id,name,nickname,review_content,rating,write_date
y_111_211,엔브릿지 호텔,황소자리구역보스,테라스도 좋고 층이 높지않지만 전체적으로 좋았어요 차도 앞인데도 그렇게 차소리로 시쓰럽지않고 직원분들도 친절하고 한옥마을도 가까워서 좋았고 그렇다고 너무 가까운게 아니라서 좋았구요 다음에도 재방문의사있습니다 테라스도 좋고 층이 높지않지만 전체적으로 좋았어요 차도 앞인데도 그렇게 차소리로 시쓰럽지않고 직원분들도 친절하고 한옥마을도 가까워서 좋았고 그렇다고 너무 가까운게 아니라서 좋았구요 다음에도 재방문의사있습니다,5,3년 전
y_111_212,엔브릿지 호텔,크림색프로게이머,"전주 한옥마을 근처에서 이만한 퀄리티에 이만한 가격의 숙소 찾기 쉽지 않을겁니다. 저 또한 아주 만족스러웠었습니다. 조식을 보기 전까지는요. 1층 할리스커피에서 먹을 수 있는 조식이 있고 호텔에서 자체적으로 제공하는 조식이 있는데 자체 조식이 퀄리티가 너무 떨어집니다. 토스트 기계하나, 시리얼 조금, 우유랑 주스 조금 갖다 놓고 따로 이용료를 받으신다니요? 그때 당시 외국인 가족들이 조식을 먹는것을 봤는데 한국사람으로서 미안하더라구요,, 근처에 먹을 곳 많습니다. 이렇게 조식 운영 하실바에는 그냥 없애시는게 호텔 이미지에 좋을 것 같습니다,,",3,5년 전
y_111_213,엔브릿지 호텔,여기어때 이용 고객,직원분들은 다 친절하십니다. 주차장이 협소한게 아쉬워요. 그리고 일단 방이 너무 더워서 창문열고 잤어요. 온도 조절이 안되는게 아쉽습니다. 또 옆방 소음과 화장실 물소리 때문에 잠을 거의 못잤어요. 청결은 좋은데 테이블과 리모컨이 너무 더러웠어요.,3,4년 전
y_111_214,엔브릿지 호텔,시원찮은생강주,체크인 하고 방 문 열었을때 자동으로 커텐 열리고 방도 예뻐요. 스파 할때 천장도 열리고 야경도 예뻐요 그리고 할리스 할인 쿠폰도 챙겨 주셔서 좋습니다! 한옥마을하고 매우 가까워서 구경가기도 좋아요,5,2년 전
y_111_215,엔브릿지 호텔,5331329,티한점없이 깨끗하고 침구도 편안했어요. 어매니티도 마음에 들고 무엇보다 조용한 실내랑 친절하신 직원분들덕분에 푹자고 잘쉬고갑니다! 전주한옥게하보다 편하고 질좋은숙박을원하신다면 엔브릿지를 추천드려용,5,5년 전
y_111_216,엔브릿지 호텔,이안마마,한옥마을을 즐기기 아주좋은 위치와 정말 깨끗한 객실 그리고 조용하고 좋은 시설이 겸비되어져 하루 기분좋게 지내다 갑니다. 안그래도 전주 놀러오는거 굉장히 좋아하는데 그때마다 이곳으로 올겁니다.,5,6년 전
y_111_217,엔브릿지 호텔,7892223,새로 생긴곳이라 그런지 깔끔했구요 . 직원분 친절도가 굉장히 높았어요. 테라스도 있어서 답답하지 않고 가격대비 만족도가 높아 다음에도 전주 호텔은 무조건 여기로 잡을거에요!,5,6년 전
y_111_218,엔브릿지 호텔,1083655,"조망도 좋았고, 욕실도 쾌적하게 꾸며져있었습니다. 다만 가족인원대비 냉장고 사이즈가 너무 적어 다소 불편했다고 할까요. 나머지는 킹왕짱 엄지척척할 수 있었습니다. ~:)",5,5년 전
y_111_219,엔브릿지 호텔,행큐,잘 사용하다가 갑니다~ 숙소도 깔끔하고 좋네요,5,3년 전
y_111_220,엔브릿지 호텔,팡맘,20대 때 좋은 기억이 남아 아이가 있어 호텔로 결정했어요. 한옥뷰라 결정했고 예전만큼 한옥마을이 많이 환하진 않았지만 그래도 잘 쉬다갑니다^^,4,2년 전
y_111_221,엔브릿지 호텔,여기어때 이용 고객,진짜 조용히 있으면 아무소리도 안 들릴 정도로 조용해요 잘 쉬다 갑니다 ⭐️,5,5년 전
y_111_222,엔브릿지 호텔,Ken87,잘쉬고 왔습니다~ 한옥마을에 걸어갈수도 있고 시설도 깨끗하고 친절했습니다. 한파 속에서도 눈맞으면서 스파도 즐겼구요. 다음에도 방문하겠습니다,5,2년 전
y_111_223,엔브릿지 호텔,6924429,깨끗하고 인테리어도예쁘고 가격값하네요,5,6년 전
y_111_224,엔브릿지 호텔,8042816,청결한 룸 상태. 친절한 직원들. 아쉬운 점은 윈도우 뷰. 그 외 앞에서 언급한 내용과 전주 곳곳을 돌아다니기에 부담없는 거리도 마음에 들었다.,5,6년 전
y_111_225,엔브릿지 호텔,샌프란아줌마,"전주 갈때마다 넘 좋아하는 곳 입니다. 시설도 깔끔하고 조용하고 꿀잠 잘수 있고, 무엇보다 라운지도 깔끔하고 세련되서 커피 마시기에도 편안하게 있기에도 너무 좋습니다. 개인적으로 좋아하는 곳은 연장해서 지내다 가는 편인데, 인기도 많고 다음날 방도 없어서 아쉬웠습니다; 다음에 전주를 또 간다면 망설임 없이 이곳을 선택 할 것입니다!",5,3년 전
y_111_226,엔브릿지 호텔,soon1225,체크인시 우선 엄청 친절하세요. 평일이어서 그런지 10분정도 일찍 체크인되었고 룸도 깨끗하고 테라스가 있어서 그런지 개방감도 있어 넓어보여요. 한옥마을가기도 가까워서 길거리 음식 사다먹기 좋았어요. 나중에 전주 방문시 또 묵어도 좋을것 같아요.,5,3년 전
y_111_227,엔브릿지 호텔,떡*****,침대 이불 모두 푹신하여 잠 잘 잤습니다 발코니와 루프탑 경치도 좋았어요~ 위치도 너무 좋습니다,5,1년 전
y_111_228,엔브릿지 호텔,아바도,전주 한옥마을 도보3분 거리인 남천교 건너에 있어서 지리적 위치는 좋아요. 1층에 할리스 있는것도 좋습니다. 한옥마을 주차 헬인데 호텔 지하에 주차장 있어서 주차걱정은 안했습니다. 다만 룸서비스가 아예 없는것과 넓은 방인데 뷰가 안좋은쪽에 배치돼 있는건 아쉬웠어요.,4,5년 전
y_111_229,엔브릿지 호텔,겨울겨울가을,시설도 깨끗하고 직원분들도 너무 친절해서 좋았어요! 야경도 예쁘고 잘 놀고 잘 쉬다 갑니다 다음에 가게 되면 또 이용하고 싶어요,5,2년 전
y_111_230,엔브릿지 호텔,여기어때고객님,편안하게 잘 있었습니다~객실도 깨끗하고 한옥마을 야경도 예뻤습니다~~다음에 전주여행을 가게되면 또 이용해야겠어요~~,5,4년 전
y_111_231,엔브릿지 호텔,now4me,신축 건물인것 같아요. 깨끗하고 인테리어도 좋고 친절했습니다. 다음에 전주 갈일 있으면 다시 이용하겠습니다. 감사합니다.,5,6년 전
y_111_232,엔브릿지 호텔,아리블리,연박으로 보내기 좋았습니다! 다만 층이 낮게 배정되어서 약간 밖을 내다보기가 망설여졌지만 테라스가 있어서 좋았구요! 또 커튼이 자동식이라 너무 좋았어요! 객실도 청결하고 대리석 바닥도 너무 좋았습니다! 다시 재방문 하고싶네요!,5,3년 전
y_111_233,엔브릿지 호텔,꼬꼬북북,할머니 모시고 다녀왔습니다. 전주 한옥마을하고 가까워서 위치가 너무 좋았습니다. 테라스에는 밤에 불도 켜져서 예뻤어요. 그런데 큰길 대로변에 있어서 자동차 소음이 조금. 있었습니다. 예민하신분은 체크하고 예매하세요^^ 1층 할리스가 있어서 커피 사 마시기도 편했습니다^^,5,2년 전
y_111_234,엔브릿지 호텔,짼근,좋아요~ 깨끗하고 친절하구 좋습니다,4,1년 전
y_111_235,엔브릿지 호텔,확정적인미군,전주 넘버1 숙소입니다. 시설 너무 깔끔하고 1층에 카페가 있어 너무 좋습니다. 주차장이 부족하지만 호텔 앞 길가에 세워도 전혀 문제없습니다.오히려 더 편하죠(다만 비가 오거나 할때는 불편할수 있습니다) 1층 직원분들 너무 친절합니다! 항상 미소로 답해주시는 직원분들 최고! 사장님! 직원분들 보너스 주셔도 될듯😆,5,4년 전
y_111_236,엔브릿지 호텔,핀란드목적,모든게 좋은 숙소인데 화장실 문이 유리라..사운드는 노래를 튼다지만 실루엣은 좀..그렇습니다,5,2년 전
y_111_237,엔브릿지 호텔,서른여섯천체관측,"너무 좋았어요. 뷰, 친절, 청결 상태 모두 완벽했습니다. 행복한 하루를 보냈어요",5,4년 전
y_111_238,엔브릿지 호텔,뚜비두밥뚜밥,청결하고 다 좋았는데 낮은 저층을 배정받아서 기대했던 뷰가 하나도 안보였어요,4,4년 전
y_111_239,엔브릿지 호텔,비인간적인비밀요원,스파가봣는데 좋네요,5,4년 전
y_111_240,엔브릿지 호텔,선댄스1,잘쉬다갑니다 감사합니다,5,2년 전
y_111_241,엔브릿지 호텔,다정한바퀴벌레,안에 시설이 너무 잘 되어있어서 쉬다 가기 너무 좋았습니다 직원분도 친절하게 해주셨고 1층에서 할리스 커피 할인 쿠폰도 주니 나갈때 쓰면 딱 좋았습니다 걸어서 전주한옥마을이랑도 가까웠고 생각보다 밖에 소리는 잘 들리지않았습니다 여기 추천해요 !!,5,3년 전
y_111_242,엔브릿지 호텔,밍구리당당,숙소 들어가자마자 커튼이 자동으로 열리는데 멋지더라고요 2층이여서 나무에 살짝 가려져 다리가 조금만 보이긴했지만 너무 이뻤어요! 객실도 깨끗하고 서비스도 좋았습니다,5,1년 전
y_111_243,엔브릿지 호텔,9063629,직원분들이 정말 친절하시고 위치 또한 너무 좋아요 다음에도 이용할께요,5,6년 전
y_111_244,엔브릿지 호텔,gjdud1111,시설 깨끗하고 좋았습니다 침대도 확실히 편안하네요,5,6년 전
y_111_245,엔브릿지 호텔,맘껏누리자,직원분들 친절하시고 전주쪽에서는 한옥마을가기도 편하고 시장가기도 편하고 전동성당도 걸어서 갈만하고 위치나 시설 모두 만족합니다.,5,3년 전
y_111_246,엔브릿지 호텔,착한보쌈,프론트직원분께서 너무 친절하게 잘 안내해주셨어요 그리고 커튼이 자동버튼이 있는데 고장났는지 손으로 열고닫아야했고 스파룸 기준 창문 사이에 고무바킹이 떨어져있었던 것 제외하고는 시설도 너무 좋았어요. 산 근처라 그런지 밤에는 모기가 정말 많아요.. 밤에 모기 10방은 넘게 물렸어요. 창문도 다 닫고 있었는데 어떻게 모기가 들어왔는지는 모르겠어요. 그래도 그거 외에 친절하고 즐거운 여행이었어요 아래 호텔과는 별개로 할리스커피 있어서 편리한데 거긴 한 직원은 친절한데 다른 친절은 인상쓰고 불친절함...,5,1년 전
y_111_247,엔브릿지 호텔,쑝5832,깨끗하고 위치 좋고 청소상태 너무좋았어요,5,4년 전
y_111_248,엔브릿지 호텔,7362249,한옥마을이랑 가까워서 좋았어요 방은 2층을 주셔서 한옥마을은 보이지 않구 일부러 돈 더주구 큰방했는데 장기 투숙객만 좋은 뷰로 준다하시구 가격 더 낮은 방두 같은층이라 굳이 비싼방 안해두될듯,5,5년 전
y_111_249,엔브릿지 호텔,실미도하마,"업무차 방문했습니다. 샌드위치 프로모션도 만족했어요. 룸컨디션 좋고, 창밖 전경이 참 예뻐서 사진 많이 담았습니다. 다음에 또 방문할게요. 감사합니다",4,2년 전
y_111_250,엔브릿지 호텔,대내외적인도의원,위치도 좋고 깔끔하고 아주 만족합니다,5,1년 전
y_111_251,엔브릿지 호텔,월내요원,이용 잘하고 갑니다 감사합니다,5,1년 전
y_111_252,엔브릿지 호텔,hansyoon,한옥마을 바로 앞이라서 좋았음,4,1년 전
y_111_253,엔브릿지 호텔,구들구들한모자,"시설, 청결, 위치 모든게 좋았습니다",5,2년 전
y_111_254,엔브릿지 호텔,진쪼깅,와 진짜 전주 모든 호텔 가본거같은데 여기가 제일좋은거같아요. 프론트직원분도 너무 친절하시고 엘리베이터앞까지 안내해주실줄은 몰랐어요 ㅠ시설도 엄청 깨끗하고 정말 잘 쉬었습니다,5,3년 전
y_111_255,엔브릿지 호텔,머루4,시설도 깨끗하구 청소상태도 좋아요. 다른 리뷰에서도 다들 언급하듯 테라스에서 보는 경치도 좋구요. 단점은 주차장이 너무 좁아서 주차하기가 힘들구요. 하수구 구조상 그런건지 샤워실에서 계속 소리가 나서 자는데 너무 방해되더라구요. 다른 방과 하수구가 다 연결되서 그런건지 다음날이 휴일 아니구 평일이었으면 잠도 못자구 큰일날뻔 했네요. 내가 잔 방만 그런건지 ㅠ,4,3년 전
y_111_256,엔브릿지 호텔,9651839,우선 지리적으로 너무좋고 깨끗하고 좋았습니다 :) 혹시 전주에가게되면 꼭 다시 가고싶어요 :)♡,5,4년 전
y_111_257,엔브릿지 호텔,미니미니짱짱,시설깨끗하고 서비스도 친절해서 좋앗어요. 한옥마을하고도가깝고~~담에. 전주오믄 또 묵을게요!!,5,3년 전
y_111_258,엔브릿지 호텔,이리혜디야,아기랑 왔는데 객실 깨끗하고 제공해주는 샌드위치 맛나용,5,2년 전
y_111_259,엔브릿지 호텔,j*****,숙소 뷰가 아주 좋았어요. 체크인 시간보다 조금 일찍 도착해서 기다려야하는가 걱정했는데 남는 방으로 주셨어요.,4,2년 전
y_111_260,엔브릿지 호텔,9562608,전주 한옥마을 바로 앞에 위치하고 있어 도보로 한옥 마을 둘러보기엔 딱 좋은 위치이고 시설도 좋네요. 남부 시장 옆이라 먹거리가 많아요.,4,6년 전
y_111_261,엔브릿지 호텔,순창장본가전통식품,불친절한 것 빼고는 좋아요,5,5년 전
y_111_262,엔브릿지 호텔,불편한갑오징어,넘 좋았어요 시장이랑도 가깝고 바로옆에 편의점 카페 등 최고였어요 시설도 너무 깔끔하고 깨끗했어요 다음에 전주가면 또 방문할게요,5,5년 전
y_111_263,엔브릿지 호텔,코임브라행열차,한옥마을과 가까워 위치도 좋고 객실 상태도 아주아주 깨끗했습니다 저녁에 비가 와 숙소로 일찍 들어왔는데 너무 만족스러웠습니다,5,5년 전
y_111_264,엔브릿지 호텔,또기뚜니,깨끗하고 친절하고 시설도 최신식이라 좋네요. 근데 방에 콘센트가 안되는게 많네요,4,6년 전
y_111_265,엔브릿지 호텔,고불고불한귀환병,전주에 가게될땐 다시 이곳을 이용할 것 같아요! 깨끗하고 친절하시고 정말 좋은 경험이었습니다. 감사합니다,5,5년 전
y_111_266,엔브릿지 호텔,9504459,방충망이 뜯어져있는 줄모르고 창문을 열고 잤는데 다행히 벌레는 없었어요ㅋㅋㅋ그래도 깔끔하고 좋아요,5,4년 전
y_111_267,엔브릿지 호텔,just7,"직원분들도 친절하고, 한옥마을이 바로 앞이라 위치 좋습니다.",4,1년 전
y_111_268,엔브릿지 호텔,저돌적인휴대식량,"혼자 전주가면서 다양한 호텔 알아봤는데 굉장히 좋다라기 보다는 깔끔하고 정갈한 호텔입니다. 위치가 참 좋구요, 앞에 전경이 너무 예쁘네요. 서비스도 친절하시고 무엇보다 잠을 푹 자서 너무 좋았습니다. 재방문 의사 있습니다!",4,3년 전
y_111_269,엔브릿지 호텔,이지붓스트,"시설 엄청깨끗하고 1층에 카페가있어서 편합니다! 안내데스크 직원분도 정말친절하시고, 최곱니다",5,5년 전
y_111_270,엔브릿지 호텔,16723736,"좋은 숙소였습니다. 한옥마을과도 거리가 가까웠으며 하천을 끼고 있어 뷰가 좋습니다. 온돌방(한실)을 사용했는데 시설이 잘 이루어져있어 기분 좋게 사용했습니다. 아침 샌드위치가 포함된 객실로 예약했는데 코로나 시국에 조식보다 훨씬 안전하고, 맛도 좋았습니다. 다만, 음식을 먹을만한 상이 없어 바닥에서 먹어야 했습니다 ㅠ 온돌방에도 다른 객실처럼 테이블(or 상)을 놓아주세요 !!🙂 다음에 또 갈게요 !",5,3년 전
y_111_271,엔브릿지 호텔,수리산도립공원군의관,"시설은 좋은데, 객실 곳곳에 잔고장이 많아서 수선이 필요한 정도(약간의 불편함을 감수할 수 있는 정도), 주차공간이 매우 협소하여 갓길에 주차하라는 안내도 어이없네요(제휴주차장도 없나요, 단속 되면 과태료 대신 내줄 것도 아니고)",2,3년 전
y_111_272,엔브릿지 호텔,샌프란아줌마,전주 갈때마다 여전히 좋아요. 조용하고 쾌적하고 무엇보다 카페랑 연결이 된 라운지가 참 좋습니다. 리셉션 분들도 친절하세요. ㅎㅎ 나중에 또 전주 가게 되면 꼭 가야 할 곳은 분명 합니다! 전주에서 몇 안되는 괜찮은 호텔 입니다!,5,2년 전
y_111_273,엔브릿지 호텔,진주성케이크,시설 : 1층에 커피숍있고 들가자마자 좋은냄새 폴폴 방: 깔끔하고 좋음,5,6년 전
y_111_274,엔브릿지 호텔,로로롤롤로,시설 깔끔하구 기분좋게 사용 하엿습니다 재방문 의사 잇습니다!,5,5년 전
y_111_275,엔브릿지 호텔,융밤이,샤워하면 물이 다 밖으로 새어나가서 바닥이 엄청 미끄러워지니 조심하셔야 될 것 같아요ㅠ 그 외에 전반적으로 깨끗하고 좋았습니다! 체크아웃 하고 짐도 맡겨주셔서 덕분에 편하게 돌아다녔네요~~감사합니다 다음에 또 갈게요 😄,5,1년 전
y_111_276,엔브릿지 호텔,o레몬,위치가 정말 좋았어요 한옥마을 바로 앞이라 놀다가 피곤하면 잠시 쉬었다가 다시 나가서 놀았어요 직원분들도 친절하시고 방도 깨끗했습니다,5,3년 전
y_111_277,엔브릿지 호텔,인스피레이션,우선 직원들이 친절해서 좋았고 방도 위치도 너무 좋았어요~~,5,4년 전
y_111_278,엔브릿지 호텔,상당한강정,친절하고 위치도 너무 좋았어요!,4,6년 전
y_111_279,엔브릿지 호텔,요르단뉴게이트,침구류도 깨끗하고 시설도 깨끗해서 연박으로 잘 쉬고갑니다~,5,4년 전
y_111_280,엔브릿지 호텔,한산대첩기념비외투,시설도 우수하고 한옥마을 접근성이 너무 쫗았습니다.,5,6년 전
y_111_281,엔브릿지 호텔,나혼자사니,너무잘이용했습니다' 깨끗하고 시설도 좋고 친절해요,5,2년 전
y_111_282,엔브릿지 호텔,시콩이럭키,따뜻했어요 엄청 건조할 정도로 테라스 룸이라 다행히 문여니깐 시원했고 3층 이엇는데 뷰도 나쁘지 않앗어요 방음도 잘되엇는데 문이 확확 열려서 쾅소리가 좀 불편했어요 아침되니깐 지나가는 차소리가 좀 드리더라고요 얼음 서비스도 달라해서 시원하게 맥주도 마시고 룸서비스도 가능하고 1층 다이닝교도 맛도 좋고 산토리 맥주가 너무 비쌋지만 맛잇엇어요 주차장도 넓은 편이고한옥마을도 가깝고 만족햇어요 할리스 커피숍이 로비에잇어서 커피향도 좋고 호텔 내부에 들어오면 굉장히 좋은 향이 기블좋게해줘요,5,1년 전
y_111_283,엔브릿지 호텔,설렌딩,깨끗하고 침구도 편하고 좋았습니다. 무엇보다 직원들분이 너무 친절하셔서 기분좋게 지내다 올 수 있었습니다. 다음에도 방문하고 싶은 의사가 있고 지인들께 추천하고 싶은 숙소였습니다,5,3년 전
y_111_284,엔브릿지 호텔,건전건전지,위치도 정말좋고 서비스도 정말좋아요ㅎㅎ,5,2년 전
y_111_285,엔브릿지 호텔,피곤이풀려,전주 최고의 위치! 그러나 저층배정! 많이 아쉬웠내요 도로 근접해서 시끄럽고 밖어서 다보이고,5,3년 전
y_111_286,엔브릿지 호텔,우스운장소,스파 이용했는데 엄청 크고 좋아요,5,6년 전
y_111_287,엔브릿지 호텔,제라드입니다,진짜 좋아요 시설 그리고 방음도 좋구요 룸서비스 가성비 좋네요 다음에도 또 올게요 ㅎ,5,1년 전
y_111_288,엔브릿지 호텔,아리아리승아리,부모님모시고2박3일 전주여행와서 엔브릿지호텔 너무만족하고가요 저희세식구 트리플룸 썻는데 청결하고 편하게 연박하고왔어요 소음도없구 진짜조용하구 차길만건너믄 한옥마을가는길이라 걷기도좋고 계천공원도있어서 산책로도 환상적이였어요 숙소는만족 직원분도친절 잘쉬다갑니다,5,1년 전
y_111_289,엔브릿지 호텔,p계란이,일단 호텔이라해서 갔는데 그냥 깨끗한 모텔정도 입니다 난방도 중앙난방이라 룸에서 조절할수가 없고 온도를 올려달라 내려달라 전화를해야합니다 온수도 뜨거웠다 줄이면 차갑고 또 조금 올리면 넘 뜨겁고 샤워를 하는동안 몇번을 이쪽저쪽을 돌렸는지 짜증이 날 정도였습니다 커튼도 자동이라 완전히 치던지 걷어버리던지 원하는만큼 열고 닫고를 할수가 없어요 2층인데 활짝 열수도 없고 계속 어둡게 닫아 놓으니 답답했습니다 왜 여기가 이정도 금액인지 이해가 안갑니다 만족도 꽝입니다,3,5년 전
y_111_290,엔브릿지 호텔,여행재벌,한옥마을이 가까워서 구한 숙소였지만 너무 만족했어요~~^^ 침구도 너무 편해서 좋았구요~전주 올일 있다면 무조건 여기로 오려구요,5,2년 전
y_111_291,엔브릿지 호텔,기매져,전주한옥마을과 가까워서 편했어요! 숙소에서 한옥마을쪽이 바로 보이고 뷰도 좋네요!! 내부도 깔끔하고 들어가자마자 전동커텐이 자동으로 열려서 기분 좋았어요ㅋㅋ,3,2년 전
y_111_292,엔브릿지 호텔,동도도동,깨끗하고 스파도 좋았어요,3,3년 전
y_111_293,엔브릿지 호텔,사나운로버트,너무너무 만족합니다. 깨끗하고 한옥마을 가깝습니다,5,2년 전
y_111_294,엔브릿지 호텔,479997,너무만족합니다. 객실미니바도 있어서 굳굳 너무만족합니다. 객실미니바도 있어서 굳굳 너무만족합니다. 객실미니바도 있어서 굳굳 너무만족합니다. 객실미니바도 있어서 굳굳 너무만족합니다. 객실미니바도 있어서 굳굳,5,4년 전
y_111_295,엔브릿지 호텔,뚜루루루루루oo,너무 깨끗하고 침구 또한 흠잡을데없이 좋았습니다. 침구에 예민한데 저는 만족했습니다 ◡̈,5,6년 전
y_111_296,엔브릿지 호텔,3425726,한옥마을 근처에 있어서 접근성 우수하며 호텔 룸컨디션 및 기타 시설도 좋다. 다만 가성비는... 중간정도 인것 같다.,3,6년 전
y_111_297,엔브릿지 호텔,maskz,가성비 좋았던 곳이에요 ㅎㅎ 객실 기대안했는데 깔끔했고 샌드위치도 생각보다 괜찮게나왔어요,4,4년 전
y_111_298,엔브릿지 호텔,삼월이일,엔브릿지는 이번이 5번째 이용인데 2층 테라스 뷰는 정말 형편없네요ㅠㅠ 아쉬워요.,4,4년 전
y_111_299,엔브릿지 호텔,굿굿83,한옥마을이랑 거리도 너무 좋고 깨끗하네요,4,1년 전
y_111_300,엔브릿지 호텔,울긋불긋한마스터,만족 만족 너무 좋았어요 다음에 전주갈일있으면 또 갈거에요 스파룸 최고입니다,5,6년 전
y_111_301,엔브릿지 호텔,정인쥬니,넘나 깨끗하고 직원분들도 친절하셔서 인상에 남습니다. 또 오고 싶네요.,5,6년 전
y_111_302,엔브릿지 호텔,1757354,전주 한옥마을이 보이는 뷰와 깔끔한 환경 아주 좋아요~ 만족합니다~,5,6년 전
y_111_303,엔브릿지 호텔,단비23,부모님이 묵었는데 아주 만족해하셨어요 ㅎㅎ 연박하고싶었지만 방이 없을 정도로 인기가 많나봐요 ㅎㅎ,5,1년 전
y_111_304,엔브릿지 호텔,감색장미,신축건물인지 깨끝하고 한옥마을이 바로 길건너라 좋았습니다,5,6년 전
y_111_305,엔브릿지 호텔,멕시코시티맹꽁이,뷰가 너무 예쁘고 커텐 너무 신기해요. 깔끔하고 좋았어요,5,4년 전
y_111_306,엔브릿지 호텔,예사로운간호원,아이와 함께 가서 한실룸을 이용했어요 두번째 가는건데 좋아요!,5,1년 전
y_111_307,엔브릿지 호텔,2547509,친절하고 깨끗하고 좋았습니다,4,5년 전
y_111_308,엔브릿지 호텔,라떼냠,깔끔하고 넓어요~ 인포 직원분들도 친절하십니다 만족!,5,2년 전
y_111_309,엔브릿지 호텔,11369637,주차장표시가없어서 아쉽지만 전체적으로 깔끔하니 좋아요,5,5년 전
y_111_310,엔브릿지 호텔,6766393,처음 이용하는데 시설아 참깔끔하고 좋았어요 ㅎㅎ,5,5년 전
y_111_311,엔브릿지 호텔,순창장본가전통식품,깨끗하고 친절하고 깔끔해서 좋았어요,5,5년 전
y_111_312,엔브릿지 호텔,Dowhatyoulike,한옥마을 근처에 있어서 좋았어요,4,3년 전
y_111_313,엔브릿지 호텔,스패니쉬,너무 친절하게 해주셔서 좋았습니다,5,6년 전
y_111_314,엔브릿지 호텔,부꼬,깔끔하고 분위기도 좋았습니다~,5,5년 전
y_111_315,엔브릿지 호텔,6566408,좋아요 다음에도 이용하려구요,5,6년 전
y_111_316,엔브릿지 호텔,완전한고집불통,너무좋고깨끗해요 추천,5,4년 전
y_111_317,엔브릿지 호텔,날아라노랑병아리,좋아요 또 이용할께요,4,2년 전
y_111_318,엔브릿지 호텔,몽타쥬,주차 빼고 다 좋았습니다. 무엇보다 침구 너무 편했어요,5,2년 전
y_111_319,엔브릿지 호텔,맑고창의적인바게트빵,급하게 잡은 호텔이어서 혹시나 걱정을 많이 했는데 오히려 너무 좋았어요~ 방도 따뜻하고~ 특히나 침구가 편해서 맘에 들었습니다. 덕분에 즐거운 여행이 되었네요!,5,1년 전
