id,name,nickname,review_content,rating,write_date
y_111_111,엔브릿지 호텔,hyunbird,"기대를 그렇게까지 크게 하지 않고 신축 호텔이라서 그냥 예약 해 보았어요. 근데 방도 정말 크고, 화장실 그리고 바닥 등등이 정말 마음에 쏙 들었어요. 탁월한 선택이었다고 생각해요. 물론 평일이라 그럴 수도 있지만 호텔도 너무 조용하고 좋았어요. 리셉션데스크 직원분도 친절해서 더 좋았어요. 계속 이용할 의사 100% 있고요, 꼭 다시 오고 싶습니다. 대만족 !!!",5,2년 전
y_111_112,엔브릿지 호텔,자동적인못,야경이 멋져요 테라스룸을 추천합니다 한옥마을과 멀지않고 산책하는 재미도 있고 편의점도 가깝게 있어요. 1층 로비 카페 10%할인쿠폰으로 커피+케이크 드셔도 좋을거 같고 큰욕조는 아니나 1인 욕조로 깊고 아늑해서 반신욕하기도 좋았습니다. 춥지않고 온도도 좋구요,5,3년 전
y_111_113,엔브릿지 호텔,지희꽃,전주가시댁이라매년몇번씩이용하는엔브릿지호텔입니다! 남편이랑둘이오다가올해는아가랑셋이와서좀더큰룸으로예약했어요~ 침대도크고 배개도 높낮이다른종류로있어서 좋아요! 다만아가씻기기엔화장실이대리석이고세면대도각져있어서 불안했어요::) 그리고 날파리들이 ㄷㄷ 그래도전체적으로전주주변다른호텔들보다낫기때문에엔브릿지만이용합니다~ 아 체크인은세시였던거같은데 네시로바뀐거같네용 크게상관은없지만^^,4,2년 전
y_111_114,엔브릿지 호텔,절제된우아함,직원분들 친절했습니다 객실도 마음에들었습니다,5,3년 전
y_111_115,엔브릿지 호텔,방콕개복치,벌써 4번째 방문입니다 한옥마을에서 맛난거 사와다 먹으면서 혼자 쉬기 좋아요 근데 올때마다 느끼는건데 침대랑 침구가 묘하게 불편하네요..^^;;,4,3년 전
y_111_116,엔브릿지 호텔,애매한소용돌이,처음에 외관 딱봤을때는 호텔 치고는 층수가 낮아서 오잉?하긴 했습니다 ㅎㅎ 보통 호텔은 좀 크잖아요ㅠ 그래도! 숙소내부 청결은 아주 좋았고요 ㅎㅎ 아침에 온 조식도 맛있었습니다! 다만 조금아쉬운 점은 뷰가 정말 별로예요 ^^ 그리고 방충망을 닫아놔도 옆에 틈자체가 살짝 있어서 모기들어올까봐 걱정됐어요ㅠ 칫솔은 4인 가족에 맞게 4개나 준비되어 있어서 그점 맘에 들었네요~~~,4,3년 전
y_111_117,엔브릿지 호텔,라니도니파파,깨끗하고 좋아요 드라이기는 약해서 따로 준비하시는게 나을것 같구요 주차장은 주차면수가 적은데 근처에 갓길이나 감자탕집에 호텔용 지정석이있어서 크게불편함은 없어요,5,1년 전
y_111_118,엔브릿지 호텔,소주병와인,"너무 잘 이용하고 왔습니다. 반신반의하고 갔었는데. 방도넓고, 깨끗하고, 한옥마을과 너무 가까워서 좋네요~~야경도 좋았습니다~~~너무 잘 이용하고 왔습니다. 반신반의하고 갔었는데. 방도넓고, 깨끗하고, 한옥마을과 너무 가까워서 좋네요~~야경도 좋았습니다~~~너무 잘 이용하고 왔습니다. 반신반의하고 갔었는데. 방도넓고, 깨끗하고, 한옥마을과 너무 가까워서 좋네요~~야경도 좋았습니다~~~너무 잘 이용하고 왔습니다. 반신반의하고 갔었는데. 방도넓고, 깨끗하고, 한옥마을과 너무 가까워서 좋네요~~야경도 좋았습니다~~~",5,4년 전
y_111_119,엔브릿지 호텔,시원시원한바다가재,한옥마을과 가까이 위치해 있어 1박2일동안 편하게 숙소 들렸다 관광 할 수있었어요 일층 로비를 할리스랑 같이 관리되어 그런가 시설도 아주 깔끔하고 직원분들도 모두 친절했습니다 내부시설 역시 모자람 없이 편하게 좋은 시간 보내고 왔어요 적당한 가격대로 깔끔하고 위치 좋은 숙소에서 묵은거 같아 좋습니다 ~ 다음에 전주 가는날이 있음 또 같은 엔브릿지에서 숙박하고싶네요 ^^,5,4년 전
y_111_120,엔브릿지 호텔,ksh0327,아이와 함께한 여행이였는데요. 호텔이 조용하고 시설도 깨끗하고 직원분들도 친절하시고 한옥마을도 너무가까워서 정말 좋았어요. 다음에 전주오게된다면 다시 이용하고싶네요^^ 할인쿠폰도 주셔서 1층 할리스 커피도 아침에 잘 먹었습니다~,5,1년 전
y_111_121,엔브릿지 호텔,까망키,처음 간 전주 여행이었는데 숙소 자체로는 마음에 들었어요 앞에 풍경도 좋고 시설도 좋고 직원분들도 친절했어요 조심도 먹을만했어요 전주 가서 사람들의 불친절에 화가 났지만 숙소에서는 힐링했어요 감사합니다 추천합니다 욕조도 있고 앞에 거울에 불빛도 예쁘고 들어와서 좋았어요 엄청 따뜻하게 겨울 여행을 마치고 부산으로 돌아왔어요 숙소로만 따지면 다시 가고싶은 숙소입니다 한옥마을이랑 가까워서 더 좋아요 조식은 살짝 아쉬웠어요 그래도 먹을만해요,5,3년 전
y_111_122,엔브릿지 호텔,미코딱지,"프론트, 복도, 화장실까지 뭐하나 빼놓을 수 없는 완벽한 숙소였습니다. 앞에 바로 천이있어 시티뷰도 굉장히 좋구요, 우선 화장실 시설이 정말 압도적으로 클린하고 깨끗하며 고급스럽습니다. 직원분들 서비스도 정말 좋아요.",5,1년 전
y_111_123,엔브릿지 호텔,몽실몽실한가죽,우선 전주여행을 계획없이 갑자기 갔던터라 숙소를 당일에 예약했는데 침대룸은 솔드아웃이라 어쩔수 없이 한실로 예약했는데 기대 이상으로 좋았어요~ 주차장도 조금 좁다고 들었는데 늦게 밤 11시넘어 체크인 했음에도 불구하고 너무나도 친절하고 반갑게 맞이해 주셔서 너무 감사했습니다 주차공간이 없었는데 잘 도와주셔서 안전하게 주차까지 완료했고 저희 객실이 미니바패키지룸 이였던것 같은데 그래서 그런지 체크인 하면서 먹을거 주셔서 뭔가 선물 받는 느낌이였어요 ㅎㅎ 가성비 훌륭한 호텔입니다~!!,5,4년 전
y_111_124,엔브릿지 호텔,용인어흥이,음 깨끗하고 깔끔한 느낌 주변 동네 모텔보다 낫네요 단 면도기등이 비치되어 있지 않아서.. 흠 조금 불편햇어요 그외에 깨끗하게 정돈된 객실과 청소상태 등은 너무 마음에 들었습니다. 늦은밤에 찾아갔는데도 친절히 응대해주신 매니저님이나 단.. 어제 입구쪽에서 술취한 분들 목소리가 바로 들려오던... 방음은 좀 모르겠네요 그리고 밤에 좀 더워서 에어콘 조금 켤려구 했는데.. 작동이 안되는.. 대신 넷플릭스나 침구 상태 넘 좋았습니다,5,3년 전
y_111_125,엔브릿지 호텔,날라리여우,"전주 한옥마을 안에있어서 위치가 아주 좋습니다 짐풀고 관광지를 구경하기 좋아요. 깔끔하고 직원분들도 다 친절하십니다. 스파를 하면서 하늘을 볼수있는점이 가장 좋았습니다. 스파할때 샤용할수 있는 입욕제는 챙겨주십니다. 조식서비스를 이용했는데, 따로 이동하지 않아도 방안에서 먹을수있는점이 마음에들었습니다. 혹시 얼음이 필요하시다면 1층 할리스커피에서 제공된다고 하니 참고하세요.",5,3년 전
y_111_126,엔브릿지 호텔,선명한아이리스,호텔이 매우 깔끔하고 좋았습니다. 평일이용 주차도 괜찮았구요 호텔 자체 분위기도 좋습니다 그리고 호텔내부에 향이 나는데 처음엔 좋다가 너무 많이 나서 숨쉬기 조금 힘들긴했어요 그래도 인테리어나 객실 내 깔끔히 정돈된 느낌이라 편히 머물다 갑니다 전주와서 묵을 만 한 숙소라고 생각해요 한옥은 힘들어서 편한곳 깔끔한곳 찾다가 평이 좋아서 오게되었는데 잘 이용하고 갑니다~ 앞은 청연루 다리가 있는데 야경이 예뻤슴당,5,1년 전
y_111_127,엔브릿지 호텔,읁자,1박2일 여행차 왔는데 잘쉬다가요~! 로비향 좋다는리뷰 봣는데 프리지아향이 객실복도까지나서 넘 좋앗어요!침구에 머리카락이랑 얼룩이 좀 있엇지만 룸 컨디션은 괜찬앗어요 글구 고층이라는말에 예약햇는데 5층이라 고층느낌은 없엇던게 아쉬워요!,4,2년 전
y_111_128,엔브릿지 호텔,15773916,남친이랑같이 한옥마을에 가게되어서 숙소를 찾아보던중 리뷰가좋아 예약했습니다.. 한옥마을 안에있는건 아니지만 걸어서 얼마안걸리는 거리라 가까워 좋았습니다.. 사진으로봤던것보다 방도크고 깨끗하니 컨디션도좋았고 도로에 위치하고있어도 창문닫으니 크게 시끄럽지도 않았습니다..2층에배정되었지한 앞이 트여있어서 까깝하지도알구여.. 카운터에서 일하시는 직원분 엄청 친절해요.. 다만 호텔크기에비해 주차장이 너무작아요..체그인전 문자로 숙박손님이 많아 주차장 자리가없을수도있으니 호텔갓길에주차해도 된다며 주차단속하지 않는다고 보내주셨는데..아무리 주차단속을 하지않는다해도 갓길에 주차하라는건 좀그렇네요 건물주차장이 협소하면 다른방안을 준비하셔야하지않을까하네요..그리고 샌드위치도같이 주문했는데..요금을 조금더 받더라도 괜찮은음식 제공을 했음합니다 빵도 반쪽짜리고 야채도 별루 싱싱하지않아서 만원밖에 안되지만 사실 그것도 아까웠어요.. 만약담에 다시가게된다면 이호텔에 다시 묵을생각은 있지만 샌드위치는 주문안할꺼같아아요.. 암튼 숙박은 잘하고갑니다,4,3년 전
y_111_129,엔브릿지 호텔,8759703,"위치,청결,서비스 모두 만족했어요. 한옥마을 바로 앞이여서 걸어서 남부시장,한옥마을 관광 편하게 했네요. 야외스파객실 너무 좋았습니다. 천장열고 닫히는 어닝? 있어 밤하늘 보며 프라이빗하게 스파 즐길 수 있었구요.호텔 조식도 만원도 안했는데 맛있었구요 할리스 커피까지 세트여서 커피는 테이크아웃해서 마셨어요. 무엇보다 할리스가 24시간 운영되고 있어서 안심도 되고 있어서 밤늦게 케잌이랑 음료사먹기 좋았습니다. 트리도 너무 예뻐서 사진도 잘 나오고.. 스파객실이여서 그랬는지 바디드리이기도 따로 구비되어 있었습니다. 바닥난방이여서 건조하지 않아 좋았습니다. 다음 전주여행시 호텔 선택은 당연히 엔브릿지 호텔입니다.",5,6년 전
y_111_130,엔브릿지 호텔,까칠이,"1. 가족여행 보단 연인끼리 가는게 더 좋을것 같은 숙소 입니다. 2. 새로 지어진 건물이라 시설은 전부다 새거 이고, 깔끔해서 좋습니다. 청소도 잘 해서 객실 컨디션도 좋아요. 3. 뷰가 정말 너무 좋았습니다. 그리고, 화장실 샤워실 세면대가 분리가 되어 있고 바닥부터 천장까지 막혀있어서 좋았습니다. 그리고, 1층에 할리스 커피가 있어서 좋았는데, 투숙객에게 10% 할인 쿠폰까지 제공해주셔서 좋았습니다. 그리고, 직원분들 친절하십니다~ 아쉬운점은 주차공간이 협소하다는점... 이부분은 문자로 자세히 안내를 해주시지만, 조금 당황스럽긴 했습니다. 4. 재방문 의사 있습니다. 잘 놀다가 갑니다~~",5,2년 전
y_111_131,엔브릿지 호텔,방콕개복치,벌써3번째 방문인데 역시 여기만한 뷰가 없는것 같네요 ㅎㅎ 이번엔 5층을 배정받았는데 뷰가 넘나 예뻐요,4,3년 전
y_111_132,엔브릿지 호텔,선풍적인바보,"전주 한옥마을 근처에서 놀기위해 예약했던 호텔이었습니다. 한옥마을 뿐 아니라 객리단길도 가까워서 위치가 좋았고, 특히 밤에 한옥뷰가 너무 마음에 들었습니다. 직원분들도 친절하게 응대해주셔서 너무 좋았고 1층에 할리스와 할인쿠폰도 유용했습니다. 샌드위치 포함 패키지를 선택하여 아침에 준비해주신 샌드위치도 맛있었습니다! 다음번에도 전주에서 머물일이 있다면 또 이 곳을 선택할 것 같습니다 :)",5,2년 전
y_111_133,엔브릿지 호텔,자유분방한참다랑어,전주 처음여행으로 고민하다가 골랐는데 괜찮았어요 직원분들 친절하시고 룸상태도 괜찮았어요 한옥마을이 가까워서 좋았고 1층에 할리스카페가 같이있는데 10%할인권도 줘서 좋았어요 편의점도 근처에 있어서 이용하기 편했습니다. 한옥마을 놀러갈때 예약하면 좋을것 같네요 체크아웃할때 모르고 놓고간 물건이 있어서 연락했는데 잘 찾아주셨어요 다음에 한옥마을 갈일있으면 다시와야겠어요,5,2년 전
y_111_134,엔브릿지 호텔,돔스파이크,다음에 전주오면 또 여기 예약할 듯! 깨끗하고 넓어서 좋았습니다. 신발 신고 들어가는 방이 아니라서 너무 편했고 화장실도 잘 분리되어 있고 청소 상태도 좋았어요. 여자친구도 아주 만족해했습니다! 1층에는 할리스커피가 있어요. 체크인 할 때 10퍼센트 할인쿠폰 주는 데 그거 써서 할인 받아서 이용하시길! 한옥마을이랑도 가까워서 저 같은 뚜벅이에게는 정말 좋은 호텔이 아닌가 싶어요~,5,3년 전
y_111_135,엔브릿지 호텔,흥취,출장 차 리뷰보고 예약~오우 테라스가 있네요 시설도 좋고 청결도 깨끗합니다 길가라 차다니는 소음이 있는것빼곤 예민하신분은 패스 일단 뷰가 너무도 좋아요~왠지 내일 행운이 있을것만 같은~^^ 담에 또다시 오고픈 엔브릿지 믿고 예약하세요,4,3년 전
y_111_136,엔브릿지 호텔,쵸코아빠2,전주한옥마을 놀러왔다가 당일 예약했는데 방문하니 프론트 여직원분이 너무 친절히 상담해주시고 안내해주셔서 편하게 하루 저녁보낼것같네요 이호텔 방문해서 가장 인상적이었던건 호텔보단 너무 친절하게 맑고 예쁜 목소리로 상담해주신 프론트 여직원분이네요 모든 호텔 직원분들이 친절하지만 이분은 형식적인 친절함이아닌 진심이 느껴지는 친절함이네요 다음에 전주한옥마을 놀러오면 다시 방문하고싶은 호텔이네요,5,2년 전
y_111_137,엔브릿지 호텔,흥미로운해,객실도 깨끗하고 좁지도 않고 테라스도 조금 있어서 답답하지 않았구요 한옥마을도 가까워서 다니기 좋았습니다~~ 샌드위치랑 샐러드도 맛있었어용!!!로비도 넓고 쇼파도 좋았습니다 잘놀았어용 다음에 전주에 간다면 다시 묵고싶습니다~~ 굿굿~~~~~객실도 깨끗하고 좁지도 않고 테라스도 조금 있어서 답답하지 않았구요 한옥마을도 가까워서 다니기 좋았습니다~~ 샌드위치랑 샐러드도 맛있었어용!!! 잘놀았어용 다음에 전주에 간다면 다시 묵고싶습니다~~,5,3년 전
y_111_138,엔브릿지 호텔,보헤미안재키,잘 묵다갑니다 전주여행와서 친절한 서비스 만족합니다. 스파도 좋았어요. 잘 묵다갑니다 전주여행와서 친절한 서비스 만족합니다. 스파도 좋았어요. 잘 묵다갑니다 전주여행와서 친절한 서비스 만족합니다. 스파도 좋았어요.,5,2년 전
y_111_139,엔브릿지 호텔,비밀이지영,전경도 좋고 한옥마을에서 가까워 전주 여행하기에 적합합니다👍 다만 자다보니 침대 이불이 두 개로 나눠지더군요 ㅎㅎ 이 점은 그저 조금 아쉬운 부분이라 재방문의사 100%입니다! 잘 쉬다 갑니다!,5,3년 전
y_111_140,엔브릿지 호텔,곤란한고집불통,정말 마음에 드는 숙소였어요 한옥마을과 가까워서 위치도 좋아오 도보로 이동 가능합니닿ㅎㅎ 그리고 숙소 깔끔해요~ 직원분도 친절하셨구요 ㅎㅎㅎㅎ 다음에 다시 가고싶은 숙소에요 전주에서도 이런 호텔을 갈 수 있다는게 너무 좋네요 ! 무료 업그레이드도 받을 수 있어서 좋았어요 샤워하는 곳이 조금 좁았던 것 말고는 불편한 점도 없었어요 편하게 묵다갑니다!! 또 올게요,5,3년 전
y_111_141,엔브릿지 호텔,이카루스119,"현충일에 부모님과 익산, 전주, 완주 여행 시 숙박하였는데 침구랑 청결상태가 너무 깨끗해서 매우 만족합니다. 윗 객실의 아이가 너무 뛰어다녀 카운터에 문의드렸더니 바로 해경해 주시더라구요. 다만 욕실의 바닥이 대리석이라 미끄러운것은 조심하셔야 할 것 같습니다. 정말 층간소음은 기본 에티켓인데 무시하시눈 분들이 너무 많은것 같습니다. 부모님이 또 오고 싶으시다고 하시네요. 수고하십시요..",5,2년 전
y_111_142,엔브릿지 호텔,후진왕김전진,날씨가 추워서 스파는 야외라 조금춥습니다. 객실은 깔끔합니다 작은 날파리들이 스파근처에 모입니다. 앞에 강 뒤에산이라 감안하면 그리 심한건아닙니다,5,1년 전
y_111_143,엔브릿지 호텔,노는게제일조음,한옥마을 도보 1분의메리트 한옥마을이지만 한옥보다는 조금더 깔끔한곳을 원하시는분에게 강력추천이에요 저는 한옥마을 놀러가면 또방문할 예정 4인가족이서 더블배드 2개있는 방썻는데 마음에 딱 들었습니다 아그리고 1층에 할리스 커피있어서 너무 좋았어요 조식도있습니다,4,6년 전
y_111_144,엔브릿지 호텔,쀼후,호텔 문 열자마자 나는 향기부터 좋았어요~ 체크인/아웃시 두분의 직원분을 만났는데 모두 정말 친절하셨구요 룸컨디션이 정말 깨끗하고 좋았습니다 커튼도 자동이고 화장실도 깨끗해요! 한옥마을과도 엄청 가깝고 모든게 만족스럽습니다~~ 샌드위치도 아침에 받았는데 좋았어요 사실 샌드위치는 맛이 엄청 좋은 편은 아니었지만 호텔 전반의 것들이 다 맘에 들어서 좋았습니다 방음도 잘되는 것 같았고요! 테라스까지도 깔끔하게 관리가 잘되고 있는 것 같아서 다음 전주 출장도 엔브릿지 이용할거같습니다! 사용은 안했지만 2장의 10%카페할인 쿠폰도 감사합니다~,5,3년 전
y_111_145,엔브릿지 호텔,여행에돌았음,전주 올 때 마다 이용하는 호텔이에요! 한옥마을까지 도보로 가능한 거리에 있습니다. 주차장이 넓진 않지만 올때마다 주차 못 했던 적은 없었어요. 한 9시쯤 체크인 했는데 한 자리 더 남아있었음. 1층에 할리스커피 카페있는 게 진짜 꿀이에요. 분위기도 좋고 공부하기 좋은 네모 책상 많아요! 직원 분들 서비스가 엄청 좋고 그런건 아니지만 이정도 가격에 친절까지 바래선 안된다고 생각합니다.,4,3년 전
y_111_146,엔브릿지 호텔,여전한추어,주차 공간이 넓은 편이 아니라 체크인 전에 전화로 미리 여유 공간 확인하고 가시는게 좋을 듯 합니다. 저는 4시 조금 넘어서 체크인 했는데 남은 자리가 두세개 뿐이었어요. 객실은 매우 청결하고 직원분께서도 친절하셨는데 객실 내 냉장고에 냉동칸이 없어서 조금 당황했어요ㅜㅜ 아이스크림을 사갔는데 놓을 곳이 없어서..! 그 부분 말고는 전반적으로 만족스럽습니다 욕조도 커서 좋았어요!,4,4년 전
y_111_147,엔브릿지 호텔,여기어때 이용 고객,호캉스를 즐기기 위한 곳으로는 적합한 것 같아요 시설도 좋은데 외관은 생각보다 별로라 당황했어요 그래도 디자인이 예쁘고 깔끔합니다 사진 올리신 것과 일치해요 가격대비 시설과 위치조건이 만족스러워 다음에 또 올 것 같네요^^,5,6년 전
y_111_148,엔브릿지 호텔,댕댕봄봄,전주 여행 올때 자주 들려요. 올때마다 의자 테이블 끄는 소리 거슬렸는데;; 의자바닥에 소음방지라도 붙여주지...싶었거든요. 근데..와..어젠 진짜 심각했어요. 윗층에 거대한 사람이 들어왔는데 걸을때마다 쿵쿵..울리고 머히는건지 의자ㅜ새벽까지 엄청끌고다니고 아침부터 쿵쿵..끼익익... 사람 환장할뻔 했어요 잠도 제대로 못자고..나왔습니다..,3,1년 전
y_111_149,엔브릿지 호텔,김밥도환불이되나요,전주여행간 1박 숙박했습니다. 객실컨디션은 너무 만족했는데 직원들이 프론트에 잘 없는 호텔은 처음이네요. 체크인이 다른호텔과 달리 16시던데 15시경부터 도착했으나 직원들이 주차때문애 바쁜지 프론트를 십몇분씩 비우기도하고 야간(밤 12시)급하게 연락할것이있어 객실 내 전화기를 세번이나 걸었는데도 받지 않습니다. 결국 직접 내려와서 프론트를 가니 개인 연락처를 써두고 필요시 연락하라고만 되어있네요. 심지어 출력물로 되어있어서 한두번도아니고 상시로 그러는것 같습니다. 이런곳에서 무슨 도움을 받을수있을까하며 연락도 안하게 됐습니다. 급한일을 마무리하고(약 30분 후) 다시 프론트로 돌아왔음에도 아무도 없었습니다. 호텔의 운영방침이 야간에 프론트를 비우는것인지 해당 근무자가 비우는것인지는 모르겠으나 호텔프론트가 비어있는것은 처음 본 상황이라 매우 당황스럽네요. 객실은 정말 깔끔하고 한옥마을도 가까우면서 뷰나 구조도 좋습니다. 다만 호텔답지않은 호텔리어마인드가 있어 재방문은 안할것같네요. 개선이 필요할듯 합니다.,3,2년 전
y_111_150,엔브릿지 호텔,열정적이고푸른자루,깨끗하고 넓고 테라스도 있어서 풍경 보기도 좋고. 들어가면 시트러스향이 너무 좋았어요. 한옥마을 보다 여기 호텔이 더 좋아서 또 오고 싶어요. ㅍ,4,1년 전
y_111_151,엔브릿지 호텔,당근색전사,"1. 시장과 한옥마을과의 접근성이 매우 좋음 2. 신축 건물이라 매우 깨끗함. 고급호텔은 아니지만 모텔보다는 훨씬 깔끔 3. 개인적으로 한옥마을 내의 숙소보다 편하고 좋았음 4. 침구류를 넉넉하게 준비해줌. 인원추가 가능 비용11000 5.주차편리. 6. 재방문의사, 추천 의사있음 7. 침대없는 3인실 방이었는데 7명은 잘수있을만큼 크고 넓었음. 8. 약간의 현대 한옥식 인테리어",5,4년 전
y_111_152,엔브릿지 호텔,자극적인배추,잘 쉬고 갑니다. 깨끗하고 쾌적합니다. 친절하게 인사해주시고 필요하거나 궁금한점도 전화로 친절하게 받아주셔서 감사합니다. 지하 주차장이 넉넉해서 주차하기 좋았습니다. 다만 주차공간은 많이 넓지 않으니 차량 이용시 알고 오셔야 할것 같습니다~~~ 크로와상이 맛있다던데 단독특가로 예약해 먹어보지 못해서 아쉽네요! 다음에 크로와상 샌드위치 먹으로 다시 올께요 ㅎㅎ,4,4년 전
y_111_153,엔브릿지 호텔,15347718,"늦은 여름휴가 즐기러 예랑이랑 왔는데 넘 편안하게 잘 쉬다가요~ 룸도 청결하고 어메니티 및 수건도 2인 쓰기엔 부족함없었어요~^^ 1층에 카페도 있어서 커피없으면 안되는 저에겐 최고였어요ㅎㅎ 아, 그리구 조식 샌드위치랑 샐러드도 맛있게 잘 먹었어용! 직원분들도 넘넘 친절하시구 체크아웃 할 때 룸에 체크할부분이 있어 말씀드렸더니 우선 고객이 다치진 않았는지 여쭤봐주시는 세심한 배려까지 최고였어요 예쁜 직원분 넘 감사해요❣️ 편안히 잘 쉬고 가요😆 룸에서 보이는 씨티뷰도 넘 좋았어요👍🏻",5,3년 전
y_111_154,엔브릿지 호텔,모험심있고소박한장어덮밥,객실깨끗했으나 수건에 왕먼지붙어있어서 떼고사용했어요 바꿔달라고하려다가 귀찮아서그냥썼고 세면대물이잘안내려가서 체크아웃할때얘기했습니다 전반적으로 가성비좋고 깔끔합니다,4,1년 전
y_111_155,엔브릿지 호텔,디디구그,2박연박 했었는데 욕실 환풍기 돌아가는소리 너무 시끄러웠고 수건 3개에 펼치자마자 머리카락 보여서 별로였어요.. 난방은 안켜도될정도로 따뜻해서 아예 끄고있었고 더워서 창문 열고 잤더니 너무 건조해서 바닥에 축축한 수건 깔고 잤네요 도로변쪽 룸이여서 차 지나다니는 소리가 좀 거슬리더라구요 이거 말고는 직원분들도 다 친절하시고 호텔안에 있는 다이닝교 음식 너무 맛있었어요,5,1년 전
y_111_156,엔브릿지 호텔,방콕개복치,두번째 방문입니다. 이번엔 2층으로 배정받았는데 겨울엔 괜찮지만 나뭇잎이 무성해지는 계절에 2층은 한옥마을뷰가 나무에 다 가릴 것 같네요. 방이 깔끔해서 기분 좋게 이용하고 갑니다.,4,4년 전
