id,name,nickname,review_content,rating,write_date
y_111_001,엔브릿지 호텔,15세패잔병,"전주 여행 숙소! 1.먼저, 카운터 직원분들 너무 친절햐세요. 2.방이 깨끗합니다. 3,청결상태, 룸컨디션, 매우 쾌적하고, 아주 좋습니다. 4.어뮤니티,일회용품도 잘 구비되어 있어서 편리하게 잘 섰습니다. 5,수건, 침구상태,중요한데 매우 뽀송뽀송하고, 가운상태도 매우 청결합니다. 6.숙소너무 편하게 잘 쉬고 잘자고 갑니다. 2박여행이었는데 가격대비 너무 만족한 숙소였고, 전주여행오면 당연 재숙박 예정입니다. 맛집들도 많구요 오땅은 대박입니다.",5,14일 전
y_111_002,엔브릿지 호텔,김소혜,부모님께서 바람 쐬고 싶으시다 하여 전주쪽 예약 해드렸고 부모님께서 이용 하셨습니다. 깔끔하니 아주 마음에 든다고 하시네요. 바깥 경치사진 찍어 보내주셨는데 딱봐도 탁 트인게 보여서 기분이 좋아질 것 같습니다. 내부도 아주 깔끔하고 화장실도 수압도 좋고 그러셨다고 하셨습니다. 전주는 고객사가 있어서 출장(당일)으로 자주 왔지만 놀러온 적은 아직 없었는데 다음번에 와이프 데리고 한번 와야겠네요. 한옥마을이 가까운게 아주 좋다고 생각됩니다. 입실 전 문자로 사전 안내 해 주셔서 부모님께 보내드렸는데 이 점도 좋다고 해 주셨습니다.,5,1개월 전
y_111_003,엔브릿지 호텔,나*****,오랜만에 또 엔브릿지를 이용했는데 재방문할수있어서 너무 좋았습니다! 평일에 이용해서 그런지 주차자리 넉넉했습니다! 수건도 넉넉히 구비되어있어서 좋았으며 에어컨 청결도 좋아서 시원하게 잘잤네요! 샴푸 바디워시 이런것들이 냄새도 좋아서 사용하기 좋았구요^^ 확실히 아침에 일어나서 테라스 한옥마을 뷰를 보니까 한껏 취해서 출근도 늦을뻔했네요.. 물도 두개정도 딱 적당히 구비되어있어서 이용하기 좋았습니다! 침대 컨디션도 좋고 확실히 기분좋게 하루 묵고가요-!,5,2일 전
y_111_004,엔브릿지 호텔,더위야,숙소 내부에 모기가 있고 작은 벌레가 있어서 꺼리짐 했어요...다른건 다 괜찮았답니다,3,21일 전
y_111_005,엔브릿지 호텔,빵빵이il,"여기 호텔 직원들,카페직원들 너무 친절하셨어요 !! 1층에 화장실 있어서 급하게 화장실 마려워도 엘베타고 방안에 까지 안들어가도 1층 사용 가능하니 괜찮았고, 카페도 있어서 나가기전에 커피 한잔 사고 나가는 것도 좋았어요 ! 객실 내부는 이중 커튼으로 되어있어서 낮에는 암막커튼 없이 있기에 좋았고, 잘 때에는 암막 커튼 쳐서 자기에 좋았어요 ! 침대도 푹신 하고 뷰도 나쁘지 않았고 콘센트도 침대 양쪽으로 있어서 편했고 필요한 물품도 하나하나 다 잘 챙겨주셨어요! 주차장은 입실 시간대에 맞춰서 오거나 조금 일찍 오셔야 추자 자리 있을거 같아요 아니시면 호텔 입구 길가에 주차 하셔야 합니다! [전주한옥마을, 남부시장] 모두 도보로 가까이 있어서 주차 해두시고 걸어서 가시는걸 추천 드립니다 :) 1층에는 다이닝바? 같은게 있는데 조금 비추 ... 너무 비싸고 저한테는 안맞았는지 새벽에 응급실 가고 장염 걸려서 종일 화장실만 갔네요 ㅠㅠ 객실 단점은 화장실이 조금 불편했던게 다같이 붙어있는게 아니라 세면대,변기통,샤워기 다 따로 되어있어서 조금 불편 했고 냉장고에 냉동 기능이 없더라구요.. [냉장고 자체가 작음] 그래서 1층에 부탁해서 맞겼어요! 그래도 직원분들이 친절해서 기분 좋게 연박 하고 편하게 쉬다 갑니다 ! :)",5,10개월 전
y_111_006,엔브릿지 호텔,드렁큰베베,처음 전라도 여행을 하며 이용했어요~~~~~ 아쉬웠던점은 ㅋㅋ 항상 운전하는 친구만 술을 못마시니 편하게 즐기고 싶어서 한옥마을 도보 1분거리에 위치했다해서 잡은건데 ㅋㅋㅋ 차량으로도 최소 5분이상은 걸렸던거 같아요ㅋ⫬ㅋ⫬ㅋ⫬ㅋ⫬ㅋ⫬ 도보로 못갈거리는 아니지만 15분 정도는 걸어나가야.. 결국은 포장해서 먹었음. 그리고 객실내 다른 이용객들 소음이 있는건 아닌데… 밖에 차량들로 소음이 엄청 커요…(저녁에 먹고 마시고 티비볼땐 몰랐는데..)자가용들은 그거려니 였는데 도로 청소차량이 매일 다니는건지 이용일에 청소일이었던건지… 무슨 제트기 지나가는 소음이…. 놀래서 일어났어요;;; 그리고 냉난방이 중앙시스템이라 조절이안되서 그것도 좀 난감하더라구요… 그래도 객실은 청결한 편이었어요,4,8개월 전
y_111_007,엔브릿지 호텔,재능지야,리뷰만 보고 결정했는데 방도 좋았고 전주한옥마을과 가까워서 더 좋았어요 조식도 서비스로 나와서 간단히 먹기 좋아요 전주가면 재방문입니다 좋은 기억으로 다녀갑니다,5,2개월 전
y_111_008,엔브릿지 호텔,좋은샘,"전주 한옥마을을 구경하러 왔어요. 오기 전에 남편이 유튜브를 보고 이 호텔이 좋다고하여 예약했어요. 와보니 처음엔 외관을 보고 그렇게 아주 좋을것 같지는 않았는데 일단 프런트 직원이 참 친절했고,이 호텔 위치가 전주한옥마을 강 건너편에 있어서 한옥마을을 바라보면서 쉴 수 있어서 좋았고,방에 들어서니 커튼이 자동으로 열려서 그것도 좋았고,냉장고에서 소리가 안나서 엄청 좋았어요. 이불과 베개도 폭신하니 좋았어요.",5,1년 전
y_111_009,엔브릿지 호텔,바지런한민물,직원분들이 너무 친절하셨어요! 체크아웃 후에 짐 맡길 수 있는 것도 좋았습니다 ㅎㅎ 숙소는 청결도가 상당히 높았어요 침구류도 정말 푹신하고 화장실이나 바닥도 깔끔하게 청소되어 있어서 이용 내내 만족하며 지냈습니다! 인근 맛집 카페들이랑의 접근성도 좋아서 상당히 만족했습니다! 직원분들이 너무 친절하셨어요! 체크아웃 후에 짐 맡길 수 있는 것도 좋았습니다 ㅎㅎ 숙소는 청결도가 상당히 높았어요 침구류도 정말 푹신하고 화장실이나 바닥도 깔끔하게 청소되어 있어서 이용 내내 만족하며 지냈습니다! 인근 맛집 카페들이랑의 접근성도 좋아서 상당히 만족했습니다!,5,9개월 전
y_111_010,엔브릿지 호텔,빨주노초파남보7778,"일단 직원분들이 정말 친절하시고 객실이 아주아주 깨끗합니다. 혼자여행오면 잠을 잘 못자는데 여기서는 걱정없이 완전 꿀잠 잤네요🌛 청연루는 1분거리 한옥마을 메인거리는 5분, 객사길도 걸어가기 딱 좋은 위치에 있어서 전주여행하기 정말 좋았어요🙃",5,16일 전
y_111_011,엔브릿지 호텔,밥하깃,"딱히 부대시설이 없고.. 조식도 이용하지 않았지만.. 그래도 깔끔하고 따뜻하게 잘 지내고 왔어요^^ 직원분 친절하시고, 한옥마을이랑 가까워서 좋았어요~ 주차장 좁다고 리뷰 보이는데 좁긴해요.. 근데 뭐밖에 길가에 주차가 가능해서 큰불편함은 없었어요. 다음에도 가족여행 간다면 이용할 의향 있습니다.",4,1년 전
y_111_012,엔브릿지 호텔,미숫가루동동,"부모님 예약해드렸는데 정말 너무 만족스러워하셨어요. 급하게 잡느라 다른 곳은 비싼 방만 남아 있어서 속상해하셨는데, 여기는 가성비 뿐만 아니라 퀄리티가 너무 좋아서 행복해하셨어요. 창문을 열면 한옥마을이 쫙 보이고, 남부시장도 가깝고 있을거 다 있고 깔끔하고 호텔 주차장 이용하면 되니 주차 스트레스도 없고 로비도 카페 같아서 좋으셨대요. 5001호 강추합니다. 천변 옆이라서 아침 산책하기도 좋다고 합니다. 심지어 친절하기까지 하다고 리뷰를 꼭 남겨달라고 하십니다 ㅎㅎ 추천!",5,8개월 전
y_111_013,엔브릿지 호텔,빛나고활동적인바나나색,청결하고 한옥마을과 가까워서 다니기 좋았고 저렴한 가격에 간단한 조식 주셔서 좋았어요 한옥마을 뷰가 있는줄 알았는데 3층은 가로수에 가려서 안보여서 좀 아쉬웠어요.,4,8개월 전
y_111_014,엔브릿지 호텔,나*****,"전주에 살면서 가까운 엔브릿지 호텔을 이용할 기회를 못보고 있었는데 마침 특가 할인이었어서 이용을 해봤는데 위치도 그렇고 테라스에서 바람 쐴수 있어서 너무 좋았네요. 주차장은 조금은 협소하지만 엄청 늦게만 안오신다면 충분히 주차 가능입니다. 또한, 엘리베이터나 객실 들어가기 전부터 호텔 냄새가 너무 좋아서 기분좋게 들어갈 수 있었네요. 한옥마을 근처여서 꼭 꼭 이용해보고 싶은 호텔 중 한 곳 이었는데 이용할 수 있어서 너무 좋았습니다. 샤워실이나 침대도 깔끔 그자체.",5,1개월 전
y_111_015,엔브릿지 호텔,용마산괴수,객사-한옥마늘 근처에서 가장 깔끔하고 묵기 좋은 곳이라고 생각합니닷 화장실도 깔끔했고 침구류도 문제 없이 다 좋았어요! 접근성도 좋아서 여행 오시는 분들께도 추천하고 싶은 호텔입니다 ㅎ_ㅎ 1층 로비 바로 옆에 카페도 있고 투숙시 할인 쿠폰도 받을 수 있어서 넘 조아용 👍🏻 객사-한옥마늘 근처에서 가장 깔끔하고 묵기 좋은 곳이라고 생각합니닷 화장실도 깔끔했고 침구류도 문제 없이 다 좋았어요! 접근성도 좋아서 여행 오시는 분들께도 추천하고 싶은 호텔입니다 ㅎ_ㅎ 1층 로비 바로 옆에 카페도 있고 투숙시 할인 쿠폰도 받을 수 있어서 넘 조아용,5,9개월 전
y_111_016,엔브릿지 호텔,자타일시성불도,전주여행시 자주이용하는 호텔입니다~,4,2개월 전
y_111_017,엔브릿지 호텔,paul1,"한옥마을 바로 건너편이라 상당히 지리적으로 좋았구요. 저녁도 뒷블럭에서 저렴하게 잘 먹었습니다. 직원분들 상당히 친절하여, 아들이 고등학교 졸업시까지 다음에 또 오도록 하겠습니다.",5,7개월 전
y_111_018,엔브릿지 호텔,옛거북이,한옥마을 위치 가깝고 시설 좋아요,5,2개월 전
y_111_019,엔브릿지 호텔,샌프란아줌마,시차적응이 왔다갔다 하여 게으름을 피우다가 연박하고 말았습니다. 그만큼 편하게 쉬었습니다.,5,1년 전
y_111_020,엔브릿지 호텔,샌프란아줌마,"배정 받은 방의 컨디션이 좋지 않아 새로 바꿔달라고 요청 했습니다. 괜찮은 방을 배정 받았고, 편하게 쉬었습니다. 이 호텔의 장점은 로비에 있는 까페와 새로 생긴 일식집과 주변 입니다. 나름 많은것들을 만끽할수 있습니다. 전주에 새로 생긴 호텔들이 많아졌음에도, 아직까지 이 호텔만의 장점이 크다는것은 변함 없을거 같습니다.",4,1년 전
y_111_021,엔브릿지 호텔,메메롱롱롱롱,"숙소 주차도 편하고 한옥마을,객사위치접근도 젛아요! 택시 안잡힐까봐 걱정했는데 카카오택시 아주잘잡힙니다.. 화장실 진짜 중요하게생각하는데 허ㅏ장실진짜 깨끗해요 그리고 숙소전체에서 들어가자마자 엄청좋은냄새나요!! 침대 매트리스도 편하구 암막커튼이라 꿀잠잤어용 추천햐요 1층카페도 편햐요 10프오 할인쿠폰도 주셔서 카페이용도 햇습니당 또 전주가면 야기로 예약할구같아요",5,1년 전
y_111_022,엔브릿지 호텔,여행가자가자가자진짜가자,시설이 좋았습니다. 청결하고 잠이 잘오네요,5,1개월 전
y_111_023,엔브릿지 호텔,용암동동,깨끗하고 편히 잘 쉬다갑니다. 직원분들 정말 친절하세요!,5,6개월 전
y_111_024,엔브릿지 호텔,퓨충,직원들도 친절하게 설명해주시고 호텔도 전체적으로 깨끗해서 좋아요 침실도 깨끗하니~침대도 포근하고 푹신하니 좋았어요 잘 묵고 갈거같아요,5,9개월 전
y_111_025,엔브릿지 호텔,팍팍한잔당,"대체로 조용하고 괜찮았으나 청소는 좀~~~침대옆 테이블에 머리카락이... 욕실은 바닥이 대리석이라 미끄러지지 않게 조심... 차라리 욕실 신발 하나 있으면 좋겠음. 에머니티는 칫솔,치약, 비누, 면봉. 머리끈, 화장솜, 얇은 슬리퍼 정도... 조명이 어두워 이불이 보기는 깨끗하게 보였으나 제가 피부가 좀 예민해서인지 다리가 가려움~ 여튼 하루는 묵었으나 또? 글쎄~~~ 고민할거 같음. 직원분들은 친절하셨음.",4,11개월 전
y_111_026,엔브릿지 호텔,서성1965,한옥마을 접근성이 좋고 시설 및 서비스가 괜찮습니다.,5,7개월 전
y_111_027,엔브릿지 호텔,자갸나지금신나,뷰는 기대햇지만 3층도 한옥 지붕하나 안보인다는;;그냥 관광지 가족관광호텔 수준이고 주차장은 협소한편 방음시설이 쫌 부족한듯,3,2개월 전
y_111_028,엔브릿지 호텔,dalre,전주한옥마을 여행올땐 이 호텔이 최고예요!! 두번째 방문인데 역시나 넘 만족합니당 위치 말할것도 없이 넘 좋고 한옥마을에서 놀다가 더워서 호텔에 잠시 들러 쉬고 나가기 좋아요 😊 깨끗하고 친절하고 주차도 편하고!! 기분좋게 놀다 갑니당 👍,5,11개월 전
y_111_029,엔브릿지 호텔,마흔여섯살혼연,지하주차장도 있구 프론트 직원이 너무 친절했네요 룸은 넓고 깔끔하고 매우 좋았는데 단점은 방음이 안되고 화장실이 너무 비좁네요 근데 그거빼고는 다 좋았네요,4,5개월 전
y_111_030,엔브릿지 호텔,아흔한살모험가,구우웃 시설 좋고 뷰도 좋고 즐거운 여행이었습니다.,4,11개월 전
y_111_031,엔브릿지 호텔,아낌없는브뤼셀그리펀,한옥마을이랑도 가깝고 시설이나 서비스 모두 좋았습니다 어매니티가 잘되어있어요 다음에 전주 방문하면 또 들릴거같으요~~,5,12개월 전
y_111_032,엔브릿지 호텔,은지84,"전주한옥마을과 가깝고, 깔끔하고 조용한 숙소였습니다. 아이가 다음에 또 오고 싶다 하네요.",5,1개월 전
y_111_033,엔브릿지 호텔,humbluv12,최고입니다. ㅁㅁㅁㅁ,5,1개월 전
y_111_034,엔브릿지 호텔,전주금붕어,굿굿 다음에 또 방문의사 있습니다 좋인요,5,1년 전
y_111_035,엔브릿지 호텔,준Aos,푹 쉬다 왔어요 냄새 민감한 일행이 있어 긴장했는데 1도 안난다구 좋아하네요 체크인에서 체크아웃까지 친절히 대응해주셔서 좋았습니다 다음에 재방문예정입니다,5,4개월 전
y_111_036,엔브릿지 호텔,불규칙한복사꽃,스파 잘 이용했습니다 호텔측에서 준 입욕제 향이 세지 않아서 기분 좋게 이용했습니다,4,9개월 전
y_111_037,엔브릿지 호텔,시대마눌,너무 맘에들었어요 깨끗하고 조용해요. 침구 편하고 한옥마을 바로앞이예요 지인추천으로 간곳인데 정말 추천합니다,4,9개월 전
y_111_038,엔브릿지 호텔,문광당,직원분들 무척 친절 하시고 객실 상태 굿 한옥마을 놀러 오실때 이용 하시면 좋은 선택이 될 것 같습니다,4,10개월 전
y_111_039,엔브릿지 호텔,섬뜰,침구류와 실내가 깔끔하고 깨끗하네요. 직원분들이 너무나 친절하네요. 아침에 간단한 조식이 나와 만족스럽네요.,4,4개월 전
y_111_040,엔브릿지 호텔,GC1501905090,시설이 깨끗하고 뷰가 끝내주네요. 다시 방문의사 있음,5,11개월 전
y_111_041,엔브릿지 호텔,달빛천사777,전반적으로 깨끗해서 좋았어요 한옥마을도 가까워서 편했습니다,4,4개월 전
y_111_042,엔브릿지 호텔,라이프도슨트,깔끔하고 베란다도 있어서 좋습니다. 직원분들도 친절하시고 잘 머물다 왔어요. 침대도 괜찮습니다.,5,8개월 전
y_111_043,엔브릿지 호텔,나는나0615,또 가라면 갈듯요 깔끔한 가성비 숙소,5,7개월 전
y_111_044,엔브릿지 호텔,낌줄,시설은 만족스럽습니다 침구도 깨끗하고 욕실도 깨끗합니다 방음도 괜찮구요 한옥마을과 다리만 건너면 바로 앞 입니다. 추천합니다,4,11개월 전
y_111_045,엔브릿지 호텔,제임스사진관,뷰가 좋고 조용한 곳입니다,5,7개월 전
y_111_046,엔브릿지 호텔,DJBINYOU,숲뷰도좋고 이불도폭신해서 잠이잘왔어요! 조식이안된다해서좀많이아쉬웠어요 ㅠㅠ,5,11개월 전
y_111_047,엔브릿지 호텔,온화하고획기적인별명,기대이상 만족했습니다~ 연박하지 못해서 아쉬워요ㅠㅜ,4,7개월 전
y_111_048,엔브릿지 호텔,몽몽이구,화장실 바닥 배수구가 많이 뚫려있고 길게 있던데 설마 했지만 아침에 문열고 들어갔더니 여러마리가 방으로 들어와 침대 머리쪽이랑 벽에 다 자리잡고 붙어있네요 날이 더 따뜻해지고 여름되면 더 심해지겠어요,2,1년 전
y_111_049,엔브릿지 호텔,선댄스1,잘잤습니다 감사합니다,5,11개월 전
y_111_050,엔브릿지 호텔,yup47,청결하고 편안합니다.,5,2개월 전
y_111_051,엔브릿지 호텔,yup47,청결하고 편안합니다.,5,2개월 전
y_111_052,엔브릿지 호텔,열정적이고탁월한포메라니안,날씨가 너무 더워서 잠깐 쉴겸 방문하였는데 편하게 잘 쉬다 갑니당~~~ 너무 좋았어용👍👍👍👍👍,5,10개월 전
y_111_053,엔브릿지 호텔,61세위병,너무 깨끗하고 좋았어요,5,8개월 전
y_111_054,엔브릿지 호텔,에코사람,깔끔하고 직원분들 친절하고 좋았습니다,5,10개월 전
y_111_055,엔브릿지 호텔,비범한주술사,한옥마을이랑 가깝고 잘쉬었다 가요,5,7개월 전
y_111_056,엔브릿지 호텔,미인폭포낚시꾼,"깨끗하고, 친절해서 넘 좋았습니다 ^^",5,10개월 전
y_111_057,엔브릿지 호텔,배동훈2,전주 여기저기 투숙해봤는데 만족도가 제일 큰 호텔입니다^^,4,7개월 전
y_111_058,엔브릿지 호텔,알*****,정말좋았어요! 호텔 1층 라운지도 있고 객실도 너무 깔끔하고 테라스도 있어서 행복한 하루를 보냈어요 추천합니다!!,5,7개월 전
y_111_059,엔브릿지 호텔,웨딩스냅,숙소도 깔끔하고 한옥마을도 가까워서 좋아요 강추,4,6개월 전
y_111_060,엔브릿지 호텔,꼬비는울강아지,객실구석에 먼지가 좀 날아다니고 수건과 가운에서 락스냄새가 너무 나서 그게 젤 별로 다른건 괜찮았어요 수건과 가운 세척시 락스 냄새를 없애주심좋을거깉아요,2,1년 전
y_111_061,엔브릿지 호텔,천만배우,창문 없는 방이 있음 세면대 불량... 친절한 직원만 추천요~~~,3,4개월 전
y_111_062,엔브릿지 호텔,뜨으응,깨끗하고 좋아요. 다음번에도. 오고싶어요,4,8개월 전
y_111_063,엔브릿지 호텔,청담공원버튼,잘쉬다갑니다.환풍기소리가너무커신경이쓰였어요.침구는완죤만족.생수에좀인색하더구요.1일2병규칙이라는데 할말없죠 ㅜㅜ,2,6개월 전
y_111_064,엔브릿지 호텔,의심스러운훼손자,로비도 이쁘고 친절하고 좋습니다.,5,6개월 전
y_111_065,엔브릿지 호텔,chanroh,"장점: 한옥마을과 가까움 단점: 주차공간이 부족 (4시30분에 도착했는데도 불구하고 자리 없음, 도로변 주차했는데 다음날 새들의 흔적으로 바로 새차함)",3,11개월 전
y_111_066,엔브릿지 호텔,여주아나운서,깔끔하고 한옥마을도 가까움,5,3개월 전
y_111_067,엔브릿지 호텔,교동홍이엄마,창문이나 의자에 먼지 머리카락의 흔적이 좀~~ 한옥마을이랑 가까운거에 한표입니다,3,8개월 전
y_111_068,엔브릿지 호텔,성한피신자,깨끗하고 조용한 숙소입니다.,3,8개월 전
y_111_069,엔브릿지 호텔,쎄나m,"전주한옥마을을 가고 싶어서 신랑과 반차하고 내려가서 8시넘어 도착하게 되었어요 호텔에서 미리 문자와 전화로 세심하게 도착시간과 주차가능부분 알려주었어요 한옥마을 들어가는 입구라 거리가 아주 가까웠어요 들어가서 카드키 넣자마자 창문도 자동으로 열리네요 다만 고층뷰를 멋진풍경대도 3층에 묵어서 사진에서보던 기와 지붕의 멋진풍경은 못보아 아쉬웠어요 객실은 더블사이즈 침대로 침구도 깨끗하고 정리가 잘되어 있었어요 친환경의 애니머티가 준비되어 있고 칫솔도 있는데 일회용 면도기는 없어요 샤워공간.화장실,욕조가 분리되어 있어요.바닥이 대리석이라 미끄럼 방지 매트도 있는데 미리 객실안내시 다시 말해주기도했어요~ 침구가 편안해서 잘 잤어요~ 전주에 오면 다시 묵고싶어요~ 늦게 도착해서 주변 먹을곳이 드물어 주변 가맥집에서 먹었는데 다른분들은 한옥마을안에도 늦게까지하는곳이 있으니 가보시길 권해요. 또 금토에는 근처 남부시장야시장도 있다하니 추천드려요 ㅎ",5,2년 전
y_111_070,엔브릿지 호텔,절제된우아함,"엔브릿지 호텔 을 이용하는것은 이번이 두번째 입니다 처음이용했을때의 인상적인 부분때문에 다시 이용 하게 되었습니다 엔브릿지 호텔은 위치적으로 전주천을 사이에두고 전주한옥마을의 맞은편에 위치해 있습니다 여행일정 에서 중심이 전주한옥마을 이다보니 한옥숙소는 제외하고 호텔을 찾던중 엔브릿지 호텔이 가장 적합했기에 위치는 최적의 장소중 하나였습니다 엔브릿지호텔은 호텔 내부 지하주차장이 생각보다 협소해서 입실을 늦게 할경우 호텔 앞 도로면에 주차를 해야합니다 체크인 할때 객실키 하나만 주는데 2개 요청하면 2개 줍니다 2층의 2012호 객실을 배정받았습니다 객실의 첫 청결도는 만족스러웠습니다 객실뷰는 옆건물 뷰였고 더블베드 한개 싱글베드 한개 베드의 쿠션 과 침구류는 누우면 잠이 솔솔 올정도로 좋았습니다 객실안의 테이블 과 의자 구성도 좋습니다 베쓰룸은 1인용 욕조도 있고 물수압 빠르고 물빠짐도 시원합니다 샤워실 과 용변기가 분리된부분도 만족스러웠습니다 어매니티는 샘플식용기로 샴푸 컨디셔너 바디워시가 있는점은 다소 불편했습니다 그리고 샤워실 의 물빠짐이 매우 느려서 샤워하면서 발목까지 물이 차오르는 상태에서 샤워를 하게 되었고 이점이 매우 불편했습니다 호텔 1층 로비에는 할리스 매장이 있는데 체크인시 10프로 할인쿠폰을 한장 서비스로 줍니다 2박3일 숙박료는 286,200원 여기어때 리뷰포인트 5,000원 사용 여기어때 쿠폰 58,620원 사용 실결제금액 222,580원 입니다",4,1년 전
y_111_071,엔브릿지 호텔,창피한신문배달부,"지난번에 너무 만족스럽게 잘 숙박하였던 기억이 있어서, 일반 방보다는 다소 비싼 방이 남아있어 숙박하게 되었습니다. 인테리어나 직원 친절도는 너무 만족스러웠습니다. 하지만 프리미엄 스파 방에 맞게 스파를 사용하자 몇몇부분 불편한 점이 많았습니다. 1. 스파 덮개를 열자 먼지들이 우수수 떨어져 탕속에 빠져서 불편하였습니다. 2. 스파 탕 내부 물때가 지지 않아 기분이 상당히 찝찝하였습니다. 3. 등받이가 한부분이 파손되어 있었습니다. 4. 온수가 매우 약하게 나와 탕 전체를 채우는데 시간이 많이 걸렸습니다. 평일 숙박에 18만원이라는 거금을 들여 숙박하였으나 전체적으로 아쉬운점이 많았습니다. 또한 냉장고가 매우 작고, 시원하지 않아서 불편하였습니다. 일반 객실에 비해 두배정도 비싼 프리미엄 방이 기대에 못미쳤습니다. 다른분들께 추천해드리고 싶은 방은 아니네요",4,4년 전
y_111_072,엔브릿지 호텔,청둥오리556,고층이 아니라서 한옥마을 하나도 안보일까봐 걱정했는데 객실에서 한옥마을이 매우 잘 내려다보여서 매우 좋았습니다 객실도 깨끗했구요 잘 쉬고 갑니다,5,2년 전
y_111_073,엔브릿지 호텔,눈병,"적은 주차공간이 조금 아쉽지만, 그 외에 모든 면은 다 만족스러워서 재방문의사 있어요 :) 한옥마을이랑 근접하고, 청결하고 따뜻해서 좋았어요! 넷플릭스 당연 가능하고, 직원분들도 친절하세요 ㅎㅎ 급여행이라 하루전 급하게 예약했지만 숙소덕분에 좋은 기억 안고가요~! 다음번에 전주에 또 온다면 들를게요, 아 그리고, 숙박시 1층 할리스커피 10% 할인 쿠폰도 주셔서 잘 사용했어요!",5,3년 전
