id,name,nickname,review_content,rating,write_date
y_126_001,에이치에비뉴 덕진점,여*****,"전주 출장차 에이치에비뉴 덕진점에 숙박하게 되었습니다. 덕진공원 옆에 위치해 있어 접근성이 좋고, 주변 산책하기에도 딱 좋습니다. 무엇보다 주차장이 매우 넓고, 건물 외관과 내부 모두 고급스러운 분위기라 만족스러웠습니다. 저는 조식 포함 예약이었고, 감사하게도 프리미엄 플러스룸으로 업그레이드도 해주셨습니다. 신관과 본관으로 나뉘어 있는데, 신관 1층에는 드럼세탁기와 건조기가 마련돼 있어 장기 숙박이나 출장객에게 유용해 보였습니다. 객실도 매우 청결하고 쾌적해서 출장 목적은 물론, 가족여행에도 추천할 만한 호텔입니다. 전주 방문 시 다시 찾고 싶은 곳입니다.",4,1개월 전
y_126_002,에이치에비뉴 덕진점,백김치김치구이,체크인 하는데 룸 업그레이 시켜주셔서 넓은방에서 편하게 쉬었네요 직원분들 언제나 친철하시고 방 컨디션 너무 좋아요 올때마다 진짜 편히 쉬는기분이에요 에어컨도 천장에 있어서 깔끔해보이고 공청기도 있어 방 쾌적합니다 슬리퍼 구비되어있고 드라이기 바람 짱짱합니다 수건도 뽀송~ 욕실도 깨끗해요 욕조도 있어서 분위기도 너무 좋아요 굳굳 오늘은 조식도 신청해서 먹었는데 반찬인 고기가 퍽퍽하게 생겨서 기대안했는데 되게 부드럽고 맛있었어요 간도 좋았고 밥 국 반찬 고기 빵 음료수 커피 우유 시리얼 다양하게 구비되어있어서 너무 좋았고 만족스러웠습니다 조식좋아~~,5,24일 전
y_126_003,에이치에비뉴 덕진점,딩구발바닥,겨울에 이용한번하고 보일러 고장때문에 고생을 좀 하다가서 재방문 안할가도 싶었는데 객실도 좋고 직원분들이 너무 친절하셔서 어른들 모시고 재방문했습니다 :) 방도 2개다 친절한 설명과 함께 업그레이드 해주셔서 덕분에 어른들도 저희도 편하게 쉬다 왔네요 ^^* 청소부분은 깨끗한데 머리카락이 쫌 떨어져있어서아이랑 같이간거라 제가 다시한번 닦았어요 떨어진 부분은 사람이 청소하는거니 이해하고 넘어가요~~! 청소하시는 분들도 복도에서 만났는데 엄청 친절하셨어요 ! 또한 침구도 뽀송하고 욕실과 화장실 구분되있고 세면대도 2개라 좋았어요 ! 숙소는 여행의 젤 중요한 부분이라 생각해서 다음에 전주오면 또 방문할거에요 감사히 잘묵었다 갑니다,4,2개월 전
y_126_004,에이치에비뉴 덕진점,지지지구,아이가 전주로 진학을 해서 종종 전주에 가게 됩니다. 매번 비슷한 동네의 호텔이 지겨워서 꼼꼼하게 리뷰 참고해서 찾아낸 호텔. 진짜 정말정말 만족합니다. 동네가 낯설어서 어리둥절 하다가 호텔 프론트에서부터 너무나 친절하게 맞아주시고 전망좋은 방 특별히 챙겨주셔서 감사합니다. 주차도 건물앞이라 쉽고 가깝고 주차면도 생각보다 많아요. 지난번 묵었던 호텔은 밤에 자리 없어서 옆건물에 주차 불편했어요. 프론트에서 신관 6층 배정 받고 객실 들어서는 순간 우와 정말 깨끗하고 리모델링 새로 해서 너무 좋습니다. 가전도 다 고급이고 욕실에 엄청 큰 조적욕조도 있어서 깜짝 놀랬어요. 티비 사이즈도 65인치. 1층에 자유롭게 쓸 수 있는 세탁기도 여러대 있습니다. 다음에도 무조건 여기로 올 거예요. 같은 학교 엄마들한테 홍보 많이 할게요 ^^ 아! 조식도 신관1층에서 제공된다는데 기대됩니다.,5,1개월 전
y_126_005,에이치에비뉴 덕진점,안매운떡볶이,"여기 숙소 정말 추천드립니다. 우선 가격 대비 방이 넓고 쾌적했습니다. 문 열고 키 꽂자마자 자동커튼이 열려 창밖이 보이는데 너무 좋았어요! 침대도 넓고 얘기할 수 있는 편한 의자와 식탁도 있어서 밤에 간단하게 먹으면서 얘기나눴습니다. 공기청정기와 디퓨져, 천장형 에어컨이 있어서 쾌적하게 지냈습니다. 화장실도 깨끗하고 좋았어요! 욕조도 있고, 샤워공간이랑 세면대가 분리되어있어 깔끔했습니다. 화장대에는 드라이기와 더불어 고데기까지 있었고, 스타일러도 있어서 외출준비하기 좋았습니다. 조식은 밥이랑 토스트 등등 한식, 양식(?) 중에 선택할수있었어요! 저는 간단히 씨리얼에 우유 말아서 먹고, 구운 식빵에 딸기쨈과 버터를 발라서 맛있게 먹었습니다. 무엇보다 야경이 예쁜 덕진공원과 가까워서 밤에 산책하고 들어가기 좋았습니다. 다음번에 기회가 되면 또 와보고싶네요:)",5,1개월 전
y_126_006,에이치에비뉴 덕진점,whdgkpower1,"전주출장다녀왔어요ㅎ 여기 진짜 좋네요 전북대랑 덕진공원근처이고, 유명한 비빔밥집 고궁도 근처에 있어서 좋습니다 조식이무료여서, 아침 드시는분들 오시면좋고 근처에 편의점이 브랜드별로 다 있어서 좋습니다ㅎㅎ 그리고 방에 담배냄새도 안나고 들어가자마자 코튼향이ㅎㅎ 세탁을 얼마나 잘하셨으면 코튼향이 나는지 넘 좋았네요ㅎㅎ 스타일러도 있어서 출장오시면 스타일러 필수잖아요 그리고 저녁에는 바로 앞 덕진공원 한바퀴도시면 진짜 출장와서도 운동까지 완벽 그리고 카운터에계신 남자분이 너무 친절하셔서, 기분 좋았습니다ㅎㅎ 샤워젤,샴푸,컨디셔너는 일회용품으로 제공되고 칫솔 치약 다 제공해줍니다ㅎㅎ 전기장판도 있어서 따듯하게 잘 수 있었습니다ㅎㅎ",5,3개월 전
y_126_007,에이치에비뉴 덕진점,흠동이,"덕진공원 주변 머무를 일이 있어 찾아본 숙소였는데 잘 쉬고 가네요ㅎㅎ 룸 컨디션, 청결상태도 양호하고 응대해주시는 직원분이 매우 친절하셔서 좋았습니다.",4,7개월 전
y_126_008,에이치에비뉴 덕진점,쁨뽐뽀,데스크 직원분도 너무 친절하시구 웃는게 너무 이쁘세요^-^덕분에 기분이 너무 좋아졌어요!! 객실 청결도 너무 좋구요!! 깔끔하고 넓어서 숙소예약 할일이 생기면 무조건 에이치에비뉴로 예약할거에요!!덕분에 잘 쉬고 갑니다아^-^,5,5일 전
y_126_009,에이치에비뉴 덕진점,득의양양한소탕,"(알바아님주의)전주출신으로서 전주에 매우 자주 방문했고 그동안 지냈던 호텔들과 견주어보았을때 탑급으로 손꼽을 만큼 만족스러웠습니다😍 한옥마을 근처 호텔보다 더 조용하고 한적해서 오히려 좋습니다~덕진공원이 코앞이라 아침저녁 산책하며 힐링가능합니다. 전 남자친구와 금요일 저녁에 체크인해서 1박 머물렀습니다! 체크인 할 때 직원분이 엄청 친절하셨어요:) 무료로 업그레이드 해주신 룸이 신관에 있었는데 지은지 얼마 안되어서 새 건물 느낌이 확 났습니다ㅎㅎ 신관 1층 입구에는 세탁실이 있고 세제도 비치되어 있어서 장기 숙박 하시는 분들도 불편하지 않을 것 같습니다. 1. 배정받은 룸은 굉장히 넓었습니다! 3인 기준의 방이었고 침실과 욕실이 확실히 구분되어 있어서 휴식을 취하기가 좋았습니다. 특히 세면대가 두개 있고 샤워실과 변기(비데)가 각각 다른 공간에 있어서 아주 쾌적했습니다. 공기청정기와 스타일러가 있어서 청결한 1박을 보낼 수 있었습니다😉 2.칫솔, 치약, 샴푸, 샤워젤, 샤워타월 등 어매니티가 잘 구비되어있었습니다. 냉장고가 굉장히 커서 와인이나 맥주 많이 넣어놓으셔도 될 것 같아요😄 또 드레스룸에는 드라이기 뿐만 아니라 고데기까지 있으니 여성분들 여행오실때 짐 한결 가볍게 챙기셔도 될 듯 합니다! 3. 바닥이 깔끔하고 따땃해서 나중에는 맨발로 다녔습니다. 침대는 꽤 큰 편이고 완전 푹신 매트리스는 아닌데, 전 오히려 허리가 편안하게 느껴져서 숙면을 취했네요. 그리고 TV가 무지무지 커요! 침대에 누워서 밤새 영화보다가 잠들어도 괜찮을 듯 하니 호캉스 장소로 추천드립니다😊 4. 제일 좋았던 게 바로 조적식 욕조였습니다😍 하얀욕조는 때가 껴있거나 터럭(?)이 붙어있는게 너무 잘 보여서 별로 안좋아하는데, 온천탕에서 프라이빗하게 목욕을 즐긴다는 느낌이 들어서 만족했습니다ㅎㅎ하나 팁을 드리자면 물 채우기 전에 한번 싹 헹구셔야 먼지가 떠다니지 않습니다~ 5. 조식 포함이어서 신관 1층 레스토랑에서 조식을 먹었습니다. 사실 전주는 먹을게 많고 호텔 주변에도 밥집이 많기 때문에 별 기대없이 먹었는데요, 찬 가짓수는 적어도 일단 여긴 기본베이스 '전주'라서..ㅋㅋ밥이 윤기 좔좔에 반찬 맛납니다! 얼결에 두 그릇 먹었어요ㅋㅋㅋ 식빵에 잼이랑 버터, 커피머신도 있으니 바쁘신 분들은 입에 물고 나가셔도 될 듯 합니당 쓰고보니 엄청 길어졌는데..전 딱히 단점 못느꼈고 남자친구도 만족도 최상이라서 지인들한테 전주 방문할 때 꼭 여기 예약하라고 추천하려구요🙂 고즈넉한 덕진공원 풍경 남기고 갈게요 모두모두 즐거운 전주여행 하세요🤗",5,7개월 전
y_126_010,에이치에비뉴 덕진점,파프롬오피스,"1박 숙박을 하게 되었는데, 가격 대비 정말 만족스러운 경험을 했어요. 사실 호텔 선택할 때 중요한 기준 중 하나가 편안함과 청결이잖아요? 에이치에베뉴 덕진점은 이 부분에서 완벽하게 만족스러웠어요. 다른 호텔들과 비교했을 때, 전체적인 시설과 서비스에서 확실히 더 나은 점들이 많았다고 느꼈어요. 첫 번째로 침구류가 정말 깨끗하고 편안했어요. 다른 호텔들에서는 때때로 침대 시트나 이불이 낡은 느낌을 받았던 적이 있었는데, 여기선 침구류가 정말 새것처럼 깔끔하고 푹신했어요. 덕분에 밤새 편안하게 잘 수 있었고, 아침에 일어났을 때도 피곤함이 덜 느껴졌어요. 그리고 스타일러가 객실에 구비되어 있어서 옷이나 이불에 먼지가 묻거나 냄새가 나는 걱정을 하지 않아도 돼서 좋았어요. 여행 중에는 그런 작은 디테일이 큰 차이를 만들어 준다고 생각해요. 이 부분에서 정말 인상적이었어요. 객실 자체도 다른 호텔들과 비교해 봤을 때 넓고 깔끔한 편이었어요. 심플하면서도 모던한 인테리어가 아늑한 느낌을 주어서, 정말 편안하게 쉴 수 있었어요. 객실 내에 있는 모든 시설이 최신형이라서 불편함 없이 쾌적하게 지낼 수 있었고, 무엇보다 필요할 때 바로바로 이용할 수 있는 편의시설들이 잘 준비되어 있었어요. 에이치에베뉴 덕진점은 기본적인 시설이 정말 잘 갖춰져 있어서, 작은 불편함 없이 머무를 수 있었어요. 아침 조식도 정말 좋았어요. 사실 종류가 많지는 않지만, 각 메뉴가 신선하고 질이 좋아서 매우 만족스러웠어요. 보통 호텔에서 아침을 먹으면 그냥 간단한 뷔페 스타일로 제공되는 경우가 많잖아요? 그런데 여기는 그렇지 않았어요. 국물 요리와 함께 제공되는 반찬들이 정말 맛있었고, 식빵 등 간단한 음식들도 식사를 더욱 풍성하고 맛있게 만들어 줬어요. 저는 개인적으로 한식 위주의 조식을 좋아하는데, 여기 조식은 딱 제 입맛에 맞았어요. 간단하지만 맛있는 아침을 즐기고 싶다면 정말 추천할 만한 조식이었어요. 그리고 무엇보다 직원들이 정말 친절하고 세심한 서비스를 제공해줘서 기분 좋게 지낼 수 있었어요. 체크인할 때부터 체크아웃할 때까지 직원분들이 웃으면서 친절하게 대응해주셔서 너무 편안했어요. 사실 다른 호텔들에서는 직원들이 약간 기계적인 느낌을 주기도 했는데, 여기는 그런 점이 전혀 없었어요. 작은 질문에도 진심으로 답해주고, 고객의 편안함을 신경 쓰는 모습이 정말 인상 깊었어요. 이런 세심한 서비스가 여행의 만족도를 크게 높여준다고 생각해요. 에이치에베뉴 덕진점의 직원분들 덕분에 정말 편안하고 기분 좋은 시간을 보낼 수 있었습니다. 그리고 호텔 주변 환경도 굉장히 좋았어요. 덕진호 산책로가 가까운 곳에 있어서, 아침에 일어나서 가볍게 산책을 즐기기에 정말 좋았어요. 덕진호는 자연경관이 아름다운 곳이라 산책을 하면서 기분 전환도 할 수 있었고, 특히 날씨가 좋을 때는 주변 풍경을 감상하며 여유로운 시간을 보낼 수 있었습니다. 시내와 가까운 위치에 있으면서도 이런 자연을 가까이서 즐길 수 있다는 점은 정말 큰 장점이라고 느꼈어요. 여행 중에 잠깐이라도 여유를 갖고 싶다면, 덕진호 산책로를 걷는 것도 좋을 것 같아요. 호텔 위치도 편리했어요. 시내와 가까워서 외출할 때 전혀 불편함이 없었고, 주변에 다양한 먹거리가 있어 여행 중에 간단히 끼니를 해결하기도 좋았어요. 덕진호 산책로와 가까워서 도심 속에서도 자연을 즐길 수 있었던 점도 정말 좋았어요. 다른 호텔들은 외곽에 위치해 있어서 이동에 시간이 걸리거나 번잡한 분위기였던 곳도 있었는데, 여기는 시내와 가까우면서도 조용하고 평화로운 분위기를 제공해 줘서 정말 좋았어요. 전체적으로 에이치에베뉴 덕진점은 가격 대비 정말 뛰어난 만족감을 주는 호텔이에요. 다른 호텔들과 비교했을 때, 청결하고 편안한 객실, 친절한 서비스, 그리고 아침 조식까지 모든 부분에서 만족스러웠어요. 특히 직원들의 친절함이 가장 기억에 남아요. 작은 디테일까지 신경 써주고, 편안하게 지낼 수 있도록 도와준 직원분들에게 감사드리고 싶어요. 덕분에 정말 편안하고 즐거운 시간을 보낼 수 있었어요. 또 하나의 장점은 덕진호 산책로가 가까워서 아침 산책을 즐기기 좋았다는 점이에요. 자연을 만끽하며 산책할 수 있는 여유로운 시간을 가질 수 있어서 더욱 좋았어요. 다시 방문할 의향이 충분히 있는 호텔입니다. 가격 대비 시설과 서비스 모두 좋았고, 주변 환경도 아늑하고 편안해서 여유로운 여행을 즐기고 싶은 분들에게 강력히 추천하고 싶어요.",5,3개월 전
y_126_011,에이치에비뉴 덕진점,조용하고소박한마닐라,"정말 좋아서 후기 남기러 왔어요ㅎㅎ일단 정말 청결했고 따뜻했고, 세면대가 2개인 것도 좋았어요. 요즘은 세면대가 침대 옆에 붙어있는 경우가 많은데 아예 욕실이 침실과 분리되어 있어서 좋았구요. 당일에 인원 추가있어서 말씀드렸더니 사장님이 정말 친절하게 처리해주셨어요ㅎㅎ조식도 깔끔하고 맛있게 차려져 있어서 아주 만족스러운 숙박이었습니다! 돈이 전혀 아깝지 않았어요! 담에 또 숙박하러 갈 마음 100% 입니당ㅎㅎ",5,5개월 전
y_126_012,에이치에비뉴 덕진점,용인낭만,"친절하신 사장님께서 룸을 업그레이 해주셔서 들어가면서부터 좋았는데, 방에 들어가자마자 작지만 커튼이 자동으로 열리는데 너무 좋아요. 침구상태 너무 좋고, 청소상태는 더 좋았습니다. 창문으로 보이는 덕진공원이 너무 이뻐요. 조식도 너무 과하지않게 손만가는 찬으로 구성되어 만족하였습니다. 또 한가지 팁은 요즘 슬로우조깅이 인기인데, 조용한 덕진공원을 도는것 추천드려요 1년에 2번 전주에 출장을 오는데, 저는 고정입니다. ♡♡♡",5,3개월 전
y_126_013,에이치에비뉴 덕진점,조용하고완고한머스터드소스,업그레이드해주셔서 기분좋앗네요 새로 리모델링해서 깔끔햇어요 가격대비 괜찮아용,4,7개월 전
y_126_014,에이치에비뉴 덕진점,땅끝관광지생김치,"들어가자마자 프론트에 계신 사장님이신지 직원분이신지 아무튼 너무 친절하셨어요 ...!!! 이렇게 친절하고 서비스 좋은 숙소는 더 잘되어야한다고 생각해요 ... ❤️ 늦은 시간에 방문했는데도 체크인 친절하게 도와주시고 룸 업그레이드도 해주셨어요!! 방도 정말 넓고 침대 두개, 세면대 두개, 변기 분리 화장실에, 자쿠지, 화장대에 어메니티까지 너무너무 만족스러운 숙소였어요 !! 연박으로 오래 묵고 싶은 숙소에요 ~ 사진엔 없지만 쇼파에, 큰 TV, 스타일러까지 없는 게 없는 숙소였답니다 ... ! 또 전북대 근처에 위치해있어서 근처 덕진공원, 전북대 번화가 거리까지 가까워요 ! 덕분에 덕진공원도 산책하고 번화가 나가서 술도 마시고 편하게 숙소 돌아와서 아침에 자쿠지도 즐겼어요 !! 다른 리뷰에 조식도 괜찮다고해서 가보고 싶었는데 늦잠자서 못 갔네요ㅎㅎ 다음에 또 방문해서 조식까지 경험해봐야겠어요 ! 전북대 근처 숙소는 무조건 에이치에비뉴 추천함니다!! 정말 만족스러웠어요 ... 별 다섯개 ⭐️⭐️⭐️⭐️⭐️",5,3개월 전
y_126_015,에이치에비뉴 덕진점,블루rose,프론트 직원분이 엄청 친절해요 내부도 깔끔하구 서비스가 좋았어요 다시오고싶어요 주차장도 넓구요 주위 산책로도 좋아요 꼭 추천해요,5,23일 전
y_126_016,에이치에비뉴 덕진점,경희사랑해,전주 출장으로 자주오는데 처음 찾는 호텔인데요. 숙소입구부터 청결이 느꼐지네요. 사장님도 친절하시고 직원분들의 웃는모습이 좋았어요. 숙소 청결은 침대 메트리스가 잠자기 좋았고요.TV도 화면이 큰편이라 시정하기 만족하고 욕실과 화장실이 불리되어 있어 좋았고요.청결상태도 너무 깨끗해서 만족합니다. 조식으로 약간의 한식과 빵과씨리얼이 우유가 있어 아침을 든든하게 만들어주어서 오늘 일하기 너무 좋아았어요. 다음에 전주을 찾는다면 꼭 다시 방문할 예정입니다.,5,1개월 전
y_126_017,에이치에비뉴 덕진점,Buckeye,"개시한지 3달밖에 안된 숙소라서 그런지, 흠 잡을 때 없이 깨끗하고 넓은 방을 이용할 수 있었어요. 샤워와 화장실이 일본식 마냥 나뉘어져 있어 편리했고, 샤워도 하나는 욕탕밖에, 또 하나는 욕조안에 있어 욕조사용도 편리. 침대도 퀸사이즈 두개가 있어 편히 쉴 수 있었고요. 스타일러도 있고, 냉장고도 꽤 큰걸로 새것이 비치되어 있네요. 창 밖의 덕진공원의 경치를 볼 수 있어 더욱 좋았고, 주변의 음식점들도 꽤 많아 골라 먹을 수 있어서 좋았어요. 강추합니다.",5,7개월 전
y_126_018,에이치에비뉴 덕진점,먕묭녕냥,"침구류도 푹신하고 룸안에 편한 소파와 테이블도있어서 앉아서 수다도떨고 밤에 야식먹기에 너무편했어요👍🏻 화장실 수압도 좋구요 방안에 스타일러도있어서 유용하게 잘사용했습니다☺️ 무엇보다 창밖에 덕진공원뷰가 너무예뻐요💕걸어서 코앞이라 저녁에 산책도갈 수있고 방안에서 예쁜야경볼수있어서 넘좋았습니당 조식포함이여서 아침에 조식먹으러갔는데 🔥조식이 너무맛있어요!!!!!🔥 제가갔을때는 돼지갈비,황태해장국,오징어호박무침,기타 반찬등이 있었는데 버릴것하나없이 너무맛있었어요 이거 외에도 시리얼이나 빵도있긴한데 저는 한식이 너무맛있었어요👍🏻👍🏻 출장오신분들은 꼭 여기 예약하셔서 아침밥묵고가셔야할듯....조식먹는공간도 넘깨끗하고 정갈해서 좋았어용 좋은추억많이남기고갑니당 또올게요!!!!",5,7개월 전
y_126_019,에이치에비뉴 덕진점,수상한은행강도,객실깨끗하고 조식 아주 좋아요. 맛있음.,4,1개월 전
y_126_020,에이치에비뉴 덕진점,남알아요동성,"침구류가 청결하고, 인테리어가 깨끗합니다.",4,2개월 전
y_126_021,에이치에비뉴 덕진점,아르미2,17개월아기랑 전주 놀러와서 1박 잘 쉬었다갑니다! 일단 너무 만족했어요! 저희는 프리미어방 예약했는데 체크인 할때 아기 있는거 보시고 룸 업그레이드 해주셨어요! 방에 들어오자마자 너무 좋은방 주셔서 너무 감사했습니다!!🙌🏻 덕분에 너무 잘 쉬었고 침대에서 꿀잠 잤어요! 아기도 편했는지 잘잤네요! 조식사진은 못찍었는데 아기때문에 조식있는곳으로 예약을 했고 조식구성도 한식이라 나름 만족하며 잘먹었습니다! 아기의자랑 아기수저는 없어서 아기있는분들은 참고하시길!! 숙소 바로 옆에 편의점도 있어서 간단히 뭐 사먹기도 좋았네요! 입실할때 주차도 안내하시는분이 봐주셔서 너무 좋았습니다 다음에도 전주 방문하게 되면 다시 올게요~~👍👍,5,7개월 전
y_126_022,에이치에비뉴 덕진점,운앙운앙,전체적으로 깨끗하고 깔끔하고 아늑했습니다~사장님?직원님 너무너무너무 친절하세요..!!!!! 진짜 세상에서 제일 친절하신것 같아요. 아침조식도 좋았습니다. 푸짐하고 영양가득히 준비 잘 되어있고요. 든든하게 먹고 힘내서 일하고 왔어요. 요청사항도 잘 들어주고 귀기울어 주시고 상냥하십니다. 방 상태도 먼지 하나없고 새 건물 느낌 났어요~!! 본관도 있고 신관도 있더라고요. 저는 신관에서 묵었어요~조식식당이 신관에 있던거로 기억이 나네요. 출장 마무리 잘하게 해주셔서 감사합니다,5,4개월 전
y_126_023,에이치에비뉴 덕진점,세계여행하기,"남도 여행중에 전주숙소찾다 여기에서 1박을. 우선 리모델링을 했는지 넘 깔끔했습니다. 룸도 업그레이드해 주셨는데, 넘 깔끔하고 좋았습니다. 추천합니다. 조식은 간단한 한식이었는데, 맛이 있어 좋았습니다. 반찬들이 다 맛이 있어요. 가성비에 맛에다 추천합니다. 하루 잘쉬었다가 갑니다~ 감사합니다.",5,1개월 전
y_126_024,에이치에비뉴 덕진점,rkrdus,침대는 적당히 쿠션감 있어서허리 아프지 않게 잠 잘잤고 다음날 일어나서도 어디 배기거나 하지 않았습니다. 스타일러 있어서 옷 깨끗하게 만들었고 티비도 화면 커서 보기 좋앗네요 숙소 주변 둘러보면서 동네 주변으로 둘러보고 이것저것 구경 할 게 많았습니다. 주변에 맛집 도 많이 있어서 맛집 검색해서 먹는 재미도 있네요 제일 만족스러운게 조식이었는데 돼지갈비 나오는 숙소 조식은 처음이었습니다. 전주 답게 반찬이 다 맛있고 돼지갈지 진짜 맛있게 먹었습니다. 식사 하는 곳이 신관 쪽이라 위치는 잘 알아보고 가셔야 합니다.,5,4개월 전
y_126_025,에이치에비뉴 덕진점,세인트루이스미어캣,전주 덕진공원 앞에 위치한 숙소로 주차장도 넓고 건물도 상당히 컸습니다. 원래 살던 곳에서 에이치에비뉴를 방문한 적이 있어서 좋은 기억을 갖고 숙소를 예약했는데 전주 덕진점에서도 좋은 추억을 만들고 가는 것 같습니다. 방에 스타일러도 구비되어 있어서 비즈니스 출장 뿐 아니라 여행으로 오신 분들도 사용하기에 매우 훌륭한 숙소라고 생각합니다. 방 자체가 새롭게 리모델링 된듯이 상당히 깔끔했으며 고객들을 생각한 인테리어라는 것이 느껴졌습니다. 바로 옆에 편의점도 있어서 편의성이 뛰어났으며 전북대의 대학로와도 거리가 가까워 차를 주차해두고 걸어서 방문하기에 충분했습니다. 다음에도 전주에 여행을 오게 된다면 다시 방문하고 싶은 숙소입니다.,5,7개월 전
y_126_026,에이치에비뉴 덕진점,꼬마돌내사랑아뵤,어무너무 실망..다시는 안오기로햇어요,3,13일 전
y_126_027,에이치에비뉴 덕진점,창의적이고유머러스한망건,객실이 너무 이쁘고 무엇보다 깨끗해요! 직원들도 다 착하고 하나하나 설명도 자세히 해주셔요😊 전주 오면 여기로 올 거 같아요👍 룸 업그레이드 해주셔서 덕분에 편하게 잘 쉬다 갑니다~,5,4개월 전
y_126_028,에이치에비뉴 덕진점,쪼바오,"원래 예약했던 방보다 훨씬 좋은 방으로 업그레이드 해주셨어요! 정말 저렴하게 10만원 초반대로 예약했는데 실제 머물렀던 방은 거의 30만원대 수준이었습니다. 안내해주신 직원분들도 정말 친절하게 응대해주셨고, 조식도 맛있었어요~ 담에 또 오겠습니다^^",5,7개월 전
