id,name,nickname,review_content,rating,write_date
y_126_029,에이치에비뉴 덕진점,우주건빵,"일단 프론트에서 너무 친절하게 체크인 응대 해주셔서 기분이 좋았는데, 룸까지 업그레이드 해주셔서 기분이 두배로 행복했습니다😃😃 호텔은 신관으로 들어갔는데 내부도 너무 깔끔하고 샤워실과 화장실도 칸으로 잘 나누어져 있어서 친구와 함께와도 와도 불편함이 없었어요!! 티비도 엄청크고 스타일러도 있어서 정말 좋았던 것 같아요 :) 조식까지 야무지게 먹고 잘 놀다 갑니당!!",5,4개월 전
y_126_030,에이치에비뉴 덕진점,틀림없는핵무기,깨끗하고 쾌적했습니다,5,7일 전
y_126_031,에이치에비뉴 덕진점,daulnou,"편하게 잘 쉬었다 갑니다~ 조식도 깔끔하게 나오고 맛도 맛있었어요 ㅎㅎ 담에 또 방문할께요 ^^ 덕진공원도 있어 산책도하고 ,GS25편의점도 GOOD 인테리어도 깔끔하게 잘되어있습니다 로비에 계신분들도 친절하시고 방문하시면 후회는 안하실꺼예영 ㅋㅋ",5,2개월 전
y_126_032,에이치에비뉴 덕진점,침대테스터,방도 스위트룸으로 업그레이드 시켜주시고 너무 좋았습니다 방도 깨끗하고 세면대가 무려 2개나 티비에 넷플릭스나 유튜브 같은 시설도 되어있고 바로 앞에 편의점도 있어서 좋았습니다,5,6개월 전
y_126_033,에이치에비뉴 덕진점,온화하고창의적인집적도,직원분이 친절하게 응대해서 맞이해주시고 방도 넓고 너무 깨끗해서 만족스러워요~시설도좋고 주차도 편하고 추천이용^^,5,7개월 전
y_126_034,에이치에비뉴 덕진점,일흔다섯뿅,예약한 숙소보다 좋은 방으로 업그레이드 시켜주셨어요! 덕분에 더 좋은 1박하고 왔어요ㅎㅎ 배달 시켰는데 일회용품을 깜박하고 안 시켰는데 부탁드리니 일회용 숟가락도 챙겨주셨답니다 다음에 또 올게요!!,5,9개월 전
y_126_035,에이치에비뉴 덕진점,규하다,출장와서 이용했는데 좋아요,5,29일 전
y_126_036,에이치에비뉴 덕진점,규하다,출장와서 이용했는데 좋아요,5,29일 전
y_126_037,에이치에비뉴 덕진점,반짝반짜코속도로,객실이 신관이라 그런지 깨끗하고 직원분 안내도 친절하고 좋았습니다,5,1개월 전
y_126_038,에이치에비뉴 덕진점,eunnnnl,신관 이용했는데 다음에도 올 것 같아요. 신발 벗고 들어가자마부터 합격! 맨발로 바닥 걸어도 하나도 안찝찝하구요.. 깨끗하고 고급지고 기분 좋게 잘 묵고 갑니다~~ 정장 입고 친절히 맞아주셔서 고맙습니다^0^,5,8개월 전
y_126_039,에이치에비뉴 덕진점,충장로웰시코기,"아이 데리고 투숙하였는데, 모자랄 수 있다며 수건과 어메니티도 미리 요청전에 챙겨주셨고, 전체적으로 아주 깨끗하고 인테리어도 좋았어요~ 전주에 또 놀러간다면 재이용할 의사 있습니다~ 다만, 조식은 조금만 더 신경써주시면 좋을거 같아요~^^",5,8개월 전
y_126_040,에이치에비뉴 덕진점,2121225,깔끔한 시설 덕분에 편안하게 쉬다 가요~,4,7개월 전
y_126_041,에이치에비뉴 덕진점,강렬하고유머러스한껌정,항상 전북대 근처 숙소 예약할때면 여기만 찾게 됩니다. 너무 청결하고 신축이라 객실 내 불쾌한 냄새도 없고 무엇보다 프론트 직원분들이 너무 친절하십니다. 주차공간도 여유로워서 모든게 완벽한 숙소같아요. 다만 몇몇 객실에 넷플릭스 로그인이 안되어있는것만 고쳐주시면 더 완벽할 것 같습니다! 항상 잘 이용하고 있습니다🙂,5,5개월 전
y_126_042,에이치에비뉴 덕진점,감감한허물,전주에 또 방문하게 된다면 무조건 올듯하네요,5,1개월 전
y_126_043,에이치에비뉴 덕진점,조용하고신나는북극곰,내외부가 깔끔해서 전주에 올때마다 항상 들리는 숙소입니다. 방도 업그레이드 해주셔서 항상 편안하게 쉬고 갑니다.,5,2개월 전
y_126_044,에이치에비뉴 덕진점,백김치김치구이,방이 엄청 깔끔하고 침대 푹신푹신해서 좋아요 프론트 직원분들도 친절하시고 생각치도 못하게 룸 업그레이드까지 받아서 더욱 기분좋은하루였네요 출장 온 회사만 가까웠다면 계속 여기서 묵고 싶을만큼 너무 만족스러웠습니다,5,9개월 전
y_126_045,에이치에비뉴 덕진점,블루레드퍼플,"주차편함, 방간 소음이 안되네요.ㅠ 일회용품은 품질이 좋았어요. 수압도 좀 약했어요. 배달을 문앞까지 받는건 좋았어요. 난방이 약한건지 객실이 너무 추웠어요.",5,8개월 전
y_126_046,에이치에비뉴 덕진점,내장산불도그,사진을 못찍었는데 여태 썻었 숙소중에 거의 탑으로 좋았습니다!화장실 청결은 물론이고 특히 침구류가 좋은건가 매트리스가 좋은건가 모르겠는데 푹 자고 일어났습니다!그리고 조식도 맛있게 잘 먹었어요 다음 전주 여행때도 꼭 이용 할게요~~,5,3개월 전
y_126_047,에이치에비뉴 덕진점,리치쫑,조용하고 시설이 훌륭합니다.,4,4개월 전
y_126_048,에이치에비뉴 덕진점,정주렁주렁이,"잘쉬고왔습니다.실내도,깔끔하고,아늑했어요",5,1개월 전
y_126_049,에이치에비뉴 덕진점,진중하고자신감있는데이터,숙소도 매우 청결하고 깔끔해서 편하게 묵다 갑니다! 다음에 또 전주에 오게 되면 다시 이용할 것 같아요.,5,7개월 전
y_126_050,에이치에비뉴 덕진점,여기어때고객님,정말 깨끗하고 친절하고 전반적으로 좋아요,5,2개월 전
y_126_051,에이치에비뉴 덕진점,귀족적인사령관,늦은 시간 체크인이었는데 문제없이 친절하게 응대 해주셨고 시설도 너무 깔끔하고 좋았습니다,5,4개월 전
y_126_052,에이치에비뉴 덕진점,체리먹는여우,3명이서 묵었는데 너무너무 쾌적하고 좋았어요!!! 전주에 여행 오시는 분들께 추천드립니다!,5,4개월 전
y_126_053,에이치에비뉴 덕진점,이한제,군더더기없는 조식 깨끗한 침구류 친절하신 직원분들 아기포함 세식구 너무잘쉬고갑니다!!,5,3개월 전
y_126_054,에이치에비뉴 덕진점,lhslhslhslhs,룸 업그레이드 해주셔서 너무 편하게 묵었어요! 깨끗하고 냄새도 안나고 너무 좋았습니다,5,3개월 전
y_126_055,에이치에비뉴 덕진점,미시적인패악,밤에 예쁜 덕진공원 바로 옆에 위치해서 산책도 할 수 있고 너무 좋았습니다! 생각보다 외관도 내부도 깔끔하고 깨끗하고 좋아서 기대 이상이였어요 안내해주신 직원분도 친절하시고 예약했던 방에서 업그레이드 해주셨는데 덕분에 더 기분좋은 여행을 즐기고 왔습니다ㅎㅎ 고데기도 있어서 섬세함에 놀랐네요.. 여자분들 챙겨가지 않으셔도 됩니다~~ 한옥 마을 택시 10분이면 갑니다 오히려 조용하고 한적해서 좋아요 추천합니다~~~,5,5개월 전
y_126_056,에이치에비뉴 덕진점,독도전망대노름,쾌적함 친절함 조식은 집밥같음 갈비 맛있음,5,7개월 전
y_126_057,에이치에비뉴 덕진점,다정하고자신감있는102세,너무 깨끗하고 친절했습니다. 출장 후 뜨거운 물로 목욕하니 피곤도 풀리고 스르르 잠들었네요 근처 출장오면 또 묵을겁니다. 최고~!!,5,6개월 전
y_126_058,에이치에비뉴 덕진점,32세반디불,깨끗하고 포근한 숙소 강추 ! 조식 ! 만족 !,5,4개월 전
y_126_059,에이치에비뉴 덕진점,엄청나고창의적인유람선,너무 깨끗하고 직원분도 너무 친절했습니다. 웬만한 대형 호텔보다 훠얼씬 좋습니다!! 만족 대만족 또올게요,5,7개월 전
y_126_060,에이치에비뉴 덕진점,조조마,깨끗하니 좋네요...간단히 조식도 좋구요,5,7개월 전
y_126_061,에이치에비뉴 덕진점,jaewon07,너무 좋았어요~ 또갈게요,5,4개월 전
y_126_062,에이치에비뉴 덕진점,고산보조MC,출장으로 묵었는데 괜찮았습니다.,5,9개월 전
y_126_063,에이치에비뉴 덕진점,조용하고기대하는김초밥,깔끔하고 쾌적했습니다.,5,3개월 전
y_126_064,에이치에비뉴 덕진점,8303660,숙소가 깔끔하고 너무 친절하셔서 또이용하고 싶습니다,5,3개월 전
y_126_065,에이치에비뉴 덕진점,가쟈아자아자,깔끔하고 너무 편하게 쉬었어요 ㅎㅎ,5,5개월 전
y_126_066,에이치에비뉴 덕진점,운앙운앙,전체적으로 깨끗하고 깔끔하고 아늑했습니다~사장님?직원님 너무너무너무 친절하세요..!!!!! 진짜 세상에서 제일 친절하신것 같아요. 아침조식도 좋았습니다. 푸짐하고 영양가득히 준비 잘 되어있고요. 든든하게 먹고 힘내서 일하고 왔어요. 요청사항도 잘 들어주고 귀기울어 주시고 상냥하십니다. 방 상태도 먼지 하나없고 새 건물 느낌 났어요~!! 본관도 있고 신관도 있더라고요. 저는 신관에서 묵었어요~조식식당이 신관에 있던거로 기억이 나네요. 출장 마무리 잘하게 해주셔서 감사합니다,5,4개월 전
y_126_067,에이치에비뉴 덕진점,날씬날씬한잡종견,"들어가는 입구나 엘르베이터 모두 쾌적해서 시작부터 나쁘지 않았 습니다. 실내는 생각보다 넓어서 편하게 사용했구요, 샤워실이 조금 불편한것 빼고는 욕실도 좋았습니다. 편하게 쉬다가 갑니다. 들어가는 입구나 엘르베이터 모두 쾌적해서 시작부터 나쁘지 않았 습니다. 실내는 생각보다 넓어서 편하게 사용했구요, 샤워실이 조금 불편한것 빼고는 욕실도 좋았습니다. 편하게 쉬다가 갑니다. 들어가는 입구나 엘르베이터 모두 쾌적해서 시작부터 나쁘지 않았 습니다. 실내는 생각보다 넓어서 편하게 사용했구요, 샤워실이 조금 불편한것 빼고는 욕실도 좋았습니다. 편하게 쉬다가 갑니다.",5,5개월 전
y_126_068,에이치에비뉴 덕진점,라유유유,방이 너무 깔끔하고 직원분들도 친절해서 기분좋아지는 숙소였어요 다음에 전주오면 또 이용하고싶네요!,5,1일 전
