id,name,nickname,review_content,rating,write_date
y_145_001,전주 한옥 몽유화원,총명하고평범한무선인터넷,장점:가격대비 묵을 수 있다 한옥 느낌을 느낄 수 있다 거리가 예쁘다 (아침에) 물이 잘 나온다 단점:위생이 너무 좋지 않다. 백번 양보해서 바퀴벌레는 습해서 있었다고 해도 머리카락들과 닦이지 않는 먼지들..정말 깜짝 놀랐습니다. 이런곳은 처음입니다;;;; 청소를 하시는지 안하시는지 모를정도로 여기서 하루니까 다시는 오고 싶지 않습니다. 화장실 신발도 필히 교체하셔야할 것 같습니다.. 그리고 주변에 먹거리가 없습니다 드라이기가 망가져서 사용할 수가 없었습니다 -궁금한건 토요일은 왜 조식이 다르죠? (구운계란은 있지도 않았습니다..답장도 없으시고),1,8일 전
y_145_002,전주 한옥 몽유화원,탱탱한우주레인저,한옥마을 숙소 찾다가 찾게된 곳! 게스트 하우스 인줄은 모르고 예약했는데..오~ 옛날 집 체험 같은 느낌으로 재밌게 자고 왔어요~ 못 찾으실까봐 집 방향을 문자로 사진을 보내주시니 찾는거 불편하지 않았어요. 비치 되어있던 컵 라면도 아침에 든든하게 먹고오고 담엔 잘 지내는 3커플도 함께 가보고싶어요~~^^,5,3개월 전
y_145_003,전주 한옥 몽유화원,여기어때고객님,부모님 숙소로 잡아드렸는데 화장실이 조금 작은 거 빼고는 사장님도 친절히 마중 나와주시고 아기자기 잘 꾸며진 분위기에 따뜻한 침대에 편안히 잘 쉬고 오셨다고 하네요~ 물도 잘 나오고 조용한 곳이라고 하셨어요. 잘 챙겨주셔서 감사합니다 번창하세요~!,5,1개월 전
y_145_004,전주 한옥 몽유화원,서나v,사장님이 너무 친절하셔서 아이들과 편하게 1박 묵고 왔어요! 비가와서 좀 습하긴 했지만 나름 운치 있었네요^^~,4,2개월 전
y_145_005,전주 한옥 몽유화원,천칭자리부대장,"사장님 내외께서 계란도 삶아주시고, 라면도 비치해 주시고, 저희 딸을 위해 주변에 갈 곳도 추천해 주시고, 친절히 대해주셔서 정말 감사했습니다. 방도 포근하고 좋아요 전기장판도 따뜻따뜻",5,4개월 전
y_145_006,전주 한옥 몽유화원,므냑ll,인원 추가해서 총 7명 이용했는데 큰 침대 두 개도 있고 바닥에 이불 깔고 누울 수 있어서 나쁘지 않았습니다! 주인 분들도 친절하고 좋았어요 아쉬운 점은 현관문 쪽까지 커튼을 칠 수 없어서 거실은 외풍이 좀 심했습니다 ㅠㅠ 그래도 온도 올려서 바닥 따뜻하게 하고 이불 덮으면 괜찮았어요,5,5개월 전
y_145_007,전주 한옥 몽유화원,후우니아빠,가족여행을 따뜻하게 잘 보내고 왔습니다. 만화책도 보드게임도 있어 좋았습니다. 작은 정원도 있어 아이가 너무 좋아했습니다. 다만 4인이 지내기에 방이 좀 작은 편이었습니다.,4,8개월 전
y_145_008,전주 한옥 몽유화원,썩썩한순두부찌개,가족들과 편리하게 묵었어요 감사합니다,5,11개월 전
y_145_009,전주 한옥 몽유화원,유머러스하고친숙해진시외버스,사장님이 너무친절하시고 덕분에 잘쉬었다가 갑니다^^ 전주오면 또올게요~ㅎㅎ,5,7개월 전
y_145_010,전주 한옥 몽유화원,엄지공주수연,좋은추억남기고갑니다 방도따뜻하고 한옥마을이랑가까워서좋았어요~,5,7개월 전
y_145_011,전주 한옥 몽유화원,66세도주병,즐겁게 잘 쉬다가 갑니다.,5,7개월 전
y_145_012,전주 한옥 몽유화원,전주성지킴이,제집처럼 편하게 쉬다갑니다~침구상태 넘 좋구요 고즈넉한게 넘좋았어요 서비스로 준비해.주신 구운계란 남김없이 다 잘먹었습니다.담에 또 올께요~,5,10개월 전
y_145_013,전주 한옥 몽유화원,빠다돌고래,거실을 공유하는 형태여서 처음엔 당황했지만 아늑하고 좋았어요ㅎㅎ 배란다 같은것도 있어서 안답답했어요,5,2년 전
y_145_014,전주 한옥 몽유화원,6064156,"급하게 결정한 여행지에서 정말 깨끗하고 편안한 한옥게스트하우스를 만났습니다. 아담하고 아기자기하면서도 곳곳에 작품들까지 전시되어있는 몽유화원 게스트하우스 너무너무 맘에들었어요 !! 아담하고 소박해서 작고 예쁜 공간에서 도란도란 푹 쉬고싶었던 저희 자매에게는 더할나위없이 좋았습니다. 특히 가격이 너무너무 착해서 약간 믿기지 않았달까.....???🤔😶하지만 진짜 요렇게 가성비 좋은 게하는 진짜 찾기힘들다눈고....♡ 시설도 한 객실을 제외하고는 전부 화장실이 방 내부에 있구, 모든 구석구석 청결에도 신경써주신 덕분에 너므 만족스럽게 묵었습니다. 심지어 눕뷰(누워서 보는 뷰☆)도 맘에들었슴다 천장이 높아서 탁트인 느낌..! 야시장하고 한옥마을 볼거라고 했더니 사장님이 책자도 들고가라고 챙겨주시고, 추운 날씨에 차도 마실 수 있게 준비해주셨어요..! 아늑하고 따뜻해서 친구들끼리와도 가족들끼리 와도 만족스러울 것 같습니다. ☺😻",5,7년 전
y_145_015,전주 한옥 몽유화원,3887161,미술관에 다녀온듯한 게스트하우스! 시설도 깨끗하고 무엇보다 다리하나 건너면 한옥마을 이라 접근성도 정말 좋았습니다^-^ 준비해주신 조식토스트와 차도 좋았고 이모저모로 배려가 많이 담긴 게스트하우스 였습니다~ 첫날 가방이 너무 무거워서 숙소에 맡기려고 체크인시간보다 빨리 도착할 수 밖에 없었는데 ㅠㅠ 사장님(작가님)과 사모님(안주인)이 너무너무 친절하게 맞아주셔서 정말 감사했습니다! 가을이라지만 아직 더워서 땀을 주룩주룩 흘리는 저희를 위해서 시원한 오미자차도 준비해주시고 작가님께서 작품설명도 해주시면서 작업실도 보여주신 덕분에 더 특별하고 완벽한 전주 여행을 할 수 있었습니다~,5,7년 전
y_145_016,전주 한옥 몽유화원,myhi0813,인터넷검색하다 예약하게 되엇습니다 전주 한옥마을 부근 주차하기 힘든거 같아 숙소부근에 세우구 가려구 미리 숙소부근에 갓는데 마침 몽유화원 사장님이 연락주셔서 게스트하우스앞에 주차를 하고 편히 한옥마을 구경하엿습니다~ 친절하신사모님!! 날이 겨울날씨답지 않게 푸근해서좋앗구요 한복대여 인터넷으로저렴히 대여해서 잼나게 다녓습니다~ 야시장서 먹거리구입 일찌기 컴백 조식으로 사과 계란 요쿠르트 나와서 맛나게 먹엇습니다~방은 인터넷상과 같이 깔끔하구 이뻣습니다 방도온돌방 절절끓어 따끈따끈히 ....좀아숩다면 화장실이 좀 추웟네요 ㅡㆍㅡ 잼난여행하고 왓습니다 여행할때마다 이사이트 이용하는데 매번 후회없엇네용 감사합니다,4,6년 전
y_145_017,전주 한옥 몽유화원,4765329,"입구에서 왼쪽에 있는 몽방을 이용하였는데 보일러 빵빵하게 틀어주셔서 제대로 찌졌습니다. 주택이다보니 다소 운풍은 존재하나 바닥의 뜨끈함이 만회하였고 화장실이 딸린방이었는데 화장실바닥도 뜨끈하였습니다. 기본적인 샤워도구는 있으나 개별적으로 챙겨가는것이 좋고 아침에 사과, 토스트, 날계란이 냉장고에 있어서 날계란은 싱크대에 있는 냄비에 삶아서 먹고 사과는 깎아먹고 식빵은 토스트해서 쨈발라먹고 오미자차원액이 있어서 잘 타마셨습니다. 건조한 날씨다보니 수건에 물적셔서 주무셔야 할거예요 샤워실과 화장실이 같이 있다보니 다소 좁을수도 있지만 충분히 씻을수있어요. 남부시장과 한옥마을을 걸어갈 수 있는거리다보니 가격저렴하게 잘 이용할 수있는 게스트하우스였습니다.",5,7년 전
y_145_018,전주 한옥 몽유화원,15270375,제가 사용한 방은 화장실이 따로(그 방 전용) 있었습니다. 사용하는데 특별한 불편함은 없었고요 조용한 분위기에서 썼습니다. 방마다 방문 밖에 자물쇠가 있어서 짐 풀고 나갈 때 분실물 걱정은 안해도 될것 같더라구요.(비밀번호는 주인분께서 가르쳐 주십니다) 아침 조식으로 컵라면이랑 요구르트 제공해주시는데 저는 한옥마을에 식당에서 먹고싶어서 안먹고 그냥 나왔습니다. 아 제가 쓴 방은 큰 방이 아니라서 에어컨 틀면 금방 시원해지더라구요.,4,3년 전
y_145_019,전주 한옥 몽유화원,haichauvu,"1. 원래 몽실(2인실)을 예약했지만 별1(2인실)로 업그레이드돼었어요. 방이 가격보다 넓고 따뜻하고 깨끗해요. 이집은 방 3개 별1실, 별2실 하고 별3실만 있어요. 2. 주방에 시설이 너무 좋아요. 사진를 보시다시피 공기청정기, 전자렌지, 정수기, 토스트기, 전자주전자, 식기류가 다 있어요. 근데 가스렌지나 냄비 없어요. 3. 사장님도 너무 친절하시네요. 우리가 외국인이라서 시설이 다 자세히 설명해주시고 아침에 사과이랑 롤케으크 챙겨주셨어요.",5,6년 전
y_145_020,전주 한옥 몽유화원,5017318,후기남길께요 2박3일 일정 딸이랑 같이 둘이 전주여행 가장 저렴하면서도 예쁜 원실로 선택 도착하고 나서 사장님께서 제가 선택한 원실은 춥다고 몽실로 변경해 주셔서 정말 감사합니다 제가 선택한 원실은 화장실이 거실에 있는 곳으로 후기나 방소개에서도 이미 보고 알고 있어서 사용해도 개의치 않았는데 직접 보니까 변경해주신 몽실이 화장실이 안에 있어서 더 편하기는 하더라구요^^ 29~1일까지 저희만 묶었어요 방안에 보일러 잘 넣어 주셔서 정말 따뜻하게 지냈고 아무래도 한옥이라 웃풍이 있긴 한데 계속 서서 돌아다니거나 하지 않기에 그 정도는 괜찮았어요 한옥이 원래 웃풍있다던데 확실하게 맞는 듯 싶어요 한옥마을까지 징검다리 건너가면 5분안에도 가겠더라구요 위치 완전 좋고 주변에 3분거리 정도에 편의점이나 식당 카페도 많아서 밤에 혹시라도 배고프면 바로 나가면 되요 그리고 10분정도의 거리에 남부시장도 있어요 조식은 2박3일동안 없었어요 대신 냉장고에 계란이 있다고 삶아 먹으라 하셨는데 한옥마을에서 간식거리를 많이 사와서 아침에 먹었던지라 조식을 주셨어도 안먹었을 것 같아요 다음 재방문 의사 있어요^^ 사장님 정말 감사했어요,5,6년 전
y_145_021,전주 한옥 몽유화원,에피카나,급하게 예약하고 방문한곳이라 큰기대는 없었습니다 저렴한 가격에 하루 묶고 전주한옥마을을 가려고 했던거라 저렴한 가격과 한옥마을 접근성 주차여부 아기와 함께라 가능한지를 찾아보던중 찾던 숙소 입니다. 도착후 반겨주시는 사장님은 정말 친절하시고 선한인상을 주셨어요~또한 다른사람과 방이 곂치지 않게 기존예약한 룸도 다른곳으로 옮겨주시고 세심히 챙겨주시는게 느껴지더라구요 옮겨주신곳에서 바베큐가 가능하다 했는데 독립적인 공간에서 가족과 오붓하게 즐길수 있어서 너무 좋았습니다. 다만 우풍이있어서 방바닥은 따듯하네 좀 춥긴햇어요 그래도 저녁을 너무 분위기 있게 먹을수 있어서 너무 좋았습니다!! 번창하세요,5,3년 전
y_145_022,전주 한옥 몽유화원,5856231,조용하고 아늑한 분위기에 인테리어가 고풍스러워서 좋았어요!!!,5,6년 전
y_145_023,전주 한옥 몽유화원,철목개화,아기자기하고 예쁜 게스트하우스라서 기억에 많이 남습니다. 화방에 걸린 큰 그림이 아직도 생각나네요. 방에 화장실이 있어서 편리했습니다. 냉장고나 가스레인지 이런게 있어서 간단한 취사도 가능하구요. 수건도 챙겨주셔서 편리했습니다. 다만 방 앞에 마당이 있어서인지 날이 더워져서인지 방에 작은 불개미가 출몰해서 사알짝 놀랐어요ㅋㅋㅋ벌레를 싫어하신다면 유의해주세요ㅜㅜ어쨌든 화가의 방이라는 예술마을 감성에 적합한 게하였습니다. 좋은 경험하고 가요!^^,4,6년 전
y_145_024,전주 한옥 몽유화원,대동여지도,"한옥마을과 가깝고. 인근 초등학교옆 주차장 이용할수 있어 편리함. 방은 사진보다 작다고 생각됬고. 침구류 청결상태, 욕실상태는 보통임.",4,7년 전
y_145_025,전주 한옥 몽유화원,콕콕24,"당일예약하고갔는데, 룸업그레이드도 시켜주셨어요~ 한옥 특성상 작은 벌레가 좀 나오긴했는데 불편함없이 잘 쉬고왔어요~",4,4년 전
y_145_026,전주 한옥 몽유화원,한데인,원실에서 2인 숙박했어요 ! 체크인도 친절하게 해주시고 늦게 입실했는데도 어려움없이 들어갈 수 있었어요 :) 원실의 경우에는 방밖에 별도로 화장실이 있었네요 ㅎㅎ 인테리어는 진짜 예쁘고 아기자기 해서 좋았어요 객실크기가 아담한건 문제가 아니었지만 작은 객실이니 만큼 환기나 먼지 문제가 취약하기 마련인데 에어컨 상태보고 잠을 도저히 못자겠더라고요.. 먼지 가득한 객실에 시원한 바람사이로 나오는 에어컨 냄새가 답답해서 봤더니 .. 에어컨 청소는 해주셔야 될 것같아요 ㅠㅠ 결국 문열고 자고 다른 분들이 안계셔서 공용 거실에서 머무는 시간이 길어졌어요 저희가 묵을때는 저희 뿐이어서 상관없었지만 다른 분들도 계셨다면 방안에서 먼지 때문에 잠도 못잤을 것같아요 .. 쪼금 아쉽네요 그래도 잘 묵고갑니다ㅎㅎ,3,5년 전
y_145_027,전주 한옥 몽유화원,뎅그랑,깨끗하고 조용한 곳에서 잘 쉬다 왔어요. 아기자기 너무예쁜 곳이예요. 독채 빌렸는데 5명이상도 가능할듯.추가요금은 있겠지만요. 만약에 지인이 한옥마을 간다하면 추천해주고 싶은 곳 입니다. 숙소에서 한옥마을까지 걸어서 5분거리도 안되는 가까운 곳. 주차하고 한옥마을 구경해도 될듯해요.,5,1년 전
y_145_028,전주 한옥 몽유화원,zmaleich,"본채가 아닌 별채에 묵었습니다. 한옥 느낌이 나는 가정집 같은 곳이었습니다. 사진에 있는 그림을 보고 싶어서 일부러 별채로 예약했는데 실제로 그림 보니까 더 좋았습니다. 샴푸린스겸용과 바디워시, 샤워볼, 치약은 비치되어 있고 개인이 사용하는 칫솔, 면도기는 챙겨 가야 합니다. 생수는 따로 비치 되어 있지 않고 정수기물 을 사용하시면 됩니다. 조식 시간은 따로 정해진 건 없고 공용 냉장고안에 비치해두신 요구르트와 라면 잘 먹었습니다.",5,3년 전
y_145_029,전주 한옥 몽유화원,슬짱,"*몽유화원* 유실 3인. 우선 참고 하실 점은 방이 매우 작음. 세명이서 바닥에 쪼르르 누우면 끝날 방임.그리고 방음이 부족함. 화장실에서 숨 쉬어도 들림.(방구 튼 친구들이랑 가세요) 친구들끼리 방만 거기서 잠만 자고 나가서 놀 생각으로 숙소를 잡은 것이라 저희는 상관이 없었음. 있다보면 마치 아담한 내 방에 누워있는듯한 편안함을 느낄수 있어서 처음 가는 곳 임에도 편히 쉴 수 있었음. 다음에 마음이 쉴 휴가가 필요할 때 혼자라도 예약해서 쉬고 싶은 마음이 드는 곳 입니다. 처음엔 저희가 처음 도착하는 때라 약간 썰렁했는데 보일러 틀고 좀 있으니 화장실 바닥까지 따뜻해서 깜짝 놀랐어요~ 다음 날 아침에 간단한 먹을 거리 나옴. // 방 내 구비물품 (화장실 있음) : 샴푸,린스,바디워시,휴지,수건,이불,드라이기, 상반신거울, 탁상용작은거울,책 몇권,에어컨,작은히터(엄청 뜨신바람 잘 나옴) // 부엌 내 구비물품 : 정말 귀엽고 예쁜 찻잔들 엄청 많음, 정수기,토스트기,가스렌지, 냉장고(달걀있음),봉지커피,그 외엔 사용하고 싶은게 없어서 더 안봄. // 거실 구비 물품 : 큰 에어컨, 개인 신발장 없음. 컴퓨터. // 부엌 옆 화장실 : 방 화장실과 동일한 제품 구비. ㄴ그 앞 진열대 : 린유, 렌즈깍,페브리지, 헤어롤, 빗,일회용 칫솔, 오 이런 것 까지? 이런저런거 . // #몽유화원 입실 3시~6시, 다음날 퇴실 11시 주소:완산구 서서학동 186-1.(몽유화원)",5,6년 전
y_145_030,전주 한옥 몽유화원,치키룩,거실에 싱크대와 냉장고가 있어서 음식물 관련해 식기나 간단한 과일 씻어 먹을 수 있어서 좋아요 일반 게스트하우스 느낌보다는 게하로 깨끗하게 꾸며놓은 가정집 같다는 느낌이 듭니다 무엇보다 화가엔 주인분 그림을 방에서 감상할 수 있는 게 좋았어요 숙소 금처에 있는 갤러리는 시간상 못 들르고 왔는데 다음에 들르고 싶네요 방이 넓지는 않지만 깨끗하고 문이나 다른 시설이 견고한 느낌이라 추천합니다,4,3년 전
y_145_031,전주 한옥 몽유화원,8173289,급으로 숙소를 구하게 되었는데 기대이상으로 만족해요! 사장님의 온화한 미소와 친절한 동네 설명. 그리고 안부(?)를 여쭈어주시고 피드백을 주시는 센스까지! 한옥마을도 가깝고 야시장하고도 거리가 가까워요 그리고 무엇보다!! 한 곳에 다른 방이 3개나 있었는데도 화장실 세면대 물소리 말고는 소음이 전혀 없었어요 그리고 아침에 넉넉한 조식까지^^ 깨끗하고 조용하고 친절하고!! 작은 공방(?)미술관(?)도 운영중이셔서 작품을 감상할 기회까지!! 아! 방에도 작품이 걸려있어요 무튼 대만족입니다!^^ 덕분에 즐거운 여행 마무리했어요 감사합니다^^,4,6년 전
y_145_032,전주 한옥 몽유화원,효블리이이이,"저희 커플은 여름에 이용했어요. 청결이 안좋다, 벌레가 많이 나온다 등의 후기가 많아 예약할 때 고민했었는데 그런 후기가 있어 주인분께서 관리를 더 잘해놓으셔서 그런지 이용하는동안 방을 가던 화장실을 가던 부엌을 가던 “불청결하다”라는 느낌은 전혀 받지 못했고 오히려 “신경을 하나하나 많이 써서 깨끗하다”라는 느낌을 많이 받았어요. 처음에 방이 좁아서 놀란건 사실이었지만 한옥 이라는 점을 두고 체험하러 왔다는 마음가짐으로 예약한거라 저희는 불편함이 없었어요. 캐리어 하나 펼치기에도 괜찮은 크기였구요. 아침에 컵라면과 구운계란을 먹을 수 있어서 좋았어요. 리뷰를 봤을때보다 시끄럽지 않았어요. 한옥 구조이다 보니 서로 조심하는것 같아서 시끄럽지 않았던것 같아요. 크고 넓고 방음 잘되는 숙소를 원하시면 호텔가시거나 한옥 스테이는 버리셔야 할것 같아요. 저희는 한옥을 마음껏 느끼고 싶어 이 숙소를 예약했고 너무 좋았어요. 안심이 되었던게 체크인시 주인분께서 맞이해주셔서 너무 좋았어요. 다음에 전주에 방문하게 되면 또 이용하고 싶어요. 전주 한옥마을이랑 가깝고 가격도 좋았어요. * 저희가 사용한 숙소는 wha room 이었어요.",5,1년 전
y_145_033,전주 한옥 몽유화원,5851336,원실이용했습니다. 원실은 잔용화장실이 있긴한데 밖에있어요~ 방은 예상대로 매우 좁습니다 겨울엔 한옥이 역시나 춥네요~ 한옥마을과도 거리 10분정도 떨어져있습니다 하지만 객실은 작가님 작품으로 꾸며져 있어서 예쁩니다~아침에 조식으로 빵과 사과 차 요구르트 주셨어요~ 조용히 하룻밤 자기 나쁘지 않네요~ 남문시장이 가까워서 먹부림 하기 좋습니다,4,7년 전
y_145_034,전주 한옥 몽유화원,르*****,"1. 방이 정말 좁습니다. 2. 화장실이 분리되어 있는데 물이 잘 안 내려가고 온수도 잘 안 나와서 불편했어요. 3. 결정적으로 여성분들끼리 가신다면 정말정말 비추합니다. 방음도 잘 안되고, 무엇보다 방문이 엄청 뻑뻑해서 잘 안 닫힙니다. 문을 꽉 닫지 못한 제 불찰도 있지만, 아침에 눈 떴을 때 어떤 아저씨가 방문 틈 사이로 지켜보고 있었습니다. 소름 그 자체였어요. 다시는 경험하고 싶지 않습니다.",2,2년 전
y_145_035,전주 한옥 몽유화원,블루라벨09,급작스럽게 가게된 전주여행..한옥마을은 너무 시끄러워서 주변 숙소 찾아보다가 발견한 숙소입니다.사장님이 작가님이시라 방에 끔직한 그림이 있고요..주변이 다 그렇지만 오래된듯한 집이지만 관리를 잘 하셔서 내부는 무척이나 깨끗합니다.침구류도 냄새 나지 않고 깨끗하고.온돌방은 근방 온도가 올라가서 따뜻하게 잘 잤습니다.너무더워서 새벽에 보일러를 많이 줄일 정도였죠.잘 쉬었다가 갑니다.,5,2년 전
y_145_036,전주 한옥 몽유화원,앙큼스러운성취,"사장님의 친절 하세요 그러나 개인적으로 많이 지저분 합니다 벌레를 많이 잡았거든요.. 방을 옮겨서 잤네요.. 사장님이 저희가 간 뒤에 대대적으로 소독 하실꺼라 하시긴 했지만.. 사장님 ""에어컨 청소"" 도 부탁해요 안쪽 보고 많이 놀랬어요ㅡㅡ 아이와 함께하시는 분들은 비추!!! 금액 대비 방이 너무 좁구요 게스트 처음 가봤는데 무서웠어요 거실을 같이쓰는 구조라 별로.. 방음도 아예 안됨",5,2년 전
y_145_037,전주 한옥 몽유화원,오레오레오레오레,"별1,별3 여자5명 여행~^^ 이른시간에 도착했는데도 입실허락해 주셔서 빨리 짐풀고 한옥마을에서 즐거운 시간 보낼수 있었어요~^^ 남부시장야시장 추천해 주셔서 맛있는 간식 많이먹고 편안하게 잘 쉬었다 갑니다.아침에 주신 배와 고구마도 너무 달고 맛있었어요.ㅎ 딸들에게 주라고 주신 cc크림 너무 감사드려요. 몽유화원과 좋은 추억 남기게 되어서 영광입니다. 항상 건강하세요.~",5,7년 전
y_145_038,전주 한옥 몽유화원,딸기부,게스트 하우스라 작지만 주인이 친절하고 한옥마을이 가까워 좋았습니다,4,2년 전
y_145_039,전주 한옥 몽유화원,2469762,사장님 좋으시고 청결하고 조식도 나오고 예쁨.,5,7년 전
y_145_040,전주 한옥 몽유화원,8681565,1. 시설 너무 좋았어요. 가격이 너무 싸서 조금 걱정했는데 방도 따뜻하고 화장실 물도 따뜻하고 냉장고. 냄비. 그릇들.약통 까지 웬만한것들은 다있었어요! (렌즈액까지!) 2. 사장님들도 너무 친절하시고 아침에 삶은계란이랑 비피더스도 주셨어요!!,5,6년 전
y_145_041,전주 한옥 몽유화원,10296526,"방에 화장실도 있었고 엄청 아늑했어요:) 전기요 덕분에 따뜻하게 푹 자고, 아침에는 조식도 챙겨주셔서 좋았어요! 사장님이 엄청 친절하셔서 잘 지내가 갑니당ㅎㅎ",5,5년 전
y_145_042,전주 한옥 몽유화원,5933002,한옥마을과 남부시장주변에 있어 편했고 방이 안락해서 좋았습니다. 주인분도 친절하셨고 간단한 조식도 있었네요. 다만 단점은 방음이 안되서 서로 조심하셔야할듯~,5,7년 전
y_145_043,전주 한옥 몽유화원,남산팔각정패밀리,사진으로 본것보다 넓었고 따뜻 했습니다 작지만 화장실도 깨끗하고 사장님 친절하세요~ 잘 자고 나왔습니다~,4,1년 전
y_145_044,전주 한옥 몽유화원,5490212,게스트하우스 방음이 안됩니다. 조심스러운 부분이 많고 머리말릴때도 욕실해서 해야하고.. 따뜻한 물이 금방 나오지 않고 한참 기다려야 했고 조식 빵이 전날 냉장공니ㅣ 준비되지 않아 일찍 서둘러 나가야했는데 못 먹어 아쉬웠습니다. 한옥마을과는 비교적 먼 거리구요. 사장님 내외분은 친절하고 좋았습니다.,3,7년 전
y_145_045,전주 한옥 몽유화원,숭띵잉,숙소 인테리어가 너무 예쁘고 아름다워서 정이 많이 드는 곳이었어요! 사장님께서 오기 전부터 꼼꼼히 체크하는 것은 물론 퇴실하는 순간까지도 너무 잘해주시고 사소한거 하나하나 다 챙겨주시는 모습에서 많이 감동 받았습니다😊 여자 둘이 간 여행이었는데 그런 사소한 부분까지 배려해주시면서 게스트하우스 전체를 맘편히 쓸 수 있게 해주시는 건 물론 방도 더 크고 따뜻한 곳으로 바꿔주셔서 하루지만 집처럼 편하게 지내다 다녀왔습니다. 전주 한옥마을도 정말 가까워서 편히 왔다갔다 하기에도 좋았고 차가 없는 뚜벅이들을 위해 최적화 된 곳이라고 생각합니다🙏🏻 다시한번 작은 배려들로 인해 즐거운 여행을 할 수 있게 된 것을 감사드리며 이곳이 더욱 번창하기를 바랍니다❤️,5,5년 전
