id,name,nickname,review_content,rating,write_date
y_147_301,전주 에이플러스,혜뿡뿡이,넓고 이불도 깨끗했어요.근데 바로 옆이 도로라 소음이 좀 있고 화장실 바닥턱땜에 넘어질뻔 한거 빼곤 괜찮았어요,4,1년 전
y_147_302,전주 에이플러스,적극적이고밝은해바라기색,방이랑 욕실이 넓은편이라 이용하기 너무 편했습니다 침대도 크고 푹신해서 푹 자고 나왔습니다 스타일러도 있어서 잘 이용했고 컴퓨터 잘되서 게임하기 너무 좋아요 주차장이 넓어서 마음에 들어요,4,2년 전
y_147_303,전주 에이플러스,낭중지추,"출장으로이용했습니다.방크기도적당하고,청소도잘되어있었네요..티비도크고,넷플릭스도이용할수있어서편히쉬다왔네요..주차장도여유있고,단점을찾아보기힘드넹요..다음번에또이용할예정입니다.잘쉬다갑니다.사장님친절해요",5,2년 전
y_147_304,전주 에이플러스,이질적인토마토,"사장님이 친절하시고 주차장이 무지넓습니다 실내컨디션도 청소부터 물까지 너무잘나오고 침대도 좋습니다 주변편의시설이많아 사용하기 편하고, 식당들과 도로 이용에서도 좋습니다 전주올때마다 여기로올듯합니다ㅎ",5,2년 전
y_147_305,전주 에이플러스,안개낀부둣가,객실이 방도 넓은데다가 사방이 거울이니 더욱더 넓어 보이네요. 창문도 큰거하나 작은거 하나 있어서 여름에 끝내주겠네요. 침구도 깨끗하고 욕실도 깨끗하고 객실도 깨끗하고 나무랄데가 없네요.,5,2년 전
y_147_306,전주 에이플러스,크킄킼키키키키킼,"전주 놀러와서 숙박 할곳 찾는 와중에 전주한옥마을이든 , 야시장이든 다 멀지 않아서 여기로 픽 했는데 너무 만족한 숙소 였어요 ! 날씨가 너무 더웠는데 에어컨도 잘나와서 답답하거나 그러지 않아서 덕분에 꿀잠 잔거 같아요 ~~ 무엇보다 기본 방으로 예약 했지만 방 사이즈도 크고 티비도 커서 좋았습니다 ! 화장실 수압도 괜찮고 깔끔 했습니다. ㅎㅎ근데 주변에 편의점을 못찾은건지 안보이더라고요 ㅠㅠ 이거 하나 아쉽 ㅎ 그래도 너무 만족한 숙박이였어요 다음에 전주 놀러간다면 재방문 할거같아요",5,1년 전
y_147_307,전주 에이플러스,의욕적이고활발한사수자리,숙박했는데 다른곳은 먼지없이 꼼꼼했지만 침구에 먼지들이 묻어있었어요 다 좋은데 이부분만 신경써주시면 될것같아요,4,1년 전
y_147_308,전주 에이플러스,YSuit,"진짜 방 넓고 엄청 따뜻하고 쾌적하고 좋아요, 다만 도로 자동차 달리는 소리가 많이 들리나 가격도 좋고 재방문 의사 있습니다",5,1년 전
y_147_309,전주 에이플러스,노을이집사,가격 대비 만족스럽게 이용했습니다🙋🏻 역이랑 가까운것도 좋았구요 :) 물도 잘 나왔어요🙆🏻🙆🏻,5,2년 전
y_147_310,전주 에이플러스,감*****,깔끔하고 넓고 좋았어요 단점은 바깥 차 소리가 너무 잘들리네요 하지만 그 외에 다 좋아서 재방문하고 싶어요,4,1년 전
y_147_311,전주 에이플러스,하람파파is,여기는 무조건 전주 최고임 다녀본 모텔중 조식은 여기가 1등 카운터 여사장님 매우친절 볼떼마다 반겨주심 출장시 어플로 저렴하고 깨끗하고 조용한곳을 찾아가는데 이번 초이스도 정말 굿초이스 였네요 숙소도 저렴하고 방도 깨끗했고요 침구류도 편안해서 푹 쉴수 있었습니다 방청결상태도 좋았구요,5,2년 전
y_147_312,전주 에이플러스,미미한꽃,1박 2일 여행으로 머문 숙소입니다 캐리어가 있었는데 체크인 시간이 아님에도 불구하고 사장님께서 너그럽게 체크인 해주셨어요! 객실 상태는 너무 깨끗했고 넓었습니다 🥹 체크아웃 시간도 레이트로 요청드렸는데 추가금 없이 해주셔서 다음날 늦잠까지 잘 수 있었어요 전주 여행 일정이 있으신 분들은 방문해도 만족하 실 거에요 주변에 여럿 숙소들 중 가성이 좋고 청결한 숙소입니다 !! 장거리 커플이라 전주에서 자주 만나는데 다음에 또 이용하고 싶은 숙소에요 ~~ ! 사장님 번창하세요,5,1년 전
y_147_313,전주 에이플러스,세렌디피티지민,"이불덮다가 이불커버 올라가서 정리하려는데 무슨;;빨지도 않는지 누구것인지도 모를 털들이 속에 가득하더군요.;; 진짜 토나올뻔했습니다. 그리고 눈이있으시다면 커튼은 정말 너무한것아닌가요.?보셨으면 정리하시는것이 상식일텐데, 저대로 그냥;;; 어우...; 어이가없어서;; 다신안갈것같아요. 그리고 화장실에서 하수구냄새나요.",2,2년 전
y_147_314,전주 에이플러스,386스티븐,대로변이라찾기가쉽네요 주차장 짱넢어요원하는곳에다 주차깔끔하게했고 1층 로비에스넥바겸식당이있고 물론조식서비스가준비되어있네요 금연모텔은아닌듯한데 각실문을열었는데 감사하게 정말담배냄새가1도없네요 창이2개라환기가 잘되서그런가 잘쉬었습니다,5,3년 전
y_147_315,전주 에이플러스,감사합니다4163,최근에 새로 리모델링해서 굉장히 깔끔하고 무엇보다 넓어서 쾌적해요 TV도 굉장히 커서 와서 Netflix 보기 너무너무 좋아요 ㅎㅎㅎㅎ 스타일러도 있어서 혹시나 외투 갖고 오신 분들은 여기서 쓰고 가셔도 될 것 같아요 아직 많이 추운데 전기장판난방도 잘되어있어서 따뜻하게 묵기 참좋았었습니다. 다른데에는 없는 길다란 Bar 테이블이 있어서 물건을놓기도 좋고 혹시나 사무업무 보러 비즈니스로 들르신분들한테도 유용하실 것 같아요 책상이 넓어 여유롭게 사용하기 좋습니다 다음에도 들르겠습니다,5,1년 전
y_147_316,전주 에이플러스,닉넴귀차니즘,넓어서 아주 좋았어요 티비도 큼직해서 영화도 한편보고 푹자고 갑니다~,4,2년 전
y_147_317,전주 에이플러스,이루어지길,가장 큰 장점은 넓은 객실에 깔끔하고 모던한 인테리어라고 생각해요 프론트에서 헤드셋 대여도 해주셨어요 친절하시고 깨끗한 침구와 고사양 게이밍 컴퓨터가 있어서 편안하게 휴식할 수 있어요,5,2년 전
y_147_318,전주 에이플러스,이루어지길,가장 큰 장점은 넓은 객실에 깔끔하고 모던한 인테리어라고 생각해요 프론트에서 헤드셋 대여도 해주셨어요 친절하시고 깨끗한 침구와 고사양 게이밍 컴퓨터가 있어서 편안하게 휴식할 수 있어요,5,2년 전
y_147_319,전주 에이플러스,닉네임닉네임name,객실 인테리어가 리모델링을 해서그런가 정말 깔끔해요 수압도 잘나오고 비데도 있고 화장실 공간도 넓어요 심지어 실내도 좁지않게 넓고 넷플릭스도 가능해서 정말 좋은 숙소이 머무르다 간거같아요 감사합니다.,5,2년 전
y_147_320,전주 에이플러스,찐순이랑,여기어때에서 예약후 방문했는데 주차장이 밖에있어서 약간 불편했는데 입실해보니 티비도크고 이브자리 깨끗하고 청결상태 조아보였는데 샤워하고 닦으려고 수건을보니 실망했어요 까맣게 세탁이 덜 되어있어서 감점이네요 ㅜ ㅜ,4,2년 전
y_147_321,전주 에이플러스,조급한광고담당자,아주 좋습니다^^ 직원분들 친절하시고 객실 청결상태 양호합니다. 주차 하기도 편하고 잘 쉬고 갑니다. 다음에 근처에 오면 다시 들리도록 하겠습니다. 잘 쉬고 갑니다 감사합니다ㅎㅎㅎ,5,2년 전
y_147_322,전주 에이플러스,조급한광고담당자,아주 좋습니다^^ 직원분들 친절하시고 객실 청결상태 양호합니다. 주차 하기도 편하고 잘 쉬고 갑니다. 다음에 근처에 오면 다시 들리도록 하겠습니다. 잘 쉬고 갑니다 감사합니다ㅎㅎㅎ,5,2년 전
y_147_323,전주 에이플러스,GC14752934272,새로 오픈해서 그런지 깨끗하고 아주 청결합니다 또 이용할 예정입니다^^,5,3년 전
y_147_324,전주 에이플러스,n*****,"아주 저렴한 가격으로 1박했습니다. 광양 가는 길에 중간인 전주에서 평점 좋은 곳으로 찾아보다가 예약했어요! 총 7층 건물인데 이벤트 특가로 3층에 묵었습니다. 리뷰 내용중에 대로변이라 차 소리가 많이 들린다고 했는데,,맞습니다ㅋㅋㅋIC부근이라 확실히 소음이 있는 편이예요 잠귀가 밝은 저는 조금 불편하긴 했지만 하루 가볍게 자기에는 괜찮았습니다. 다음에 또 전주 올때도 이벤트하고있으면 오픈특가세일일때 재방문 의사있습니다. 사장님 수고하세요! 잘 묵고 갑니다!",4,1년 전
y_147_325,전주 에이플러스,밝고편한게자리,넓고 쾌적하고 좋아요! 다음에도 자주 이용할게영,4,1년 전
y_147_326,전주 에이플러스,멍쟝,"객실 위생에 관해서 안좋은 리뷰가 좀 있어서 걱정했는데 깨끗한편이예요! 근데 옷걸이가 없어서 옷을 마땅히 둘 곳이 없었고 음식을 먹을곳도 딱히 없어서 조금 불편했어요 침대에 앉아서 먹기에도 테이블이 많이 낮았어요ㅠ 사장님께서 친절하시고 좋으신데 체크인하는데 안계셔서 조금 오래 기다렸어용,, 아쉬움이 남은 숙소였습니당,,ㅠ",4,2년 전
y_147_327,전주 에이플러스,연지색전자메일,오픈파격특가 디럭스 예약했는데 티비가 작고 침대도 작은 방으로 주더군요 전에는 예약했을때 티비 엄청크고 침대도 넓은 방으로 주셨는데 물어보니까 원래 디럭스는 티비가 작은 방이라고 하더라고요 근데 디럭스 사진 보시면 티비 엄청 큰 방입니다 ㅋㅋ가격이 싸다고 이런방 주신곤지 모르겠지만 왜 모텔정보에는 티비 65인치가 공통이라고 공지해놓은건지 모르겠네요 그리고 방 줄때 미리 말해줬다고 하시는데 그런말 들은적 없어요,2,2년 전
y_147_328,전주 에이플러스,북악산노루,우선 방음이 거의 안된다고 보면돠구요.. 도로변이였는데 창문을 닫아도 차다니는 소리때문에 새벽에 계속 깻습니다 옆방 소리도 글쿠요.. 화장실 물 떨어지는소리 등 좀 방음이 너무 안좋네요,5,2년 전
y_147_329,전주 에이플러스,오늘오리알,친절하시고 좋아요 객실 바닥청소에 신경써주셨으면 좋겠습니다,4,1년 전
y_147_330,전주 에이플러스,봉다리봉투,전주 출장와서 숙박했습니다 행사기간이라고 숙박비가 많이 저렴하네요 숙박객에게 조식도 제공한다고 합니다 저는 늦잠으로 이용하지는 못했는데 암튼 가성비 엄청 좋았습니다 기분좋게 잘 이용했습니다,3,2년 전
y_147_331,전주 에이플러스,깔끔한노숙인,65인치티비? 절대아니고요 티비 정말 옛날 조금만한 티비 티비큰거 보고 예약한건데 특가로 예약했다고 이런방준건가요? 사기당한기분.. 이럴줄알았음 퇴실시간도 긴 다른곳 갔을텐데..마지막 이용이되겠네요 왜후기가좋은거지?,3,2년 전
y_147_332,전주 에이플러스,민아민쓰,처음방문한거치고는 리모델링 하셨는지 객실은 깔끔하고넓고괜찮았는데 암막은 덜되여 있어서 저로서는 아침에 눈부셔 별로였구 도로가라서 시끄럽고 문은 이중막이 아니라 시끄럽더라구요아침일찍부터 그리고 위에층도 시끌 방음이잘안되나봐요전체적으로 예민하신분들은 이부분은 고려하시고 가셔야할거같아요 객실은깨끗하니 괜찮고 직원 아주머니도친절하니 괜찮으십니다 물수압도 좋아요,4,2년 전
y_147_333,전주 에이플러스,준호수지니,일단 너무 깨끗해요 ~ 넷플릭스가 안되는게 조금 아쉽긴 하지만 담배 냄새도 안나고 무척 청결합니다 화장실도 새로 공사했는지 깨끗합니다 사장님도 친절하시고 앞으로 또 자주 이용할께,5,1년 전
y_147_334,전주 에이플러스,감동적이고기대하는97세,1주일 남부지방 여행 하면서 전주에서 2일동안 묵은 숙소입니다 정말 진심 이 가격에 숙소를 잡을수 있다니.. 사장님이 미쳤어요 여기는..ㅋㅋ 정말 친절하시고 전주사람이 아니라서 전주 숙소 가격때가 얼마인지 모르겠지만 하루 잡았다가 방이 맘에들어서 하루 더 묵었네요 ㅋ 티비도 크고 컴퓨터도 잘 돌아가고 방도 크고 너무 맘에 들었습니다 혼자 일주일 여행 다니고 숙소 혼자 쓰느라 외롭긴 했지만 진심 사장님 엄청 친절하시고 방도 좋아요 냄새도 안나고! 전주 가성비 숙소 찾으시는분들 추천드립니다,5,1년 전
y_147_335,전주 에이플러스,앙큼스러운파전,여러번 방문인데 넖고 좋아요 ㅈ수압도 쎄구요 전기장판도 밌어서 좋아요 창문으로 바람이 조금 들어오긴 하지만 그래도 마니 춥지는 않앙ㆍ 역이랑도 가까워 좋아요 침구류도 다 깨끗해서 좋아요최고입니다다음에도 이용 할거에요 감사합니다,5,2년 전
y_147_336,전주 에이플러스,유쾌하고우호적인푸른차,첫 배정 받은 객실은 냄새가 많이 나서 말씀 드렸더니 바로 바꾸어 주셨습니다. 하루밤 편안하게 묵고 갑니다,3,1년 전
y_147_337,전주 에이플러스,루이얌,좋아요 사장님 왕왕 친절🩷🩷,4,1년 전
y_147_338,전주 에이플러스,nnnsss,너무 깔끔하고 좋았어요 사장님도 친절하세요~~! 재방문 의사 있습니다 ㅎㅎ 너무 깔끔하고 좋았어요 사장님도 친절하세요~~! 재방문 의사 있습니다 ㅎㅎ 너무 깔끔하고 좋았어요 사장님도 친절하세요~~! 재방문 의사 있습니다 ㅎㅎ 너무 깔끔하고 좋았어요 사장님도 친절하세요~~! 재방문 의사 있습니다 ㅎㅎ 너무 깔끔하고 좋았어요 사장님도 친절하세요~~! 재방문 의사 있습니다 ㅎㅎ 너무 깔끔하고 좋았어요 사장님도 친절하세요~~! 재방문 의사 있습니다 ㅎㅎ 😍😍,5,1년 전
y_147_339,전주 에이플러스,녹운,객실이 상대적으로 넓고 욕실내 욕조 세로폭이 일반적인 크기대비 상대적으로 커서 이용이. 만족스러윘습니다.,3,1년 전
y_147_340,전주 에이플러스,팔*****,두번 이용했네요. 시설좋아요. 아마 전주 갈때마다 이용할 듯 합니다. 주차시설 넓고 좋아요. 시설들 다 깨끗해요. 원주랑 가까워요. 그 주변으로 여행다니기도 너무 좋네요. 일하시는 리모님들도 친절하셔요. 여행 잘 마치고 왔네요.,5,2년 전
y_147_341,전주 에이플러스,이슬이,객실에 중문이 없네요 찻길옆이라 차소리가 들려요 화장실에 턱이 두군데나 있어서 넘어질뻔. 타일을 다른색으로 해놨으면 알수있을텐데요 화장지도. 없구 각티슈갖다놔서 불편했어요 수건이 빨었는데도 머리카락이 붙어있구 그다지 가고싶지 않은 숙소네요ㅠㅠ,3,2년 전
y_147_342,전주 에이플러스,오늘도샤샤,일단 전체평은 너무 좋은거 같아요 티비도 크고 방안도 크고 넓은거 같아요 방안청소 상태 침구청결상태 욕실청결상태 모두 좋아요 리모델링을 너무 잘하신거같아요 아침에 조식도 이용할수있었는데 아쉽게도 이용을못했어요,5,2년 전
y_147_343,전주 에이플러스,코코스79,"건물 외관은 좀 낡아보이긴 했지만 내부 리모델링을 하셨는지 내부는 심플하고 정말 깨끗했어요..나름 주차장도 좁지 않아서 주차하기엔 별로 큰 문제가 없었고, 혹시 만차시 주변인근에 주차해도 큰 문제 없을꺼 같아요~~ 모텔밀집지역이라 그런지 주변 가까이에 편의점 및 식당들이 많아서 편리하기도 하구욤.. 1층 카운터에 계시분은 친절하셨고 방은 따뜻해서 추운겨울 날씨임에 불구하고 편하게 이용했습니다. 다만, 많은분들이 리뷰에 언급해주신대로 도로옆이라ㅜㅜㅜㅜㅜ",5,1년 전
y_147_344,전주 에이플러스,앙큼스러운파전,몇번 방문한곳인데 좋아요 5층은 바람이 조금 들어오긴 하지만 커텐있어서 괜찮은거 같아요 방도 넓고 시설도 좋아요 수압도 무지 섹청소상태도 좋구 전기장판있어서 좋더라구요 침구류도 깨큿해요,5,2년 전
y_147_345,전주 에이플러스,왜욯,진짜 넓고 보통 모텔은 좁아서 하루 자도 답답한데 여기는 깨끗하고 스타일러도 상태 좋고 화장실도 깔금하고 넓고 방도 넓고 아주 만족했어요!! 글고 티비가 엄청 커서 누워서 보면 영화관인줄 알았슴댜(그만큼 크고 좋다는거에용ㅋ) 전주 여행오면 또 이용할게요,5,1년 전
y_147_346,전주 에이플러스,이루어지길,리모델링을 하고 나서 TV화면이 커져서 좋아요 큰 화면이 좋아요 침구가 깨끗하고 부드러워요 에어컨으로 실내가 시원하고 쾌적해요 인근에 편의점이 있어서 좋아요 편안하게 휴식할 수 있어요,5,2년 전
y_147_347,전주 에이플러스,춤추는킹콩,"난방도 너무 잘해주셨고, 전기장판도 따뜻하고 수건도 깨끗하고 냄세도 안나고 너무 좋았어요. 넷플릭스 보기에도 화면 크고 좋아서 더 좋았던거같아요. 주차장도 넓고 ㅋㅋ 다음에 오면 또 오겠습니다 잘썻어요~",5,2년 전
y_147_348,전주 에이플러스,하람파파is,출장시 어플로 저렴하고 깨끗하고 조용한곳을 찾아가는데 이번 초이스도 정말 굿초이스 였네요 숙소도 저렴하고 방도 깨끗했고요 침구류도 편안해서 푹 쉴수 있었습니다 방청결상태도 좋았구요 조식 최고네요,5,2년 전
y_147_349,전주 에이플러스,푸른하락,웬만한 피씨방보다 컴퓨터가 좋아서 성능에 놀랐고 뽀송하고 이상한 냄새 안 나는 가운이 너무너무 좋았어요 ㅠㅠ 진짜 다음에 꼭 다시 갈 곳으로 도장 꽝꽝 .. ! 너무 좋았구 잘 이용했습니당,5,2년 전
y_147_350,전주 에이플러스,의욕적이고긍정적인입국심사,숙소가 매우 깨끗하고 좋은데 화장실이 위험해요.,4,1년 전
y_147_351,전주 에이플러스,율소리,전주올때 이곳주변숙소를 이용하는데 넘좋았어요,4,1년 전
y_147_352,전주 에이플러스,충장로모험,주차장이 넓어서 주차하시기엔 편리해요 주변에 상가도 있고 놀기에 좋았습니다 방도 넓도 침대도 푹신해서 잘 잤습니다 넥플릭스도 되서 편하게 놀았습니다 전주 놀라오게 되면 또 오고 싶어요,5,2년 전
y_147_353,전주 에이플러스,명란젓코비,현장일을하면서 전국의 숙박업소를 이용을 많이합니다! 전주 인근에 현장이 나와도 항상 전주숙박을 이용하는데 갈때마다 너무 편안하고 좋아요!! 주말에만 집을 가는데 내집처럼 편안한게 다시 또 방문을 하게 됩니다!,4,2년 전
y_147_354,전주 에이플러스,피어나너내도도독,"전주 숙박을 어디로 할지 고민하다가 선택했습니다. 산정동이라 좀 외곽이라서 고민이 많았지만 정말 너무 만족스러운 숙박이었습니다. 룸 컨디션도 아주 좋았고, 난방도 완벽했으며 물 나오는 거며 수압이며 전체적으로 다 만족스러웠습니다. 또 이용하겠습니다.",5,1년 전
y_147_355,전주 에이플러스,꺼뭇꺼뭇한수생식물,사진에는 있었는데 욕조가 없는방을 주셨어요.ㅠㅠ 방크기도 침대크기도 컸는데 중문도없고 방음이 전혀 안돼서 아침에 청소하시는분들 소리때문에 잠을 설쳤습니다 이 부분이 많이 아쉽네요,5,2년 전
y_147_356,전주 에이플러스,마음만20대,정말정말자주방문하는숙소입니다 너무너무자주와서 이제 어떤 리뷰를 써야할지 모를정도로 제가 애정 하는 숙소입니다 주차장도넓고 객실이 전체적으로 엄청크고 전체리모델링을해서 화사한 화이트톤이 너무 예뻐요 전에는 남직원한분이 좀 불친절해서 좀 신경이쓰였던 부분이있었는데 저만 그렇게 느낀게 아닌지 사장님께서 그직원분을 짤랐다고 해서 개인적으로 웃픈얘기네요ㅋ 지금 직원분들은 너무친절하시고 무엇보다 사장님이 매우친절하세요 주변에 먹거리도많고 조용하고참좋아요,5,1년 전
y_147_357,전주 에이플러스,출장왕김선생,전주 출장와서 이용했습니다 방이 넓어요 여유롭네요 주차도 편하고 좋네요 방 전등이 조금 문제는 있었지만 비품도 잘 되어있고 이용하는데 부족함이 없이 잘 이용했습니다 또 방문할께요,5,2년 전
y_147_358,전주 에이플러스,이상무8,추워서 잠을 푹 못 잤어요,4,1년 전
y_147_359,전주 에이플러스,강원랜드포획자,엄청 크고 쾌적해서 좋았어요! 이중창 잘 닫으니 대로변 소음도 차단됐고 조식은 주말에는 운영 안하시는지 먹어보고 싶었지만 못먹어서 좀 아쉬웠어요!,5,2년 전
y_147_360,전주 에이플러스,조급한광고담당자,아주 좋습니다^^ 직원분들 친절하시고 객실 청결상태 양호합니다. 주차 하기도 편하고 잘 쉬고 갑니다. 다음에 근처에 오면 다시 들리도록 하겠습니다. 잘 쉬고 갑니다 감사합니다ㅎㅎㅎ,5,2년 전
y_147_361,전주 에이플러스,궁색한버선,사장님도 친절하시고 깨끗해요 ㅎ 조식도 깔끔하고 맛있어요,5,2년 전
y_147_362,전주 에이플러스,초특가야야야야야야놀자,일단 방 상태 깔끔해서 좋았고 담에 또 올 의향이 있습니다 그리고 아침에 나오는 조식은 기대를 별로 안 했었는데 계란에 시리얼에 여러 나물과 반찬 김치찌개까지 풍족하게 있어서 너무 만족했습니다 다음에 또 올게요 ㅎㅎ,5,2년 전
y_147_363,전주 에이플러스,라바라바라바라라,농협하나로마트 도보 5분 노동부청사 도보 10분. 다이소도 있음 숙소근처 도로변 식당가 도보5분 숙소옆 오복식당 우렁된장찌개 강추 아침식사가능 숙소앞 진안오겹살 추천 숙소옆 도보1분 사랑식당 백반강추 아침식사가능 숙소근처 도보2분 감자탕.쌈밥. 맛집있음 하나로마트 옆 새우전문 수산식당 강추 그중에서도 에이플러스 조식이 최고^^,5,2년 전
y_147_364,전주 에이플러스,쑤블리13,욕조있는 룸이에요ㅋㅋ 스타일러도 있네요 룸은 전체적으로 되게 깔끔해요~~~ 욕조있는 룸을 원하실경우 예약하신후 전화를 하셔야해요 아님 랜덤이에요 ㅋㅋ남자사장님과 여자사장님 각각 계실때 가봤는데 두분 다 너무 친절하셔서 자꾸 여기만 예약하게 되네요ㅋㅋ 감사합니당ㅋ,5,1년 전
y_147_365,전주 에이플러스,이루어지길,객실 내부가 깔끔하고 좋아요 인근 편의점이 있어 편리해요 넷플릭스 시청가능합니다 스타일러 휴대폰 충전기 공기청정기가 있어서 편리하고 쾌적하게 이용할 수 있어요 침구도 깨끗하고 깔끔해서 좋아요,5,3년 전
y_147_366,전주 에이플러스,오늘따라기분이조아,정말 다 좋은데 가장 아쉬운 부분이 갈때마다 수건이나 이불에 먼지가 많습니다 . 그것만 개선되면 아주아주 좋을 것 같아요. 수건으로 얼굴 닦으면 얼굴에 먼지가 많이 묻어서.. 털고쓰면 괜찮지만 그래도 해당부분은 조금 개선이 필요하지 싶습니다. 나머진 다 좋아요,5,3년 전
y_147_367,전주 에이플러스,영스타보이,신축인거같이 깨끗하고 편안하게 잘쉬다갑니다~사장님도 친절하시구요,5,1년 전
y_147_368,전주 에이플러스,라바라바라바라라,"깨끗하고 넓은 객실에 청결한 에어컨~ 조식서비스까지~~ 물가도 많이 오르고, 휴가철이라 여행객들도 피서지로 몰려 사장님 많이 힘드실텐데 힘내세요~~ 전주는 봄.가을이 여행객이 많은데 가을에 또 코로나로 힘드실까 걱정이네요 ㅜㅜ 사장님 건강하시고 파이팅 하세요",5,2년 전
y_147_369,전주 에이플러스,논리적인태연,룸컨디션으로 설명하면 처음에는 많이 추웠습니다. 카운터에 이야기하였더니 온도를 올려주신것 같았습니다. 방은 넓은 편이었습니다. 한가지 아쉬운건 중문이 없어서 소음에 노출된다는 점이었어요. 수압도 좋고 깔끔해서 리모델링된 모텔이라는 외관보다는 만족했다는 점이네요. 조식은 자느라 먹지 못해서 조금 아쉬웠어요. 친절한 여 사장님 덕분에 편히 머물다 갑니다,5,2년 전
y_147_370,전주 에이플러스,28802880,전기장판 따뜻하고 돟아요,5,2년 전
y_147_371,전주 에이플러스,러쉬5,오늘도 역시 괜찮은곳에 정말 착한 가격으로 하루 묵게 되네요 주자장 넓구요~! 조식도 아주 맛나요~! 그리고 방크나 그리고 청결도 너무 너무 좋아서 평일날 출장 오실일 있으시면 들려보셔요~!^^,5,2년 전
y_147_372,전주 에이플러스,루이얌,조아요오오로오✌🏻✌🏻✌🏻✌🏻✌🏻🩷🩷,4,1년 전
