id,name,nickname,review_content,rating,write_date
y_157_132,전주 스토리,bluejwh1,"입실 시간보다 일찍 도착했는데 흔쾌히 짐을 맡아주셔서 편하게 관광 할 수 있었어요. 객실 컨디션도 좋고, 스파욕조가 넓고 입욕제도 따로 구비가 돼 있어서 좋았습니다. 근데 세면대 물이 천천히 내려가서 조금 불편했습니다~ 다음에 또 전주에 놀러오게 되면 여기 묵을거에요~",5,2년 전
y_157_133,전주 스토리,모로코신선,방이 진짜 넓고 거울도 큼직하네요~ 시설이 전반적으로 무난히 깔끔하고 좋았습니다~ 터미널이랑도 가깝고 가격도 괜찮고 ~ 화장실 및 욕실이 오픈되어 있는 구조라서 특이했는데.. 담배냄새랑 소음이 환풍구를 타고 들어오는거 같더라구요.. 그거 빼고는 다 좋았습니다,5,4년 전
y_157_134,전주 스토리,puki,여기 진짜 강추 준특실사용했는데 침대 좋고 깨끗하고 화장실 청결하고 욕조 크고 티비 좋고 넓고 전주오면 또 가고싶은 곳,5,7년 전
y_157_135,전주 스토리,2748327,다좋은데 준특실은 창문이 욕실쪽에있어서 너무답답해요 욕조에 목욕좀하려고 준특실한건데 창문이 흠이네요 방이 좀 답답한 느낌이에요 그리고 에어컨도 안되게해놓으셨던데,3,7년 전
y_157_136,전주 스토리,1997363,무인텔이라는곳을 처음이용해봤어요 좀불편하긴했으나 드라이빙특실이라 방도크고 청결상태도 개안아서 좋았는데 바로건너편이 빌라라창문열어놓기 진짜불편했구요 화장실하수구냄새 작살이구요 첫째날 카운터 삼춘은 엄청 친절하시더라구요 근데 오늘 아침에수건이 모자라서 카운터전화했더니 나이드신분이 완전불친절하게 넣어준거 다쓴거냐고 짜증을 내시더군요 애기까지 세식구가 어제 오늘수건 네개가지고 모자라는거 당연한거 아닌가요?,2,8년 전
y_157_137,전주 스토리,져니져언,"완전완전 만족이에용 ! 급하게 예약한 곳인데 객실도 크고 청결해서 너무 잘 쉬다가 갑니당 ㅠㅠ 다음에 또 머무르고 싶은 곳이었어요 ㅎㅎ 좋은 객실 제공 감사해요! 제가 주차를 잘못했는데 친절하게 다시 해주셨어요,,",5,2년 전
y_157_138,전주 스토리,2752890,새로 오픈했대서 처음에 이용해보고 마음에 들어서 두번째 방문했어요. 드라이빙룸말구 일반룸이용햇구여. 넓고 깔끔하고 청결해용. 근데 화장실이 오픈형이라 조금 불편하긴해요... 숙박업소가 다 구렇겟져근데.... 다음에 또 이용할생각많아요! 좋아요좋아용,4,8년 전
y_157_139,전주 스토리,hh6552,어제갓다가 오늘 아침까지잇엇는데 주차시설은 별로 엿어요 모텔 옆에다 주차해야해서 별로 엿구요 인테리어는 엄청 좋네여 깔끔하고 근데 이불 속 보니까 머리카락이 잇어서 찝찝하더라고여 속눈썹이랑도 한가닥씩 떨어져잇고 그런것만아니면 만족합니다,3,8년 전
y_157_140,전주 스토리,쓸쓸하고찬란한신,"시설,청결,서비스 모두 만족합니다",5,5년 전
y_157_141,전주 스토리,독보적인일생,처음 이용해본곳인데 가성비랑 시설 청결 다 만족합니다 한번씩 출장올때 들르기 괜찮고 가격또한 착합니다 여기저기 다녀본곳중 중상급은 되는듯합니다 주차가 다소 불편한부분이있지만 그래도 굿,5,4년 전
y_157_142,전주 스토리,GC14875155410,출장 차 묵은 호텔로 방문시에 알았지만 메인이 무인텔임 발렛안됨 1회용품 추가 비용없이 룸에 비치 1회용품 안에 치약없음 샤워스폰지 없음(카운터 전화에 받아씀) 그외 잘 모르겠지만 비용대비 룸이 크고 깔끔함,4,8년 전
y_157_143,전주 스토리,5605578,가격이나 시설면에서는 만족하나 몇가지 단점이 있어 적어봅니다. 화장실이 세면대가 물이 잘 빠지지 않아 넘치는 현상이 있었고..문이 따로 없어 볼일보는 소리와 샤워하는 소리등 너무 들리는 단점이 있어요..,4,7년 전
y_157_144,전주 스토리,여든여덟부여,방이 넓고 욕조도 깨끗해서 좋아요ㅎㅎ 그치만 방구조가 엄청나게 비효율덕르호 되있더라구요 화장실이 엄청넓었어요 고울위치는 별로지만 숙소 깔끔하고 괜찬항요ㅎㅎㅎ 다시갈수있는곳에여 어나지,4,4년 전
y_157_145,전주 스토리,6942011,인테리어도 넘나 예쁘고 깔끔해서 너무나 편하고 좋은 시간 보내고 왔네요^^ 배달음식점을 종류별로 정리해놓은 책자를 보고 싸장님 센스가 넘치는 부분 엄지척! 다음에도 또 이용할게요><,5,7년 전
y_157_146,전주 스토리,2748327,드라이빙방은 처음해봤는데 주차장바로계단올라옴 딱 각각방이라 좋은데 청소상태가좀.. 드라이빙이 아닌 방들 이용했을땐 엄청깨끗하고했는데 여긴 좀 탁자나 의자위에 머떨어져있는 그대로고.. 먼가 그냥 일반으로 하는게 더좋고 넓어요 걍 드라이빙은 안하려고여ㅋ,3,7년 전
y_157_147,전주 스토리,콩29,"그냥 말이 필요없는 ""친절"" 그. 자. 체. 시설은 어쩜 그렇게도 맘에들게 인테리어를 하셨는지?넘 맘에들어서 방을 사구싶을만큼 예뻤어여. 하나부터-. 열까지. 천장부터-. 바닥까지. 빠지는게 하나두없는!, 흠이하나도 없는 ""전주 스토리"" ?여기어때 어플로딩후, 주변검색위치로! ""스토리"" 가 뜬다면 비교도하지말구, 고민도하지말구. ??????""전주 스토리"" 로 오세여. 아름다운 밤이 될꺼에여♥️?♥️",5,8년 전
y_157_148,전주 스토리,체리필통,방도 큰데 화장실도 넓고 욕조도 커서 좋았어요 다만 화장실 세면대랑 욕조에 머리카락이 몇가닥 있었어서 조금만 더 신경써주시면 너무 좋을꺼같아요!! 시설이 좋아서 다음에 또 재방문 할꺼예요ㅎㅎ,4,4년 전
y_157_149,전주 스토리,비오4,방은 기본 일반룸이었는데도 엄청 넓고 깨끗했어요! 화장실이랑 샤워시설도 깨끗하게 잘 이용했네요 숙소 방 들어가는 입구까지 깔끔해서 쾌적했습니다 처음에 주차장에 들어가니 드라이브인 주차장이라 당황했지만 잘 주차하고 이용했네요 또 이용할거 같아요!,5,1년 전
y_157_150,전주 스토리,5915713,항상 이용중입니다 ~ 청결하고 시설도 줗아요,3,5년 전
y_157_151,전주 스토리,여든네살자판,터미널 근처에 위치했으며 깔끔했어요 ~~ 객실도 넓어서 좋구 ㅎㅎㅎ 다만 화장실이 ㅜㅜ 문이 아래위로 뚫려있어서 좀 민망민망 그거빼곤 전체적으로 만족이었습니다 다음에 전주오면 또 들릴게요,5,2년 전
y_157_152,전주 스토리,17364450,깔끔하고 스파도 좋았어용ㅎㅎ,4,3년 전
y_157_153,전주 스토리,8031699,가본 숙소중에 진짜 가성비 갑입니당ㅎㅎㅎ,5,4년 전
y_157_154,전주 스토리,돈이없어,깨끗하고 넓어서 정말 좋아요 밖에 곧바로 편의점도 있고 고속버스터미널이랑도 엄청 가까워요 사실 기대도 안 하고 왔는데 엄청 잘 온 것 같아요 친구랑 같이 온 건데 친구도 엄청 깔끔하고 좋다고 그러네요ㅎㅎ 다음에도 또 이용할 것 같아요,5,7년 전
y_157_155,전주 스토리,11112566,스파하러 갔는데 만족합니다 ㅋㅋㅋ,5,4년 전
y_157_156,전주 스토리,3434613,리뷰 처음 써보는데 진짜 방넓고 깨끗하고 욕조넓고 건조하지않고 적당히 덥지않게 따듯하고 침대넓고 진짜 푹잤네요 유일한 단점아닌 단점이라고 말한다면 침대 앰보싱이 완전푹신하지않고 적당히 푹신하다는거? 이게 단점이 될지는 잘 모르겠지만 입실시간도 빠르고 가격도 싼편이라 전주 최고의 모텔아닌가싶네요,5,8년 전
y_157_157,전주 스토리,3062765,"스토리모텔 두번째 방문인데 어플로는 처음이용했습니다. 예약하기전에 전화로 문의드리니 너무 친절하게 답해주셔서 기분좋게 바로 예약했네요. 인원에 맞게 물품도 챙겨주시고 이불도 갖다주셔서 편하게 이용했습니다. 한옥마을, 터미널과도 가까워서 이동하기 좋았습니다. 객실도 깨끗하고 좋았습니다!!",5,8년 전
y_157_158,전주 스토리,세달돌이,화장실에 문이 제대로 있지 않아서 조금 불편했지만 인테리어나 청결상태나 최고였어요,5,7년 전
y_157_159,전주 스토리,소수서원,좋아요!! 친절하시구 조명 등 고장난 부분 없이 작동도 잘 되서 좋구 늦게까지 있을 수 있어서 너무 너무 좋네요ㅎㅎㅎ 처음에 환기가 잘 되면 더 좋을 것 같아요ㅎㅎ 잘 쉬다 갑니다:),4,4년 전
y_157_160,전주 스토리,2748802,깔끔하고 정돈 잘 되어 있어서 좋았어요 :) 컴퓨터랑 TV랑 연결이 안되어 있어서 조금 아쉽지만 잘 이용하고 갑니다~~,4,8년 전
y_157_161,전주 스토리,1788227,4번째 이용할 만큼 그냩 말이 필요없습니다 청결부분 방음부분 주차 거리부분 다 그레잇입니다!!,5,7년 전
y_157_162,전주 스토리,2다은2,급하게 하루 숙박할곳 찾다가 저렴해서 기대없이 예약하고 갔는데 객실 업그레이드도 해주시고 고데기 대여도 해주시고 좋았습니다~ 욕조도 크구 시간이 좀더 있었다면 사용했을텐데 담에 방문할땐 꼭사용하려구요! 다만 방음이 조금 아쉬웠어요~,5,3년 전
y_157_163,전주 스토리,8194863,첫 인상이 조금은 허름한 익스테리어에 약간은 실망했는데 실내 컨디션은 근래 이용했던 숙박업소 중에 가장 좋았습니다. 객실에 담배 냄새가 배어 있지 않았고 욕실도 아주 깨끗했습니다. 재방문 의사 있습니다. 고맙습니다.,5,3년 전
y_157_164,전주 스토리,호호불어먹어,전주 놀러가서 어디서 자야할지 몰랐는데 일단 터미널 근처라러 마음이 놓였습니다. 처음 숙소에 들어갔을 때 너무 깔끔하고 조명이 예뻐서 좋았습니다!! 냄새도 안나고 침구류도 깨끗했습니다 전주 오면 또 이용하겠습니다,5,2년 전
y_157_165,전주 스토리,2075608,가격에비해서 시설도 좋고 잘사용했어요ㅎㅎ 냉장고가 약간더 청결했으면 좋겠어요? 카운터에 남자분 계셨는데.. 저희가 뭐여쭤보면 조금 무섭게 답해주시더라구요ㅠㅠ,3,8년 전
y_157_166,전주 스토리,뭉*****,"위치도 좋고, 깨끗하고 객실도 넓어서 좋았어요!!! 근데 저녁에 전기가 나가서 드라이기, 비데, 콘센트를 이용할 수 없어서 카운터에 말씀드려서 드라이기는 따로 받긴했지만 살짝 불편하긴 했네요 ㅠㅠ그래도 편하게 잘 쉬다 갑니당",4,2년 전
y_157_167,전주 스토리,유동적인동맹,침대도 방도 따뜻하네요 요즘 날씨도 추운데 덥지않게 잘 잤어요 따뜻한 물도 잘 나오고해서 푹쉬었어요 다음에 근처에 또 오게된다면 여기를 이용할께요 편하게 푹쉬고 꿀잠자고 갑니다 번창하세요,5,2년 전
y_157_168,전주 스토리,여기어때 이용 고객,방 전체 보일러 들어와서 따뜻하게 잘 잤어욤 시설도 깨끗하고 방음도 잘 되고 사장님도 친절하셔서 잘 이용하고 갑니당! 다만 주차자리가 부족한 부분만 조금 아쉬운거같아요 ㅎㅎㅎ 무인텔도 같이 운영해서 어쩔 수 없기도 하지만 ㅠ,5,3년 전
y_157_169,전주 스토리,히야히야호,"312호 준특실 묵었습니다!ㅎㅎ 터미널하고 가까운 모텔 자주 가는데, 스토리는 처음 가봤어요~! 신축이라 그런지 확실히 깨끗하고 쾌적합니다! 방구조나 크기도 사진과 같고, 가운&일회용품도 잘 구비되어 있습니다. (다만, 화장솜&면봉이 없는 게 조금 아쉽네요ㅠ ㅠ~) 방, 욕실 모두 넓고 수압도 좋아요ㅎㅎ 전체적으로 만족스럽게, 편하게 잘 쉬었습니다~!",4,8년 전
y_157_170,전주 스토리,819413,전주 출장 왔는데 터미널 옆이라 오고 가기 편했고 신축이라 청결 상태 또한 좋았습니다. 그리고 프런트에 계신 분이 친절했습니다 . 저녁에 귀찮게 질문 많이 했는데도 맛집 여러군데 알려주시고 덕분에 잘 먹고 잘 쉬다갑니다.,4,9년 전
y_157_171,전주 스토리,섬진강유원지,일반실인데도 넓고 깨끗하고 좋았어요 에어컨은 프론트에서 관리해주시더라구요,5,2년 전
y_157_172,전주 스토리,해안공원헌병,종종 가는데 관리가 잘 되어있어서 좋아요. 신경쓰시는 게 느껴집니다. 공간도 넓고 따뜻하고 온수 잘 나오고 깨끗해요ㅎㅎㅎ 그리고 위치도 터미널 근처라서 이용할 때 편리합니더!! 감사해요,5,2년 전
y_157_173,전주 스토리,자생적인벼랑,객실청소 상태가 깨끗했고 하루 편하게 쉴수 있는 모텔이에요. 사장님도 친절하십니다. 침대도 푹신하고 난방도 잘 되어서 따뜻하게 1박하고 갑니다. 담에도 또 이용할거 같아요. 번창하세요.,5,2년 전
y_157_174,전주 스토리,해안공원헌병,깨끗해서 좋고 티비크고 욕조에 화장실도 크고 위치도 너무 좋고 다 좋아요! 그리고 따뜻해서 좋습니당ㅎㅎ 냄새 안 나고 쾌적해서 항상 잘 쉬다 갑니다!!~~ 터미널이랑 가까워서 좋아요.,5,2년 전
y_157_175,전주 스토리,열살브레인,출장올때마다 이용합니다. 지방 자주 다니는데 이렇게 큰 방이 기본으로 있는 곳은 처음봅니다. 방 크기 압도당함 ㅎㅎ 청결한 편. 이곳을 5번정도 와본 것 같은데 이번엔 좀 아쉬웠습니다. 방에서 왠 꼬락내가 ㅜㅜ 그건 좀 아쉬웠어요. 수건도 교체가 좀 필요해보입니다. 왠만하면 재사용하는 어매니티는 새것과 다를 바가 없는지 확인하시고 비치해두셔야할것같아요. 자주 이용하는 투숙객이라 애정을 담아 글을 올립니다,5,2년 전
y_157_176,전주 스토리,8367151,첫방문이라 고심끝에 고른 숙소인데 실내도 넓고 청결하고 예상시간보다 조금 일찍 들어가도 괜찮냐고 연락드렸더니 괜찮다고 친절하게 응대해주셔서 좋았습니다. 충전기도 다양하게 있고.,5,6년 전
y_157_177,전주 스토리,한라수목원군사령부,넓고 좋았어요 다음에 또 이용할게요,5,4년 전
y_157_178,전주 스토리,좋은곳만리뷰씀,솔직히 싸다곤못하겟지만 가격대비 시설이최고라 불만없습니다 한번가보시는걸 추천드리구요 다음엔 여자친구랑같이갈게요 직접안내해주셔서 좀뻘줌햇는데 친절하게알려주셔서 감사합니다,5,8년 전
y_157_179,전주 스토리,5915713,늘 잘 이용하고있는데 이번엔 책상위에를 안닦아주시는건지..ㅠㅠ양념이랑 밥풀이 묻어있어서 조금 그랬어여 갖고있던 소독제로 닦고 이영했습니다 담부터 신경써주세요!,4,5년 전
y_157_180,전주 스토리,열일곱애기똥풀,오우.. 맨날 이층 드라이브만 가보다가 어제는 삼층으로 가봤는데 삼층이 훨씬 아늑하구 좋더라구요 깔끔하면서 이층보다는 확실히 삼층이 좋은데 어떻게 이층 삼층 나뉘는지를 모르겠네욤 암튼 결론적으로 좋았습니닷,5,3년 전
y_157_181,전주 스토리,DHAz,"사장님이 친절하시고, 방 넓고 새거라서 좋습니다. 여기어때에서 예약하면 건물 가장자리 주차공간 이용하고 3층으로 오셔야 하네요 ㅋ",5,6년 전
y_157_182,전주 스토리,영자에요,대실 잠깐 했었는데 티비도 넷플릭스 되고 좋아요,4,1년 전
y_157_183,전주 스토리,9037784,"이런 곳이 있는 줄 몰랐는데, 처음 가봤어요 드라이브인 호텔이라 대실 이용자는 밖에 차를 바쳐야해서 넘 불편하긴 했네요ㅠㅠ 바닥이나 이런 부분이 살짝 더 깨끗했으면 하는 바람, 방음이 좀 안되는구 같은 ㅠㅠ 그래도 모텔치고 엄청 넓고 잘쓰고 왔슺니다!",4,3년 전
y_157_184,전주 스토리,삼천동왕,좋아요 좋아요 좋아요,3,5년 전
y_157_185,전주 스토리,lsjghgh,잘 쉬다 가요~~~~~,4,5년 전
y_157_186,전주 스토리,여우티잉,객실도 넓고 청결해서 푹 쉬다 갔어요~!,4,4년 전
y_157_187,전주 스토리,써니9292,방이 너무 넓어서 좋았어요 넓은데 구석구석 청소상태도 굿 다만 가운에서 냄새가 많이 났어요 그거 빼고는 너무 좋았어요~~,5,7년 전
y_157_188,전주 스토리,곰국먹으면논문엌,"대체 왜 1층 이용하려면, 전화를 꼭 해야 하는 거죠? 뭐 알람을 받거나 하는 방식은 없는 건가요? 다 완벽한데 전화하는게 ㄹㅇ 무드오지게 깸 ㅋㅋ",3,3년 전
y_157_189,전주 스토리,2779811,숙소 너무 깨끗하고 좋았어요 방도 적당히 넓고 깨끗했어요 침대도 좋더라구요 이불도 좋은 냄새나서 기분 좋았네요 전체적으로 만족하고 온 숙소입니다 😆😆,5,6년 전
y_157_190,전주 스토리,아무렇지않은폭스하운드,역시여기는믿고갑니다 방도넓고 냄새도안나구 조용하구 편의점도바로옆에있어서편하구 배달음식도많구 솔직히코로나시대에서 이렇게가성비좋고 호캉스할수있어서너무좋아요 언제나여기는믿고가는곳입니다 ❤️,5,3년 전
y_157_191,전주 스토리,2745818,전주 놀러가서 숙소를 예약했는데 크기도 크고 깔끔해서 잘 놀다가 가요. 직원분이 인사해도 안받아 주신건 말곤 좋았네요~,4,8년 전
y_157_192,전주 스토리,감사의힘,위치가 좋습니다. 시설이 최신입니다. 분위기도 깔끔합니다. 직원도 친절합니다. 출장시 이용합니다.,5,6년 전
y_157_193,전주 스토리,5915713,담배냄새도 안나고 깔끔해서 애용중입니다 근데 테이블에 음식물이 묻어있었어요ㅜㅜ쓰지않아서 괜찮긴했지만 전에 썼던사람들의 흔적이라 그런지 찝찝했습니당,3,5년 전
y_157_194,전주 스토리,2281764,객실도 깨끗하고 넓었어요~ 다만 처음에 무인텔인줄 알고 와서 한참 헤맸는데 사장님께서 나와서 도와주셨네요~ 1층2층은 드라이브무인텔이고 3층이 일반텔이었어요~ 만족합니다~^^,5,8년 전
y_157_195,전주 스토리,9836917,청결 상태 좋았고 심플한 인테리어에 조명도 깔끔했어요 사장님도 친절하셨음. 재방문 의향 있어여,5,4년 전
y_157_196,전주 스토리,전스님,깨끗하고 따듯하고요 보일러가 빵빵해서 좋았습니다 사장님이 친절해서 좋았습니다,4,1년 전
y_157_197,전주 스토리,해안공원헌병,"코로나 19로 인해 데이트 할 장소가 없어서 대실을 많이 이용하게 되었는데요, 그 중 스토리는 무난한 인테리어와 깔끔함이 좋았어요 예전 모텔을 리모델링을 깨끗하게 해 놓은 거 같더라고요!",4,4년 전
y_157_198,전주 스토리,나른함아침이닷,"스토리 모텔의 좋은점이 방이 넓다는거에요. 여유있게 쉬고싶을때 아주 제격이에요. 침대도 푹신하고 수압도 좋고, 변기도 뜨끈해서 좋아요. 나중에는 숙박에한번 도전해보갰습니당 ㅋㅋㅋㅋㅋ",5,2년 전
y_157_199,전주 스토리,151014,"숙소 넓고 따뜻해서 좋아요 다만 주차장이 조금 아쉽다는점ㅠ 그래도 근방에 편의점, 음식점, 카페, 피시방 등등 터미널이랑 가까워서 좋습니다",4,6년 전
y_157_200,전주 스토리,6942011,저번에 준특실 이용하고 넘나 좋아서 이번엔 드라이빙으로 이용했어요! 역시나 깔끔하고 매우 편안했네요~^^ 드라이빙은 처음이라 도착하고 문의전화 드렸는데 주인이모님께서도 친절하게 설명도 잘해주시고 또 오길 잘했다고 생각했어요 ㅎㅎ 다음에도 이용할 생각입니다!,5,7년 전
y_157_201,전주 스토리,치즈핫도그S2,"시설 , 청결도, 서비스 하나도 나무랄것없이 제가 다녀왔던 모텔중에 단연 으뜸이였습니다. 우선 일반실인데도 불구하고 방의 크기가 너무 커서 쾌적한 하룻밤을 보내게 되서 좋았고, 조명도 너무 이쁘더라구요 전주에 자주가는데 스토리무인텔만 이용해야겠어요 ^.^",5,7년 전
y_157_202,전주 스토리,육경임,시설은 깔끔한데 모기가 너무 많았어요 다 잡고 잔줄 알았는데 새벽에 또 윙윙~ 나름 깔끔했어요,4,7년 전
y_157_203,전주 스토리,호야몬,버스터미널에서 가까웠고 바로 앞 편의점 잘 이용했습니다. 전체적으로 살짝 노후된 느낌은 있었으나 넓은 욕조와 깨끗한 청결상태가 마음에 들었습니다. 업무차 들렸었는데 종종 이용하겠습니다.,5,3년 전
y_157_204,전주 스토리,진슈니,뚜벅이로 간 전주여행 ! 가맥을먹으며 급하게 잡고간 숙소^^ 후기 확인후 픽~~~방 넓고 깨끗해서 넘나 좋았네요. 단점이있단면 화장실이 뚫려있어 큰거볼때 넘 민망하네요ㅜ 가성비 좋은호텔입니다,5,3년 전
y_157_205,전주 스토리,2724831,시설이랑 깨끗하고 좋아요 근데 여름되가는데 이불좀 얇은걸로 바꿔주세요 너무덥습니다ㅜ,4,8년 전
y_157_206,전주 스토리,명글로,"사장님께서 더 좋은 방 주셨던거 같아요! 버스 타고 돌아가기 전 시간이 너무 많이 남아 한 3시간정도만 대실했는데, 진짜 방 청결도도 그렇고 너무 좋았습니다 다음에도 재방문 할 의사 있습니다",5,3년 전
y_157_207,전주 스토리,3284410,시설 청결 위치 모두 만족합니다 친절하셔서 또 가고싶은 곳이네요^^,5,8년 전
y_157_208,전주 스토리,삼천동왕,평일에가서 누리고오세요 객실이 넓어서 너무좋아요 청결상태도 만족합니다,4,5년 전
y_157_209,전주 스토리,GC14650411046,전주가면 여기만감 ㅇㅇ,5,4년 전
y_157_210,전주 스토리,토끼가거북,자주 이용하는곳입니다! 이번엔 바닥에 머리카락이 많았던것빼곤..ㅠㅠ 만족했어요!,4,6년 전
y_157_211,전주 스토리,김천누구,입 실. 시. 간. 을. 칼. 같. 이. 준. 수. 하. 는. 모. 범. 모. 텔. 이. 에. 요,5,2년 전
y_157_212,전주 스토리,10205127,프론트에 계신 사장님? 도 친절하시고 객실도 항상 청결하게 되어있어요!,4,5년 전
y_157_213,전주 스토리,208925,"벌써 두번이나 방문했네요ㅎㅎ 매달 전주 오는데 앞으로는 여기서만 숙박할듯! 시설도 매우 좋았고(207호) 특히 옷장이 정말 맘에 들었습니다 ㅋㅋ 아, 샤워부스에 해바라기 말고 일빈 샤워기 거치해서 사용할 수 있었으면 좋겠어요",4,9년 전
y_157_214,전주 스토리,a28593,1. 대실할 때는 여기먼저 찾아보는거 같아요~!! 2. 어떤거 하나 빠지는거 없이 무난하니 객실 컨디션 좋고 청소 상태도 괜찮아서 늘 잘 쉬다 가는거 같아요~!! 3. 바로 앞에 편의점은 덤,5,2년 전
y_157_215,전주 스토리,나른함아침이닷,"전주 터미널 부근에서 이 가격에 대실시간도 4시간이고, 대실마감시간도 22시까지인건 여기밖에없는거같네요. 시설 좋은거야 말할것도없구요. 무엇보다 방이 넓은게 마음에듭니다. 또뵈요. 담에ㅎ",5,2년 전
y_157_216,전주 스토리,Pho,연박으로 예약하고 조금 전에 방에 들어왔는데 깔끔하고 인테리어도 예쁘고 사장님도 친절하시네요! 리뷰에서 좋은 평가를 받는 숙소라서 믿고 연박으로 예약했는데 후회없는 선택이었네요 감사합니다,5,8년 전
y_157_217,전주 스토리,부산대교맥스,진짜 프라이빗 하고 편해요,4,1년 전
y_157_218,전주 스토리,11879052,재방문이였어용 생긴지 초반에 왔을때 좋아서 오랜만에 예약했는데 여전히 깔끔하고 일반실인데도 넓고 좋았어용 그리고 사장님도 친절하세요! 방도 따뜻하고 아쉬운건 주차가 조금 아쉬웠어요ㅠㅠ,5,4년 전
y_157_219,전주 스토리,펭순부인,너무 청결하고 좋았어요!! 프라이빗한 공간을 원하는 분들은 1실 1주차 가능한 드라이빙룸을 추천합니다 비대면으로 입퇴실하고 계단 내려가자마자 바로 차타고 갈수 있어서 편리하고 좋았어요,5,5년 전
y_157_220,전주 스토리,곰국먹으면논문엌,알쏭달쏭 한 모텔 1층은 드라이브 모텔이라 예약하고 가면 1층 사용 가능 다만 여기 예약할 땐 호수가 중요한 것 같은데 그거 알려면 전화하는 수 밖에 없어서 곤란한 경우가 있었다. 불편요인,5,3년 전
y_157_221,전주 스토리,벚꽃소년,잘묵고갑니다~~ 사장님친절하시고깨끗합니다~~추천,5,2년 전
y_157_222,전주 스토리,평온한새벽에,시설 깨끗하고 좋인요. 물. 수건 부족하면 제공해주고 방도 크고 따뜻해요. 전주 올때마다 이용하고있는데 진짜 편안하게 잘 쉬다 갑니다. 숙박하고도 대실 이용할만큼 편하고 좋아요.,5,4년 전
y_157_223,전주 스토리,4121976,가격대비 깨끗하구 시설도 너무 좋았어요,4,8년 전
y_157_224,전주 스토리,1967960,깔끔하고 좋았어요 깨끗하고 시설도 좋구여 가격이 싼편은 아니지만 괜찮은듯!!,4,9년 전
