id,name,nickname,review_content,rating,write_date
y_157_348,전주 스토리,첫날밤은여기,진짜 깔끔하고 방이 넓어요~ 여자친구랑 자는데 침대도 넓고 사장님이 되게 친절하세요!,5,6년 전
y_157_349,전주 스토리,1294214,매번이용 할때마다 좋은것같아요 객실도 깨끗하고 공기도 쾌적해서 자주 이용하고 있어요,5,8년 전
y_157_350,전주 스토리,2058126,시설 정말정말 깨끗했고 친절하게 안내해주셔서 잘 쉬다 갑니다.다음에 또오고 싶네요,5,8년 전
y_157_351,전주 스토리,3987782,전주에 주말마다 내려가야 하는 입장이라 깔끔하게 쉴 수 있는 숙소가 필요했는데 인근에서는 이만큼 깔끔하고 깨끗한 숙소가 없다고 단언할 수 있을 정도로 만족스럽습니다. 또 젊은 사장님께서 항상 친절하게 응대해주셔서 이곳만 찾게 되네요. 강추합니다^^,5,7년 전
y_157_352,전주 스토리,2156794,고속터미널 근처 여기저기 다녀봤지만 스토리가 제일 깔끔하고 시설이 좋은것같네요!,5,8년 전
y_157_353,전주 스토리,반진골적인열매,객실상태도 좋았구요 방이 큼직큼직해서 좋았습니다 난방도 잘되서 아주 따뜻하게 잘지내다 갑니다,4,8년 전
y_157_354,전주 스토리,1804220,방도 넓고 깨끗해서 자주 이용하고 싶어져요! 인테리어도 깔끔해서 맘에 듭니다!,5,8년 전
y_157_355,전주 스토리,1734616,깔끔하구..분위기좋구..접근성좋구..다만족스럽네요..다음에또올거같아요..,5,8년 전
y_157_356,전주 스토리,리차드막스,깨끗하네요. 만족합니다. 화장실이 정말 신축건물이라 좋아요.^^ 베리굿h,5,8년 전
y_157_357,전주 스토리,2156794,여기 시설이 짱좋음!ㅎㅎ 드라이빙 일반도 신기방기! 추천 꾸욱!!! ㅎㅎㅎ,5,8년 전
y_157_358,전주 스토리,예순세살멍텅구리,좋아요 자주 이용하고 있어요 앞으로도 자주 이용할 거 같아요 좋아요 자주 이용하고 있어요 앞으로도 자주 이용할 거 같아요 좋아요 자주 이용하고 있어요 앞으로도 자주 이용할 거 같아요 좋아요 자주 이용하고 있어요 앞으로도 자주 이용할 거 같아요 좋아요 자주 이용하고 있어요 앞으로도 자주 이용할 거 같아요 좋아요 자주 이용하고 있어요 앞으로도 자주 이용할 거 같아요 좋아요 자주 이용하고 있어요 앞으로도 자주 이용할 거 같아요 좋아요 자주 이용하고 있어요 앞으로도 자주 이용할 거 같아요 좋아요 자주 이용하고 있어요 앞으로도 자주 이용할 거 같아요 좋아요 자주 이용하고 있어요 앞으로도 자주 이용할 거 같아요 좋아요 자주 이용하고 있어요 앞으로도 자주 이용할 거 같아요 좋아요 자주 이용하고 있어요 앞으로도 자주 이용할 거 같아요,5,1년 전
y_157_359,전주 스토리,손에땀난다,들어가자마자 난방이잘되어있어서 따뜻했구요 관리가잘되어 청결했습니다^^,5,8년 전
y_157_360,전주 스토리,니얼굴토마토,좋아요 깨끗하고 근데 냉장고인지문물 넣어놓는곳이 냄새가심해요..,5,6년 전
y_157_361,전주 스토리,메롱메롱메롱,처음 묵었는데 너무나 좋네요😁,4,1년 전
y_157_362,전주 스토리,1710149,넓은방에 룸 컨디션 최고!! 드라이빙은 너무 편리해요 여기만 옵니다,5,5년 전
y_157_363,전주 스토리,8940983,시설이며. 방 안 청결이며 아주 좋았습니다. 잘 쉬다갑니다,5,5년 전
y_157_364,전주 스토리,연한왕,청결하고 침대도 너무 푹신하고 가본곳중 제일 맘에 들어용,5,7년 전
y_157_365,전주 스토리,파파이팅,가격대비 좋아요 사장님이 친절해요가격대비 좋아요 사장님이 친절해요가격대비 좋아요 사장님이 친절해요가격대비 좋아요 사장님이 친절해요가격대비 좋아요 사장님이 친절해요가격대비 좋아요 사장님이 친절해요,5,2년 전
y_157_366,전주 스토리,제발청결,3인으로 설정하고 결제했으나 현장에 가니 추가금 만 원을 달라고 하셨습니다.,4,1년 전
y_157_367,전주 스토리,열일곱애기똥풀,깔끔하고 넓고 좋아요 하지만 방음 처리가 너무 안되요 항상 위에서?? 발이 쿵쿵? 큰 소리가 많이 들려요 깔끔하고 넓고 좋아요 하지만 방음 처리가 너무 안되요 항상 위에서?? 발이 쿵쿵? 큰 소리가 많이 들려요,5,2년 전
y_157_368,전주 스토리,1774481,시설도 청결도 조았어요 ~ 전주 올때마다 이용합니다,5,7년 전
y_157_369,전주 스토리,하남콜리,방도 깔끔하고 침대도 푹신하고 친절하셔서 좋았어요,5,6년 전
y_157_370,전주 스토리,308890,항상 올때마다 좋은 편의시설에 기분이 좋습니다,5,8년 전
y_157_371,전주 스토리,뀨잉가즈아,시설도 깔끔하고 냄새도 안나고 너무 좋아요👍👍,5,5년 전
y_157_372,전주 스토리,5915713,항상 잘 이용하고 있습니당! 청결하고좋아요ㅎㅎ,5,4년 전
y_157_373,전주 스토리,1253293,깨끗하고크고다조은데요 영화볼때티비소리가안남,5,7년 전
y_157_374,전주 스토리,2687456,변기 물 내려가는 소리 빼면 100점 드려요,5,7년 전
y_157_375,전주 스토리,m46,깨끗하고 아늑한 곳이네요 깔끔하네요~ 가성비 좋은곳입니다 방도 깔끔하고 수압도 좋았어요 다시 재방문의사 200프로네요 ! 출장중인데 잘쉬고 출근합니다 사업 번창 하시고 대박나세요~~,5,2년 전
y_157_376,전주 스토리,1007104,전주 에서 쓰는곳중에 만족스럽다고 느낀곳중 하나!!! 너무 좋아하는곳이에요!!! 갈때마다 나쁘다는 느낌이아니라 예약안하면 자리없어서 다른곳찾아다니느라 ㅠㅠ 고생좀하는데 그만큼 좋아서겠죠?? ㅎㅎ,5,8년 전
y_157_377,전주 스토리,찌랑,"오랜만에 갔는데 여전히 넓고 쾌적해서 좋아요. 컴퓨터도 빨리 잘 되고, TV랑 연결해서 넷플릭스나 왓챠도 볼 수 있어요! 침대 헤드쪽도 깨끗하게 잘 닦여있어서 잘 쉬다 왔습니다!!!",5,4년 전
y_157_378,전주 스토리,94세당나귀,깔금하고좋아요 전화도 친절하게받아주시고요,5,7년 전
y_157_379,전주 스토리,2156775,시설 정말좋고 깨끗합니다 적극 추천!!,5,8년 전
y_157_380,전주 스토리,43500,세번 가봤는데 이제서어 리뷰 남깁니다. 정말 정말 강추하는 모텔입니다. 깨끗하고 버스 정류장이랑도 가까워서 교통편도 좋아요. 장거리 연애 하시는 분들께 특히나 추천하는 숙소입니다ㅎㅎ,5,8년 전
y_157_381,전주 스토리,5915713,청결하구용! 시설도 만족스럽습니다^^,5,4년 전
y_157_382,전주 스토리,셀룰라,좋아요 방도넓고 깨끗해요 화장실이 개방형이라 좀그래요,2,7년 전
y_157_383,전주 스토리,군산조식,만족합니다. 청결합니다.,5,1년 전
y_157_384,전주 스토리,878336,좋아요. 다만 욕조가 깨끗하지 않아서 아쉽 ㅠㅠ,4,8년 전
y_157_385,전주 스토리,6213475,여자 셋이서 썼는데 정말종말 맘에 들었습니다!!! 덕분에 잘놀고 잘자고갑니당,4,7년 전
y_157_386,전주 스토리,듀콩넴,넓기도하고 깔끔하니 매우좋습니다 고급져보이구요,4,6년 전
y_157_387,전주 스토리,1888850,처음 들어갔을땐 객실도 넓고 괜찮았는데 청소가 안된건지 구석에 사용된 콘돔이 있더라구요.... 짜증나서 바로 말은 안했는데 투숙하는 내내 기분이 안좋고 찝찝했습니다. 진짜 무엇보다 청결을 제일 중요시 해주시길 바랍니다.,2,8년 전
y_157_388,전주 스토리,8864939,좋습니다 락스 냄새가 좀 심하네요,4,5년 전
y_157_389,전주 스토리,9702385,깔끔한시설 편리한교통,5,6년 전
y_157_390,전주 스토리,94세당나귀,상태좋고 친절하네요,5,5년 전
y_157_391,전주 스토리,2897105,정말 너무 좋고 무엇보다 친절하셔서 좋았어요 다음에 전주오게 된다면 꼭다시 오고싶네요^^,4,8년 전
y_157_392,전주 스토리,기다려봐아,일회용품이 삭아있었어요...,3,5년 전
y_157_393,전주 스토리,2574688,2번째 방문이었는데 이번에도 역시나 만족!! 시설도깨끗하고 최신식이어서 최고에요ㅎㅎㅎ 전주에 일이있어서 한달에 한번정도 가는데 항상여기만 갈거같네요^^,5,8년 전
y_157_394,전주 스토리,북군,일반실 달라고 했는데 트윈으로 업글해주심. 욕실이 상당히 넓은데 문이 없어 화장실 이용시 조금 민망함이 있을수 있음. 그 외 모든면은 다 만족,5,8년 전
y_157_395,전주 스토리,1585315,전주천 거닐다가 생각나면 예약하는 곳이에요 터미널이랑도 가까워서 딱 좋아요,3,9년 전
y_157_396,전주 스토리,8725941,여자직원 넘안친절하쥬 잘 몰라서 전화드렸는데 한숨쉬고 자다깨웠다고 짜증내는거같앴움,2,5년 전
y_157_397,전주 스토리,쩌리언니,횐기잘되고 침대 폭신하고 춥지도 않고 전에 다니던곳보단 전체적으로 맘에 드는곳이네요 한번가게되면 자주애용하게 될만한곳인거같네요,5,8년 전
y_157_398,전주 스토리,열살브레인,여기 굉장히 깔끔하고 객실 엄청큽니다. 큰 객실 선호하시는분 완전 강추! 쓸데없이 크다는 생각 들 정도로 크다고 보시면돼요. 콘센트도 곳곳에 있어서 엄청 편리함. 무엇보다 주로 모텔에서 나는 락스냄새 잘 빼줘서 그것도 좋음여기 굉장히 깔끔하고 객실 엄청큽니다. 큰 객실 선호하시는분 완전 강추! 쓸데없이 크다는 생각 들 정도로 크다고 보시면돼요. 콘센트도 곳곳에 있어서 엄청 편리함. 무엇보다 주로 모텔에서 나는 락스냄새 잘 빼줘서 그것도 좋음여기 굉장히 깔끔하고 객실 엄청큽니다. 큰 객실 선호하시는분 완전 강추! 쓸데없이 크다는 생각 들 정도로 크다고 보시면돼요. 콘센트도 곳곳에 있어서 엄청 편리함. 무엇보다 주로 모텔에서 나는 락스냄새 잘 빼줘서 그것도 좋음,5,3년 전
y_157_399,전주 스토리,냉담한역사,좋아요~~~~~ㅇㅅ,5,6년 전
y_157_400,전주 스토리,옹기옹기,생각보다 방음이 너무 안됬어요 옆방 물내리는 소리나 씻는소리 다 들렸어요 군데군데 녹슬어있는곳도 있고 가운도 보풀이 너무 일어서 입을때 까칠까칠했어요 다음에 전주오더라도 여기는 안올거 같아요,1,6년 전
y_157_401,전주 스토리,일없는침엽수,굉장히 만족합니다 전날 비싼가격의 호텔보다 친구들이 대단히 좋아하네요~ 친구셋이서 여행중~ㅋ 다음에 전주오면 꼭 들리겠슴니다,5,5년 전
y_157_402,전주 스토리,여기어때 이용 고객,처음방문인데 깔끔하네요,5,5년 전
y_157_403,전주 스토리,자유주의적인가자미,따뜻한 물 팡팡 나와서 좋습니다,4,1년 전
y_157_404,전주 스토리,훼이루,들어가자마자 집 느낌이 들네요~ 깨끗하고 따뜻해요~ 넘 좋아요~ 잘 쉬고 갑니다~~ 감사합니다~~ 다음에 또 방문할게요~,5,6년 전
y_157_405,전주 스토리,8864939,좋습니다. 다만 화장실 물이 안내려가고 세면대에 이물질이 있어서 잘 안내려가네요 아침에 뜨거운물이 나왓다 안나왓다해요,5,5년 전
y_157_406,전주 스토리,스물여덟살방법,좋아요좋아요좋아요좋,5,1년 전
y_157_407,전주 스토리,론다번,우선 주말인데도 다른 모텔에 비해 완전 저렴했어요 아이들이 있어 특실트윈에서 숙박했는데 방도 넓고 좋아요 전주갈때마다 이용하는 곳입니다..,5,2년 전
y_157_408,전주 스토리,GC1510908714,저렴한가격에 잘 이용했습니다~,4,2년 전
y_157_409,전주 스토리,진55,VIP로 1박햇는데 신축건물이라 그런지 깨끗하고 넓어서 좋앗어요~ 다음엔 드라이빙으로 가볼까 생각중입니다ㅎㅎㅎ,5,8년 전
y_157_410,전주 스토리,9652044,트윈 입실했는데 넓고 깨끗하고 좋아요~ 직원분도 친절하고 셀프코너로 토스트도 먹을수 있어서 너무 좋습니다~~,5,6년 전
y_157_411,전주 스토리,미사펠리칸,깔끔하게 잘썼어요^^,3,6년 전
y_157_412,전주 스토리,hh6552,방이 무지 넓어요 근데 목욕탕에 머리카락이..,3,6년 전
y_157_413,전주 스토리,쌍썬,괜찮괜찮괜찮괜찮괜차,3,7년 전
y_157_414,전주 스토리,아무흠,깨끗하고 침대도 푹신푹신하여 잠을 푹자게 되었네요ㅎ 손톱부러져 밴드를 찾았는데 바로있어서 좋았어요ㅎ,5,8년 전
y_157_415,전주 스토리,앵두앵두우,생각보다 깔끔하고 넓고 너무 좋았어요! 가격도 적당한거같아요 ㅎㅎ 다음에 또 오겠습니다~!,5,8년 전
y_157_416,전주 스토리,소수서원,친절하고 좋아요~~~~!~!~ 청결하고 좋아오 객실컨디션도 나쁘지 않고 처음 들어갔을 때 담배냄새만 빼고 다 좋았어요~~~ 비흡연실 있으면 좋겠다는 생각이 들어요!! 재방문 의사있씁키당,5,2년 전
y_157_417,전주 스토리,손에땀난다,입구에들어서자마자 좋은향기와함께 청결하다는 느낌을 받았습니다 방도따뜻해서 너무좋았습니다,5,8년 전
y_157_418,전주 스토리,2884805,시설 관리 모두 최고입니다 깨끗하고 깔끔하고 너무너무 좋아요 앞으로 여기만 이용해야 겠네요,5,8년 전
y_157_419,전주 스토리,89545,깔끔한 인테리어 너무 좋습니다 이렇게만 있으면 맨날 자고 싶네요ㅎㅎㅎ 잘있다가 갑니다,5,8년 전
y_157_420,전주 스토리,2156775,너무너무 깨끗하고 시설도 좋고 아무 마음에 들었습니다ㅋㅋ 다음에 또 가고싶네요ㅋㅋ,5,8년 전
y_157_421,전주 스토리,2156794,출장때문에 전주 버스터미널 근처 여기저기 다녀뵜지만 여기만큼 좋은데 아직 못봤음!!,5,8년 전
y_157_422,전주 스토리,콩29,사장님 완전 친절하시구 진짜 완전 배려심 짱!!!!!!!!!!!!!!!!!!!!,5,8년 전
y_157_423,전주 스토리,월희,넓이가 무슨...기존 가던모텔 두배정도... 너무넓어서 깜짝놀랐네요 둘보단 친구들끼리 술먹을때 좋을정도... 안에 만원짜리 성인장난감도 팔고 재밌게 놀다갑니다 화장실이랑 씻는곳이 붙어있는점이 아쉽,5,4년 전
y_157_424,전주 스토리,3003350,사장님과 직원분들도 친절하시고요 객실은 넓고 깔끔하고 깨끗하네요 좋습니다 번창하세요,5,7년 전
y_157_425,전주 스토리,2724831,진짜믿고가는 스토리 너무 좋습니다 고급스럽고 인테리어도좋고 진짜 좋습니다 좋아요,5,8년 전
y_157_426,전주 스토리,2971800,깨끗하고 넓고 좋으네요~ 살짝 방음이 안되는것빼고는요~^^ 일단 깔끔해서 좋았습니다,5,8년 전
y_157_427,전주 스토리,18376372,사진그대로 너무좋았어요 방도 정말 넓고 깨끗해서 다음에 전주가면 또 이용하고싶어요,5,8년 전
y_157_428,전주 스토리,넓죽넓죽한장소,좋은듯합니다!!! 전북대 자이라는 곳에서 실망하고 와서 그런지 더 좋게 느껴지네요,5,8년 전
y_157_429,전주 스토리,더운취침,대실했었는데 넓고 깨끗하고 좋습니다 잘쉬다가는거같아서 좋아요 ~홓 추천합니다,5,9년 전
y_157_430,전주 스토리,까칠한숲,매번 찾지만 너무 만족스러운 객실! 편의시설! 깔끔! 다 갖추고잇는 곳!!,5,7년 전
y_157_431,전주 스토리,251600,깔끔하고 좋았어요. 시설도 매우 만족 하였고 담음에. 또 이용 할것 같네요,5,8년 전
y_157_432,전주 스토리,민둥한정원,매우좋아욯ㅎ 남자친구도 좋아하수됴 자주 들릴께요 ㅎㅎㅎㅎㅎ감사합니다 ㅎㅎㅎ,5,8년 전
y_157_433,전주 스토리,1740120,항상 이용하고 있습니다. 우선 신축이라 방도 깨끗하도 관리도 잘되어 있어요,5,8년 전
y_157_434,전주 스토리,2156775,깨끗하고 분위기도 좋고 아주아주 좋습니다.ㅋㅋㅋㅋㅋㅋㅋㅋㅋㅋㅋㅋㅋㅋㅋㅋㅋ,5,8년 전
y_157_435,전주 스토리,2156775,객실이 깨끗하고 깔끔하고 아주 좋습니다. 후회하지 않습니다. 40글자ㅋㅋ,5,8년 전
y_157_436,전주 스토리,5551357,깨끗하구 베게도 편하고좋아요 거품목욕도 좋구요 다음에또이용하고싶은곳입니다,5,7년 전
y_157_437,전주 스토리,2748327,갈때마다 이용하는곳 깨끗하고 넓고 조아요 근데 커피는 이제없나봅니다ㅜ,5,6년 전
y_157_438,전주 스토리,4206260,방 업그레이드 해주시고 좋았어요 프론트가 3층에 있어서 좀 신기했어요,5,7년 전
y_157_439,전주 스토리,여기어때 이용 고객,아주아주이주아주아주만족합니다.아주아주이주아주아주만족합니다아주아주이주아주아주만족합니다.아주아주이주아주아주만족합니다아주아주이주아주아주만족합니다.아주아주이주아주아주만족합니다아주아주이주아주아주만족합니다.아주아주이주아주아주만족합니다,5,2년 전
y_157_440,전주 스토리,홍당모,방이 너무 넓어요 좀 줄이고 차라리 욕조를 넣는게 더 좋을듯 ㅋㅋ,5,6년 전
y_157_441,전주 스토리,따뜻한휴지,여기 힌번 오고서 정말 좋다고 생각했습니다 춥지도 않고 비데있고 샤워실도 작지만 깔끔하고 티비도 넷플가능이며 그리고 무엇보다 공간이 참 넓어서 너무 좋습니다... 애용하겠습니다ㅎㅎ,5,2년 전
y_157_442,전주 스토리,츄블린,방이따뜻하고넓어서 좋네요^^,4,6년 전
y_157_443,전주 스토리,2748327,깨끗하고 조아여 침대도 편하고 역시 다니던데를 가는게 좋네요ㅋ,5,7년 전
y_157_444,전주 스토리,2748327,조아요 깨끗하고 조용하고 따듯하고 이용하던곳이 역시 편합니당,5,7년 전
y_157_445,전주 스토리,포근한화분,전부 다 좋은데 샴푸 린스가 너무 안조아여... ㅜㅜ....,5,5년 전
y_157_446,전주 스토리,스물여덟살방법,좋아요좋아요좋아요좋,5,1년 전
y_157_447,전주 스토리,블랙러시안,너무 편히 묵고왔습니다~~깔끔하고 친절하시고 다 좋았어요,5,6년 전
y_157_448,전주 스토리,포근한화분,완전만족 욕실 미끄러운거 빼고는 갈때마다 만족 1000퍼,5,5년 전
y_157_449,전주 스토리,662431,너무 깨끗하고 시설이.정ㅁ말 최첨단 내일도 갈거에요 ><,5,7년 전
y_157_450,전주 스토리,무등산굴,시설도 넘나좋고 깨끗하고 넘나 좋으네요 수고하세요,5,7년 전
y_157_451,전주 스토리,그즈느,"사장님 친절하심 출장이었는데 짐도 잘 맡겨주심 4인용 느낌임 개넓음 깔끔함 이불에 아주 작은 이염 말고는 거슬리는 부분 없었음 전반적으로 매우 만족해서 가성비 굿, 또오고 싶음",5,1년 전
y_157_452,전주 스토리,스물여덟살방법,"좋,아요좋아요좋아요",5,1년 전
y_157_453,전주 스토리,이진영29,무인텔이고 터미널근처이고 위치도 좋고 방도 깨끗해요,5,6년 전
y_157_454,전주 스토리,손에땀난다,향기나는객실에 깨끗하기까지 해서 너무좋았습니다^^,5,7년 전
y_157_455,전주 스토리,흥겨운식물,시설이 깔끔하고 엄청 넓네요 자주 이용할께요~,5,5년 전
y_157_456,전주 스토리,4837791,자주 이용하는데 진짜 시설 다 깨끗하고 좋아용,5,5년 전
y_157_457,전주 스토리,혜남찬여,잘 쉬다가 왔습니다. 시설도 깔끔해서 좋아요,5,6년 전
y_157_458,전주 스토리,쿠닌수,방도 컸구 시설도 깔끔했습니다 잘쉬다가가요~,5,7년 전
y_157_459,전주 스토리,이명철6,사장님 친절하시고 깨끗하고 너무 좋았어요,5,6년 전
y_157_460,전주 스토리,2764080,깨끗하고 시설도 좋았어요 잘 쉬다갑니다~,5,8년 전
y_157_461,전주 스토리,7008572,두번째묵는곳인뎅 시설이 너무 좋아요!!,5,7년 전
y_157_462,전주 스토리,뇽마,깔끔하고 조용해요 편하게 쉬었어요,4,6년 전
y_157_463,전주 스토리,찌랑,자주 이용하는데 좋아요%~~넓어요!,5,5년 전
y_157_464,전주 스토리,여기어때 이용 고객,깨끗하고 좋았어요 침대도 나쁘지 않고,5,4년 전
y_157_465,전주 스토리,2208491,좋습니다 깔끔하고 시설도 좋고^^,5,7년 전
y_157_466,전주 스토리,포근한화분,진짜 추천ㅋㅋㅋㅋ! 후회 안함ㅋㅋㅋ,5,5년 전
y_157_467,전주 스토리,2593566,너무 깨끗하고 청결해요! 좋았습니다,5,7년 전
y_157_468,전주 스토리,6558198,유리도깨져있고 냄새도 조금 났네요,3,7년 전
y_157_469,전주 스토리,아무렇지않은폭스하운드,항상깔끔하고친절하시고너무좋아요,5,2년 전
y_157_470,전주 스토리,하나사슴,두번째이용~~ 좋아요!!! ㅎㅎ,5,7년 전
y_157_471,전주 스토리,하얀제프리,늘 이용하는곳이예요 좋아요 역시,5,6년 전
y_157_472,전주 스토리,하얀제프리,좋아요 늘 이용하는곳이예요 ^^,5,6년 전
y_157_473,전주 스토리,2748327,항상깨끗하고조아요 매번이용하는곳,5,6년 전
y_157_474,전주 스토리,샤람이먼저다,깔끔하고 시간도 넉넉하여 좋네요,5,5년 전
y_157_475,전주 스토리,7006025,인테리어가 정말 마음에 들었어요,5,6년 전
y_157_476,전주 스토리,5915713,만족스럽게 잘 이용했습니다~!,5,5년 전
y_157_477,전주 스토리,우아한코코샤넬,나쁘지 않았어요 가격도 그렇구,5,6년 전
y_157_478,전주 스토리,치킨5,직원이디게친절하시고완전좋았어요,5,8년 전
y_157_479,전주 스토리,여든다섯귤,정말 깔끔해요 시설도 좋아요,5,5년 전
y_157_480,전주 스토리,불필요한불여우,방도깨끗 서비스도 좋아요,5,7년 전
y_157_481,전주 스토리,근사한수정,화장실과 욕실이 구분되어있어서 좋아요,5,1년 전
y_157_482,전주 스토리,냉담한역사,대실너무비싸요 ㅜㅜㅜ,5,6년 전
y_157_483,전주 스토리,열일곱애기똥풀,방이 엄청 넓고 깨끗해요 방이 엄청 넓고 깨끗해요 방이 엄청 넓고 깨끗해요 방이 엄청 넓고 깨끗해요 방이 엄청 넓고 깨끗해요 방이 엄청 넓고 깨끗해요 방이 엄청 넓고 깨끗해요,5,2년 전
y_157_484,전주 스토리,강원랜드포획자,쾌적하고 구조도 독특했어요,5,3년 전
y_157_485,전주 스토리,1619869,엄청 깨끗하고 친절해용~!,5,7년 전
y_157_486,전주 스토리,5915713,잘이용하고있어요 좋습니당,5,5년 전
y_157_487,전주 스토리,목담서원삼엽충,객실이 깔끔하고 좋아요,5,6년 전
y_157_488,전주 스토리,4777084,청결하니 잘쉬다갑니다!,5,6년 전
y_157_489,전주 스토리,하얀제프리,자주 이용해요 좋습니다,5,6년 전
y_157_490,전주 스토리,신뱅이,시설도 좋고 깔끔합니다,5,7년 전
y_157_491,전주 스토리,lsjghgh,주차하기 편해서 좋아요,5,5년 전
y_157_492,전주 스토리,치즈몽꿀,여기 화장실이 일반모텔반해요 진짜넓은편이네요 깨끗하고 푹 쉬다갑니다 에어컨도 깨끗하고 다 너무좋아서 다음에 전주오면 또 이용할게요여기 화장실이 일반모텔반해요 진짜넓은편이네요 깨끗하고 푹 쉬다갑니다 에어컨도 깨끗하고 다 너무좋아서 다음에 전주오면 또 여기 화장실이 일반모텔반해요 진짜넓은편이네요 깨끗하고 푹 쉬다갑니다 에어컨도 깨끗하고 다 너무좋아서 다음에 전주오면 또 이용할게요,5,3년 전
y_157_493,전주 스토리,유쾌하고새로운조미료,깔끔하고 져렴하고 좋았습니다,5,1년 전
y_157_494,전주 스토리,초절정미남꽃,좋습니다 깔끔해용 추천합니다,5,2년 전
y_157_495,전주 스토리,3341248,새로지은 건물이라 그런지 너무 깔끔하고 좋았습니다 출장 일주일 내내 묵었는데 전주오면 또 오겠습니다 그때도 싸게 주세요! ㅋㅋ,5,7년 전
y_157_496,전주 스토리,열일곱애기똥풀,바닥도 따뜻하고 이불도 깨끗한 편이여서 좋았습니다 화장실이랑 샤워실도 나눠져있고 세면대도 따로 있어서 편하구용 ! 따뜻한물도 잘 나오구 직원분도 친절하셔서 좋은 기억에 남네용 담에 또 갈게요,5,3년 전
y_157_497,전주 스토리,항상봄느낌으로,객실이 이쁘고 좋아요 잘 쉬고 갑니다,5,4년 전
y_157_498,전주 스토리,구경온나그네,제가 다녀본 숙소중 최고 숙소라 말할만한 곳입니다. 깨끗하고 화려하고 멋진곳입니다. 기회가된다면 또방문하겠습니다.,5,8년 전
y_157_499,전주 스토리,블랙러시안,준특실만 가고 일반은 처음이었는데 일반실도 너무 깔끔하고 따뜻하고 아늑해서 너무 푹잤습니다! 스토리 조아용!,5,6년 전
