id,name,nickname,review_content,rating,write_date
y_157_073,전주 스토리,아픈섬,"화장실 샤워실은 천장이 뚫려 있어서 맘 편히 씻지도, 화장실을 가지도 못했습니다 . 여자 사장님이 체크인 해주셨는데 여자3명이라 하니깐 이상한 눈빛으로 보시더라구요. 또 2인기준이라 1만원 추가로 냈구요. 주차시설이 어떻게 되어 있는지 모르고 1층이 주차 공간이였구 써있는 호수 안에 넣으면 2층으로 바로 올라가는 구조였습니다. 차는 받쳐야 해서 일단 빈 곳에다 주차 했는데 프론트 가니깐 여자 사장님이 손님 받아야 하는데 거기다 주차하면 어떡하냐고 전화를 하고 왔어야지 하고 화를 내시는거입니다!! 저희는 몰라서 일단 주차 했다구 했는데 저희 표정이 굳어지니깐 사장님께서 밖에 주차 자리 있으니깐 밖 주차 자리에다가 주차 하라고 애써 웃으면서 말씀 하시더라구요.. 아무리 어리다지만 .. 손님인데.. 그리고 퇴실 시간이 13시라 되있는걸 확인하고 거기로 화장실 예약 한건데 12시 조금 넘으니깐 전화로 주말이니깐 빨리 나오라 하시더라고요.. 그럼 체크인 할때 내일은 주말이니 손임을 받아야 하니깐 빨리 퇴실 하시면 감사하겠습니다 라고 말씀을 해주셨으면 준비를 빨리 했을텐데요.. 저희도 손님인데 어리다고 무시하는게 너무 느껴졌습니다.. 전주 놀러와서 좋게 숙박 하려고 온건데 일행들이 기분만 상해서 갔습니다 다음부턴 조심해주세요",1,5년 전
y_157_074,전주 스토리,열*****,좋아요 다음에도 쉬러 갈께용 주차 자리도 넓고 객실도 깨끗했어요 빠르게 안내해주시고 전화해주신 직원분도 친절하셨습니다 넷플릭스도 되는것도 좋았어용 ㅋㅋ 머리끈이랑 다 구비되어있습니닷,5,2년 전
y_157_075,전주 스토리,홍*****,체크인하고 침대에 앉으려고 보니 뭐가 있더라고요 침구를 교체 안해주신건지 ... 솔직히 좀 기분이 그랬습니다 그 시간에 다른 객실 청소 중이셨는데 흠 청결에 신경 많이 써주세요,4,3년 전
y_157_076,전주 스토리,아무렇지않은폭스하운드,항상어기들리는데요 사장님 너무친절하시고 우선 주차시설편하구 깔끔해요 그리고담배냄새도 안나고 번화가랑가까이있으니좋구요 이불이랑포근포근해서 자는데도 넘편했어요 화장실도깨끗하구요 담에재방문할께요,5,3년 전
y_157_077,전주 스토리,2077116,객실 사진보고 준특실로 예약하려고 전화했는데 있다고 하셨으면서 일반실 주신 듯 하네요 일반실 준 것 까지는 그렇다쳐도 사진과 퀄리티가 많이 달라서 실망했습니다. 사진에 과장이 아주 많이 들어간 것 같군요ㅎㅎ,3,8년 전
y_157_078,전주 스토리,주깨비,일반방치고 넓어서 너무 좋아요 담배냄새도 안나고 물 수건 부족하면 갖다쓰면되구용!!!!!!!!!!!!!!!!!!!!!자주 애용하는곳입니당!!!!!!!!!!!!번창하세요 항상!!!!!!!!,4,3년 전
y_157_079,전주 스토리,주깨비,항상 잘있다갑니당~~ 편하게 있다가요 침대도 푹신푹신하고 욕조도 넓고.. 수건 물도 카운터 옆에 있어서 편해요ㅎㅎ 방도 넓직하고 편의점도 바로앞에 있어요 자주애용중입니당 번창하세여!,4,3년 전
y_157_080,전주 스토리,주깨비,일반방치고 넓어서 너무 좋아요 담배냄새도 안나고 물 수건 부족하면 갖다쓰면되구용!!!!!!!!!!!!!!!!!!!!!자주 애용하는곳입니당!!!!!!!!!!!!번창하세요 항상!!!!!!!!,4,3년 전
y_157_081,전주 스토리,3379709,원래 하루만 여기서 지내고 내일은 다른 곳으로 이동하려고 했는데 지내면서 넓고 좋아서 연박하게되었어요~ 직원분도 친절하시고 안내도 잘해주셨구요 청소안해주셔도 되는데 청소도 깨끗이 해주셔서 감사해요. 일단 트윈특실이 넓어서 좋구요 저녁에도 따뜻하게 해주셔서 정말 푹잤어요. 다만 컴퓨터가 엄청빠른데 어도비플레시?그게 안되서 ...음악플레이어가 안된거빼고는 다 좋아요. 호텔에서 이 정도 방크기면 10만원은 기본으로 넘을텐데 이정도 방크기에 인테리어에 1박65000원이면 굉장히 괜찮은 숙박료라고 생각해요:) 다음에도 전주오면 이 곳에서 묵고싶네요.,5,8년 전
y_157_082,전주 스토리,독특하고온화한수달,최근에 방문하거 좋아서 또 방문했습니다. 늦은 시간에 가도 되는점도 역시 좋아요 컴퓨터랑 티비가 같이 있는데 예전에는 컴터랑 티비랑 연결이 됐었는데 지금은 안된다고 하네요 그래도 뭐 넷플릭스랑 볼수있어서 상관은 없었습니다. 이불상태 또한 청결하고 약간 어두컴컴한 부분이 있긴 하지만 괜찮습니다. 주차공간은 밖에 몇대댈수가 없어서 그옆에 있는 가게 주차장을 이용했습니다. 저녁이라 딱히 제재가 없어 주차장 만차시 이용하시는것도 좋아보입니다. 가격도 매우 저렴해서 좋아요,4,1년 전
y_157_083,전주 스토리,4493640,"3명이서 출장가서 숙박하느라 차가지고가는 직원은 드라이빙룸 했고 나머지는 준특실로 했는데, 드라이빙룸이라 해서 뭔가했는데 차까지 같이 방이랑 연결되는 신기한 구조라 다들 좋아했어요 근데 준특실 특히 310호는 화장실 하수구냄새때문에 3일내내 넘 힘들었어요 무조건 꼭 수리를 하셔야할 거같아요 그외엔 시설도 좋고 넓고 깨끗하고 친절하고 바로앞 편의점도 있어서 아주 만족해요 감사해요",5,6년 전
y_157_084,전주 스토리,열일곱애기똥풀,좋아서 자주 갔었지만 ㅠ̑̈ㅠ̑̈ 이날따라 방음이 정말 안되서 다른 방에서 소리 나는것도 들리구 밖에서 통화? 하는것도 들리더라구요.. 혹시나 창문이 열렸나싶어서 봤는데 닫혀있는 상태 ㅜㅜ 이방만 그런가 싶기도 하고 ‎ﻭ‎ﻭ 전에는 크게 신경쓰이지않아서용..! 암튼 잘 이용했습니다,4,3년 전
y_157_085,전주 스토리,즉흥적인엄마,2박3일 숙소는 스토리모텔로 예약 ㄱㄱㄱ 후다닥..ㅋ 아이와 함께라서 트윈방 잡앗어요~~쏴장님께서 객실 업그레이드~~호오랏!!!인심팍팍 감쏴해열~~♡ 방에 들어가는 순간 오~~넓다 침대 푹신푹신 잠잘때 생명은 베개인거죠??? 너무 좋앗어요 퐁신퐁신해서 일단 객실컨디션 굿!!!하루 자고 일어나서 전주 볼거리 먹거리 하고 들어왓는데 방이 엄청 깨끗하게 정리되어있네요??? 청결합니다 심플하고요 넓고용!!!!모자란부분 다 채워주셨고요~~오늘도 맛잇는 전주음식먹고 스토리에서 꿀잠 청할랍니다 아!!!!!방음 쩔오용!!!우리가 끝방이라소 그런건지는 모르겟지만 조용해요 느므느므 좋앗오용,5,5년 전
y_157_086,전주 스토리,빨간맛초록맛,사실 주차장 시설이 조금 불편해서 들어갈때는 아쉬운면이 없지 않지만 건물에 들어가는 순간부터는 아쉬움이 사라지는것 같습니다. 청결을 중요시 하는 사람으로서 갈때마다 침구시트가 깔끔해서 너무 좋습니다.,5,3년 전
y_157_087,전주 스토리,쏜살같은깃,시설은 만족스러웠습니다. 하지만 퇴실시간이 1시인데 12시쯤부터 몇 분 간격으로 계속 이용시간이 지났으니 연장하려면 카운터에 문의하라는 알람이 울려서 짜증났어요. 그리고 보통 전화로 퇴실준비 해달라고 말해주시는데 여기는 청소시간이라고 나가달라는 식으로 말을 해서 좀 별로였어요. 지금 생각해보니 일부러 빨리 나가라고 저렇게 조작해둔거 같다는 생각이 드네요,3,6년 전
y_157_088,전주 스토리,포리파파,"터미널 근처에 있는 곳 중에서는 가장 시설 좋은 곳이라 생각됩니다. 깔끔하고, 욕실도 크고, 신기한 것도 있고요 에어컨도 빵빵합니다. 다만 청소상태가 욕조주변이랑 침대 구석쪽에 머리카락이 한두개 보였던게 약간 신경 쓰였네요.",4,7년 전
y_157_089,전주 스토리,feelhot,"첫번째는 드라이빙으로 두번째는 도보로 이용해서 프론트거쳐서 가는 준특실 이용했어요.. 객실도 괜찮았구 청소상태로 양호했는데,다만 베개에서 조금 냄새가 나더라구..침구상태도 점검해주셨으면 좋겠어요",4,7년 전
y_157_090,전주 스토리,주깨비,역시 무난합니다~~ 고터 주변에선 이정도 숙소 없을듯 싶어요ㅎㅎ 일단 침대가 너무 푹신푹신거리고 잠이 잘와요~ 덕분에 여자친구도 푹 잔거같아 좋습니다~ 고터 주변 잘일있음 또 애용할게요,4,3년 전
y_157_091,전주 스토리,열살브레인,이 근처 숙박업소중 가장 가성비가 좋은 편. 대부분 노후되고 관리가 안되는 편. 그러나 이곳은 비교적 신축이고 방음이 잘됨. 주차공간 많고 객실이 이 근방중 제일 큼. 다만 이번 숙소 청결상태는 좀 많이 아쉬웠음. 머리카락이 좀 많이 발견되서 ㅜㅜ 원래는 안그러니까 넘어감. 이 근처 숙박업소중 가장 가성비가 좋은 편. 대부분 노후되고 관리가 안되는 편. 그러나 이곳은 비교적 신축이고 방음이 잘됨. 주차공간 많고 객실이 이 근방중 제일 큼. 다만 이번 숙소 청결상태는 좀 많이 아쉬웠음. 머리카락이 좀 많이 발견되서 ㅜㅜ 원래는 안그러니까 넘어감.,4,2년 전
y_157_092,전주 스토리,vjh1104v,"매번 가겠다고,가보고 싶다고만 하고 못가본 스토리를 가보게되네요ㅎ 언빌리버블~!~!~!ㅎㅎㅎ 역시 사진과 별차이를 못느낀 방구조와 인테리어ㅎ 다른곳에서 화려함을 봤다면,여기에서는 모던함을 보게된곳 스토리ㅎ 무엇보다 침대가 푹신하니 너무 좋았습니다ㅎㅎㅎ 방이 크다ㅎ 청결나쁘지 않음ㅎ 침대가 푹신ㅎ 컴터도 속도 나쁘지 않음ㅎ 에어컨도 천정에 있어서 더 시원했다는ㅎ 욕실.화장실은있지만ㅎ다른게 없다는 단점ㅠㅜ 앞으로는 올일 많을것 같음ㅎㅎㅎ 잘쉬다갑니다^^!",4,8년 전
y_157_093,전주 스토리,soso194,화장실이랑 샤워실이 따로 있어서 좋았습니다.,4,1년 전
y_157_094,전주 스토리,주깨비,항상 잘있다갑니당~~ 편하게 있다가요 침대도 푹신푹신하고 욕조도 넓고.. 수건 물도 카운터 옆에 있어서 편해요ㅎㅎ 방도 넓직하고 편의점도 바로앞에 있어요 자주애용중입니당 번창하세용~,4,3년 전
y_157_095,전주 스토리,반소희1,겨울인데도 더워서 땀을 흘릴정도로 난방을 잘해주셔서 너무 좋았구요 지은지 얼마안되서 그런가 시설이 깨끗하고 너무 좋더라구요 다만 너무 골목에 위치해서 찾기가 어려웠어요 그리고 기본물품이 비치가 안되있어서 원래 없는건가 사야하는건가 생각하고있었는데 저희 일행이 방을 두개 잡았는데 나머지 방에는 기본물품이 비치가 되있더라구요 그런 사소한것만 조금만 더 신경써주시면 너무 좋을 거 같아요 시설이랑 청결도 등은 너무 좋았어요,4,8년 전
y_157_096,전주 스토리,주깨비,직원분들은 만날일이 딱히 없어서 잘모르겠구요ㅎㅎ 일단 고속터미널 주변 모텔중에선 상급인듯해요 가격도 이정도면 적당하구요 욕조도 넓고 방도넓고 좋습니당 이정도면 탑3정도일듯하네요 고터주변에서요ㅎ,5,3년 전
y_157_097,전주 스토리,카미이,저는 가격대비 제가 다녀본 결과 가장 깨끗하게 관리하는 것 같으며 구석구석 다른곳에 비하여 청결하게 하려고 노력이 보이더군요 침구도 깨끗하고 개보수 많이 했더라구요 몇몇 곳을 제외 하고는 대체적으로 괜찬은편 입니다 간혹 겉만 번드르하고 내부는 냄세심하고 낡고 곳곳이 청소한 흔적만 낸 집들이 간혹 있습니다. 가성비 아주 괜찮습니다,5,2년 전
y_157_098,전주 스토리,옅은짐승,불편한점 1.욕실 문 위로 뚫려 있어서 샤워할때 따뜻한물로 씻어도 금방 춥다는점 2. 침대에서 느껴지는 먼지인지 뭔지 이물질이 있어 까끌까끌한 점 3.리모컨에는 넷플릭스 인데 넷플은 안나오고 지니만 나오는 점 빼면 인테리어도 깔끙하고 넓어서 그냥 저냥 만족하고 나왔습니다,3,1년 전
y_157_099,전주 스토리,12638823,"위치: 고속버스터미널 근처로 도보 5분 이내라서 너무 좋았어요 주변편의시설 : 바로 앞에 편의점이 있어서 아침에 간단히 식사할것을 사오기도 좋았고, 도보 5분거리 이내에 폴바셋이나 24시 하는 해장국집도 있어서 2박 하는 동안 편했습니다 객실상태: 상당히 넓고 깔끔했고, 욕실에 욕조가 있어서 너무 좋았어요. 베쓰 버블 입욕제를 주셔서 서울서 먼길 갔는데 피로도 풀고 다음날 일정을 개운하게 시작해서 좋았습니다 기타: 객실이 2,3 층에 주로 위치한것 같았고, 저희는 3층을 배정받았는데, 유일한 단점이라면 창문은 세면대 앞으로만 크게 하나가 있었고, 창이 도로쪽을 향해있어서 창을 열어놓기는 약간 곤란한것? 이외에는 매우 쾌적하고 가격도 착한 모텔이였습니다 ㅎㅎ 다음에도 전주에 가면 이용할것같아요~^^",5,4년 전
y_157_100,전주 스토리,6715852,사장님도 착하시고 침대도 넓고 제일 좋았던거는 화장실과 방이 깔끔하고 청결해서 좋았습니다 밖에 소음도 잘 들리지않아 편하게 이용했습니다. 제가 불빛이 있으면 잠을 잘 자지 못하는데 그 불빛들도 거의 없고 매우 편하게 이용했던거같습니다.다만 조금 아쉬웠던점은 샤워부스에 거울이 없어서 조금 아쉬웠습니다 그래도 사장님 편하게 자다가요 다음에 또 이옹할게요♥,5,7년 전
y_157_101,전주 스토리,1045390,드라이브인으로 예약했는데 들어갈때 따로 주차하는곳으로 가야하더라구요. 친절하게 주차장 안내까지 해주셔서 좋았고 들어가보니 담배냄새도 안나고 깔끔했어요. 욕조도 있어서 반신욕으로 하루 피로도 풀고 티비도 크고 보기좋게 되어있어서 재미나게 지내다 왔습니다. 별점 5개 주고싶네요 땅땅!!!,5,8년 전
y_157_102,전주 스토리,4698645,방이 진짜 넓어요 좋았구요 냉장고 냉동실이 없어서 불편했어요 ㅠ 세면대에 머리카락 몇개 떨어져있는거 말고는 청결했어요 5만언에 이렇게 좋은 숙소는 첨이에요~~ 그리고 30분 일찍 도착했는데 들여보내주셔서 감사했습니다~,4,7년 전
y_157_103,전주 스토리,10877822,전주에 급하게 내려가서 잡았는데 방도 넓고 깔끔해서 편히 쉬었어요 다만 장마철이라 그런지 수건이랑 베개애서 빨래 덜 마른 꿉꿉한 냄새가 너무 아쉬웠어요 ㅠㅠ,4,4년 전
y_157_104,전주 스토리,짤막짤막한체리,"위치는 터미널 근처에, 버스정류장 가깝고(금암동), 편의점이 바로 앞에 있어서 정말 좋습니다. 방이 정~말 넓고, 욕조도 커서 정말 만족스러웠습니다. 그리고 욕조에서 사용하라고 간단한 입욕제도 있어서 좋았어요. 겨울이라 날도 추운데 침대에 전기장판도 있어서 좋습니다. 다만 냉장고가 작아서 아쉬워요. 냉장고 하단에 성인용품 판매기가 달려있어서 냉장고가 작습니다 ㅠ",4,4년 전
y_157_105,전주 스토리,7082703,비품은 정말정말 깨끗했어요!!! 심지어 드라이기 빗은 새거처럼 일회용 봉지에 포장되어있었고 침대랑 수건도 정말 깨끗하고 화장실도 너무좋았어요!! 방바닥(냉장고앞)에 좀 끈적끈적했던거만 최고였어요!!!,4,7년 전
y_157_106,전주 스토리,엄*****,전주에서 제일 시설 좋은 가성비 숙소예요! 남자친구랑 장거리연애중이라서 전주에서 만날때는 스토리를 자주 이용해요~! 욕실도 깨끗하고 이번엔 일반실 예약햇는데 방 업그레이드 해주셔서 감사합니당 ㅜㅜ!! 전주에서 숙박 필요하신분 스토리로 이용하세용!😃😃,5,2년 전
y_157_107,전주 스토리,니나노둥둥,방이 넓다는게 장점이고 주차를 밖에 해야되는게 단점 냉장고에 성인용품 파는건 재미도 있고 덕분에 냉장고는 시원하지 않다는게 조금 아쉽지만 근처에선 상위권에 들어가는 숙소 인건 확실해요,5,4년 전
y_157_108,전주 스토리,979410,전주 출장와서 숙박하고가요 컴퓨터랑 티비 침대도 넓고 폭신해서좋구 이불도맘에들어요 단점으로는 수압이 좀 약하고 돈벌레? 기어다니는거봄ㅜ,4,8년 전
y_157_109,전주 스토리,소수서원,리모컨 고장 없이 잘 작동되서 좋았어요~~ 전등도 고장난 부분 없이 잘 들어와서 좋았어요ㅎㅎ 창문이 조금밖에 안 열렸지만 환기했더니 괜찮았어요!! 친절하시구 잘 이용하고 갑니다 :),4,4년 전
y_157_110,전주 스토리,해안공원헌병,"여기 너무 좋아요!!! 공간이 다 커요ㅎㅎㅎㅎ 이것저것 다 준비되어 있고 욕조도 있고 버블도 준비해주시고, 청결하고, 위치도 좋네여~ 조용하고 편하게 잘 쉬다 갑니다. 감사합니다!",5,3년 전
y_157_111,전주 스토리,zzxx8482,준특실이용했는데 화장실이 아주 넓고 쾌적함 욕조도 매우크고 사워부스도 따로있어서 좋았음 창문블라인드만있었다면 아주 완벽했을듯 나머진 침싷도 좋고 다 만족!,5,4년 전
y_157_112,전주 스토리,Pho,저번에 연박하고 또 이용했어요. 저번에 만족하고 또 예약한건데 좀 추웠네요. 숙소 많이 다녀봤는데 이렇게 추운곳은 처음이에요. 보일러가 꺼져있어서 켜달라고 말했는데 온도를 낮게 맞춰주셨나 봐요. 신경 좀 써주세요,4,8년 전
y_157_113,전주 스토리,찌랑,"재방문 의사 100% 청결하고 숙소크기도 넓고 외관도 다른 건물 대비 세련되고 모든 게 훌륭했습니다. 화장실 샤워실가 분리되어 있는 점, 거울이 크고 조명이 색감이나 밝기 정도도 모두 적당했습니다. 앞으로 터미널 근처 숙박은 여기서만 할 거에요.",5,5년 전
y_157_114,전주 스토리,까칠한숲,시설은 항상똑같은거 같습니다 내집처럼 편안하고 푸근하고요 욕실에 욕조가 커서 우선 합격이였습니다. 하지만 시트가 좀 더러워서 청결면에서 마이너스를 드렸어요 청결면에 좀더 신경써주시면 더욱 많이 찾을거같아오,3,7년 전
y_157_115,전주 스토리,브레드이스더베스트,버스터미널 주변이라 그런지 좀.. 출장온 아저씨들이 사용할 법한 숙소였습니다.. 성 기구 자판기도 방에 비치되어있고 좀..분위기가 그랬습니다 깨끗하고 넓긴 해요! 근데 화장실도 위가 뚫려있고.. 민망하더라고요,3,6년 전
y_157_116,전주 스토리,나른함아침이닷,일단 방이 넓어서 좋았고 수압도 좋았습니다. 근데 한가지 아쉬웠던건 컴푸터랑 티브이랑 연결이 안되어있어서 컴푸터로 다운받아서 티비로 보지를 못했다는 점입니다. 이것만빼고는 완벽크합니다,5,3년 전
y_157_117,전주 스토리,김포공항태풍,"사장님께서 방을 업그레이드 해주셨어요 . 방컨디션도 좋았구 코로나 시대에 맞춰 비대면으로 프라이빗 하게 잘 묵었다 갑니다. 다만, 배달음식 시킬 때 정문 ? 현관앞에서 받아와야하는 번거로움은 있으나 무인텔 특성상 어쩔수 없는 것 같아요. 아쉬운게 있다면 넷플릭스가 연동되어 있으면 더 좋았을것 같아요. 그래도 쾌적하게 잘 쉬다갑니다.",5,3년 전
y_157_118,전주 스토리,깜정윤띠,따로 사진은 못 찍었지만 무엇보다 깔끔하고 저렴해서 좋았어요~ 사실 가격이 저렴하다보니 방이 조금 별로 겠구나 하고 기대없이 숙소에 들어갔는데 시설도 좋고 청결해서 이 가격에 이렇게 이용할 수 있다고? 하며 놀랐습니다! 다음에도 재방문 의사 100%에요~ 너무 만족하고 갑니다~,4,1년 전
y_157_119,전주 스토리,팔괘정보석,"방 깨끗하고 좋네요. 담배 냄새도 전혀 없었습니다. 일반인데 실내도 넓고, 사용하는데 전혀 불편한게 없었네요. 전주 출장때마다 어디서 자야할지 고민 많았는데 고민없이 이용할 거 같아요.",5,3년 전
y_157_120,전주 스토리,2449791,일반실인데 사진과똑같이 너무 깨끗하고 넓고 좋네요 그렇게 비싼편도아닌데 가성비 짱인것같아요 다음에 전주 놀러가면 또 이용할 예정이예요 ^^,5,8년 전
y_157_121,전주 스토리,소라카장인,"청결 역시 신축이라 깨끗하고 좋은 침구류, 화장실도 나눠져있어서 좋았어요. 차가있어서 주차생각해서 드라이빙룸으로 예약했는데도 넘 넘 좋았어요!",5,8년 전
y_157_122,전주 스토리,돼낑이,"방이 매우 넓습니다! 인근에 있는, 시설 괜찮은 숙소들보다 저렴한 편이고 시설도 깔끔합니다~ 그런데 화장실 유리가 비치는 재질이어서 민망한 상황이 벌어질 수도 있는 부분이....😅",4,4년 전
y_157_123,전주 스토리,6295538,완젼 좋아요 깔끔 청결 럭셔리~~ 단골할래요 완젼 강추😀😊😊😊,5,7년 전
y_157_124,전주 스토리,1788227,"욕조가 제일 맘에 들만큼 큼직했고, 화장실 시설이 분리가 되잇어서 쓰기에 편리했다. 처음으로 이용해봤지만 또 다시 오자고 할 만큼 시설 분위기 위치면에서 너무 좋은 곳이였다.",5,7년 전
y_157_125,전주 스토리,오리은,저렴한 가격으로 너무 좋은 곳에서 쉬었어요~!! 다른 숙소의 특실정도 되는 크기와 시설인데 일반실이라니....정말 깜짝 놀랐답니다~!! 직원 분도 친절하시고~ ㅎ 고속터미널 주변이라 편의시설도 많고 좋았어요~ 방 난방을 넘 잘해주셔서 창문열고 잤네요 ㅋ 다음에 전주오면 꼭 여기서 잘 것 같아요~!! 지인들에게도 추천할 의향 100%입니다~^^,5,8년 전
y_157_126,전주 스토리,차라투스트라,일단 제가 이용해본 모텔 중에 최고였습니다. 다른 곳은 방이 쓸데 없이 넓거나 욕조가 작거나 그러는데 일반실 이용했음에도 욕조가 넓었고 방 구조가 아늑했어요. 깔끔한 인테리어 맘에 들었습니다! 다음에 또 이용할 의향 있어요. 한가지 아쉬운 점은 주말에 입실시간이 너무 늦다는 점이에요. 6시부터 입실 가능 하면 좋을 것 같습니다.,4,8년 전
y_157_127,전주 스토리,아무렇지않은폭스하운드,안녕하세요 여기는자주이용하는데인데요 깔끔하구 드라이브인이라주차하기가우선편하고 이불도 따뜻하고 언제나사장님친절하시구바로옆에편의점이있어서그게너무편합니다 그래서자주이용하게되네요 한번이용해보세요,5,3년 전
y_157_128,전주 스토리,2774814,중문이있어서 바람이 차단되어 좋았음 넓은 자쿠지욕조와 샤워부스 변기가 따로 되어있어서 좋았음 그러나 침대쪽에서 바라볼때 샤워부수와 변기쪽이 불투명유리라 다 비치고 문제는 맨 윗칸이 뚫려있어서 용변볼때 상당히 민망함 그것빼곤 다 괜찮음,4,8년 전
y_157_129,전주 스토리,김포공항태풍,처음방문때 일반실예약했는데 업그레이드 해주셔서 드라이빙실에 들어갔었나봐요. 그래서 차를 드라이빙실 1:1주차를 할수있던거였고 전객실이 1:1 무인텔처럼 차를 댈수있는 지알고 두번째 방문하였는데 알고보니 일반실은 외부주차장이 따로 있었더라구요. 비가엄청와서 짐도많아 외부에 주차하고 들어오기 난감하였어요. 그래서 사장님께 추가비내고 드라이빙실로 변경과 환불요청을 했었는데 환불이불가한 숙소였고 드라이빙실은 꽉 차서 하는수없이 외부에 차를세워두고 묵게되었으나 정리잘되어있는 컨디션좋은 쾌적한 룸이여서 기분좋게 잘쉬다 갔습니다. 제가 미처 확인하지못하고 되려 환불요청을 드렸던게 죄송했구요.. 사장님께서도 기분안좋으실수있었을텐데 잘맞이해주셔서 감사했어요. 드라이빙실도 일반룸도 다 너무 깨끗하니 좋네요☺,5,3년 전
y_157_130,전주 스토리,14334574,사진은 못찍었지만 리뷰대로 방이 상당히 커서 불편함이 없었습니다. 수건도 넉넉히 있고 침대도 아늑했어요 방음은 좀 안돼는거 같아요 그리고 샤워시설 물이 안빠지구 반대쪽으로 고여가지구 그 점은 살짝 불편했습니다 그래도 전반적으로 이 가격에 아주 만족했습니다 잘 쉬다가 갑니다,5,3년 전
y_157_131,전주 스토리,흥미로운감옥,전주방문시 매번 이용을 하고 있는데 청결하고 매번 만족을 하고 있네요!! 욕실 컨디션도 좋고 청소상태도 양호합니다 주차도 크게 불편하지 않아서 좋아요!!! 직원분들도 친철하세요!!!,5,3년 전
