id,name,nickname,review_content,rating,write_date
y_172_137,전주 뷰티,크로슬리,더블 침대방을 썻는데 방의크기가 생각보다 작고 티비의 위치가 애매해서 약간 불편함이 있습니다 티비의 위치를 바꿔주는게 좋을거 같네요,5,10년 전
y_172_138,전주 뷰티,1880391,객실도 깨끗하고 잘 쉬다 갑니다 ㅎㅎ 사징님도 친절하시고 근처에 먹거리도 많아서 좋습니다,4,8년 전
y_172_139,전주 뷰티,사랑해랑사,1.내부가 청결합니다. 2.주변이 조용합니다. 3.간식이 커피랑 식빵이 비치되어 좋아요. 4.만화책이랑 볼게 있어 좋네요. 5.내부 안마의자가 있어 뭉친 근육 풀어주니 좋네요. 6.월풀욕조가 크고 피곤한몸 피로를 풀어주네요 7.저렴한 가격대비 모든게 좋네요,5,3년 전
y_172_140,전주 뷰티,929317,처음방문했는데 사장님이 너무나친절하시더라구요 덕분에 잘쉬다가갑니다 화장실도 넓고 침대도 깔끔하고 다음에 또 방문하도록 할게요^^,5,9년 전
y_172_141,전주 뷰티,여기어때 이용 고객,일단 사장님이 정말 괜찮은곳 또한 가격도 서비스와 시설에 비해 결코 나쁘지않은 가격 전주에있는 숙박업소중 탑3안에 들지않나 생각함,5,9년 전
y_172_142,전주 뷰티,야도이,카운터 사모닝 친절 응대는 좋으나 엘베 밤향제 냄새 너무심하고 내부청결 상태 불량 했녜요 베개에 남자 머리카락 있음 환풍 잘만됨 저녁엔 날씨가 찬데 장판 없어서 추위느끼며 겨우잠듬 원풀은 최고입니다,3,9년 전
y_172_143,전주 뷰티,3043720,"저렴한 가격 대비 가성비는 좋습니다 ㅎ 욕실 조명이 좀 어둡고, 환풍이 잘 되지않네요 나머지는 다 괜찮았습니다 ㅎ",4,8년 전
y_172_144,전주 뷰티,여기어때 이용 고객,카운터에서부터 친절하셔서 기분좋게 이용했구요 다음에 또 올 의향잇습니다,4,9년 전
y_172_145,전주 뷰티,132103,정말 좋아요~~ 너무 친절하시고 방도 깔끔해요 주변 다른 곳들이링 구조나 이런건 크게 다르진 않는데 친절하고 서비스가 좋아요,5,9년 전
y_172_146,전주 뷰티,녹색학교,시설 깔끔하고 서비스 좋아요,5,2년 전
y_172_147,전주 뷰티,halazuku,사장님 친절하세요^^!아침에 토스트에 딸기쨈 발라먹었는데 식빵 상태도 좋았고~~~욕조 버블도 잘됨 ㅎㅎㅎ,4,8년 전
y_172_148,전주 뷰티,132103,터미널과 가까이 위치하고 있어서 타지에서 오신분들 이용하시기 좋아요 가격대비 시설도 깔끔하고 좋습니다~!!,4,9년 전
y_172_149,전주 뷰티,una1226,"객실도 깔끔하고, 스파욕조가 있어서 피로도 풀고 왔네요^^ 다음에 또 전주에 들를 일이 있으면 또 이용하고 싶습니다.",5,9년 전
y_172_150,전주 뷰티,1157435,아주머니도 친절하시고 가격대비 좋았습니다. 큰 특징은 욕조가 크다는것!!,4,9년 전
y_172_151,전주 뷰티,1235172,샤워실 안에 화장실이 따로 분리되있어서 편햇어요 스파도 잘나오고 좋은데 화장실 환풍기가 안돌아가서 속상했네요,5,9년 전
y_172_152,전주 뷰티,839826,자주 이용하는데 너무괜찮아요 아주머니도 친절하시구 깔끔하고 저렴하고 항상 잘 이용하고 잇습니다 추천이요ㅋㅋ,5,9년 전
y_172_153,전주 뷰티,709482,시설이 꽤 괜찮았습니다. 분위기도 좋구 가격도 합리적이구 타미널에서 가까운게 마음에 드네요. 추천합니다.,5,9년 전
y_172_154,전주 뷰티,song골매,침대도 편안하고 객실도 깔끔해 잘 쉬다가 갑니다. 나중에 기회되면 다시 한번 들릴게요~~,4,9년 전
y_172_155,전주 뷰티,1235172,화장실하고 완벽분리가 되잇어서 담배연기가 방안으로 안들어오는게 너무좋네요 방도 싸고 좋구요 잘쉬다갑니다,5,9년 전
y_172_156,전주 뷰티,1114468,사장님과 사모님 두분다 너무 친절하세요 ㅎㅎ 가격은 다룬 모텔들과 별 차이는 많이 안나지만 시설과 서비스로 따지면 가격대비 정말 좋아요 아 한가지 불편햇던게 화장실이 고장낫는데 남는 방이 없어서 그냥 참앗다는거...ㅠ 그것만 빼고는 만족스러웟습니다 ㅎㅎ,3,8년 전
y_172_157,전주 뷰티,850689,전주출장올때마다 느끼는거지만. 가격착하고 시설 너무좋고 정말 올때마다 기분좋네요,5,9년 전
y_172_158,전주 뷰티,꽁51,시설깨끗하고 너무 좋아요 저렴한데 굳,5,8년 전
y_172_159,전주 뷰티,123842,기억에 남을 만한 서비스와 가격대비 최고의 시설이예요. 객실 컨디션이 매우 좋아서 만족합니다.,5,8년 전
y_172_160,전주 뷰티,457672,어제 특실이용햇는데 시설도좋고 스파가 넓고좋앗어요 주인아주머니도 친절해서 좋앗어요 또가고싶네요,5,9년 전
y_172_161,전주 뷰티,1049313,두번째 이용인데 가격대비 정말 좋습니다 아주머니도 친절하시고 다음에도 또 방문 할거같아요 ㅋㅋ,5,9년 전
y_172_162,전주 뷰티,3586847,완전짱짱짱~~!!!!!친절도 완전굿이고 시설도 완전 짱이양ㅎㅎ 오늘도 예약할거지롱~~,5,8년 전
y_172_163,전주 뷰티,ormr8512,룸 청소가 깨끗하네요 냉장고 냉동실이 없어어 아이스크림이 죽이 ㅜㅜ 근데 냄새가 나네요,5,8년 전
y_172_164,전주 뷰티,jh124,시설도 깨끗하고 편안하게 쉬었다가 갑니다 사장님두 친절하시구 다음에도 이용하고싶네요,5,8년 전
y_172_165,전주 뷰티,1119097,깔끔하고 넓고 좋아요 자주 올것같아요 침대도 편해요 구조가 편안해서 마음에 듭니다,5,8년 전
y_172_166,전주 뷰티,1119286,항상 이용해요 욕조도 잇고 조용하고 넓어요 침대상태도 좋습니다 탁 트인게 좋네요,5,8년 전
y_172_167,전주 뷰티,2470302,깨끗하고 시설도 괜찮았습니다 프론트에 먹거리도 있구요 근처에 편의점도 있어서 좋네요,5,8년 전
y_172_168,전주 뷰티,광꾼,깨끗하고 욕조도 좋구여 에어컨이 좀 더운게 아숴웠지만 좋았습니다 추천 해드려요,5,6년 전
y_172_169,전주 뷰티,3586847,여기 사장님 여자분 완전 친절하세요!!!대박 역시 전주 사람입니다!!! 여기 방은 진짜 가격대에 비해 방이 정말이쁘고 디자인도 세련댐!!여기만 몇번째이용중인지 모르겟으여!! 진심으로 가격대에 비해 비싼곳보다 완전 최고임 다른대 안가고 여기만와유!!,5,8년 전
y_172_170,전주 뷰티,김예니2,진짜 너무 잘잤어요 스파도 좋고 시설도 좋고 사장님도 엄청 친절하셨어용 ㅎㅎㅎ,5,7년 전
y_172_171,전주 뷰티,1218928,시설은 평범하고 스파월풀이 넓찍하니 있어 좋았네요. 처음 배정받은 방이 청소상태가 안좋아서 바꿔달라하니 바로 다른방으로 바꿔주셨어요. 근데 거기마저도 누가 써서 청소가 막끝난방인지 욕실에 물이 좀 있고 화장실에 습기가.. 조명이 리모콘으로 작동되진 않더라구요. 저희가 묵은 객실은 특이하게 드라이기가 거울 윗벽면에 붙어서 서서 사용해야했네요;; 그럭저럭 잘 묵고 갑니다,3,9년 전
y_172_172,전주 뷰티,오사카작당,객실도 쾌적하고 고데기도 비치되어 있고 면봉도 구비되어 있고 다 괜찮았어요 ㅎㅎㅎㅎ 다음에 또 묵으러 올게요----!!!!! 사장님도 너무 친절하시고 로비에서 빵이랑 아이스크림도 막을 수 있어서 정말 좋았어용~~~~,5,3년 전
y_172_173,전주 뷰티,9140110,깔끔하고 화장실 이랑 샤워실 따로있는 것도 좋고 가격대비 시설은 정말 좋아요,5,6년 전
y_172_174,전주 뷰티,앙뇽하세요오,숙박예약하고갔는데 고데기도빌려주시고 욕조도크고 너무좋았습니당 다음에또이용할게요,5,9년 전
y_172_175,전주 뷰티,시간7,자주가지만 예약을 처음하는데 겁나 친절하게해주시니 자주이용할수밖에없습니다,5,8년 전
y_172_176,전주 뷰티,여기어때 이용 고객,좋아요 객실 컨디션 근처 숙박업소 중 가장 좋네요 잘 쉬다 가요 감사함니다,5,9년 전
y_172_177,전주 뷰티,ddaby001,연속된 일때문에 무척 피곤했는데 15시 빠른체크인인데 14시10분 도착했음에도 추가요금없이 체크인 시켜 주셔서 너무 감사했어요. 하루 정말 잘~~~~~쉬었다 갑니다. 감사합니다 사장님! 적극 추천합니다.,4,7년 전
y_172_178,전주 뷰티,3679895,오래된 느낌이 있어요 불 켜고 끄는 부분이 좀 너덜하고... 리모컨으로 조절이 안돼요 그리고 방이 좀 어두운편? 깨끗하고 시설자체는 나쁘지 않았어요 욕실 엄청 크구요 나쁘진 않았습니다,4,8년 전
y_172_179,전주 뷰티,1058741,인천에서 출발이라 늦은시간에 도착이라 연락드리고갔어요 축구게임있는방보고 예약했는데 그방은 아니었지만 친절히맞아주시고 방도 넓고 오락기도있고 스파도하고 늦게나왔는데도 콜없었어요 잘쉬고갑니다^^* 다음에 또 전주가게되면 갈거같아요~^^,5,8년 전
y_172_180,전주 뷰티,2341617,시설굿 청결굿 욕조굿 항상오는데 매번 만족도100점 잘쉬다가요 ~~,5,8년 전
y_172_181,전주 뷰티,면밀한공립학교학생,그냥 가격정도 하는수준 시설은 사진하고 비슷 청소는 잘 안되는거같음. 머리카락이 그대로있음,3,7년 전
y_172_182,전주 뷰티,1739753,자주 애용하지만 수건과 샤워실 위생에 신경 써주세요.,4,5년 전
y_172_183,전주 뷰티,볼링사랑레인,기본이상은 하는곳입니다 화장실 샤워실 따로따로 분리 되있습니다 👍,5,2년 전
y_172_184,전주 뷰티,거침없응게,방넓고 욕실크고 침대편안하고 깔끔한내부 모든게 만족스러워요,5,6년 전
y_172_185,전주 뷰티,GC1462364116,친절한 사장님과 깔끔한 인테리어 시설 짱 좋아요!,5,7년 전
y_172_186,전주 뷰티,1070303,친절하고 깨끗하고 방음도 잘 되고 해서 좋았어요 주변에 편의시설이 많아서 좋습니다,4,9년 전
y_172_187,전주 뷰티,1270752,우왕 객실업그레이드를 해주신진모르겠지만 엄청 좋았고요 트윈피씨에다 무설치실행까지되는데 옵치는 안되서 좀아쉬웟어요 같이 메이플함 그래서ㅎㅎ 1층에 음료마음껏 가져다먹어서 조아써요 전주데이트하게된다면 또오고싶어요,5,8년 전
y_172_188,전주 뷰티,gegege,출장차 갔는데 나쁘진 않았어요~ 인테리어가 좀 난감한 부분은 있었지만요 물건을 두고 왔는데 전화드렸는데... 못찾아써 좀 속상했다는....,4,8년 전
y_172_189,전주 뷰티,446699,방금 들어왔어요. 사장님이 유쾌하셔서 들어올 때부터 기분이 좋았는데 일반실 들어왔는데 방도 생각보다 엄청 넓고 욕실도 넓고 욕조도 월풀이어서 좋구요. 무엇보다 깨끗합니다. 다음엔 무조건 여기입니다.,5,9년 전
y_172_190,전주 뷰티,9488971,시설 좋고 청결하고 주차공간도 넓음 굿굿,5,5년 전
y_172_191,전주 뷰티,1D3K,스파가 너무 좋았구 그리고 청결하구 따뜻해서 좋았어요 집가기전 토스트가 진짜 꿀맛 전주여행오면 여기부터 가야지 싶어요! 그리고 터미널에서 엄청 가까워서 거의 가성비 굳인듯...별점20개•,5,8년 전
y_172_192,전주 뷰티,포리파파,전주 터미널이랑 정말 많이 가깝네요. 시외버스터미널이랑 고속버스터미널이랑 바로 옆에 있어서 정말 편리하게 왔어요. 친절하시고 깔끔하네요.,4,9년 전
y_172_193,전주 뷰티,1605093,전주로 1박2일 여행왔는데 너무 친절하게대해주시고 시설도 깨끗하고 너무 만족하고 잘 머물다갑니다ㅎㅎ 다음에 놀러오면 또 이용할게요,4,9년 전
y_172_194,전주 뷰티,6257249,카운터 직원 분 인상이 좋으시고 친절하세요 전체적으로 방이 깨끗하고 좋았습니다 다만 티비가 매장모드로 되어 있는지 티비 제품 스펙 광고가 계속 뜨더라고용 잘 쉬었다 갑니다 감사합니다,5,6년 전
y_172_195,전주 뷰티,884521,사장님도 친절하시고 편안하게 해주셔서 자주 들리는데 늘 고맙게 생각해요~ 담에 또 들릴게요~ 해피 new year~,4,9년 전
y_172_196,전주 뷰티,짱구와신사,별한개도아까운곳이네요..어떻게높은평점을받았는지 의문이네요 주인은 사이트에올라온것보다 돈을 더받을려고하고 청소상태도최악이네요.. 바닥에는먼지투성이에 베게하고이불은 냄새도나고 방은담배냄새하고 악취가나네요.. 참고로 주인이 손님대하는 태도에서 일단화가나네요.. 지방갔다가 피곤해서하루자고 올러갈려고했는데..전주모텔에 실망이네요..어제 순천에서잔곳하고너무비교되네..여인숙수준임..ㅠㅠ,0,9년 전
y_172_197,전주 뷰티,닉첸,사장님이 친절해요 입구에 음료 및 토스트가 있어서 좋았고요 시설도 오래된 느낌이 아니고 깔끔했어요 다음에 또 방문할께요^^,4,8년 전
y_172_198,전주 뷰티,6045539,이용한지 2년가까이 되가는데요 전주 어느곳이랑 비교해도 손색이 없어요. 지금은 카운터에 계시는 분든이 낮에는 건 물주 사장님이 시고 밤에는 일하시는 아주머니분이 계시죠 예전에는 낮이랑 밤에도 일하는 아주머니 두분이셨는데 그때나 지금이나 크게 변한건 없는것같아요. 이제 정들어서 다른곳은 가지도 못해요 한달에 5일이나 6일 전주오는데 전 무조건 뷰티로 직행입니다. 한번 들려보세요 후회는 없으실꺼에요.,5,7년 전
y_172_199,전주 뷰티,고속진,음.... 다른곳보다 깔끔하고 괜찮은듯.... 아주머니도 친절하고 좋았어요!!! 개인적으로 인테리어도 상당히 마음에 들었습니다!! 또또 올께요~~,4,8년 전
y_172_200,전주 뷰티,1973909,역시 최고인거같습니다 어제 빨래방을아무리찾아도 업길래 포기하고 혹시나하고 여쭤봣는데ㅠㅠ 진짜 대단한거같습니다 많은분들이 이용해주셨으면합니다 가격대비 환상적입니다!,5,9년 전
y_172_201,전주 뷰티,여기어때 이용 고객,진짜 매일올거에요! 이 근처 숙박업소중에서 최고입니다 넓고 pc랑 tv연결도 잘되고 스파까지 있어요! 1층에 토스트도 만들어목을수있는데 다음번에가면 꼭 먹어봐야겜ㅅ어요,5,9년 전
y_172_202,전주 뷰티,4257690,욕조가 크고 마음에 들어요. 시설은 좀 낡았지만 방도 넓고 있을 거 다 있고 가격 대비 만족합니다.,4,8년 전
y_172_203,전주 뷰티,못난딸기,안마의자 덕분에 안마도 받고 스파도 하고 기분좋게 하루 잘 지내고 가요 다음에 또 이용할께요~~,4,8년 전
y_172_204,전주 뷰티,140026,일반실 대실이용했어요 방들어가서깜놀! 욕조큰방부탁드렸더니2인욕조에 방도넓고 시설좋아서 주말 15000원에 이런시설이라니 감동하고편히쉬었어용 담에도또이용할게요~~~~,5,10년 전
y_172_205,전주 뷰티,422595,클래식한 인테리어에 방도 께끗하고 서비스도 괜한고~ 잘쉬다 갑니당~^^ 다음에도 들릴까 생각중ㅎㅋ,4,9년 전
y_172_206,전주 뷰티,전국투어,아주머니가 컵라면도 주시고 양말도 주시고 친절해요 ㅎㅎ 전주오면 여기만 갈 생각입니다. 주변에 복자식당 맛있고 반찬 잘나옵니다 ㅎㅎㅎ 번창하세요~~~!,5,9년 전
y_172_207,전주 뷰티,쩐찐쩐찐,전주여러곳다녀봤는데 쵝오좋아요 시설이아무리좋아도 불친절하면 가기싫은데 여긴사장님도 친절하시고 시설도 깨끗하고 방도너무따뜻해요^^계속뷰티만다닐꺼랍니다^^,5,9년 전
y_172_208,전주 뷰티,2424626,"뷰티 자주 이용하는데, 1층에간식거리도 많이 있고 전체적으로 깔끔해서 좋아요 월풀도 넓고 컴퓨터도 다른곳과 다르게 성능이 좋아서 더 많이 이용하게되네요^^",5,8년 전
y_172_209,전주 뷰티,426289,여행가기전 하루 급하게 잡아 이용했는데 너무 좋았어요 깔끔하고 혜택도 받고 ㅎㅎ 프론트 사장님 너무 친절하셔서 좋았어요 무엇보다 터미널과 가까워ㅓ 굳,5,9년 전
y_172_210,전주 뷰티,534202,이쪽 금방은 잘 안와봤는데 시설도 좋고 잘되있네요 ㅎㅎ 가격이 싼데 그에비해 크기도 넓고 좋네요,4,8년 전
y_172_211,전주 뷰티,4634992,모처럼 깔끔한 시설의 숙소를 만나 정말 기분좋게 쉬었어요 좀 외곽인것만 빼면 가성비 갑입니다,4,7년 전
y_172_212,전주 뷰티,피카피카추,출장을 자주 다녀 숙박을 자주 이용합니다 가격도 좋고 방도 매우 깔끔하고 맘에들어요 가격대 성능비 갑입니다 다음에 또 출장 진행하게 되면 다시 한번 재 방문 할 예정입니다 사업 번창하세요,3,1년 전
y_172_213,전주 뷰티,cctv1,화장실이 추운것말고는 방도넓고 욕실도 큽니다 전기장판 조절이 안되는게 아쉬웠습니다.,4,6년 전
y_172_214,전주 뷰티,1551470,윗방에서 휴대폰 진동소리가 다들리는거빼곤 괜찮았어요... 청결이나뭐 이런부분은 ㅋㅋ,4,8년 전
y_172_215,전주 뷰티,373789,좋아용ㅎㅎㅎㅎ저렴한가격으로 잘있다가 갑니다 욕조좋네요 번창하세요ㅎㅎㅎㅎㅎㅎㅎㅎㅎ,4,9년 전
y_172_216,전주 뷰티,주시용연,원래 좋은 시설같은데 유지보수가 안되어 아쉬웠습니다. 방은 청소 상태가 그런 저럭 괜찮은데 난방도 약하고 조금 추운 느낌 들었습니다. 그리고 욕조 청소가 안되어 있어 제가 청소하고 사용한 것이 아쉬움이 남습니다. 감사합니다,5,2년 전
y_172_217,전주 뷰티,8939794,다좋앗어요 머리카락 조금 이불에 뭍어잇어 아쉬웟지만 그것빼고는 갠찮네용,4,6년 전
y_172_218,전주 뷰티,7976116,"기본 음료 두캔에, 시원한 물 두병이 냉장고안에 들어있구요, 방 상태는 깨끗하고 좋았어요. 믹스커피와 녹차(일회용)도 있어요! 들어오는 카운터 앞쪽에는 즐길수 있는 다양한 종류의 음료자판기와 토스트, 시원한 물과 캔커피,아이스크림이 있어서 편하게 이용할수 있어요! 방상태나 시설상태 깨끗하고 좋아요",4,6년 전
y_172_219,전주 뷰티,6257249,욕실이 크고 좋습니다 사장님 직원분들이 친절하세요 여자친구가 맘에 들어해서 뷰티 오고 난 뒤 부터 다른데는 잘 안가요 ㅋ ㅣ,5,6년 전
y_172_220,전주 뷰티,이불킥,여자친구랑 대실이용했었어요~~~ 사장님이 너무 친절하셨구요 시설 좋고 너무 깔끔 했어요 다음에 또 이용할거 같습니다~,5,9년 전
y_172_221,전주 뷰티,152561,시설 깔끔하고.. 사장님 친절하고.. 거기에 양말까지 주시니 ㅎ 자주 이용할 듯 합니다.. 잘 쉬었다 갑니다..,5,9년 전
y_172_222,전주 뷰티,여기어때 이용 고객,여기어때에서 이용한 곳 중에 가장 괜찮앗어요!! 카드로해도 정가로 해주시고 시설 대만족이요! 버블스파도 잇엇어요!,5,9년 전
y_172_223,전주 뷰티,1175607,진짜조아요!!! 가격도 저렴하고 방도 좋고 특히 화장실이 굿!!! 다음에 또 전주 여행오면 여기로 올게요~~~,5,9년 전
y_172_224,전주 뷰티,295536,시설 좋쿠 깨끗하고 ! 좀 아쉬운점은 욕실에 휴지통이 없엇던점 ㅠㅠ 그래도 다좋아서 만점 드리고 갖니다 ^^,5,9년 전
y_172_225,전주 뷰티,여기어때고객님,전체적으로 깔끔하고 월풀도 괜찮았네요 다만 침대바로위에 창문이라 외풍이살짝있네요 전기장판틀고자서 춥진않았네요,5,9년 전
y_172_226,전주 뷰티,1159635,욕조가 넓어서 좋았어요. 샤워기랑 멀어서 아쉬웠지만..침대도 넓고 깨끗했고 장판이 따뜻했어요.,4,8년 전
y_172_227,전주 뷰티,356150,방도크고 깔끔하고 pc도 2대에 티비랑 연결해서 볼수있어서 좋네요. 욕실이랑 화장실도 따로 떨어져서 편함!!,5,9년 전
y_172_228,전주 뷰티,975674,굿 굿 좋아요 생각보다 좋은시설에 화장실이 제일 마음에 드네요 모든 숙박업소가 이런 화장실이었으면 좋겠네요,5,9년 전
y_172_229,전주 뷰티,534056,사진보고 긴가민가 하면서 갔었는데 사장님께서 정말 친절하고 금액대비 시설도 맘에 쏙 드네요 믿고 가볼만하다!!,5,9년 전
y_172_230,전주 뷰티,74768,좋았어요 근데 난방이되는데도 방이너무커서그런가 좀 쌀쌀했어요 그래도 바로예약도되고 욕조도무지크고 편히쉬다가요~~~,5,9년 전
y_172_231,전주 뷰티,5237696,시설도 좋고 가격대비 가성비도 좋았습니다 무엇보다 넓어서 좋았습니다,4,7년 전
y_172_232,전주 뷰티,3472275,항상 자주애용합니다 사장님도 진짜 친절하고요 ㅎㅎ 진짜 깨끗하고 욕실도 넓고 ㅎㅎ 엄청 만족스러워요 ㅎㅎ,5,8년 전
y_172_233,전주 뷰티,1991106,가격 착하고 사장님은 더더욱 착하도 서비스도 좋구 방도 좋아요 ㅎㅎ 터미널에서 멀지 않아서 괜찮아요 ㅎㅎ,5,8년 전
y_172_234,전주 뷰티,89545,우선 카운터 아주머니분께서 너무 친절하시고 방도 완전깔끔해서 아는 지인분들께는 항상 여기추천! 굳!!,5,10년 전
y_172_235,전주 뷰티,크로슬리,일단 다른 모텔보다 깔끔합니다 욕실도 좋고 커피포트도 깔끔해요~~ 대실시간이 조금만 더 길면 좋겠네요,5,10년 전
y_172_236,전주 뷰티,이불킥,지금 대실 이용중인데 사장님 너무 친절하시고~ 시설 너무 좋고 깔끔해요~~다음에 또 올거같습니다~,5,9년 전
y_172_237,전주 뷰티,467647,인테리어도 예뿌고 여러가지로 좋은 점이 많아서 괜찮았어요 편하게 이용 했어요^^,5,9년 전
y_172_238,전주 뷰티,1961375,피씨랑 티비랑 연결이 안되있어요.. 이 객실만안된거겠죠? 방 크기도 크고 컴퓨터도2대라서 좋습니다~,5,7년 전
y_172_239,전주 뷰티,2604079,컴퓨터랑 티비가 연결되어 있길래 쉬면서 영화도 보고 좋았어요 ㅎㅎ 다음에 또 방문할게요~,4,8년 전
y_172_240,전주 뷰티,667616,가격대비 방도 깨끗 하고 깔끔 해서 마음에들어요 사장 님도친절 하시고 담에 또 올게요 ㅋ,5,9년 전
y_172_241,전주 뷰티,1995975,시설도 깔끔하고 아주 좋았어요 욕조가 넓어서 사용하기도 좋았구요 다음에도 또 방문의사 있습니다~~~,5,7년 전
y_172_242,전주 뷰티,1016261,가격도 저렴하고 시설도 깔끔하고 아주젛아요 강추합니다 자주 이용하고 있고 앞으로도 자주갈ㅋ곱니다ㅋㅋ,5,8년 전
y_172_243,전주 뷰티,74768,대실이용했어요 편하고 깔끔하고 좋았습니다! 욕실이 무척크고 버블바스도 좋았구요 다음에도이용할게요~,5,10년 전
y_172_244,전주 뷰티,666904,방금 입실했는데 깨끗하고 사장님도 친절하시고 가격도 좋고 좋은거 같습니다 전주오면 또 오고싶네요,5,9년 전
y_172_245,전주 뷰티,1548886,컴퓨터 피시방처럼 속도빠르고 온수도 잘 나오고 만족합니다 잘 쉬었습니다 다음에 또 이용하겠습니다,5,8년 전
y_172_246,전주 뷰티,프리린,방도 넓고 깨끗하고 좋았네요. 무엇보다 욕조가 커서 따뜻하게 잘 즐기다 갑니다. 나름 추천!,5,8년 전
y_172_247,전주 뷰티,105024,한번 와보고 또와요 시설 너무 깔끔하구요 욕조도 넓고 너무 좋았어요 앞으로도 자주 이용할께요,5,10년 전
y_172_248,전주 뷰티,139669,조아요우연히든른곳인데 깔끔하고정리도잘되어잇고 다음에또이용하고싶은곳이네요 ~ ~,5,9년 전
y_172_249,전주 뷰티,1117174,먼지가 좀 있었지만 빠른 체크인 너무 좋았어요.,4,7년 전
y_172_250,전주 뷰티,837276,가격이 너무 착해서 재방문 했습니다 자알 쉬다 갑니다. 착힌가격에 자알 이용합니다.,5,9년 전
y_172_251,전주 뷰티,임은지13,시설이 깨끗하고 좋아요ㅎㅎㅎ 사장님도 친절하시고 친근감있게 대해주셔서 좋구요 잘 있다갑니다~,5,9년 전
y_172_252,전주 뷰티,친숙해진도롱뇽,전주오면 여기만 들려요! 사장님도 친절하고 시설도 너무나도 좋아요 자주 이용할거 같아요^*^,5,7년 전
y_172_253,전주 뷰티,124379743,지금 대실중이에요~~~~ 사장님이 친절하셔서 좋았어요ㅎㅎ 시설도 깔끔하고 시원해서 좋아요,5,9년 전
y_172_254,전주 뷰티,386스티븐,정말친절하신사모님 불편함없이잘대해주시네요 덕분에 넓은객실서 푹쉬었습니다 감사합니다,5,6년 전
y_172_255,전주 뷰티,할렐루얏,가격도 싸고 방도 따뜻하고 화장실도 넓고 아주좋네여 다음에 전주오면 또 오겠습니당^^,5,9년 전
y_172_256,전주 뷰티,546960,방도깨끗하고 시설도좋고 사장님이 친절하셔서 잘있다갑니다 ...........ㅎㅎㅎㅎㅎ,5,9년 전
y_172_257,전주 뷰티,89545,자주 오지만 친절하시구 좋습니당ㅎㅎㅎㅎㅎ 다음에도 다시 와야징 추천드려용ㅎㅎㅎㅎㅎㅎㅎ,5,10년 전
y_172_258,전주 뷰티,여기어때 이용 고객,"어쩌다보니 또 이용했네요..ㅎㅎ.... 갈때마다 친절하시고, 시설 너무너무 좋아요!",5,9년 전
