id,name,nickname,review_content,rating,write_date
y_172_259,전주 뷰티,122965,이모ㅋㅋㅋㅋ올때마다진짜진짜친절하시구 정도많이주시공ㅋ히히ㅋ짱좋아용ㅋㅋ 앞으로자주이용할께용,5,9년 전
y_172_260,전주 뷰티,132103,대실이용 편하게 하구가요 위치도 좋고 방도 깔끔하구 좋았어요^^ 다음에도 잘 부탁해용,5,9년 전
y_172_261,전주 뷰티,50371,좋았지만 담배냄새가너무낫다는점ㅠㅠㅠㅠㅠ사장님도친절하셨고 냄새가심했던것빼면만족해용,5,9년 전
y_172_262,전주 뷰티,880019,인테리어가 제맘에 ㄲ쏙드네용 ㅎㅎ그점이좋았구여 시설도괜찮았습니다 다음에또올게용,5,9년 전
y_172_263,전주 뷰티,soning55,가격도 너무 저렴하고 저렴해도 방도 크고 좋았어요! 방도 깨끗하고 스파도 있어요,5,8년 전
y_172_264,전주 뷰티,2724806,이곳은 전주 갈때마다 이용하는대 항상 만족해요. 사장님도 친절하시고 ㅋ 대박나세요,5,8년 전
y_172_265,전주 뷰티,1157392,전주에서 대실하게 되면 항상 갑니다 넓고 청소상태 양호하며 물건들도 괜찮습니다~,5,9년 전
y_172_266,전주 뷰티,50371,자주가는데 담배냄새쬐금나는것빼고는좋아요~이만하면넓기도하고좋네요~~~번창하세용,5,9년 전
y_172_267,전주 뷰티,므우으,입욕제도 주시고 욕조가 진짜 넓고 좋아요 방도 깔끔하고 티비 보면서 힐링했네요,5,8년 전
y_172_268,전주 뷰티,복태2,깨끗하고 욕조도 있어서 아주 편하게 쉬었고 가격도 저렴해서 좋네요...,5,8년 전
y_172_269,전주 뷰티,122965,사장님이너무친절하셔서짱이예용~^^ㅋㅋ자주자주이용하는뎅ㅋㅋㅋ너무좋아요ㅋㅋ뷰티짱♡,5,9년 전
y_172_270,전주 뷰티,쩐찐쩐찐,항상갈때마다 사장님이 친절하셔서 기분좋게 쉬다와요~ 방도깨끗하구요~~~^^,5,9년 전
y_172_271,전주 뷰티,418313,시설 깔끔해서 좋았구여!!!!! 친절하셔서 편히 쉬었다가네여~~~!!!!!!,5,9년 전
y_172_272,전주 뷰티,1880391,사장님도 친절하시고 객실도 괜찮고 만족합니다 ㅎㅎ 다음에도 애용할게용 ㅎㅎ,5,9년 전
y_172_273,전주 뷰티,음퀴퀴,편하게 잘쉬고감 침대 욕실 넗어서 좋음,4,5년 전
y_172_274,전주 뷰티,eunjiyo,방도 넓고 화장실도 넓어서 좋았어요 컴퓨터가 피시방처럼 게임이 가능했어요,5,3년 전
y_172_275,전주 뷰티,fireline2,음.. 일단 305호에 묵었으나 티비와 컴퓨터 연결이 되긴 되나 완전 파란 화면이 떠 이용 못하였고 객실에 담배 연기 때문인지 쾌쾌해서 둘다 목이 계속 아팠습니다 화장실에 담뱃재도 그대로 있었고요 다시 이용할 일은 없을 듯 합니다,2,7년 전
y_172_276,전주 뷰티,766202,괜찮았고 또 가고 싶습니다. 다만 바닥에 이상한 먼지깉은게 있더군요 그래도 거슬릴 정도는 아니었습니다.,4,7년 전
y_172_277,전주 뷰티,신윤성,방도크구여 깔끔하구 좋네여 시설도괜찬구 직원분도친절하셔서 잘쉬다가네영,5,9년 전
y_172_278,전주 뷰티,가당찮은따귀,서울이었음 몇만원 더 비쌌을 퀄리티 담배냄새도 안나고 조용하고 쾌적했어요,5,8년 전
y_172_279,전주 뷰티,young89,급하게 예약해서 들어간곳인데 욕조가 넓고 좋았다가 욕조 위에 물떨어지는 샤워시설기계가있는데 밤새 윙윙 거려서 잠을 몇번이나 꺴는지 몰라요;;;,3,9년 전
y_172_280,전주 뷰티,1715387,객실도 깨끗하고 깔끔해요 컴퓨터 두대에 시설 모텔치고는 괜찮은 것 같아요,5,8년 전
y_172_281,전주 뷰티,162773,깔끔하고 좋음 여자 사장님도 친절하심 욕조도 커서 좋음 잠깐 쉬었는데 만족,5,10년 전
y_172_282,전주 뷰티,쉰아홉살선약,깨끗하고 냄새도없고 좋아요.시설도 모자람이 없네요,5,5년 전
y_172_283,전주 뷰티,2451119,방바닥은 춥고 전기장판만 따뜻해요 비데는 되지도 않아서 화장실도 춥고.. 가격대비 시설은 별로네용,3,8년 전
y_172_284,전주 뷰티,122965,이모친절하고짱ㅋㅋㅋㅋㅋㄱ 서비스도짱ㅋㅋ 월풀욕조도짱입니다용 또가고싶다ㅋㅋ,5,9년 전
y_172_285,전주 뷰티,11221189,수압 좋아요. 방도 넓고 티비크기도 큽니다. 잘 쉬었다 갑니다~,5,5년 전
y_172_286,전주 뷰티,1270752,뷰티 조아요 음료 마음껏먹어도 되고 토스트도 있고 주차시설도 있고,5,7년 전
y_172_287,전주 뷰티,사랑해랑사,1.내부가 청결합니다. 2.주변이 조용합니다. 3.간식이 커피랑 식빵이 비치되어 있어.... 간단하게 굶주린 배를 채울수 있습니다.. 4.저렴한 가격대비 시설이 만족합니다...,5,3년 전
y_172_288,전주 뷰티,ggqq,가격대비 좋았어요 다른데비해 퇴실시간도 늦고 좋아요,5,6년 전
y_172_289,전주 뷰티,kkansol,전반적으로 부족함 없이 만족했어요. 잘 이용했습니다! 전반적으로 부족함 없이 만족했어요. 잘 이용했습니다! 전반적으로 부족함 없이 만족했어요. 잘 이용했습니다! 전반적으로 부족함 없이 만족했어요. 잘 이용했습니다!,5,2년 전
y_172_290,전주 뷰티,5331126,가격대비 깨끗하고 넓은 공간 다음 에도 이용하겠습니다,5,6년 전
y_172_291,전주 뷰티,2196800,시설이 좋아요 깔끔하고 잘쉬다갑니다 고급스럽네요 ㅎㅎ,5,8년 전
y_172_292,전주 뷰티,2664814,시설좋어요 넓어요 추천,4,8년 전
y_172_293,전주 뷰티,2575158,일단 깔끔합니다. 냄새도 없고 용품들도 깨끗했어요.,5,8년 전
y_172_294,전주 뷰티,우비6,오호ㅋㅋ두번째로 간곳인데 아주머니들이 계셨는데 너무 친절하세요 진짜ㅠ 갑자기 정전이나서 놀랬는데 바로사장님이 올라오셔서 고쳐주시고 너무좋습니다! 전주놀러간다고 갔는데 서비스가 너무 좋은 곳이네용ㅎㅎ,5,9년 전
y_172_295,전주 뷰티,6145433,시설 괜찮고 위생상태 양호 하네요,4,6년 전
y_172_296,전주 뷰티,4089386,주말인데 가격도좋고 시설도 좋아서 좋네요^^,5,8년 전
y_172_297,전주 뷰티,3973279,샤워시설도 좋고 주변 교통편도 좋은것같습니다,5,7년 전
y_172_298,전주 뷰티,까슬한소용돌이,"편하게이용하긴했으나, 위생에 신경쓰셔야할거같네요",3,6년 전
y_172_299,전주 뷰티,나*****,시설관리가 잘 되어서 오래된듯 한데도 깨끗하네요.사장님 친절하시구요,4,6년 전
y_172_300,전주 뷰티,907528,"일주일에 한번씩은 꼭 가는 뷰티,,^^ 시설도 괜찮고 특히 저희 신랑이 거기만 가면 자유롭게 게임을 즐길수 잇어서 너무 좋대요 내일도 가려고 합니다^^ 내일도 따뜻하고 좋은 방 부탁 드려용",5,9년 전
y_172_301,전주 뷰티,쩌리언니,청결하고 사장님도 친절하십니다!!,5,8년 전
y_172_302,전주 뷰티,6045539,언제와도 좋으네요. 2주전에 깜빡하고 갔었던 와이셔츠랑 바지도 잘 챙겨두셔서 오늘찾았네요. 기분 좋게 쉬었다 갑 니다.,4,6년 전
y_172_303,전주 뷰티,7270759,내부시설은 그냥 평범했지만 깨끗하고 서비스가 좋았어요ㅎ,4,6년 전
y_172_304,전주 뷰티,ggqq,잘이용했어요 싼가격에,5,6년 전
y_172_305,전주 뷰티,리뷰남겨볼까,가격좋고 시설좋고 끝!!,5,7년 전
y_172_306,전주 뷰티,2341617,욕조도 다른 모텔에비해 크고 입욕제도 줘서 힐링하고 왔어요 방도 이뻣고요 다만아쉬운점이 있다면 게임기있는방을 예악했는데 없는방을 주신것? 그것빼곤 다 좋았습니다,5,8년 전
y_172_307,전주 뷰티,2937522,객실이 지저분하고 청결상태가 그닥좋지 않았습니다 두번째 이용인데 처음과는 사뭇다르더군요 화장실 수압도 너무낮고 신경좀 써주세요,2,8년 전
y_172_308,전주 뷰티,6102989,가격대비좋습니다 감사,5,5년 전
y_172_309,전주 뷰티,6045539,더운날이라 일찍 예약해서 들어왔어요 편안히 잘 쉬고 있어 요 어제 와도 편안히 쉴수있는곳이라 좋아요.,4,6년 전
y_172_310,전주 뷰티,1133772,전주 놀러와서 처음 방문했어요! 사장님도 엄청 좋으시고 방도 얼마나 깔끔한지 정말 좋습니다!!!! 입실시간전이엿는데ㅠㅠ 바로 입실 시켜주시고 잘쉬고 갑니다!,5,9년 전
y_172_311,전주 뷰티,HosooLee,전주 여행올 일 있어서 방문했습니다 우선 터미널 주변이라 정말 좋았고요 월풀도 정말 좋았습니다 전북대 덕진공원도 걸어서 15분 20분정도면 갈수있거여,5,8년 전
y_172_312,전주 뷰티,235359,모텔 그렇게 많이 다녀보진 않았지만 다녀본곳중 두번째로 좋았어요 전주오면 자주 이용 하도록 하겠습니다,4,9년 전
y_172_313,전주 뷰티,밉살맞은행복,가격대비 정말 완전 만족 200%입니다 전주와서 많은곳 다녀봤지만 여기가 제일 좋은거같아요 전주 뷰티 기억해서 다음번에 또 방문 꼭 하겠습니다 ❤️,5,6년 전
y_172_314,전주 뷰티,1157435,따뜻하고 무엇보다 욕조가 넓어서 좋습니다. 전기장판도 있고 방도 따뜻해서 좋았습니다.,4,9년 전
y_172_315,전주 뷰티,솔향기never,욕실시설 넓고 쾌적 가성비좋아요,5,1년 전
y_172_316,전주 뷰티,HotelManiaRev,안마방 이용했었어요 안마기는 짱짱하더군요. 다만 컴퓨터쪽은 어딜가나 다똑같아요 먼지 쌓이고 비위생적입니다.,3,8년 전
y_172_317,전주 뷰티,53096,터미널 근처라서 접근성도 좋고 시설도 좋아서 편하게 쉬다 가요~ 번창하세요~~ㅎㅎ,4,9년 전
y_172_318,전주 뷰티,2604079,저번에 친절했던게 기억에 남아서 또 방문했어요~ 영화 보면서 잘 쉬었다 갑니다~~,4,8년 전
y_172_319,전주 뷰티,1187064,갠찮아요 넓어ㅓ 답답하디 않아요 ㅋㅋ 근데 화장실에 전에 쓴 사람 머리끈이 남나있엇어요 욕조에 머리카락도 하나 ㅜㅜ 그래도 갠차나요!!!!8.8,3,7년 전
y_172_320,전주 뷰티,5125563,전주처음갔는데 정말좋았습니다,5,7년 전
y_172_321,전주 뷰티,2191359,매반 전주에 올때마다 뷰티에 묶어요. 깔끔하고 넓고 전주에서 이 가격에 묶을수 있는 곳은 없는 거 같아요. 또 올께요,5,8년 전
y_172_322,전주 뷰티,2191359,좋아요. 매번 전주 올때마다 묵는 곳인데 깔끔해요! 다음에 또 올께요! 특히 주인아주머니께서 참 친절하시네요 ㅎㅎㅎ,5,8년 전
y_172_323,전주 뷰티,2937522,룸도 깨끗하고 잘 정돈되있어서 너무좋아요 일단 외관자체가 너무 웅장해서 멋스러워 보이구요 찾기도 쉽고 뷰티짱짱^^,5,8년 전
y_172_324,전주 뷰티,104061,뷰티 진짜 좋아요 화장실이 매우 럭셔리 하구요 방도 넓고 깨끗합니다 방 있으면 왠만하면 가세요 강추 ㅋㅋㅋ,5,9년 전
y_172_325,전주 뷰티,여기어때 이용 고객,올때마다 좋아요! 거품샤워도 올때마다 하고잇어요 기분좋게다녀갑니당 ^^~~~,4,9년 전
y_172_326,전주 뷰티,231045,깨끗하고 친철하셔서 좋아요!!!!! 다음에두 이뽁으로 와야돼겟어요!!!! 커피하고 빵이 잇어서 더 좋아요!!!!,5,9년 전
y_172_327,전주 뷰티,476229,욕실도 크고 월풀욕조가 커서 여친도 만족합니다. 음료도 1층에서 꺼내올수도있고 게다가 식혜! 완전 좋습니다,5,8년 전
y_172_328,전주 뷰티,므우으,제일 좋은곳인듯해요 욕조도 넓고 입욕제도 주시곻ㅎㅎㅎ 물도 마음껏 꺼내마실수 있고 깔끔하구 방도 따뜻하네요,5,8년 전
y_172_329,전주 뷰티,350336,솔직히 주인아주머니 너무 좋르시고 목욕시설 너무 좋고 에어컨 빵빵하고 여름 휴가 다른데 안가도 될거같아요~~,5,9년 전
y_172_330,전주 뷰티,오피걸,굉장히 깔끔하고 숙박목적으로 묵었는데 조용한 방으로 배치해주셔서 감사했어요 사장님 인상도 너무 좋으시고,5,8년 전
y_172_331,전주 뷰티,3592884,사장님 친절하시고 주말임에도 비교적 저렴하게 이용했어요,4,7년 전
y_172_332,전주 뷰티,709482,뷰티가 그래도 고속터미널 근처에서는 나은 곳인것 같아요. 시설도 나름 괜찮고 거리가 고터랑 가까워서 출장오고 할때 이용하기.편리해요,3,8년 전
y_172_333,전주 뷰티,302958,사장님이 친절하시고 방도 깨끗하고 넓고 진짜좋아요!! 짐도 맡겨주시고ㅎㅎ 담에놀러오면 또 여기로올께요!!,5,9년 전
y_172_334,전주 뷰티,2341617,여태 재방문을 한 숙소는 없었는데 사장님도 너무 친절하시고 방도 너무좋아서 재방문한 숙소였어요 굿굿,5,8년 전
y_172_335,전주 뷰티,대량적인질소,"너무 좋아용 시설도 좋고 사장님도 친절하시구 셀프바에 식빵이랑 딸기잼, 토스트기 있고 전자레인지도 이용할 수 있어요 그리고 아이스크림 1개 무료로 먹을수있어서 넘 좋았어유",5,2년 전
y_172_336,전주 뷰티,140026,숙박했습니다 방도넓고 크고 프리미엄묵었는데 피씨도두대고 영화받아서 잘보고갑니다 자주찾을게요 번창하세요,5,9년 전
y_172_337,전주 뷰티,144776,후기는 처음남기네요 몇번 쉬러 대실했는데 주인아주머니도 친절하시고 저렴해서 잘쉬다가왔네요~ㅎㅎ,5,9년 전
y_172_338,전주 뷰티,886689,방도 깨끗하고 가격도 저렴합니다. 그리고 가격대비 성능이 좋아요. 만족스럽습니다.,5,9년 전
y_172_339,전주 뷰티,104151,무엇보다 객실 내부가 깔끔한게 마음에 들어요 ㅎㅎ 그리고 다른곳 보다 넓은것두 좋구요 ㅎㅎ,5,9년 전
y_172_340,전주 뷰티,여기어때 이용 고객,사장님 친잘하고 정말 잘쉬다 갑니다. 재방문할게요 !!! 너무 좋아요 욕실도 좋고 다좋아요..,5,9년 전
y_172_341,전주 뷰티,1981473,전주 뷰티 항상 좋은 서비스 너무좋아요!! 전주를 방문 할 때 마다 항상 찾는곳 입니다!!!,5,9년 전
y_172_342,전주 뷰티,크로슬리,자주 방문합니다~ 넓고 깨끗하구 항상 좋습니다~ 위치도 고속버스 터미널에서도 안멀어요ㅎㅎ,5,9년 전
y_172_343,전주 뷰티,1880391,사장님도 친절하시고 깨끗하고 잘 쉬다갑니다 ㅎㅎ 다음에도 애용할게요 ㅎㅎㅎ,4,8년 전
y_172_344,전주 뷰티,가슴절인사랑,쳔히 잘 쉬었다가 왓습니다 방두깔꿈하구요 사장님두 친절하시궁 방두 따뜻하고 좋았습니다,5,8년 전
y_172_345,전주 뷰티,1206856,정말 너무 좋아요 사장님도 친절하시구 만족했습니다 다음에 또 올 의향있구요 잘 쉬다 갑니다,5,9년 전
y_172_346,전주 뷰티,1218302,오랜만에 전주와서 들렀는데 괜찮네요 방이 커서 좋았어요 화장실도 좋네요 잘쉬다갑니다~,5,9년 전
y_172_347,전주 뷰티,1722841,너무 너무 좋아요.감사합니다.올때마다 너무변하게 쉬다가 감니다 .다음에또 꼭 올거에요,5,9년 전
y_172_348,전주 뷰티,당첨자합격자,"스탠다드 기본방 예약했는데 안마의자 월풀욕조가 있는방 사용했어요. 욕조사용은 하지 말아달래서 안했어요. 밤늦게 입실해서 욕조사용할 기운도 없었지만요. 샤워실배수가 약하고 냉장고 소음때문에 별반개만뺐어요. 엘베옆방이라 시끄러울줄 알았는데 조용했고 방음도 괜찮았어요. 방음, 청결, 다 좋았습니다. 재투숙 하겠냐 묻는다면 네 전주 또오면 재투숙할겁니다.",4,4년 전
y_172_349,전주 뷰티,2926505,전주에서 제일 괜찮은 모텔이니요 깔끔하고 넓어요 대실도 예약 할 수 있으면 좋겟어요,5,8년 전
y_172_350,전주 뷰티,3003350,음료수 생수 무한에 식빵도 있고 방은 깨끗하고 깔끔하고 좋았습니다 다시한번 가고싶네요,5,8년 전
y_172_351,전주 뷰티,65970,"여자친구랑 다시한번 꼭 가고 싶은곳이고, 여 사장님 너무 친절하셔서 서비스 굿굿^^",5,10년 전
y_172_352,전주 뷰티,춘씨1,사진그대로예요~안마의자시원합니다!! 들어오는골목이조금좁아요~나름괜찮네요,4,6년 전
y_172_353,전주 뷰티,122965,ㅋㅋㅋㅋㅋ따뜻한물도많이나오고 짱이예요ㅋㅋㅋ항상이모님서비스짱 단골이예용ㅋㅋ 자주자주갈께용,5,9년 전
y_172_354,전주 뷰티,105112,주변에서 가장 깔끔한 모텔이다고 생각해요~ 간식거리가 좀 더 보충된다면 더 좋겠네요,5,10년 전
y_172_355,전주 뷰티,1119097,역시 좋다고 하는데는 다 이유가있나봅니다ㅎ 잘쉬다가요 깨끗하고 인테리어도 좋아요,5,8년 전
y_172_356,전주 뷰티,김성수120,깨끗하고 친절해서 늘 이용합니다,4,7년 전
y_172_357,전주 뷰티,2191359,이 가격에 최고입니디. 넓고 깨끗하고 참으로 맘에 듭니다. 다음에 또 올께요.,5,8년 전
y_172_358,전주 뷰티,1256361,일요일예약이라그런지 저렴하게 예약! !35000원에 컴터두대 월풀까지!!대애박~,5,8년 전
y_172_359,전주 뷰티,coflwnfl,방도 크구 깨끗하게 청소도 잘되잇네융 다음에 놀러가면 또갈예정~~~ㅎㅎㅎㅎ,5,9년 전
y_172_360,전주 뷰티,164231,전주에서 대실은처음인데 사장님이친절하셔서잘온거같아요 방도깔끔해서편히쉬고왔습니다,5,9년 전
y_172_361,전주 뷰티,709482,시설도 괜찮구 좋습니다!!^^ 다음에 또 오고싶네요 고속버스터미널도 가까워요,5,9년 전
y_172_362,전주 뷰티,582589,방이 사진이랑 똑같아요 월풀도 좋았구요 일단 시설도 좋구 깔끔해서 좋았어요,5,9년 전
y_172_363,전주 뷰티,2604079,처음 여기와서 대실을 해봤는데 삼촌이 친절하게 해주셔서 너무 좋았어요 ㅎㅎ,5,8년 전
y_172_364,전주 뷰티,1049313,편하게 쉴수 있어서 자주 방문하고 있어요 좋아요 이 가격에 이정도면 정말 좋죠,5,9년 전
y_172_365,전주 뷰티,6145433,시설 괜찮고 객실상태도 괜찮네요,4,6년 전
y_172_366,전주 뷰티,611520,항상 방문하지만 방도 깨끗하고 서비스도 좋아요!!! 다음에또 방문할게요~~,5,8년 전
y_172_367,전주 뷰티,3937424,잘 묵다가 서울왓어요. 전주내려갈때마다 이용하지만 너무 좋네요,4,8년 전
y_172_368,전주 뷰티,llove2734,샤워시설도 좋고 방도 깔끔하니 맘에 들었습니다 다음에 또 방문할게요~~,5,9년 전
y_172_369,전주 뷰티,씨에스테크,"청결상태 양호 서비스 상 1층로비에 토스트 및 아메리카노, 아이스크림, 음료, 물 등 구비되어 있음",5,1년 전
y_172_370,전주 뷰티,6310654,사장님도 친절하고 방도 깨끗하고 좋네요. 맘에 듭니다. 잘 묵고 갑니다.,5,7년 전
y_172_371,전주 뷰티,555395,언제나 와도 편안한 내방같은곳 이라 마음이 너무 편해서 잘 쉬고가는 가요,5,9년 전
y_172_372,전주 뷰티,959657,첨으로 여기어때어플보고 왔지만 실망했습니다ㅜㅜ 이틀전부터 알아보구 왔는데 사진과 좀 다르구요ㅜ 사장님은 친절하셨지만 생각과 다른 객실에 너무 아쉬웠어요 .. 담엔 안오고싶네요.이럴줄알았음 일부러 찾아오지말고 그냥 가까운곳갔을걸 ㅠㅠ.,2,8년 전
y_172_373,전주 뷰티,6257249,사장님과 프론트 직원분이 정말 친절하시고 좋습니다 잘 쉬었다 갑니당~~,5,6년 전
y_172_374,전주 뷰티,1673773,리뷰보고 대체로 평이 좋아서 갔는데 서비스가 영ㅡ.ㅡ 아니네요 약간 신경질적이라고 해야하나 퇴실시간 딱맞춰 나가는 손님이 어딧나요 퇴실시간10-15분 지났다고 전화상으로 빨리 나가라고 기분나쁘게 말하시네요.참나 두번다시 오기싫어지네요,0,9년 전
y_172_375,전주 뷰티,2488774,주인아주머니께서 친절하시고 방도 너무 깔끔해요 ㅎㅎㅎ 잘 쉬다가요~~!,5,8년 전
y_172_376,전주 뷰티,평양성취,레쓰비캔과 물이있어서 좋았어요 토스트도 있구 잘이용하고가요,4,6년 전
y_172_377,전주 뷰티,신경호7,전주 오랜만에왔는데 또 이곳 이용하네요 좋습니다! 아늑하고 위치좋고,5,8년 전
y_172_378,전주 뷰티,8203266,괜찮네요 . 처음 모텔을 이용해봤는데 엄청 넓고 시설도 깨끗합니다!,5,6년 전
y_172_379,전주 뷰티,korysun,잘 이용했습니다...,4,1년 전
y_172_380,전주 뷰티,난처한제이콥,역시 깔끔하고 좋은곳 같습니다 가격도 저렴하고 너무 마음에 듭니다,5,8년 전
y_172_381,전주 뷰티,야리야리한자갈,요기서만 자면 무조건숙면이네요 편안하고 안락함이 끝네줍니다,5,8년 전
y_172_382,전주 뷰티,songhaneul,정말 깔끔하고 넓고 너무좋라요 일단 화장실이 너무 좋네요!!!!,5,5년 전
y_172_383,전주 뷰티,1270752,잘쉬다갑니다 고대기도 카운터에 문의하면 줍니다 가격대비 싸서좋네요,5,7년 전
y_172_384,전주 뷰티,3003723,청결상태는깨끗하구요 아쉬운점은 비개가좀누렇더라고요 친절하기는한데조금 말투가듣기안좋드라구요,3,8년 전
y_172_385,전주 뷰티,김호갱,좋아요! 친구들이랑 갔는데 3명이 한 침대에서 잤는데도 남았어요,5,7년 전
y_172_386,전주 뷰티,야리야리한자갈,시설 최고 완전 깨끗합니다 전주에선 당연 뷰티가 짱입니다,5,8년 전
y_172_387,전주 뷰티,6257249,짐 보관도 흔쾌히 해주시고 친절하고 좋습니다 잘 쉬었다 갑니다,5,5년 전
y_172_388,전주 뷰티,여기어때 이용 고객,가성비 완전 짱짱입니다! 주인 아주머니도 아주 친절하셧어요!!,5,7년 전
y_172_389,전주 뷰티,2328737,괜찮았어요 따뜻하고 스파되는줄알앗는데 안되네ㅇ ㅜㅡㅜ ...,5,8년 전
y_172_390,전주 뷰티,노주섭1,시설이 전체적으로 깔끔하고 좋아요 ㅎㅎ잘쉬다갑니다.ㅎㅎㅎㅎ,5,8년 전
y_172_391,전주 뷰티,여기어때 이용 고객,터미널과 가깝고 가격도 저럼하고 너무좋아요~~~~~~~~,5,8년 전
y_172_392,전주 뷰티,7851228,에어컨 틀어도 좀 덥지만 좋아욤 아이스크림도 있구 조아용,5,6년 전
y_172_393,전주 뷰티,쉰아홉살선약,터미널근처이고 넓고 깨끗하고 아주좋아요,5,5년 전
y_172_394,전주 뷰티,무등산굴,사장님도 친절하시고 방도 깨끗하고 좋으네요 수고하세요,5,7년 전
y_172_395,전주 뷰티,127112,잘 쉬다가요ㅎㅎ 시합전날 스파로 몸 잘 풀고갑니다,5,6년 전
y_172_396,전주 뷰티,비비콕콕2,시설이 상당히 좋으네요.. 재구매..300%,5,5년 전
y_172_397,전주 뷰티,9140110,좋아요~~~ 깔끔하고 편해서 자주 이용하고 있어요~,5,6년 전
y_172_398,전주 뷰티,3096798,다시 찿게끔 해요 깨끗하고 풍족하고 시설 좋아요~~,5,8년 전
y_172_399,전주 뷰티,부레훔,깔끔하고 괜찮아요~~ 무난하게 자주 이용해요~~~ 추천ㅋㅋ,3,8년 전
y_172_400,전주 뷰티,3692142,터미널 근처라 좋고 대체적으로 만족스러웠어요~,5,8년 전
y_172_401,전주 뷰티,2714595,깔끔하니 인테리어도좋고 터미널하고가까워소좋아요,5,8년 전
y_172_402,전주 뷰티,김진원38,너무 좋고요 가성비가 사장님도 친절하세요ㅎㅎ,5,7년 전
y_172_403,전주 뷰티,2891953,좋습니다. 가격 대비 깨끗하고 괜찮은거같아요,5,7년 전
y_172_404,전주 뷰티,쩌리언니,깔끔하고 사장님도 친절하셔서 잘 묵다갑니다,5,8년 전
y_172_405,전주 뷰티,5409916,좋아요 근데 컴퓨터가 너무 안되네요,5,5년 전
y_172_406,전주 뷰티,천동,청결하고 좋아요 잘쉬다가요,5,4년 전
y_172_407,전주 뷰티,쌩쌩한아메리카들소,터미널근처라 잘쉬다갑니다,4,5년 전
y_172_408,전주 뷰티,하남콜리,싸고 좋았어요 화장실이 조금 무서웠어요,5,6년 전
y_172_409,전주 뷰티,뽀얀코코아,역시 이름답게 뷰티해요 ㅋ 추천합니다,5,7년 전
y_172_410,전주 뷰티,가야산된장찌개,여긴 깨끗하고 친절함 금암동에선 최고,5,4년 전
y_172_411,전주 뷰티,김성수120,친절하고 깨끗해서 전주갈때면 항상 이용합니다,3,7년 전
y_172_412,전주 뷰티,야심한버전,역시 시설은 가장 좋은거같아요!!,5,7년 전
y_172_413,전주 뷰티,ggqq,잘이용했습니다 따뜻하고 좋아요,5,6년 전
y_172_414,전주 뷰티,사랑해랑사,굿굿굿굿굿... 최~~~~고....입니다. 굿굿굿굿굿... 최~~~~고....입니다. 굿굿굿굿굿... 최~~~~고....입니다. 굿굿굿굿굿... 최~~~~고....입니다....,5,2년 전
y_172_415,전주 뷰티,사랑해랑사,굿굿굿굿굿... 최~~~~고....입니다. 굿굿굿굿굿... 최~~~~고....입니다. 굿굿굿굿굿... 최~~~~고....입니다. 굿굿굿굿굿... 최~~~~고....입니다....,5,2년 전
y_172_416,전주 뷰티,사랑해랑사,굿굿굿굿굿... 최~~~~고....입니다. 굿굿굿굿굿... 최~~~~고....입니다. 굿굿굿굿굿... 최~~~~고....입니다. 굿굿굿굿굿... 최~~~~고....입니다....,5,3년 전
y_172_417,전주 뷰티,사랑해랑사,굿굿굿굿굿... 최~~~~고....입니다. 굿굿굿굿굿... 최~~~~고....입니다. 굿굿굿굿굿... 최~~~~고....입니다. 굿굿굿굿굿... 최~~~~고....입니다....,5,3년 전
y_172_418,전주 뷰티,3973279,잠자리도 좋고 샤워시설이 좋습니다,5,6년 전
y_172_419,전주 뷰티,천동,잘 쉬다 갑니다 편안하니 좋네요,5,4년 전
