id,name,nickname,review_content,rating,write_date
y_21_295,전주 YAJA-전주한옥마을점,서래마을해충,크리스마스여서 타지에서 세시간이나 걸려서 왔습니다 공휴일이고 크리스마스라서 당연하 사람이 많을거라생각하고 가격차이도 심하지 않아서 vip객실로 예약을 했는데 프론트에 도착하고 체크인을할때 직원분이 성함과 예약내역을 확인하고서도 트윈룸으로 안내를 해주셨습니다 들어가자마자 예약한 내역과는달리 월풀 욕조도 없고 침대도 트윈침대였습니다 카운터에 전화를하니 체크인할때 오류가 ’생긴것 같다‘ 라고 하시며 다시 방을 안내해주시겠다고 하셨는데 청소하는데 시간이 걸린다고 하시면서 40분정도 걸린다고 기다리라고 말씀하셨습니다 그사이 배달음식은 다식고 기존에예약한 방 기다린다고 여행와서 소중한시간 날리고 서있었습니다 예약할때 분명히 두세번 이름확인하셨는데 실수아닌거 알고있습니다 예약한방에 예약한손님이 들어가는건 당연한건데 손님이 체크인을 안하면 그방을 대실로 바로 돌리나 보네요 사과한마디도 없고 최악의숙소입니다 “ 야자호텔 예약하시는분들은 프론트에서 안내해주는방과 예약한방이 다르니까 꼭 두세번 확인하세요 ”,0,1년 전
y_21_296,전주 YAJA-전주한옥마을점,x*****,사장님도 친절하시고 시설도 좋아여 방도 넓고 잘 쉬다 갔습니당 ❤️❤️,5,6개월 전
y_21_297,전주 YAJA-전주한옥마을점,x*****,사장님도 친절하고 방도 너무 좋아여 다음에 또 올게용,5,6개월 전
y_21_298,전주 YAJA-전주한옥마을점,x*****,사장님도 친절하시고 방도 깔끔하고 넓었어용 편하게 쉬다가여❤️,5,6개월 전
y_21_299,전주 YAJA-전주한옥마을점,강화갯벌국수오리,"전주 한옥마을과 1km 정도 거리가 있습니다. 걸어서 충분히 갈만한 거리입니다. 카운터에 얼음 정수기가 있고 바로 옆 BBQ 치킨 집에 가면 3,000원 할인도 해줍니다. 가성비 좋은 숙소입니다.",5,1년 전
y_21_300,전주 YAJA-전주한옥마을점,현무3,최악중에 최악입니다. 객실에서 담배냄새도 심한대다 청소도 안한지 한참된듯 더러웠고 담배꽁초도 있고 모기가 들끓는지 벽에는 모기잡은 흔적이 엄청 많아서 불안했는대 역시나 어디서 들어왔는지 밤새 모기 잡느라 잠도 제대로 못잤는대 아침엔 구조적으로 80%밖에 안닫히는 커튼때문에 눈부셔서 숙면을 취할수도 없었어요. 스타일러스도 없었는대 전객실 스타일러스 구비라고 되어있는것도 사기 아닌가싶고 애초에 대여가 안되는 쓰레기같은 객실을 준것같네요.,1,1년 전
y_21_301,전주 YAJA-전주한옥마을점,타*****,엄청 더러워요.. 너무 심하더라구요..따뜻한 물도 안 나오고 침구도 무슨 파란색 점 같은 거 있어서 찝찝하고 수건도 엄청 얇아요 다신 못 갈듯ㅠㅠ,0,8개월 전
y_21_302,전주 YAJA-전주한옥마을점,도미우럭,너무 더러워요ㅠ 맨발로 바닥을 밟기가 싫어요... 먼지도 많고 너무 꿉꿉해오ㅜ,1,1년 전
y_21_303,전주 YAJA-전주한옥마을점,바로우,첫 방문입니다. 전주 영화의거리 바로 코앞에 숙소가 있어서 너무 좋았습니다. 넓은 공용주차장도있구 시내와 딱 붙어있어서 전주국제영화제를 더 재밌게 즐길수 있었습니다^^! 숙소가 너무 깨끗해서 한번 놀랬구 고급지고 객실 내부의 센스있는 소품 인테리어에 두번 놀랬습니다~ 객실 바닥도 따듯해서 포근한 온도에서 잠들 수 있었네용~ 화장실은 객실과 일체형이라 되게 신기했어용!! 아! 그리구 전객실 스타일러 ㄷㄷ 스타일러는 최신형이라 소리와 진동도 적어서 신세계 였네용~~♡ 저렴한 가격에 스타일러까지 이용할 수 있어서 정말 최고였구 재방문 무조건 할게용~ ㅎㅎ,5,2년 전
y_21_304,전주 YAJA-전주한옥마을점,내일도여기로,"정말 착한 가격에 잘 쉬다갑니다. 사이다랑 헛개차가 구비되 있어 걱정없이 마실 수 있어서 좋았어요.거리도 장점이구요.재방문 의사 충분합니다 바라는 점은 손이 닿지 않는곳은 먼지가 수북하여 관리 부탁드리며, 들어갈때 부터 쾌쾌한 냄새가 납니다ㅠㅠ",5,2년 전
y_21_305,전주 YAJA-전주한옥마을점,영덕대게마을지하,객사에 갈때 종종 이용하는데 일단 여전히 청결한 시설이 좋았으며 넉넉한 주차공간도 좋았습니다 다만 화장실 구조때문인지 샤워실 구조때문인지 모르겠는데 물이 바닥에 고이는 구조더라구요 이부분만 신경써주시면 더 좋을 것 같습니다!,3,2년 전
y_21_306,전주 YAJA-전주한옥마을점,6768627,여행하다 잠깐 쉬려고 들렀어요 편히 쉬다 갑니다 티비도 잘 보고 가요,5,2년 전
y_21_307,전주 YAJA-전주한옥마을점,띤총,깔끔하고 저렴하게 오랜시간 이용할 수 있어요 좋아요 객사에 위치하고 있어서 주변 맛집이라던지 편의시설을 이용하기에 편리하네요 화장실 이용할때 수압이 쎄서 좋았고 넷플릭스도 재밌게 잘 봤어요 고데기와 충전기가 대여가 되어서 편했습니다,5,2년 전
y_21_308,전주 YAJA-전주한옥마을점,윤슬해,바깥문이 아래가 다 트여있어서 방음이 제대로 되진 않았어요. 그리고 특히.. 모텔들어오는데 냄새 관리가 안돼있어서 하수구 + 화장실 냄새가 많이 났어요.. 1층만 그런가? 했더니 엘레베이터 진심... 강아지가 오줌싼듯한 냄새 났어요 ㅠㅠ.. 아무리 가성비 텔이라지만 비위약한 분들은 오기 좀 그럴 거 같아요.. 내부 방 온도는 춥지않고 괜찮았어요 근데 화장실 들어가니까 역시나 오물 냄새가 좀 심했고 세면대 물트니까 호스가 연결이 안돼있는지 바닥으로 물이 줄줄샘.. 청결 생각하면 돈 더내고 다른 텔 찾아보는 게 좋을 거 같아요..,4,1년 전
y_21_309,전주 YAJA-전주한옥마을점,가비83,정말 이가격에 이정도 퀄리티의 숙소는 전국어디에서도 찾을수없을듯합니다. 너무 친절하시고 너무깔끔한 숙소 인정입니다. 전주 갈일있으면 무조건 여기로 가라고 추천드리고싶네요. 최고입니다.,5,2년 전
y_21_310,전주 YAJA-전주한옥마을점,우즈베키스탄부여,저렴한 가격에 푹 쉬고 갑니다.,5,2년 전
y_21_311,전주 YAJA-전주한옥마을점,헨이짱,일단 가성비 좋은건 맞아요 한옥마을 걸어서 1.4 키로 나와서 산책겸 걸어갔어요 위치도 좋고 직원분 친절하시고 좋았는데...... 음... 다시 방문의사는 글쎄요..입니다 평일 프리미엄방 5만원에 입실했고 일단 방에 들어갔는데 욕실 넓은 욕조 좋았는데 방이 정말 작았어요 프리미엄 방 맞냐고 다시 문의해볼정도.. 사진이랑 같지가 않았어요 스타일러 이런거 없는거 둘째치고 그냥 아주 좁고 벽면 창가 천장 등이 청소상태가 정말 안좋았어요 몇달은 청소 안된기분이 들정도... 침구 베개에 검은 먼지점처럼 다닥다닥 있길래 남친이 바꿔달라 하자 하길래 예민 떨지 말자고 했지만 분명 충분히 찝찝했습니다 살짝이라도 예민하신분은 못가실거같아요 사진보시다시피 사진상으로는 깔끔해보이지만 좀 많이 아쉬웠어요 남친은 다시는 오기 싫다고 했어요 ㅜㅜ 가성비 그리고 더러운거 별로 신경 안쓰시면 충분히 위치상 괜찮습니다 여행 돌아온 후 후기 남기는데 지금 생각해도 방 넘 좁고 청결상태 찝찝했던게 아쉬움으로 남아요,3,2년 전
y_21_312,전주 YAJA-전주한옥마을점,주시용연,"가격대비 가성비가 너무 좋은 숙소입니다. 욕실 청소 상태가 너무 좋았고 방도 깨끗합니다. 3시 체크아웃은 정말로 너무 좋았습니다. 시내번화가 중심지역으로 식당과 쇼핑을 할 수 있는 정도 강점입니다. 다시 가고 싶은 숙소이고 다른 사람들에게 추천해주고 싶을정도로 좋은 숙소입니다. 다만, 요즘 난방비가 많이 올라 이해는 가지만, 조금 추운 느낌이 들었습니다. 그래도 욕실물은 따뜻해서 좋습니다. 그리고 아쉬운것은 건물구조 문제인것 같은데 하수구냄새가 올라와서 불편했습니다. 감사합니다",4,1년 전
y_21_313,전주 YAJA-전주한옥마을점,누*****,"숙박업소 리뷰 안남기는 타입 인데 너무 심각했어서 글 남겨요. 333특가 3시입실 3시퇴실 첫날에 몰랐는데 자고 일어나니까 배게+침대시트 검정색 이 잔뜩 묻어 있어서 당황 했습니다. 처음엔 일행 옷 때문인지 알았으나 일행 의 상의,하의 가 검정색 이라 일행 으로 인해 오염 됬나 싶었는데 배게-배게라인 +이불 만 오염 되어있어서 이건 저희 문제가 아닌거 같아 혹시나 하고 영상 찍어놨었습니다. 일행 옷 이 문제 였다면 하의부분+ 제 옷 까지 오염이 되어야 하는데 그러진 않았습니다. 결국 원인을 찾던중 침대 위 검정색가죽(?) 처럼 꾸며있는 부분에서 오염 된거같더라고요;;; 휴지에 테스트 해봤는데 바로 묻어서 나왔습니다.. 광택제 가 덜 말랐나? 할 정도로 심각 했습니다. 만약 숙소에서 하룻밤 잤을경우 소중한 옷 입고 잤더라면 옷이 오염 됬을꺼 같아요;;; 일행 이 검정 옷 이라서 오염이 됬는지 안됬는지 확인조차 못 해본 상황 입니다. 패딩 을 옷걸이 에 걸고 잤는데 퇴실하고 차량에 탑승해서 보니 패딩에 흰색 비듬처럼 부분 뭐가 떨어져있었습니다;; 옷걸이 걸어두는 곳 이 흰색으로 도배 한거 같은데 어떻게하면 흰색 페인트잔여물(?) 같은게 묻어 나오는지... 엘리베이터 방향제 모서리 마다 방향제 가 있는데 1개 만 둬도 지독할꺼 같은데 4개를 두셔서 엘리베이터 탈때마다 머리 가 아팠어요.. 또한 화장실 에 담배 재떨이 가 있어서 흡연이 가능 한 방 였던거 같아요. 베란다 도 있던데 화장실 휴지걸이 위에 두셔서 좀 그랬어요. 인테리어 신경 써서 해주셨으면 좋겠습니다. 그외 프론트직원 분 은 친절 하셨고 화장실 도 깨끗 했어요~",3,2년 전
y_21_314,전주 YAJA-전주한옥마을점,누두가자,편하게 잘 보냈어요 조용하고 깨끗하거 너무 좋았어요. 덕분에 좋은 추억 남기고가요~~~~ 가격도 합리적이고 위치적으로도 너무 좋네요. 주차하기도 편하고 부족한 점이 없어서 좋았어요~,5,2년 전
y_21_315,전주 YAJA-전주한옥마을점,빠빠오80,"최근에 가본 숙소 중 정말 깨끗한 숙소였습니다. 침구도 푹신하고, 온수도 잘 나와서 좋았습니다. 또한 수건이나 슬리퍼 가운 등의 청결상태도 좋았습니다. 어메니티나, 음료도 잘 구비되어 있어 펀리하게 이용할 수 있어 좋았습니다. 인근에 맛집도 많아서 출장 같이 온 동료들과 식사도 무리없이 잘할 수 있어 좋았습니다. 그리고 안내해주시는 직원분들도 참 친절해서 좋았습니다. 다음 출장 시에도 다시 이용할것 같습니다. 편안하게 푹 쉬고 갑니다. 언제나 번창하세요. 감사합니다.",5,1년 전
y_21_316,전주 YAJA-전주한옥마을점,재미있고엄청난라따뚜이,"이번에 전주 여행 처음와봤는데 덕분에 편안하게 푹 쉬다 갑니다😀 가장 좋았던 점은 한옥마을이랑 멀지않아서 차로 5분? 10분? 정도면 갈수있는 거리라서 한옥마을에서 걸어서도 갈만했습니다 객실 내부에 샤워부스랑 화장실, 세면대가 각각 분리되어있는 신기한구조..,😃 스타일러가 있어서 잠 자는동안 셔츠 넣어놨더니 좋았습니다. 침대도 둘이 자기에도 좁지않고 넉넉한 사이즈라 좋았고 이번 여행가방 챙길때 충전기를 안챙겨갔는데 카운터에서 친절하게도 직원분이 충전기를 빌려주셨습니다 감사합니다^♡^",5,1년 전
y_21_317,전주 YAJA-전주한옥마을점,달려라경수,가성비 좋은 곳입니다. 주변 비슷한 가격대 형성한 곳들보다 시설이 훨 나아요. 전주 객사 놀러오신 분들 하루 자고 가기 무난합니다. 스타일러(코웨이 제품) 있고 넷플릭스 돼고 칫솔 같은 애머니티도 구비되어 있습니다. 1층에 BBQ 치킨 있고 객사 자체가 웬만한 프랜차이즈 배달 업체 많아서 배달 시켜먹기도 좋습니다~ 차량 가져오신 분들은 주차 20대 정도? 있으니 주차에도 문제 없을 것 같네요. 예전엔 엘리베이터에서 안 좋은 냄새가 났었는데 이번에 이용할 땐 쾌적했습니다.,5,1년 전
y_21_318,전주 YAJA-전주한옥마을점,달려라경수,주차 공간도 있고 넷플릭스 잘 되고 가성비가 정말 좋은 숙소인 것 같습니다 객사 초입이라 객리단길이랑은 좀 멀지만 근처 비슷한 가격대 보다는 훨 좋아요 비비큐 치킨도 먹을 수 있어요 애머니티도 줍니다 치약 칫솔 폼클렌징 필요한 거 다 쓸 수 있어요 또 에어드레서 있어서 고기나 술 먹고 옷 냄새 뺄 수 있어서 좋습니다 객실마다 있는지 모르겠는데 제가 이용한 객실에는 있었어요 객사 놀러오신 분들 중에 차 있으신 분들 여기서 묵으면 좋아요 주차장이 꽤 넓어서 초보인데도 헤매지 않고 바로 주차했어요,5,1년 전
y_21_319,전주 YAJA-전주한옥마을점,키다리아쟤,"스타일러는 작동이 안해요. 전원은 들어오는데 터치가 안되요. 큰욕조가 있어요. 물이 뜨겁지는 않고 미지근해요. 아침에는 엄청 뜨겁게 나왔어요. 커피머신이 고장나서 안나왔어요. 캡슐 커피 아쉽네요. 조식은 없어요. 휴게실에 토스트기도있고 포장용기도 있어서 살짝 기대했는데 토스트도 없었어요. 침대는 크고 푹신했어요. 티비는 작은편이고, 넷플릭스는 잘나오고, 웨이브,티빙도 나오나 봅니다.충전기는 없으니까 로비에서 빌리세요.화장품이 없으니까 챙겨가세요.",4,1년 전
y_21_320,전주 YAJA-전주한옥마을점,단기적인쇠고기덮밥,저렴하고 좋네요! 위치도 찾기 쉽고 깔끔해요 다음이 또 올 일 있음 올께요 잘 쉬다가 갑니다 감사합니다~~~~~ ㅎㅎㅎㅎ 🤗🤗🤗🤗🤗🤗🤗🤗🤗🤗🤗🤗🤗🤗🤗🤗🤗🤗🤗🤗🤗🤗🤗🤗🤗,5,2년 전
y_21_321,전주 YAJA-전주한옥마을점,슘슘슘슘,방사진은 못찍었지만 조용하고 깔끔한 숙소덕에 즐거운여행이 되었습니다!!!! 담배냄새도 안나고 직원분도 너무나도 친절하셔서 너무나도 좋았습니다!!-! 한옥마을 내의 숙소는 온돌방이라 침대있는 곳을 찾고있었는데 가격도 저렴하고 너무좋았습니다!!- ! 한옥마을에서 걸어가도 그리멀지않았고요! !-- 스타일러도 있다해서 가자마자 사용해보았는데 오류가 뜨면서 안되더라고요 ㅠㅠ 그게 좀 아쉬웠습니다 5층이었는데 호수는 기억이 안납니다!!!,5,1년 전
y_21_322,전주 YAJA-전주한옥마을점,청포도색아이,저번에 방문했을때 방을 무료로 업그레이드해주셨던 좋은 기억이 남아 이번에도 야자로 예약했습니다. 그런데 이번에도 방을 업그레이드 해주셨더라구요. 예약한 시간보다 1시간 일찍 방문했음에도 바로 입실할 수 있었습니다. 6층이라 5층에서 엘레베이터에서 내려 1층을 계단으로 올라가야했지만 방을 보고 만족했습니다. 따로 별도의 공간에 있는 욕조에 화장실도 방이랑 분리되어 있어서 훨씬 쾌적하다는 느낌을 받았습니다. 유튜브나 넷플 끊김없이 잘 재생되구요 리모콘이 3개라 맞는거 찾아서 쓰시면 될 것 같습니다. 다음에도 이용할 예정입니다. 감사합니다 번창하세요,5,1년 전
y_21_323,전주 YAJA-전주한옥마을점,형광색케이크,"여행으로 왔는데 위치, 주차장 다 좋아서 한옥마을이나 시내에서 놀다 들어가기 좋았어요~ 스타일러도 있고 넷플 티빙 다 돼서 편하게 쉴 수 있었습니당 그런데 입실할 때 환기때문인지 창문이 열려있었어요 그건 좋은데 모기들이...ㅠㅠ 창문 반대편에 방충망이 살짝 열려있어서 자다가 모기소리에 에프킬라 뿌리고, 물리고 그랬답니다🥲 전주는 지금 모기가 많긴하던데 그래도 이거말고는 객실상태도 쾌적하고 깨끗해서 좋았습니다! 담에 전주여행 또 온다면 재방문할 의사 있어요~",5,1년 전
y_21_324,전주 YAJA-전주한옥마을점,용맹하고독특한서산,잘 꾸민 느낌이 드는 편안한 숙소였음 욕조가 넓고 좋았으나 욕조앞 배수구가 물이 조금 천천히 빠졌음 핸드폰 충전기와 비누는 카운터에서 받아갈 수 있으니 예약할때 참고하시면 좋습니다. 잘 꾸민 느낌이 드는 편안한 숙소였음 욕조가 넓고 좋았으나 욕조앞 배수구가 물이 조금 천천히 빠졌음 핸드폰 충전기와 비누는 카운터에서 받아갈 수 있으니 예약할때 참고하시면 좋습니다. 잘 꾸민 느낌이 드는 편안한 숙소였음 욕조가 넓고 좋았으나 욕조앞 배수구가 물이 조금 천천히 빠졌음 핸드폰 충전기와 비누는 카운터에서 받아갈 수 있으니 예약할때 참고하시면 좋습니다.,4,1년 전
y_21_325,전주 YAJA-전주한옥마을점,민트주,"필요한거 다 있고 편했습니다. 테이블, 의자가 있어서 간식먹기 좋고 스타일러 있어서 잠바 돌려서 너무 좋더라고요. 따뜻한 물 시원하게 잘 나오고요. 아쉬운점은 수건이 얇고 좀 낡았는데 3개만 있더라고요. 가격대비 너무 만족했어요.",4,1년 전
y_21_326,전주 YAJA-전주한옥마을점,포득,"1. 들어오자마자 담배냄새 나깅래 보니까 담배꽁초 담긴 종이컵 있었음 2. 다음날 아침에 일어나서 드라이기 쓰는데 코드 터짐 3. 프론트에 전화해서 드라이기가 터졌다. 일행이 다친것 같다도 하니 정적이 흐르다가 그럼 드라이기 새거 필요하세요? 라고 물어보길래 일단 그럴 것 같다고 하니 교환하러 내려오라고 함. 4. 전등 하나 무너져있고, 빨간동그라미 조명 계속 켜졌다 꺼졌다 깜빡거렸다 난리임 담배꽁초도, 전등도 그러려니 하겠지만 드라이기가 터져서 다친 것 같다고 하면 괜찮냐고 먼저 물어보는게 맞지 않나 싶습니다",0,2년 전
y_21_327,전주 YAJA-전주한옥마을점,이스탄불달팽이,좋았아요 좋아ㅛ어요 좋았아요 좋아ㅛ어요 좋았아요 좋아ㅛ어요좋았아요 좋아ㅛ어요 좋았아요 좋아ㅛ어요 좋았아요 좋아ㅛ어요좋았아요 좋아ㅛ어요 좋았아요 좋아ㅛ어요 좋았아요 좋아ㅛ어요좋았아요 좋아ㅛ어요 좋았아요 좋아ㅛ어요 좋았아요 좋아ㅛ어요좋았아요 좋아ㅛ어요 좋았아요 좋아ㅛ어요 좋았아요 좋아ㅛ어요,5,2년 전
y_21_328,전주 YAJA-전주한옥마을점,주거써연,객사길에 위치해있어서 주변에 먹을게많았어용 고데기는 없었고 드라이기 바람이 강해서 좋았어요 조금 청소가 부족해보이는 느낌이 들긴 하는데 그럭저럭 지낼만 했어요! 수건 기본으로 세장 주시는데 욕조사용하고 하다보니 부족해서 더 받아서 사용했어요~!! 가성비 숙소로 괜찮은거 같아요 그래도 있을건 다 있는 ㅋㅅㅋ 침대도 막 딱딱하지 않아서 잘때 불편한건 없었어요~!! 전주 여행와서 잘 묵고 갑니당😆,5,1년 전
y_21_329,전주 YAJA-전주한옥마을점,진짜이용하고쓴다,"앞으로 이용하실 분들을 위해 리얼후기를 남깁니다. 이용하시기 전에 꼭 참고하세요~ <장점> - 번화가와 거리가 가까움. (객리단길 도보로10분) - 주차장 넓음. - 퇴실시간이 13시 <단점> 1) 스탠다드와 프리미엄의 차이는 욕조의 유무이기 때문에 스파를 할게 아니라면 스탠다드가 방이 훨씬 넓고 쾌적함. 프리미엄으로 예약했지만 실제 방 크기는 스탠다드의 1/2수준도 안되었고, 방크기는 말도 안되게 너-무 작아서 움직일때 불편했음. 사진에 속지말고 돈 날리지 마시길. 2) 침구류 청결도 최ㅡ악. - 이불에 이물질 그대로 묻어있음 - 배게4개중 2개 곰팡이 - 전 이용객의 것으로 추정되는 다수의 머리카락 - 수건4개 중에 3개가 헐다못해 올이 다 빠져있음. 행주인줄. 청소를 못하는건지 안하는건지 참... *청결은 정말 최-악이니 참고. 3) 벽지 및 화장실 벽면에 벌레 때려죽인 흔적 다수 발견, 바닥에 음료수 굳은건지 끈적임. 역시나 기본적인 청결 부분에서 매우 최악. 4) 화장실과 침실 사이가 가벽(유리)으로 막혀있는줄 알았는데 구멍 송송 뚫려있어서 서있으면 화장실 내부가 훤히 보임. (환기를 위해 뚫어놓은것이라면 이해하겠지만 일반적인 사람들의 상식으론 이해가 되지않았음, 이용객들이 서로간에 오픈되지 않은 관계라면 매우 불편할것으로 예상되니 참고) 5) 에어컨 소리가 너무 시끄러웠음. 제일 낮은 풍량으로 24'c 맞춰놓고 숙면하는데 에어컨 돌아가는 소리가 너무 커서 몇번씩 깼음. @ 총평 @ 이전에 가끔씩 이용할때마다 불편하긴 했지만 이번 숙박에 비해 크게 불편하진 않아서 따로 방 변경 요청은 하지않았었음(스탠다드). 이번 숙박(프리미엄)은 이전(스탠다드)보다 가격이 비쌌지만 이용만족도는 정말 최악이었음. 절대 두번 다시는 안갈듯. *방 변경 요청을 하기엔 이용날짜에 만실이었고, 입실시간이 늦은시간이라 어쩔수없이 이용하였음. 수많은 리뷰에서 청결에 대해 아쉽다는 말이 많았는데 사장님이 리뷰를 안보는건지 주변에 숙소가 많이 없어 배짱장사를 하는건지 모르겠지만 기본적인 청소나 청결적인 부분에서 정말 최악이어서 아쉬웠고, 조금 더 오래 영업하시고싶으시면 조금 더 신경써줬으면 하는 바램. 지금 이 상태면 누군가 위생상태 불량으로 신고해도 할말없을듯.",0,2년 전
y_21_330,전주 YAJA-전주한옥마을점,청포도색아이,무료로 2pc룸으로 업그레이드 해주신덕에 편하게 놀았습니다. 널널해진 덕에 스타일러도 돌려보고 넷플도 보고 다 좋았네요. 원풀도 엄청 크고 좋았습니다. 객사 한복판에 있는데도 널널한 주차 자리와 바로 객사 메인 거리로 빠질 수 있는 뒷길도 있어서 전주로 여행 오시는분 들은 가성비 좋게 이용하시면 좋겠습니다. 엘레베이터도 리모델링 한 것 같습니다. 친절한 카운터 직원분 덕에 업그레이드 없이도 재방문 의사 있고 번창하셨으면 좋겠습니다. 감사합니다. 다음에 또 들릴게요.,5,1년 전
y_21_331,전주 YAJA-전주한옥마을점,비오4,객사 시내에 자리한 식사나 술한잔하고 오기 가까운 위치라서 좋았습니다. 저녁에는 쌀쌀했는데 들어가자마자 따뜻하게 쉴 수 있어서 좋았습니다. 숙소 안은 모텔보다는 게스트하우스 느낌이 나서 좀 더 편안했습니다.,5,2년 전
y_21_332,전주 YAJA-전주한옥마을점,포로수용소팔보채,월풀욕조가 있는 방을 골라서 숙박했어요. 침대와 파티션으로 구분되어있고 욕조 출입이 편리해서 좋았으며 2인용이라 좋았는데 문제는 화장실 변기쪽 문이 천장까지 막혀있지않고 좀 공중화장실같이 공간이 떠있어서 방음이니 냄새 방어가 전혀 안됩니다. 잘때도 물떨어지는 물방울소리에 은근 신경이 예민해지더라구요. 그거외엔 가성비 좋은 숙소입니다. 에어드레서가 있어서 옷 냄새빼기 좋구요. 흡연 냄새가 쩔어있는 방이 있는데 그건 방바이방입니다. 나머지 침대 평범하고 화장실 욕실쪽 완전 공개되있어서 좀 눅눅할수있어요.,3,1년 전
y_21_333,전주 YAJA-전주한옥마을점,우*****,"이벤트로 저렴하게 방을 예약했지만 이불이 찢어져 있고 먼지와 머리카락이 있었으며, 바닥 청소가 아쉬웠습니다. 발에 머리카락과 먼지가 붙는 정도였습니다. 또한 직원분께서 보일러가 고장났다 하였지만 별 상관 없을 것 같아 그냥 자려 했지만 타올 같은 기본적인 것도 구비되어 있지 않고 따뜻한 물마저 안나오는 상태였습니다. 새벽이라 환불때문에 문의드리기도 뭐해서 그냥 카운터에 키두고 나왔습니다. 싼가격에 그 값을 하는 정도 였습니다.",3,2년 전
