id,name,nickname,review_content,rating,write_date
y_21_450,전주 YAJA-전주한옥마을점,번듯번듯한마족,객사에 있어서 접근성이 굉장히 좋고 룸 컨디션도 깨끗하고 좋았어요 화장실에 재떨이가 있었으나 방에 담배 냄새가 나진 않았어요 여행 중 지쳐있었는데 가볍게 넷플릭스로 영화 보고 쉬기 좋았습니다,5,2년 전
y_21_451,전주 YAJA-전주한옥마을점,떠돌아다니는정,"첫 배정받은 방에 담배냄새가 너무 심해서 다른방으로 재배정 받았습니다만, 다른 방도 비슷할 거라고 안내해주시더라구요... 2층보다는 5층방이 그래도 좀 덜했습니다. 엘레베이터에 방향제가 설치된 듯한데 기존 냄새와 어우러져서 더 힘들었어요.. 한옥숙소보다는 그냥 침대있는 곳을 원해서 가장 가까운 장소로 예매했는데, 비용부담이 없으시다면 더 지불하고 이용하시기를 추천드립니다..",3,2년 전
y_21_452,전주 YAJA-전주한옥마을점,걸쭉한조어,항상 이용하고 있지만 정말 친절하시고 숙소도 깨끗하고 편안하게 잘 쉬다 가는 것 같습니다 잘한런아니ㅇ 잘한런아니ㅇ 필요하면 줘서 너무 좋아요!!!ㅎㅎ 앞으로도 계속 이용할예정입니다~~,5,2년 전
y_21_453,전주 YAJA-전주한옥마을점,밝고탁월한시치미,"다른 평들에서 숙소가 춥다,물이 안나온다, 더럽다 이런 이야기가 많았어서 방문당일까지도 숙소 예약취소해야하나 고민했었는데 진짜 넓고 짱 좋았어요! 뜨거운 물도 잘 나오고 방도 따뜻했고 더럽지도 않았어요!-! 아쉬운 점 굳이 하나 뽑자면 고데기가 없다는 점?? 다 만족했습니다!",4,1년 전
y_21_454,전주 YAJA-전주한옥마을점,1matic,하루 잘 묵고 갑니다. 근데 방이 꽤 추웠습니다. 전기매트 없습니다. 나머지는 그럭저럭 괜찮았습니다.,4,1년 전
y_21_455,전주 YAJA-전주한옥마을점,자세한요구르트,객실에 하수구 냄새 같은게 심했어요 ㅠㅠㅠ 창문 곰팡이 때문에 만지기 찝찝하더라구요… 그 외에 객실 상태는 양호했습니다. 가격이 저렴한만큼 가격값한다고 생각했습니다 !!!!ㅠㅠㅠㅠ,4,2년 전
y_21_456,전주 YAJA-전주한옥마을점,방콕의뢰,333이벤트 가성비가 너무 좋아요! 또 텔이 시내 안에 위치해 있어서 정말 편했습니다! 추가 대실도 흔쾌히 받아주시고 너무 친절하게 대해주셔서 정말 좋았어요! 즐겁게 잘 놀다 갑니다 감사합니다! 😊,5,1년 전
y_21_457,전주 YAJA-전주한옥마을점,놀고먹기012,깔끔하고 좋았어요! 세면대도 따로 있어서 아주 편했습니다ㅠ,5,1년 전
y_21_458,전주 YAJA-전주한옥마을점,용마폭포공원혁명군,친절하시고 또 재방문 의사 있어요.,5,1년 전
y_21_459,전주 YAJA-전주한옥마을점,******,가격도 저렴하고 한옥마을 근처라서 참 좋앗습니당........ 시내에 위치해잇어서 객리단길도 방문 할수잇어서 만족햇습니다 그런데 배정 받은 방에 중문이 고장나서 좀 아쉬엇어용,5,1년 전
y_21_460,전주 YAJA-전주한옥마을점,예술적인좌표,시설이 깨끗하고 무료제공 음료들이 좋아요 샤워시설이 좋습니다,5,2년 전
y_21_461,전주 YAJA-전주한옥마을점,soso194,객실이 전체적으로 살짝 어두운편이었고 객사라 시끄러웠던것 말곤 괜찮았습니다.,4,1년 전
y_21_462,전주 YAJA-전주한옥마을점,Verqwert,"위치도 좋고, 내부 인테리어도 쾌적하고 좋았습니다 -! 전주에 놀러와서 하루 묵게 되었는데 잘 선택한 것 같아요 . 다음에 또 놀러온다면 묵고 싶습니다.",5,2년 전
y_21_463,전주 YAJA-전주한옥마을점,내일도여기로,아주 가성비로 잘 이용했습니디. 로비에 사이다랑 헛개차가 있어 맛있게 마실 수 있었고 객리단길과 근접하여 이동에도 편리합니다.재방문 의향 충분합니다 단점이 있다면 엘레베이터와 통로에 이상한 냄새가 난다는점,5,2년 전
y_21_464,전주 YAJA-전주한옥마을점,센치한부엉이,출장으로 방문했는데 숙소가 번화가에 위치해 있어 간식 사먹기도 좋고 이곳저곳 이동도 편해 좋았어요. 시설도 깔끔하고 침구류고 편안해 하룻밤 숙박 잘 하고 왔습니다. 최신 시설은 아니지만 가성비 훌륭했어요. 재방문 의사 있습니다.,5,2년 전
y_21_465,전주 YAJA-전주한옥마을점,용마폭포공원혁명군,시설이 좋고 깨끗하고 좋아요.,5,1년 전
y_21_466,전주 YAJA-전주한옥마을점,기분이몽글몽글,안녕하세여~~ 너무편하게 잘 쉬구갑니당ㅎㅎ 깔끔하고 편하게 잘 쓰고갔어요. 화장실도깨끗하구 수압도 적당해요~ 다음에 이 근처오게되면 재방문의사가 무조건 있습니다!! 감사합니다~~,5,2년 전
y_21_467,전주 YAJA-전주한옥마을점,일곱소대원,시내가 바로 앞이여서 위치가 좋고 퇴실시간이 길어서 좋았어요~~ 시내가 바로 앞이여서 위치가 좋고 퇴실시간이 길어서 좋았어요~~ 시내가 바로 앞이여서 위치가 좋고 퇴실시간이 길어서 좋았어요~~,5,2년 전
y_21_468,전주 YAJA-전주한옥마을점,라벤더색백목련,한옥마을이랑 가깝고 바로 앞이 객리단길이라 걸어다닐수있어서 편하고 좋았어요 방도 넓고 주차공간도 넉넉해서 괜찮았습니다 퇴실시간도 1시까지라 푹 쉴 수 있었어요 비품도 깨끗하고 좋아요~,5,1년 전
y_21_469,전주 YAJA-전주한옥마을점,GC1508646447,언제와도 편한하고 좋네요 역시 시설잘되어있고 앞으로로 한번씩올게요,5,1년 전
y_21_470,전주 YAJA-전주한옥마을점,당나귀보틀,접근성이 일단 좋아요 주차공간도 넉넉합니다 엘리베이터도 잘 되어 있어요 객사 한옥마을 걸어서 다닐만한 위치입니다 가성비가 좋은 숙소로 추천드립니다 재방문의사 있습니다 객사 차가져오기 애매한데 받치기 좋은 것 같아요,5,2년 전
y_21_471,전주 YAJA-전주한옥마을점,GRAPPA,여기어때 숙소 이미지가 참 좋았었는데 이번에 전주 한옥마을점을 이용하고 나서는 생각이 많이 바뀌었습니다. 옛날 건물 구조를 그대로 사용하고 있었고 관리만 잘 되었더라면 문제 없었겠지만 일단 에어컨을 작동시키면 터질것처럼 덜덜거리는 소리가 너무 커서 끌 수 밖에 없었습니다. 다들 아시다시피 지금 11월이 되었는데도 날씨가 덥습니다. 그리고 문제의 모기....천장에 모기 시체들이 더덕더덕 붙어있고 그걸 보고 누워야합니다..그리고 모기 때문에 잠을 잘 수가 없었습니다....,1,1년 전
y_21_472,전주 YAJA-전주한옥마을점,리비아소환사,깔끔하고 잠깐 묵기에 좋았습니다 잘 이용하고 갑니다,5,1년 전
y_21_473,전주 YAJA-전주한옥마을점,용마폭포공원혁명군,깨끗하고 시설이 좋아요.,4,1년 전
y_21_474,전주 YAJA-전주한옥마을점,rnjsalswns7,너무 너무 좋았습니다 가격대비 이런곳 없습니다 최고최고 ㅠ 딱한가지 방이추웠어요 ㅠ 그래서 안내데스트 갔는데 잠시 어디가셧는지 없으시더라고여 그건 빼돈 완벽합니다,5,2년 전
y_21_475,전주 YAJA-전주한옥마을점,백일곱살위험,사장님께서 너무 친절하셨습니다 ㅎㅎ 객실 컨디션도 너무 좋고 스타일러도 있어서 좋았어용! 쾌적했습니다 ㅎㅎ 드라이기도 쎈바람 잘 나오고 수압도 쎄서 좋았어요! 여행왔는데 잘 쉬다 갑니당!,5,1년 전
y_21_476,전주 YAJA-전주한옥마을점,이카리짠지,룸 컨디션 별루에요. 소음도 좀 심하구 수건상태가 무슨 걸레도 아니구 추가 수건 받으려고 10분이상 카운터에서 대기했습니다. 주차장은 널찍해서 좋았는데 나머지는 마음에 드는게 하나도 없어요,2,1년 전
y_21_477,전주 YAJA-전주한옥마을점,블랙잭더원,일단 숙소가 안쪽에 있어 조용하고 청결 상태도 딱히 문제가 될만한 점은 찾지 못했구요 리뷰들 본것들중 가장 많이 지적됏던 엘베 냄새가 걱정됏는데 이젠 그런 걱정 안하셔도 될듯해요,3,1년 전
y_21_478,전주 YAJA-전주한옥마을점,샤르망코리아,주차장이 넓고 깨끗합니다.,5,1년 전
y_21_479,전주 YAJA-전주한옥마을점,엄청난사나이,사장님도 너무 친절하시고 청결하고 너무 좋아요 출장 나갈때마다 숙박하는 호텔인데 너무너무 푹 쉬다가 갑니다 같이 일하는 어르신들도 좋다고하시고 편하게 쉬었다고 하네요 앞으로도 출장 가면 무조건 이용합니다.,5,1년 전
y_21_480,전주 YAJA-전주한옥마을점,예*****,시설 깔끔하니 좋고 위치도 한옥마을 바로 옆이라 쉬기 좋았습니다. 시간도 길어가지고 편하게 오랫동안 쉬다가 가네요 다음에도 전주 올일 있으면 여기 꼭 이용하시길 추천 드립니다 번창하세요!,5,2년 전
y_21_481,전주 YAJA-전주한옥마을점,박상섭,여자친구랑 롤하려고 2PC인 곳으로 잡았는데 첫날 바빠서 못하고 다음날 아침에 롤을 켰는데 롤이 안 되더라고요. 다른 게임은 되는데 롤만 안 되길래 카운터에 전화로 물어봤더니 자기도 전문가가 아니라 잘 모른다고 하더군요. 그래서 여자친구랑 같이 1시간동안 고치려고 노력해봤는데 안 되서 카운터에 다시 전화했어요. 저는 다른 객실로 옮겨주거나 pc없는 방과의 차액을 환불해 달라고 했는데 다른 객실은 빈 곳이 없어서 안 되고 차액환불은 롤만 안 되는 건데 자기들이 왜 환불을 해줘야되냐고 하더군요. 그러면서 저희는 입실시간 1시간 40분 후에 입실했는데 입실도 규정시간보다 일찍한 거 봐준거라는 식으로 얘기하더라고요. 어이가 없어서 따지고 싶었지만 자기도 직원이라 상급자한테 물어봐야된대서 일단 알았다고 하고 기다리는데 계속 연락이 안 와서 다시 전화해보니까 상급자가 주무시고 계신가 전화를 안 받는다고 하더라고요. 근데 그땐 이미 퇴실시간도 2시간밖에 안 남아서 저희도 기분 나빠서 나오면서 상급자와 연락되면 연락주라고 하고 나왔어요. 근데 지금 퇴실한지 31시간이 지나도록 연락이 안 왔고 별도의 사과나 보상도 받지 못한 상태에요. 직원 태도도 최악이고 스트레스 받아서 다시는 이용하기 싫어지네요. 그리고 여기 이용하실 분들은 창문 꼭 잠그고 주무세요! 밖에 베란다랑 같은 층 객실이랑 연결되어있어서 마음만 먹으면 밤에 다른 객실 드나들 수 있는 구조에요. 처음엔 창문이 안 잠겨있으니 조심하세요.,0,2년 전
y_21_482,전주 YAJA-전주한옥마을점,치뉴케,방이 깔끔했고 숙소 위치가 나쁘지 않았어요,5,1년 전
y_21_483,전주 YAJA-전주한옥마을점,87세현명한과학자,시설은 좋았으나 건물자체 냄새가 많이 나서 아쉬웠습니다,3,1년 전
y_21_484,전주 YAJA-전주한옥마을점,소소하고감동적인금발,객실도 깨끗하고 시내에 있어 좋아요,5,1년 전
y_21_485,전주 YAJA-전주한옥마을점,엘살바도르가오리,모기가 있었어요 ㅠㅠ 아쉬워용,4,1년 전
y_21_486,전주 YAJA-전주한옥마을점,열여덟조어,한옥마을 거리 가깝구요 사장님 센스가 좋으세요 스타일러도 잘 되구요 잘 쉬다갑니다 주차공간도 넓어요 한옥마을 거리 가깝구요 사장님 센스가 좋으세요 스타일러도 잘 되구요 잘 쉬다갑니다 주차공간도 넓어요,5,2년 전
y_21_487,전주 YAJA-전주한옥마을점,주시용연,"가격대비 가성비가 너무 좋은 숙소입니다. 욕실 청소 상태가 너무 좋았고 방도 깨끗합니다. 3시 체크아웃은 너무 좋았습니다 다시 가고 싶은 숙소이고 다른 사람들에게 추천해주고 싶을정도로 좋은 숙소입니다. 다만, 요즘 난방비가 많이 올라 이해는 가지만, 넝수나 추워고 아침에도 추웠습니다. 그래도 욕실물은 따뜻해서 좋습니다. 그리고 아쉬운것은 건물구조 문제인것 같은데 하수구냄새가 올라와서 불편했습니다. 감사합니다",5,1년 전
y_21_488,전주 YAJA-전주한옥마을점,긴밀한오징어,전주 놀러갔다가 한옥마을에서 가까워서 예약했는데 좋았어요!! 객리단길이랑 가까워서 술먹고 들어가기 너무 좋아요 ㅠㅠ 방도 넓고 깔끔한데 침대가 진짜 푹신해요 ㅎㅎ 전주 놀러가면 또 갈게용,5,1년 전
y_21_489,전주 YAJA-전주한옥마을점,더유,프리미엄으로 예약했는데 프리미엄이 아닌거 같아요.. 스타일러도 없고.. 사진이랑은 좀 다른 부분이 많더라고요. 긴가민가 했는데 다른 리뷰 보고 확신이 드네요. 방도 생각 보다 너무 작고 방음도 잘 안돼요ㅠㅠㅠ 그리고 따뜻한 물도 잘 안나오더라구요.. (다음날 아침엔 또 잘 나오긴 했어요) 전체적으로 조금 아쉬운 부분이 많아요ㅠㅠ,3,1년 전
y_21_490,전주 YAJA-전주한옥마을점,온화하고자신감있는레저타운,편하게 잘 쉬었어요~ 위치도 좋고!,5,1년 전
y_21_491,전주 YAJA-전주한옥마을점,나른한백년초,잘쉬었다갑니다 ..,5,1년 전
y_21_492,전주 YAJA-전주한옥마을점,경이종이,라운지랑 계단 복도 디자인이 좋고 편안하게 느끼게 설계되어있어서 좋았습니다. 방은 냄새 나지 않고 괜찮았는데 화장실 변기 뚜껑 이음새가 부서져 있고 세면대가 벽에서 떨어질랑말랑 달랑거리네요 시설보수만 조금 신경써주면 될 거 같습니다. 그래도 15000원이라 가성비는 인정입니다,3,2년 전
y_21_493,전주 YAJA-전주한옥마을점,이구역의방랑자,항상 지나가기만 했었는데 오늘 한번 이용해보니 생각보다 숙소가 좋아서 놀랐어요 깔끔하고 공기도 탁하지 않아서 좋았어요 다음에도 또 이용해볼수 있을꺼 같아요 사장님 번창하세용 ㅎㅎㅎㅎ,5,2년 전
y_21_494,전주 YAJA-전주한옥마을점,진별짱,다른건 모르겠는데 수건은 좀....,4,1년 전
y_21_495,전주 YAJA-전주한옥마을점,loveme3406,"카운터는 손님 와도 게임중. 수건 3장, 샤워수건 없음. 슬리퍼 1켤레. 샤워타올 혹은 스펀지 없음. 샤워가운 없냐고 물어보니 그제서야 카운터로 호출함. 근처 숙소가 없어서 대체제가 없으니 갔지만 다음부턴 안갈 숙소.",3,1년 전
y_21_496,전주 YAJA-전주한옥마을점,누두가자,편하게 잘 보냈어요 조용하고 깨끗하거 너무 좋았어요. 덕분에 좋은 추억 남기고가요~~~~ 가격도 합리적이고 위치적으로도 너무 좋네요. 주차하기도 편하고 부족한 점이 없어서 좋았어요~,5,2년 전
y_21_497,전주 YAJA-전주한옥마을점,당나귀보틀,스타일러 있습니다 문밖소리가 잘 들리긴 하나 전체적으로 조용한 편 수건도 넉넉하게 주십니다 객사에서 접근성이 좋습니다 화장실 샤워실 반투명해서 실루엣이 보입니다 담배냄새 안 납니다,5,2년 전
y_21_498,전주 YAJA-전주한옥마을점,간간한매,조아여 진짜 ㅠㅠㅠㅠㅠ,5,1년 전
y_21_499,전주 YAJA-전주한옥마을점,자립적이고새로운86세,잠깐 있기엔 좋았어요!!,4,1년 전
y_21_500,전주 YAJA-전주한옥마을점,재미난고양이,방은 괜찮았는데 너무 추웠어요ㅠ 숙소 근처에 뭐가 많아서 좋았습니다!,3,1년 전
y_21_501,전주 YAJA-전주한옥마을점,행복한사람은바로나젤리,두번째 방문이였어요! 저번 방보다 더 트여있고 좋았어요! 모기는 좀 있어서 5방 물렸지만.. 그래도 객사랑 엄청 가까워서 완전 편합니다~ 주차도 편하고 넓어요! 다음에 객사 올때 또 방문할게오!!,5,1년 전
y_21_502,전주 YAJA-전주한옥마을점,청주도의원,조아요~~~~~~~,5,2년 전
y_21_503,전주 YAJA-전주한옥마을점,바르샤바소식,잘 머물고 갑니다! 깨끗하고 좋았어요.,5,1년 전
y_21_504,전주 YAJA-전주한옥마을점,허지혜10,10시입실12시 토실특가 5만원 가격은 좋은데 시설은 역시 별로네요 가격에 딱맞는 시설이였습니다 전반적으로 요상한 냄새가나고 먼지가 많아요. 먼지 알러지있으신분들 피하시거나 약챙겨오세요. 침대는 너무 딱딱하지않고 너무 푹신하지도 않고 키180넘어가몃 침대짧아서 발목아파요,1,1년 전
y_21_505,전주 YAJA-전주한옥마을점,깔끔한노숙인,333룸 정말좋아요 입실시간도 빠르고 퇴실도 늦게해도 되니 여유롭게 부담 없이 지내기 딱입니다 다만 아쉬운점은 하수구냄새가 너무 심하게 납니다 호텔 로비 들어서자마자 하수구냄새 진동ㅜ 그걸 아시는지 곳곳에 디퓨져 많이 깔아놓으셨는데 그걸로는 한계가있는듯합니다 5층 복도에서도 심하게 나고 심지어 방에서도ㅜㅜ 하수구가 막혀서그런건지 건물 자체 하수시스템에 문제가 있는거같은데 그거 손보는게 비용시간 쉬운일이 아니지요 그래도 한번은 손봐야듯합니다 냄새 좀 심하긴해요 그래도 전 시설도좋고 퇴실도 늦고해서 가끔씩 이용할예정입니다,5,2년 전
y_21_506,전주 YAJA-전주한옥마을점,반*****,깔끔하고 잠깐 머무르고 가기 좋았습니다,5,1년 전
y_21_507,전주 YAJA-전주한옥마을점,호호불어먹어,전주 객사 갈 때마다 이용하는 곳입니다. 숙소 청결상태 컨디션 모두 좋았고 위치 또한 객사 안에 있어서 놀기에도 좋고 접근성도 좋습니다! 1층에는 커피머신도 있어서 이용하면 좋을거 같아요!,5,2년 전
y_21_508,전주 YAJA-전주한옥마을점,알쏭달쏭하고친숙해진회갈색,잘쉬다가ㅜ갑니다….,5,1년 전
y_21_509,전주 YAJA-전주한옥마을점,띤총,직원분들이 정말 친절하시고 고데기랑 충전기 대여가되서 너무 좋았던거 같아요 스타일러도 있어서 옷에 냄새 걱정없이 밥먹으러다녔어요ㅋㅋ 객사랑 가까워서 그것도 너무 좋았던거 같아요 다음에 재방문의사 100%입니다,5,2년 전
y_21_510,전주 YAJA-전주한옥마을점,유동곤3,방음하고 청결에서 좋은 점수를 주긴 어려운데 접근성과 가성비는 좋은거같아요 주변에 왕가랑 타코야끼 추천해요,3,1년 전
y_21_511,전주 YAJA-전주한옥마을점,영덕대게마을지하,예전에 자주 이용하다가 오랜만에 다시 이용하게 됐는데 여전히 시설이 깔끔하고 침구류도 깔끔해서 잘 이용했습니다. 들어가자마자 바닥 보일러도 따뜻해서 정말 좋았네요 앞으로 자주 이용하겠습니다,5,2년 전
y_21_512,전주 YAJA-전주한옥마을점,호호불어먹어,전주 객사 올 때마다 이용하는 숙소입니다. 쾌적한 컨디션과 아주 좋은 위치에 있어서 접근성도 매우 좋습니다!! 객사로 술마시러 오거나 놀러오시면 여기로 숙소 잡으시면 될거 같습니다 ㅎㅎ,5,2년 전
y_21_513,전주 YAJA-전주한옥마을점,흑천이,방에 들어오니 스타일러도 비치되어있고 방도 깔끔하고 이쁩니다. 아쉬운거는 방에 등이 어두워서 좀 그랬는데 잠도 잘오고 한옥마을이랑 가까워서 위치적으로고 괜찮습니다..ㅎㅎㅎㅎ 담에 한번더 방문할게요,5,1년 전
y_21_514,전주 YAJA-전주한옥마을점,줄리아루커스,굳좋아요 엄청!!!!!!!,5,1년 전
y_21_515,전주 YAJA-전주한옥마을점,난*****,vip 예약하고 갔는데 사진과 많이 다르길래 잘못 온 줄 알고 보니까 스탠다드 방을 주심 전화해서 얘기하니까 vip는 청소가 안됐다며 차액 환불하고 프리미엄으로 바꿔주겠다고 하심 얘기 안했으면 vip돈내고 스탠다드 방 쓸뻔함 체크인할 때 말이라도 해주시지 아쉬웠어요 그리고 현관문 아래쪽은 왜 살짝 뚫려있던건지 의문!,2,1년 전
y_21_516,전주 YAJA-전주한옥마을점,연희동쫄보,6시 입실인데 9시까지 방 준비 안 되어 있어서 불편했어요 ㅠ 다른 부분은 만족했습니다.,3,2년 전
y_21_517,전주 YAJA-전주한옥마을점,상나뇽,깔끔하고 좋았습니다.,4,1년 전
y_21_518,전주 YAJA-전주한옥마을점,뿔달린코뿔소,접근성도 용이하고 친절한 응대가 좋은 거 같아요,5,2년 전
y_21_519,전주 YAJA-전주한옥마을점,깔끔한노숙인,모텔에 물이없는게 말이됩니까? 객실에도없고 물자체가 없다네요?ㅋㅋ 어이가없어서 사정이 어떻든 없음 객실에라도 기본 물은 갔다놔야지 머 이런거지같은경우가 짜증나네요 진짜 여기는 올라면오고 말라면 말어라식으로 영업하시는듯,2,1년 전
y_21_520,전주 YAJA-전주한옥마을점,영쟁1,화장실 천장이 뚫려있음,3,1년 전
y_21_521,전주 YAJA-전주한옥마을점,독특하고온화한수달,일단 주차장이 가득 차있어서 주차하기가 쉽지 않았습니다. 방이 좀 추웠고 전기장판이 없어서 아쉬웠습니다. 수건도 3개여서 아쉬웠어요 좋은 점은 스타일러!! 스타일러가 있어서 좋았어요,3,1년 전
y_21_522,전주 YAJA-전주한옥마을점,나폴레옹다이너마이트,잘 쉬다갑니다 주변에 놀거리가 많아서 좋았습니다,5,2년 전
y_21_523,전주 YAJA-전주한옥마을점,띤총,"333이벤트로 간거여서 3시퇴실이였는데 12시반에 전화로 퇴실준비해달라고 해서 엄청 놀랐었어요ㅠㅠ 고데기, 충전기 대여가되서 편했어요 화장실이 오픈되있어서 조금 당황스럽기는 했지만 편하게 쉬다왔습니다",5,2년 전
y_21_524,전주 YAJA-전주한옥마을점,당나귀보틀,한옥마을 객사와 근접합니다 걸어다니기 용이 엘리베이터 있고 계단도 있고 이용하기 편리합니다 주치장 잘 되어 있고 침구류도 적당히 좋아요 재방문 의사 있습니다 티비도 크고 좋습니다~!,5,2년 전
y_21_525,전주 YAJA-전주한옥마을점,호후러후헐,스타일러 있는 건 좋았는데 너무너무 추웠어요... 온도 좀 올려달라고 말씀드렸는데 그래도 추워서 연락드렸더니.. 달리 방법이 없다고...하시네요... 침대에 온열매트라도 있었으면 좋았을텐데요. 무척이나 아쉬움이 가득한 숙소였습니다....,4,1년 전
y_21_526,전주 YAJA-전주한옥마을점,한달에한번,갑작스런 약속 방문길에 어플을 이용하여 예약하게 되었습니다. 이런저런 검색 끝에 예약하고 왔는데 시설도 괜찮았고 방도 깨끗하고 좋았습니다. 사장님께서도 너무 친절하셔서 기분좋게 잘 묵고 왔습니다. 감사합니다^^,5,1년 전
y_21_527,전주 YAJA-전주한옥마을점,어니스트2,복도에서 하수구냄새가 나고 욕실 세면대에서 곰팡이 냄새가 나요 지급된 수건이 너무 헐었어요,3,1년 전
y_21_528,전주 YAJA-전주한옥마을점,나토k,저렴하고 가성비짱 자주 이용할게요,5,2년 전
y_21_529,전주 YAJA-전주한옥마을점,껄렁껄렁한염장,잘쉬고가요.....,5,1년 전
y_21_530,전주 YAJA-전주한옥마을점,배은망덕한중전차,청결상태랑 스타일러가 있어서 좋았어요,5,1년 전
y_21_531,전주 YAJA-전주한옥마을점,분석적인크루세이더,도보로 한옥마을도 가고 객사 부근이라 놀기 좋아요 내부는 적당히 깨끗함. 승강기 밑에서 악취가 올라옴 구조적인 문제인듯,2,2년 전
y_21_532,전주 YAJA-전주한옥마을점,빛나고유머러스한광산,좋아요 사장님도 친절하시고 좋은 여행이 되었네요 ㅎㅎㅎ 다음번에 또 방문 하겠습니다 항상 즐겁고 행복한 나날들 되세요~~~~ 방 컨디션도 깔끔하고 수건 등 부족한거 있으면 친절하게 응대해 주십니다 이곳 이용하시고 좋은 추억 남기세요!!,5,1년 전
y_21_533,전주 YAJA-전주한옥마을점,GC1510908714,저렴한 가격으로 가성비있게 이용했어요! 그런데 엘베냄새가ㅠㅠ,4,2년 전
y_21_534,전주 YAJA-전주한옥마을점,당나귀보틀,금연은 아닙니다 따뜻한 물 잘 나오고 무난합니다 객사 주변이라는 점이 좋아요 스타일러도 구비되어 있음 창문 있어 환기도 가능한데 세면대에선 따뜻한 물이 안 나와요 샤워기에선 나옵니다,5,2년 전
y_21_535,전주 YAJA-전주한옥마을점,소소하고감동적인금발,전주 갈때마다 애용할것같아요,5,1년 전
y_21_536,전주 YAJA-전주한옥마을점,따분한병인,들어가자 마자 담배 냄새가 너무 심해요. 애연가들에겐 강추~!!!!,5,2년 전
y_21_537,전주 YAJA-전주한옥마을점,닉네임은최대열네자까지됩니다,1. 침구 세제 이염된채로 그냥 사용. 2. 방향제 냄새 코를 심하게 찌름 3. 수건이 걸레짝만큼 실밥이 다 풀려있고 더러움 4. 욕실 세면대 부숴져서 물 다 새고 물때 심함 5. 객실에 있는 종이컵 장시간 방치되어 있었나 이물질과 먼지 심하게 묻어있음,0,1년 전
