id,name,nickname,review_content,rating,write_date
y_22_325,전주 호텔 써밋스테이,여귀어때밀이,생각했던 것보다는 별로인듯,3,5개월 전
y_22_326,전주 호텔 써밋스테이,NQI1팀,출장와서 간곳인데 너무 편안히 잘쉬다갑니다. 다음에 출장잡히면 무조건 재방문합니다.,5,5개월 전
y_22_327,전주 호텔 써밋스테이,55세템플릿,리모델링 하여 아주 깨끗하고 쾌적합니다 잘 이용하고 갑니다 또 이용 할게요,5,11개월 전
y_22_328,전주 호텔 써밋스테이,온타리오,잘쉬고갑니다 번창하세요,4,3개월 전
y_22_329,전주 호텔 써밋스테이,공감하고기대하는소나기,남사장님이 매우매우 친덜합니다. 청소상태가 깨끗하서 좋았고 티비고 크고 스타일러고 있고 공기청정기도 있어서 꽤나 만족스럽게 이용한거 같습니다..... 주차공간고 매우 넓어서 아무나 편하게 주차항 수 있을 정도 입니다.... 화장실은 깨끗한 편입니다.....용조가 없고 단순한 편입니다....1회 용품도 잘 준비되어있고 객실안에 위생가운도 잘 비치되어 있어서 만족 스럽게 일박했네요. 객실은 다른곳에 비해 작지고 크지도 않는 평범한 편입니다.....,4,7개월 전
y_22_330,전주 호텔 써밋스테이,calm05,만족합니다. 좋아요.,5,8개월 전
y_22_331,전주 호텔 써밋스테이,창의적이고친밀한,3번째 가는거지만 좋아요~,5,4개월 전
y_22_332,전주 호텔 써밋스테이,예순일곱구름,시설고 깨끗하고 청결합니다,5,11개월 전
y_22_333,전주 호텔 써밋스테이,시네라야,항상 잘 이용하고 있습니다,5,5개월 전
y_22_334,전주 호텔 써밋스테이,홍냥냥낑깡꽁,굳ㅎㅎㅎㅎㅎ ㅋㅋㅋㅋㅋ,5,5개월 전
y_22_335,전주 호텔 써밋스테이,깔끔하고창의적인조미료,출장와서 간곳인데 편안히 잘쉬다갑니다. 다음에도 무조건 재방문,5,5개월 전
y_22_336,전주 호텔 써밋스테이,깔끔하고창의적인조미료,전주에서 가성비 원탑이라 생각합니다. 출장가면 항상 항상갑니다.,5,4개월 전
y_22_337,전주 호텔 써밋스테이,떡의왕국,전주가본곳중에 세손가락안에 들어가는 좋은곳인거같아요,5,11개월 전
y_22_338,전주 호텔 써밋스테이,정통령,깨끗하고 넓어서. 좋았고. 아침을 주어서. 좋았어요,5,5개월 전
y_22_339,전주 호텔 써밋스테이,효자동통감자,깨끗하고 편히쉬었습니다,5,10개월 전
y_22_340,전주 호텔 써밋스테이,지구사랑해요,감사합니다 잘쉬었다가감니다 좋은하루보내세요,5,5개월 전
y_22_341,전주 호텔 써밋스테이,DW맘,깔끔하고 괜찮았엉ᆢㄷㅎㅎ,4,7개월 전
y_22_342,전주 호텔 써밋스테이,음지의마왕,좋습니다~~~~굿굿,5,5개월 전
y_22_343,전주 호텔 써밋스테이,saivary2,세번째방문입니다 감사합니다,5,3개월 전
y_22_344,전주 호텔 써밋스테이,깔끔하고예술적인진달래색,청결해요 방도 따듯합니다,5,6개월 전
y_22_345,전주 호텔 써밋스테이,가스으료운다,척결하겠다는 편해요 여러분강 추천합니다,5,3개월 전
y_22_346,전주 호텔 써밋스테이,준구동머,깨끗하고 좋습니다^^,5,3개월 전
y_22_347,전주 호텔 써밋스테이,이쁘니대박,친절하시고 잘해주십니다,5,1년 전
y_22_348,전주 호텔 써밋스테이,자동품질,가성비 굿 굿. 사장님 핑절도 최고,5,3개월 전
y_22_349,전주 호텔 써밋스테이,saivary2,두번째방문입니다 잘있다갑니다,5,5개월 전
y_22_350,전주 호텔 써밋스테이,떡의왕국,요즘 가본곳중 가장 깔끔한곳같아요,5,10개월 전
y_22_351,전주 호텔 써밋스테이,아들이두놈,첫방문인데 만족합니다,5,10개월 전
y_22_352,전주 호텔 써밋스테이,시네라야,항상 깨끗하고 해서 자주 애용합니다,5,9개월 전
y_22_353,전주 호텔 써밋스테이,배성열입니다,오늘도 여김없이 출장일을 끝내고 숙소를 찾아 여기어때 어플을 켜고 내주변을 찾아봅니다. 사진부터 마음에 드는 인테리어를 찾았지만 이지역에선 야기가 가장 맘에 들어서 예약을 하고 방문 하였습니다. 역시나 사진처럼 깨끗하고 푸근하고 좋습니다. 전지역을 모두 출장을 다니기에 전국 곳곳의 숙소를 다니고 숙소를 비교하지만 여기도 어김없이 잘 선택 한거 같아 마음이 뿌듯합니다 ㅎㅎ 다음에도 재방 계획입니다. 출장다니시는 분들 화이팅 하십시오~~~~~ 리뷰 작성하기 힘듬!!!!,5,7개월 전
y_22_354,전주 호텔 써밋스테이,배성열입니다,오늘도 여김없이 출장일을 끝내고 숙소를 찾아 여기어때 어플을 켜고 내주변을 찾아봅니다. 사진부터 마음에 드는 인테리어를 찾았지만 이지역에선 야기가 가장 맘에 들어서 예약을 하고 방문 하였습니다. 역시나 사진처럼 깨끗하고 푸근하고 좋습니다. 전지역을 모두 출장을 다니기에 전국 곳곳의 숙소를 다니고 숙소를 비교하지만 여기도 어김없이 잘 선택 한거 같아 마음이 뿌듯합니다 ㅎㅎ 다음에도 재방 계획입니다. 출장다니시는 분들 화이팅 하십시오~~~~~ 리뷰 작성하기 힘듬!!!!,5,7개월 전
y_22_355,전주 호텔 써밋스테이,우스꽝스러운역술가,전체적으로 청결해서 하루 머물기 좋은 거 같어요 숙소도 따뜻했고 위치도 좋아서 만족입니다 재방문하기도 좋을 거 같아용!,3,5개월 전
y_22_356,전주 호텔 써밋스테이,준준준준준준준준중,너무 좋아요 완전 좋아요 너무 좋아요 완전 좋아요 너무 좋아요 완전 좋아요 너무 좋아요 완전 좋아요 너무 좋아요 완전 좋아요 너무 좋아요 완전 좋아요 너무 좋아요 완전 좋아요 너무 좋아요 완전 좋아요 너무 좋아요 완전 좋아요 너무 좋아요 완전 좋아요 너무 좋아요 완전 좋아요 너무 좋아요 완전 좋아요 너무 좋아요 완전 좋아요 너무 좋아요 완전 좋아요 너무 좋아요 완전 좋아요 너무 좋아요 완전 좋아요 너무 좋아요 완전 좋아요 너무 좋아요 완전 좋아요 너무 좋아요 완전 좋아요 너무 좋아요 완전 좋아요 너무 좋아요 완전 좋아요 너무 좋아요 완전 좋아요 너무 좋아요 완전 좋아요 너무 좋아요 완전 좋아요 너무 좋아요 완전 좋아요 너무 좋아요 완전 좋아요 너무 좋아요 완전 좋아요 너무 좋아요 완전 좋아요 너무 좋아요 완전 좋아요 너무 좋아요 완전 좋아요 너무 좋아요 완전 좋아요 너무 좋아요 완전 좋아요,5,6개월 전
y_22_357,전주 호텔 써밋스테이,배성열입니다,오늘도 여김없이 출장일을 끝내고 숙소를 찾아 여기어때 어플을 켜고 내주변을 찾아봅니다. 사진부터 마음에 드는 인테리어를 찾았지만 이지역에선 야기가 가장 맘에 들어서 예약을 하고 방문 하였습니다. 역시나 사진처럼 깨끗하고 푸근하고 좋습니다. 전지역을 모두 출장을 다니기에 전국 곳곳의 숙소를 다니고 숙소를 비교하지만 여기도 어김없이 잘 선택 한거 같아 마음이 뿌듯합니다 ㅎㅎ 다음에도 재방 계획입니다. 출장다니시는 분들 화이팅 하십시오~~~~~ 리뷰 작성하기 힘듬!!!!,5,8개월 전
y_22_358,전주 호텔 써밋스테이,청정월롱,전주 숙소중 최고에요 가성비좋고 깨끗하고 따뜻하고 직원분도 친절하십니다 전주 숙소중 최고에요 가성비좋고 깨끗하고 따뜻하고 직원분도 친절하십니다 전주 숙소중 최고에요 가성비좋고 깨끗하고 따뜻하고 직원분도 친절하십니다 전주 숙소중 최고에요 가성비좋고 깨끗하고 따뜻하고 직원분도 친절하십니다 전주 숙소중 최고에요 가성비좋고 깨끗하고 따뜻하고 직원분도 친절하십니다 전주 숙소중 최고에요 가성비좋고 깨끗하고 따뜻하고 직원분도 친절하십니다 전주 숙소중 최고에요 가성비좋고 깨끗하고 따뜻하고 직원분도 친절하십니다,5,4개월 전
y_22_359,전주 호텔 써밋스테이,kkansol,친절하시구 침대가 푹신해요~~ 시설 및 인테리어 좋구요 객실 청결상태 좋구요 서비스 좋았어요 시설 및 인테리어 좋구요 객실 청결상태 좋구요 서비스 좋았어요 시설 및 인테리어 좋구요 객실 청결상태 좋구요 서비스 좋았어요 시설 및 인테리어 좋구요 객실 청결상태 좋구요 서비스 좋았어요 시설 및 인테리어 좋구요 객실 청결상태 좋구요 서비스 좋았어요 시설 및 인테리어 좋구요 객실 청결상태 좋구요 서비스 좋았어요 시설 및 인테리어 좋구요 객실 청결상태 좋구요 서비스 좋았어요 시설 및 인테리어 좋구요 객실 청결상태 좋구요 서비스 좋았어요,5,9개월 전
y_22_360,전주 호텔 써밋스테이,kkansol,침대가 푹신해요~~~ 시설 및 인테리어 좋구요 객실 청결상태 좋구요 서비스 좋았어요 시설 및 인테리어 좋구요 객실 청결상태 좋구요 서비스 좋았어요 시설 및 인테리어 좋구요 객실 청결상태 좋구요 서비스 좋았어요 시설 및 인테리어 좋구요 객실 청결상태 좋구요 서비스 좋았어요 시설 및 인테리어 좋구요 객실 청결상태 좋구요 서비스 좋았어요 시설 및 인테리어 좋구요 객실 청결상태 좋구요 서비스 좋았어요 시설 및 인테리어 좋구요 객실 청결상태 좋구요 서비스 좋았어요 시설 및 인테리어 좋구요 객실 청결상태 좋구요 서비스 좋았어요,5,9개월 전
y_22_361,전주 호텔 써밋스테이,배성열입니다,오늘도 여김없이 출장일을 끝내고 숙소를 찾아 여기어때 어플을 켜고 내주변을 찾아봅니다. 사진부터 마음에 드는 인테리어를 찾았지만 이지역에선 야기가 가장 맘에 들어서 예약을 하고 방문 하였습니다. 역시나 사진처럼 깨끗하고 푸근하고 좋습니다. 전지역을 모두 출장을 다니기에 전국 곳곳의 숙소를 다니고 숙소를 비교하지만 여기도 어김없이 잘 선택 한거 같아 마음이 뿌듯합니다 ㅎㅎ 다음에도 재방 계획입니다. 출장다니시는 분들 화이팅 하십시오~~~~~ 리뷰 작성하기 힘듬!!!!,5,5개월 전
y_22_362,전주 호텔 써밋스테이,백곰님,"일단 홍보 사진과 똑같은 상태의 숙소라 좋았구요. 욕조보고 예약했는데, 시원하게 목욕도 하고 잘지냈습니다. 컴터도 잘돌아가고.. 울가족 만족스럽게 자고 왔네요.",5,9개월 전
y_22_363,전주 호텔 써밋스테이,쌍둥이칭구,출장중에 방문한곳입니다 주차장 넉넉합니다 들어오는 입구에 음료수 자판기가 있는데 사장님께 말씀드렸더니 오백원 동전을 넣으면 된다고 동전을 주셔서 음료수 두개를 뽑았답니다 숙소에는 물 두병과 이슬 톡톡이 있네요 좋았어요 방은 컴퓨터 두대있는곳을 예약했어요 침대 좋아요 트윈이라 편하게 따로 잘수 있어서 좋았어요 스타일러가 있어서 다음날 출근할때 냄새 안나고 좋을듯 합니다 공기청정기 있어서 답답함 없이 잘 쉴수가 있고 욕조는 사용하지 않았지만 사진에서 처럼 넓어요 편안한 잠자리 잘 쉬다 갑니다,5,1년 전
y_22_364,전주 호텔 써밋스테이,두산빠,그동안 전주로출장가게되면 다른숙소에 갔었는데 신축이라는리뷰보고 바로예약.근처가보니 입구부터 신축느낌이 물씬풍겼고 너무나도 깔끔히정리되어있어 입실부터기분이좋았네요.침구류도새거쌔거느낌이고 세면장 바닥 전부 깔끔그자체였네요.전주역에서 버스로15분정도이고 주변에 많은모텔이있지만 단연 돋보이고 깔끔해보입니다.이제부터는 전주출장시 고민할필요없이 무조건 재방문의사있고 다시 사진리뷰올리겄습니다. 덕분에 너무나도 잘쉬다갑니다.~^^,5,1년 전
y_22_365,전주 호텔 써밋스테이,HotelManiaRev,"구 허니입니다. 이번에 리모델링했다해서 다녀와봤습니다. 1주차장 담벼락마감을 해서 진출입로를 하나로 만들어서 좀더 넓어보이네요. 객실은 큰차이는 없어보이고 에어컨이 24년식 최신기종으로 변경되서 세균걱정안해도 될듯합니다. 화장실이 좀더 세련미가 돋보이고 바디,샴푸,린스등도 제가 개인적으로 좋아하는호텔 제품이였고 비데또한 좋았습니다. (린스통은 펌프가 파손된듯 눌러도 린스안나옴 ) 소형호텔과 모텔 차이점은 조리시설.. 조식운영하시나봅니다. 라면 끓여주는 기계또한있어서 이용은 안해봤지만 데스크 주변이 다채로워졌습니다. 룸업을 해주셨고 스탠b인듯싶습니다. gtx960사양에 pc와 신규템인 스타일러가 존재하는 객실이였습니다. 서울에서 가족 지인들오면 트원룸 예약하던곳입니다. 그래서 그런지 업그레이드는 환영이네요. 객실 냉장고에는 일반실은 물2 이있습니다. 사전에 데스크에서 에이스랑 하나씩 챙기시면 되겠습니다. 주차장에 자판기가 있는데 데스크에 500원 짜리가 있다는데 없었고(1개실 1음료 무료), 안내또한 전혀 없어서 (소수스탭만있는 소형호텔은 일일이 물어보는게 서로 시간낭비) 조금 아쉬움이 있습니다. 관리를 안할거면 운영또한 안하는게 맞는거 같습니다.아무튼 오랜 숙제는 냉방기기 업그레이드와 화장실에 쾌적함이 아우러진 이번 리모델링으로 매출상승이 있으시면 좋겠네요.",4,1년 전
y_22_366,전주 호텔 써밋스테이,두산빠,전주출장때문에 다시 방문 처음방문했을때 너무좋아서 조금 먼곳에서 업무를 보았지만 무조건 예약.역시나 두번째방문도 좋았습니다.스타일러는 당연히 관리도잘도었고 어느하나 부족함없이 너무나도 편히쉬다 업무보러갑니다.침구류면침구류 어매니티또한 다른곳보다도 좋은것으로구비해놓으셔서 그것또한만족 어디 흠잡을곳이 없네요.입구서부터친절하게 맞아주셔서 첫인상이 너무나도 좋았답니다 다음전주출장시 무조건 재예약할것을 약속드릴게요.감사합니다~,5,1년 전
y_22_367,전주 호텔 써밋스테이,386스티븐,출장올때마다 숙소에들어가기전에 항상저녁은 돈까스클럽에가서왕돈까스를 먹는즐거움이있는데 오늘도변함없이 근처에숙소를예약하고 큼지막한왕돈까스 한접시뚝딱 든든하게배를채우고 숙소로발걸음을옮겼는데 아 생각보다주차장이 괜찮네요 차량간격도넓고 주차장이넓어서좋고 매우만족스러웠습니다 원하는위치에완벽주차완료 항상주차가완벽하면 숙소에서불안하지도않고 편안해서좋아요 데스크에상당히친절하신 사모님의안내를받아 객실에들어오니 상당히만족 매우청결하고 매트리스상태양호 폭신폭신해서 넘좋았습니다 감사합니다 잘쉬었습니다,5,1년 전
y_22_368,전주 호텔 써밋스테이,여기어때 이용 고객,총평 : 하룻밤 잘 쉬어갔습니다. 여행지에 늦게 도착해서 체크인을 입실 시간보다 늦게하게되었습니다. 남아있는 객실 중 업그레이드해주셔서 뷰가 좋은 곳으로 배정되었는데 객실에서 담배냄새가 좀 나서 이야기드렸더니 다른 방으로 바로 변경해주셨어요. 변경 된 방은 환기가 잘 되어있어서 담배 냄새가 나지 않아서 첫번째 방이 더 좋긴했는데 나중에 옮긴방을 이용했습니다. 1층에 라면 끓여먹을 수 있는 공간이 있었는데 못 끓여먹고 온게 아쉽네요~ 다음 전주 방문시에도 이용하고 싶은 써밋스테이에요!,4,1년 전
y_22_369,전주 호텔 써밋스테이,쌍둥이칭구,좋아요 너무 좋아요 두번째 방문입니다 처음 방문은 신랑 출장길에 동행하느라 피곤할것 같아서 침대 두개로 예약을해서 편하게 쉬었는데 이번엔 여행길에 방문해서 도착하자마자 배고픈 신랑이 1층에 한강라면으로 해결해서 같이 먹고 숙소로 올라와서 쉬었네요 이번 방은 침대 하나여도 넉넉한 침대로 둘이 같이 쉴수 있었어요 스타일러덕에 옷도 깔끔하게 세탁했어요 방구조가 모두 넓어요 큰 티비덕에 야구도 먹고 영화도 보고 창문밖은 산이 보여서 맘껏 창문을 열고 쉬어도 된답니다 다음 출방길에 재방문 해야겠네요,5,1년 전
y_22_370,전주 호텔 써밋스테이,따뜨밥,처음 이용해본 곳인데 만족하고 갑니다. 체크인하는데 아직 방이 준비가 덜되서 업그레이드 된 다른방으로 주셔서 더 넓은 방에서 머물게 된 것 같더라구요 ㅎㅎ 침구류도 깨끗했고 침대도 편안해서 잠도 잘 잤습니다ㅎㅎㅎ 다른숙소가면 에어컨이나 스타일러에서 냄새가 나는 경우가 있었는데 냄새도 안나고 스타일러 잘 썼습니다~!ㅎㅎㅎ 1층에는 조식먹을 수 있는 바가 있고 주차장도 넓었어요 ㅎㅎ 넷플릭스도 잘 이용했습니다~~! 주변에 좀만 걸어가면 음식점도 많고 전주역도 가깝고 접근성 좋은 숙소입니다~~!,5,1년 전
y_22_371,전주 호텔 써밋스테이,모던파파,"전주 출장으로 다녀왔습니닺 1. 최근에 리모델링을 한 것 같아요. 전체적으로 깨끗했어요 2. 예약한 스탠다드 룸을 소독한다고, 룸 업그레이드 해주셨어요.^^ 3. 1층에 간단한 토스트와 커피가 준비되어 있구요, 무엇보다 한강라면을 무료로 즐길 수 있어요~^^",4,1년 전
y_22_372,전주 호텔 써밋스테이,엄지곤쥬,"전주 자주 놀러와서 숙소찾던 와중에 오픈한지 얼마 안됐되서 와보게 됐는데 깔끔하고 좋아요 사장님도 친절하시고 서비스 좋네요~ 음료 먹고싶으면 동전도 주시네요 종류가 다양해서 먹을것도 많아요 무엇보다 비흡연자라서 방도 금연방이라 안심하고 잘 묵다가 가네요 다른숙소는 보면 담냄새 나던데 여긴 안나요 깔끔하고 침대도 아주 푹신해요~ 단 하나 아쉬운점이 있었다면 창문을 열면 벽이 보여서 답답한거 빼곤 다 완벽했습니다 ㅎㅎ, 다음에 생각날거같아요 또 오고싶은 곳 이라 기회되면 올게요",5,1년 전
y_22_373,전주 호텔 써밋스테이,뿅뿅은진,"부산에서 전주로 1박2일 짧은여행을 왔는데 전체적으로 깨끗하고 체크인 시간도 빠르고 대부분 좋았어요~ 수압도 괜찮고 비데도 있고 샴푸, 바디 향도 맘에들고~ 조식으로 라면, 식빵, 커피도 있더라고요^^ 구지 아쉬운걸 찾자면 냉장고 안이 좀 아쉽긴했는데 생수도 3병 들어있고 저희부부는 대부분 만족합니다ㅎㅎ 늦은시간까지 넷플릭스 보면서 짧은시간 이지만 재밌었어요~~ 평일이라 그런건지 방음도 잘되는거 같아 조용한 편이고~~ 객실 들어오면 문이 하나 더 있어서 좋네요^^ 저희 잘쉬다갑니다~~~~",4,1년 전
y_22_374,전주 호텔 써밋스테이,야이노마3,"서비스 가격 객실컨디션 주차장 간식 모두 만족합니다. 전주는 여기만 올래요,,,",5,1년 전
y_22_375,전주 호텔 써밋스테이,HotelManiaRev,"It is a small hotel that is making great progress through many trials and errors. As a consumer, I feel happy when I see this place. The parking lot lines are wide and good. However, except for the fact that the bed sheets came off quickly due to the poor quality of the bed and that the pillow smelled like laundry, probably because it was the rainy season, the breakfast service was not bad. Of course, I have never had breakfast.",4,1년 전
y_22_376,전주 호텔 써밋스테이,딱밤을딱밤,"당일 밤 늦게 급하게 1박 할 일이 생겨 이용했습니다. 그렇게 큰 기대는 안 했는데 막상 이용해보니 리뷰를 안 쓸 수가 없겠더라고요. 평소 출장다니면서 모텔들 많이 이용해봤는데, 그중에서도 최상으로 꼽을만큼 쾌적했습니다. 저는 혐연가라 모텔 다닐때마다 담배냄새날까 노심초사하는데 전객실 금연이라그런지 담배냄새 1도 없고, 스타일러, TV도 크고, 방도 넓고 빠지는게 없네요. 스탠다드방이 무슨 다른 모텔들 디럭스 이상같아요. 주차장도 꽤 여유로운편이고 조식라면 및 음료 제공도 좋았습니다. 특히 음료는 그 모텔들에 있는 묻지마 캔음료 말고 자판기형식으로 원하는거 골라갈 수 있는게 아주 좋네요. 다음에 근처 방문하면 또 여기서 자고 갈 것 같습니다.",5,1년 전
y_22_377,전주 호텔 써밋스테이,엄청나고활동적인하양,토요일 오후 급하게 예약을 하게 되었는데 저렴하누가격에 깔끔한 곳에서 숙박을 하고 나올 수 있어서 좋았습니다 다른 리모델링을 한 숙소처럼은 아니지만 넓고 쾌적한 공간이 마음에 들었습니다. 특히 주차 하는데에 있어서는 너무 만족하였습니다. 주차 자리가 넓어서 넉넉하게 주차할 수 있었습니다. 화장실 도 넓어서 가격대비 만족하고 사용할 수 있었습니다. 위치상 햇볕이 잘 안들어서 인지 조명도 그렇고 어두컴컴하고 침침한 분위기가 있는게 살짝 아쉽긴 했지만 비교적 좋았습니다.,5,1년 전
y_22_378,전주 호텔 써밋스테이,딩턴쒸,항상 만족스러운호텔입니다 청결하고 주인분들 친절하고 가격대비 좋습니다항상 만족스 러운호텔입니다 청결하고 주인분들 친절하고 가격대비 좋습니다항상 만족스 러운호텔입니다 청결하고 주인분들 친절하고 가격대비 좋습니다항상 만족스 러운호텔입니다 청결하고 주인분들 친절하고 가격대비 좋습니다항상 만족스 러운호텔입니다 청결하고 주인분들 친절하고 가격대비 좋습니다항상 만족스 러운호텔입니다 청결하고 주인분들 친절하고 가격대비 좋습니다항상 만족스 러운호텔입니다 청결하고 주인분들 친절하고 가격대비 좋습니다항상 만족스 러운호텔입니다 청결하고 주인분들 친절하고 가격대비 좋습니다항상 만족스 러운호텔입니다 청결하고 주인분들 친절하고 가격대비 좋습니다항상 만족스 러운호텔입니다 청결하고 주인분들 친절하고 가격대비 좋습니다항상 만족스 러운호텔입니다 청결하고 주인분들 친절하고 가격대비 좋습니다항상 만족스 러운호텔입니다 청결하고 주인분들 친절하고 가격대비 좋습니,5,1년 전
y_22_379,전주 호텔 써밋스테이,배성열입니다,오늘도 여김없이 출장일을 끝내고 숙소를 찾아 여기어때 어플을 켜고 내주변을 찾아봅니다. 사진부터 마음에 드는 인테리어를 찾았지만 이지역에선 야기가 가장 맘에 들어서 예약을 하고 방문 하였습니다. 역시나 사진처럼 깨끗하고 푸근하고 좋습니다. 전지역을 모두 출장을 다니기에 전국 곳곳의 숙소를 다니고 숙소를 비교하지만 여기도 어김없이 잘 선택 한거 같아 마음이 뿌듯합니다 ㅎㅎ 다음에도 재방 계획입니다. 출장다니시는 분들 화이팅 하십시오~~~~~ 리뷰 작성하기 힘듬!!!!,5,1년 전
y_22_380,전주 호텔 써밋스테이,유쾌하고친숙해진개트윅공항,새로 리모델링 했는지 깨끗하고 스타일러도 새거라 좋은 냄새 나서 좋았어요 다음에 또 전주오면 재방문 할거같아요 잘 쉬다 갑니다,5,1년 전
y_22_381,전주 호텔 써밋스테이,이투태어아,"사장님도 너무너무 친절하시구, 외관부터 복도, 룸, 화장실 모두모우 굉장히 청결해요! 침대도 딱딱한게아니라 푹신해서 꿀잠잤어요! 라면제조기?랑 식빵도 항상 비치되어있어 굉장히 특색있어요. 재방문 의사 120퍼에요!",5,1년 전
y_22_382,전주 호텔 써밋스테이,야이노마3,"잘쉬다가 갑니다. 전주오면 다시 들를께요,",5,1년 전
y_22_383,전주 호텔 써밋스테이,야이노마3,잘쉬다 갑니다 전주오면 다시 드릴께요.,5,1년 전
y_22_384,전주 호텔 써밋스테이,갸름한린다,잘 이용하고 갔습니다ㅎㅎㅎ,3,1년 전
y_22_385,전주 호텔 써밋스테이,네오텍코리아,추천해요. 룸컨디션 굿입니다 전주 출장을 많이 오는편인데 가격대비 만족도 좋습니다,5,1년 전
y_22_386,전주 호텔 써밋스테이,엄지곤쥬,전주놀러와서 두번왔는데 진심 깔끔하고 담냄새 안나서 좋었어요 무료로 음료도 골라먹을수있고 좋아요 구웃 구웃~~~ 전주놀러와서 두번왔는데 진심 깔끔하고 담냄새 안나서 좋었어요 무료로 음료도 골라먹을수있고 좋아요 구웃 구웃~~~ 전주놀러와서 두번왔는데 진심 깔끔하고 담냄새 안나서 좋었어요 무료로 음료도 골라먹을수있고 좋아요 구웃 구웃~~~ 전주놀러와서 두번왔는데 진심 깔끔하고 담냄새 안나서 좋었어요 무료로 음료도 골라먹을수있고 좋아요 구웃 구웃~~~,5,1년 전
