id,name,nickname,review_content,rating,write_date
y_22_097,전주 호텔 써밋스테이,오동통한구름,"전체적으로 친절하신사장님, 객실컨디션다만족했는데 화장실샤워기에끼여있던머리카락이 아쉬웠어요 온탕에서 피로도풀고 편히쉬고왔는데 욕실정비한후사용했어서조금불편했어요",4,6개월 전
y_22_098,전주 호텔 써밋스테이,먹거리마을곱등어,숙소도 깨끗하고 좋아여! 전주역 근처라 접근성도 좋음 1층에 라면기계도 있어서 조식으로 먹울수도있음,4,2개월 전
y_22_099,전주 호텔 써밋스테이,국이짜다,여자친구랑 전주 여행가면서 많은 숙소를 찾아봤어요 그 중에서 써밋스테이가 가장 좋아보여서 예약을 하고 갔는데 저희의 눈은 틀리지 않았어요 주차장도 엄청 넓고 직원분도 친절하셨어요 주차장 쪽에서 입구 들어가는 길에 자판기가 하나 있는데 객실 인원 수대로 음료를 뽑아갈 수 있다는 점이 좋았어요! 오전 6시부터 9시까지 조식을 주시는데 아쉽게도 늦잠을 자서 조식은 먹지 못했네요 커피 머신도 있고 전자레인지도 있어서 야시장에서 사온 음식들을 따뜻하게 먹을 수 있었어요! 객실 청결상태도 너무 마음에 들었습니다 다음에도 방문할게요!,5,7개월 전
y_22_100,전주 호텔 써밋스테이,대와앙파리,깔끔하네요 잘 쉬다 갑니다^^,4,23일 전
y_22_101,전주 호텔 써밋스테이,창의적이고획기적인소설,실내에 담배냄새가 나지 않고 화장실도 물때하나 없고 침구류도 깨끗하니 사장님께서 보이지 않는 곳도 신경 쓴다는게 느껴졌습니다. 다음에 또 오게 된다면 진짜 이곳으로 또 올겁니다. 로비부터 엘리베이터 방까지 모든곳이 청결에 신경쓴게 너무 좋았습니다.,5,2개월 전
y_22_102,전주 호텔 써밋스테이,따오기마음,직장일이 전주가 있어서 숙소를 이주일에 한번씩 전주로 정해야하는 상황인데 이곳이 맘에 들어서 자주 방문합니다 조식으로 라면이 있어서 오전 식사는 걱정 안해도 됩니다 저녁을 배달로 먹었는데 사장님께서 친절하게 식당을 소개시켜줘서 식사 걱정은 없었네요 스타일러가 있어서 요즘같은 두꺼룬옷도 냄새 제거 가능해서 편합니다 아침에 나가는길에 사장님이 라면과 과일과 삶은계란 추천해서 조식 해겷했습니다 음료수는 객실 들어가기전에 두개 챙겨 가심 됩니다 편한 시간 보내고 갑니다 .,5,6개월 전
y_22_103,전주 호텔 써밋스테이,딸기우체부,가격도 저렴하고 깔끔해서 좋아요 확실히 타지 여행갔다가 전주와서 노는데 전주모텔 시설이 확실히 좋네요 티비도 커요 가격도 저렴하고 깔끔해서 좋아요 확실히 타지 여행갔다가 전주와서 노는데 전주모텔 시설이 확실히 좋네요 티비도 커요 가격도 저렴하고 깔끔해서 좋아요 확실히 타지 여행갔다가 전주와서 노는데 전주모텔 시설이 확실히 좋네요 티비도 커요 가격도 저렴하고 깔끔해서 좋아요 확실히 타지 여행갔다가 전주와서 노는데 전주모텔 시설이 확실히 좋네요 티비도 커요 가격도 저렴하고 깔끔해서 좋아요 확실히 타지 여행갔다가 전주와서 노는데 전주모텔 시설이 확실히 좋네요 티비도 커요,4,8개월 전
y_22_104,전주 호텔 써밋스테이,밥열공기,시설도 깨끗하고 너무 좋아요!!,4,29일 전
y_22_105,전주 호텔 써밋스테이,찌니다룰루,"재방문의사 100% 1.깔끔하고 청결함 2.조식제공 및 라면!! 3.욕조 왕 넓음 4.엘베빠름 5.주차편함 6.객실이 솔직히 다 거기서 거긴데 사진보다 넓고 공청,스타일러도 있고 침구 깨끗함 7.수건도 여유롭고 필요하면 더 주심 8.친절하심 9.퇴실시간 굿! 서울에서 간건데 보통11시 퇴실인데 12시퇴실이 굿굿굿굿 13.고데기있음 14.전기장판 굿..침대마다 별도로 있음 15.음료꽁짜 (밖에서 자판기로 알아서 가져가는) 단점 1.빗이없었음 울 객실만 없던거같음ㅠㅠ 2.린스바꿔주세요ㅜㅜ 오히려 더 쓰게되는 ㅜㅜ +롤빗이 있으면 좋을거 같아요 어쨌든 전주 놀러오면 숙소는 또 여기로 잡고싶네요 ㅎㅎㅎ👍🏻👍🏻👍🏻",5,5개월 전
y_22_106,전주 호텔 써밋스테이,비비안나별,전주성으로 축구보러 갔다가 너무 깨끗하고 좋은 곳에서 푹 꿀잠자고 왔어요~ 다음에 또 전주에서 숙박하게 되면 이용할겁니당~ㅋㅋ 추천 꾸욱~👍,5,1년 전
y_22_107,전주 호텔 써밋스테이,엄지곤쥬,놀러와서 오게됐는데 오픈한지도얼마안되고 여기 진짜 깨끗하네요~~ㅎㅎ 오래된곳은 노후되고 오래된물건이랑 오래된 이불베개 그대로 쓰는거같아서 찝찝하고 그런데 여긴 관리가 잘되어잇는지 이불베개 깨끗하고 화장실이랑 내부안에 전체가 먼지도없이 청결했어요!!. 금연방이래서 냄새도 안낫고 요즘 날이 급격하게 추워진 탓에 감기걸릴까봐 불안했는데 보일러도 빵빵하게 틀어주셨는지 아주 덥게 잤어요 ㅋㅋㅋ 사장님이 안추웠냐고 물으시는데 그렇게 걱정해주시고 무진장 친절하세요~~ 또 오고싶은곳!,5,7개월 전
y_22_108,전주 호텔 써밋스테이,Alexhoya,청결 상태랑 2인 욕조는 아주 만족했지만 객실 거울 내 거울이 없어서 아쉬웠어요.,4,5개월 전
y_22_109,전주 호텔 써밋스테이,시간과세월,"깨끗한 모텔 근데 방음이,,,",4,1개월 전
y_22_110,전주 호텔 써밋스테이,준구동머,사장님이 친절하시고 객실관리도 좋습니다^^,4,2개월 전
y_22_111,전주 호텔 써밋스테이,벚수니,욕조도 크고 욕실도 넓어요.조식도 간단하게 준비되어 있고 무엇보다 친절합니다.^^,5,2개월 전
y_22_112,전주 호텔 써밋스테이,타사다르,완전 깔끔 하고 깨끗한 객실과 완전 넓은 주차장에 주차할수 있어요 아주 널널합니다. 로비가 크진않지만 커피 및 한강 라면 토스트 잼 얼음 스프 등 조식으로 먹을거리가 준비되어있어서 최고입니다 수압 좋고 따뜻한물 엄청 잘나오고 방도 넓습니다 완전 깔끔 하고 깨끗한 객실과 완전 넓은 주차장에 주차할수 있어요 아주 널널합니다. 로비가 크진않지만 커피 및 한강 라면 토스트 잼 얼음 스프 등 조식으로 먹을거리가 준비되어있어서 최고입니다 수압 좋고 따뜻한물 엄청 잘나오고 방도 넓습니다,5,4개월 전
y_22_113,전주 호텔 써밋스테이,오그랑한개미,"호텔 대실을 이용했는데 정말 만족스러웠습니다. 객실이 넓고 청결하게 관리되어 있어 쾌적한 분위기에서 편안하게 쉴 수 있었습니다. 침대도 푹신하고 아늑해서 잠깐의 휴식에도 피로가 확 풀리는 느낌이었습니다. 프런트 직원분들도 친절하게 응대해 주셔서 이용하는 내내 기분이 좋았고, 체크인·아웃 과정도 빠르고 간편했습니다. 방음도 잘 되어 있어 조용하게 시간을 보낼 수 있었고, 전체적으로 시설이 깔끔하고 관리가 잘 되어 있었습니다. 다음에도 또 이용하고 싶은 좋은 호텔이었습니다!",5,4개월 전
y_22_114,전주 호텔 써밋스테이,마음만20대,객실이전체적으로 깔금하고침구류정돈이잘돼있습니다 주변에 먹을거리도많고 마실것도많이 있어서 좋았습니다 사장님이 친절하시고 부담없고 좋았습니다 객실이전체적으로 깔금하고침구류정돈이잘돼있습니다 주변에 먹을거리도많고 마실것도많이 있어서 좋았습니다 사장님이 친절하시고 부담없고 좋았습니다 객실이전체적으로 깔금하고침구류정돈이잘돼있습니다 주변에 먹을거리도많고 마실것도많이 있어서 좋았습니다 사장님이 친절하시고 부담없고 좋았습니다ㅎㅎ,5,5개월 전
y_22_115,전주 호텔 써밋스테이,토박한예비역,출장가다 들렸는데 가성비가 짱,5,1일 전
y_22_116,전주 호텔 써밋스테이,딸기케크,저번이용때 너무 좋아서 다시 이용했습니다 물이나 수건 더 필요하면 프론트에서 받아가면 되고 자판기에 1인 1음료수 늦게가면 품절된 음료수가 많으니 체크인 전에 들고 가시는거 추천해요! 두번째이용때는 방충망에 담뱃재가 보였어요 누가몰래 피고 뒷정리 안하고간듯..ㅠㅠ 저번이용때 너무 좋아서 다시 이용했습니다 물이나 수건 더 필요하면 프론트에서 받아가면 되고 자판기에 1인 1음료수 늦게가면 품절된 음료수가 많으니 체크인 전에 들고 가시는거 추천해요! 두번째이용때는 방충망에 담뱃재가 보였어요 누가몰래 피고 뒷정리 안하고간듯..ㅠㅠ,5,6개월 전
y_22_117,전주 호텔 써밋스테이,네오텍코리아,출장중 자주 이용합니다 룸 컨디션 좋아요. 침대에 열 장판만 없으면 좋을텐데 잠 잘때 포근한 느낌이 없어요.,3,11개월 전
y_22_118,전주 호텔 써밋스테이,준구동머,깨끗해서 좋습니다^^,5,1개월 전
y_22_119,전주 호텔 써밋스테이,7245482,출장중에 자주방문했던곳 입니다 숙소분위기 늘 갈때마다 깨끗한 침구에 욕실은 깨끗하게 청소되어있으며 필요한 모든게 다 갖추어져있어서 좋아요 출장중일때 겨울이라 냄새가 걱정되었는데 스타일러가 있어서 다음날에 옷 편하게 입고 출근 가능합니다 야식으로 라면이랑 음료수 챙겨서 먹음 최고예요 아침 조식으로 토스트와 삶은계란과 커피 간편한 조식으로 시작합니다 라면도 조식으로 딱입니다 클 깨끗한 침구 매번 갈때마다 깨끗하게 청소되어있는 객실 객실에 보일러빵빵해요 전기요있어요,5,4개월 전
y_22_120,전주 호텔 써밋스테이,KJY0311,"전주 호텔 써밋스테이에 숙박하면서 매우 만족스러운 경험을 했습니다. 호텔은 전주의 주요 관광지와 가까워 이동이 편리했고, 주변에 맛집과 편의시설도 많아 여행하기에 최적의 위치였습니다. 객실은 깔끔하고 모던한 분위기로 꾸며져 있어 쾌적하게 머물 수 있었고, 침대도 편안해 숙면을 취할 수 있었습니다. 특히, 직원들의 서비스가 인상적이었습니다. 체크인부터 체크아웃까지 친절하고 세심하게 응대해 주셔서 편안한 기분이 들었고, 요청사항도 신속하게 처리해 주셨습니다. 조식은 간단하지만 맛있었고, 로비와 공용공간도 정돈이 잘 되어 있어 전반적으로 만족도가 높았습니다. 가격 대비 훌륭한 숙박 경험을 제공하는 곳이라 전주 여행을 계획하시는 분들께 추천드립니다. 다음에도 전주를 방문할 기회가 생긴다면 다시 이용하고 싶습니다.",5,4개월 전
y_22_121,전주 호텔 써밋스테이,bedonangel,침대가 너무 편해요~~~~~!!!!! 완전 푹신하고 편해요~~~~~!!!!! 방도 너무 따뜻해요~~~~~!!!!! 샤워실도 너무 따뜻 해서 씻는데 춥지도 않고 너무 좋아요~~~~~!!!!! 주차장도 적당히 넓어서 주차하기도 불편하지 않아요~~~~~!!!!! 방마다 1인1개씩 음료도 주시니까 자판기에서 눌러먹기 편하게 되어있어요~~~~~!!!!! 너무편하고 좋아요~~~~~!!!!! 티비도 넓고 크고 스타일러도 있어서 비지니스 차때 가는것도 좋아요~~~~~!!!!!,5,7개월 전
y_22_122,전주 호텔 써밋스테이,준구동머,깨끗해서 좋습니다^^,4,2개월 전
y_22_123,전주 호텔 써밋스테이,용맹하고독특한김밥,너무 깨끗하고 맛있는 라면과 커피도 준비가 되어 있어요,5,2개월 전
y_22_124,전주 호텔 써밋스테이,소소하고바람직한은하수,따뜻이잘잤습니다 조용하고 좋네요,4,6개월 전
y_22_125,전주 호텔 써밋스테이,공감하고밝은엄지,전북 출장시에는 무조건 여기 입니다,5,22일 전
y_22_126,전주 호텔 써밋스테이,천사입니다,잘쉬다갑니다. 다음에 또 올게요.,5,29일 전
y_22_127,전주 호텔 써밋스테이,판이한오웬,제가 전주를 자주가는데 이날은 아아중리에서 모임이있어서 한잔먹고 숙박을찾다가 우연하게 지나가다가 예약한 호텔이였습니다 요세 호텔은 이름만호텔이고 안에는 대부분 노후화되있어서 불편하고 물도잘안나오는곳도 많은데 여기는 호텔이름답게 외관이며 방이며 너무깔끔하고 좋았습니다다 물도일단적으로잘나오고방에 스타일러도있어서 다음날온도 프레쉬하게 입고나올수있어서 너무 만족스러웠습니다 다음에도 꼭한번 다시 예약하고 하룻밤지내고십네요 너무만족하고갑니딘,5,7개월 전
y_22_128,전주 호텔 써밋스테이,JP바스,깔끔하게 아늑하니 잘 정돈된 방에서 푸욱 잘자고 갑니다~^^감사 합니다,4,3개월 전
y_22_129,전주 호텔 써밋스테이,따오기마음,주차장 넓어요 주차장 입구에 음료수 있습니다 1인 1캔 가능합니다 카운터에 얼음과 커피 있으며 라면조리기 있어서 야식으로 가능합니다 단무지와 계란도 있는데 정말 맛있게 잘 먹었습니다 출장길에 여러번 방문하지만 매번 깨끗합니다 아침 일찍 나오느라 객실에서 라면이랑 토스트 가져가서 편하게 먹을수 있게 테이블이 객실에 있어서 편리합니다 출장길 옷이 냄새 날까 걱정했지만 스타일러덕에 깔끔한 옷차림으로 출근합니다 퇴실할때보니 삶은계란과 바나나가 추가로 준비되어있으니 참고하세요,5,8개월 전
y_22_130,전주 호텔 써밋스테이,지금이좋다니까,"저렴한 가격에 잘 이용했습니다 처음도착 했을때에는 살짝 추웠는데 시간지나고 나니 따뜻해졌어요 청결상태도 좋고 ,전반적으로 좋았습니다 다음에 또 이용할게요",4,3개월 전
y_22_131,전주 호텔 써밋스테이,스머프패밀리,"깨끗하고 친절하고 따뜻했어요. 다만, 다른 손님들이 욕조 물을 그냥 빼기만 하니 벽면에 때가 남아있어요. 물받아놓고 탕에 들어가자마자 물 표면에 꽤 많이 흰때들이 꽤많이 떠있네요.. 청소때 솔이나 수건으로 벽면을 문질러서 샤워기로 물뿌려야 될것같아요 그래도 암막커튼에, 조용해서 10시간으니 푹 잤습니다! 다음에도 이곳 올 일 있다면 여기 묵을생각입니다^^",4,6개월 전
y_22_132,전주 호텔 써밋스테이,황금색아매바,깔끔하고 1층에 라면도 무료로 끓여먹을 수 있어서 좋았습니다. 근데 화장실 청소만 조금 더 신경써 주시면 좋을 거 같아요. 이 전에 사용한 사람이 양치를 어떻게 했는지 모르겠지만 치약이 샤워실 벽에 껌딱지처럼 붙어있었습니다.,4,12개월 전
y_22_133,전주 호텔 써밋스테이,진솔되고맑은코커스패니얼,전주에 놀러갔다가 잡은 숙소인데 정말 최고로 만족스럽습니다 항상 숙소는 청결이 너무 중요해서 그것만 보는데 여기는 청결상태가 다녀본곳 중에서 제일 좋았네요 화장실 청결이 너므 중요한데 화장실이 너무 깨끗해요 사장님이 직접 청소를 하시는거같아요 이렇게 깨끗할수가없네요 숙소 청결 상태는 물론입니다 방도 엄청 넓고 전주 갈때마다 이용하고싶어요 여러곳을 다녀봤지만 여기만큼 청결이 좋은곳은 없어요 사장님이 원래 청결을 중요하게 생각하시는거같아요 주차장도 마저도 깨끗..,5,3개월 전
y_22_134,전주 호텔 써밋스테이,roamer2615,잘 쉬고 갑니다~~~~,4,2개월 전
y_22_135,전주 호텔 써밋스테이,여행을떠나잉,굿 전주에서 젤 가성비 갑인듯,5,12일 전
y_22_136,전주 호텔 써밋스테이,숙박아니면쪽박,위치 괜찮고 주차장이 넓어서 좋습니다 주차장 무료 음료 자판기에 감동이었네요,5,2개월 전
y_22_137,전주 호텔 써밋스테이,주도적이고우호적인콩우유,사장님도 친절하시고 룸도 편안하고 집처럼 편안했어요. 조식도 제공해주셔서 좋았습니다! 만족했어요 ~,5,4개월 전
y_22_138,전주 호텔 써밋스테이,우스꽝스러운역술가,친절하시고 숙소도 청결해요 ~~! 늦은 시간 대실도 가능해서 좋았습니다,4,4개월 전
y_22_139,전주 호텔 써밋스테이,준준준준준준준준중,너무 좋아요 ! 담배냄새 안나고 ! 청결하며 사장님 또한 좋으신분 같아요 ! 다음에 또 이용하겠습니다 !! 너무 좋아요 ! 담배냄새 안나고 ! 청결하며 사장님 또한 좋으신분 같아요 ! 다음에 또 이용하겠습니다 !! 너무 좋아요 ! 담배냄새 안나고 ! 청결하며 사장님 또한 좋으신분 같아요 ! 다음에 또 이용하겠습니다 !! 너무 좋아요 ! 담배냄새 안나고 ! 청결하며 사장님 또한 좋으신분 같아요 ! 다음에 또 이용하겠습니다 !! 너무 좋아요 ! 담배냄새 안나고 ! 청결하며 사장님 또한 좋으신분 같아요 ! 다음에 또 이용하겠습니다 !!,5,8개월 전
y_22_140,전주 호텔 써밋스테이,준구동머,깨끗해서 좋습니다^^,5,2개월 전
y_22_141,전주 호텔 써밋스테이,라바라바라바라라,티비 크고 수압최고~~,5,19일 전
y_22_142,전주 호텔 써밋스테이,xxllq19,주말 예약이었는데도 비싸지 않고 가성비 좋았습니다. 아침으로 먹을 수 있는 음식들이 1층 데스크에 많이 구비되어있어서 좋았어요. 방도 깨끗하고 냄새도 안 나고 머리카락 없고 좋았어요. 화장실이 엄청 넓고 깨끗해서 쾌적함이 좋았습니다.,5,9개월 전
y_22_143,전주 호텔 써밋스테이,준구동머,항상 청결해서 좋습니다^^,5,2개월 전
y_22_144,전주 호텔 써밋스테이,유미통상,직원분 친절하고 조용해서 출장때 자주 이용할께요,4,8개월 전
y_22_145,전주 호텔 써밋스테이,침착하고우호적인시멘트,잘쉬다갑니다 ~~~~,4,3개월 전
y_22_146,전주 호텔 써밋스테이,다정하고맑은뿌리,정말 깨끗한 시설입니다 담에 또방문예정,4,3개월 전
y_22_147,전주 호텔 써밋스테이,고슴미,청결도는 기본. 업체에서 게시된 사진과 큰 차이 없음. 청정기와 스타일러 상태도 관리가 잘 된게 보임. 창문 열면 탁 트인 도로뷰. 밤에 소음 1도 없음. 화재대비를 위한 완강기 또한 관리가 잘 되어있음. 사장님의 사랑과 보살핌이 가득한게 티가남. 주차장 널찍. 흡연실 조차도 깨끗. 별10000개 주고 싶은 숙소♡,5,8개월 전
y_22_148,전주 호텔 써밋스테이,마흔둘자갈,시설도 깨끗하고 좋았습니다. 추천!!,4,1개월 전
y_22_149,전주 호텔 써밋스테이,우주025,인테리어랑 내부도 깨끗해서 엄청 좋았습니다! 전주 여행 와서 편하게 잘 있다 갑니다! 다음 여행때도 방문 하겠습니다!,4,2개월 전
y_22_150,전주 호텔 써밋스테이,태쁘2,방음 잘되구 주차장 넓어서 좋아요,5,3개월 전
y_22_151,전주 호텔 써밋스테이,체릐,사장님 너무 친절하셔서 또 방문 하고 싶은 숙소에용!ㅎㅎ,5,5개월 전
y_22_152,전주 호텔 써밋스테이,감동적이고소박한티파니,깔끔한 객실. 여유로운 주차장. 맛있는 조식. 어른뿐 아니라 아이들까지 좋아하는 숙소예요. 따뜻하게 잘 쉬다가요.,5,3개월 전
y_22_153,전주 호텔 써밋스테이,bedonangel,눈이 많이 와서 걱정 했는데 주차장 지붕이 있어서 좋았어요!!^^ 자판기가 고장나서 걱정됐어요~~~~~!!!!! 방이 넓어요~~~~~!!! 시설이 깨끗하고~~~~~!! 침대 푹신해요~~~~~!!! 배달도 근쳐에 많아서 음식 시켜 먹기 좋고 조식 라면과 빵 커피가 있어서 아침에 먹기 좋아요~~~~~!! 주차장이 넓어요~~~~~!!!! 티비가 커서 영화 보기 좋아요~~~~ ~ > I ! 사장님이 친절해요~~~~~!!! 변기에 라이트가 들어와서 밤에 앉기 편해요~~~~~!!!! 따뜻한 물도 잘나오고 샤워기도 깨끗하고 청결해요~~~~~!!!!,5,5개월 전
y_22_154,전주 호텔 써밋스테이,독특하고완고한해적단,깨끗하고 친절하고 잘 쉬었어요.,4,7개월 전
y_22_155,전주 호텔 써밋스테이,욜로록,"매주 평일 여기어때로 회사 출장 때마다 이용하고 있는데 여기는 정말 좋네요 깔끔하고 출장이 이 지역으로 잡힐 때마다 이용하고 싶네요 회사 출장지가 보통 강원도, 충청도, 경상도 등 전국을 돌아다닐 정도로 자주 이동하는데 가봤던 곳 중에서 손에 꼽을 만큼 정말 깔끔하고 또 이용하고 싶네요 주차장도 꽤나 넓어서 만차 걱정없이 좋았습니다😆👍 출장으로 평일에 가다보니 저렴한 가격에 이렇게 좋은 숙소 이용했는데 주말도 가격이 비싸지 않아 재방문 의사 200% 있습니다. !!!! 번창하세요",5,7개월 전
y_22_156,전주 호텔 써밋스테이,듬성듬성한살구나무,숙소도 생각보다 크고 깔끔했어요 다만 날이 풀려서 그런건지 뭔지 온도조절이 일정온도이상으론 안되더라고요 또 콘센트 꼽을데가 조금 부족해요 다만 가격도 저렴한데 크고 깔끔하고 친절하셔서 만족했어요 조식도 다른곳에 비해 다양하고 준비도 너무 잘해주셔서 만족했어요,5,4개월 전
y_22_157,전주 호텔 써밋스테이,네오텍코리아,화장실이 깨끗해서 좋았습니다,4,11개월 전
y_22_158,전주 호텔 써밋스테이,소주싫어,모든게 굿입니다 넘 좋아요,5,2개월 전
y_22_159,전주 호텔 써밋스테이,네오텍코리아,룸 컨디션 매우 만족합니다. 출장중 자주 이용하는데 불편함 없이 잘 지내고 옵니다. 아침에 한강라면도 잘 먹고 왔구요 수고 하세요,5,9개월 전
y_22_160,전주 호텔 써밋스테이,GC1456110503,호텔건물도 깔끔하고 객실도 관리가 잘되어있고 사장님이 아주친절하게 아침조식 사용바법도 설명해 주셔서 아주 기분좋은 여행이 되었습니다. 감사합니다!,5,5개월 전
y_22_161,전주 호텔 써밋스테이,aesrla,친절하시고 깔끔하고 좋았습니다,5,2개월 전
y_22_162,전주 호텔 써밋스테이,네오텍코리아,스타일러 굿입니다. 화질 좋은 TV도 굿,3,11개월 전
y_22_163,전주 호텔 써밋스테이,쏘시울,전체적으로 좋았음 주차공간도 넓어서좋았음,4,10개월 전
y_22_164,전주 호텔 써밋스테이,따오기마음,출장길 부부가 같은일을해서 전주에 일이 있다보니 자주 방문합니다 입구에 음료수 있어서 일하느라 힘들었는데 시원한 음료와 아이스커피 한잔으로 피로를 풉니다 스타일러가 있어서 돌아가니면서 찝찝한 옷들 세탁합니다 티비는 넷플리스 디즈니 가능하니 영화보면서 피로를 풉니다 등치가 큰 저희부부 두링 자기에도 넉넉한 침대 늘 깨끗한 침구류 그리고 다음날 입을옷들을 드라이해서 출장 길에 다시 가면 왠지 편하게 잘 쉬다 가는 기분 좋아요 냉장고엔 물이 있으니 편한 하루를 잘 보내니다.,5,10개월 전
y_22_165,전주 호텔 써밋스테이,따오기마음,출장길에 신랑이랑 자주 방문했던곳입니다 이번엔 휴가 마지막 길에 집에 가기전에 들렸는데 늘 한결같이 깨끗한 방에 푹신한 침대 편합니다 탁자가 있으니 아침 조식으로 한강라면이랑 토스트에 커피를 먹으니 아주 좋아요 아이스커피 맛있어요. 카운터에 커피랑 아이스티랑 얼음이 있으니 시원하게 한잔 하면 좋아요 들어오는 입구에 음료수 자판기가 있으니 이 더위 시원한 음료 드세요 스타일러로 여름 땀나는 옷 깔끔하게 드라이해서 편하게 출장길 갑니다. 식사도 가능하고 숙소는 넓으니 편합니다,5,10개월 전
y_22_166,전주 호텔 써밋스테이,용맹하고독특한김밥,너무 깨끗합니다 리면도 있고 시설이 너무 좋아요,5,3개월 전
y_22_167,전주 호텔 써밋스테이,시민의숲가락지빵,숙소 진짜 좋구요 사장님도 너무 친절하십니다 담에 친구랑 온다면 열루 올것 같아요 최고최고 아침조식은 먹지 못했지만ㅋㅋㅋ 라면이랑 빵 있어요 그리고 커피 있습니다 일반방 컴은 보통이에요 만약 겜하실거면 고사양으로 가셔야할것같아요 담에는 고사양방으로 잡으려고요 친절하고 깨끗해요 물도 모자라서 갔는데 친절하게주시고 좋았어요^^^^^담에 또 올거에용 사장님이 제가 귀찮게 해드렸는데 응대도 친절하고 방도 좋아요 퇴실도 늦고 입실은 빠르고 방은 좋아요 호캉스 저리가라 ^^ 굿,5,9개월 전
y_22_168,전주 호텔 써밋스테이,퍼퓨미,자주이용하는 호텔 매우 만족하고있어요,5,2개월 전
y_22_169,전주 호텔 써밋스테이,압제적인창,항상 여기만 다녀요!~^^ 음료도 공자로 뽑을수 있공!~^^ 아라보다때부터 다녔는데!~^^ 써밋스테이로 바뀌엇더라구여!~^^ 암튼 그래도 여기가 넓고 쾌적래요,3,15일 전
