id,name,nickname,review_content,rating,write_date
y_31_152,전주 화이트호텔,독특하고희망찬가죽색,호텔 외관이 뭔가 이쁘게 생겨서 엄청 신기해요!! 터미널하고도 가까워서 접근성도 엄청 좋은 편이구요! 호텔 로비 들어가면 깔끔한 외관이 먼저 반겨줘요 사실 관광호텔이라는 어감이 제가 느끼기에 뭔가 좋은 편은 아니라 큰 기대는 안했는데 생각보다 너무 좋았어요! 그리구 아무 생각 없이 체크인하는데 방을 업그레이드 해주셔서 정말 좋았어요 그렇다고 모든 분을 해드리는건 아닐테니 이건 기대를 하지는 않는게 좋을 것 같아요 그리구 객실 처음 들어왔는데 향이 너무 좋아서 첫인상이 좋았어요 그리구 생각보다 객실이 넓어서 너무 좋았어요,5,7개월 전
y_31_153,전주 화이트호텔,빛나고배려있는요거트,주변에 모텔촌이랑 떨어져있어서 새벽에 조용하나도 시끄럽지않고 조용해서 좋았습니다!!!!! 방도 조식포함되있는거 생각하면 굉장히 싼편이고 조식도 맛있는편입니다!!!! 주변환경도 전주역 주변이나 한옥마을 주변보다 조용해서 지내기좋았어요 또 1층에 물이나 커피도 마음대로 뽑아갈수 있어서 편리합니다!!!! 또 방에 테이블들도 굉장히 큰편이라 배달음식이나 사온 음식 먹을때도 편해요!!!!! 그 외엔 따뜻한물 잘 나오고 수압도 괜찮았어요!!!!! 전주에 요새 올일 많은데 자주 방문할거같습니다!!!!,5,11개월 전
y_31_154,전주 화이트호텔,봄봄이79,명절 가족들과 보내고 편히 쉬려고 방을 잡았어요 조용하니 잘 쉬다 왔습니다 대로변이고 주차장 자리도 있구요 조식 1인도 있었으나 두명이라 비용 더주고 조식 2인 포함으로 결정했는데 첨에 명절이라 안 된다고 해서 당황했는데 조식 식권 주셔서 잘 먹었습니다. 떡라면과 프렌치토스트가 있었는데 저흰 토스트~ 숙소는 담에 또 이용해도 좋을거 같아요~,5,5개월 전
y_31_155,전주 화이트호텔,다정하고풋풋한나비,제가 가본 숙소중에 제일 깔끔하고 좋았습니다. 외관부터 이뻐서 맘에 쏙 들었습니다. 들어가니 사장님도 친절하여서 좋았습니다 방에 들어가보니 침대도 깔끔하게 정리가 잘 되어있었고 베개나 이불에서 냄새가 나지않았습니다. 화장실도 깔끔하게 정리가 되어있어 좋았습니다. 제가 또 그 지역을가게된다면 이 곳을 다시 방문할 의사가 있습니다!! 항상 숙소를 가게된다면 다 좋지만은 한두가지씩 아쉬운 점이 다 있었지만 여기는 아쉬점없이 편하게 잘 쉬다와 만족스럽게 숙소를 정한 것같습니다,5,9개월 전
y_31_156,전주 화이트호텔,야노른자,"온수매트 따뜻하구 좋아용 객실에 담배냄새 1도 안나는 모텔 처음임...진짜 감탄사 절로 나왔구용 아침부터 이용할수있는 스낵바(토스트, 라면, 씨리얼)가 있더라구용 전 이용못했지만 씨리얼먹고싶었음ㅠㅠ 온수매트라 진짜 따뜻하게 잘잤고, 뜨거운물도 엄청 잘나와용! 객실 참 넓고 깨끗하고 진짜 너무잘쉬다가 갑니닷!!건물까지 가는 골목이 매우 비좁은것빼고는 다좋았음!주차장 쬐꼼 아주 조금 좁은것빼고도 전반적으로 진짜 좋은 숙소입니닷! 담에 전주오면 또올것같음!",5,6개월 전
y_31_157,전주 화이트호텔,남다르고알록달록한혹성,매번 갈때마다 친절히 응대해주시고 가격이나 서비스면에서 만족하는 호텔입니다. 최신식은 아니지만 이 가격에 이런 룸과 서비스 찾기 힘든것 같습니다. 이번에는 방도 업그레이드해주셔서 더욱 편안히 이용하였습니다. 다른 모텔에서 넷플릭스 안나온다고 하였더니 해결해주지 않고 죄송하다는 말 또는 방도 옮겨주지 않고 그냥 넘기던데. 화이트모텔은 넷플릭스 안나오면 직접 오셔서 확인해주시고 매번 해결해주시고 감사해요. ^^ 다음에도 또 이용할 예정입니다.~~~~~,5,10개월 전
y_31_158,전주 화이트호텔,카구카구,카운터에 계시는 선생님께서 너무 친절하게 맞이해주셔서 좋았습니다 객실은 다른 곳과 다르게 너무 청결하여 감사합니다,5,2개월 전
y_31_159,전주 화이트호텔,흔쾌한연애,"301 처음 배정받은 방에서 이상소지가 있어 연락드렸고, 선 교체 후 확인 해주셨습니다. 새로 받은 방은 컨디션이 매우 좋았습니다. 근처에 편의점이 가까워 가볍게 장을 봐서 복귀했고, 음식또한 배민권이라 편리하게 주문했습니다. 비가오는데도 불구하고 주차장은 만석이였고, 역시나 좋은 컨디션의 방과 친절한 사장님은 여러사람이 느끼도 있구나 라고 생각하게 되었습니다. 항상 친절하신 사장님 덕분에 자주 이용하고 있습니다.",5,1년 전
y_31_160,전주 화이트호텔,이벨리나,객실 넓고 깨끗해요~ 자주 오는 편인데 최근에 수건이랑 샤워기도 바뀌었더라구요. 청결하고 뽀송하니 햇볕에 말린거 같은 기분 좋은 향이 납니다. 넷플릭스로 흑백요리사 정주행하고 아침 조식도 맛있게 잘먹었어요. 이 근방에서 여기보다 가성비 좋은 숙소는 여태 못본거 같아요!,5,8개월 전
y_31_161,전주 화이트호텔,하위태오아리,"전주화이트호텔 두번째 이용해요 ㅎㅎ 다시 숙박을 하게 된 이유는 밝은 분위기, 편리함과 기분 좋은 조식이에요. 차량으로 접근이 쉽고, 주차하기 좋아요. 프론트 친절하고요. 프론트의 분위기가 밝아서 특히 여행자로서 좋은 장소 같아요. 아침 조식 주셔서 참 좋아요. 조식카페에서 별도 주문하는 커피가 특히 맛있어서 꼭 드셔보시길 추천해요. 객실에 TV가 무척 커서 유투브 보기도 좋답니다. 그리고 아무것도 없이가도 필요한 모든 것들이 다 준비되어있어서 진짜 좋았어요. 다음 전주 여행 때 또 돌아올게여",5,8개월 전
y_31_162,전주 화이트호텔,소스하라으트,두번째 후기입니다. 방 컨디션은 처음과 비슷하게 깔끔했고요. 생수는 부족하면 1층 로비에서 가져다 먹을 수 있어 좋았어요. 방과 화장실이 넓어요. 침대도 기본 킹 베드여서 둘이서도 편하게 잘 수 있어요. 이 날은 조식을 먹었어요. 토스트와 떡라면 중에 선택할 수 있는데 저는 토스트를 골랐습니다. 생각보다 맛있었어요. 슬라이스 파프리카와 양배추 샐러드가 새콤한 드레싱으로 버무려져서 잘 어울렸어요. 시나몬 향이 느껴지는 달콤하고 부드러운 토스트도 좋았습니다. 우유와 오렌지 쥬스도 준비되어 있었어요. 잘 묵었습니다.,5,11개월 전
y_31_163,전주 화이트호텔,vjh1104v,저두 리뷰라는걸 적어보네요 우선 편안히 잘쉬다갑니다ㅎ 다만 청결문제는 어쩔수없나봐요~ 이건 복불복?ㅜ 포인트만 남깁니다ㅎ 신축아닌 노후화는 어쩔수ㅜ 관리는 잘된? 입실시 포근함ㅇ 창과 바깥뷰ㅇ 침대가 따뜻X 화장실 물기ㅇ ㅜㅜ 수건 ㅁ(초성) ㅜㅜ 여기까지만~ 솔직히 침실은 기대안합니다-복불복 화장실만 깨끗해도 운이좋다?ㅎ 사진을 못찍어서 200자를 못남기는 아쉬움이 ㅜㅜㅎㅎ 그래도 쓰다보니 200자는 써지네요ㅎ 편히 쉬다가는게 좋은거니까요ㅎ 또 올게요~,4,4개월 전
y_31_164,전주 화이트호텔,흔쾌한연애,"화이트 관관호텔은 전주 종합경기장과 고속/시외 버스 터미널 사이에 위치하고있습니다. 근처에 대학로도있어서 각종 배달에 편리하며, 호텔에서 3분거리내에 편의점도 있습니다. 호텔 1층 음식점에서 간단한 배달도 가능합니다. 도로 옆에 있어서 출입이 편리하며, 타지에서 고속/시외 버스를 타고오셔도 굳이 택시를 안타도 될만큼 가깝습니다.(기본요금) 과거에 아침 조식 서비스가 있었으나 현재는 없어졌으니 참고하시길 바랍니다. 마지막으로 사장님들이 친절하십니다.",5,1년 전
y_31_165,전주 화이트호텔,나무엔터프라이즈,"1년에 1번은 꼭 가는 숙소입니다. 가성비 좋은 모텔이에요 추천합니다! 특히 카페테리아에서 조식은 지금껏 방문한 숙소중에서 가장 만족도가 높은 곳입니다! 당연히 재방문 의사 있어요! 다만, 변기가 너무 작아요! 아마 비데때문에 그런거같은데 그냥 없애고 일반변기커버를 배치하시는게 어떨지 조심스레 건의해봅니다. 그리고 저희 방만 그런것같던데 에어컨 바람이 원활히 안 나오는것 같았습니다. 여름이 거의 지난 시점이라 크게 불편하진 않았지만 점검해보시면 좋을것 같습니다! 번창하세요!",5,9개월 전
y_31_166,전주 화이트호텔,찰*****,노후된 느낌이있고 청소 상태는 별로 입니다... 머리카락이 수건이나 침구류에서 계속 나오고 문뒤에도 쓰던 머리끈이.... 방도 춥고 전기장판도 없었어요 그냥 저렴한 가격에 딱 그정도인거같아요 급하게 일찍들어갈수 있는곳으로 예약했는데 완전 세모세모했어요.... 직원분 친절해서 좋았습니다,3,4개월 전
y_31_167,전주 화이트호텔,태양초,외관은 많이 노후되었지만 안에는 깨끗하니 좋았어요~아쉬웠던건 넷플릭스 개인계정인줄 몰랐는데 로그인하라고 떠서 당황했어요ㅠ 개인계정 사용이라고 적어놓으셔야 할거 같아요~,4,10개월 전
y_31_168,전주 화이트호텔,하늘높낮이,두번째 이용.. 이번엔 수건이 새것으로 교체되어서 너무 뽀송뽀송했어요. 퀄리티 더른곳보다 매우 훌륭해요.. 영화 보면서 하루 종일 편히 쉬었네요,4,7개월 전
y_31_169,전주 화이트호텔,닉넴므하지,위치가 진짜 좋아요!! 방도 깨끗하고 수건이나 방 냄새도 너무 좋고 깔끔해요 자주 이용할게요!!,5,5개월 전
y_31_170,전주 화이트호텔,남다르고알록달록한혹성,가격대비 매우 만족합니다. 조금 아쉬운건 수건이 세월이 느껴짐이었어요. 그렇다고 더러운건 아니었습니다. 조식도 만족스러웠습니다!,4,10개월 전
y_31_171,전주 화이트호텔,전주탐정,전주에 남친이있어서 나름 자주오는데 화이트호텔만 3번째 오는거같아요 객실 깨끗하고 넓어요 진짜 다른데는 너무 객실이 작은데 여긴 넉넉해서 답답함이 없어요 조식도 주신다는데 저희는 늦게 일어나가지구 못먹었지만 그외 티비 이용하는데도 다른데에비해 자동화되있어서 너무 편리하구요 또 화장대가 따로 있어 화장하기 좋고 고데기도 갖춰있어서 좋아요 무엇보다 사장님이 친절하십니다! 다음에 또 올께요^^,5,4개월 전
y_31_172,전주 화이트호텔,샤르망코리아,이 가격에 조식까지 가능합니다.,5,3개월 전
y_31_173,전주 화이트호텔,패턴식스,"금암동 터미널 인근에 위치한 화이트 호텔! 가성비 좋고... 사장님께서 친절하신 숙소입니다. 접근성 좋고 가성비 또한 좋은데 인근 편의점과 식당가, 시내가 인접해 있어 좋았습니당. 다음번에 기회가 된다면 재숙박 하도록 하겠습니다... 금암동 터미널 인근에 위치한 화이트 호텔! 가성비 좋고... 사장님께서 친절하신 숙소입니다. 접근성 좋고 가성비 또한 좋은데 인근 편의점과 식당가, 시내가 인접해 있어 좋았습니당. 다음번에 기회가 된다면 재숙박 하도록 하겠습니다",5,10개월 전
y_31_174,전주 화이트호텔,동글102500,요약하면 화장실 샷시 문이 닫을 때 불편했던 것 빼고는 전반적으로 초등학생 둘 동반한 4인 가족이 연휴에 이용하기에 가성비 좋았던 숙소예요~ 조식 간단히 떡라면과 토스트 좋았고 ott시청에 추가 수건과 로비에 있는 물이랑 커피 필요한 만큼 이용 가능했으며 편한 주차와 친절한 응대 감사했어요^^,3,4개월 전
y_31_175,전주 화이트호텔,피지소용돌이마녀,깔끔하고 괜찮아요 대신 티비 음량은 조절 잘되는데 넷플릭스 볼 때 음량조절은 안되는거같더라고요.. 소리를 키워도 너무 소리가 작아서 넷플릭스 보는 건 포기했어요ㅠ,4,5개월 전
y_31_176,전주 화이트호텔,엄숙한지도자,담배 냄새가 나서 불편했는데 환기를 시키니 나름 괜찮았어요!,4,10개월 전
y_31_177,전주 화이트호텔,이벨리나,객실 컨디션이 아주 좋았어요. 넓고 깨끗하고 비품상태 좋아서 기분좋게 이용하고 갑니다:),5,1년 전
y_31_178,전주 화이트호텔,바봉님,"역시나 라면 맛집 입니다,프런트 직원분 너무 친절히 맞이 해주시고 좋았어요,원두 커피도 너무 맛나게 마신듯 합니다,침구류 좋았구요,나중에 전주 가면 다시 이용 할것같아요,감사합니다,",5,1년 전
y_31_179,전주 화이트호텔,흠냐링리잉,청결 상태도 좋고 깔끔하고 내부도 좋아서 편하게 푹 쉬고 갔습니다 !!,4,4개월 전
y_31_180,전주 화이트호텔,배리멜로,가족여행숙소로 좋아요~~~,4,8개월 전
y_31_181,전주 화이트호텔,공쥬2223,조식으로 나오는 토스트랑 떡라면이 너무 맛있아요👍👍 방도 아주 깔끔합니다,5,6개월 전
y_31_182,전주 화이트호텔,영국은잉글랜드,전주 놀러가서 급하게 찾은 곳인데 주변에 먹을거리도 많고 사장님도 친절하시고 무엇보다 조식 제공에 놀랬습니다! 맛도 꿀맛👍👍 내부도 깔끔 그 자체였고 향도 좋았고 내부는 앱에 올라온 사진이랑 동일했어요!!!!! 근처 음식점들도 많았고 편의점도 가까워서 젛았습니다~! ㅎㅎ 생각보다 방이 넓어서 좋았어요! 2명에서 하룻밤 자기 딱 좋은 곳이였고 침대가 완전 푹신푹식해서 잘 잤답니다👍👍👍 에어컨도 빵빵 냉장고도 엄청 쎄고! 👍👍👍 다음에 전주 놀러가면 연박으 또 방문 하겠습니당🫡🫡,5,9개월 전
y_31_183,전주 화이트호텔,잉뿡,"청소 상태도 깔금 하고 따뜻한 물도 잘 나오고 너무 좋았어요 다만 아쉬운점은 객실 안 리모컨이 잘 눌러지지 않아 넷플릭스 시청을 못했네요 ㅎㅎ,, 잘 쉬다 갑니다",5,6개월 전
y_31_184,전주 화이트호텔,장길산2,직원분들 써비스가 좋네요 조식도 정성이 담겨있어요 영업 마지막 날 이라네요 새단장하면 재방문 하겠습니다,4,8개월 전
y_31_185,전주 화이트호텔,정읍수성동,가성비짱 많이 많이 좋아요,4,1년 전
y_31_186,전주 화이트호텔,요기보세요,프론트 직원분 너무친절하셨고 룸컨디션도 좋았아요.,5,6개월 전
y_31_187,전주 화이트호텔,다정하고남다른토스트,깔끔하고 👍 넓어요 찾기도쉽고 컴텨의자 ㅋ 깜놀했음 성능도 기가막히네요. 매트와 배개가 무척 강력한텐션을 가졌음 샤워기 사용법까지 컬러로 출사해서 붙여놓으신 섬세함에 감동적입니다 그러나 낮은수압과 파도치는 온수의 높낮이 한겨울이면 짜증날수도있겄어요 아 방충망 보수하셔야겠어용,4,11개월 전
y_31_188,전주 화이트호텔,둘치욕,외관이 노후되 보이고 에어컨에서 물이 계속 떨어져서 룸체인지 해주셨는데 원래보다 더 작은 방으로 주셨어요 수압 약해요 청소도 상태도 여기 저기 머라카락이.. 비품구성이나 이불 냉장고 시원한거는 좋았습니다,3,11개월 전
y_31_189,전주 화이트호텔,용마폭포공원혁명군,깨끗하고 시설이 좋아요.,5,6개월 전
y_31_190,전주 화이트호텔,이벨리나,"방문할 때마다 서비스나 시설이 하나씩 업그레이드 되어있는 느낌이라 좋습니다:) 청결하고 난방이 잘되서 따뜻하고 좋았는데 방이 좀 많이 건조합니다. + 샤워할때 수온이 한번씩 뜨거워질 때가 있어서 주의가 필요합니다. 12시 20분에 체크아웃 20분 초과했다고 연락이 왔고 주말에는 12시 퇴실이라고 설명해주셨는데, 예약한 어플상 13시 체크아웃으로 되어있는데 해당 내용이 최근에 변경이되었다면 어플에서도 확인할 수 있게 크게 기재해주셨으면 합니다.",5,7개월 전
y_31_191,전주 화이트호텔,원*****,우선 샤워가운이 하나만 있어서 아쉬웠구요ㅠㅠ 그래도 방 업그레이드 해주셨어요!! 온수는 미지근한 정도예요.. 침구도 나름 깨끗하고 방 자체가 넓어서 쾌적했습니다만 좀 추웠어요! 이불 꽁꽁..,4,1년 전
y_31_192,전주 화이트호텔,닉넴므하지,냄새도 좋고 시설도 진짜 좋아요!! 사장님도 친절하심 다음에 또 이용할게용^ㅇ^,5,4개월 전
y_31_193,전주 화이트호텔,하늘빗소리,"서비스 아침 조식도 너무 좋고, 직원분들도 친절하셔서 너무 기분이 좋습니다.",5,5개월 전
y_31_194,전주 화이트호텔,진지하고밝은일식,발전 하세요.....,5,2개월 전
y_31_195,전주 화이트호텔,우아한백포도주,사장님 친절하시고 깔끔해요!,5,5개월 전
y_31_196,전주 화이트호텔,주공뚝딱남,생각보다 깔금하고 일단 직원분들이 진짜 너무친절합니다 진짜로 너무 친절해서 또 가고싶어요,4,4개월 전
y_31_197,전주 화이트호텔,7400217,사장님 직원분 다 베스트 카인드! 카페 조식 정성듬뿍! 방 넓찍! 청소 깨끗! 침구 뽀송! 수압 짱! 주변 먹거리 맛집 천지삐깔! 조용해서 호캉스 힐링 짱! 507호 2박 임**입니다 감사했습니당♡♡♡,5,10개월 전
y_31_198,전주 화이트호텔,빨리아무대나,싸고 괜찮았지만 물 온도조절 힘들고 드라이기랑 고대기 걸려있는게 떨어져있네요..,4,4개월 전
y_31_199,전주 화이트호텔,비쏘팅커벨,따뜻하게잘쉬다왔어요 담에 또 이용할께요^^,4,6개월 전
y_31_200,전주 화이트호텔,스카이프,인테리어는 별루였는데 사장님이 친절하고 아침도 주는데 맛있어요,4,9개월 전
y_31_201,전주 화이트호텔,abcde0444,보일러가 빵빵해서 약간 건조하긴했는데 따뜻하게 잘 잤어요~ 감사합니다~,5,5개월 전
y_31_202,전주 화이트호텔,똘비짱댕댕이아빠,사진상 이미지로 여약하고 숙박 했는데 객실 담배 냄새도 심하고 시설도 안좋고 다시 숙박은 힘들꺼 같아요 다른곳에 비해서 가격이 저럼한 만큼 여관급이라고 생각하시고 숙박하면 문안할듯 합니다,2,2개월 전
y_31_203,전주 화이트호텔,샤르망코리아,아침식사도 먹을 수 있어서 좋습니다.,5,5개월 전
y_31_204,전주 화이트호텔,홧팅후니,전주에 가면 자주 이용하는곳 좋아요 가성비도 굿 아침 라면이 ... 라면 맛집,5,5개월 전
y_31_205,전주 화이트호텔,다정하고확실한다복,편안하고 잘쉬다갑니다,4,6개월 전
y_31_206,전주 화이트호텔,서러운괴성,좋앗습니다 조식도잇고 가격도좋고,4,3개월 전
y_31_207,전주 화이트호텔,치졸한사탕야자,타지 가기 전에 이용했었는데 체크인 시간이랑 체크 아웃 시간이 너무 맘에 들어서 좋았습니다,5,8개월 전
y_31_208,전주 화이트호텔,크고날렵한사나이,따뜻하고 쾌적해서 좋았러요,4,1년 전
y_31_209,전주 화이트호텔,덩구리이,급하게 잡았는데 만족했습니다 ott 안돼서 사장님께 말씀 드렸는데 친절하게 다 알려주셨습니다 사장님 친절하고 좋아요,5,6개월 전
y_31_210,전주 화이트호텔,w모드리치,편하고 좋았습니다 깨끗하고 사장님도 친절하셔서 다음에도 또 방문할거같습니다,5,1년 전
y_31_211,전주 화이트호텔,더스카이,샤워 수압이 엄청 안좋음.. 졸졸졸나옴.. 방충망이 없는 창문은 처음.. 핸드폰 충전기조차 고물 깨끗하긴 한데 시설적인거에는 무관심하신듯,2,5개월 전
y_31_212,전주 화이트호텔,빠다령,깔끔합니다 주차도 편하고 터미널에서 가까워 좋아요,5,6개월 전
y_31_213,전주 화이트호텔,Poing,연박으로 묵었는데 시설이 깨끗해서 만족하면서 지냈네요,4,5개월 전
y_31_214,전주 화이트호텔,황팔백,친절 하고 깨끗한 방 시설,5,4개월 전
y_31_215,전주 화이트호텔,빠다령,깔끔하고 연박도 잘 이용했습니다,5,6개월 전
y_31_216,전주 화이트호텔,숨참고블랙홀다이브,룸 업그레이드 해주셔서 너무 좋았어요 전자렌지랑 스타일러랑 옷장까지 있는 특실이라 잘 쉬었습니다 감사합니다,5,6개월 전
y_31_217,전주 화이트호텔,G*****,깨끗하고 좋아요 수압이 약한건 아쉬우ㅏ여,5,4개월 전
y_31_218,전주 화이트호텔,Oneneone,깨끗하고 좋은 숙소입니다.,5,5개월 전
y_31_219,전주 화이트호텔,소익수,친절하시구 시설도 너무 깨끗하고 좋앗어요! 잘쉬다가요😀,5,5개월 전
y_31_220,전주 화이트호텔,스파랜드팔라딘,편안하고 좋아요 ㅎㅎㅎ,5,4개월 전
y_31_221,전주 화이트호텔,여주거울,편안하게 잘 묵었다갑니다,4,6개월 전
y_31_222,전주 화이트호텔,닉넴므하지,갈때마다 만족 하구 갑니다! 다음에 또 이용할게욥,5,4개월 전
y_31_223,전주 화이트호텔,빛나고밝은가죽점퍼,시설도 깨끗하고 좋네요,5,5개월 전
y_31_224,전주 화이트호텔,다정하고확실한다복,편안하고 잘쉬다갑니다,4,6개월 전
y_31_225,전주 화이트호텔,남산타워카네이션,더운 여름에 실내에서 쉬자 하고 찾은 곳이 화이트 호텔이었는데 너무너무 만족이에용 객실 컨디션도 좋고 무엇보다 터미널 근처라 이동시간도 짧았어요 ㅎㅎ 대실 시간도 무엇..너무 좋아용!! 다음엔 숙박으로 이용하고싶어요ㅎㅎ 더운 여름에 실내에서 쉬자 하고 찾은 곳이 화이트 호텔이었는데 너무너무 만족이에용 객실 컨디션도 좋고 무엇보다 터미널 근처라 이동시간도 짧았어요 ㅎㅎ 대실 시간도 무엇..너무 좋아용!! 다음엔 숙박으로 이용하고싶어요ㅎㅎ 더운 여름에 실내에서 쉬자 하고 찾은 곳이 화이트 호텔이었는데 너무너무 만족이에용 객실 컨디션도 좋고 무엇보다 터미널 근처라 이동시간도 짧았어요 ㅎㅎ 대실 시간도 무엇..너무 좋아용!! 다음엔 숙박으로 이용하고싶어요ㅎㅎ,5,10개월 전
y_31_226,전주 화이트호텔,산소같은방구,우선 전주 첫 여행이였는데 편안하게 숙박 하고갈수 있어 너무 좋았습니다 물도 잘나오고 깨끗하고 조용해서 담번에 전주 방문하면 또 숙박하고싶은 숙소이네요 ㅎㅎㅎ 주변에 음식점 및 술집도 있어서 간단하게 저녁에 한잔하기도 좋아요 담번에두 전주 방문시 꼭 방문하고 싶네요 ㅎㅎㅎ 그리구 주변에 한옥마을 및 가맥 가게들도 10분거리에 있어서 택시 및 걸어서 움직이기도 나쁘지 않탑니다 그리고 가맥축제 기간이라 전주를 더욱 색다르고 더운날 시원하게 잘즐긴거 같아 좋네요 날이 더운것 빼곤 좋은 추억입니다 ㅎㅎ 잘쉬다 갑니다 ㅎㅎㅎ.,5,11개월 전
y_31_227,전주 화이트호텔,등따신곳찾는이,"전주고속버스터미널+시외버스터미널 인근이라 접근편하고 자차 이용시 주차장이 있어 편히 주차했습니다. 혹 식사시 음식은 웬만한 곳배민권이라 좋습니다. 사장님의 친절한응대와 방배정 받았습니다. 객실 문을 열고 들어갈 때제일 먼저 맡게 되는게 냄새인데 쾌적했어요. 비흡연자라 담배냄새에 좀 민감한 편이거든요 시트와 커버는 청결했어요! 화장실도 깨끗했어요~ 샴푸, 린스, 바디워시가 비치되어있고 일회용품 가방도 있어서 불편없이 이용했어요",5,1년 전
y_31_228,전주 화이트호텔,김은찬님,깔끔하고 좋아요~~~~,4,1년 전
y_31_229,전주 화이트호텔,원*****,다른 건 다 좋았는데 화장실 수압이 좀 약했던 거랑 아침에 따뜻한 물 나오려면 좀 걸리더라구요..! 그리구 새벽엔 방 안이 좀 추웠어요ㅠㅠ 그래도 만족합니다!,4,1년 전
y_31_230,전주 화이트호텔,옅은짐승,좋은 시설에서 잘 쉬다 가요,4,4개월 전
y_31_231,전주 화이트호텔,흔쾌한연애,"방에 이상소지가 있어, 직원분께 말씀드렸고, 적극적으로 해결해주시려 노력하셨습니다. 또한 수건 2장 추가 요청도 인상 찌푸림없이 바로 해결해주셨습니다. 환경도 깨끗하고, 주변에 음식점과 편의점이 가까워 자주 애용합니다.",5,1년 전
y_31_232,전주 화이트호텔,도옹한,깔끔하니 정말 좋아요 가격도 싸네요,5,3개월 전
y_31_233,전주 화이트호텔,김은찬님,깔끔해서 좋아요~~~~,4,1년 전
