id,name,nickname,review_content,rating,write_date
y_31_001,전주 화이트호텔,이*****,"6월16일 월요일, 급히 전주에 가게 됐습니다. 성남에서 급히 출발하다 보니 숙소 예약도 못했는데 전주IC 나와서 신호 대기시 여기어때 앱을 통해 예약을 했습니다. 전주에 오면 숙소는 역시 화이트호텔이죠^^~! 객실 깨끗하고 넓고, 일회용품 넉넉히 비치되어 있고, 에어컨 빵팡, PC사향 좋고, 침구류 깨끗하며, 다만 샤워기 수압이 조금 약했습니다.그렇다고 불편할 정도는 아니었어요. 그리고 숙소부근 인프라 좋구요~ 머니 머니해도 아침 무료 조식 아트입니다^^~♡ 편히 잘 묵고 갑니다.고맙습니다~♡",5,14일 전
y_31_002,전주 화이트호텔,이*****,"4월17일 목요일, 여기어때를 통해 전주화이트호텔에 숙박 예약을 했습니다. 특가를 이용해 제일 저렴한 객실로 예약 했는데, 숙소 사장님이 객실을 더 좋은데로 무료 업그레이드 해 주었습니다. 너무 너무 감사 드려요^^;; 오후 4시 전주 도착, 숙소에 갔는데 주차장이 텅 비어 있어 깜놀 , 역시 경기가 안좋긴 안좋은가봐요. 특히 지방은 더 경기가 안좋은듯 ㅠㅠ 주차장 자리도 제일 좋은 자리에 주차하고 객실로 올라 갔습니다^^~ㅎ 청소 상태 깔끔하고 사용시설물 다 좋습니다. 첨부 사진과 같이 아침 무료 조식 너무 맛있게 잘~먹었습니다^^♡",5,2개월 전
y_31_003,전주 화이트호텔,이*****,"4월8일 여기어때를 통해 전주화이트호텔에 숙박 예약을 했습니다. 전주에 몇 달만에 왔는데 엘리베이터 새것으로 리모텔링을 했네요~아주 좋습니다^^ 객실내 청소는 아주 깨끗하고 좋았습니다. 다만, 화장실 변기커버와 변기사이즈가 맞질 않아 큰일 보기가 좀 난감했습니다 ㅡㅡ, 602호에 숙박하였는데 샤위기 수압도 좀 약했고요~ 하지만 대체적으로 숙박하는데 불편함은 없었습니다. 그리고 아침 조식을 무료로 주는데 감동, 감동입니다~♡ 샌드위치와 떡라면 중 골라 먹을수 있는데 전 떡라면!!! 너~~~무 맛있었어요^^~ 다음에도 전주 출장 오면 역시~화이트호텔은 필수입니다♡♡♡",5,2개월 전
y_31_004,전주 화이트호텔,이*****,"6월23일 월요일, 급히 전주 출장을 가게 되었습니다. 전주에 오면 숙박 예약은 당연히 화이트호텔입니다. 친절하시고 어떨땐 객실도 업그레이드 해주시고^^~ 주차하기도 편하고 저처럼 시청 일보러 오면 관공서 가깝고~딱입니다! 객실내 에어컨 빵빵하고, 일회용품 넉넉하고 청소 깔끔에 침구류도 깨끗하고 머하나 흠 잡을게 없습니다. 조식도 무료로 주시고, 특히 아침 무료 조식이 아트입니다^^ 1층 프론트 옆에 무료아이스커피도 만들어 먹을수 있으니 참고 하시고요^^~ 항상 고맙습니다^^~♡",5,10일 전
y_31_005,전주 화이트호텔,이*****,"요새는 3일에 한번씩 전주를 가네요~ㅎㅎ 오늘도 변함없이 전주화이트호텔에 숙박 예약을 했습니다. 프론트에 사장님 또는 지배인님께서 좀 더 좋은 방으로 업그레이드 해주시고, 항상 감사드리며 고맙습니다^^;; 프론트 옆 커피자판기 있구요~얼음생성기도 있음에 아이스아메리카노 바로 만들수 있습니다.물론 무료이고요~ 객실은 다 좋습니다. 더 이상 칭찬하면 입 아플정도로 객실 짱!!! 그리고 아침 무료 조식 정말 감사하고 짱짱짱!!! 입니다. 이 가성비에 이런 혜택이~감동입니다~♡",5,1개월 전
y_31_006,전주 화이트호텔,이*****,"5월26일 월요일, 급한 일로 전주 출장을 가게 됐습니다. 저번주 22일(목) 전주 출장 일이 잘 끝나지 않아 부랴 부랴 여기어때를 통해 예약 했습니다. 저는 항상 전주 출장시 전주화이트호텔만 예약합니다. 그 이유로는 프론트 사장님(지배인님)이 너무 친절하시고, 객실 여유시 좀 더 좋은 방으로 무료 업그레이드도 해주시고. 객실내 청소 깔끔, 침구류 깨끗하고, 일회용품들 넉넉히 비치되어 있으며, 무엇보다도 1층 식당,카페의 무료 조식이 아트입니다. 아메리칸블랙퍼스트하고 떡라면이 있는데 라면 너무 맛있습니다. 고맙습니다^^~♡",5,1개월 전
y_31_007,전주 화이트호텔,59세,추천합니다 주차장에 넓어서 편했어요 객실도 청결하고 침구도 깨끗합니다 욕실의 청결도도 좋았어요 재방문의사 있어요 추천합니다 주차장에 넓어서 편했어요 객실도 청결하고 침구도 깨끗합니다 욕실의 청결도도 좋았어요 재방문의사 있어요 추천합니다 주차장에 넓어서 편했어요 객실도 청결하고 침구도 깨끗합니다 욕실의 청결도도 좋았어요 재방문의사 있어요 추천합니다 주차장에 넓어서 편했어요 객실도 청결하고 침구도 깨끗합니다 욕실의 청결도도 좋았어요 재방문의사 있어요 추천합니다 주차장에 넓어서 편했어요 객실도 청결하고 침구도 깨끗합니다 욕실의 청결도도 좋았어요 재방문의사 있어요 추천합니다,5,16일 전
y_31_008,전주 화이트호텔,이*****,"5월22일 목요일, 여기어때를 통해 전주화이트호텔에 숙박 예약 하였습니다. 전주에 오후 3시정도 도착하였고, 주차자리는 20여대정도 주차할 공간이 있습니다. 호텔근처에도 주차할 때는 있는듯 합니다. 제일 저렴한 객실로 예약하였는데 사장님께서 좀 더 좋은 객실로 무료 업그레이드 해줘서 너무 감사 했습니다. 평일에는 객실 여유가 있을시 무료 업그레이드를 해준다 하네요. 고맙습니다^^ 숙소 바로 옆에는 현대옥, 24시짬뽕집, 술집 등등 인프라 좋습니다. 아침 조식 무료인데 너무 감사합니다^♡",5,1개월 전
y_31_009,전주 화이트호텔,앙칼스러운조로,전주 올때 친구랑 항상 이용하는 숙소입니다 ㅎㅎㅎ올때마다 청결하고 친절해서 자주이용하게 되네요 충전기도 있고 전기장판도 잘되구 퇴실시간도 넉넉하다고 생각합니당!!!!!ㅎㅎㅎㅎ앞으로도 자주 이용할게용 그리고 진짜 친철해요 ㅜ ㅎㅎㅎ가운도있구요 쾌쾌한 냄새가 안나서 좋았던거같아요 샴푸 트리트먼트도 너무 괜찮구 아!!!!가격이 제일 저렴한거같아요 다근데랑 비교도 많이 해봤는데 여기만한 곳이 없는 것 같아요 주변 편의점도 있구 대중교통도 너무 잘되어있습니다~~,4,1개월 전
y_31_010,전주 화이트호텔,이*****,"6월30일 월요일, 급한 일로 전주 출장을 가게 되었습니다. 항상 전주 출장시에는 하루 숙박을 해야함에 다른 숙박업소 보다는 저는 전주화이트호텔을 자주 애용합니다. 평일에는 상황에 따라 객실도 좀더 좋은 룸으로 무료 업그레이드도 해주시고, 객실내 대형TV, PC사향도 좋구요~ 무엇보다 침구류 깨끗하고 방청소 깔끔~넉넉한 일회용품들...고객을 배려 하는 느낌을 받는 화이트호텔입니다. 그리고 다음날 오전7시~9시까지 무료조식 아트♡입니다^^ 화이트호텔에 숙박하면 항상 대접받고 가는 기분이에요. 고마워요 화이트호텔^^~♡",5,4일 전
y_31_011,전주 화이트호텔,vvvinnnn,"주변 숙박시설들을 여러 곳 비교해본 결과, 이곳은 정말 가성비 측면에서 압도적으로 뛰어납니다. 단순히 가격만 저렴한 것이 아니라, 가격 대비 제공되는 시설이나 서비스의 품질이 굉장히 우수해서 매우 만족스럽습니다. 숙소 내부는 깔끔하게 관리되어 있었고, 청결 상태도 흠잡을 데 없이 완벽했습니다. 침구류도 청결하고 포근해서 편안하게 쉴 수 있었고, 욕실 또한 청결하게 관리되어 있어 사용하면서 전혀 불편함이 없었습니다. 기본적인 편의시설은 물론, 세세한 부분까지 신경을 많이 쓴 느낌을 받을 수 있었는데요. 예를 들어 어메니티 하나하나도 저렴한 숙소에서는 보기 힘든 퀄리티였고, 조명이나 가구 배치, 인테리어까지 전반적으로 아늑하고 세련된 분위기를 자아내서 휴식하기에 안성맞춤이었습니다. 또한 조용한 위치에 자리하고 있어 주변 소음 없이 푹 쉴 수 있었고, 접근성도 좋아서 대중교통이나 차량을 이용한 이동 모두 편리했습니다. 무엇보다 인상적이었던 점은 직원분들의 친절함이었습니다. 체크인부터 체크아웃까지 모든 과정에서 응대가 친절하고 정중했으며, 고객의 불편함이 없도록 세심하게 배려해 주시는 모습이 정말 인상 깊었습니다. 요청사항에 대한 반응도 빠르고 적극적이어서 머무는 동안 불편함 없이 지낼 수 있었고, 이러한 서비스 마인드 덕분에 다음에 또 방문하고 싶다는 생각이 자연스럽게 들었습니다. 주변 다른 숙소들과 비교해보면 가격은 비슷하거나 오히려 저렴한 편인데, 시설이나 서비스 면에서는 훨씬 더 만족스러운 경험을 제공받을 수 있었기에 가성비 면에서 최고의 선택이라 자부할 수 있습니다. 실제로 여러 조건들을 종합적으로 따져봤을 때, 이만한 곳이 없다는 생각이 들 정도로 전반적인 만족도가 높았고, 다음에 이 지역에 또 올 일이 생긴다면 고민할 필요 없이 무조건 이곳으로 예약할 것 같습니다. 처음 방문한 숙소였지만, 마치 오래 전부터 알고 있었던 단골 숙소처럼 편안하고 정감 있게 느껴졌습니다. 결론적으로 말하자면, 이 숙소는 가격, 시설, 위치, 서비스 등 모든 면에서 매우 우수한 숙박시설이라고 생각합니다. 짧은 여행이었지만 이곳 덕분에 더욱 기억에 남는 시간이 되었고, 좋은 기억으로 오래 남을 것 같습니다. 주변에 숙소를 찾는 지인이 있다면 자신 있게 추천할 수 있을 정도로 만족스러운 경험이었습니다.",5,1개월 전
y_31_012,전주 화이트호텔,jade7,"조식 정말 좋았습니다 친절하고, 청결하고~ 욕실청소만 조금 더 신경써주시면 완벽!!! 근처에 비스트라는 모텔이 있는데 거기는 절대 가지마세요.....완전 개 더러워요",5,8일 전
y_31_013,전주 화이트호텔,민망한삵,우선 가장 인상 깊었던 점은 카운터 보시는 분이 굉장히 친절하셨습니다. 그래서 1차적으로 기분이 좋았구요. 방에 들어 갔는데 굉장히 깨끗해서 2차적으로 기분이 좋았습니다. 또 시원하기도 하구요. 욕실에 샴푸랑 바디워시도 냄새가 좋았습니다. 침대도 일반 모텔보다는 큰 거 같았습니다. 방 크기랑 인테리어는 전체적으로 심플합니다. 아 개인적으로 조명이 좋더라구요. 주차에 관해서 말하자면 주차장 크기는 평범하다고 보시면 됩니다. 다음에 또 재방문 의사 있습니다. 좋네요.,5,1개월 전
y_31_014,전주 화이트호텔,의심스러운쥐,"전주 터미널 근처에 위치, 숙박시설으로써 갖춰야할 친절한 매너와 일회용품 등이 잘 구비 되어있다. 많이 방문하였는데 변함 없는 친절함으로 고객을 응대해주며 날씨가 추울땐 따뚯한 차도 준비해준적이 있으며 조식으로 토스트나 라면으로 선택하여 아침까지 챙겨주는 센스있는 숙소! 시설이 조금 노후화되어 수압이 약하고 뜨거운 물 조절이 원활히 되지는 않지만 그래도 뜨거운물 잘나오고 비대가 설치되어 비대를 사용하는 분들께 좋음! 청소를 항상 깔끔하게 해주시며 불만 없이 이용합니다.",5,1개월 전
y_31_015,전주 화이트호텔,이편한꿈자리,전주 여행 오려고 우연히 예약 했는데 가성비 최고네요 딱 필요한게 다 있어서 너무 좋았고요 청결해서 그런지 편하게 잘 쉬었다 갑니다 조식도 당연 최고!! 다음에도 방문하겠습니다 ㅎ,5,29일 전
y_31_016,전주 화이트호텔,원숭이좋아,친절하고 좋아요 깨끗하고 주말치고 가성비 좋고 안락한 느낌 이라 더 좋았습니다 불편한 것도 없었고 사장님도 친절하셔요 다음에 또 오고 싶습니다 위치나 주변 먹거리 놀거리도 많아 보이고 괜찮습니다 그런 거 치고 조용하고 방음이나 그런 게 부족하지도 않았어요 조용해서 좋습니다 방도 따뜻하고 수압 도 잘 나오는 편이며 따뜻한 물도 잘 나와서 괜찮았습니다 티 비도 잘 나오고 별 문제없이 편히 쉬었다 갑니다 가성비가 찮아서 다음에 또 찾아오고 싶은 숙소입니다 추천드릴게요 따따봉 굳굳 여긴 보장!!,5,1개월 전
y_31_017,전주 화이트호텔,희지공주,"전주 가성비 좋은 화이트관광호텔 희지우성짱 블로그에도 소개한 곳입니다. 친절한 사장님과 저렴한 숙박비 조식(2인)까지 포함되어 저렴하게 결재했어요. 호텔 위치까지 맘에 드네요~ 맛집, 편의점, 노래방..등 가까이 위치하고 있어서 맘에 쏙 드네요 ^^ 미니 냉장고 + 전자렌지 + 컴퓨터까지 설치되어 있어 간단하게 취식하기 좋을 듯 합니다. 드라이기와 매직기까지 사장님 센스가 돋보입니다. 넷플릭스,티빙,웨이브,디즈니플러스...등을 볼수 있는 OTT가 잘되어 있어 마지막회 못본 옥씨부인전을 즐감하며 보는 동안 침대 옆에 스타일러 이용했어요. 눈이 많이와 겉옷이 눅눅했는데 전원 켜고 버튼하나 누르면 작동할수 있게 되어 있어 사용하기 편리했어요. 욕실이 얼마나 큰지 몰라요ㅎㅎ 우리집 거실 욕실보다 반정도 더 큰거 같아요. 수건, 침구가 깨끗해요. 샴푸,린스,바디샴푸 비치되어 있구요~ 칫솔은 준비해 오세요. 전주 시외버스터미널 앞에 있고, 전주한옥마을 차로 10분 위치도 좋은 가성비 호텔 화이트관광호텔 추천합니다.",5,5개월 전
y_31_018,전주 화이트호텔,앙칼스러운조로,전주 올때 친구랑 항상 이용하는 숙소입니다 ㅎㅎㅎ올때마다 청결하고 친절해서 자주이용하게 되네요 충전기도 있고 전기장판도 잘되구 퇴실시간도 넉넉하다고 생각합니당!!!!!ㅎㅎㅎㅎ앞으로도 자주 이용할게용 그리고 진짜 친철해요 ㅜ ㅎㅎㅎ가운도있구요 쾌쾌한 냄새가 안나서 좋았던거같아요 샴푸 트리트먼트도 너무 괜찮구 아!!!!가격이 제일 저렴한거같아요 다근데랑 비교도 많이 해봤는데 여기만한 곳이 없는 것 같아요 주변 편의점도 있구 대중교통도 너무 잘되어있습니다~~,3,1개월 전
y_31_019,전주 화이트호텔,에단호크,번화가 주변에 있어서 식당 편의점 많고 배달 음식은 당연히 잘 됩니다. 유흥가는 아니라서 조용하고 아늑하네요. 침구 깨끗하고 사각사각 느낌 좋아요. 퀘퀘한 냄새 없고 깔끔하고 청소상태도 좋습니다. 더블 침대에 싱글 침대 방인데 가격도 저렴하고 전체적으로 너무 좋았습니다. 뜨거운물 잘 나오고 수압도 좋아요. ott 대형 티비로 볼 수 있어요. 생수 3병 냉장고에 들어있는데 1층에 생수 냉장고 있습니다. 1층이 카페 입니다 주차장 넓어서 주차 편해요. 호텔 건너편 전통육개장 맛있어요. 다음에 꼭 들리겠습니다,5,3개월 전
y_31_020,전주 화이트호텔,5오5오,청결도는 너무 좋았어요 들어가자마자 담배 냄새도 없었고 페브리즈향이 가득하긴 했지만 편하게 쉬다 갈 수 있어서 좋았습니다. 객실도 조용하고 깨끗해서 다음에 또 와도 될 것 같다는 생각이 들었어요! 전주 여행 오면 고속버스 터미널도 가까워서 여기로 예약해야겠어요 재방문 예약입니다 ㅎㅎ 사장님도 친절하시고 객실 안에 있어야 할 것들이 다 준비되어 있어서 좋았고 화장실도 깨끗해요 근데 물을 틀 때는 조금씩 돌려서 움직이셔야해요 ㅎㅎ 살짝 움직였는데 차가운 물과 뜨거운 물이 아무튼 숙소 추천입니당,5,1개월 전
y_31_021,전주 화이트호텔,54나그네,항상 잘 이용하고 있습니다.,5,24일 전
y_31_022,전주 화이트호텔,okcomputer,편하게 잘 자고 왔습니다. 터미널 근처에 많은 숙박시설이 있지만 오히려 그렇다보니 제대로 만족할만 숙소를 찾기 어려운 점이 있습니다. 화이트라는 이름에서 연상되듯이 깔끔한 느낌입니다. 인테리어가 화려하지는 않지만 숙박업소 본연의 역할에 맞게 깔끔하고 기본에 충실한 느낌입니다. 온도도 적당해서 아늑하게 잘 잘 수 있었습니다. 주변에 식당도 많고 편의점도 가깝습이다. 조식은 떡라면과 토스트 두가지 메뉴로 구성되어 있습니다. 식성 취향에 맞게 주문해서 드시면 될 것 같습니다.,4,3개월 전
y_31_023,전주 화이트호텔,등따신곳찾는이,"자주 애용하는 호텔입니다~ 주차장 10대 이상 주차 가능한 주차장이 있습니다. 1층에서 예약 확인 후 방키 주시는데, 데스크에 렌즈보관함이 비치되어 있어 공짜로 사용가능하고 저도 가져왔습니다 1층에 카페가 연결되어 있어 문하나만 열면 카페도 이용가능합니다ㅎ 엘레베이터를 이용 해 방으로 이동~! 문 열자마자 맡게 되는 냄새! 냄새도 나지 않고 쾌적합니다 합격! 침구류 잘 정돈 되어 있고 베개를 들춰봐도 깨끗! 화장실은 비데가 있고 역시나 깨끗합니다 티비가 커~서 좋고 넷플릭스도 시청가능해서 좋습니다. 물 비치되어 좋아요~~ 재방문할께요",5,10개월 전
y_31_024,전주 화이트호텔,시애틀앨빈,"충분한 하고 깔끔하게 담긴 어메니티 만족했습니다. 그리고 안락한 매트리스까지 편안했습니다. 환절기임에도 난방이 잘 되어 있어 쾌적하게 쉬었고요. 객실 청소 상태 또한 만족했는데요. 머리카락 하나 보이지 않을 정도로 청결했습니다. 그리고 더 마음에 들었던 것은 보디로션이 크게 한 통으로 있어서 좋았어요. 다른 곳들은 보디로션이 없거나 있어 소 소분해서 있다 보니 쓰기에 부족했는데, 건조한 부위에 충분히 바를 수 있어서 좋았습니다. 가성비 있게 잘 이용한 것 같아 만족했습니다. 다음에도 기회가 된다면 또 이용하도록 하겠습니다.",5,8개월 전
y_31_025,전주 화이트호텔,남다르고알록달록한혹성,갑자기 전주 주변의 모텔또는 호텔에서 머물러야 일이 생겨서 여기저기모텔을 다니면서 머물고 있어요. 그중에 화이트호텔은 만족도가 높았습니다. 일단 화장실 및 방도 넓고 좋아요. 그리고 다른곳보다 창문이 크게 나있으며 창문을 열수 있는게 너무 좋더라고요. 다른데는 다른 건물과의 거리가 가까워서 창문을 열 수 없고 너무 작았는데 여기는 그게 아니라 만족스러워요. 조식도 주시니 조식을 해결 할 수 있어 편하고요. 대신 수건의 세월이 느껴지는 아쉬움이 있었습니다. 계속 또 이용할게요^^^,4,10개월 전
y_31_026,전주 화이트호텔,GC1504170458,숙소 근처에 편의점도 가깝고 늦게까지하는 식당들도 있어서 편했습니다 하지만 화장실 샤워기 수압이 약하고 에어컨이 잘 안나왔어요,5,18일 전
y_31_027,전주 화이트호텔,54나그네,항상 잘 이용합니다. 조용하고 깨끗해요.,5,24일 전
y_31_028,전주 화이트호텔,이*****,"1월8일 전주 출장시 여기어때를 통해 일반실을 예약했습니다. 할인 적용을 받아 35,000원에 숙박하였고요. 일반실에는 컴퓨터가 없는데 사장님이 무료로 방 업그레이드를 해줘 컴퓨터 있는 방으로 배정해줬습니다. 고맙습니다^^~ 객실은 깨끗하고 일회용품 넉넉하고, 냉장고에 캔음료2개, 생수3개 무료 비치되어 있고, 온수 빵빵 수압 짱짱 좋았습니다. 컴퓨터 사향 좋고 주차장시설 편안합니다. 아침 조식(라면 또는 아메리칸블랙퍼스트) 무료고요-아주 맛있습니다. 이 가성비에 이렿게 누리다니 너무 편히 잘 쉬었다 갑니다^^~♡",5,5개월 전
y_31_029,전주 화이트호텔,syncout,숙소 깨끗하고 넓어요. ott 많아서 볼것도 많고 몰랐는데 조식도 먹을수 있어서 좋고요. 방음이 잘 되어서 조용해서 좋았고 화장실도 넓고 따뜻한 물 잘 나오고 수압도 좋고 터미널이랑 가까워서 위치도 괜찮아요. 가격도 괜찮았고 사장님도 친절하셔서 좋았어요. 아 샤워하면 화장실 세면대 쪽으로 물이 흘러서 물이 좀 첨벙거리는게 좀 아쉬운것 말고는 진짜 만족합니당!! 재방문하고 싶을 정도입니다,5,1개월 전
y_31_030,전주 화이트호텔,닉넴므하지,갈때마다 시설이 깔끔 하고 청소상태도 좋아서 편하게 쉬고 갑니다! 사장님도 너무 친절하세오👍🏻,5,12일 전
y_31_031,전주 화이트호텔,분위기전문가,안녕하세요 트립홀릭 분위기전문가입니다~ 오늘은 전주 화이트호텔 방문 후기입니다~~~ 근처 학원에 다니는데 너무 피곤해서 운전 할수없을거같아 진짜 제일 싼곳으로 왔어요!! 🥇🥇🥇장점🥇🥇🥇 1.모텔치고 로비가 굉장히 깔끔합니다 들어오자마자 아 이름에 왜 화이트가 들어가는지 알게됩니다! 2.주차장이 넓어요 생각보다 주차장이 엄청넓어서 좋았습니다. 끽해야 얼마 없겠지 했는데 생각보다 넓었습니다^^ 3.객실이 큽니다. 저는 평일숙박 35000원을 지불했는데 객실이 크고 티비도 크고 좋았습니다. 4.기본어메니티 제공을 해줍니다.요새 칫솔 치약 돈받는곳 쫌 있는데 퀄리티는 많이 떨어지지만 무료인게 어디에욯ㅎ 그리고 화장실에 있는 바디워시 샴푸 컨디셔너가 일반 샤xx이트 아닌게 너무 좋았어요^^ 5.수압이 좋습니다. 쫄쫄 나올줄알았는데 콸콸 잘나옵니다!!! 6.룸서비스가 있다!! 모텔에 룸서비스 찾기 힘든데 술과 음료 안주 와 밥... 꼭 먹고싶었지만 22시까지라 먹질못했습니다.. 22시에 입실해서ㅠㅠ 7.조식이 무료!!!?? 저도 신청은 했지만 시간이 늦어 먹진못했네요..ㅠㅠ 프렌치토스트 다른후기에서 봤을땐 맛나보였는데ㅠㅠ 🥈🥈🥈아쉬운점🥈🥈🥈 1.룸에 들어갔을때 냄새가 살짝 아쉬워요.. 음.. 뭐랄까 모텔 특유 그런냄새..? 화장실은 너무 습해서 들어가고싶지 않았습니다. 2.시설들의 노후화 사실 이가격에 비하면 정말 좋은곳이긴한데.. 에어컨이라도 청소 꼭 하셔야할거같아요.. 이제 여름다가와서 에어컨 많이틀텐데 냄새가..후...ㅠㅠ 3.기본정비들이 조금 아쉽네요 침구는 베팅이 살짝 쫙쫙 안되어있고 의자는 망가졌어요.. 그리고 충전기.. 왜 충전을 하는데 배터리를 뺏어가죠..ㅠㅠ(요건 프론트에서빌림) 아무튼 밤새 충전해도 안될거같아 프론트에서 빌렸는데 그건 잘됐습니다^^ 총평: 아쉬웠던거 고치고 가격 좀 올리셔도 좋을거같습니다. 가격대비 좋긴하지만 소비자들은 더 좋은걸 원할거에요^^ 몇가지 더 고친다면 와이프도 데려오고싶네요~~ 7.0/10 입니다^^ 어제는 잘 쉬다 갑니다~!,5,1년 전
y_31_032,전주 화이트호텔,이순신공원마늘,건물외관은 노후됐지만 안에는 그래도 시설도 괜찬고 가성비 좋고 침구 시설등도 가격대비 좋은편임다... 전주에서 이정도면 준수한편이고 비싼호텔 비하면 좋진 않지만 어차피 돈따라 가는거니..가성비 측면에서는 아주 좋아요..주변에 식당들도 괞찬은 식당들이 있어서 좋고 전체적으로 조용해서 좋아요.... 출장을 많이 다녀서 가성비호텔이 나름대로 기준이 잡혀있는데 극강의 가성비는 아니지만 주차장도 넓고 조아요....결론 가격대비 아주 좋아요.. 아침엔 라면도 끓여준답니다..,5,3개월 전
y_31_033,전주 화이트호텔,가을향기,집처럼 편한한곳에서 숙박을 하게되었습니다. 비가내려 옷이 젖었는데 스타일러가 비치되어있어 옷도 보송보송해서 입을수 있어 전주를 찾는분들에게 추천해드립니다. 조식도 카페에서 먹는 기분좋음과 객실 업그레이도 감사 합니다,4,1개월 전
y_31_034,전주 화이트호텔,딴딴한허리,"출장와서 급하게 숙소를 잡았는데, 상담도 친절하시고, 시설도 깔끔하고, 편하게 숙면취하고 나왔네요.^^",5,1일 전
