id,name,nickname,review_content,rating,write_date
y_31_410,전주 화이트호텔,등따신곳찾는이,자주 애용하는 숙소입니다. 이용할 때마다 느끼지만 이름처럼 정말 깨끗합니다. 주차장이 있어 주차 편히 했습니다. 1층 데스크에 직원분이 예약확인 후 방키 주십니다. 엘레베이터 이용하여 방으로 이동~~~~ 방문 열자 마자 맡아보게 되는 방냄새~~ 그러나 역시 인위적인방향제 냄새도 없이 쾌적합니다. 샴푸/린스/바디워시/폼클렌징/수건과 비데 있는 장실. 물과 음료가 들어 있는 냉장고. 일회용품이 들어 있는 상자. 혹시나 해서 들춰보는 베개 그곳까지 깨끗하네요ㅋ 큰 티비와 넷플릭스까지!ㅋ 음식은 웬만한 곳 배민권이라 좋습니다. 가성비 쥑입니다,5,1년 전
y_31_411,전주 화이트호텔,10666770,24시간 이용할수잇는 셀바도잇고 카운터에 냉장고에 물이잇어서 마실만큼 가져다먹을수잇고 커피머신기도잇어서 좋아요 가성비좋고 숙박도 입실시간빠르고 길고 욕조도잇구 주차장도넓어서 아주 편히쉬기에 좋아요,5,3년 전
y_31_412,전주 화이트호텔,비가내린새벽,4박하는동안 먼저 인사해주시고 필요한것도 잘챙겨주시고 친절하십니다. 컴퓨터없는방으로 이용했는데 방구조는 컴퓨터빼고 동일하고 아늑하니 쉬기에 좋습니다. 무엇보다도 조식맛집이네요ㅎ 덕분에 잘쉬다가 갑니다.,5,3년 전
y_31_413,전주 화이트호텔,등따신곳찾는이,"화이트는 늘 굿입니다~ 오늘은 무료 업그레이드 해 주셔서 감사했습니다. 침대와 분리된 휴식 공간이 좋았습니다 전주고속버스터미널+시외버스터미널 인근이라 접근편하고 자차 이용시 주차장이 있어 편히 주차했습니다. 혹 식사시 음식은 웬만한 곳배민권이라 좋습니다. 사장님의 친절한응대와 방배정 받았습니다. 객실 문을 열고 들어갈 때제일 먼저 맡게 되는게 냄새인데 쾌적했어요. 비흡연자라 담배냄새에 좀 민감한 편이거든요 시트와 커버는 청결했어요! 화장실도 깨끗했어요~ 샴푸, 린스, 바디워시가 비치되어있고 일회용품 가방도 있어서 불편없이 이용했어요",5,1년 전
y_31_414,전주 화이트호텔,Should,ㅎㅎㅎㅎ침대와 화장실 모두 청결해서 잘 쉬었다 갑니다 ^^ 배게 높이에 조금 예민한 편인데 배게 높이도 적당해서 꿀잠 잤네요 ㅎㅎ 주차도 편하게 할 수 있어서 종종 이용할 것 같네요 ㅎㅎ 강추!!!! 그리고 가격이 워낙 저렴해서 혹시나 시설이 좋지 않을까 염려했는데 너무나 깨끗해서 깜짝 놀랐어요 ㅎㅎ 수건도 넉넉해서 부담없이 사용할 수 있어서 좋았습니다 ㅎㅎㅎ,5,3년 전
y_31_415,전주 화이트호텔,섬강유원지골목,정말 깔끔하고 방 컨디션도 너무 좋습니다. 냄새도 안나고 방음도 잘 되는 편이고 침대도 무척 좋습니다. 이번엔 대실을 했지만 평소에는 숙박을 하는편입니다. 친절하고 맛있는 조식 좋아요,5,1년 전
y_31_416,전주 화이트호텔,두*****,넓고 좋았습니다. 티비도 굉장히 크고 선명해서 좋았네요. 컴퓨터는 방에 없었으니 참고하실 분은 참고하세요. 깔끔함도 나쁘지 않았던 것 같습니다. 터미널과 가까운게 진짜 장점입니다.,4,3년 전
y_31_417,전주 화이트호텔,차분한템플릿,들어갔을때 락스청소하셨는지 소독약냄새가 났는데 환기시켜도 잘안빠지는것같았어용 근데 이건 어쩔수없는거고 ㅎㅎ 티비가 굉장히 크더라구요 넷플릭스도 잘돼고 영화 잘봤습니다 ㅎㅎ 아 그리고 침대 밑에 프레임이 침대에비해 더 크게있어서 발부딪히기 딱좋더라구요 ㅠㅠ 저희 둘다 한번씩 부딪혀서 아팠어요 ㅋㅋㅋ 그거랑 수압이 좀 약한거빼고 시설은 전체적으로 괜찮고 무난하니 방문하기 괜찮았습니당 일층로비도 깔끔하고 주차장도 넓고 딱 쉬고 가기좋았습니당 잘 놀다가요~,4,3년 전
y_31_418,전주 화이트호텔,등따신곳찾는이,"주차장이 있어 주차 편히 했어요. 음식은 웬만한 곳 배민권이라 좋습니다. 친절한 응대와 방배정 받았습니다. 객실 문을 열고 들어갈 때 제일 먼저 맡게 되는게 냄새인데 쾌적했어요. 비흡연자라 담배냄새에 좀 민감한 편이거든요 시트와 커버는 청결했어요! 화장실도 깨끗했어요~ 샴푸, 린스, 바디워시가 비치되어 있고 일회용품 가방도 있어서 불편없이 이용했어요 자주애용합니다 터미널 근처라 대중교통도 이용좋아요",5,2년 전
y_31_419,전주 화이트호텔,기*****,전주에 오래머물면서 주변에있는모텔들을 자주이용하는데 주차시설도 괜찮고 객실 침대랑 화장실이 깨끗했어요 이용하기 너무좋습니다 주변에도 시켜먹을곳이많아 고르는데 애먹었네요 다음에도 이용하겠습니다,5,1년 전
y_31_420,전주 화이트호텔,카미이,저는 가격대비 제가 다녀본 결과 가장 깨끗하게 관리하는 것 같으며 구석구석 다른곳에 비하여 청결하게 하려고 노력이 보이더군요 침구도 깨끗하고 개보수 많이 했더라구요 몇몇 곳을 제외 하고는 대체적으로 괜찬은편 입니다 간혹 겉만 번드르하고 내부는 냄세심하고 낡고 곳곳이 청소한 흔적만 낸 집들이 간혹 있습니다. 가성비 아주 괜찮습니다,5,3년 전
y_31_421,전주 화이트호텔,마이클조던볼링,"늦은 시간 방문했지만, 친절하게 안내 도와주셨고, 조식도 너무 맛있게 먹었어요~~~ 보일러도 따끈해서 너무 좋았습니다. 재방문 의사 있습니다!! 👍👍👍👍👍👍👍👍👍👍👍👍👍👍👍👍👍👍👍👍👍👍👍👍👍👍👍👍👍",5,3년 전
y_31_422,전주 화이트호텔,여행갈땐여기어때어때,가격도 싸고 시설도 좋아 편히 쉬다 갑니다. 주변에는 먹을곳도 많고 가까워 이동도 편해 좋았습니다. 모든면에서 최고라고 생각합니다. 사장님도 친절하고 다시 이지역에 오게되면 무조건 재방문 예정입니다.,5,3년 전
y_31_423,전주 화이트호텔,등따신곳찾는이,자주 애용하는 숙소입니다. 이용할 때마다 느끼지만 이름처럼 정말 깨끗합니다. 주차장이 있어 주차 편히 했습니다. 1층 데스크에 직원분이 예약확인 후 방키 주십니다. 엘레베이터 이용하여 방으로 이동~~~~ 방문 열자 마자 맡아보게 되는 방냄새~~ 그러나 역시 인위적인방향제 냄새도 없이 쾌적합니다. 샴푸/린스/바디워시/폼클렌징/수건과 비데 있는 장실. 물과 음료가 들어 있는 냉장고. 일회용품이 들어 있는 상자. 혹시나 해서 들춰보는 베개 그곳까지 깨끗하네요ㅋ 큰 티비와 넷플릭스까지!ㅋ 음식은 웬만한 곳 배민권이라 좋습니다 가성비갑오브갑수차차,5,1년 전
y_31_424,전주 화이트호텔,하늘스타나리,"숙박하게 될 때, 이곳이 이제 1순위가 되었네요. 너무 깨끗하고 좋았어요. 일단, 청소상태가 항상 잘되어 있어서 좋았고, 주차장도 충분하고, 로비에 있는 음료수도 좋았어요. 그리고 친절했었어요.",5,3년 전
y_31_425,전주 화이트호텔,비가내린새벽,사장님도 친절하시고 로비에 셀프음료대도 잘돼있어서 사용하는동안 불편함없이 부족함없이 잘 쉬었습니다. 한가지 아쉬운점은 모텔의 문제는 아니지만 낮시간대에는 주변에서 공사를 하고있어서 소음이 살짝있었네요,5,3년 전
y_31_426,전주 화이트호텔,등따신곳찾는이,"주차장이 있어 주차 편히 했어요. 고속버스터미널 주변이라 버스이용시에도 이용이 편할것같아요. 음식은 웬만한 곳 배민권이라 좋습니다. 친절한 응대와 방배정 받았습니다. 객실 문을 열고 들어갈 때 제일 먼저 맡게 되는게 냄새인데 쾌적했어요. 비흡연자라 담배냄새에 좀 민감한 편이거든요 시트와 커버는 청결했어요! 화장실도 깨끗했어요~ 샴푸,린스, 바디워시가 비치되어 있고 일회용품 가방도 있어서 불편없이 이용했어요 넓은 TV와 스타일러가 있어 좋았습니다",5,2년 전
y_31_427,전주 화이트호텔,등따신곳찾는이,"주차장이 있어 주차 편히 했어요. 고속버스터미널 주변이라 버스이용시에도 이용이 편할것같아요. 음식은 웬만한 곳 배민권이라 좋습니다. 친절한 응대와 방배정 받았습니다. 객실 문을 열고 들어갈 때 제일 먼저 맡게 되는게 냄새인데 쾌적했어요. 비흡연자라 담배냄새에 좀 민감한 편이거든요 시트와 커버는 청결했어요! 화장실도 깨끗했어요~ 샴푸,린스, 바디워시가 비치되어 있고 일회용품 가방도 있어서 불편없이 이용했어요 넓은 TV와 스타일러가 있어 좋았습니다",5,2년 전
y_31_428,전주 화이트호텔,엘리자벨스,위치도 좋고 깨끗하고 좋았습니다 다음에 또 기회가 된다면 다시 방문할 의향 있습니다! 그리고 사장님도 친절하시고 무엇보다 조식 나오는게 너무 좋았어요 출장 있으신분들께 정말 추천합니다!,5,2년 전
y_31_429,전주 화이트호텔,윤서현7,객실도 깨끗하고 직원분들도 친절해서 좋았습니다. 수건이 약간 오래된 느낌이 들었는데 그 부분빼고 다 좋았어요!,4,1년 전
y_31_430,전주 화이트호텔,항4,숙소 사진은 못찍었는데 트윈룸이었습니다 방 넓었고 청소상태 좋았습니다 수건도 넉넉했습니다 직원분도 너무 친절했습니다 방도 따뜻했습니다 수압은 좋았으나 샤워기 물온도가 왔다갔다했어요 그래도 괜찮았습니다 사진은 조식 사진인데 조식이 정말 잘 나왔어요 조식 잘안먹는데 여기는 정성들여 만들어주셔서 넘 맛있게 먹었습니다 다음에도 다시 이용하려구요~,5,3년 전
y_31_431,전주 화이트호텔,제주개그작가,"택시타고 가는데 설마 저기? 저기? 헐.... 이게 내 솔직한 심정 여기어때에 있는 사진은 밤에 야간이라 괜찮아보이지만 낮에가면 년식오래된 건물이나옴 관광호텔 이 의미를 여기서 알게됨 ㅋㅋㅋ 방은 넓은편 다만 창문열면 바로 도로앞이고 오래된 가구들 화장실도 넓은편이나 오래된건물이라서 낡은티가 남 화장실 변기가 작은데 비데를 껴놓아서 변기보다 튀어나온? 그렇게 안불편한데 변기도자기?부분이 앉으면 닿음 그리고 방에 놔둔 디퓨저냄새가 단 포도향이라서 더 싸구려처럼 느껴지던... 샴푸 린스도 오렌지향 과일을 좋아하시는듯, 좋은점은 조식은 빵아니면 라면을 만들어주는데 간단히 먹기좋음 다만 전주에 미식여행오신분들은 굳이? 먹을게많은뎁 가격대비 좀 실망스러움..",3,2년 전
y_31_432,전주 화이트호텔,MKMKS,첫 방문이라 큰 기대하지않았는데 청결하고 친절하셔서 너무 좋았어요. 다음 전주 갈때 또 방문할려구요 청결상태도 좋았어요. 대실후 숙박까지 끈어서 푹 잘쉬고 갑니다. 특히 침대시트 너무 좋음,5,3년 전
y_31_433,전주 화이트호텔,쉰하나사격,전주 화이트모텔~~~~~~~~~~ 출장 올때마다 항상~~~~~~~~~~~~ 찾는곳입니다~~~~~~~~~~ 주차장넓어서 주차하기편하고~~~~~~~~~~~~ 사장님 직원분다 친절하네요~~~~~~~~~~~,4,2년 전
y_31_434,전주 화이트호텔,쎄바스찬바하,조식은 못 먹어서 평가는 못하겠구요 일단 건물은 좀 노후 했는데 내부 리모델링ㄴ 약간 진행 한듯 보임 도로변에 있어서 차소리 약간 들리고 건물 연식 때문인지 약간의 냄새는 있어요 하지만 주변에 식당도 많고 주차 편이함,3,3년 전
y_31_435,전주 화이트호텔,적절한부대장,너무친절하고 숙박하시면 조식이 꽁짜,5,1년 전
y_31_436,전주 화이트호텔,효과적인비행기,아침에 주는 조식 맛있습니다 귯입니다 ㅎㅎ 잘쉬엇다 가요 ㅎㅎㅎㅎ 굿굿굿굿굿굿굿굿굿굿굿굿굿 아침에 주는 조식 맛있습니다 귯입니다 ㅎㅎ 잘쉬엇다 가요 ㅎㅎㅎㅎ 굿굿굿굿굿굿굿굿굿굿굿굿굿 아침에 주는 조식 맛있습니다 귯입니다 ㅎㅎ 잘쉬엇다 가요 ㅎㅎㅎㅎ 굿굿굿굿굿굿굿굿굿굿굿굿굿 아침에 주는 조식 맛있습니다 귯입니다 ㅎㅎ 잘쉬엇다 가요 ㅎㅎㅎㅎ 굿굿굿굿굿굿굿굿굿굿굿굿굿,5,1년 전
y_31_437,전주 화이트호텔,달빛찬란한,오픈 특가로 입실한 숙소여서 별 기대하고 가지는 않았는데 침구류며 객실 용품들이 대형 호뎰 수준이어서 깜짝 놀랐습니다. 추운 날씨에 중앙 난방이라 아주 따뜻한건 아니었지만 불편할 정도는 아니었어요. 룸도 좋았지만 조식이 훌륭했어요. 라면을 오천번 이상은 끓였을거라는 1층 카페 사장님의 정성스러운 조식은 너무 맛있었어요. 좋은 재료로 정성껏 만들어 주신 토스트는 너무 맛있어서 감탄을 자아냈습니다. 저렴한 숙박료에 조식 까지.. 최고였어요. 다시 숙박하고 싶은 호텔이네요.,5,2년 전
y_31_438,전주 화이트호텔,노선편집달인,건물 외관은 오래된 느낌은 있지만 안에 시설은 모두 깨끗했습니다 넷플릭스 잘나오며 티비도 엄청커서 만족했습니다 하나 단점은 화장실 변기가 좀 작고 비대가 커서 벨런스가 안맞습니다 ㅠ 그부분이 아쉽고 조식서비스 너무 마음에 들어요 ㅎㅎ 터미널 근처라 걸어오기도 편하며 주변에 밥집 편의점이 엄청많아서 다니기 너무 좋습니다 평점대비 가격도 싸고 추천합니다,5,2년 전
y_31_439,전주 화이트호텔,일괄적인샹크스,처음에는 그렇게 기대 안했지만.. 생각보다 좋은 곳이었어요! 출장와서 항상 방음이 문제였는데..조용하게 푸욱 잘잤습니다- 고사양 피씨도 있어서 게임도 좀 했네요ㅋㅋ 다음에도 이용할 의사 있습니당ㅎ,4,3년 전
y_31_440,전주 화이트호텔,김천누구,가성비 참좋아요 . . 요즘 이런가격 흔치 않아요. . 출장이 잦다보니 . . .약간씩 부족한부분은 눈에 띄지만 그래도 대체로 만족할만한 수준 이라고 생각되네요. . . . . .,4,3년 전
y_31_441,전주 화이트호텔,몽실몽실한다랑어,사장님은 너무 친절하시고 다만 화장실에 너무 청소가 안된것 같아요. 오즘 냄새하고 담배 냄새 엄청 많이 나요. ㅠㅠ 그거 빼고는 다 만족합니다. 그리고 조식도 맛있어요. 그래도 다음에 이용할께요~~~,4,3년 전
y_31_442,전주 화이트호텔,비가내린새벽,자주 숙박하다보니 이젠 내집처럼 편안합니다. 사장님도 친절하시고 로비에 얼음컵도 있어서 더워진날씨에 시원한 음료도 마실수있어서 좋습니다. 이번엔 제가 일정이 안맞아 조식을 못먹어서 많이 아쉽네요ㅠㅎ,5,3년 전
y_31_443,전주 화이트호텔,당진라일락,깨끗하고 수압도 쎄서 좋아요~ 넷플기본이라 시원하게 밀린 드라마보고 영화도 보고 피서가 따로없어요~ 최오 장점은 조식이 제공되는대 간단하면서도 정성이 느껴지는?? 아침 꼭 먹는 저는 제일 맘에든다는.,5,2년 전
y_31_444,전주 화이트호텔,바그다드강도,옆에 넓은 주차장도 이용가능하고 룸 컨디션도 좋고 터미널 근처 가성비 숙소로 갑 .,5,3년 전
y_31_445,전주 화이트호텔,d막시무스b,"무궁화 3개짜리 숙박업소로 시설이 깨끗하고 좋습니다 냉방도 잘 되어서 요즘처럼 더운날에도 쾌적하게 숙박할 수 있어요 전주 터미널에서 멀지도 않아서 접근성도 좋습니다 숙소 주변에 식당이랑 편의시설이 있어서 비지니스로 이용해도 좋아요 직원분들도 친절 하시고, 청결상태도 좋아서 다음에 또 이용 할 예정입니다 전주에 여행계획이 있거나 한옥마을 가려고 한다면 적극 추천 합니다",5,2년 전
y_31_446,전주 화이트호텔,우아한백포도주,위치가 너무 좋고 방도 쾌적하고 넓어서 이용하기 편했습니다.배달음식을 시켰는데 수저가 안와서 당황했지만 호텔 사장님께서 주셔서 너무 감사했습니다!,4,1년 전
y_31_447,전주 화이트호텔,메론빵은역시빠바,서비스 청결도 뭐 다 무난하게 좋았어요! 대실 시간이 긴편에 속하는 모텔이라 그 점이 좋아요. 티비 크고 잘 작동하고 피시도 게임 잘 돌아가네요. 일회용품 제공 잘 되구 냉장고에 물도 충분했어요.,5,1년 전
y_31_448,전주 화이트호텔,f우왕,"시설도 깨끗하고, 사장님, 직원분들도 너무 친절하십니다 침대도 좋고 잠도 잘오고 좋습니다 일때문에 이용한건데 다음에 또 오게 된다면 여기를 이용하겠습니다 잘 쉬고 갑니다!! 너무 만족합니다",5,1년 전
y_31_449,전주 화이트호텔,담홍색좀도둑,올때마다 느끼는 거지만 위치가 너무 좋습니다 모텔촌이 아니어서 분위기가 쾌적하고 주변에 맛집도 많아서 무척 편리합니다 객실도 넓고 조용해서 너무 만족합니다 게다가 조식까지 무료라니!!!,5,2년 전
y_31_450,전주 화이트호텔,탱글탱글한업그레이드,출장관계로 회사에서 전주고속 터미널 근처라고 해서 예약해 줘서 숙박하게 되었습니다. 우선 주차장은 넓어서 주차에는 불편함이 없을듯... 직원과는 별다른 대화없이 키만 받아서 친절도는 pass.. 시설은 무난하고 다음애도 재방문 의사 있게 하내요. 퇴실시간도 넉넉하고 아무튼 잘쉬었습니다..,5,2년 전
y_31_451,전주 화이트호텔,프리스프,적당히 넓고 청소상태도 괜찮았습니다 화장실은 살짝 오래된 느낌이긴 합니다 직원분은 친절하셨구요 잘 이용했어요,4,3년 전
y_31_452,전주 화이트호텔,흔쾌한연애,"화이트 관광호텔은 전주 종합경기장과 고속/ 시외 버스 터미널 사이에 위치하고있습니다 근처에 대학로도있어서 각종 배달에 편리하며, 호텔에서 3분거리내에 편의점도 있습니다. 호텔 1층 음식점에서 간단한 배달도 가능합니다 1층 로비에는 간단한 편의시설과 음료, 소모품등이 준비되어있습니다. 부족한 물품은 사장님께 말씀드리면 즉시 응대해주십니다. 도로 옆에 있어서 출입이 편리하며 고속/시외 버스 터미널과 가깝습니다. 마지막으로 사장님들이 정말 친절하십니다",5,1년 전
y_31_453,전주 화이트호텔,MKMKS,첫 방문이라 큰 기대하지않았는데 청결하고 친절하셔서 너무 좋았어요. 다음 전주 갈때 또 방문할려구요 청결상태도 좋았어요. 대실후 숙박까지 끈어서 푹 잘쉬고 갑니다. 특히 침대시트 너무 좋음,5,3년 전
y_31_454,전주 화이트호텔,김천누구,로비에 여분의 물도 있고. . . 커피자판기도 있는데 얼음 정수기도 있어서 아아 만들어 먹을수도 있고 . . 참 맘에들어요. 조식도 제공해주는데 저희는 라면을 먹을수 있었어요. . 좋아요,4,3년 전
y_31_455,전주 화이트호텔,적절한부대장,너무 너무 친절하시고 숙소가 아주 아주 깔끔합니다.,5,1년 전
y_31_456,전주 화이트호텔,당진라일락,리뷰가 좋아서 방문했는대요~ 깨끗하고 에어컨도 시원하고 수압도 괜잖아요~ 욕실이 넓어서 맘에 들어요~ 역시 도로가라 소음있어요~ 침대폭이 다른곳에 비해 좁더라고요ㅠ 그게 제일 불편했어요,4,2년 전
y_31_457,전주 화이트호텔,ksi,출장차 내려온 전주. 남자 두명이어서 트윈 예약하고 갔는데 주차도 편리하고 방 컨디션도 깔끔해서 매우 만족함. 주차도 편하고 직원도 친절하고 주변에 먹자골목까지는 아니지만 식사하기에도 편리했음. 착한가격 감사,5,1년 전
y_31_458,전주 화이트호텔,107세태양계,"오래된 모텔 느낌이 있지만 잘 묵고 왔어요 호텔어메니티도 필요한건 다있었고, 조식도 맛있었습니다 전반적으로 만족합니다 재방문의사100%!",5,3년 전
y_31_459,전주 화이트호텔,하늘스타나리,"화이트 호텔 또 이용하게 되었네요~^^ 일단 시설이 좋고, 깨끗해서 좋았습니다. 그리고 직원분들이 친절하였고, 아침 조식이 잘 나와서 너무 좋았습니다~^^! 또 이용할꺼 같애요~^^",5,3년 전
y_31_460,전주 화이트호텔,쉰하나사격,전주쪽으로~~~~~~~~ 출장갈때마다~~~~~~~~~~~~ 찾는곳입니다~~~~~~~~~~~~~~~~ 주차장넓어서 주차하기도 편하고~~~~~~~~ 직원분들 친절하고 방 깨끗하고 좋아요~~~~~~~~,4,2년 전
y_31_461,전주 화이트호텔,난잡한사탕무,"남자친구랑 방문했는데, 들어가보니까 티비도 굉장히 크고 좋았어요. 그리고 위치가 굉장히 좋았어요. 시외버스 터미널도 근처고 전북대도 근처고 다 근처라서 너무 좋았어요. 다음에도 방문할거 같아요.",5,3년 전
y_31_462,전주 화이트호텔,흑대지11,따듯하고 좋앗습니다 낮출장 대실하엿는데 역시 화이트호텔 깔끔하고 청결상태최고네요 ㅎㅎㅎㅎ 그리고 아쉬운점이 있다면 ㅜ 객실충전기가 잘안되네요 점검부탁드려요 항상감사히 쉬다갑니다요 ㅎㅎㅎ,5,2년 전
y_31_463,전주 화이트호텔,타*****,처음 들어갈 때 로비도 넓고 깨끗해서 기분 좋았는데 친절하신 사장님 덕분에 더 좋더라구요. 버스 시간까지 4시간 가량 남아서 대실 잠깐 이용했는데 방도 꽤 넓고 깨끗해서 편하게 쉬다가 퇴실했어요 ! 다음에 또 방문하겠습니다 !,4,2년 전
y_31_464,전주 화이트호텔,해안공원헌병,"너뮤 편하고 좋아요. 물도 음료도 언제든 편하기 꺼내갈 수 있게 로비에 놔주시고, 넷플 잘 되고 와이파이 잘 되고 뭐 시켜먹기 좋게 테이블도 크고, 관리 잘 되어있어서 애용합니다. 감사합니다 또 갈게요",5,3년 전
y_31_465,전주 화이트호텔,해안공원헌병,"항상 애용하는 호텔, 가성비 너무 좋고 친절해요 강추 입니다! 방도 따뜻하고 온수 잘 나오고, 에어컨도 빵빵해요 사장님도 친절하시니 완벽하죠! 전주 근처에서 가성비 호텔 찾으신다면 이용해보세요!",5,3년 전
y_31_466,전주 화이트호텔,하늘스타나리,"전주에서 호텔 이용할 일이 있을땐, 역시 여기가 너무 좋아요^^ 가격도 착하고, 깨끗해서 좋습니다. 냄새도 안나고, 청소상태도 항상 좋아요~^^ 앞으로도 깨끗하게 잘 부탁드려요~^^",5,3년 전
y_31_467,전주 화이트호텔,이벨리나,합리적인 가격에 늘 청결해서 기분좋게 이용합니다:),5,1년 전
y_31_468,전주 화이트호텔,적절한부대장,너무편안 함니다. 조용하고 침대가 좋습니다.,5,1년 전
y_31_469,전주 화이트호텔,여든한살공룡,"첫번째 방문이었는데, 정말 좋은 시간이었습니다!! 건물 입구에 들어가서부터 좋은 향기가 나고, 건물의 청결하며 위생적이었습니다~~!! 직원분이 건물 내부 관리를 신경 쓰고 있다는 것이 느껴졌고, 매우매우 친절하셔서 객실을 이용하기 전부터 기분이 좋았습니다. 방을 들어가고 나서 보니까, 이보다 더 좋을 수 없을 만큼 만족스럽고 좋았습니다!! 따뜻하고 아늑하면서도 위생적이며, 청결하게 잘 관리되어 있었습니다~~ 😄😄",5,2년 전
y_31_470,전주 화이트호텔,등따신곳찾는이,"화이트는 늘 굿입니다~ 전주고속버스터미널+시외버스터미널 인근이라 접근편하고 자차 이용시 주차장이 있어 편히 주차했습니다. 혹 식사시 음식은 웬만한 곳배민권이라 좋습니다. 사장님의 친절한응대와 방배정 받았습니다. 객실 문을 열고 들어갈 때제일 먼저 맡게 되는게 냄새인데 쾌적했어요. 비흡연자라 담배냄새에 좀 민감한 편이거든요 시트와 커버는 청결했어요! 화장실도 깨끗했어요~ 샴푸, 린스, 바디워시가 비치되어있고 일회용품 가방도 있어서 불편없이 이용했어요",5,1년 전
y_31_471,전주 화이트호텔,투스카니짱,깔끔 깨끗해요. 룸 업그레이드에! 티비 엄청 크고 좋고! 컴퓨터 게임도 많아 피씨방 같아요! 비데 깨끗하고! 담배 냄새 안나고! 친절하시고! 스타일러 짱 좋아요. 전주 오면 무조건 이제 화이트에요.,5,2년 전
y_31_472,전주 화이트호텔,디오44,전주 동물원을 가기위해 지내게 되었는데 근처에 장어집을 알게되어 더욱더 기억에 남습니다. 스탠다드 더블로 예약을 했는데 침대가 굉장히 작아서 퀸인지 킹으로 업그레이드 부탁하니 저렴하게 업그레이드 해주셔서 너무 감사합니다. 다음에도 재방문 의사 있습니다. 최고!!^^,5,3년 전
