id,name,nickname,review_content,rating,write_date
y_33_232,전주 와이케이,우언저쥬무,굿굿굿굿굿굿굿 굿 굿 굿 굿 굿 굿 굿 굿 듯 긋 굿 굿 구ㅛ 굿 슥 숙 굿굿굿굿굿굿굿 굿 굿 굿 굿 굿 굿 굿 굿 듯 긋 굿 구ㅛ 굿 슥 숙 굿굿굿굿굿굿굿 굿 굿 굿 굿 굿 굿 굿 굿 듯 긋 굿 굿 구ㅛ 굿 슥 숙 굿굿굿굿굿굿굿 굿 굿 굿 굿 굿 굿 굿 굿 듯 긋 굿 굿 구ㅛ 굿 슥 숙 굿굿굿굿굿굿굿 굿 굿 굿 굿 굿 굿 굿 굿 듯 긋 굿 굿 구ㅛ 굿 슥 숙 굿굿굿굿굿굿굿 굿 굿 굿 굿 굿 굿 굿 굿 듯 긋 굿 굿 구ㅛ 굿 슥 숙 굿굿굿굿굿굿굿 굿 굿 굿 굿 굿 굿 굿 굿 듯 긋 굿 굿 구ㅛ 굿 슥 숙 굿굿굿굿굿굿굿 굿 굿 굿 굿 굿 굿 굿 굿 듯 긋 굿 굿 구ㅛ 굿 슥 숙 굿굿굿굿굿굿굿 굿 굿 굿 굿 굿 굿 굿 굿 듯 긋 굿 굿 구ㅛ 굿 슥 숙 굿굿굿굿굿굿굿 굿 굿 굿 굿 굿 굿 굿 굿 듯 긋 굿 굿 구ㅛ 굿 슥 숙 굿굿굿굿굿굿굿 굿 굿 굿 굿 굿 굿 굿 굿 듯 긋 굿 굿 구ㅛ 굿 슥 굿 구ㅛ 굿 슥 숙 굿굿굿굿굿굿굿 굿 굿 굿 굿 굿 굿 굿 굿 듯 긋 굿 굿 구ㅛ 굿 슥 숙 굿굿굿굿굿굿굿 굿 굿 굿 굿 굿 굿 굿 굿 듯 긋 굿 굿 구ㅛ 굿 슥 숙 굿굿굿굿굿굿굿 굿 굿 굿 굿 굿 굿 굿 굿 듯 긋 굿 굿 구ㅛ 굿 슥 숙 굿굿굿굿굿굿굿 굿 굿 굿 굿 굿 굿 굿 굿 듯 긋 굿 굿 구ㅛ 굿 슥 숙 굿굿굿굿굿굿굿 굿 굿 굿 굿 굿 굿 굿 굿 듯 긋 굿 굿 구ㅛ 굿 슥 숙 굿굿굿굿굿굿굿 굿 굿 굿 굿 굿 굿 굿 굿 듯 긋 굿 굿 구ㅛ 굿 슥 숙 굿굿굿굿굿굿굿 굿 굿 굿 굿 굿 굿 굿 굿 듯 긋 굿 굿 구ㅛ 굿 슥 숙 굿굿굿굿굿굿굿 굿 굿 굿 굿 굿 굿 굿 굿 듯 긋 굿 굿 구ㅛ 굿 슥 숙 굿굿굿굿굿굿굿 굿 굿 굿 굿 굿 굿 굿 굿 듯 긋 굿 굿 구ㅛ 굿 슥 굿 구ㅛ 굿 슥 숙 굿굿굿굿굿굿굿 굿 굿 굿 굿 굿 굿 굿 굿 듯 긋 굿 굿 구ㅛ 굿 슥 숙 굿굿굿굿굿굿굿 굿 굿 굿 굿 굿 굿 굿 굿 듯 긋 굿 굿 구ㅛ 굿 슥 숙 굿굿굿굿굿굿굿 굿 굿 굿 굿 굿 굿 굿 굿 듯 긋 굿 굿 구ㅛ 굿 슥 숙 굿굿굿굿굿굿굿 굿 굿 굿 굿 굿 굿 굿 굿 듯 긋 굿 굿 구ㅛ 굿 슥 숙 굿굿굿굿굿굿굿 굿 굿 굿 굿 굿 굿 굿 굿 듯 긋 굿 굿 구ㅛ 굿 슥 숙 굿굿굿굿굿굿굿 굿 굿 굿 굿 굿 굿 굿 굿 듯 긋 굿 굿 구ㅛ 굿 슥 숙 굿굿굿굿굿굿굿 굿 굿 굿 굿 굿 굿 굿 굿 듯 긋 굿 굿 구ㅛ 굿 슥 숙 굿굿굿굿굿굿굿 굿 굿 굿 굿 굿 굿 굿 굿 듯 긋 굿 굿 구ㅛ 굿 슥 숙 굿굿굿굿굿굿굿 굿 굿 굿 굿 굿 굿 굿 굿 듯 긋 굿 굿 구ㅛ 굿 슥 숙,5,2년 전
y_33_233,전주 와이케이,이구역의방랑자,좋아용 좋아용 좋아용좋아용 좋아용 좋아용 좋아용 좋아용좋아용 좋아용 좋아용 좋아용 좋아용좋아용 좋아용 좋아용 좋아용 좋아용좋아용 좋아용 좋아용 좋아용 좋아용좋아용 좋아용 좋아용 좋아용 좋아용좋아용 좋아용 좋아용,5,3년 전
y_33_234,전주 와이케이,격렬한부대장,좋아요!! 좋아요!! 좋아요!! 좋아요!! 좋아요!! 좋아요!!좋아요!! 좋아요!! 좋아요!! 좋아요!! 좋아요!! 좋아요!!좋아요!! 좋아요!! 좋아요!! 좋아요!! 좋아요!! 좋아요!!,5,4년 전
y_33_235,전주 와이케이,하얀큥야,자주 이용하는 곳인데 쾌적하고 내부도 깔끔하니 아주 좋아요!! 대실도 저렴한 편이고 계속 이용 할 거 같아요,5,2년 전
y_33_236,전주 와이케이,knp123,👍👍👍👍👍👍,5,6년 전
y_33_237,전주 와이케이,knp123,👍👍👍👍👍👍,5,6년 전
y_33_238,전주 와이케이,또보겠지,항상 이용하는 곳이에요~ 금연방 요청드려서 쾌적하게 쉬고왔어요. 지금까지 이용한 횟수 세어보니까 약 30회 정도 되네요ㅋㅋㅋㅋ 거의 아지트느낌.. 들어가면 이제 내집 처럼 편안해요 ㅎ,5,2년 전
y_33_239,전주 와이케이,남색서바이벌조교,우선 먼저 금연룸 흡연룸 나눠주시는 게 너무 좋았고요 내부도 깔끔하고 좋았습니다 다만 장점이자 단점인게 위치가 좋긴한데 너무 한가운데라 ㅋㅋㅋ 그것 말고는 가격도 좋고 앞으로도 자주이용할거 같네요,5,2년 전
y_33_240,전주 와이케이,개꿀장소에만등장,"🏩 진짜 장난 아닙니다.. 엄청나게 현실적인 후기 씁니다용 전주 여러 곳 머물러봤지만, 침구 엄청 좋구요 !! 다른 곳은 엄청 가렵고 조금만 움직여도 바스락 거릴 때 있어서 잠 못자고 나온 적 많은데ㅡㅡ 여기는 절대 아니예요 남자친구가 불편하면 몸에 알레르기 올라오고 잘 못 자고 뜬 눈으로 새는데 새벽 5시에 자서 12시 반에 약속이라도 한 듯 깼는데.. 진짜 개쩔어욤.. 거의 기절했다 깬 수준으로 잘 자버렸습니다.. 위치도 덕진공원 쪽 아니고 북대 쪽에 있어서 밥 먹고 주변 빙수집 갔다가 다시 들어오기 너무 좋았어요 ! 장미맨숀 건물이여서 처음엔 엥 뭐지 이런데에 숙박이 있나 하고 들어갔는데 엘레베이터 5층 딱 내리자마자 무슨 엄청 잘 꾸며놓은 게스트하우스인 줄 ㅠㅠㅠ 키 받구 방 들어가는데 창이 커서 후끈하고 더웠는데 에어컨 켜니 너무 시원하고 지상낙원이 따로 없었습니다 진짜!!! 그리고 술집가는 척 엘레베이터 타고 들어가는 거여서 남자친구랑 들어가는데 민망하지도 않더라구요 .. 헤헤 다른 곳들은 거의 덕진광장 쪽에 있어서 여름에 조금만 걸어도 힘들고 오래되고 들어가자마자 담배냄새나고 그렇단 말이죵.. 저희는 비흡연자여서 진짜 스트레스 받아가면서 다닐 때마다 향수 들고다녔는데 여긴 냄새는 1조차 안나고 그냥 청ㅡ결 그 자체입니다 인스타에 동영상 올렸더니 친구들이 여기 대체 어디냐고 전주에 이런 곳이 있냐면서 완전 물어봐서 다 대답해줬어요 ㅎㅎ!! 💌 일단 체크인 4시 체크아웃 1시인 점에서 개꿀이고, 창 개큰데 앞에 높은 건물 없어서 하늘이 내 세상같고, 현장결제 (시 학생증 할인 가능!) 10번 하면 숙박 1회 무료이고, 왓차 티빙 넷플릭스 유튜브 다 되고 시원하고 침대 넓고 화장실 문으로 닫을 수 있고ㅠㅠ 개좋고 깔끔하고 제발 꼭 가라ㅠㅠㅠ!!! 라면서 대답했더니 전주에 이런 곳이 있냐고 남자친구랑 꼭 가겠다그러고 제발 오라고 막 설명하니까 무슨 그 모텔 사장님이냐면서..^^ 홍보대사냐고 ㅋㅋㅋㅋㅋㅋ 그 만큼 제발 왔으면 좋겠더라구용 전주에 이런 곳은 제발 널리 알려져서 유명해졌으면 ㅠㅠ 💌 집에선 창문 밖 잘 내다보지도 않는데 여기선 햇빛쬐서 더운데도 커튼 계속 열고 ㅋㅋㅋㅋ 남자친구는 탄다고 닫으라그러고 거의 창과 방패였습니다 ㅎㅎ 💌 그리고 사장님이신지!!? 엄청 친절하셔용 엄청 !! 배달 일회용품 부탁드렸는데 안와서 5층 인포 가서 부탁드렸더니 바로 찾아서 주시더라구요..!! 걱정했는데 그냥 감동받고,, 떡볶이 먹을 수 있어 다행이고 그랬습니답 ㅎㅎ 💌 진짜 굳이굳이 단점을 꼽자면.. 리모컨이 잘 안눌려요..ㅜㅜ 정말 손톱이 너무 아플 정도로 눌러도 안먹었어요ㅜㅜㅜ 제가 리모컨 조작 방법을 몰랐던 걸까용.. 외부입력은 정말 잘 안눌렸는데 에어컨은 처음에 안눌리는 줄 알고 더운 날 너무 화나서 18도까지 올려두고있다가 너무너무 추워서 끄려고 하니깐 눌리질않더라구요 !!! 그렇게 오들오들 떨다가 그냥 코드를 뽑았습니당 ㅎㅎ 그리고 더워서 다시 틀고 조작하려하니.. 리모컨에 있는 에어컨 전원 버튼을 누르고 하면 되게 잘 되더라구용... 💌 저랑 남자친구는 머무르는동안 정말 너무너무 좋았어요 시간 꽉 채워서 있다가 왔는데 처음엔 55000 하룻밤인데 가격이 너무 쎈 거 아냐 하고 돈 아까울까봐 걱정했는데, 막 서울에 엄청 좋은 창 큰 오피스텔 같아요 ㅋㅋㅋㅋ너무 청결하고 방음도 잘 되고 볼 것도 많고 저는 진짜 앞으로 계속 가서 10번 채울 생각이예요 ㅎㅎ 진짜 너무좋음 ㅜㅜ 🏩 다들 기념일이나 기분 내고 싶을 때 꼭 !! 스카이뷰 가세여 진짜 꼬오오옥 정말 너무너무 잘 놀다 갑니다.. 💖💖",5,4년 전
y_33_241,전주 와이케이,흔쾌한연애,"근처에 올리브영, 코노, 토이박스, 다이소, 당구장,편의점, 음식점, 술집 등등 굉장히 많습니다. 방도 넓고, 청결도 또한 좋았습니다. 그외에 간단한 스백바가 있어, 이용하시기 편리합니다 테라스처럼 공간이있고, 의자와 태이블이있어 날씨만 괜찮다면 이용해보는것도 좋습니다. 수압이 좋아씻을때 기분이 좋습니다. 침대엔 전기장판이있어 따뜻하게 잘 수있었습니다. 실장님께서 정말 친절하시고, 여러 문의 사항에대해 잘 안내해주십니다. 다음에 재방문 의사 있습니다.",5,1년 전
y_33_242,전주 와이케이,모험심있고확실한구리,"일단 저희 커플은 전주를 처음 가봤습니다. 처음에는 여기어때에서만 예약해서 5,6층 한건물위에 있는지 몰랐네요. 룸은 5000원 더주고 배쓰있는 방으로 옮겼는데요. 담배냄새가 안나는 점 (금연이더군요) , 방음이 괜찮은 점, 깔끔하고 , 좋았습니다. 사장님이 친절하시구요. 제가 1시간 연장하고 한번더 했는데 그럴꺼면 10시까지 있어도 좋다고 해주셔서 넘 감동 먹었습니다. 날씨도 비가 와서 그런지 많이 몸이 무겁고 해서 배달시켜먹고 잠깐 잠들었는데. 시간이 잘 가더라구요. 아무튼 배려해주셔서 호텔은 물론 전주에 대해서도 좋은 인상 받았습니다! :) 여자친구도 감덩이래여>_< 또 들릴게요 사장님 -- **",5,1년 전
y_33_243,전주 와이케이,흔쾌한연애,"근처에 올리브영, 코노, 토이박스, 당구장, 편의점, 음식점, 술집 등등 굉장히 많습니다. 사장님께 문의사항이 있을때 전화하면, 친절하거 응대해주십니다. 방도 넓고, 청결도 또한 좋았습니다. 렌즈액을 안가져가서 있는지 물어봤는데, 사장님께서 바로 준비해주셨습니다. 그외에 간단한 스백바가 있어, 이용하시기 편리합니다. 테라스처럼 공간이있고, 의자와 테에블이있어 날씨만 괜찮다면 이용해보는것도 좋습니다. 침대엔 전기장판이있어 따뜻하게 잘 수 있습니다.",5,1년 전
y_33_244,전주 와이케이,흔쾌한연애,"근처에 올리브영, 코노, 토이박스, 당구장, 편의점, 음식점, 술집 등등 굉장히 많습니다. 사장님께 문의사항이 있을때 전화하면, 친절하게 응대해주십니다. 방도 넓고, 청결도 또한 좋았습니다. 렌즈액을 안가져가서 있는지 물어봤는데, 사장님께서 바로 준비해주셨습니다. 그외에 간단한 스낵바가 있어, 이용하시기 편리합니다. 테라스처럼 공간이있고, 의자와 테에블이있어 날씨만 괜찮다면 이용해보는것도 좋습니다 침대엔 전기장판이있어 따뜻하게 잘 수 있습니다.",5,1년 전
y_33_245,전주 와이케이,흔쾌한연애,"근처에 올리브영, 코노, 토이박스, 다이소, 당구장, 편의점, 음식점, 술집 등등 굉장히 많습니다. 사장님께 문의사항이 있을때 전화하면, 친절하게 응대해주십니다. 방도 넓고, 청결도 또한 좋았습니다. 그외에 간단한 스백바가 있어, 이용하시기 편리합니다 테라스처럼 공간이있고, 의자와 태이블이있어 날씨만 괜찮다면 이용해보는것도 좋습니다. 수압이 좋아 씻을때 기분이 좋습니다. 침대엔 전기장판이있어 따뜻하게 잘 수 있습니다. 다음에 재방문 의사 있습니다.",5,1년 전
y_33_246,전주 와이케이,흔쾌한연애,"근처에 올리브영, 코노, 토이박스, 다이소, 당구장, 편의점, 음식점, 술집 등등 굉장히 많습니다. 사장님께 문의사항이 있을때 전화하면, 친절하게 응대해주십니다. 방도 넓고, 청결도 또한 좋았습니다. 그외에 간단한 스백바가 있어, 이용하시기 편리합니다 테라스처럼 공간이있고, 의자와 태이블이있어 날씨만 괜찮다면 이용해보는것도 좋습니다. 수압이 좋아 씻을때 기분이 좋습니다. 침대엔 전기장판이있어 따뜻하게 잘 수 있습니다. 다음에 재방문 의사 있습니다.",5,1년 전
y_33_247,전주 와이케이,흔쾌한연애,"근처에 올리브영, 코노, 토이박스, 다이소 당구장, 편의점, 음식점, 술집 등등 굉장히 많습니다. 방도 넓고, 청결도 또한 좋았습니다. 그외에 간단한 스백바가 있어, 이용하시기 편리합니다 테라스처럼 공간이있고, 의자와 태이블이있어 날씨만 괜찮다면 이용해보는것도 좋습니다 수압이 좋아씻을때 기분이 좋습니다. 침대엔 전기장판이있어 따뜻하게 잘 수있었습니다. 실장님께서 정말 친절하시고, 여러 문의 사항에대해 잘 안내해주십니다. 실장님 아이디어가 너무 좋아요. 수건따로 나와있으니 편하게 가져가세요. 다음에 재방문의사 있습니다.",5,1년 전
y_33_248,전주 와이케이,흔쾌한연애,"근처에 올리브영, 코노, 토이박스, 다이소 당구장, 편의점, 음식점, 술집 등등 굉장히 많습니다. 방도 넓고, 청결도 또한 좋았습니다. 그외에 간단한 스백바가 있어, 이용하시기 편리합니다 테라스처럼 공간이있고, 의자와 태이블이있어 날씨만 괜찮다면 이용해보는것도 좋습니다 수압이 좋아씻을때 기분이 좋습니다. 침대엔 전기장판이있어 따뜻하게 잘 수있었습니다 실장님께서 정말 친절하시고, 여러 문의 사항에대해 잘 안내해주십니다. 실장님 아이디어가 너무 좋아요. 수건따로 나와있으니 편하게 가져가세요. 다음에 재방문의사 있습니다",5,1년 전
y_33_249,전주 와이케이,흔쾌한연애,"라지 예약했지만, 사장님께서 비즈니스로 업그레이드 해주셨습니다. 덕분에 좋은 시설을 저렴한 가격으로 이용해볼수있었습니다. 근처에 올리브영, 코노, 토이박스, 당구장, 편의점, 음식점, 술집 등등 굉장히 많습니다. 사장님께 문의사항이 있을때 전화하면, 친절하거 응대해주십니다. 방도 넓고, 청결도 또한 좋았습니다. 렌즈액을 안가져가서 있는지 물어봤는데, 사장님께서 바로 준비해주셨습니다. 그외에 간단한 스백바가 있어, 이용하시기 편리합니다. 테라스처럼 공간이있고, 의자와 테에블이있어 날씨만 괜찮다면 이용해보는것도 좋습니다 침대엔 전기장판이있어 따뜻하게 잘 수 있습니다.",5,1년 전
y_33_250,전주 와이케이,흔쾌한연애,"근처에 올리브영, 코노, 토이박스, 다이소 당구장,편의점, 음식점, 술집 등등 굉장히 많습니다. 방도 넓고, 청결도 또한 좋았습니다. 그외에 간단한 스백바가 있어, 이용하시기 편리합니다 테라스처럼 공간이있고, 의자와 태이블이있어 날씨만 괜찮다면 이용해보는것도 좋습니다 수압이 좋아씻을때 기분이 좋습니다. 침대엔 전기장판이있어 따뜻하게 잘 수있었습니다. 실장님께서 정말 친절하시고, 여러 문의 사항에대해 잘 안내해주십니다. 다음에 재방문 의사 있습니다.",5,1년 전
y_33_251,전주 와이케이,다소곳한계란,전주 출장 올때 자주 왔습니다. 앞에 덕진수영장도 있고 병원도 가깝고 전북대 근처라서 맛집도 많고 위치와 접근성이 좋아요. 여자 사장님 항상 친절하고 좋아요. 건물 자체가 오래 돼서 처음에는 망설여졌는데. 안에는 깨끗하고 인테리어가 좋아요. 비즈니스 객실은스타일러도 있어서 옷 잘 관리할수 있어 좋습니다. 침구도 깔끔하고 침대가 크고 푹신해요. 코너 쪽방은 꽤 밖에 소리가 많이 들어와서 잠귀예민하신붐들은 코너쪽 방 말고 이런 복도 쪽 방으로 예약하시면 훨씬 좋을거 같아요.,5,1년 전
y_33_252,전주 와이케이,아라민찐마미,"다음은 와이케이에 대한 후기입니다.  * ""가격이 저렴하고, 위치가 좋고, 편의시설이 잘 갖추어져 있어 만족했습니다."" * ""전주여행 가는 분들에게 좋은 선택입니다."" * ""다음에 전주에 갈 때도 꼭 다시 이용하고 싶습니다.""  전주와이케이는 가격이 저렴해 학생들에게도 좋은 선택입니다. 가격이 저렴하고, 위치가 좋으며, 편의시설이 잘 갖추어져 있습니다. 지식인 보다는 업체의 홈페이지에 남겨진 후기를 참고하시는게 조금 더 도움이 되실 겁니다객실에는 에어컨, 냉장고, TV 등의 기본적인 시설이 갖추어져 있습니다.",5,1년 전
y_33_253,전주 와이케이,아라민찐마미,와이케이호텔에는 5층에 조식 공간이 마련되어 있음 AM 7 시 아홉시까지 이용가능하다고 안내되어 있네요 ㅎ 다른 숙소에 비하면 조식 음식의 종류도 다양하고 좋은 것 같음 깔끔한 화장실 굿! 따뜻한 물도 잘나오고 수압도 문제없고 욕조가 있었는데 욕조의 크기가 커서 좋음 근데 가끔 냄새나는 객실도 있었음 그래도 나름객실이 굉장히 청결했고 객실 자체가 넓어서 좋았음 침대도 적당히 푹신하고 침구류도 깨끗 했음넓고 깨끗한 와이케이호텔의 객실 서비스에 굿굿 사장님도 친절하고 좋았음,5,1년 전
y_33_254,전주 와이케이,11235724,진짜 정말 좋았어요 ㅎㅎ 비록 기대했던 스카이뷰를 보지는 못했지만 ㅎㅎ 호텔측에서 빠른 대쳐 해주셔서 덕분에 바로 결정하고 예약한 날을 편히 쉴수있었던거 같아요. 라지룸도 많이 넓더라구요 . 또한 담배냄새가 하나도 나지 않았어요. 그게 가장 만족스러웠던거 같아요. 매번 담배냄새 때문에 카운터가서 방 바꿔달라고 하기도 뭐해서 매번 참고 넘어가는 것이 다반사였는데... 여기는 진짜 그런걱정 할 필요가 없더라구요. 또한 바로 옆에 편의점도 있고 같은 건물에 방탈출 및 장미맨숀이 있어서 편의성고 재미도 많구요 ㅎㅎ 바로앞에 북대이니 저녁에 무언가 시켜먹기에도 좋고 산책을 하고 싶다면 덕진공원이 있으니 너무 좋더라구요 ㅎㅎ 진짜 방도 깨끗하고 너무 좋았어요 또한 아침 조식 ㄹㅈㄷ ㅎㅎ 사진을 보시면 아시셌지만 신경을 많이 써주셔서.. 남친이랑 저 배터지는 줄 알았어요 ㅠㅠ 진짜 정말 감사합니다 ㅎㅎ 앞으로도 잘 유지 하셨으면 좋겠어요 ㅎㅎ,5,4년 전
y_33_255,전주 와이케이,공쥬여신님이다,숙소 들어가자마자 바닥이 따뜻해서 정말 좋았습니다!!!! 전기장판도 있어서 좋았는데 온도 조절이 잘 안되는 거 같아요 ㅜㅜ 1로만 해도 너무 뜨거웠어요...ㅎ 그래도 깨끗하고 담배냄새 안나서 너무 줗았습니다~~~ 아 그리고 덕진공원이랑도 가까워서 좋았어요 숙소도 방음 잘되는 거 같아서 만족합니다!!!!!숙소 들어가자마자 바닥이 따뜻해서 정말 좋았습니다!!!! 다음에 또 전주오면 여기서 숙박할게요~~~~ 깨끗하고 깔끔합니다!!!!!좋아요~~~~~,5,1년 전
y_33_256,전주 와이케이,77세장갑,자주 이용합니다 접근성 매우 좋으며 객실 깨끗합니다 정리가 잘 되어있습니다 스타일러 사용했는데 냄새 안나고 깔끔합니다 숙소나설때 기분이 산뜻해서 좋아요 자주 이용합니다 접근성 매우 좋으며 객실 깨끗합니다 정리가 잘 되어있습니다 스타일러 사용했는데 냄새 안나고 깔끔합니다 숙소나설때 기분이 산뜻해지네요 전기장판 따뜻 카운터도 항상 친절하게 응대해주십니다 발코니가 따로 있는점도 좋아요 감사합니다 또 이용의사있어요 자주 이용합니다 접근성 매우 좋으며 객실 깨끗합니다 정리가 잘 되어있습니다 스타일러 사용했는데 냄새 안나고 깔끔합니다 숙소나설때 기분이 산뜻해지네요,5,1년 전
y_33_257,전주 와이케이,아무렇지않은폭스하운드,여기는 전북대 먹거리랑가깝구 숙소가 뷰가엄청좋아요 침대도푹신하구요 모든배달음식도 금방오구요너무좋아요 그런데 주차할때 들어가는공간이너무작아요ㅠ 그리고 방이추워요 라제이터있기는한데엄청춥네요 그거빼고는최고입니다,5,3년 전
y_33_258,전주 와이케이,내일도여기로,객실의 컨디션도 깔끔하고 침구류도 푹신하고 적 당히 좋았습니다!!특히 화장실이 너무 깔꼼해서 좋아요 위치도 전 북대 바로 근처라 술마시 고 오기도 넘 좋고 이동 시에도 위치가 아주 굳굳 가격대비 정말 좋은 선택인것같아요 객실의 컨디션도 깔끔하고 침구류도 푹신하고 적 당히 좋았습니다!!특히 화장실이 너무 깔꼼해서 좋아요 위치도 전 북대 바로 근처라 술마시 고 오기도 넘 좋고 이동 시에도 위치가 아주 굳굳 가격대비 정말 좋은 선택인것같아요 자주 이용합니다. 재방문 가능입니다,4,1년 전
y_33_259,전주 와이케이,공혬,스카이뷰라고 해서 갔는데 음.. 딱히 잘 모르겠어요 그냥 보이는 뷰는 이렇구요.. 그냥 볼 거 없으니 차라리 일반 방 가시는 걸 추천.. 합니다... 유리도 더러워요.. ㅠㅠㅠ 닌방은 저걸로 하는데 좀 불편하지만 그나마 따뜻하게 잔 거 같네요! 그리고 샤워가운에서 너무 걸레 냄새? 같은 게 나서 빼고 안 입었습니다.. 그래도 그냥 가볍게 쉬거나 스카이뷰에 환상이 없는 분들은 잘 쉬고 가실 거 같아요! 번화가에 있어서 술집 접근성이 높아용,4,2년 전
y_33_260,전주 와이케이,앵*****,매일 출석하는 와이케이ㅎㅎ 오랜만에 가도 매일 가도 역시 좋은..! 깨끗하고 따뜻해서 진짜 편해요 대실 시간 22시까지 늘려주셨으면 예약이 좀 더 수월할 것 같긴 합니다ㅠㅠㅠ 강추!!!,5,2년 전
y_33_261,전주 와이케이,아라민찐마미,따뜻하고 방음도 잘되고 너무 너무 좋았어요 갈 때 마다 사장님이 친절하게 대해주셔서 너무 감사하고 수압도 좋고 뭐 하나 빼놓을게 없어요~~~~~이 금방에선 여기가 가장 깨끗하고 좋은것 같아요 ! 여기 말고 다른 곳은 몸에 알러지가 일어나거나 하자가 많고 담배냄새도 나는데 여기는 그러지도 않습니다 적극 추천입니다 ~~,5,1년 전
y_33_262,전주 와이케이,찐쎔후야,"가격대비 쾌적하고 깔끔하고 좋았으며. 업무 때문에 방문했는데 사실 집아닌 다른잠자이 불편해하고 싫어하는데 덕분에 좋은환경에서 출장왔다가 잘쉬다갑니다. 담에 근처 출장올일 생기면 다시이용해야겠네요,",5,3년 전
y_33_263,전주 와이케이,익산신도시,"시설 좋아요 자주 최근에 이용을 했습니다. 냄새도 담배냄새 안났어요 그리고 뭐냐 에어컨도 시원했어요 냉장고도 작동이 잘되서 물이 시원해요 티비도 잘나와요 냇플릭스가 없는건 아쉬웠어요 컴퓨터도 잘돼요, 방이 엄청 따뜻해요 에어컨도 잘 돼요 화장실도 따뜻한 물 잘 나오고 변기 수압도 좋아요, 직원분들이 친절하고 안내도 잘 해줘서 기분이 좋아요 앞으로도 또 오고싶어요",5,2년 전
y_33_264,전주 와이케이,아라민찐마미,거의 2주에 한번씩 이용하고 있습니다 모두 완벽하고 사장님도 정말 친절하십니다 !! 근데 항상 피곤해 보이셔서 조금 걱정 입니다 항상 감사드리고 앞으로도 많은 이용하겠습니다 ^^^^^^,5,3년 전
y_33_265,전주 와이케이,일흔두살다랑어,일단 인테리어 특히 쇼파랑 테이블 예뻤고 침구도 보송보송하고 화장실 베란다? 전부 깔끔했어요 상가건물 위쪽숙소고 주차장 들어가면서 걱정 많았는데 막상 들어가서는 진짜 맘에 쏙 들었어요 그 가격에 베란다까지 있고 흡연도 베란다에서하니까 훨씬 청결했던거같아요 담배냄새도 안나고요 하지만 청결에서 별 하나 뺐는데 왜냐면 종이컵 두개 포개져있었는데 그 사이에 누가 껌을 뱉어놓고 갔더라고요 ㅡㅡㅋㅋㅋ 그리고 커피포트 바닥?에 정체모를 얼룩이 있었는데 말씀드리니 씻어서 주셨어요 하지만 지워지진않더라고요 ㅠㅠ 그래도 로비에 정수기 있어서 불편하진않았어요 여러모로 너무 맘에 든 숙소였어요 ^^,5,5년 전
y_33_266,전주 와이케이,아라민찐마미,담배냄새가 나서 방 바꿔 달라고 했는데 바로 바꿔주시고 직원분이 너무 친절하시네요 ~~~~~~ 근데 삼십분전에 전화 하는건 조금 별로에요 ....그건 미리 사전에 말씀 해주시는게 좋은 것 같네요~,5,4년 전
