id,name,nickname,review_content,rating,write_date
y_33_419,전주 와이케이,진격의거어인,객실상태도 좋아요 담배필수있게 베란다 있는게 좀 특이했습니다.,5,3년 전
y_33_420,전주 와이케이,남해대교진달래,금연방이라 너무 좋았어요. 전기장판 있어서 따듯하게 잤어요. 욕실 하수구 냄새 조금 났지만 괜찮아요,4,5년 전
y_33_421,전주 와이케이,재파리짱,연박햇더니 추가비용 2만오천원달라더군요 보통다른대는 만원받는데 그리고 처음에예약한방이없엇는지 더좋은방으로주신다고해서 짐두고 바로나왓습니다 전화가와서 그방에 보일러가터져서 공사를해야한다는데 짐을빼서 다른방으로놓겟다고.. 그러려니햇죠? 저희가볼땐 대실한방이 나와서 원래방으로 바꿔주신듯한느낌인데 별로였어요 진짜공사를해야해서 방을비워달라고햇을까요?? 글고새벽에 2시쯤 전화가와서받으니 잘못전화햇다네요;;잠다깨우고 뭐하는짓인지 ㅡㅡ.. 아무튼 별로였어요~~,2,6년 전
y_33_422,전주 와이케이,실없는천왕성,다른 모텔보다 일단 깔끔하고 청결도도 좋았어요 방도크고 넷플릭스도 어렵지않게 틀어서 볼수있는게 좋았고 기본3시간인대실이 4시간이어서 조금더 여유롭게 쉬다올수있던게 장점인거같아요 재방문의사있습니다,5,3년 전
y_33_423,전주 와이케이,푸른하락,직장이 근처라 몇 번 이용했었는데 편하고 시끄럽지 않아서 좋았어요 화장실 상태도 깨끗하고 침대도 깨끗해서 좋았어요 ! 태라스에서 흡연할 수 있어서 방에 냄새가 안 베는 게 최대 장점인 것 같아용,5,2년 전
y_33_424,전주 와이케이,스물여덟살중대원,방도 깔끔하고 담배냄세도 안나서 편하게 잘 쉬다가여 넷플릭스도 잘 나오고 쇼파랑 테이블도 있어서 잘 사용하다가요 욕실 샤워기 수압이 조금 약한게 아쉬웠는데 그래도 깔끔해서 기분좋게 이용했어요,5,2년 전
y_33_425,전주 와이케이,15084195,대실시 시간으로 문제가 있었는데 그래도 끝까지 친절하게 대해주셔서 감사했습니다. 룸컨디션은 모텔보다는 낫습니다. 방도깨끗하고 화장실도 괜찮아요. 북대한가운데에 위치해있고 여러모로 괜찮습니다.,5,3년 전
y_33_426,전주 와이케이,녹색아욱국,좋아요 와이케이!! 북대는 역시 와이케이! 깨끗하고 담배 냄새도 안 나고 친절합니다!!!!! 그리고 침대에 장판도 틀 수 있어서 ㅠㅠ 편히 쉴 수 있어서 좋아요 ㅎㅎ 다음에 또 이용할게요,5,2년 전
y_33_427,전주 와이케이,조철환,방도 깔끔하게 정리되어 있고 욕실도 깨끗해서 좋았습니다,5,3년 전
y_33_428,전주 와이케이,낙랑파라,친절하시고 주차도 지하에 할수 있어서 좋았습니다 방 컨디션도 좋고 북대에서 이 위치에 이 가격이면 아주 훌륭하네요 ㅎㅎㅎㅎㅎㅎㅎㅎㅎㅎ 전주 올때마다 들려야겠습니다 번창하세요 감사합니다,5,2년 전
y_33_429,전주 와이케이,공감하고배려있는달,난방이 잘되면 좋을듯해요,4,1년 전
y_33_430,전주 와이케이,호호불어먹어,여기는 항상 자주 애용하는 곳입니다 룸 컨디션과 주변 상권 놀거리가 아주 좋습니다 다음에 또 이용하겠습니다 ㅎㅎㅎ 특히 술마시러 왔을 때 좋았습니다 다음에 이용할 때는 더 좋은방을 선택할게요!,5,2년 전
y_33_431,전주 와이케이,스물셋마당,대학로와 가깝고 좋습니다,5,2년 전
y_33_432,전주 와이케이,seeeeee,위치도 너무 좋고 깨끗해요,5,1년 전
y_33_433,전주 와이케이,dkqk130,전에 대실했다가 너무 맘에 들어서 숙박예약했습니다. 매우 만족!!,5,1년 전
y_33_434,전주 와이케이,11765843,"우선 실수로 예약을 잘못했는데 여기어때 고객센터 측과 원만하게 대화에 응해주시고 서비스 제공해주신 점에 대해서 무척 감사하다는 말씀을 드리고 싶습니다. 업체측 덕분에 좋은 시간을 보내서 정말 좋은 하루가 되었습니다. 하지만 좋은 이야기만 쓰고 싶었지만 도저히 아쉬운 부분에 대해서는 꼭 아셨으면 해서 리뷰 남깁니다. 우선 체크인했을 때 바닥에 물기가 마르지 않았고, 창문도 열려있는 상태인 점이 마치 청소한 지 얼마 안 된 것 같아 보였는데 베개 밑 매트리스 커버엔 기름자국으로 추정되는 오염이 있었고, 빨래가 덜 마른듯한 물비린내가 진동했어요. 가지고 있던 향수를 뿌려보았는데도 나아지긴 커녕 조금 힘들 정도로 많이 났어요. 제 개인적인 요청에도 긍정적으로 받아주셔서 정말 감사했습니다. 다만, 위에 말씀드린 부분에 대해서는 다른 방은 어떨지 모르겠지만 개선이 필요해 보여요.",2,3년 전
y_33_435,전주 와이케이,찌랑,좋아유 좋아유 아이폰 충전기가 연결이 안 되어있어서 문의했는데 챙겨주셨어용 굿굿굿굿 침구도 깨끗하고 화장실도 깨끗해서 좋았습니다. 티비 조작도 빨리빨리 잘 되고 넷플릭스도 잘 봤어요.,5,4년 전
y_33_436,전주 와이케이,자카르타주책,인테리어가 바뀌어서 좋았어요,4,6년 전
y_33_437,전주 와이케이,여기어때 이용 고객,방금 막 청소한 느낌으로 화장실이 물로 다 젖어있는게 좀 그렇긴 한데 ㅠ 그래듀 대실시간도 길고 시설도 좋고 방마다 고데기도있고 컴퓨터도있고 만족했습니당 ㅎㅎ,5,6년 전
y_33_438,전주 와이케이,빨간맛초록맛,침구류 상태가 청결해서 기분좋게 이용했습니다.,5,3년 전
y_33_439,전주 와이케이,zz5005,"몇번째 이용인지 모르겠어요! 올때마다 항상 방, 침구, 화장실 모두 깨끗하고 편안한 분위기라서 여기만 오고있습니다. 사장님도 친절하시고 좋아요~~~~",5,6년 전
y_33_440,전주 와이케이,병아리색프라이드치킨,시설 완벽하네요 수압도 좋고 카운터분도 무지 친절해요 깨끗하고 저는 여기만 와요!,5,6년 전
y_33_441,전주 와이케이,예순둘순대,"접근성 좋고 좋아요 항상 잘 이용하고 사장님도 친절하세요 시설도 깔끔해서 좋아하는 곳 입니다 주변에 편의점, 음식점도 많고 좋아요 주차장이 좀 어둡긴한데 숙소가 좋으니 용서가 됩니당~~",5,2년 전
y_33_442,전주 와이케이,chajihun,시설 깔끔하고 룸 컨디션 너무 좋아요.. 사장님 너무 친절하시고 애용하는 곳이에요. 좋은 시설 합리적인 가격에 기분 좋게 머물다가 가요..앞으로도 자주 애용하겠습니다..강추입니다..,5,2년 전
y_33_443,전주 와이케이,10084990,근처 모텔중에선 가장 청결한 것 같아 자주 이용하는데 방에 들어가니 쫌 많이 추웠어요ㅠㅠ 전기장판은 전자파가 너무 강하더라구요.. 이것빼곤 만족스러웠습니다,4,5년 전
y_33_444,전주 와이케이,능통한크루아상,신기하게 생겼네요ㅋㅋㅋㅋ 뷰는 그럭저럭 욕조는 좀 많이 좁았어요 그래도 시설 깔끔하고 깨끗해서 기분좋게 이용했습니다! 뭔가 복도에 방음이 잘 안 되는 것 같긴 했는데 그래도 나름 괜찮았어요,4,2년 전
y_33_445,전주 와이케이,온두라스벼락,너무 좋아요 굿굿굿 시설도 괜찮고 깨끗하네요 너무 좋아요 굿굿굿 시설도 괜찮고 깨끗하네요 너무 좋아요 굿굿굿 시설도 괜찮고 깨끗하네요 너무 좋아요 굿굿굿 시설도 괜찮고 깨끗하네요 너무 좋아요 굿굿굿 시설도 괜찮고 깨끗하네요,5,3년 전
y_33_446,전주 와이케이,Lyngun,나쁘지 않아용 ㅎㅎ,4,1년 전
y_33_447,전주 와이케이,GC14960550328,굿굿궇굿궇구굿 늘 잘 이용합니다,3,3년 전
y_33_448,전주 와이케이,겸댕이쭈니,전주에 볼일이 있어서 2개월만에 다시들렸네요 그때 그방다시 ㅎㅎ 역시 청소상태나 정리는 잘되어있어서 좋았습니다 다만 그전에는 화장실 악취는 별로 없었는데 이번에는 하수구에서 좀 심하게 올라옵니다 욕실 하수구악취는 손보셔야할듯요,5,4년 전
y_33_449,전주 와이케이,공감하고소박한백신,굿굿 방은 조듬 작지만 깔끔하고 위치가 매우 좋음,4,1년 전
y_33_450,전주 와이케이,또보겠지,중화산동이 집에서 더 가까운데도 항상 와이케이로 찾아가는 거 같아요. 아마 졸업해도 올듯 ㅠㅠ 근처에서 놀다 들어가기도 너무 좋고 방에 들어가면 내집 온 것 처럼 편안해요. 화장실 하수구냄새만 개선하면 완벽,5,1년 전
y_33_451,전주 와이케이,89세대리기사,깨끗하고 좋아요~~~~!!,5,1년 전
y_33_452,전주 와이케이,예순둘순대,자주 이용하지만 확실히 좋아요 넓고 주변에 편의시설도 많고 음식점도 많고 좋습니다 청결하고 좋은 냄새 나고 좋아요~~~ 다음번에 또 묵고 싶은 곳입니다 좋습니다 좋아요~~~~~~~~~~~~~~,5,3년 전
y_33_453,전주 와이케이,3209140,인테리어해서 괜찮은거같은데. 숙박시간 전화로 물어보길래 의아햇는데 그시간에 맞춰 대실 손님을 받는건지 잘 모르겟는데. 바로들어가서 그런지 청결상태와 냄새는 솔직히 좀 실망이었어요. 다른건 다 괜찮았습니다.,3,6년 전
y_33_454,전주 와이케이,hepoo,위치도 좋고 깔끔해서 좋아요,5,1년 전
y_33_455,전주 와이케이,하나같은매화,간단히 마실수 있는 커피가 있습니다. 물론 커피포트는 사용 가능합니다. 침대옆에 간단히 먹을수 있는 테이블과 의자가 있어요 침대에 누워서 볼수 있는 위치에 TV가 설치되어 있었습니다.,5,2년 전
y_33_456,전주 와이케이,3507625,첫째로 수압이 매우 약합니다. 제가 사용했던 룸만 그럴 수도 있지만 6xx호 정말 답답하고 씻어도 개운하지 않았어요. 좋았던 점은 요즘 숙박업소들이 객실이 넓어보이기 위해 화장실 벽을 허물고 유리벽으로 하는 경우들이 많은데 이곳은 화장실을 개별적으로 두어서 사생활을 많이 개방하지 않은 커플이나 동성간의 여행으로써 좋은 것 같습니다,4,6년 전
y_33_457,전주 와이케이,이구역의방랑자,자주 가는 곳이기도 한데요 위생도 청결하고 잠깐 머물다가기에 좋은 곳 같습니다. 자주 애용할꺼구요 추천드려요!! 자주 가는 곳이기도 한데요 위생도 청결하고 잠깐 머물다가기에 좋은 곳 같습니다. 자주 애용할꺼구요 추천드려요!!,4,3년 전
y_33_458,전주 와이케이,련쯜,갈 때마다 항상 청결하고 좋은 컨디션을 유지하고있어요 그래서 지인들 놀러오면 숙박도 여기로 예약하라구 해요 북대 중심에 위치해서 놀다가 들어가기도 가까워서 좋구요 가성비는 말해 뭐해 !!,5,2년 전
y_33_459,전주 와이케이,녹색아욱국,최고~~! 전북대 근처 오면 무조건 추천이에용!!,4,1년 전
y_33_460,전주 와이케이,빨간맛초록맛,기분좋게 이용했어요,5,3년 전
y_33_461,전주 와이케이,앵*****,전북대에서는 여기가 최고인 것 같아요.. 일단 위치도 완전 최고구 주변에 술집 편의점 짱 많고! 깨끗하고 화장실 분리도 되어있어서 그냥 전주 놀러오는 분들도 집처럼 사용가능할 것 같네요ㅎㅎ 다음에 또 이용할게요!,4,2년 전
y_33_462,전주 와이케이,용왕당첨제발,수압 적당히 괜찮고 에어컨 빵빵하게 잘 나옵니다 주차장이 따로 있어서 편하게 이용했어요 객실도 상태 만족했어요 흡연자들은 테라스 이용해서 흡연가능해서 장점인듯합니다 티비도 물론 잘나와요,5,1년 전
y_33_463,전주 와이케이,넷번개,깨끗하고 직원분이 친절하셨습니다,5,1년 전
y_33_464,전주 와이케이,밝고푸른아마존,올때마다 잘 쓰고 있습니다 깨끗하고 따뜻해요,5,1년 전
y_33_465,전주 와이케이,빛나고진솔된목각,댕로 주변에선 제일 좋은 곳 아닌가 싶습니당 술먹고 가기에 너무 적당한 거리 진짜 구라 안치고 앞으로 넘어지면 바로 와이케이 임당 ;; 그리고 잠깐 쉬기에도 너무 편하고 조씁니당 !!!,5,3년 전
y_33_466,전주 와이케이,나른한장소,일단 방문의 가장 큰 목적이었던 넷플릭스 되는 TV가 너무 좋았습니다. 화면도 크고 소리도 우렁차고 객실마다 계정이 있어서 재미있게 시청할 수 있었어요. 욕실도 청결했고 미니바까지 잘 이용했습니다. 다음에도 방문하고 싶어요.,5,3년 전
y_33_467,전주 와이케이,불곰너구리,침대는 가격대비 다른곳 보다 꿀잠 가능 근데 2층 집 2인실 환풍기 소리 고쳐쥫으먼,3,4년 전
y_33_468,전주 와이케이,유담94,"예약시간보다 일찍 왔는데도 친절하게 응대해주시고, 방에서 담배냄새나서 방향제 달라 요청했는데 방을 아예 바꿔주셔서 편하게 잘 쉬었습니다! 온수도 잘나오고 티비고 크고 창문도 크고 참 좋습니다! 웬만한 호텔보다 나아요!!",5,5년 전
y_33_469,전주 와이케이,dkqk130,대실로 여길 처음 알았는데 여기를 왜 진작 알지 못했을까 싶었습니다... 매우 만족!,5,1년 전
y_33_470,전주 와이케이,분주한두꺼비,청결하고 좋아요!!청결하고 좋아요!!청결하고 좋아요!!청결하고 좋아요!!청결하고 좋아요!!청결하고 좋아요!!청결하고 좋아요!!청결하고 좋아요!!청결하고 좋아요!!청결하고 좋아요!!,5,2년 전
y_33_471,전주 와이케이,1739753,처음 들어갔을때 비오는 날씨여서 그런지 꿉꿈함은 에어컨을 통해서 싹 제거 했구요! 전반적으로 이미지랑 시설은 되게 깔끔 한거 같아요 조명은 빨간색 조명..이여서 당황했지만 끌 수 있어서 다행이구 발코니에 따로 흡연장소를 마련해놓아서 괜찮은거 같아요! 다음에도 이용할 의향 있습니다!,4,5년 전
y_33_472,전주 와이케이,예순세살루피,오랜만에 방문 했습니다 베개와 침구는 정말 완벽 했어요 그러나 전 손님이 사용한 젖은 수건을 발견 못 하셨는지 쉰내가 계속 진동해서 조금 힘들었어요 ㅠㅠ 다른건 다 좋았어요 에어컨 티비 컴퓨터 암막커튼 완벽해요,5,2년 전
y_33_473,전주 와이케이,Oricompany,"위치 객실컨디션 등 나쁘지 않은 만족스런 숙소다. 출장객으로서 신경 많이 쓰는 부분은 매트리스와 침구류의 컨디션을 중요하게 생각하는데 이런 부분에서는 만족스러웠다. 잘 잤고, 다음날 좋은 컨디션으로 퇴실했다",5,2년 전
y_33_474,전주 와이케이,분주한두꺼비,객실은 들어가면 따뜻한 분위기에 실내는 청결해서 계속 가게되는 곳이에요!! 그리고 시간도 넉넉해서 항상 가면 푹 쉬다가 나오게되는데 그리고 구정문 바로 안에 있어서 주변 돌아다니기도 너무 편해서 좋아요!!,5,2년 전
y_33_475,전주 와이케이,여기어때 이용 고객,전주 여행가서 숙소 잡은건데 너무 깔끔하고 사진이랑 똑같아요~~~~~~ 만족했어용!!! 사장님도 친절하시고 잘 쉬다가 왔어요~~~~~~ 담에 여행 또오면 또 묵을께요~~~~~~~~~~,5,4년 전
y_33_476,전주 와이케이,또보겠지,매번이용하는데 위치도 좋고 시설도 좋아요. 금연방 요청드렸는데 바로 주셔서 감사했어요. 특히 고데기가 있는게 정말 좋은 것 같아요! 근처에 넷플릭스랑 유튜브 다되어서 여기로만 다니는 것 같아요 또올게요,5,2년 전
y_33_477,전주 와이케이,다소곳한계란,"이번에도 출장시에 이용했어요. 로비에 있는 로투스랑 사탕이랑 약과도 있고 로비안쪽에 매실음료있어요 사장님과 직원분 변함없이 친절 하시고, 방도 항상 청소 깔끔하게 해주셔요. 던진공원으로 산책가기 좋아요",5,2년 전
y_33_478,전주 와이케이,상당한조선범,깨끗. 깔끔. 시원. 쾌적. 너무 좋습니당. 전주 놀러왔다가 잘 쉬고 왔습니다 ~ 방음이 잘되어있는건지.. 아무소리도 들리지 않습니다 ㅋ tv도 크고 !! 다시 이용할 의향 1000~ 또 놀러오게 된다면 올것같아요 대학로랑 가까워서 넘 좋아요 ~ 아 ! 창문이 없어요 ~ 신기함...,5,1년 전
y_33_479,전주 와이케이,15840753,객실도 깨끗하고 넓어서 좋아요,5,3년 전
y_33_480,전주 와이케이,아라민찐마미,주마다 한번씩 가요~~~청결하고 너무 좋아영 !!!!!ㅎㅎ제일 좋은건 사장님의 친절함 입니다~~맨날 가는 이유가 있어요 ㅎㅎ피곤하실텐데 항상 고생하십니다😎💖💖💖💖💖💖💖💖💖💖💖💖💖💖💖💖,5,2년 전
y_33_481,전주 와이케이,수미니뚜뚜,금연방인데 담배냄새인지 비슷한냄새가 계속 나서 숨쉬기 불편했어요..그래도 잘 쉬었다가가요!,3,5년 전
y_33_482,전주 와이케이,영덕대게마을지하,5층에 식혜가 있어서 좋았고 시설 자체는 깨끗하고 깔끔했습니다. 그리고 용품들도 딱 필요한 것만 들어있어서 좋았습니다. 무엇보다도 청결을 중요시 여기는데 여기는 청결점수 5점만점에 4.5입니다,5,4년 전
y_33_483,전주 와이케이,무말랭이이이이,편하게 쉬기 좋은 곳 같아요 !! 북대랑 가깝기도 하고 주변에 먹을 것도 많고 ! 그리고 침대도 푹신하면서 깔끔하고 화장실도 세련되고 고급스러운 느낌이라서 좋았습니다 ! 자주 이용할게요 !,5,2년 전
y_33_484,전주 와이케이,감동적이고총명한커피색,"사장님도 정말 친절하시고 시설도 깨끗!!! 넓은 주차장, 번화가 주변의 아주아주 좋은 위치에 완전 만족하며 이용하고 갑니다~~!! 다음에 또 이용할 예정입니다~~! 항상 친절한 사장님 감사합니다",5,1년 전
y_33_485,전주 와이케이,이구역의방랑자,깨끗하고 쾌적해서 너무 좋습니다!! 다른 곳은 가면 공기에서 좀 쾌쾌한 냄새가 나는데 여기는 그렇지 않아서 좋았어요!! 알바생분도 친절하시고 이용하기에 불편함없이 잘 이용했습니당 ㅎㅎ,5,2년 전
y_33_486,전주 와이케이,아흔두살벽,방에비해 소파가 성인 한명 앉으면 꽉차는 소파였어요 그리고 무슨일인지 입실시 방문은 활짝열려있었어요.. 청소후 안닫으신건지.. 그 외 청결상태는 좋았습니다 화장실에서 약간 냄새가 올라오긴해요,5,3년 전
y_33_487,전주 와이케이,dbjsrms,무한대실 이용했는데 시간 길어서 너무 좋았어요 다만 비품이나 시설들이 약간의 노후화가 되긴했더라구요 민감하신분은 불편할수있지만 그렇다고 엄청 심하진않아요 그래도 위치가 좋아서 그점은 좋아요,5,2년 전
y_33_488,전주 와이케이,분주한두꺼비,항상 갈 때 마다 너무 친절하게 안내해주사고 좋은 방에 아늑하고 청결해서 항상 좋은 숙소 잘 이용하다가 가요 매번 갈 때마다 느끼는 점은 숙소가 근처 먹거리가 좋아서 너무좋어요 ㅎㅎ,5,2년 전
y_33_489,전주 와이케이,빨간맛초록맛,기분좋게 이용했습니다,4,3년 전
y_33_490,전주 와이케이,반사적인음유시인,제가 여자친구랑 주말마다 자주 와서 묵는곳인데 올때마다 편안하고 시설도좋고 주차공간도 충분히 많아서 자주 오게 됩니다. 사장님도 항상 친절하시고 다음에도 많이 이용하겠습니다!!😀😀,5,4년 전
y_33_491,전주 와이케이,안뇽기욤,가끔 이용하는 곳인데 깔끔하고 담배냄새도 안나고 수압도 좋았고 에어컨도 잘 작동 되었구 넷플까지 완벽했어요 밖에 더웠는데 잘 쉬다갔어요~~ 다음에 또 이용할 의향 있습니다~~~~~~,5,2년 전
y_33_492,전주 와이케이,캠퍼족,여기 깔끔하고 너무 좋아요 우선 방 들어가면 따뜻하고 담배냄새도 안났어요 큰길가 옆이라서 바로 체크인하구 편의점도 식당도 바로옆이라 지내기 좋았습니다 재방문 의사 있어서 리뷰 남겨요,5,2년 전
y_33_493,전주 와이케이,때엥크,정말 조아요 겉에 보이는거랑 많이 다르더라구요 친절햇구 시설도 청결하구 만족햇 습니다 근처 먹거리들이 충분해서 것두 매우 만족햇구요 두고간 소지품도 잘 보관해주셔서 정말 감사햇습니다,5,6년 전
y_33_494,전주 와이케이,등황색채식주의자,대실 이용했는데 카운터 친절하시고 방 깨끗해서 잘 쉬고 갔습니다. 좀 특별한 점은 베란다가 있어서 나가서 앉을 수도 있게 해놨더라구요. 이용하지는 않았지만 날씨 안추우면 밖에서 맥주랑 과자 먹으며 이야기 할 수 있을 것 같았기도 했습니다.,4,2년 전
y_33_495,전주 와이케이,푸른이리2,사장님. 안내 친절 하시고 객실도 깨끗하고 위생적이어서 좋아요. 하루 묵고 또 선택했습니다.,5,2년 전
y_33_496,전주 와이케이,실무적인진주,좋아요. ~~~!! 근처에서 가격대비 혀율 좋아요. 가끔이용하겠지만 다시 방문할 의사있어요. 깨끗하고 따뜻해서 아주 좋았어요. 베게만 낮은것이 푹신한것이 있으면 더더 좋았을거 같아요!!!!!@ 좋은 시간 보내시기 위해서는 추천 드립니다 최고에요~!2!~!,5,2년 전
y_33_497,전주 와이케이,자연스러운도도,여기는 신기허게 베란다가있습니다 밖이보이는 뷰가 좋고 빨간조명이 뭔가 웃깁니다 두번째이용이고 생각보다 좋습니다 다음에도 또 이용할 마음있고 침구류도 깔끔하고 편언허게 쉬었다가 갑니다.번창하세요 ㅎㅎ,5,1년 전
y_33_498,전주 와이케이,혖구리,전주 출장으로 자주오는데 와이케이 자주 이용할게여ㅎ 사장님도 친절하시고 방도 깔끔하고 여심저격🥰,5,5년 전
y_33_499,전주 와이케이,앵*****,대실뿐만 아니고 숙박도 자주 이용하는 와이케이! 사장님도 너무 친절하시고 물이랑 식혜 커피도 가져다 먹을 수 있어요 체크아웃 시간도 넉넉해서 완전 굿입니다요 앞으로도 애용할게요ㅎㅎ!,4,2년 전
y_33_500,전주 와이케이,dkqk130,전북대 근방 중 가장 좋은 것 같습니다.,5,1년 전
y_33_501,전주 와이케이,쟈주니,시설도 좋고 친절하셔서 좋습니다,5,2년 전
y_33_502,전주 와이케이,오레곤동화,"번화가쪽이라 소음이 있었던게 아쉽습니다ㅜㅠ 방자체는 좋았어요 전기장판,큰티비,라디에이터까지 좋았습니다 하지만 방 자체가 추웠어요... 그 부분을 제외하곤 괜찮았습니다",4,5년 전
y_33_503,전주 와이케이,빨간맛초록맛,청소상태가 청결해서 기분좋게 이용했습니다,5,3년 전
y_33_504,전주 와이케이,10084990,"방에서 조금 퀘퀘한 냄새가 나더라구오ㅠㅠ 시간이 지나니까 빠진건지 아님 익숙해져버린건지,,ㅎㅎ 욕실에 물기가 제거가 안되어있어서 미쓰러질뻔한거 빼곤 괜찮았어요~ 물기랑 냄새만 조금만 더 신경써주시면 좋을듯해요!",3,5년 전
y_33_505,전주 와이케이,밝고푸른아마존,가본 모텔 중에서 제일 깨끗하고 좋았어요!,5,1년 전
y_33_506,전주 와이케이,카페거리거물,우선 제일 먼저 보는게 청결 상태인데 아주 깨끗하고 이불도 깔끔해서 좋아요! 흡연할수있는공간이 분리되어있고 전망도 탁 트여서 좋습니다!!,5,5년 전
y_33_507,전주 와이케이,정신적인부정,역시 항상 갈때마다 최고입니다 너무 깨끗하고 사장님 친절하시고 테라스 뷰도 감성 있고요 ㅎㅎㅎㅎ 테라스에서 맥주 한잔 하기 좋아용 화장실도 깨끗하고 수압도 쌔고요 정말 최고입니더 ㅎㅎ,5,2년 전
y_33_508,전주 와이케이,6795455,시설도 깨끗하고 주인분이 친절하셔서 좋았어요 입실 시간보다 더 빨리 갔는데 빨리 들어가게 해주셨어요 넷플릭스도 잘나오고 좋았습니당,5,4년 전
y_33_509,전주 와이케이,짠뚱,전북대 호텔로 전북대 먹자거리에 위치해있어 방문하고 주변 놀기도 좋은데 시설도 깔끔해 휴식을 취하기 편했던 전북대 와이케이였어요,4,1년 전
y_33_510,전주 와이케이,미안할때사과,인테리어도 이쁘고 방은 깔끔하고 좋아요,4,2년 전
y_33_511,전주 와이케이,선미는선구,시설두 좋구 항상 이용합니다. 냄새도 많이안나구 청결하고 깔끔한거같아요! 프론트도 친절하십니다 ㅎㅎ 여기만 이옹해요!,5,4년 전
y_33_512,전주 와이케이,뿡빵삥빵뽕빵,"연박으로 잡았는데 머무르기 좋았서여 넷플릭스도 잘되구 방도 넓어서 지내기에 괜찮았어여!! 아 근데 화장실 하수구 냄싀가 쫌 심했어여,, ㅋㅋ큐ㅠㅜ 진짜 좀 심해서 깜짝 놀랰ㅅ긴했어요,, 그거 빼곤 위치도 좋구 갠츈함미다",5,2년 전
y_33_513,전주 와이케이,꽃분홍색샹크스,객실 상태 좋았습니다,5,1년 전
y_33_514,전주 와이케이,얄리야릴,깔끔하고 괨탆았어요 ㅎㅂㅎ,5,1년 전
