id,name,nickname,review_content,rating,write_date
y_33_725,전주 와이케이,심리적인곱등어,굿굿굿굿굿굿굿굿굿굿굿굿굿굿굿굿굿굿굿굿굿굿굿굿굿굿굿굿굿굿굿굿굿굿굿굿굿굿굿굿굿굿굿굿굿굿굿굿굿굿굿굿굿굿굿굿굿굿굿굿굿굿굿굿굿굿굿굿굿굿굿굿굿굿굿굿굿굿굿굿굿굿굿굿굿굿굿굿굿굿굿굿굿굿굿굿굿굿굿굿굿굿굿굿굿굿굿굿굿굿굿굿굿굿굿굿굿굿굿굿굿굿굿굿굿굿굿굿굿굿굿굿굿굿굿굿굿굿굿굿굿굿굿굿굿굿굿,5,3년 전
y_33_726,전주 와이케이,이구역의방랑자,깔끔의 정석 완전 추천해요 깔끔의 정석 완전 추천해요 깔끔의 정석 완전 추천해요 깔끔의 정석 완전 추천해요 깔끔의 정석 완전 추천해요 깔끔의 정석 완전 추천해요 깔끔의 정석 완전 추천해요,4,3년 전
y_33_727,전주 와이케이,얼쑤링,가격에 비해 시설 너무 귀엽고 깔끔합니다!! 가격에 비해를 빼더라도 좋고 올만한곳인것같아욥,5,6년 전
y_33_728,전주 와이케이,DMZ수초,항상 깨끗하고 깔끔해서 종종 이용합니다 좋아요!,5,1년 전
y_33_729,전주 와이케이,신상조하,저렴한데다가 시간도 충분해서 영화 두편 봤네요 카페보다 편히 있을 수 있어서 좋았어요.,5,5년 전
y_33_730,전주 와이케이,최김,잘쉬다 갑니다 수압도쌔고 좋아요,5,2년 전
y_33_731,전주 와이케이,YG패밀리,테라스가 있어서 좋았구요 시설이 깔끔하고 전반적으로 분위기(조명)가 좋았습니다.,5,5년 전
y_33_732,전주 와이케이,민망한초밥,자주 이용하는데 오늘 처음보는 직원 분이 유난히 불친절하여 아쉬웠습니다,5,5년 전
y_33_733,전주 와이케이,양송송,자주 오는데 항상 깔끔하고 사장님이 친절해서 좋아요ㅎㅎ자주 이용할께요!!,5,6년 전
y_33_734,전주 와이케이,마카롱주세요,항상 느끼지만 깔끔하고 넓고 예쁜 욕실 그리고 룸컨디션이 좋습니다!,5,6년 전
y_33_735,전주 와이케이,마카롱주세요,항상 느끼지만 깔끔하고 넓고 예쁜 욕실 그리고 룸컨디션이 좋습니다!,5,6년 전
y_33_736,전주 와이케이,3029343,시설도 좋고 깔끔해서 좋았네요,3,5년 전
y_33_737,전주 와이케이,쉰다섯에드워드,깔끔하고 테라스 있는게 신의한수있듯용 침대 넘 폭신해서 조아여 ㅎㅎ,5,5년 전
y_33_738,전주 와이케이,민망한초밥,객실 내부도 깔끔하고 직원 분들도 다들 친절하셔서 좋습니다!ㅎㅎ,5,6년 전
y_33_739,전주 와이케이,구*****,안에 원래 있던 led 조명이 사라져서 너무 좋아요! 더 분위기 있어졌어요! 욕조도 있고 전망도 좋고~ 위치도 너무 좋고! 전북대 근처에서 좋은 곳이에요! 프론트에 있는 과자도 맛있어용 ㅎ,5,2년 전
y_33_740,전주 와이케이,여든여덟부여,깔끔하고 좋았어요ㅎㅎㅎ 고데기도 있고 두번이용하는건 이유가 있습니다 잘 머물다가요~~,4,5년 전
y_33_741,전주 와이케이,한식한번에,엘레베이터가 약간 아쉽지만 화장실이나 조명이나 모두 완벽합니다 ㅎㅎ,5,6년 전
y_33_742,전주 와이케이,우주클라스,블루조명 끄고 이용했는데 너무 좋았어요 테라스도 있어서 전주가면 여기만 이용할것같아요,4,5년 전
y_33_743,전주 와이케이,선미는선구,배게가 푹신하면 좋겟다아아앙ㅇ,3,5년 전
y_33_744,전주 와이케이,마카롱주세요,항상 청결하고 친절하시고 깔끔하고 또 친절하시고 너무 좋습니다ㅜ,5,5년 전
y_33_745,전주 와이케이,태국타자,항상 자던곳이에용ㅎㅎ 편하고 이젠 집 같아용ㅎㅎ 올때마다 너무 좋고 접근성도 좋아용 주차장도있어서 차대놓기도 좋네용ㅎㅎ 항상 잘 자다가 갑니당ㅎㅎ 넷플도있구 식혜도 맛이써용 최고에연ㅎ,5,2년 전
y_33_746,전주 와이케이,하하홓호,인터리어랑 스카이뷰랑 분위기 모두 좋았습니다!! 강력 추천합니다!,5,6년 전
y_33_747,전주 와이케이,왜이,친절하고 좋았습니다 !,4,3년 전
y_33_748,전주 와이케이,유황온천참모장,분위기 있고 되게 깔끔 했어요 비싸긴 했지만 그래도 방은 낫베드,5,2년 전
y_33_749,전주 와이케이,파행적인도망병,친절하시구좋았어요 친절하시구좋았어요 친절하시구좋았어요 친절하시구좋았어요 친절하시구좋았어요 친절하시구좋았어요 친절하시구좋았어요 친절하시구좋았어요 친절하시구좋았어요 친절하시구좋았어요 친절하시구좋았어요 친절하시구좋았어요,5,2년 전
y_33_750,전주 와이케이,창선대교타운집쥐,객실이 깔끔해서 좋았어요 화장실 문이 비치는 문이 아니라 좋았어요,5,2년 전
y_33_751,전주 와이케이,10041968,청결 흠 잡을곳 없이 깔끔해요 !! 인테리어도 좋습니당 ㅎㅎㅎ,5,5년 전
y_33_752,전주 와이케이,248819,깔끔 저렴 침대도편하고 주차자리도 많고 전북대쪽에서는 최고네요,5,5년 전
y_33_753,전주 와이케이,10006311,너무 쾌적하게 잘 쉬다 갑니다~! 청소 냄새 등 너무 깔끔해요~,5,5년 전
y_33_754,전주 와이케이,마카롱주세요,좋았습니다 시설도 그렇고 항상 좋은방 제공해주셔서 감사합니다,5,6년 전
y_33_755,전주 와이케이,용딘,두번 이용했는데 항상 기분이 좋네요 객실도 깨끗하구 좋아요~,5,5년 전
y_33_756,전주 와이케이,10172707,위치도 놀기 좋고 비품도 충분하고 고데기도 있고 깨끗해요!,5,5년 전
y_33_757,전주 와이케이,10041968,위치도 좋고 깔끔해서 자주 가는곳 입니다 ㅎㅎㅎ 추천 !,5,5년 전
y_33_758,전주 와이케이,구불구불한가격,접근성도 좋고 이불이랑 침대가 푹신하고 부드러워서 좋았어요 위생도 깔끔하고 편하게 쉬다올수있는 곳 이었습니다. 접근성이 좋기때문에 나중에 또 가고싶습니다!! 사장님도 친절하세요 👍 👍,5,1년 전
y_33_759,전주 와이케이,앙골라케이크,자주 애용합니당! 너무 깨끗하구 금연방 흡연방 따로 있는것고 좋구~ 화장실도 깨끗해요~!! 인테리어도 너무 감각적이에용 다들 애용하세요 분위기 있음 근데 조명이 사진이 잘 안나와욤,5,4년 전
y_33_760,전주 와이케이,75세언데드,주마다 자주 이용하고 있습니다. 덕진광장 주변에 와이케이만한 곳이 없어요. 평일에 많이 가다보니 또이케이라고 부릅니다 ㅎㅎ 사장님도 친절하시고 방도 깔끔합니다. 앞으로도 자주 이용할거같아요~ 북대는 또이케이😄,5,1년 전
y_33_761,전주 와이케이,주굴주굴한밥감주,사장님도 너무 친절하시고 시설도 너무 깔끔해서 좋았어요,5,2년 전
y_33_762,전주 와이케이,10041968,인테리어도 깔끔하고 청결해서 애용하는곳 입니다 ㅎㅎㅎ,5,5년 전
y_33_763,전주 와이케이,민망한초밥,쾌적하고 위치도 좋아서 자주 이용해요 강추합니다~~,5,6년 전
y_33_764,전주 와이케이,다웃,좋습니다~ 깔끔하고 ㅎㅎ 근데...들어오자마자 퍼런불이 켜져서 모텔느낌을 지울 수 없었어요..ㅠㅠ왜 저걸해둔건지 이해불가. 그냥 은은한 주황빛이 좋은데,4,5년 전
y_33_765,전주 와이케이,이구역의방랑자,거의 단골이라 할수 있을 정도로 많이 간거 같네요 북대에서 와이케이 호텔이 제일 좋은거 같습니다 ㅋㅋㅋ 다음에도 또 이용하러 갈께요 사장님 번창하세요 ^^ 날씨가 많이 춥습니다 따뜻하게 입고 다니시길,5,2년 전
y_33_766,전주 와이케이,찌랑,전북대 근처는 와이케이만 가요 넓고 깨끗하고 고데기 있고 넷플릭스 볼 수 있고 직원 분도 친절하심 침구도 깨끗함요 굿굿굿굿굿굿 굿굿굿굿굿굿굿굿굿굿~~~~~~~~~~~~~~~~~~~,5,3년 전
y_33_767,전주 와이케이,이구역의방랑자,자주 이용하는 곳인데요 항상 깔끔하고 쾌적해서 만족하면서 이용합니다!! 자주 이용하는 곳인데요 항상 깔끔하고 쾌적해서 만족하면서 이용합니다!! 자주 이용하는 곳인데요 항상 깔끔하고 쾌적해서 만족하면서 이용합니다!!,5,1년 전
y_33_768,전주 와이케이,9921188,만족했어요~~! 친절하고 객실도 깨끗하고 좋아요,5,5년 전
y_33_769,전주 와이케이,11세해적,가깝고 좋아서 자주 이용했는데 서비스는 잘 모르겠어요 금연실 흡연실 나눠 있는건 좋은데 흐음 전날은 들어갔는데 누가 먹고 간지 모르는 따진 사이다 캔이 있었고 다음날 또 갔는데 5시간 예약이 가능해서 했는데 갑자기 원래 4시간이라고 준비하라고 전화왔어요 직원분 오류라고 하는데…확인 좀 잘 해주셨으면 합니다,2,3년 전
y_33_770,전주 와이케이,련쯜,세번째 방문인데 매번 깨끗했고 편하게 잘 쉬었다갑니다 ! 이 가격에 이만한 곳이 없다고 생각해요 ! 방도 넓고 아주 만족하는 곳입니다 앞으로도 자주 방문할 거 같아요 ~~ 북대에 있어서도 좋습니다,5,2년 전
y_33_771,전주 와이케이,아라민찐마미,사장님 완전 짱 친절 😀😀😀😀😀😀💖💖💖💖💖💖😀😀😀😀😀💗💖💗💖💗💖💗💖💗💗💖💗💖💗💗💖💗💖💗💖💗💖💗💖💗💖💖💗😻💗💗💗😻💖💗💖💗😻💗💗😻💗😻💗😻😻💗😻💗😻😻💗😻💗😻💗💗〰😝😻🫠〰👼🏻👼🏻😻💗💗〰〰💞〰💞〰💞〰,5,2년 전
y_33_772,전주 와이케이,갓코지,대실시간도길고 테라스도있어서 너무좋아요 ㅎㅎ,5,6년 전
y_33_773,전주 와이케이,이상띠,주차가 조금 아쉽지만 객실은 완전 좋았습니다,5,6년 전
y_33_774,전주 와이케이,빨간맛초록맛,기분 좋게 이용했습니다,5,3년 전
y_33_775,전주 와이케이,더운줄기,다른 조명이 빨간색이거나 파란색이여서 그 것만 빼면 괜찮아용,3,4년 전
y_33_776,전주 와이케이,녹색아욱국,즇아요 좋아요 시설도 좋고 깨그괘ㅛㅓ 너무너무 좋아요 북대는 역시시 와이케이!!!!!!! 담에도 또 이용할게요!! 와이케이 최고!!! 와이케이 이사가지 말아주새요요!!! 조망간 또 갈게요 호,5,2년 전
y_33_777,전주 와이케이,민망한초밥,깔끔하고 위치적으로 좋아 자주 이용합니다,5,5년 전
y_33_778,전주 와이케이,민망한초밥,청결하고 카운터 분이 친절하셔서 좋아요~,5,6년 전
y_33_779,전주 와이케이,여기어때 이용 고객,깔끔하네요 잘이용하구왔어요 시간도 많구 좋아요,5,6년 전
y_33_780,전주 와이케이,10681957,10번넘게 이용해요 청결하고 좋습니당 ㅎㅎㅎ,5,5년 전
y_33_781,전주 와이케이,대학로쉐프,외관은 사진에 보기에 신식은 아닌거같아서 큰 기대를 하지 않았습니다만 들어가보니 정말 깔끔허게 잘 되어있더군요 전북대 근처에서 쉴때 오기 좋은 숙소같습니다 다음에도 방문하겠습니다~,5,1년 전
y_33_782,전주 와이케이,갤쑥한엉터리,담배냄새 나서 방교환 친절히 안내해주셨어용,5,5년 전
y_33_783,전주 와이케이,이구역의방랑자,항상 잘 방문하는 곳 인데요 항상 쾌적하고 깔끔한 환경이어서 이용하기에 딱 알맞게 딱 좋은거 같습니다 다음에 또 이용할수 있습니다 ㅎㅎㅎ 사장님 번창하세요 ㅎㅎㅎㅎ ㅎㅎㅎㅎㅎㅎㅎㅎㅎㅎㅎ,5,2년 전
y_33_784,전주 와이케이,여든두살거위,친절하시고 저렴하고 좋아요 깔끔하고 거리도가깝고 친절하시고 저렴하고 좋아요 깔끔하고 거리도가깝고 친절하시고 저렴하고 좋아요 깔끔하고 거리도가깝고 친절하시고 저렴하고 좋아요 깔끔하고 거리도가깝고,5,2년 전
y_33_785,전주 와이케이,프랑스군용열차,생각보다 넓고 깔끔하고 좋았어요 조용하고 대학로와도 가깝고 잘 쉬다 왔습니다 프론트에 문의했을 때에도 직원 분이 친절하게 답변해 주셨어요 생각보다 넓고 깔끔하고 좋았어요 조용하고 좋아요,5,2년 전
y_33_786,전주 와이케이,il1067,시설도 청결도 짱짱 앞으로 계속갈거에요,5,6년 전
y_33_787,전주 와이케이,아라민찐마미,여기만 가요 사장님 너무 친절해요 부탁 항상 들어주시고 맨날 늦게 입실 하는데도 반겨주셔서 감사합니다 🤍🤍🤍🤍🤍🤍🤍🤍🤍🤍🤍🤍🤍🤍🤍🤍🤍🤍🤍🤍🤍🤍🤍🤍🤍🤍🤍🤍🤍🤍🤍🤍🤍🤍🤍🤍🤍🤍🤍🤍🤍🤍🤍,5,2년 전
y_33_788,전주 와이케이,편돌이피돌이,숙소 엄청 좋네요 짧은 시간이였지만 만족하다가 갑니다 ㅎㅎㅎㅎㅎㅎㅎㅎㅎㅎㅎㅎㅎㅎ 꼭 번창하시고 이번 겨울 춥지 않게 잘 보냐세요 ㅎㅎㅎㅎㅎㅎ 다음에 또 방문하겠습니다 ㅎㅎㅎㅎㅎㅎㅎㅎㅎ,5,2년 전
y_33_789,전주 와이케이,10041968,시설 깔끔하고 인테리어 좋어요 ㅎㅎㅎ,5,5년 전
y_33_790,전주 와이케이,5041905,아주 좋아요 청결하고 수압도 쎄졌고!,5,6년 전
y_33_791,전주 와이케이,련쯜,항상 갈 때마다 좋았어서 무조건 여기만 가요 오늘은 더블베드에 싱글베드 있는 방으로 배정해주셨는데 공간이 더 넓어서 좋았고 발코니도 있는데다 발코니에서 흡연 가능해서 좋았어요!!!,5,2년 전
y_33_792,전주 와이케이,땅콩닭강정,객실 상태는 깔끔하고 방이 넓어서 답답함 없이 잘 잤습니다! 여러번 왔는데 항상 만족하고 대학로 안에 있어서 이동하기도 너무 좋았어요. 다음에 재방문의사 있습니다~~~~~~~~~~,5,2년 전
y_33_793,전주 와이케이,YMHKHW,시설도 서비스도 다 최고입니다!!!,5,6년 전
y_33_794,전주 와이케이,갤쑥한엉터리,담배냄새 안나고 청결해서 너무좋아요,5,5년 전
y_33_795,전주 와이케이,윤정수3,스카이뷰 예약했는데 깔끔하고 좋아요,5,6년 전
y_33_796,전주 와이케이,예순둘순대,좋습니다 젛아요 좋아요 굿굿 항상 이용하는데 좋습니다 번화가라 먹을 곳 가깝고 시설 깨끗하고 넓어서 젛아요 굿굿굿 젛급니다 다음에 떠 이용할 일 있음 이용하거 싶어요 가성비굿입니다~~,5,2년 전
y_33_797,전주 와이케이,7542886,시설이 깨끗하고 화장실이 예뻐요,5,5년 전
y_33_798,전주 와이케이,한식한번에,청결 서비스 다 너무 좋습니다~,5,5년 전
y_33_799,전주 와이케이,8693403,너무 춥고 씻지도 못할정도로 추워요 스카이뷰방 너무 추워요 친절함매우 친절함,2,5년 전
y_33_800,전주 와이케이,97세의병제대,ㅍ편하게 아주 잘 쉬다가 갑니다. 편하게 아주 잘 쉬다가 편하게 아주 잘 쉬다가 갑니다. 편하게 아주 잘 쉬다가 갑니다. 편하게 아주 잘 쉬다가 갑니다. 편하게 아주 잘 쉬다가 편하게 아주 잘 쉬다가 갑니다. 편하게 아주 잘 쉬다가 갑니다.,5,3년 전
y_33_801,전주 와이케이,캔버라석궁,두번째 이용했는데 똑같이 깔끔하고 좋았어요~,4,6년 전
y_33_802,전주 와이케이,치사스러운달가림,좋은데 곰팡이 냄새가 좀 나요,3,6년 전
y_33_803,전주 와이케이,음악적인해,시설도 좋고 청결상태도 좋아요,5,5년 전
y_33_804,전주 와이케이,9574017,시설 깔끔하고 청소 깔끔해ㅛ,5,5년 전
y_33_805,전주 와이케이,75세언데드,주마다 자주 이용하고 있습니다. 덕진광장 주변에 와이케이만한 곳이 없어요. 평일에 많이 가다보니 또이케이라고 부릅니다 ㅎㅎ 사장님도 친절하시고 방도 깔끔합니다. 앞으로도 자주 이용할거같아요~ 북대는 또이케이😄,5,1년 전
y_33_806,전주 와이케이,익산신도시,시설도 좋고 위치도 좋아요,5,2년 전
y_33_807,전주 와이케이,유담94,친절하고 청결하고 좋아요!,5,5년 전
y_33_808,전주 와이케이,푸른어부,시설 청결 좋아양 히히히핳,5,5년 전
y_33_809,전주 와이케이,신상조하,대실기간이 긴 점이 제일 장점인거같아요!,4,5년 전
y_33_810,전주 와이케이,비인도적인문화평론가,자주 가는데 역시 믿음입니다♥,4,6년 전
y_33_811,전주 와이케이,아슬아슬한자석,잘이용했습니다 감사합니다,5,6년 전
y_33_812,전주 와이케이,녹색아욱국,북대중에서 최고 깔끔하고 좋아요|~||!!|!|!|! 담배냄새도 안나고 깔끔라고 좋아요~~~~ 사장님도 친절하심!!!!!!! 다음에 또 이용할게요 ㅎㅎ 최고에요~~ 추천추천!! 추천합니강,5,1년 전
y_33_813,전주 와이케이,민감한불교,전북대앞에 위치해있고. 먹자골목쪽. 앞에 있어서 너무 좋았습니다. 주변에 있는 다른모텔들하고 차별화된듯. 깨끗하고 넓고 좋아요. 사진이랑 똑같습니다. 비품도 세심하게 잘 구비되어 부족함이 없어요ㅋ. 강추,5,1년 전
y_33_814,전주 와이케이,DMZ수초,전북대 근처에서 가장 깔끔해서 좋아요,5,1년 전
y_33_815,전주 와이케이,42519,좀 추운데 괜찮았어용 ♡♡,4,6년 전
y_33_816,전주 와이케이,밀크티블루,항상 잘 쉬다갑니다~~ 여기는 전북대 상가근처여서 접근성이 좋아요 음식포장해서 예능보면서 푹 쉰답니당 ㅎㅎ 여름엔 대실하는 게 젤 편한 것 같아여 어디 안 돌아다니고 ㅎㅎㅎ 아주 추천해요~~,5,3년 전
y_33_817,전주 와이케이,안용,깨끗하고 가성비 좋아요~,4,5년 전
y_33_818,전주 와이케이,내일도여기로,.아주 좋았습니다 전북대학교 놀러오거나 주변에 올 일 있을 때 숙소는 고민할 필요도 없이 여기로 하고 있습니다!! 자주 애용하는 곳이고 객실 컨디 션 및 너무 좋습니다 다음에 또 이용할게요,5,1년 전
y_33_819,전주 와이케이,오들5들,북대에서 접근성도 너무좋고 시설도 매우 깨끗해서 아주 좋았습니다. 사장님이 매우 친절하셔서 더 편하게 머물렀다가 간것 같아요. 비가 와서 날도 추웠는데 따뜻해서 좋았어요 재방문의사100%입니다!,5,4년 전
y_33_820,전주 와이케이,무등산돈가스,청결하고 시설좋아요,5,5년 전
y_33_821,전주 와이케이,자급적인신발,좋아요졸아오오오오오오오,4,5년 전
y_33_822,전주 와이케이,자급적인신발,좋아용오오오오오오오오오,4,5년 전
y_33_823,전주 와이케이,악마린,확트인창 좋았는데 헠 아침에 방안이 훤히 보이네요 ㅎ,3,6년 전
y_33_824,전주 와이케이,자급적인신발,좈ㅎ아요좋아요오오오옹,4,5년 전
y_33_825,전주 와이케이,자급적인신발,좋ㅇ으ㅡ으으으으으으으,4,5년 전
y_33_826,전주 와이케이,자급적인신발,좋아요졸아요오오오오옹,4,6년 전
y_33_827,전주 와이케이,자급적인신발,좋아요좋아요좋아요오오,4,6년 전
y_33_828,전주 와이케이,안용,깨긋하고 좋아요..,4,5년 전
y_33_829,전주 와이케이,박진완3,리모델링이 잘 돼서 깔끔했어요 근데 방안에 있는 라디에이터가 방을 따듯하게 해주진 못했어요 수압이 약한것도 아쉬웠습니다! 그래도 전반적으로 만족스러웜쑵니더,5,6년 전
y_33_830,전주 와이케이,자급적인신발,좋아요좋아오오어엉ㅅ,4,5년 전
y_33_831,전주 와이케이,자급적인신발,좋습니다조아아아앙차,4,5년 전
y_33_832,전주 와이케이,GC14960550328,구슉 ㅅㄱ 수굿굿귯굿숫굿,5,3년 전
y_33_833,전주 와이케이,반*****,3년만에 전주 재방문해서 갔던 곳이였는데 너무 실망했어요 ㅠ 체크인할때 직원분이 자다 일어나서 방키도 잘 못 주셔서 정리도 안 된 곳 주시고 사과 한마디 안하시고 본인도 잘 못 주신거 아는지 그냥 다른방 키만 들고 카운터에 서 계서더라고요 정말 기분나쁘고 어이없었어요 여기 시설이 너무 좋아서 생각나서 온건데 그ㅑ냥 그 직원때문에ㅜ기분 별로 였어요,3,2년 전
y_33_834,전주 와이케이,충격적인불,잘쉬고갑니다아 .,5,2년 전
y_33_835,전주 와이케이,무아호야,"혹시 제가 방에 버스 정기권을 두고 나왔는데 찾기 힘들겠죠,,,? 빨강색 카드입니다",5,1년 전
y_33_836,전주 와이케이,자급적인신발,좋아요좋아아아아아양,3,5년 전
y_33_837,전주 와이케이,자급적인신발,좋아요좋아오오오오옹,3,5년 전
y_33_838,전주 와이케이,꼬마추장,다시외도깨끗해요 굿,5,2년 전
y_33_839,전주 와이케이,푸른어부,깨끗하고 즇아여~~~,5,4년 전
y_33_840,전주 와이케이,이구역의방랑자,이번에도 역시 잘 머물다 갑니다!! 항상 쾌적해서 맘에 들어요!! 이번에도 역시 잘 머물다 갑니다!! 항상 쾌적해서 맘에 들어요!! 이번에도 역시 잘 머물다 갑니다!! 항상 쾌적해서 맘에 들어요!!,5,1년 전
y_33_841,전주 와이케이,분주한두꺼비,깨끗하고 좋아여! 시설도 괜찮아여!,5,1년 전
y_33_842,전주 와이케이,꽃분홍색샹크스,깔끔하고 가성비 좋고 잘 쉬었습니다,4,1년 전
y_33_843,전주 와이케이,졸린무,오랜만에 이용했어요~ 이 가격에 이만큼 대실 할 수 있다니 너무 혜자인 것 같아요! 비도 오고 추웠는데 안에서 따뜻하게 넷플릭스 보면서 맛있는거 먹으면서 푹 잘 쉬다 왔습니다! 다음에 또 이용 할게요,4,2년 전
y_33_844,전주 와이케이,구불구불한가격,시설도 깔끔하고 조용해서 좋습니다,5,1년 전
y_33_845,전주 와이케이,유쾌하고평온한중국집,"자주 이용하는데, 깨끗하고 조아요!",5,1년 전
y_33_846,전주 와이케이,남다르고창의적인개트윅공항,시설도 깔끔 사모님도 이쁨 모든 게 좋았습니다!,5,1년 전
y_33_847,전주 와이케이,8930460,생각보다 좋아서 놀랐습니당 굿 ㅋㅋ,4,6년 전
y_33_848,전주 와이케이,분주한두꺼비,청결하고 좋아요 청결하고 좋아요청결하고 좋아요 청결하고 좋아요청결하고 좋아요 청결하고 좋아요청결하고 좋아요 청결하고 좋아요청결하고 좋아요 청결하고 좋아요청결하고 좋아요 청결하고 좋아요,5,1년 전
y_33_849,전주 와이케이,꽃분홍색야자수,미리 주차해둘 수 있게 배려해주시고 다른 모텔들과 다르게 큰 창이잇어 답답하지 않고 방도 너무 넓고 깨끗하규 좋았어요 ㅎㅎ,5,5년 전
y_33_850,전주 와이케이,졸린무,"스카이뷰는 처음 이용해봤는데요~ 와이케이는 원래 넓은데 더 커보이더라구요! 다른 곳과는 다르게 티비가 더 위에 달려있으면서 기울어져 있고 좌우로 돌릴 수 있어서 좋았어요! 다만 창문이 크다보니까 넘 춥더라구요ㅠㅠㅠ화장실도 그렇고,,,공기랑 방바닥이 조금 더 따뜻하면 좋을 것 같아요! 추운 날에 잘 쉬다갑니다~",4,2년 전
y_33_851,전주 와이케이,와인없인못살아,시티뷰 밤에보니 이쁘고 방도 깨끗해서 잘 쉬었네요,4,6년 전
y_33_852,전주 와이케이,1739753,살짝 아쉽네요 그래도 괜찮습니다.,3,5년 전
y_33_853,전주 와이케이,6041286,그럭저럭괜찮은데 너무밝아요,4,6년 전
y_33_854,전주 와이케이,찜찜한개그맨,감사히 잘 쉬었습니다~,4,1년 전
y_33_855,전주 와이케이,marzanaa2,좋아요 청결하구 대학로중심부라더좋앗어요,5,1년 전
y_33_856,전주 와이케이,분주한두꺼비,청결하고 좋아요!!청결하고 좋아요!!청결하고 좋아요!!청결하고 좋아요!!청결하고 좋아요!!청결하고 좋아요!!청결하고 좋아요!!청결하고 좋아요!!청결하고 좋아요!!청결하고 좋아요!!,5,2년 전
y_33_857,전주 와이케이,11235724,진짜.. 너무 화가 나더라구요 저희가 여기 한두번 이용하는 것도 아니고 좋아서 매번 웃으면서 넘어가는데 이전에는 너무 불친절하더라구요 하참... 정말 멘탈이 털리네여,0,3년 전
y_33_858,전주 와이케이,8693403,너무너무좋아요 깨끗해요,4,5년 전
y_33_859,전주 와이케이,캔버라석궁,편히 쉬다가요~~~~,4,4년 전
y_33_860,전주 와이케이,자급적인신발,w좋아요 깨끗해요오오,3,5년 전
y_33_861,전주 와이케이,쉰다섯에드워드,잘쉬다갑니다ㅎㅎㅎㅎ,4,5년 전
y_33_862,전주 와이케이,자급적인신발,좋아요좋아요오오오오,3,5년 전
y_33_863,전주 와이케이,마카롱주세요,깔끔하고 아늑한 방 은은한조명 발코니가 있는게 너무 좋았고 따듯하고 구성품이나 배려가 좋았습니다!,5,6년 전
y_33_864,전주 와이케이,꼬마추장,전망좋고 발코니가있어조아요,5,2년 전
y_33_865,전주 와이케이,굿맨76,잘 쉬다 갑니다 주차장 입구가 좀 좁아서 들어가는데 쬐끔 힘든거 빼고 ㅎㅎ 아 비데 없어요 ㅠㅠ,5,4년 전
y_33_866,전주 와이케이,12057230,휴무에 대실 이용 했는데 뷰도 괜찮고 조명도 이쁘고 너무 좋았어요 재방문 의사 100프로 입니다,5,4년 전
y_33_867,전주 와이케이,9948609,깨끗하고 수압도좋고 방도 뜨끈하니 좋았는데...방음이정~~~~~말 안되요...옆방 말소리까지 다들립니다,2,5년 전
