id,name,nickname,review_content,rating,write_date
y_40_129,전주 브라이튼 호텔-BRIGHTEN,건방진범고래,전주에 볼일이 있어 왔는데 숙소가 너무 깔끔하구 사장님도 되게 친절하시구 좋네요 전화장실이 깨끗한걸 선호하는데 그냥 청결쪽으로는 말할게없이 너무 깨끗하네용 전주오면 자주 이용할거 같아요,5,5개월 전
y_40_130,전주 브라이튼 호텔-BRIGHTEN,재미있고문학적인28세,깔끔하고 좋았습니다.,4,7개월 전
y_40_131,전주 브라이튼 호텔-BRIGHTEN,뀰사장,전주에 축구 응원하러 와서 끝나고 1박 하였는데 주차장 넓고 사장님 매우 별다섯개 친절하시고 객실 청결도 별다섯개 다음에 또 축구응원오게 되면 원픽입니다. 👏👏👏👏👏,5,11개월 전
y_40_132,전주 브라이튼 호텔-BRIGHTEN,길쑥길쑥한이사,전주 갈때마다 종종 이용하는데 사장님 너무 친절하시고 다 좋습니다~,5,8개월 전
y_40_133,전주 브라이튼 호텔-BRIGHTEN,알쏭달쏭하고창의적인비빔밥,아침밥도 너무 맛있었어요. 과일도 다양하고 빵도 씨리얼도 맛있어서 너무 만족했네요. 스타일러도 잘 이용했어요ㅎㅎ 담에 중화산동 올 일 있으면 브라이튼으로 올게요,5,3개월 전
y_40_134,전주 브라이튼 호텔-BRIGHTEN,오우주형아,저번에 방문해봤는데 깔끔해서 재방문하네요 주차도 편해요,5,2개월 전
y_40_135,전주 브라이튼 호텔-BRIGHTEN,오형입니다,시설도 좋고 사장님 인심도 좋고 다 좋은데 샤워기 수압이 아쉽더군요 그거 빼면 다 좋아요,4,10개월 전
y_40_136,전주 브라이튼 호텔-BRIGHTEN,jhjykslove,"전주 여행 왔다가 예약한 숙소에요. 깔끔하고 깨끗했어요 조식도 맛있게 잘 먹고 왔습니다 토스트, 구운계란, 커피, 주스 알차게 먹었네요 ^^ 4인 가족 잘 쉬다갑니다 !",5,10개월 전
y_40_137,전주 브라이튼 호텔-BRIGHTEN,쏘킬러,숙소정할때 리뷰를 좀 보는편인데 한결같이 깔끔하고 침대가 편하다는 평을 보고 선택하게되었습니다~실제로 깔끔하고 편안한 숙소가 마음에 들어서 킾~~단 우리가 머문곳 뷰는 별로였습니다^^,4,9개월 전
y_40_138,전주 브라이튼 호텔-BRIGHTEN,가벼운방랑자,텐트온돌+침대 방을 아이들이 아주 좋아했고 그래서 2박 머물렀습니다 시설 청결하고 일하는 분들 전반적으로 친절하십니다 단점은 보일러 컨트롤을 제어하지못합니다 첫날은 진짜 냉방이었고 둘째날은 너무 더워서 진짜 심한 몸살감기에 걸렸지만 침대만 있는방이었으면 좀 덜 민감했을거같고 감기에 걸렸더라도 다시 방문할 의사가 있습니다 조식도 기대치않게 잘먹고 갑니다,4,6개월 전
y_40_139,전주 브라이튼 호텔-BRIGHTEN,cableguy,"추천으로 숙소를 잡았는데, 따뜻하게 잘 자고 나왔습니다. 청결은 당연한거 알죠?",4,7개월 전
y_40_140,전주 브라이튼 호텔-BRIGHTEN,희경아,숙소깨끗하고 직원분들 친절했어요. 맛있는 아침까지 든든하게 먹을 수 있어서 좋았어요. 추운날씨에 신경써주셔서 감사합니다.,5,9개월 전
y_40_141,전주 브라이튼 호텔-BRIGHTEN,지몽s,잘 쉬었습니다....,4,11개월 전
y_40_142,전주 브라이튼 호텔-BRIGHTEN,무지개뜨는인생,너무따듯하고 침대 매트리스가 편안한 잠을 잤어요,4,4개월 전
y_40_143,전주 브라이튼 호텔-BRIGHTEN,하얀차차,깨끗하구요 온돌이라 아이들이 좋아하네요 잘쉬다 갑니다~,5,7개월 전
y_40_144,전주 브라이튼 호텔-BRIGHTEN,배고픈강쥐,5인 숙소 찾다가 예약했어요. 방은 깨끗하고 화장실 시설도 괜찮아요. 근데 그냥 좀 넓은 모텔방에 이불 3개 깐 느낌이긴 해요. 까는 이불이 두껍거나 폭신하진 않아서 약간 허리아팠어요. 그래도 크게 나쁜점 없이 무난무난 묵었던 숙소였습니다.,4,10개월 전
y_40_145,전주 브라이튼 호텔-BRIGHTEN,달려라크롱,깔끔해서 좋아요 . ..,4,11개월 전
y_40_146,전주 브라이튼 호텔-BRIGHTEN,강렬하고희망찬소름,친절하시고 방도 넓고 따뜻하고 깨끗했어요! 테이블도 있어서 음식 먹기 편했고 욕실도 넓어서 불편함이 없었네요! 전주 다시 가게 되면 또 들를 것 같습니다!,5,6개월 전
y_40_147,전주 브라이튼 호텔-BRIGHTEN,깔끔하고유쾌한짐바브웨,친절하고... 깨끗하고... 가격 만족하고 ... 주변 먹거리 있고 ... 좋았습니다.,4,5개월 전
y_40_148,전주 브라이튼 호텔-BRIGHTEN,엄청나고바람직한마포대교,방이 깔끔하고 넓어요 욕실도 넓어요!! 침대도 푹신하고 직원분들 친절했습니다~,5,6개월 전
y_40_149,전주 브라이튼 호텔-BRIGHTEN,태연의친한친구,"전반적으로 깔끔하고 흠잡을곳이 없습니다. 스타일러가 있어 출장나온 직장인으로서 매우 만족합니다. 화려한곳이 아니지만, 깔끔 단정한 객실을 원하시는 분들에게 좋은 숙소입니다. 화려하지 않다고 했지만, 오래된건 아니고 전반적으로 현대식으로 준수한 인테리어입니다.",5,6개월 전
y_40_150,전주 브라이튼 호텔-BRIGHTEN,하늘색기갑부대,중화산동 객실중 리모델링 잘된곳,3,9개월 전
y_40_151,전주 브라이튼 호텔-BRIGHTEN,한국과학기술원쨈,일하시는 분이 정말 정말 친절하셨어요~ 위치도 좋고 침대도 엄청 편해서 잘 쉬다 갑니대,5,9개월 전
y_40_152,전주 브라이튼 호텔-BRIGHTEN,셔니공주님,시설 아주 좋고 인테리어 깔끔하네요 객실 내 금연이라서 아주 쾌적하고 좋아요,5,6개월 전
y_40_153,전주 브라이튼 호텔-BRIGHTEN,걍대충지음,올때마다 편히 잘 쉬다가요,5,2개월 전
y_40_154,전주 브라이튼 호텔-BRIGHTEN,다정하고활발한비글,청결하고 든든하게 조식도 먹을 수 잇어서 좋았습니다~ 스타일러 덕분에 옷 땀냄새도 지우고 좋았어요! 그리고 메트리스 정말 좋네요. 밖에서 잘 못자는 저인데 푹 잘잤습니다!!,5,9개월 전
y_40_155,전주 브라이튼 호텔-BRIGHTEN,민감한불교,삼천동막걸리 골목을 가기위해 예약한 숙소였는데 택시타고 8분~ 거리가 가깝고좋았어요~ 리모델링을 했는지 깔끔하고 세련되었어요. 침대도 푹신하고 고급스러웠습니다. 강추^^,5,9개월 전
y_40_156,전주 브라이튼 호텔-BRIGHTEN,고두스,추천합니다. 시설 위치 다,5,7개월 전
y_40_157,전주 브라이튼 호텔-BRIGHTEN,쓰리원지니,가족들과 함께 이용했는데 완전 만족했습니다.. 객실 룸도 크고.. 컨디션도 최고였습니다.. 사장님 내외분도 친절하시고.. 다음 전주 방문시도 이용하도록하겠습니다!!,5,11개월 전
y_40_158,전주 브라이튼 호텔-BRIGHTEN,쓰리원지니,가족들과 함께 이용했는데 완전 만족했습니다.. 객실 룸도 크고.. 컨디션도 최고였습니다.. 사장님 내외분도 친절하시고.. 다음 전주 방문시도 이용하도록하겠습니다!!,5,11개월 전
y_40_159,전주 브라이튼 호텔-BRIGHTEN,동진사마,깔끔하고 친절해요 추천,5,6개월 전
y_40_160,전주 브라이튼 호텔-BRIGHTEN,GC1506517398,깔끔하고 좋아요 아침간식도 맛있어요,4,9개월 전
y_40_161,전주 브라이튼 호텔-BRIGHTEN,태민맘알라뷰,내돈ㆍ내후기~너무 감사한 하루였습니다 너무 친절하시고 무료로 제공하는 조식 토스트ㆍ구운계란ㆍ시리얼ㆍ쥬스ㆍ커피등 간단히 아침은 충분한 식사였습니다 담 전주에 가게되면 또가고싶은 숙소입니다 숙소근처는 먹거리가 풍부하고 전주한옥마을도 가까워서 좋았습니다 감사합니다,5,11개월 전
y_40_162,전주 브라이튼 호텔-BRIGHTEN,지몽s,잘 쉬었어요.....,4,9개월 전
y_40_163,전주 브라이튼 호텔-BRIGHTEN,이칼리우스,지방출장 20년차 다른건 모르겠으나 침구류는 정말 마음에듬,4,8개월 전
y_40_164,전주 브라이튼 호텔-BRIGHTEN,애니멀카페병풍,침대 불편한거 빼고 괜찮았어요,4,4개월 전
y_40_165,전주 브라이튼 호텔-BRIGHTEN,방라바라,좋았어요 주차장도 넓고,4,1년 전
y_40_166,전주 브라이튼 호텔-BRIGHTEN,hp몽블랑제,출장오면 항상 잘자고 갑니다~,5,7개월 전
y_40_167,전주 브라이튼 호텔-BRIGHTEN,강렬하고창조적인벽돌색,한옥마을과 차로 12분 정도 거리구요 깨끗하고 따뜻하고 조식서비스 있어서 잘 머물다 갑니다,5,4개월 전
y_40_168,전주 브라이튼 호텔-BRIGHTEN,fbi1113,출장을 자주 다니다보니 숙소를 나름대로 정하는 기준이 있죠 ... 청결좋고 주차 편했습니다. 직원분들도 친철합니다. 전날 잘못된 선택으로 힘든 밤이었는데 이곳은 정말 깨끗하고 편합니다.,5,8개월 전
y_40_169,전주 브라이튼 호텔-BRIGHTEN,스파랜드대공포,"응대해주신 직원분들 너무 친절하셨고, 아이들과 편하게 잘 보내다 왔어요:)",5,6개월 전
y_40_170,전주 브라이튼 호텔-BRIGHTEN,하늬아범,냄새 없고 깔끔하고 프라이빗 하니 좋았습니다,5,11개월 전
y_40_171,전주 브라이튼 호텔-BRIGHTEN,예린주원이아빠,"애기들이 텐트를 너무 좋와하네요! 숙소 깨끗하고, 조식 구성이 알찹니다!",5,6개월 전
y_40_172,전주 브라이튼 호텔-BRIGHTEN,페르소나79,따뜻하고 침대가 잠이 잘오더라구요 욕조 있어서 피로가 풀렸어요,5,6개월 전
y_40_173,전주 브라이튼 호텔-BRIGHTEN,hp몽블랑제,이번주도 깨끗한 방에서 잘잤습니다. 침대가 푹신하고 이불도 뽀송하고 좋아요~ 이번엔 한가지 제안드리면 거울을 앉아서 볼수 있으면 좋겠어요~,5,8개월 전
y_40_174,전주 브라이튼 호텔-BRIGHTEN,자립적이고기대하는포레스트,모텔촌에 있어서 모텔인가보다했는데 청결이나 시설보니 호텔급으로 좋았네요! 만족입니다,4,7개월 전
y_40_175,전주 브라이튼 호텔-BRIGHTEN,천안자목련,직원분들 친절최고 서비스 최고 고데기 충전기 다 대여가능 최고 다만 충전기는 작동을 안했어요ㅠㅠ 여튼 급으로 잡았는데 청결하고 아주 만족하고 갑니다😊,5,9개월 전
y_40_176,전주 브라이튼 호텔-BRIGHTEN,섭섭한코뿔소,주차도 편하고 직원도 친절해서 편한밤 되었네요,5,7개월 전
y_40_177,전주 브라이튼 호텔-BRIGHTEN,쿤쭈,모텔이 맞나 싶을 정도로 깨끗하고 쾌적했습니다. 앞으로 전주오면 무조건 여기,5,7개월 전
y_40_178,전주 브라이튼 호텔-BRIGHTEN,도깨비홍,4인가족이 자기에 좋았습니다. 침대도 있고 온돌도있어서 애기랑 자기는 딱 좋았어요.,5,7개월 전
y_40_179,전주 브라이튼 호텔-BRIGHTEN,시큼한양치식물,여직원분께서 너무 친절 하셔서 다음 출장때도 방문 예정 입니다~ 침구류도 편안하고 너무 좋았어요~,5,10개월 전
y_40_180,전주 브라이튼 호텔-BRIGHTEN,hp몽블랑제,주차장이 조금 좁은편인데 항상 출장오면 잘자고 갑니다~,5,7개월 전
y_40_181,전주 브라이튼 호텔-BRIGHTEN,hp몽블랑제,주차장이 조금 좁은편인데 항상 출장오면 잘자고 갑니다~,5,7개월 전
y_40_182,전주 브라이튼 호텔-BRIGHTEN,hp몽블랑제,주차장이 조금 좁은편인데 항상 출장오면 잘자고 갑니다~,5,7개월 전
y_40_183,전주 브라이튼 호텔-BRIGHTEN,안양제사,청소가 잘 되어있습니다 편안히 푹 쉬었습니다,4,10개월 전
y_40_184,전주 브라이튼 호텔-BRIGHTEN,걍대충지음,깨끗하고 친절하고 잘 쉬다 갑니다. 뽑기 상품도 받아서 좋았어요!,5,6개월 전
y_40_185,전주 브라이튼 호텔-BRIGHTEN,감동적이고맑은통로,잘이용했습니다 감사합니다,5,11개월 전
y_40_186,전주 브라이튼 호텔-BRIGHTEN,동진사마,가성비갑 강력 추천합니다,5,6개월 전
y_40_187,전주 브라이튼 호텔-BRIGHTEN,꽃길만걷자1,편안히 잘 쉬다가 갑니다,5,3개월 전
y_40_188,전주 브라이튼 호텔-BRIGHTEN,자립적이고꼼꼼한아이스크림,객실도 넓고 깔끔하니 너무 좋았어요! 배달음식을 시켜먹을때 수저를 깜빡해서 카운터에 요청했는데 주셔서 너무 감사했어요🥰,5,10개월 전
y_40_189,전주 브라이튼 호텔-BRIGHTEN,으흐흐흐369,너무 친절하고 시설도 너무 좋습니다~!! 최고입니다!,5,6개월 전
y_40_190,전주 브라이튼 호텔-BRIGHTEN,꺄은뀨한효미니,침구류가 편안 해서 꿈잠 잤습니다,5,10개월 전
y_40_191,전주 브라이튼 호텔-BRIGHTEN,반직업적인님,두번째 머무는 숙소인데 여전히 객실 컨디션 좋습니다 추천드려요,5,6개월 전
y_40_192,전주 브라이튼 호텔-BRIGHTEN,여기어때 이용 고객,잘이용했습니다. 감사합니다. 친절하십니다.,5,11개월 전
y_40_193,전주 브라이튼 호텔-BRIGHTEN,독자적인무릎바지,조식 토스트와 계란 음료 커피 감동입니다.,5,7개월 전
y_40_194,전주 브라이튼 호텔-BRIGHTEN,깔끔하고다감한스웨덴,정말 깨끗하고 좋아요 굿굿,5,2개월 전
y_40_195,전주 브라이튼 호텔-BRIGHTEN,악착스러운소식,"2돌 안된 아기와 함께 방문했습니다. 너무 깨끗하고 청결해서 좋았고, 아기가 텐트가 있어 너무 좋아했습니다. 재방문 의사 있습니다. 다시 또 예약하겠습니다^^",5,5개월 전
y_40_196,전주 브라이튼 호텔-BRIGHTEN,우리냥이,친절하시네요 조식류가 잘준비되어있고 계속떨어지지않게 나오네요 잘쉬다가 갑니다,3,5개월 전
y_40_197,전주 브라이튼 호텔-BRIGHTEN,약공장킴프로,친절함은 최고네요 ^^ 애들과 즐거운 하루 잘보내고 갑니다 감사합니다,5,3개월 전
y_40_198,전주 브라이튼 호텔-BRIGHTEN,루니야패스,깨끗하고 방도 큽니다 에어컨도 최근모델이도 스타일러 공기청정기 다있고 좋았네요 가격도 싸고 아주 만족합니다,5,9개월 전
y_40_199,전주 브라이튼 호텔-BRIGHTEN,독특하고소박한마이크로컴퓨터,브라이튼은 ㅋㅋㅋ 진짜 또 오고 싶게 만드네요 지짜 🤍,5,3개월 전
y_40_200,전주 브라이튼 호텔-BRIGHTEN,늙어도잘살자,"넓고 조용한호텔, 종업원도 친절합니다",5,12개월 전
y_40_201,전주 브라이튼 호텔-BRIGHTEN,고두스,전주가면 늘가는 숙소에요,5,7개월 전
y_40_202,전주 브라이튼 호텔-BRIGHTEN,천클리오네,시설이 좋고 깨긋합니다.,5,9개월 전
y_40_203,전주 브라이튼 호텔-BRIGHTEN,빵빵0411,자주 이용하는데 카운터 보시는 분들이 항상 친절하시구 시설도 깨끗하고 좋아요,5,11개월 전
y_40_204,전주 브라이튼 호텔-BRIGHTEN,마니홍,최고잉~~ 친절*실내 만족 전주출장오면 또,5,11개월 전
y_40_205,전주 브라이튼 호텔-BRIGHTEN,실2실2,사진을 찍지못했지만 사장님의 친절함과배려심에 반했어요^^ 아이들과함께 갔는데 너무 좋았어요 쾌적한 환경과 깨끗함 전주를 다시간다면 꼭 다시 묵고싶습니다^^ 잘쉬다갑니다 감사합니다^^,4,9개월 전
y_40_206,전주 브라이튼 호텔-BRIGHTEN,반하다님,편하게 잘 이용했어요~,4,12개월 전
y_40_207,전주 브라이튼 호텔-BRIGHTEN,고고하시죠,친구들과 전주여행와서 편히쉬다갑니다 진짜 깨끗하고 시설이좋았어요,4,10개월 전
y_40_208,전주 브라이튼 호텔-BRIGHTEN,고두스,전주오면 늘 숙박하는 곳,5,6개월 전
y_40_209,전주 브라이튼 호텔-BRIGHTEN,무적삼형제,깨끗하고 넓어서 사용하기좋았어요,5,9개월 전
y_40_210,전주 브라이튼 호텔-BRIGHTEN,빵빵0411,일하시는분들 다 친절하시고 깨끗하고 좋아요,5,10개월 전
y_40_211,전주 브라이튼 호텔-BRIGHTEN,전통문화체험관생쥐,친구들이랑 놀러와서 다같이 잘 수 있는 숙소를 찾던 중 가성비 대박인 곳을 발견했어요!! 다음에도 여럿이 올 땐 꼭 여기로 올게요 따뜻하고 화장실도 크고 스타일러까지 완전 대박!,5,5개월 전
y_40_212,전주 브라이튼 호텔-BRIGHTEN,손오공짱,깨끗하고 좋아요. 여행 왔다 하루 잘 지내고 왔어요 ~,5,4개월 전
y_40_213,전주 브라이튼 호텔-BRIGHTEN,꽃길만걷자1,편안히 잘 쉬다가 갑니다,5,3개월 전
y_40_214,전주 브라이튼 호텔-BRIGHTEN,꽃길만걷자1,편안히 잘 쉬다가 갑니다,5,3개월 전
y_40_215,전주 브라이튼 호텔-BRIGHTEN,여릿여릿한루시,노무 깨끗하고 좋아요 조식도 감사히 잘먹었습니다,5,8개월 전
y_40_216,전주 브라이튼 호텔-BRIGHTEN,신솜1,역시 믿고가는곳 친절하고 깨끗해요^^ 새해복많이받으세요^^,5,6개월 전
y_40_217,전주 브라이튼 호텔-BRIGHTEN,갈짜,편히 지냇습니다 감사합니다,5,11개월 전
y_40_218,전주 브라이튼 호텔-BRIGHTEN,주도적이고지혜로운대원군별장,침대가 좋아요. 잘쉬다갑니다,5,4개월 전
y_40_219,전주 브라이튼 호텔-BRIGHTEN,오우주형아,숙소 깔끔하고 스타일러도 구비 되 있네요!!,4,3개월 전
y_40_220,전주 브라이튼 호텔-BRIGHTEN,애니멀카페병풍,잘 쓰고 갑니다.다음에 또 올게요,5,3개월 전
y_40_221,전주 브라이튼 호텔-BRIGHTEN,애니멀카페병풍,잘 쓰고 갑니다 또 올게요,5,3개월 전
y_40_222,전주 브라이튼 호텔-BRIGHTEN,카불콜먼,처음 숙박하는 티비도 크고 깨끗해서 너무 좋았어요 다음에 또 숙박하러 오겠습니다.,5,10개월 전
y_40_223,전주 브라이튼 호텔-BRIGHTEN,아무렇지않은폭스하운드,항상깔끔하고 좋습니다,5,10개월 전
y_40_224,전주 브라이튼 호텔-BRIGHTEN,사상적인뇌염모기,깨끗하고 친절해서 잘쉬었다갑니다,5,6개월 전
y_40_225,전주 브라이튼 호텔-BRIGHTEN,장일6306,대구 출장을 자주가는데~ 너무 깨끗하고 좋아요~^^,5,8개월 전
y_40_226,전주 브라이튼 호텔-BRIGHTEN,다정하고소박한목각,방이 깨끗했고 직원분들 서비스가 친절했습니다,5,5개월 전
y_40_227,전주 브라이튼 호텔-BRIGHTEN,마리오오,잘쉬다갑니다~~~~~,5,6개월 전
y_40_228,전주 브라이튼 호텔-BRIGHTEN,뻐꾸기시계,부모님과 하룻밤 묵고 가는데 부모님도 만족하시고 쾌적하게 푹 쉬다가 갑니다 다음에도 또 이용할듯 합니다,5,7개월 전
y_40_229,전주 브라이튼 호텔-BRIGHTEN,평양보초병,친절하시고 좋습니다 시설도좋고 조식서비스 깔끔했습니다,5,3개월 전
y_40_230,전주 브라이튼 호텔-BRIGHTEN,진예리,외부에 나오면 잠자는게 불편한데 침대가 좋으네요.잠이 잘오니 피로가 풀려요,5,10개월 전
y_40_231,전주 브라이튼 호텔-BRIGHTEN,잠재적인문화평론가,출장 갈때마다 가는 곳이어서 너무친절하시고 청결도 항상 굿~~굿^^,5,9개월 전
y_40_232,전주 브라이튼 호텔-BRIGHTEN,굳패킹,숙소가 매우 깨끗하고 어매니티가 좋아요!,4,7개월 전
y_40_233,전주 브라이튼 호텔-BRIGHTEN,고두스,굉장히 친절하시고 침대가 진짜 좋습니다!,5,11개월 전
y_40_234,전주 브라이튼 호텔-BRIGHTEN,시도지,위치빼곤 다른 부분 다 좋습니다. 매트리스가 특히 좋네요,5,9개월 전
y_40_235,전주 브라이튼 호텔-BRIGHTEN,제쟤,깔끔하네요 만족합니다!,5,6개월 전
y_40_236,전주 브라이튼 호텔-BRIGHTEN,코코아색경비원,너무 좋아요 잘 쉬다 갑니다,5,4개월 전
y_40_237,전주 브라이튼 호텔-BRIGHTEN,대륙적인막대사탕,깨끗하고 좋아요 또 올게용~~~~,5,10개월 전
y_40_238,전주 브라이튼 호텔-BRIGHTEN,럭키전,청결도 좋고 깔끔 했어여,4,10개월 전
y_40_239,전주 브라이튼 호텔-BRIGHTEN,주도적이고지혜로운대원군별장,좋아요 잘쉬다갑니다 담에또올께요,5,4개월 전
y_40_240,전주 브라이튼 호텔-BRIGHTEN,주도적이고지혜로운대원군별장,깨끗하고 좋아요. 잘쉬다갑니다,5,4개월 전
y_40_241,전주 브라이튼 호텔-BRIGHTEN,말뚱한소행성체,잘 쉬고 갑니다.....,5,6개월 전
y_40_242,전주 브라이튼 호텔-BRIGHTEN,깔끔하고다감한스웨덴,가족끼리 왔는데 정말 좋았어요,5,10개월 전
y_40_243,전주 브라이튼 호텔-BRIGHTEN,유*****,스타일러에서 냄새 쪼끔 나는 거 빼면 다 조앗어용 조식도 야무지게 먹엇습니다 ㅎㅎ,4,6개월 전
y_40_244,전주 브라이튼 호텔-BRIGHTEN,엄청나고진솔한생강주,깨끗하고 사장님 친정하셔요,5,5개월 전
y_40_245,전주 브라이튼 호텔-BRIGHTEN,집은갑갑해,사장님친절하시고 룸컨디션좋아요,5,9개월 전
y_40_246,전주 브라이튼 호텔-BRIGHTEN,고두스,언제나 전주가면 숙박하는 최고의 숙소입니다,5,8개월 전
y_40_247,전주 브라이튼 호텔-BRIGHTEN,도도사랑도도사랑,깨끗하고 침대 정말 좋아요,5,10개월 전
y_40_248,전주 브라이튼 호텔-BRIGHTEN,블랙이글님,깨끗하고 침대 매트리스가 아주 좋아요,5,9개월 전
y_40_249,전주 브라이튼 호텔-BRIGHTEN,쑥스러운뿔,방도 넓고 수압도 쎄고 욕조도 있어서 좋았어요,5,3개월 전
y_40_250,전주 브라이튼 호텔-BRIGHTEN,쿨넘버7,진짜최고~~따뜻하고 너무편하게 쉬고 갑니다~~,5,4개월 전
y_40_251,전주 브라이튼 호텔-BRIGHTEN,가냘프고가냘픈외계행성,방도 깔끔하고 사장님도 친절하고 좋아요!,5,9개월 전
y_40_252,전주 브라이튼 호텔-BRIGHTEN,신솜1,갈때마다 너무 깨끗하고 좋아요^^ 중화산동에서 세손가락안에 들정도로 좋아요^^,5,9개월 전
y_40_253,전주 브라이튼 호텔-BRIGHTEN,빵빵0411,편의도 봐주시고 깨끗하고 너무 좋아요,5,11개월 전
y_40_254,전주 브라이튼 호텔-BRIGHTEN,아들하나중,깔끔하고 깨끗해서 너무 좋았읍니다 17개월 아이와 바닥에서 자기 넓고 편햇어요,5,10개월 전
y_40_255,전주 브라이튼 호텔-BRIGHTEN,배고픈밥돌이,깨끗해서 좋았습니다 😆😆,5,11개월 전
y_40_256,전주 브라이튼 호텔-BRIGHTEN,소주싫어,강성비 굿입니다 좋아요,5,8개월 전
y_40_257,전주 브라이튼 호텔-BRIGHTEN,견고한바가지,벌써 세번째 이용이였네요 전주가 회사에서 숙박이 필요할정도로 멀지는 않아서 보통은 복귀를 했는데 다음날 일정 연결로 하반기에만 세번째 이용이였네요 전체적인 시설 깨끗하고 객실 컨디션도 너무 깨끗했습니다 침구류 뽀송뽀송하니 정말 좋았습니다 직원분들 정말 친절하십니다 이번에는 뽑기도 했네요 꼴찌인것 같아요 견과류 쪼만한 한봉지 받았답니다 그래도 좋았습니다 근처에 먹거리들 많아서 저처럼 혼자 출장이 아니였다면 더욱 더 좋았을것 같네요 혼밥하기 괜찮은 식당은 못찾아서 편의점 도시락 사다가 먹었네요~ 담번에 또 이용 하겠습니다,5,6개월 전
y_40_258,전주 브라이튼 호텔-BRIGHTEN,kys47131,모든것이 만족 합니다 ㆍ,5,10개월 전
y_40_259,전주 브라이튼 호텔-BRIGHTEN,강남방배동,친절하고ᆢ편안했어요 굿,5,5개월 전
y_40_260,전주 브라이튼 호텔-BRIGHTEN,미륵,넓고 깨끗해서 좋아요 잘쉬고왔어요,5,10개월 전
y_40_261,전주 브라이튼 호텔-BRIGHTEN,블랙이글님,숙소도 깨끗이 잘 관련하여 좋았어요,5,9개월 전
y_40_262,전주 브라이튼 호텔-BRIGHTEN,대전곰도리,조용하고 깨끗합니다.,5,9개월 전
y_40_263,전주 브라이튼 호텔-BRIGHTEN,어쭙잖은바닷장어,그냥 여기로 하세요..,5,3개월 전
y_40_264,전주 브라이튼 호텔-BRIGHTEN,이햄돌,정말 애용하는 곳입니다! 장거리 연애라 늘 숙소를 예약하는 편인데 컴퓨터 성능도 좋고 테이블이랑 의자가 있어서 음식 먹기에도 너무 편해요. 그리고 에어컨이랑 공기청정기가 잘 돌아가서 쾌적하고 이번에도 시원하게 이용했습니다~,5,1년 전
y_40_265,전주 브라이튼 호텔-BRIGHTEN,갸름한무릎바지,시설 갈끔하고 친절해요,5,10개월 전
y_40_266,전주 브라이튼 호텔-BRIGHTEN,로즈마리0227,최고요 끝내줌 최신식요,5,10개월 전
y_40_267,전주 브라이튼 호텔-BRIGHTEN,다함TK,침대도 방도 시원하네요 요즘 날씨도 더운데 덥지않게 잘 잤어요 따뜻한 물도 잘 나오고해서 푹쉬었어요 다음에 근처에 또 오게된다면 여기를 이용할께요 편하게 푹쉬고 꿀잠자고 갑니다 번창하세요 침대도 방도 시원하네요 요즘 날씨도 더운데 덥지않게 잘 잤어요 따뜻한 물도 잘 나오고해서 푹쉬었어요 다음에 근처에 또 오게된다면 여기를 이용할께요 편하게 푹쉬고 꿀잠자고 갑니다 번창하세요 침대도 방도 시원하네요 요즘 날씨도 더운데 덥지않게 잘 잤어요 따뜻한 물도 잘 나오고해서 푹쉬었어요 다음에 근처에 또 오게된다면 여기를 이용할께요 편하게 푹쉬고 꿀잠자고 갑니다 번창하세요,5,3개월 전
y_40_268,전주 브라이튼 호텔-BRIGHTEN,R*****,조용하고 깨끗했습니다 좋아요,4,4개월 전
