id,name,nickname,review_content,rating,write_date
y_40_269,전주 브라이튼 호텔-BRIGHTEN,다함TK,침대도 방도 시원하네요 요즘 날씨도 더운데 덥지않게 잘 잤어요 따뜻한 물도 잘 나오고해서 푹쉬었어요 다음에 근처에 또 오게된다면 여기를 이용할께요 편하게 푹쉬고 꿀잠자고 갑니다 번창하세요 침대도 방도 시원하네요 요즘 날씨도 더운데 덥지않게 잘 잤어요 따뜻한 물도 잘 나오고해서 푹쉬었어요 다음에 근처에 또 오게된다면 여기를 이용할께요 편하게 푹쉬고 꿀잠자고 갑니다 번창하세요 침대도 방도 시원하네요 요즘 날씨도 더운데 덥지않게 잘 잤어요 따뜻한 물도 잘 나오고해서 푹쉬었어요 다음에 근처에 또 오게된다면 여기를 이용할께요 편하게 푹쉬고 꿀잠자고 갑니다 번창하세요,5,3개월 전
y_40_270,전주 브라이튼 호텔-BRIGHTEN,파트라슈1019,가족휴가로 전주는 처음이라 숙소를 꼼꼼히 보고 골랐습니다~첫날 많이 늦게 도착했는데 숙소 들어가니 정말 깨끗하고 넓어서 놀랐고 화장실도 정말 깨끗해서 기분이 좋더라고요~이틀동안 편안하게 좋은곳에서 지낼수 있어서 좋았고 친절하신 사장님부부와 직원분들께 감사드려요^^,5,1년 전
y_40_271,전주 브라이튼 호텔-BRIGHTEN,이햄돌,"시설이 깔끔하고 쾌적했습니다! 중문이 있어서 좋았고, 컴퓨터도 렉없이 잘 돌아갔어요~제가 먼지 알레르기 때문에 먼지에 예민한데 불편한 점 없이 편하게 잤습니다. 수압도 좋고 따뜻한 물도 잘 나와서 후에 재이용할 생각입니다 ㅎ",5,1년 전
y_40_272,전주 브라이튼 호텔-BRIGHTEN,GC14957189178,좋습니다 냄새없이 좋습니다!!강추,4,7개월 전
y_40_273,전주 브라이튼 호텔-BRIGHTEN,hp몽블랑제,출장오면 가끔 들리는 곳인데 시설 깨끗하고 내부에 안마의자도 오래된 안마의자 같이 허름하지않고 좋았고 모텔에서 여행용캐리어를 주는 이벤트까지 해줘서 정말 좋았습니다. 오늘또 갈게요~,5,8개월 전
y_40_274,전주 브라이튼 호텔-BRIGHTEN,고미남편2,출장으로 방문했는데 깔끔하고 좋았습니다,5,1년 전
y_40_275,전주 브라이튼 호텔-BRIGHTEN,견고한바가지,전주 출장중에 두번째 이용이였습니다 전에 묵었을때 기억이 정말 좋았던 같습니다 전체 시설 깨끗하고 주차도 어렵지 않았습니다 주변에 식당들도 꽤 있는것 같습니다 혼자라 이용가능 식당이 많지는 않았습니다 카운터 옆에 커피머신 무료라서 그런것인지는 모르겠으나 커피 맛 정말 좋았습니다 룸 컨디션 깨끗하고 좋았습니다 침대 시트도 깨끗했고 욕실도 깨끗했습니다 아쉬웠던점은 샤워기 상태가 영~ 빠른 시일내에 교환이 필요한것 같습니다 직원분들 정말 친절하네요 하루 잘 쉬었다갑니다,5,8개월 전
y_40_276,전주 브라이튼 호텔-BRIGHTEN,자작나무숲화살,전주로 출장을 올때면 고민하지 않고 선택하는곳입니다. 이번에는 주인이 바뀌셨는지 새로운분들이 계셨는데 친절하셨습니다. 주차장에서부터 짐도 들어주시고 너무 친절하셨습니다. 주차장은 조금 협소한듯해도 큰불편은 없습니다 이곳의 가장 좋은점은 침대입니다 침대 쿠션과 편안함이 너무 좋아서 출장시 잠자는게 쉽지 않은데 편안하게 숙면을 취할수 있어서 너무 좋습니다. 그리고 객실에 스타일러가 비치되 있어서 저같은 출장객들은 아주 유용하게 이용을 할수 있어서 좋습니다.,4,1년 전
y_40_277,전주 브라이튼 호텔-BRIGHTEN,물향기수목원등산화,숙소 인근에 음식점 및 편의점이 있어서 편리하구요. 시내와 접근성이 좋습니다. 다만 주차장이 협소하여 자차 이용하시는 분들은 참고하셔야합니다. 차키 맡기시는게 불편하시면 늦은시간에는 주차가 불가합니다. 주변에 이용하는 다른 주차장이 있어서 퇴실시간 말씀하시면 차량 준비해 주십니다. 객실 컨디션은 좋구요. 컴퓨터도 빠르고 잘 돌아갑니다. 매트릭스도 편안하니 좋구요. 따뜻한 물도 잘 나옵니다. 직원분도 친절하시고 카운터에 여분 생수도 챙길 수 있으니 참고하세요. 출장 와서 잘 쉬고 갑니다~,4,1년 전
y_40_278,전주 브라이튼 호텔-BRIGHTEN,세아르,친절하고 시설도깔끔하고 깨끗했어요 다만 스타일러가 고장인지 건조돌리니 소음이심하게 나서 사용못햇어요,5,2년 전
y_40_279,전주 브라이튼 호텔-BRIGHTEN,돌돌한살구나무,너무 잘쉬다갑니다!! 우선 너무 너무 새건물이라 깔끔하고 깨끗하고 쾌적했어요~ 체크인할때 친절하게 맞아주시고 주차장도 엄청 넓아서 좋았고 무엇보다 방에 들어가기전에 물이랑 음료수랑 필요하면 마음껏 더 가져가라고하셔 감동~ 그리고 들어갔는데 화장실도 넓고 스타일러가 있어서 옷을 넣어두고 다음날 입는데 뽀송뽀송해져서 너무 좋았어요!! 저희는 2PC룸으로 예약했는데 게임도 잘돌아가고 완전 좋더라구요~ 넷플릭스도 맘껏보고 주변에 먹을곳이 많아서 너무 잘 놀고 즐기다 왔어요 참! 침대가...진짜 어마어마합니다 제가 원래 침구류칭찬은 잘안하는데 정말 울집이 아닌곳에서 이렇게 푹자본게 얼마만인지 모르겠어요 침대랑 이불이랑 베개랑 다 가져오고싶을정도로 너무 좋았어요~ 퇴실시간도 넉넉해서좋고 보통 다른곳에는 높은층으로 받으면 수압이 너무 약해서 짜증나는데 여기는 수압짱짱하고 물조절도 잘됩니다 딱한가지 조금 아쉬움이 남는게 있다면 헤드셋 빌리러 갔었는데 아직 구비가 안되어있다고해요ㅠ 이제 생긴지 얼마안되서 아직 없는것같던데 조만간 생기겠죠? 여튼 다음 전주여행와도 꼭 재방문할 예정이예요,5,2년 전
y_40_280,전주 브라이튼 호텔-BRIGHTEN,편백지킴이,출장와서 편히 쉬다 갑니다. 아침 조식 간단해서 좋았어요. ㅎㅎ근처 먹거리도 좋구요. 한옥마을도 가깝고... 객실안 너무 청결하고 깨끗했어요...사장님...정말 친절하시고 안내 잘 해주셔서 감사했어요..ㅎㅎㅅㅇㅅ다음에도ㅎㅎ꼭 다시 이용 할것같아요...근처 전주깍두기 식당 왕갈비탕 정말ㅎㅎ 대박 강추 입니다... 진짜 ㅎㅎ국물이ㅡㅡㅡ 끝내주더라구요. ♡♡♡♡♡^^~ 전주오면 꼭 들러서 한그릇ㅎㅎ 샤워압이 좀 약한건 말고는 깨끗하고 조용히 잘 푹 ㅅㅟ 었습니다.감사합니당,4,1년 전
y_40_281,전주 브라이튼 호텔-BRIGHTEN,헬로우몽키,출장을 많이다녀서 여러 숙소를 묵어봤기때문에 숙소에 대한 컨디션을 굉장히 중요하게 생각을 하버다. 그런데 이번에 묵은 숙소는 객실도 깨끗하게 정리되어 있고 방도 춥거나 외풍없이 굉장히 따듯하네요. 입구에 계신 사장님도 굉장히 친절합니다. 담배냄새도 안나고 방음처리도 잘 되어있네요. 욕조가 있어서 출장으로 찌뿌둥하고 피곤한 몸도 풀 수 있어서 굉장히 좋았습니다. 출장을 자주 다니기 때문에 다음에 출장을 오게 되다면 다시 예약을 할 것 같습니다. 다른 분들도 한번 예약해보세요,5,1년 전
y_40_282,전주 브라이튼 호텔-BRIGHTEN,프룻프룻망고에이드,"평일이라 주차 편했어요 . 저녁에는 차가 많더라구요 . 주변에 편의점도 있고 식당들도 있어요 . 걸어서 맥도날드랑 스타벅스도 이용가능해요 . 금연숙소라 입실시 담배냄새 안났고 보일러 빵빵해서 저희는 좀 더웠어요ㅋㅋ . 화장실도 깨끗하고 수압도 좋고 좁지 않아서 안답답해서 좋았어요 . 다만 , 화장실이 입실하고 몇시간 지나지 않아 조금 냄새가 나더라구요 . 디퓨저나 방향제가 있으면 좋을거 같아요 . 스타일러랑 행거가 있어서 옷 보관이 좋네요 . 식탁이랑 의자있어서 포장해온거 먹기도 좋았어요 . 객실도 깨끗한편이고 , 좁지 않아서 좋더라구요~ 화장실에 휴지도 넉넉하게 비치되어서 안심 . 컴퓨터 사양은 나쁘지 않았어요 . 흡연은 1층 주차장 입구 측면에서 가능해요 . 전반적으로 깔끔하고 , 엘베나 객실에서 냄새안나고 침구나 매트리스도 편안하고 이불커버 안에 솜도 엄청 뽀얗고 깨끗해서 꿀잠 자기 좋았어요 . 재방문의사 200% 숙소 맘에 들어서 하루 더 머물렀답니다~",5,1년 전
y_40_283,전주 브라이튼 호텔-BRIGHTEN,서른일곱살함정,"친구가 새로 지어진 신축이라 깨끗할거라고해서 예약잡았는데, 기대이상으로 좋았습니다. 마침 쿠폰적용도 되고 해서 할인도 조금 받았고요ㅎ 근처에 편의점 맥도날드 스벅있어서 먹을거 이거저거 사서 왔어요. 여행와서 2만보이상 걸었는데,고급 안마의자가 제 피로를 싹 다 풀어줬네요ㅋ 울집에도 없는 에어드레서 체험에 넓고 따뜻한 방에서 비싼 침대와 고급 침구덕분에 꿀잠잤어요. 5성급호텔 매트리스라고 써있던데 자보니 고급호텔 부럽지 않더라고요! 간단하게 조식도 챙겨먹을수있고 재방문의사 만프로! ㅋㅋ 아쉬운건 늦게들어와서 넷플릭스시청을 많이 못했어요. 다음엔 입실시간되자마자와서 숙소에서만 놀려고요ㅋㅋ",5,2년 전
y_40_284,전주 브라이튼 호텔-BRIGHTEN,합법적인바다코끼리,"숙소 위치가 상권 중앙에 있지는 않지만 바로 근처에 맥도날드나 스타벅스도 있고 조금만 걸어가도 많은 상권이 있는 곳이라 간단하게 배달을 시켜도 2~30분 내외로 도착하더라구요 위치적으로는 밤에 조용하기도 하고 주차장이나 이용도 편했습니다. 로비에서 안내해주시는 분도 상당히 친절했고 방은 넓은 편에 속하는것 같습니다. PC사양도 좋고 PC방처럼 게임도 깔려있는 인터페이스라 사용도 너무 좋았습니다. TV도 커서 보는 맛이 났구요 ㅎㅎ 근데 숙소에서도 자랑하는 침대, 침구가 진짜 리얼로 사기캐입니다…… 지금까지 왔던 모텔 중 단연코 1등이고 가장 좋아요!! 다음에 또 기회되면 가시 묵겠습니다 ㅎㅎㅎㅎ",5,1년 전
y_40_285,전주 브라이튼 호텔-BRIGHTEN,hp몽블랑제,"잘쉬다가 갑니다. 조용하고 시설부분이 깔끔했습니다. 침대도 좋고,티비도 좋고,화장실이 깔끔했습니다. 전체적으로 깔끔하고 청결했습니다. 주변 먹을때도 있고,근접성이 좋아 다음에 또 이용할께요. 감사합니다.",4,1년 전
y_40_286,전주 브라이튼 호텔-BRIGHTEN,헬로우몽키,출장을 많이다녀서 여러 숙소를 묵어봤기때문에 숙소에 대한 컨디션을 굉장히 중요하게 생각을 하버다. 그런데 이번에 묵은 숙소는 객실도 깨끗하게 정리되어 있고 방도 춥거나 외풍없이 굉장히 따듯하네요. 입구에 계신 사장님도 굉장히 친절합니다. 담배냄새도 안나고 방음처리도 잘 되어있네요. 욕조가 있어서 출장으로 찌뿌둥하고 피곤한 몸도 풀 수 있어서 굉장히 좋았습니다. 출장을 자주 다니기 때문에 다음에 출장을 오게 되다면 다시 예약을 할 것 같습니다. 다른 분들도 한번 예약해보세요,5,1년 전
y_40_287,전주 브라이튼 호텔-BRIGHTEN,대청봉물고기,"전주 막걸리 골목 근처 숙소 찾고 있었는데 객실이 깔끔하고 이쁜 것 같아서 여기로 골랐어요! 사장님과 직원분들도 다 친절하시고 샴푸, 린스 등 모자라다고 말씀 드리니까 객실로 바로 올려다 주셔서 너무 편했습니다 ㅎㅅㅎ 침대 사이즈도 커서 편하게 잠 잘 수 있었습니다. 룸에 스타일러도 있어서 외출 후에 옷을 관리 할 수 있고, 공기청정기 덕분에 쾌적한 상태를 유지할 수 있었던 것 같아요! 전체적으로 건물의 외부, 내부가 깔끔해서 더 좋았던 것 같아요! 다음에 전주오면 또 방문하도록 하겠습니다!",5,2년 전
y_40_288,전주 브라이튼 호텔-BRIGHTEN,지몽s,아마도 욕실 환풍기 돌아가는 소리인듯 한데 다른 방의 소리가 지속적으로 신경이 쓰일 정도로 들려서 좀 불편했습니다 특히 잘때! 잘 쉬다 갑니다~,3,1년 전
y_40_289,전주 브라이튼 호텔-BRIGHTEN,얼맞은감각,너무 좋습니다. 침구류가 정말 좋네요.,5,2년 전
y_40_290,전주 브라이튼 호텔-BRIGHTEN,자작나무숲화살,어제에 이어 연박으로 예약을 했는데 방을 스위트룸으로 업그레이드를 해주셨어요. 안마의자가 있어서 피곤한 몸을 힐링했네요~ 모든게 다 좋은데 침대는 정말 최고예요. 어느 호텔의 침대보다 편안하고 쾌적합니다. 정말 푹 자는데 이만한 컨디션은 출장을 자주 다녀 여러곳을 이용해 봤지만 단연 최고 입니다. 전주 출장때는 무조건 브라이튼으로 예약해야겠어요. 계속 이렇게만 컨디션 유지해주시면 볼것도 없이 숙소 검색하느라 시간낭비 없이 편하게 이용할수 있을거 같습니다 고객에 맞춰 응대해주시는 서비스도 최고였습니다.,5,1년 전
y_40_291,전주 브라이튼 호텔-BRIGHTEN,이쁘고이쁜블루길,신축이여서 그런지 모든게 깔끔하고 넘 좋아요!! 바닥 난방도 뜨끈뜨끈해서 더울지경ㅋㅋ 스타일러도있고 드라이기도 쌔거라 바람쎄기도 좋고 화장실도 넓고 군더더기없네요. 충전기는 카운터에 말하면 주세요. 사장님 넘 친절하셔서 다음에 전주 놀러오면 여기로 잡아야겠어요!!,5,2년 전
y_40_292,전주 브라이튼 호텔-BRIGHTEN,소극적인팔보채,이 숙소 정말 너무너무 추천합니다 ! 전주 오신다면 꼭 여기로 오세요 참고로 저는 숙소 컨디션에 매우 예민한데 근래 제가 가본 숙소중에 제일 좋았어요 밤 늦게 갔는데 룸 업그레이드도 해주시고 가장 기억에 남았던건 너무나 친절한 사장님이셨어요 저도 남자친구도 배려심 넘치는 사장님 덕에 아주 잘 묵고 갑니다 앞으로 여기 자주 애용할 것 같아요! 수압도 좋고 따뜻한 물도 너무 잘나오고 방도 넓어요 특히 침대와 침구류가 너무나 좋아서 잠도 푹 잤고 청결함에 예민한 저로써는 여기저기 다 깨끗해서 참 좋았습니다 🙂 원래 리뷰 길게 안쓰는데 너무 좋아서 처음 써보네요 항상 이렇게 유지해주시면 더할나위 없을 것 같아요! 앞으로 번창하시길 바랍니다 :),5,2년 전
y_40_293,전주 브라이튼 호텔-BRIGHTEN,우주너구리,전주 여행 2박 3일 동안 이용을 했는데 이용하는 내내 매우 편안하게 이용했습니다. 사장님과 다른 직원 분들께서도 매우 친절하게 대해 주셨던 것이 아직도 기억에 남네요^^ 객실 상태는 완벽했습니다. 어디 하나 흠잡을 곳이 없었어요. 방에 들어갈 때 향기부터 기분이 좋았습니다. 객실 모든 곳 구석구석이 완전 깨끗했습니다. 청결을 중요시하시는 분들이라면 이 곳을 이용하기를 강력 추천 드립니다. 침대 매트리스도 좋은 거인지 엄청 편했습니다. 정말 편안하게 쉴 수 있어서 좋았어요. 사장님께서 방도 업그레이드 해주셨는데 다시 한 번 고맙습니다. 숙소 위치도 전주 한옥마을과 신시가지 중간 위치라 어디를 가더라도 편한 위치였어요. 다음 번에 전주 여행을 간다면 숙소는 이곳으로 잡을 거에요!! 다른 분들에게도 강력하게 추천드려요! 전주 여행을 편안하게 즐길 수 있도록 해주셔서 정말 고맙습니다^^,5,1년 전
y_40_294,전주 브라이튼 호텔-BRIGHTEN,5성급게스트,"전주 숙소중에 제일 좋았습니다. 시설, 소음, 방온도, 청결 사장님의 친절도 모두 최고였습니다. 이정도 육각형이 좋은 숙소는 없었습니다. 다음에 또 예약해서 오고싶은 숙소였습니다. 최고예요!",5,2년 전
y_40_295,전주 브라이튼 호텔-BRIGHTEN,고구마치즈볼,부모님께서 전주로 출장을 가셔서 이 호텔로 2박 3일 예약했습니다 부모님 두 분만 보내드리는거라 걱정이 많았는데 부모님께서 정말 만족하셨어요 깨끗하고 친절하고 인테리어도 최근에 리모델링을 했는지 말끔했다면서 참 좋았다고 하시네요ㅎㅎ 근처에 식당도 있고 편의점도 가까이 있어서 편리했다고 하십니다 또 근처에 갈 일이 있으면 이 곳으로 숙소를 잡으시겠대요ㅎㅎ 부모님께서 다른분들에게도 참 좋았다고 홍보도 하셔서 한 분 더 예약잡아드렸어요!ㅎㅎㅎ,5,1년 전
y_40_296,전주 브라이튼 호텔-BRIGHTEN,HotelManiaRev,전주 중화산동에 위치한 브랜드호텔입니다. 중화산동이라는 유흥지역에서 이곳에 묵어야한다면 와야하는 이유는 몇가지가있습니다. 첫째 금연객실 둘째 침구청결 셋째 (여름철) 천장형 시스템에어컨이고 또한 깨끗합니다. 코로나시대에 호흡기질환때문에 다들고생하시는데 깨끗한 에어컨에서 나오는 찬바람으로 시원하고 청결하게 여름보내기 현지인으로써 이동네는 유흥지역이라 금연객실있는곳이 몇 안됩니다.,4,1년 전
y_40_297,전주 브라이튼 호텔-BRIGHTEN,정직하고자신감있는통로,사장님 너무 친절하고 너무 너무 청결해요 진짜 좋아요!! 티비도 너무 잘 나오고 조명도 이쁘고 화장실도 너무 청결해서 기분 좋게 이용했어요 가성비도 좋고 아주 추천드립니다!!! 주변에서 가성비 1등이에요,5,2년 전
y_40_298,전주 브라이튼 호텔-BRIGHTEN,GC1510137627,"시설 및 인테리어 깔끔하고 청결하고 조용했습니다. 로비에 간단한 조식도 준비되어 있어서 간단한 아침식사도 가능합니다. 객실내 비치물품중 헤어스프레이, 헤어젤은 없습니다",5,2년 전
y_40_299,전주 브라이튼 호텔-BRIGHTEN,DMZ에드윈,아이와 다니다보면 숙소 청결이 신경쓰이는데 시설도 깨끗하고 숙소도 좋네요 넓은편이예요 큰침대2개들어갈사이즈~~ 아침 조식서비스도 좋아요 추천합니다^^,5,2년 전
y_40_300,전주 브라이튼 호텔-BRIGHTEN,hp몽블랑제,"잘쉬다가 갑니다. 조용하고 시설부분이 깔끔했습니다. 침대도 좋고,티비도 좋고,화장실이 깔끔했습니다. 전체적으로 깔끔하고 청결했습니다. 주변 먹을때도 있고,근접성이 좋아 다음에 또 이용할께요. 감사합니다.",5,1년 전
y_40_301,전주 브라이튼 호텔-BRIGHTEN,똑바로살아라,좋아요좋아요좋아요좋,4,1년 전
y_40_302,전주 브라이튼 호텔-BRIGHTEN,nicelatter,우선 내부 시설이나 인테리어가 좋습니다. 주인분들도 친절해요. 청결상태가 가장 중요한데 깨끗하고 그 어딜 가든 약간의 모텔 특유의 냄새는 있지만 크게 신경쓰일 냄새는 아닙니다. 주위에 먹을 것도 있고 위치도 좋습니다. 재방문의사 있습니다. 감사합니다.,5,2년 전
y_40_303,전주 브라이튼 호텔-BRIGHTEN,소리보미,"벌써 5월 9일이 되었네. 화사한 햇살을 맞으며 전주로 출장을 나왔는데 내려오는길이 엄청 막혀 무려 3시간도 더 걸렸네요. ㅠ 하지만 힘을 내어 열심히 일과를 마치고 여기어때 어플로 검색 중에, 예전에 머물렀던 중화산동의 브라이튼 호텔로 정하고 예약이 확정되었네요. 쿠폰을 다운받아 저렴하게 입실했고 무엇보다도 입실시간이 오후4시라서 출장나온 사람들에겐 더없이 좋았어요. 일과를 좀 일찍 마치면 오갈데도 없고.참 난처해질 때도 많았거든요. 주변으론 먹을 식당도 꽤 있네요.",5,1년 전
y_40_304,전주 브라이튼 호텔-BRIGHTEN,tlsgusrlf902,리모델링 새로 해서 냄새도 좋고 깨끗하고 깔끔 합니다~|😮 사장님도 친절하시고 무엇보다 겨울인데 오히려 더울정도로 보일러가 빵빵 해요!! (온도조절 가능 ^^) 다음에 또 올게용,5,2년 전
y_40_305,전주 브라이튼 호텔-BRIGHTEN,시카고해마,다음에 전주에 간다면 또 방문예정입니다. 너무 좋아 일부러 좋은점 리뷰쓰러왔어요. 1. 청결 침구도 아주 깨끗하고 화장실 청소상태 좋았습니다. 수건에서 아무 냄새도 안났습니다. 창틀도 깨끗해서 놀랐습니다. 2. 위치 찾기 쉬웠고 주변에 맛집도 많았어요. 주차장도 불편한 점 없었습니다. 3. 룸 크기 뒷날 간 4성급 호텔보다 방도 컸고 침대도 성인 2명이 누워도 넉넉했어요. 4. 조식서비스 급하게 나가느라 이용하진 못했지만 사장님께서 싸주신 계란을 차에서 아주 맛있게 먹었습니다. 5. 사장님 친절 아마 이게 가장 큰 장점이 아닐까 합니다. 이 숙소가 좋은 인상으로 남을수 있었던 가장 큰 이유였습니다. 덕분에 아이들과 함께한 전주여행이 좋은 추억으로 남았습니다. 담에 전주에 가게되면 꼭 다시 방문할게요. 감사합니당^^,5,2년 전
y_40_306,전주 브라이튼 호텔-BRIGHTEN,훈4단,전체적으로 만족하고 청결해서 좋아요,3,2년 전
y_40_307,전주 브라이튼 호텔-BRIGHTEN,hp몽블랑제,"잘쉬다가 갑니다. 조용하고 시설부분이 깔끔했습니다. 침대도 좋고,티비도 좋고,화장실이 깔끔했습니다. 전체적으로 깔끔하고 청결했습니다. 주변 먹을때도 있고,근접성이 좋아 다음에 또 이용할께요. 감사합니다.",4,1년 전
y_40_308,전주 브라이튼 호텔-BRIGHTEN,대전아빠요,4인가족이 여행중인데 부산에서 전주로와서 힘들었는데 먼저 프론트에 주인장님의 친절함에 한번감탄하고 방을보고 깔끔하고 옵션도 좋아서 두번감탄하고 쉬다가 잠깐 나갔다왔는데 방온도 괜찬으시냐고 체크해주시는거에 세번감탄합니다 정말 아이들과 꿀잠자고 전주를 또오면 여기바로 예약하고 올껍니다~여행중 제일 조용하고 편히 쉬다갑니다,5,1년 전
y_40_309,전주 브라이튼 호텔-BRIGHTEN,호롤롤로나방,침구도 푹신푹신하고 완전 새것처럼 하얗고 보송해요 무겁지도않으며 매트리스는 가본 모텔 호텔중 최고였어요 바닥이 따듯했지만 전기장판이 있었으면 좋겠네요 화장실 인테리어도 이쁘고 화장실에 비데있어서 진짜 좋았어요 머리카락도 하나도 안보이고 여기만 이용할것같네요 여자 직원분이 카페에서 파는것처럼 아이스아메리카노도 타주시고 친절하셨어요,5,1년 전
y_40_310,전주 브라이튼 호텔-BRIGHTEN,스위스비숑프리제,"사장님 정말 친절하세요. 들어가면 밝게 인사해주시고 나갈때도 친절하게 얘기해주세요 !! 새로지은지 얼마 안돼서 그런지 룸 컨디션도 굉장히 좋았습니다. 매트리스 강조하셨는데, 강조하실만 해요. 그동안 갔던 숙소 중 가장 푹신하고 편안한 매트릭스 였어요 ,, 덕분에 나가려다가도 잠깐 누우면 다시자고 반복 ,,, 진짜 편안합니당 😆 다만 아쉬운건 에러난 스타일러 정도네용 ,,",5,2년 전
y_40_311,전주 브라이튼 호텔-BRIGHTEN,범서읍천상리,전체적으로 숙소는 깔끔하고 좋았습니다. 단점이라고 한다면 보일러 소리였습니다.,4,1년 전
y_40_312,전주 브라이튼 호텔-BRIGHTEN,차니세미,새로 오픈한곳이여서인지 호텔 입구부터 객실이 전체적으로 깨끗하고 깔끔하고 청결햇어요~ 직원분들도 친절하시고 무엇보다 객실용품 하나하나 깨끗하고 스타일러도 잇어서 전라도 여행하면서 찜찜햇던 겉옷이랑 패딩도 스팀살균하고 ㅎㅎ 아무튼 다음에 전주오게 되면 다시 또 방문할것같네요 잘쉬고 잘 놀다가 갑니다~ 완전 강추이니 전주오시는분 계시면 이 숙소 추천합니다,5,2년 전
y_40_313,전주 브라이튼 호텔-BRIGHTEN,지훈사랑둥이,침구상태및 청결상태가 너무 좋았습니다.,4,1년 전
y_40_314,전주 브라이튼 호텔-BRIGHTEN,똑바로살아라,리모델링 이후 오랫만에 방문했어요 너무 깨끗하고 좋아요,3,2년 전
y_40_315,전주 브라이튼 호텔-BRIGHTEN,l*****,"숙소에 담배냄새가 없는 게 제일 좋았어요. 침대도 꽤나 푹신했고 시설 모두 쾌적하고 깔끔한 편이었습니다. 카운터에서도 친절하시고, 푹 잘 쉬었다 갑니다 기회되면 다음번에도 방문할 의향 있어요",5,2년 전
