id,name,nickname,review_content,rating,write_date
y_40_316,전주 브라이튼 호텔-BRIGHTEN,appstore,진짜 너무 좋았어요 ㅜㅜ 최고 !!!!!💖💖💖 종종 전주 올때마다 숙소 예약하느라 머리아팠는데 앞으론 여기만 오려구요 .. 저는 무조건 리뷰 보고 더럽다는 얘기 있으면 절대 안가는데 여기 생긴지 얼마 안됐다고하고 깨끗하다고 해서 와봤는데 세상에나… 진짜 넘 깨끗하고 시설도 너무 좋고 침대도 너무 좋아요!!! 처음 들어갔을 때 담배쩐내라든가 소독약냄새같은거 전혀안나고 화장실 진짜 깨끗하고 샴푸린스바디워시 상큼한 유자향이던데 진짜 넘 좋았어요.. 저도 사서 쓰고싶은정도여서 뭔지 궁금했어요 ㅋㅋ 처음 들어갔을때도 사장님 진짜 친절하게 안내해주셨고 방 업그레이드해주신것도 넘 감사드려요🥹 불편한 부분이 하나도 없고 모든 부분 만족스러웠어요 !! 진짜 밤에 너무 편하게 잘자고나와서 구구절절 써내려갑니다 ㅠㅠ 담에 전주 올 때 또 여기로올게요 !!! 감사합니당🙇🏻‍♀️,5,2년 전
y_40_317,전주 브라이튼 호텔-BRIGHTEN,몽동82,최근에 지어진거라 너무 깨끗하고 깔끔했고 침대또한 매우 만족입니다. 한가지 아쉬운점이 있다면 샤워기 해도가 분사조절이 안되네요. 이것빼곤 모든게 완벽합니다. 지금상태만 유지 하신다면 완전 나이스할것 같네요,5,2년 전
y_40_318,전주 브라이튼 호텔-BRIGHTEN,하리보뀨,"들어가자마자 깨끗하고 담배냄새는 1도 안 나서 너무 좋았어요!! 스타일러도 있어서 좋아요 ㅎㅎ 컴퓨터도 너무너무 잘 돌아갑니다! 피파 돌아가요~!! 음식 먹을 수 있는 탁자가 있어서 좋고, 무엇보다 침대가 너무 좋아요ㅠㅠㅠ 허리 안 좋은데 여기서 하루 잤다고 다음날 허리가 안 아프더라구요... 역시 매트리스는 비싼걸 써야하나봐요 ㅎㅎ 침구도 깨끗하고 화장실도 깨끗해요! 다음에도 pc텔 이용하게 되면 여기로 다시 올거에요! 너무 만족스러웠습니다 ㅎㅎ 아!! 그리고 가운에서 너무너무 좋은 냄새가 나서 진짜 섬유유연제 뭐 쓰는지 궁금해요ㅠㅠ 알려주시면 안되나요 ㅎㅎ.. 너무 제스타일 !!!",5,2년 전
y_40_319,전주 브라이튼 호텔-BRIGHTEN,수산이다,깨끗하고 친절해서 좋았습니다,3,1년 전
y_40_320,전주 브라이튼 호텔-BRIGHTEN,rionwoods,오픈한지 얼마 안돠어서 깨끗하고 깔끔합니다. 출장차 왔는데 여사장님께서 친절히 맞아 주시고 침대가 일품이라고 편히 쉴 수 있으시단 멘트 방에 들어와 완전 느꼈답니다. 편안한 환경에서 충전 잘 하고 돌아가도록 할께요~,5,2년 전
y_40_321,전주 브라이튼 호텔-BRIGHTEN,쁘띠프랑스불마스티프,아주좋아요 만족합니다 아침 조식 써비스 또한 만족 하고 편히 쉬었다 갑니다,5,1년 전
y_40_322,전주 브라이튼 호텔-BRIGHTEN,조촐한박쥐,객실 컨디션 진짜 너무 좋았어요 ~~ 신축이라 시설이 정말 깨끗하고 불쾌한 냄새도 안 나서 너무너무 기분좋게 이용했어요! 특히 침대가 너무 편했어요 ㅎㅎ 티비로 넷플도 잘나오고 유튜브도 볼수있어서 좋았어요 그리고 사장님이 너무 친절하세요 ㅠㅠ !! 음료도 맘껏 이용하라고 해주시고 ... 다음에 전주 방문할 때도 꼭 다시 이용할게요 !!,5,2년 전
y_40_323,전주 브라이튼 호텔-BRIGHTEN,일곱소대원,컴퓨터 잘 돌아가고 사장님이 친절하셔서 좋아요~~ 스타일러도 좋아요 따뜻하게 잘 쉬다가 갑니다 컴퓨터 잘 돌아가고 사장님이 친절하셔서 좋아요~~ 스타일러도 좋아요 따뜻하게 잘 쉬다가 갑니다,5,2년 전
y_40_324,전주 브라이튼 호텔-BRIGHTEN,니이뿌니해,깨끗하고 친절해요 조식있는것도 좋았어요 주차공간 부족시 발렛도 해주십니다 좋은 숙소였어요!!,5,1년 전
y_40_325,전주 브라이튼 호텔-BRIGHTEN,여든아홉살약,바른후기를 작성해봅니다. 제가 시간을 잘못 보아서 체크인 시간 이전에 도착했으나 입실을 허락해 주셔서 감사했습니다. 저는 입실과 동시에 화장실과 세면대를 보는데 모두 청결했습니다. 침실은 침대가 완전 폭신폭신해요 방 자체에 냄새가 전혀나지 않고 전체적으로 객실자체가 깨끗하고 깔끔한편입니다. 그리고 가장 중요한 금액!!! 가격 대비 완벽합니다. 입실부터 퇴실까지 모든것에 대해 만족하였으며 회사분들이나 지인분들이 인근에 출장 또는 방문하게 된다면 적극적으로 권유할것입니다. 너무 잘자고 쉬다 갑니다.,5,2년 전
y_40_326,전주 브라이튼 호텔-BRIGHTEN,엉성한꼼꼼이,"청결상태 최고!!!창틀까지 깨끗한 곳은 처음입니다.! 진째 객실, 화장실에 머리카락 한 올 없어서 너무 기분 좋았습니다~화장실 바닥에 물기도 하나없고 청노상태 최곱니다!!!적극 추천합니다~!",5,1년 전
y_40_327,전주 브라이튼 호텔-BRIGHTEN,nicelatter,숙소가 깨끗하고 깔끔합니다. 내부 인테리어도 깔끔해서 지내기 너무 좋습니다. 주변에 음식점도 많아서 나가서 사먹기 좋습니다. 주인분도 친절합니다. 다음에도 이 지역으로 온 다음 다시 이 숙소로 묵을 예정입니다. 다른분들에게도 강추합니다.,5,1년 전
y_40_328,전주 브라이튼 호텔-BRIGHTEN,장작난로삼겹,나쁘지않아요 괜찮네요,4,1년 전
y_40_329,전주 브라이튼 호텔-BRIGHTEN,어떤일기장,"스타일러, 공기청정기 기본 탑재. 금액은 주변에 비해 싼 편. 강력추천. 조명이 살짝 어두운거 빼고 상당히 만족스럽습니다.",5,1년 전
y_40_330,전주 브라이튼 호텔-BRIGHTEN,nicelatter,숙소가 깨끗하고 깔끔합니다. 내부 인테리어도 깔끔해서 지내기 너무 좋습니다. 주변에 음식점도 많아서 나가서 사먹기 좋습니다. 주인분도 친절합니다. 다음에도 이 지역으로 온 다음 다시 이 숙소로 묵을 예정입니다. 다른분들에게도 강추합니다.,5,1년 전
y_40_331,전주 브라이튼 호텔-BRIGHTEN,계영기원여이동사,새로오픈한지얼마안된거같아 줄장중 예약하고입장 근데줒다장이조금협소함 화장실 들렀는데 마무리가안되어있네요 꼼꼼하게 직원교육식켜야할듯 합니다 객실에도 머리카락 또거미조그만한거도있고 침구류는아주좋아요 조금더관리가필요하보이네요 아침에직원분이 우지친절해요 냉커피도 타주시더리구요 고마워요,5,1년 전
y_40_332,전주 브라이튼 호텔-BRIGHTEN,파노라마미디어,잘쉬다 옵니다 ㅎㅎㅎㅎ,3,1년 전
y_40_333,전주 브라이튼 호텔-BRIGHTEN,한국과학기술원나팔꽃,숙소가 깔끔해요 출장다니면서 자주 이용하는데 주인분도 친절하십니다.^^ 방도 따뜻하고 청소도 잘되어 있습니다. 메트리스가 좋아서 잠도 깊게 들수있어 너무 좋습니다. 자주 이용할게요 감사합니다.,5,2년 전
y_40_334,전주 브라이튼 호텔-BRIGHTEN,전세계가우리집앞마당,사진은 찍은게 없고 재작년에 리뉴얼 했다는데 아주 깨끗하고 매트리스는 세계 최고 수준의 퀄러티로 아주 편하다. 간단하긴 하지만 모든 객실에 일년내내 조식이 포함돼 있다니 없는 것보다 훨 낫고 방은 화려하진 않으나 수수하고 청결하고 기본적으로 있어야 할 것들 모두 잘 갖추고 있어서 이 정도면 대 만조크~!!!! 업주님은 사업 번창 하시라!!!,5,1년 전
y_40_335,전주 브라이튼 호텔-BRIGHTEN,jshcokr,가격대비 시설 청결 친절 꽤 괜찮아요,5,1년 전
y_40_336,전주 브라이튼 호텔-BRIGHTEN,오십살타워기사,리뷰만믿고 예약했는데 너무좋고편한하루밤을보내고왔네요 다들담에도이용한다고했는데 저역시 전주가면 꼭!여기를이용할게요 사장님도친절하시고 객실도깨끗하고 사장님 감사합니다~^^,5,2년 전
y_40_337,전주 브라이튼 호텔-BRIGHTEN,뚜껑50,"숙소가 새것이라 모든게 좋았고, 사장님의 친절함에 너무 감사드립니다. 여자5명 좋은 침구에서 꿀잠 잤고 스타일러가 있어 옷도 개운하니 좋았어요. 거기다가 정성이 들어간 조식을 먹고 행복하게 잘 놀고 갑니다. 다음번에는 신랑과 꼭 들릴께요. 사업번창하세요~^^",5,2년 전
y_40_338,전주 브라이튼 호텔-BRIGHTEN,프라우드,"객실 상태도 깨끗했고 매트리스,침구 정말 만족스러웠습니다. 조식도 만족스러웠고요~ 더불어 사장님 배려 감사했습니다. 전주 다시 갈 일 있으면 꼭 재이용하겠습니다.",5,2년 전
y_40_339,전주 브라이튼 호텔-BRIGHTEN,파르스름한위병,신축인거죠? 정말 너무 깔끔하고 방에서 새거 냄새가 나요 ㅋㅋ 리모델링 숙소여도 보통 화장실은 리모델링 비용이 좀 있어 그런지 안 하는 곳이 많던데 여기 화장실 너무 깨끗하네요 정말 최고입니다 컴퓨터도 너무 잘 되고 좋았어요 자주 이용할게요,5,2년 전
y_40_340,전주 브라이튼 호텔-BRIGHTEN,6221954,객실이 깨끗하고 좋있습니다 주변에 도보로 맛집들이 있습니다 혹시몰라거 2박만예약했다가 추가로 하루더 묵었습니다 조식도 간단히 먹을만한 구성으로 제공되었네요 직원분들 남자분 여자분 모두 친절하시네요,5,1년 전
y_40_341,전주 브라이튼 호텔-BRIGHTEN,동문23,새로 오픈하셔서 그런지 내부 시설이나 인테리어가 좋습니다. 슬리퍼나 수건에 호텔 이름이 박혀있는거로 봐서 세심하게 신경쓰신 것 같아요. 주인분들도 친절하십니다. 청결상태가 가장 중요한데 깨끗합니다. 주위에 먹을 곳도 많고 위치도 좋습니다. 재방문의사 있습니다. 감사합니다.,5,2년 전
y_40_342,전주 브라이튼 호텔-BRIGHTEN,신성한암랑,"출장갈때마다 숙소를 어디로 해야지 고민을 하는데 여기 지역 근처로 가면 꼭 다시 예약 해야겠네요 숙소도 깨끗하고, 친절하시고 만족도가 높은 편이었네요 용품이나 청소도 괜찮았구요. 잘 이용하다가 갑니다. 또 이용할 의사 있어요~~~",5,1년 전
y_40_343,전주 브라이튼 호텔-BRIGHTEN,짠우물,깨끗해요 잘쉬다갑니다-,4,1년 전
y_40_344,전주 브라이튼 호텔-BRIGHTEN,경주국립공원백성,사장님도 친절하시고 객실도 너무 깔끔했습니다..! 담배냄새 하나도 없고 스타일러랑 비데도 있어서 너무 좋았어요! 다음에 전주올때 여기서 또 묵을꺼에요 ㅎㅎㅎ 번창하세요!,5,2년 전
y_40_345,전주 브라이튼 호텔-BRIGHTEN,대한민국컵라면,신랑하고 주알마다 대실이용하는데 그전부터 가보고 싶었던 곳이었는데 정말 실망시키지 않았네요 생긴지 얼마안되서 그런지 시설도 너무너무 깨끗하고 비품도 잘 되있고 에어컨도 시원하고 사장님도 친절하게 잘 대해주셔서 너무너무 기분좋았네요 또 가보고 싶은곳이네요,5,1년 전
y_40_346,전주 브라이튼 호텔-BRIGHTEN,소리보미,"삼례에서 출장을 마치고 여기어때에서 모텔 검색하던중 전주 브라이튼 호텔이 눈에 띄더군요, 비록 거리가 멀었지만 찾아온 보람이 있네요 룸도 깨끗하고 무엇보다도 담배 냄새가 나지 않아 상쾌 하네요. 카운터 아가씨도 매우 상냥하고 조식 코너도 운영하여 출장중에 이용하기가 참 좋네요",5,2년 전
y_40_347,전주 브라이튼 호텔-BRIGHTEN,빵빵0411,자주 방문하는데 친절하고 시설도 좋고 참 좋아요,4,1년 전
y_40_348,전주 브라이튼 호텔-BRIGHTEN,990612우웅,깨끗하고 담배냄새도 하나도 안났고 화장실도 넓고 쾌적해서 잘 쉬었습니다. 근데 TV 소리가 약간 울리는 먹먹한 느낌이 났어요 그거 외에는 다 좋았습니당,5,1년 전
y_40_349,전주 브라이튼 호텔-BRIGHTEN,살이,생긴지 얼마 안되서 깨끗하구요 따뜻했네요 주차장도 잘되어 있었고 근처에 편의점 맥도날드 등이있어서 편했네요 아침에 간단한 조식있어서 좋았어요 잔체적으로 깨끗하고 친절했네요,5,2년 전
y_40_350,전주 브라이튼 호텔-BRIGHTEN,등황색군복,숙소 엄청 깨끗해요! 다만 수건 하나가 뭐가 묻은채로 안빨려 있어서(빨았는데 안지워진건지ㅠㅠ) 못썼지만 바닥이랑 침대랑 다 깨끗했어요,4,1년 전
y_40_351,전주 브라이튼 호텔-BRIGHTEN,깔끔하고다감한스웨덴,항상 친절하고 좋습니다,5,1년 전
y_40_352,전주 브라이튼 호텔-BRIGHTEN,빛나고배려있는요거트,조용하고 편안한 호텔이였어요!!!,5,1년 전
y_40_353,전주 브라이튼 호텔-BRIGHTEN,소리보미,요즘 장마철이라 비가 억수로 내렸다가 멈추었다가 반복하니 기분이 다운되었다. 오늘도 출장중이라서 모텔의 도움을 받아야 할처지라서 고민중 선뜻 지난번 로비 카운터의 상냥한 아가씨가 떠올라 찾아오게 되었다. 근무지와는 대략 15km 이동해야 했다. 도착하니 주차장도 깨끗하고 방에는 공기청정기와 엘지 스타일러 그리고 네플리스 티비등 잘 정돈되었다.,5,1년 전
y_40_354,전주 브라이튼 호텔-BRIGHTEN,수선이화이팅,룸 컨디션도 좋고 직원도 친절해서 기분좋게 쉬었다 왔어요. 너무 짧아서 아쉬웠지만. 아이들이 너무 좋아해서 담에 한번 더 오려구요. 조식도 너무 맛있게 먹었습니다.,5,1년 전
y_40_355,전주 브라이튼 호텔-BRIGHTEN,소리보미,올 여름의 더위는 그야말로 불볕 더위라 할수 있다. 삼례에서 출장 일과를 마치고 예전에 묶었던 전주시 중화산동에 브라이튼 호텔로 찾아왔다. 카운터 로비로 들어서니 안내 아가씨가 상냥하게 맞아주고 키를 받아 입실했다. 역시 한여름엔 에어컨이 최고다.,5,1년 전
y_40_356,전주 브라이튼 호텔-BRIGHTEN,니뽕니뽕네뽕,"시설은 매우청결하고 깨끗한편이나, 아쉬운점은 아직도 흡연하시는분이 있나봐요? 담배냄새 때문에 좀 힘든거말고는 좋아요",5,1년 전
y_40_357,전주 브라이튼 호텔-BRIGHTEN,빵빵0411,브라이튼호텔이 주변에서 제일 좋은거 같아요~! 시설도 깨끗하고 사장님도 친절합니다,5,1년 전
y_40_358,전주 브라이튼 호텔-BRIGHTEN,nicelatter,숙소가 깨끗하고 깔끔합니다. 내부 인테리어도 깔끔해서 지내기 너무 좋습니다. 주변에 음식점도 많아서 나가서 사먹기 좋습니다. 주인분도 친절합니다. 다음에도 이 지역으로 온 다음 다시 이 숙소로 묵을 예정입니다. 다른분들에게도 강추합니다.,5,1년 전
y_40_359,전주 브라이튼 호텔-BRIGHTEN,펜실베니아석양,전주 출장에 처음 온 숙소네요~ 다른 분들 리뷰처럼 새건물이라 쾌적하고 깨끗합니다. 인포에서도 친절하시고~ 제가 출장이 많다보니 눈여겨 보는게 스타일러인데 오래된 곳은 옷걸이가 망가진건지 분실된건지 정상 옷걸이가 없어서 특히 바지 올걸이 집게 사이즈가 안맞는 경우가 많은데 생긴지 얼마 안되서 그런지 스타일러는 상태가 너무 좋습니다~ 타 숙소들은 폰충전기가 제대로 빠르게 충전은 안되지만 어쨌든 비치는 되어있었는데 여기는 충전기가 아예 없어서 좀 불편하네요~ 그외에는 너무 만족합니다. 충전기는 담부터 챙겨와야겠네요~인포에 물어보진 않았지만 혹시 얘기하면 대여가 될지도 모르겠네요~ 암튼 잘 쉬다 갑니다.,5,2년 전
y_40_360,전주 브라이튼 호텔-BRIGHTEN,나는정력왕,지방출장을 자주 다녀서 모텔 이용을 많이 하는데 저렴하고 깔끔하고 최고였습니다 청결을 우선시 보는데 모든게다 깔끔했구요 스타일러 시스템 에어컨 공기청정기까지 완벽했어요^^ 다음에도 다시 이용하고싶네요 쿠폰까지 주셔서 훨씬 저렴하게 숙박 이용했네요 감사합니다,5,1년 전
y_40_361,전주 브라이튼 호텔-BRIGHTEN,정직하고자신감있는통로,너무너무 만족스러워요 안에 너무 따뜻하고 티비 화질도 너무 좋고 객실 내부가 청결해서 너무 좋았어요 가성비도 너무 좋아요 사장님도 친절하셔요 자주 이용하고싶은 숙소입니다 추천드려요!!,5,2년 전
y_40_362,전주 브라이튼 호텔-BRIGHTEN,한국과학기술원나팔꽃,숙소가 깔끔해요 출장다니면서 자주 이용하는데 주인분도 친절하십니다.^^ 방도 따뜻하고 청소도 잘되어 있습니다. 메트리스가 좋아서 잠도 깊게 들수있어 너무 좋습니다. 자주 이용할게요 감사합니다.,5,2년 전
y_40_363,전주 브라이튼 호텔-BRIGHTEN,히사시부리요,주차장 자리는 널널 했습니다~ 2번째 방문했는데 역시나 너무 깔금했습니다. 사장님도 친절하시고 방 컨디션도 좋아서 잘쉬다왔습니다. 앞으로도 자주 이용할게요~ 안가보신분 있으시면 강추합니다,5,2년 전
y_40_364,전주 브라이튼 호텔-BRIGHTEN,정직하고자신감있는통로,객실 컨디션 너무 좋구요 ! 사장님 너무 친절해서 좋아요 ! 객실 내부가 너무 청결하니까 편하게 있을 수 있어서 좋았어요! 그리고 아침 조식도 너무 좋아요 ! 자주자주 이용하고있습니다,5,2년 전
y_40_365,전주 브라이튼 호텔-BRIGHTEN,히사시부리요,새로 생겨서 너무 깔금하고 너무 좋아요. 일단 사장님이 너무 친절하셔서 입구에 들어갈때부터 기분이 너무 좋고 주차자리듀 넉넉하니 좋았습니다. 방도 쾌적하고 너무 좋아요 잘쉬다 왔습니다,5,2년 전
y_40_366,전주 브라이튼 호텔-BRIGHTEN,펭님,다른 사람들이 쓴 후기 보고 여러 호텔들 비교해보다 여기로 방문했어요 제가 가장 우선 순위로 둔 건 청결도였는데 여기는 제가 여태 가봤던 곳 중에 손에 꼽히게 깔끔했어요! 방은 엄청 크지는 않지만 난방 빵빵하고(다만 조금 건조한건 단점ㅜ) 방음 잘되는 편이고 인테리어 깔끔하고 있을꺼 다 있었어요! 정말 다 좋은데 베개는 다 높은 것 밖에 없어서 그건 정말 불편했어요! 낮은 베개도 구비해주시는 것 한번 고려 부탁드려요 조식도 구운계란이랑 쥬스랑 식빵 제공해주셔서 든든하게 먹고 그래도 잘 쉬다 왔어요! :) 만족합니다,5,2년 전
y_40_367,전주 브라이튼 호텔-BRIGHTEN,저택,일이 있어 며칠만에 다시 찾은 전주에 고민없이 브라이튼을 예약했어요..매트리스 정말 편하고 좋습니다..따지지않고 또 찾을거에요,5,2년 전
y_40_368,전주 브라이튼 호텔-BRIGHTEN,감동적이고새로운양방병원,따뜻하게 묵기 너무 좋은 온돌이었어요! 특히 침대 매트리스 짱입니다 👍,4,1년 전
y_40_369,전주 브라이튼 호텔-BRIGHTEN,ehy8628,깨끗하고 좋았어요 전주에 놀러갔는데 담에도 이용하고싶네요 친절하셔서 그것도 맘에 들었어요 편하고 따뜻하게 잘잤어요 근데 베게가 높아서 목이 쫌 아파서 그냥 안베고 잤어요ㅎㅎㅎㅎㅎㅎ,5,2년 전
y_40_370,전주 브라이튼 호텔-BRIGHTEN,아무렇지않은폭스하운드,아시는 사장님 만나서 되게 기분좋았네요 예전에 정말 친절하신사장님이셨는데 여기서다시만났네요 너무친절하시고 깔끔하고 침대가최고에요 푹잤어요,4,1년 전
y_40_371,전주 브라이튼 호텔-BRIGHTEN,비비콕콕2,시설이 너무좋아요 가격대비.. 재방문율200%,5,1년 전
y_40_372,전주 브라이튼 호텔-BRIGHTEN,RickyJANG,시설 좋고 친절하시고 매우 만족합니다,5,1년 전
y_40_373,전주 브라이튼 호텔-BRIGHTEN,아무렇지않은폭스하운드,여기매트리스진짜편하고좋아요 사장님 너무 친절하세요 새로생긴지얼마안되서진짜깔끔해요 편의점도앞에있구 방음도너무잘되있고 비품도잘챙겨져있습니다 그래서편안하게 쉬었다온거 같아요 중화산동에서최고입니다,5,2년 전
y_40_374,전주 브라이튼 호텔-BRIGHTEN,빠꾸레이스,청결하고 조용해서 좋아던거 같아요,4,1년 전
y_40_375,전주 브라이튼 호텔-BRIGHTEN,로또대박날수있어,잘지내고 갑니다. 사업이 번창하시길 바랍니다.,4,1년 전
y_40_376,전주 브라이튼 호텔-BRIGHTEN,빵빵0411,여자친구와의 아지트 ㅋ 매번 어지럽히고 나가서 죄송합니다 ㅎ 객실 청결하고 너무 좋아요,5,1년 전
y_40_377,전주 브라이튼 호텔-BRIGHTEN,걍대충지음,직원분 친절하시고 두번째 이용도 잘 머물다 갑니다~ 담배냄새 안나서 좋아요,5,1년 전
y_40_378,전주 브라이튼 호텔-BRIGHTEN,지니잖아,"여자직원분이 너무 친절하시고 , 조식에 빵 , 우유에 콘푸라이트에 쥬스까지 >_< 그러고, 매트리스가 단연컨데 최고 임돠 !!!! 너무 깔끔하고 담배냄새도 안나고 또 올게요~~~~",5,1년 전
y_40_379,전주 브라이튼 호텔-BRIGHTEN,rgy2003,직원분 너무 친절하시고 위치도 좋아서 여러면에서 편하게 보냈어요 다음에 또 올게용,5,1년 전
y_40_380,전주 브라이튼 호텔-BRIGHTEN,rgy2003,직원분 너무 친절하시고 위치도 좋아서 여러면에서 편하게 보냈어요 다음에 또 올게용,5,1년 전
y_40_381,전주 브라이튼 호텔-BRIGHTEN,rgy2003,직원분 너무 친절하시고 위치도 좋아서 여러면에서 편하게 보냈어요 다음에 또 올게용,5,1년 전
y_40_382,전주 브라이튼 호텔-BRIGHTEN,부지런스러운사회,전주모텔중 가장 매트리스가 좋아요 직원분들도넘친절해요 가끔 쉬고싶을때 가는편인데 넘좋아요,5,1년 전
y_40_383,전주 브라이튼 호텔-BRIGHTEN,Leedeukchoon,완전깨끗하고 청결함(비가와서 쌀쌀했는데 따뜻하게 방에 불을넣어 주어서 꿀잠을잠),5,1년 전
y_40_384,전주 브라이튼 호텔-BRIGHTEN,영국묵사발장인,1. 너무 좋아요. 깨끗하고 담배냄새도 안 나고 청소도 잘 돠어 있고 정말 정갈합니다 2. 가운도 고급지고 구비 잘 되어 있어서 좋아요 3. 물 3병의 센스! 게다가 밑에 요청하면 더 줍니다 4. 조식이 대박... 시리얼에 우유 오렌지주스 삶은계란에 토스트까지! 다음에도 또 올 거에요 5. 매트리스 편한 건 덤이에요! 정말 꿀잠 잤어요 ㅎㅎ,5,2년 전
y_40_385,전주 브라이튼 호텔-BRIGHTEN,저택,숙소를 정할때 매트리스를 중요하게 생각하는데 매트리스가 5성급 호텔 못지않게 정말 꿀잠자게 했어요..침구와 룸 컨디션은 말할것없이 깨끗하고 건물과 시설이 모두 새제품처럼 깨끗해서 사용할때 찝찝함없이 기분까지 좋았어요..사장님과 직원분도 친절하셨고 조식준비도 되어있었는데 이용은 못했네요..전주여행땐 원픽!! 다른곳 보지않고 편하고 깨끗한 이곳을 선택할거랍니다^^ 사진을 못찍어서 아쉽네요,5,2년 전
y_40_386,전주 브라이튼 호텔-BRIGHTEN,남해대교실내복,"넓고 깨끗한 편이며 직원분들 친절 하십니다. 간단하게 토스트와 우유 구운계란 주스등이 제공되어 좋았구요. 한가지 단점이라면 샤워기 수압이 조금 약하네요. 아참, 스타일러가 있어서 짱입니다",5,1년 전
y_40_387,전주 브라이튼 호텔-BRIGHTEN,완벽한연애,친절하시고 주차장도 잘 마련되어 있고 좋습니다!,5,1년 전
y_40_388,전주 브라이튼 호텔-BRIGHTEN,백스피디,객실 깔끔하고 주차편해요. 친절하시고 다음 출장시에 자주 올게요,5,1년 전
y_40_389,전주 브라이튼 호텔-BRIGHTEN,쿠리쿠리이이,갔는데 업그레이드 시켜주셔서 너무 기분좋게 이용햇습니다,5,1년 전
y_40_390,전주 브라이튼 호텔-BRIGHTEN,새벽녘첫눈,"객실 컨디션 좋았고, 사장님도 친절하셨습니다.",5,1년 전
y_40_391,전주 브라이튼 호텔-BRIGHTEN,yes04,이번이 3번째 이용인데 출장 올때마다 찾게되네요 매트리스가 너무 편하고 방도 깨끗해서 항상 안심하고 이용하고있습니다. 출장오게되면 또 이용할게요 지금 처럼 잘 관리 해주세요 수고하세요~,5,1년 전
y_40_392,전주 브라이튼 호텔-BRIGHTEN,부지런스러운사회,친절하고 담배냄새도 없고 넘좋아요,5,1년 전
y_40_393,전주 브라이튼 호텔-BRIGHTEN,사육신공원복화술사,급히 숙소정하며 사진대로 일까 살짝 고민했는데 사진보다 더 깨끗하고 좋았어요 숙소내부는 4.5성급 호텔 컨디션이라봐도 되겠다 싶었고 티비크기나 난방등도 너무 편했어요. 모텔급숙소들이 주로 음침한 조명과 이상한 냄새가 있는곳도 있어 찝찝한데 밝고 깨끗해서 너무 좋아요 전주관광단지 가까운 위치 한복판에 이정도 컨디션 숙소면 누구에게라도 추천이요. 전주 지날때면 생각날 숙소입니다.,5,2년 전
