id,name,nickname,review_content,rating,write_date
y_47_001,전주 호텔 늘,바그다드동맹,사장님 친절하시고 주차장도 은근 넓어용 ~~ 티비가 진짜 커서 넷플릭스 재밌게 봤습니다!!! 스타일러도 있어서 좋아요 욕조도 있고 주변에 편의점 완전 가깝고 한옥마을도 차 타고 별로 안 걸리는 거리에 있습미다~~ 대신 방음이 잘 되는게 단점인 거 같아요~~ 옆 방에서 티비 보는 소리 말하는 소리가 다 들리긴 합니다~ 그래도 그것만 빼면 아주 편하게 잤어요~~. 즐거운 전주여행이 됐습니다~~~~ 감사합니다~~~~ 즐거운 전주여행이 됐습니다~~~~ 감사합니다~~~~ 즐거운 전주여행이 됐습니다~~~~ 감사합니다~~~~,4,2개월 전
y_47_002,전주 호텔 늘,안드로메가커피,"방이 아주 넓진 않았지만 좁지도 않아 적당히 아늑하고 편안한 분위기였습니다. 침구류가 다른 숙소들과 다르게 깔끔하고 깨끗해서 거부감 없이 사용할 수 있었어요! 조명도 은은해서 편안한 분위기 속에서 휴식하기 좋았네요ㅎㅎㅎ. TV화면이 커서 영화나 예능 보기 좋았고, 화장실은 청결하게 관리되어 있어 사용하는 데 불편함이 없었습니다. 수압도 괜찮아 샤워하는 데 불편함 없이 좋았습니다. 전체적으로 조용하고 쾌적한 환경 덕분에 편히 잘 쉬고 재충전하고 왔네요!! 담에 또 가려구요~",5,1개월 전
y_47_003,전주 호텔 늘,서켜나,"침대는 포근하면서도 탄탄한 매트리스로 구성되어 있어, 하루의 피로를 말끔히 풀어줍니다. 뽀송하고 부드러운 침구류는 마치 구름 위에 누운 듯한 느낌을 주며, 청결하게 관리된 시트와 이불 덕분에 따뜻하고 아늑한 숙면을 취할 수 있었습니다. 베개는 다양한 높이와 경도로 비치되어 있어 개인 취향에 맞춰 사용할 수 있는 점도 만족스러웠어요. 욕실과 샤워실 또한 넓고 세련된 디자인으로, 건식 구조 덕분에 쾌적하게 사용할 수 있었습니다. 레인 샤워기와 핸드 샤워기가 함께 설치되어 있어 다양한 방식으로 샤워를 즐길 수 있었고, 미끄럼 방지 바닥 설계도 인상적이었습니다. 넉넉한 조명과 거울, 수납공간까지 잘 갖춰져 있어 아침 준비 시간도 한층 여유롭게 보낼 수 있었습니다. 전반적으로 세심한 배려와 고급스러운 구성 덕분에 만족스러운 숙박 경험이었어요. 편안한 잠자리와 실용적인 객실 비품 덕분에 휴식은 물론, 외출 준비까지 완벽하게 마무리할 수 있었습니다.",4,1개월 전
y_47_004,전주 호텔 늘,우간다키보드워리어,항상 출장업무로 모텔 숙박을 많이합니다. 욕실이 깨끗하게 청소가 잘되어 있고 침구류도 깔끔한것 같아 편안히 쉬었습니다. 방에 담배냄새가 나지않아 깔끔하게 잘 쉬다가 갑니다. 종종 이용할거같습니다.항상 출장업무로 모텔 숙박을 많이합니다. 욕실이 깨끗하게 청소가 잘되어 있고 침구류도 깔끔한것 같아 편안히 쉬었습니다. 방에 담배냄새가 나지않아 깔끔하게 잘 쉬다가 갑니다. 종종 이용할거같습니다.항상 출장업무로 모텔 숙박을 많이합니다. 욕실이 깨끗하게 청소가 잘되어 있고 침구류도 깔끔한것 같아 편안히 쉬었습니다. 방에 담배냄새가 나지않아 깔끔하게 잘 쉬다가 갑니다. 종종 이용할거같습니다.,5,3일 전
y_47_005,전주 호텔 늘,험*****,"사장님 친절하셔서 기분좋게 숙소에 들어왔어요~^^ 리모델링해서인지 방이 깔끔해보이고 화장실도 고급스럽고 티비도 넷플릭스, 유튜브가 되어 좋았어요:) 전기장판도 하나 구비되어 있었고 요즘 어메니티 없는 곳들도 있는데 칫솔치약부터 폼클로션까지 다 있더라구요~^^ 밖에 전자렌지도 있고, 방에는 고데기도 있어서 기본적인 것들은 다 갖춘듯 했습니다^^ 수건에서는 좋은 향기가 나서 세탁건조도 신경써서 하시나보다 싶었어요~ 배민으로 배달 오는곳도 많아서 숙소에서 시켜먹기에도 괜찮았고 한옥마을이랑도 10분거리인데다 갈만한 곳들도 보통 15분-20분이면 이동가능했어요 저희는 주차도 여유롭게 했습니다^^ 친절한 인상으로 시작된 곳이라 조금만 개선하면 더 번창하실수 있으실것 같아서 조금 아쉬웠던 점도적어봅니다^^ 물이랑 음료가 미지근한걸보니 냉장고 전원이 나간것 같았고, 다른분들 리뷰에서 보았었는데 첫날은 바닥이랑 화장실이 너무 추워서 못씻고 잤어요..ㅠㅠㅎㅎ 입실했을때 온도가 19도였는데 20도에서 더 안오르다가 밤에 남자분께 부탁드리니 23도까지 올랐고 다행히 둘째날은 괜찮았습니다^^ 전체적으로 전주에서 하루 지내기 좋은 숙소라 추천합니다^^",4,3개월 전
y_47_006,전주 호텔 늘,뎨니스,총점 ⭐️⭐️⭐️⭐️반 위치 ⭐️⭐️⭐️⭐️⭐️ 아중리 먹자골목 쪽에 위치한 숙소라서 주변에 음식점이나 술집 등등 맛집이 많이 있습니다. 차로 20분 정도 위치에 한옥마을 및 아중역 레일바이크도 있어서 주변에 할건 꽤 있는 편입니다. 편의점도 거의 5분거리마다 있어서 주변 인프라가 잘 형성되어 있는 편 입니다 청결도 ⭐️⭐️⭐️⭐️ 아무래도 가격이 저렴한 편이라 그런지 청결은 약간 부족한 점이 하나씩 보이는 것 같긴 합니다. 화장실이나 방바닥 등 여러 부분이 조금 지저분 했지만 가격을 생각하면 흐린눈은 할 수 있을 정도였습니다. 항상 사용하는 숙소라 이젠 익숙합니다. 대실하고 싶을 때 주로 이용하는 숙소인데 가성비 좋은 곳이라 추천합니다,5,7개월 전
y_47_007,전주 호텔 늘,하늘기쁨가득,늘에 예약을 했는데 무슨 이유인지 노이 모텔로 가라고 해서 갔네요. 그런데 무척 좋았습니다. 깔끔하고 욕실과 화장실이 분리돼서 좋고 또 유리로 된 것이 리모델링한 듯한 깔끔한 느낌이 듭니다. 고데기도 있고 거울에 불도 들어오고 이불과 베개가 푹신해서 잠도 잘 잤습니다. 저녁 먹고 늦게 들어가서 영화는 안봤는데 전체적으로 깔끔하고 깨끗하고 직원분 친절하고 마음에 드는 숙소였습니다. 다음 날은 다른 곳에 예약을 해놓았었는데 취소하고 다루 더 묵기로 했네요. 그런데 나오면서 알게 된 것이 늘모텔을 예약한다고 노이모텔에서 잘 수 있는게 아니라는 것. ㅠㅠ 오늘 늘모텔에 들어왔는데 노이모텔과 많이 다르네요. 일단 이 후기는 늘모텔을 예약했는데 노이모텔을 주셔서 하루 잘 잔 후기입니다.(사진은 노이모텔),5,8개월 전
y_47_008,전주 호텔 늘,뎨니스,"자주 가던 숙소라서 이번에도 믿고 대실 예약했습니다. 오늘 비가 와서 그런지 너무너무 습하더라구요. 그리고 배정된 방에 들어가니 청소가 방금 된건지 바닥이 미끄럽고 젖어있었습니다. 사장님께 말씀드리니 다른 방들도 다 그렇다고 슬리퍼 신으라고 하시더라구요. 신었는데 슬리퍼때문에 더 미끄러워서 넘어질 뻔 했습니다;; 그리고 청소를 제대로 안하신건지... 테이블에 담뱃재가ㅠ 이불에도 얼룩이 너무 잘 보였고,, 항상 믿고 사용하는 곳이였는데 그래도 나름 단골인데 서비스가 조금 부족했습니다",4,12개월 전
y_47_009,전주 호텔 늘,뎨니스,대실이 7시간이나 되는 데라서 벌써부터 추천드려요...! 주말에 이용하는건데도 굉장히 저렴하고 가성비 있어요! 숙소 자체가 막 엄청 좋다거나 그렇지는 않은데 그래도 이 가격이 이정도 하는 숙소 없습니당!! 이번에 배정받은 숙소는 좀 작은 편이더라구요ㅜ 그래서 음식 배달 시켜먹을때 책상이 없어서 조금 불편했어요. 그리고 방음이 잘 안되긴 하더라구요.. 햇빛이 너무 잘 들어와서 밝았어요ㅋㅋㅋㅋ 영화를 보는데 밝아서 조금 불편?했어요. 그래도 편하게 쉴 수 있어서 좋았습니다,5,2개월 전
y_47_010,전주 호텔 늘,친밀한고양님,"바닥이 축축했는데 청소하신걸로 믿고, 전반적으로 깨끗하고 냄새 안났어요 그런데 항상 2시정도에는 안내실에 사람이 없는것 같아요. 몇번 방문했는데 항상 대기했다가 입실했어요 일찍 입실이 안된다고해서 시간맞춰 왔는데도 기다려야하니까 그건 좀 불편했네요. 주차자리 넉넉하고 앞에 편의점있어서 편하고, 주변 배달 음식점도 많아요 아 티비사이즈 크고 ott 이용하기 편합니다! 바닥이 축축했는데 청소하신걸로 믿고, 전반적으로 깨끗하고 냄새 안났어요 그런데 항상 2시정도에는 안내실에 사람이 없는것 같아요. 몇번 방문했는데 항상 대기했다가 입실했어요 일찍 입실이 안된다고해서 시간맞춰 왔는데도 기다려야하니까 그건 좀 불편했네요. 주차자리 넉넉하고 앞에 편의점있어서 편하고, 주변 배달 음식점도 많아요 아 티비사이즈 크고 ott 이용하기 편합니다!",5,2개월 전
y_47_011,전주 호텔 늘,세네갈표범,"전주 아중리에 위치한 늘호텔은 제가 제일 많이 이용한 숙소네요 가격,청결도,방넓이,위치등 모든게 저에게 만족스러운 숙소다 보니 자주 이용하게 되었네요 사장님 친절하시고 안에 구비되어 있는 일회용품도 만족스럽네요 방음 잘되고 침대도 푹신해서 편안하게 잘 잣습니다 난방도 물론 잘되구요 주변에 먹을거리,즐길거리 모든게 가깝게 위치하고 있어 편안히 쉴수 있어 더욱더 좋습니다 방 업그레이드까지 해주셔서 더욱더 조용하니 잘쉬었습니다 깨끗하고 수압도 좋고 시설도 좋은 숙소로 추천드립니다 번창하세요 ~~~",5,2개월 전
y_47_012,전주 호텔 늘,고분고분한책,편의시설이 잘 갖추어져 있습니다. 공기청정기도 있어서 미세먼지 걱정 없어 좋구요. 티비 화면이 75인치 정도로 커서 영화나 드라마 보기 좋아요. 인근 숙소중에 가장 가성비가 좋은 숙소인거 같습니다. 시설이 리모델링되어서 벽지라던지 화장실이 너무 깨끗해서 기분좋게 이용하기 좋았어요. 탬퍼 메트리스도 편해서 기분 좋은 꿀잠 겠습니다. 사장님도 너무 친절하시고 출장업무나 연인끼리 데이트 하기에는 최적의 장소가 아닌가 싶습니다. 아중리 늘 호텔 추천합니다~~~~~,5,2개월 전
y_47_013,전주 호텔 늘,뎨니스,"항상 이용하는 숙소인데, 대실 이용했습니다. 11시에 체크인이였는데 조금 더 일찍 이용할 수 있었고, 룸 컨디션은 나쁘지 않았습니다. 다만 냉장고에 있는 물이 방금 넣은 것처럼 미지근해서 아쉬웠습니다. 세면대도 물을 조금 틀어놓으면 약간 막히는 감이 없지않아 있더라구요. 그건 개선하시면 좋을 것 같습니다. 위치는 아중리 모텔촌에 위치해있고 주변에 편의점이 굉장히 많아서 좋았습니다. 그리고 배달어플도 이용할 수 있는 게 많아서 좋았습니다. 다음에 또 이용하겠습니다.",5,9개월 전
y_47_014,전주 호텔 늘,호치민사과,광주에서 출장왔는데 가격도 저렴하고 사장님도 친절하시고 룸에 안마의자 없는거였는데 안마의자있는걸로 업그레드 해주심 1층에 커피에 얼음자판기도있음,5,2일 전
y_47_015,전주 호텔 늘,미래자동차,그 진짜 방하나에 안락하니 화장실도 바로옆에에 필요한 물품 다있고 비데도있고 하는게 너무좋았습니다 그리고 방인테리어가 하얀생이어서 더 밝은느낌이어서 좋았어요 하지만 아쉬운건 그래도 햇빛은 완전히 차단하고싶은데 블라인드여서 아쉬웠습니다 근데 진짜 방한칸이 안락한느낌이 너무좋았어요 다음에도 무조건 야기할거같아요 대실시간이 긴것도 참좋아요 요즘은 다 3시간 인데 저는 그래도 최소 5시간이상부터좋은데 물론평일이엇지만 그래도 어디에요 여기 진짜 좋습니다 강추강추,4,1개월 전
y_47_016,전주 호텔 늘,남*****,원래 방보다 룸 업그레이드해주셨고 사장님 친절하십니다. 근데 담배냄새가 좀 나긴했습니다. 침대에도 먼지랑 머리카락 조금 있었구요. 그래도 잘 머물다왔습니다 :) 잘 쉬다갑니다 잘 쉬다갑니다 잘 쉬다갑니다 잘 쉬다갑니다 잘 쉬다갑니다 잘 쉬다깁니다 깨끗하고 좋아요 깨끗하고 좋아요 깨끗하고 좋아요 깨끗하고 좋아요 깨끗하고 좋아요 잘 쉬다갑니다 잘 쉬다갑니다 잘 쉬다갑니다 깨끗하고 좋아요 깨끗하고 좋아요 깨끗하고 좋아요 깨끗하고 좋아요 깨끗하고 좋아요 잘 쉬다깁니다,4,10개월 전
y_47_017,전주 호텔 늘,김오롤,시내랑 가까워서 돌아다니기 좋고 일단 너무 편하게 쉬다가 왔습니다. 저렴한 가격에 이정도 시설이면 아주 만족합니다. 개인 주차장이용도 가능하고 배달음식 시켜먹기에도 아주 좋 은 위치에 있어서 편하게 이용할수도있고 침대가 일단 너무 편해서 푹잘수있었습니다. 샤워할때 수압도 이상없고 온수도 잘나옵니다. 냉난방도 잘 되고 좋습니다. 여러분들도 한번 이용해보세요! 저렴한 가격으로 이용하기 딱 좋습니다. 사장님도 친절하세요. 출장있을때 아마 종종 방문할거 같습니다.,5,3개월 전
y_47_018,전주 호텔 늘,시애틀앨빈,"한동안 공사 중인 것 같아 오랜만에 방문을 하였습니다. 그전에 비해 크게 달라진 것은 없었지만, 소소한 부분에서 리모델링을 하신 것 같더라고요. 그 외에는 전에 하셨던 대로 충분한 어메니티와 청결한 객실 청소 상태는 여전하셔서 만족했습니다. 머리카락 하나 보이지 않을 정도로 청결했습니다. 그리고 안락한 매트리스와 전기 장판이 있어 따뜻했구요. 더 나아가 바닦에 온돌이 되어 있어 밤에는 무척 따뜻하더라구요. 정말 편안하고 쾌적하게 휴식을 가졌던것 같습니다. 적당한 크기의 TV 또한 OTT를 즐기기에는 충분하였던 것 같구요. 아무튼 가성비 있게 잘 이용한 것 같아 만족했습니다. 다음에도 기회가 된다면 또 이용하도록 하겠습니다.",5,2개월 전
y_47_019,전주 호텔 늘,시애틀앨빈,"한동안 공사 중인 것 같아 오랜만에 방문을 하였습니다. 그전에 비해 크게 달라진 것은 없었지만, 소소한 부분에서 리모델링을 하신 것 같더라고요. 그 외에는 전에 하셨던 대로 충분한 어메니티와 청결한 객실 청소 상태는 여전하셔서 만족했습니다. 머리카락 하나 보이지 않을 정도로 청결했습니다. 그리고 안락한 매트리스와 전기 장판이 있어 따뜻했구요. 더 나아가 바닦에 온돌이 되어 있어 밤에는 무척 따뜻하더라구요. 정말 편안하고 쾌적하게 휴식을 가졌던것 같습니다. 적당한 크기의 TV 또한 OTT를 즐기기에는 충분하였던 것 같구요. 아무튼 가성비 있게 잘 이용한 것 같아 만족했습니다. 다음에도 기회가 된다면 또 이용하도록 하겠습니다.",5,2개월 전
y_47_020,전주 호텔 늘,흑백조종사,바닥이 엄청차갑고 하루종일 냉기가 돌아서 기장장판 싫어하는데 전기장판키고잤네요 엘레베이터 바로 옆방이었는데 다른호실 문 열고 닫을때마다 공기 압력때문인지 내 방문이 계속 열릴려고하는 그런 소리와 느낌이 나서 계속 신경쓰였네요 나가면 바로앞에 편의점이 있어서 편했고 근처에 조금 걸으면 음식점이 있어서 좋았습니다 약5분거리에 은**해장국 있는데 해장국이 13000원인데 별로였다는...주차공간은 넉넉한편이었어요 전체적으로 중간정도의 숙소라고생각됩니다,4,7개월 전
y_47_021,전주 호텔 늘,신의저격수,방내부 구조도 좋고 친철하고 잘 쉬었다가 왔습니다,4,7일 전
y_47_022,전주 호텔 늘,라바라바라바라라,큰방으로 올려주셨는데 편백향기가 너무 좋았습니다. 티비도 너무 커서 완전 영화관! 에어컨도 냄새 안나고 완전 깨끗해요~ 사장님도 엄마처럼 잘 챙겨주셔서 전주가면 또 갈겁니다,5,26일 전
y_47_023,전주 호텔 늘,감동적이고유머러스한번개,"연박으로 2일간 전주 여행하면서 묵었는데, 룸 업그레이드 해주셨네요 감사합니당ㅎㅎ! 안마의자랑 스타일러 있어서 좋았어요 전반적으로 엄-청 깨끗하다고는 할 수 없지만 벌레는 없어서 크게 불편한거 없이 잘 쉬다 왔어요. 침대이불은 얼룩이 안지워져서 조금 찝찝했는데 냄새나거나 그렇진 않았고 화장실은 꿉꿉한 배수구 냄새가 계속 나서 들어갈때마다 좀 힘들었어요ㅠㅠ 체크아웃 시간이 1시더라구요! 12시인줄 알았는데 11시 40분에 일어나는 바람에 후다닥 시간 연장했는데 그때 알았어요(시간당 5천원) 주차장도 꽤 넓습니당",4,1년 전
y_47_024,전주 호텔 늘,무형적인그레이하운드,"출장와서 잘 쉬다가 넘어가는 것 같습니다. 가격대비 방 컨디션이나 시설이 깔끔해서 좋았습니다. 욕실도 맘에 들었던 점이 욕조가 작지않아서 반신욕도 편하게 했던 것 같습니다. 방에는 담배냄새도 안나고, 청소 상태도 좋았습니다. 프론트에서 직원분도 친절하셔서 좋았습니다. 바로 앞에 편의점도 가깝고, 주변에 식당들도 많아서 접근성도 괜찬습니다ㅎㅎㅎㅎ 그리고 조금만 걸어가면 아중천이 있어 걷기도 좋을 건 같더라고요. 장거리운전으로 힘들었는데 잘 쉬다 가는 것 같아 좋네요",5,10개월 전
y_47_025,전주 호텔 늘,하늘기쁨가득,오늘은 늘에서 숙박. 키를 받아서 방을 확인하고 저녁 먹으러 나왔다가 들어가니 주차장에 자리가 없음. 카운터에 가니 아무도 없고 전화번호만 있어서 전화를 걸었더니 옆 모텔 노이에서 직원분 달려오심. 건물 옆에 주차 하라고 해서 건물에 붙여서 댔더니 옆건물 노래방에서 급 나와서 좀 더 모텔쪽으로 옮겨달라고 ㅠㅠ 주차하고 들어옴. 전체적으로 사용 용품은 좋음. 물도 잘 나오고 영화도 골고루 볼 수 있음. 침대 전기장판 위에 커버가 바로 있어서 딱딱한 느낌이 들어 깔만한 것을 물어보니 없다고. 그런데 막상 자보니 불편하진 않았음. 냉장고에 소리가 크지 않아서 좋음. 주차를 못한 것이 처음이라 별점 살짝 깎음. 전체적으로 나쁘지 않음.,4,8개월 전
y_47_026,전주 호텔 늘,황소백곰,전주 출장으로 방문하게 되었습니다!! 사장님께서 너무 친절하셔서 좋았습니다~~ 방은 전체적으로 크고 깔끔하고 아늑했습니다! 화장실 역시 깔끔하고 깨끗했습니다!! 주위에 먹을 곳도 많고 조용해서 피로가 풀리게 잘 쉬었습니다!! 주차 공간도 넓고 커서 편리했습니다!!! 전주에서는 여기 만한 곳이 없는 것 같습니다~ 가격이 우선 너무 합리적이고 가성비가 최고! 편하게 잘 쉬었다 갑니다~~최고에요! 다음 전주 출장 때도 또 방문하겠습니다!! 감사합니다~~!!!,5,2개월 전
y_47_027,전주 호텔 늘,i*****,주차장은 넓지 않아요 그래서 늦으면 주차 자리가 없어요 그리고 객실 바닥 진짜 차가워요 엄청 놀랬어요 냉골인줄 ㅜㅜ어떻게 난방을 킬줄 몰라서 못했어요 ㅠㅠ 그리고 담배냄새가 베여서 그런가 객실이고 화장실이고 냄새나요 ... 그런데 사장님은 친절하세요 담배냄새나요..그게 제일 아쉬워요 담배냄새가 주차장은 넓지 않아요 그래서 늦으면 주차 자리가 없어요 그리고 객실 바닥 진짜 차가워요 엄청 놀랬어요 냉골인줄 ㅜㅜ어떻게 난방을 킬줄 몰라서 못했어요 ㅠㅠ 그리고 담배냄새가 베여서 그런가 객실이고 화장실이고 냄새나요 ... 그런데 사장님은 친절하세요 담배냄새나요..그게 제일 아쉬워요 담배냄새가,4,7개월 전
y_47_028,전주 호텔 늘,samchoni,"말 그대로 미니룸 입니다. 평일에 가격대비 나쁘지 않은 선택지 입니다만 1인 출장 또는 여행객들에게만 추천합니다. 두명은 비좁다는 느낌이 들거 같네요~ 괜찮은 선택지라고 말씀 드리긴 했는데 예전보다 관리에 신경이 좀 덜간 느낌이에요~ 청소도 약간 미진했었고 예전엔 PC도 됐었는데 안되고 변기 리모콘도 안되고 악플이 아니라 안되는거 있으니 참고하시면 개선하실거고 그러면 더 많이 이용들 하시라는 마음 입니다. 주차장이 작지는 않은데 저녁이나 주말엔 어떨지 모르겠네요~ 이용해보질 않아서 암튼 평일에 가성비로 이용하시고 즐거운 여행, 숙박들 되시길",4,10개월 전
y_47_029,전주 호텔 늘,쪼코에몽119,항상 전주 오면 방문하는 숙소입니다 무엇보다 아늑한 침대에다가 스타일러에 안마의자까지 이렇게 완벽 풀옵션으로 구비되었는데 상대적으로 저렴한 숙소는 없다고 생각되네요 방도 업그레이드 해주셔서 그런지 기분도 굿굿! 주차공간이 내부에 매우 넓게 되어있어서 차량을 가지고 오시는 분들도 불편함 없이 방문하실 수 있어서 너무너무 좋습니다 바로 앞에 5초거리에 편의점도 있고 무엇보다 이렇게 추운날씨에도 기본난방도 빵빵한데 따땃한 전기장판까지 있어서 최고입니다 ㅎㅎ 언제나 재방문의사 있습니다!,5,7개월 전
y_47_030,전주 호텔 늘,무형적인그레이하운드,"최근 전주 출장 올 때마다 항상 이용하는 두 숙소 중 한 숙소입니다. 역시 깔끔해서 맘 편히 이용할 수 있었습니다. 담배 냄새도 나지않아 더 좋았습니다ㅎㅎ 세면대와 욕실도 구분되어 있어 꽤 좋더라고요~ 주차장도 널널해서 큰 차이에도 불구하고 주차도 편하게 했습니다. 주변에 식당들이나 편의점들도 꽤 많아 접근성도 괜찬습니다. 조금만 걸어가면 술집들도 있어 간단히 한 잔 할 수도 있습니다. 날씨가 좋지않아 걷지는 않았지만, 근처에 아중천도 있어서 걷기도 좋을 것 같습니다. 덕분에 편하게 쉬었습니다~",5,7개월 전
y_47_031,전주 호텔 늘,뎨니스,오랜만에 평일에 대실 이용했습니당! 호텔 늘은 평일에도 10시까지 대실 이용할 수 있어서 아주 좋아요! 특히 요즘 같이 더운 여름에는 ott보면서 치맥 하는게 캬~~~ 호텔 늘은 여러 ott를 다 볼 수 있어서 좋습니다 맞은편에 바로 편의점도 있어서 좋고 위치도 한옥마을에서 택시타고 20분 내외로 올 수 있어요! 방이 조금 작긴해도 가성비로는 최고의 숙소입니다! 사장님도 친절하시고 어매니티 냄새도 좋았습니당 다만 방음이 조금 안된다는 점이 아쉬웠습니다. 그것빼고는 괜찮았습니다,5,11개월 전
y_47_032,전주 호텔 늘,samchoni,사실 미니멀 예약했는데 평일이라 방을 업그레이드 해준거 같았습니다. 사진으로 봐도 미니멀 처럼은 안보이죠? 당연히 업그레이드 된 방이라 가격대비 만족도는 높았고요 비치된 비품들 모두 정상사용 가능했습니다. 욕실도 넓어서 저처럼 혼자 사용하기엔 살짝 아쉽다는 생각이 들었네요 가격적인 면이나 위치적인 면이나 우리 젊은 MZ커플들이 이용해도 크게 불만족할건 없다고 생각이 듭니다. 그래도 완벽한 것은 세상에 없다고 아쉬운 점 하나가 있는데요. 이제 쌀쌀해진 날씨 탓에 바닥도 타일이라 한기가 좀 느껴진다는 거~ 그거 외엔 만족하며 이용했습니다.,5,8개월 전
y_47_033,전주 호텔 늘,뎨니스,"미니멀 디럭스로 예약했는데, 안마의자가 있는 룸으로 업그레이드 해주셨어요ㅎㅎ 주말에 자주 이용하는 숙소인데 최근 건물 내부를 약간 리모델링 하셨더라구요! 그래서 더 깨끗해진 느낌...? 앞으로는 더 자주 사용할 것 같아요! 바로 앞에 편의점도 있고 주변에 술집거리도 있어서 전주 놀러오시는 분들이 사용하시면 좋을 것 같아요! 배달도 웬만한 음식점들은 다 되고, 주변에서 포장해서 가지고 들어가서 먹어도 좋을 것 같아요. 가성비가 좋은 숙소라서 청결이나 서비스는 평타지만 가격이 좋아서 자주 이용합니다!",5,3개월 전
y_47_034,전주 호텔 늘,밉살맞은소환사,"7시간 대실이라니ㄷㄷㄷ 진짜 좋아용 가격도 싸고,, 그래서 요즘 여기로 와요!!! 컴퓨터도 있고 넷플렉스도 있어서 무척 마음에 듭니다!! 넓기도 하고 스타일러도 있어서 좋아요 저번에 새벽에 가서 그런가 안마의자 있는 스위트방으로 주셔서 넘 감사했어용",5,10개월 전
