id,name,nickname,review_content,rating,write_date
y_47_684,전주 호텔 늘,딸기색도우미,"원래 시설 그저 그래도 좋다고 리뷰써주는데 정말 리뷰 좋게 써줄 수가 없네요. 늘로 예약하고 갔는데 프론트에 사람이 없더군요. 전화번호로 전화하니 내려갈게요 해놓고 5분을 더 기다린 것 같네요? 5분을 기다렸더니 하는 말이 안 좋은 방만 남았다며 길 건너 노이도 사장님이 같다고 업그레이드 해드릴테니 노이로 가시라고.. 그래서 노이로 갔는데 업그레이드 라더니 업그레이드 맞는 건가 싶었습니다. 카드키는 인식이 안되는지 불도 안켜지는 방이었네요. 내려가서 상황 말했더니 2분을 기다려도 안켜지냐는 말이 말인가요? 누가 현관앞에 서서 2분을 기다립니까. 불이야 제가 켜면 되니까 크게 불편함 없으니 그냥 쓰자 맘먹고 올라와서 짐을 풀며 방을 보는데 저는 사용도 안 하는 컴퓨터가 켜져있었어요. 본체 돌아가는 소리 거슬려서 컴퓨터 먼저 꺼버렸네요. 바닥엔 머리카락이 뭉텅이로 돌아다니고 샤워실엔 최소한 선반은 설치 해주셔야 하는 거 아닌가요? 커다란 통도 아니고 작은 통으로 바닥에 놔두다니요.. 침대는 수평이 아닌 다리쪽을 약간 올라가게 해두셨던데 일부러 그러신 건지.. 허리가 푹 꺼져서 좀 힘들었네요. 베개엔 긴 머리카락, 침대보를 분명 갈았을텐데 베개 아래쪽으로 머리카락들이 쌓이고 쌓여있고.. 씻으려고 어메니티 봉투 열었더니 썼던 치약이 들어있네요? 진짜 어이가 없어서 사진도 첨부합니다. 출장 다니며 많은 숙박시설 이용했는데 이런 곳 처음입니다. 업그레이드 라더니 이게 업그레이드면 늘은 대체 어떤 방인지 상상도 안 되네요. 다음은 없을 것 같네요.",0,2년 전
y_47_685,전주 호텔 늘,시콩이럭키,급하게 예약해서 갔는데 방도 급하게 변경해주시고 마음에 들었어요 인근 숙소 중에는 제일 좋은것 같아요 직원분도 친절하시고 자주 이용 할것 같아요 두세번인가 갔는데 갈때 마다 만족스러웠어요 가격대비 짱 가성비 갑이라고 하죠 출장오시는 분이 편하게 이용하기 좋을것같고 근처에 맛집도 있어서 전주 여행 오는분이 이용하기도 괜찮을 것 같아요 티비도 커서 영화보기도 좋았어요 만족합니다,5,2년 전
y_47_686,전주 호텔 늘,물만두꽃돼지,예약 아주 만족해요~~ 쉬기 너무 좋아요!! 바닥도 깨끗하고 가격도 착하네요!! 따듯한 물 잘 나오고 침구도 깨끗해서 좋습니다~ 평소 잠자리에 예민해서 잠을 잘 못자는데 여기는 잠도 잘 올것 같아요!! 출장이 많은 편이라 타 숙소랑 비교를 많이 하는데 아주 만족스럽습니다 출장 중 이런 숙소 흔치 않으니 기회 된다면 꼭 이용해 보시는 것도 좋을 것 같습니다~ 추천 왕추천 합니다~!! !,5,2년 전
y_47_687,전주 호텔 늘,숙이얌,전주에 있을땐 거의 여기만 가는거같아요ㅠㅠㅠㅠ그만큼 체고 근데 욕조 없는곳 예약 했는데 있는곳 주셔서 조금 좁긴했어요ㅠㅠㅠㅠㅠㅠㅠ 그래도 항상 청결하고 친절하셔서 너무 좋아요!! 다음에 또 이용할께용,5,4년 전
y_47_688,전주 호텔 늘,317820,깨끗하고청결하게친절하게안내해잘해주셔서감사합니다강추강추함니다,5,7년 전
y_47_689,전주 호텔 늘,미래자동차,감사하빕니다 시설좋습니다 아기자기하니 좋아요 에어컨청소가안되어잇는게아쉽습니다 비데도잇고 비품도깔끔하고 굿굿 감사하빕니다 시설좋습니다 아기자기하니 좋아요 에어컨청소가안되어잇는게아쉽습니다 비데도잇고 비품도깔끔하고 굿굿,5,2년 전
y_47_690,전주 호텔 늘,7266205,매우만족 이라는 단어밖에 표현할 방법이 읍네~ 일반실 날더운 오후에 이용했습니다 주차장도 깨끗하고 프론트에서 반겨주시고 너무좋아요 시설도 청결하구 너무 좋아요 화장실은 항상 이용할때마다 우리집 리모델링 이렇게 하고 싶을만큼 심플하고 청결해서 좋아요 실내도 청결하고 쾌적하고 냄새하나도 안나고 방음도 너무 좋아요 매번 방이 남았을까 걱정이지 이용만 하면 넘 좋아요 : ) 최고쵝오,5,6년 전
y_47_691,전주 호텔 늘,무등산굴,객실에서 냄새도 안나고 깨끗하고 좋았어요 티비도 크고 인터넷도 빠른거 같고 스타일러도 있어서 옷도 향균 할수 있어서 좋았어요 넷플이랑 다른것도 볼수 있어서 좋았어요 다음에도 또 방문하고 싶네요 친절하시고 좋았어요 위치도 좋은듯요 바로앞에 편의점 있고 좋아요,5,2년 전
y_47_692,전주 호텔 늘,자카르타과학,알바분이 친절해서 좋았습니다. 객실도 깨끗해서 이용 시 불편함을 안느꼈어요. 담배냄새도 안나서 좋았습니다. 기분 좋게 잘 쉬다 갑니다. 다음에도 또 이용할게요. 감사합니다. ㅎㅎㅎ,5,2년 전
y_47_693,전주 호텔 늘,DUB307,지금까지 모든 숙소 중에서 제일 아늑해서 정말 좋았어요 주차장도 완전 예쁘고 신식이라 그런지 너무 좋네요 가격대비 정말 최고였습니다 앞으로도 자주 이용할게요 호텔 늘 선택하시면 후회는 없을겁니다,5,3년 전
y_47_694,전주 호텔 늘,12세뉴스기자,저번에 한번 방문 했었는데 깔끔하고 친절하셔서 다시 방문했어요 저번 방문땐 불편한건 전혀 없었지만 조금 좁은 방이었는데 이번엔 저번 보다 넓은 방이여서 좋았어요 넷플 뿐만 아니라 왓챠 등 다른거 이용 가능해서 좋고 아쉬운 점은 주차장이 만차라 주차 할 곳이 없더라구요 ㅜㅜ,5,1년 전
y_47_695,전주 호텔 늘,퇴촌,지난번 출장와서 숙박할때 만족해서 이번에도 숙박하였는데 역시나 만족 하였습니다. 다음에도 여기서 이용 할게요. 지난번 출장와서 숙박할때 만족해서 이번에도 숙박하였는데 역시나 만족 하였습니다. 다음에도 여기서 이용 할게요.,5,3년 전
y_47_696,전주 호텔 늘,devilnina,사진보다 더 깔끔해요~~ 출장이 잦은 저에게 딱이네요 전주 출장의 안좋은 기억이 사라지네요 전주오면 조금 멀어도 이리로 와야겠어요 짱~ 가성비 아니래도 짱^^ 신축이라 깔끔하고 보존 깔끔하고 층마다 있는듯한 전자렌지에서도 베려가 보였답니다 강추요,5,6년 전
y_47_697,전주 호텔 늘,자카르타과학,알바분이 친절해서 좋았습니다. 객실도 깨끗해서 이용 시 불편함을 안느꼈어요. 담배냄새도 안나서 좋았습니다. 기분 좋게 잘 쉬다 갑니다. 다음에도 또 이용할게요. 감사합니다. ㅎㅎㅎ,5,1년 전
y_47_698,전주 호텔 늘,당근구이,화장실 인테리어가 젤 좋았어요ㅋㅋ 룸 상태 그럭저럭 괜찮았는데 위생이 좀 먹었던 음료가 있고 베개상태며 몇가지 위생이 불량했고 방음이 참..옆방소리가 옆에 같이 있는줄알았네요 새벽 3시까지 ... 뭐 그거말고는 숙소가 모여있어 기사님이 딱알고 잘 찾아가주셔서 편했네요,4,6년 전
y_47_699,전주 호텔 늘,깡순이,사장님 직원분들 친절하시고 냉장고 왕 빵빵 ~~ 방도 업그레이드 해주시고 가성비 좋아요 ~ ♡♡♡♡♡♡♥︎♡♡♡♡♡♡♡♡♡♥︎♡♡♡ ♡♡♡♡♥︎♡♡♡♡♥︎♡♡♡♡♡♥︎♡♡♡♡♡♡♡ ♡♡♡♥︎♡♡♡♡♡♡♡♡♥︎♡♡♡♡♡♡♥︎♡♡,5,3년 전
y_47_700,전주 호텔 늘,졸린무,"늘호텔로 예약했는데 앞에 노이로 안내해주셨어요~ 오고 가는 사람이 많아서 묵은 층에 청소해주시는 분이 계속 계셨던거 같은데 방음이 잘 안되서 시끄러운 느낌이 강했습니다ㅠㅠ문도 쾅쾅 닫으시고,, 그 점 빼면 룸 컨디션도 좋고 침대도 푹신푹신해서 잘 쉬다 왔어요",4,2년 전
y_47_701,전주 호텔 늘,좋아요좋아요좋아요,여기 자주 가는데 항상 객실 상태가 좋아요 특히 너무너무친절하시고 하나 하나 챙겨 주실려는게 눈에 보입니다 그리고 화장실 깨끗하고 좋습니다 떠 안마의자가 끝내줍니다........,5,2년 전
y_47_702,전주 호텔 늘,물만두꽃돼지,예약 아주 만족해요~~ 쉬기 너무 좋아요!! 바닥도 깨끗하고 가격도 착하네요!! 따듯한 물 잘 나오고 침구도 깨끗해서 좋습니다~ 평소 잠자리에 예민해서 잠을 잘 못자는데 여기는 잠도 잘 올것 같아요!! 출장이 많은 편이라 타 숙소랑 비교를 많이 하는데 아주 만족스럽습니다 출장 중 이런 숙소 흔치 않으니 기회 된다면 꼭 이용해 보시는 것도 좋을 것 같습니다~ 추천 왕추천 합니다~!! !,5,2년 전
y_47_703,전주 호텔 늘,쭈니니잉,"외관 및 내부 층 객실 인테리어는 괜찮습니다. 화장실도 깨끗하고 청결했습니다.👍🏻⭐️ 바닥도 따뜻하고 아늑하고 제일 좋았던건 침대!에요. 꿀잠 잔거 같습니다. 주위에 편의점도 있고 카페도 있고 편의시절이 있어서 좋았구요, 차로 10-15분 거리에 맛집들이 많았습니다! 저는 또 전주를 간다면 숙박할 예정입니다.♥️",5,2년 전
y_47_704,전주 호텔 늘,구붓한프랑키,언제 방문해도 좋은 곳입니다! 깔끔하고 청결하고 가성비도 좋고 편합니다 주위에 숙박 업소들중에 제일 좋은 것 같아요 따뜻하구요 직원분들도 친절하시고 접근성도 좋아요 단점이 딱히 없네요 ㅎㅎ 다들 꼭 방문해보시길 바랍니다 강력 추천 드려요,5,2년 전
y_47_705,전주 호텔 늘,복*****,근처에 있는 모텔들 중에는 제일 나은거 같아요 일단 매트리스가 좋고 타이밍 잘 맞춰가면 방 업그레이드 해주세요 다만 주차장이 거의 항상 만석이라 주변 공영주차장을 이용해야해서 불편합니다,5,2년 전
y_47_706,전주 호텔 늘,팔달문씽씽이,저렴한 가격때문에 예약했구요 직원분 친절도는 떨어짐 입실했는데 방 컨디션 그닥 에어컨..... 청소 좀 해주세요 제발 숨쉬면 병걸릴꺼 같아요 곰팡이 최악..... 휴 침대 매트리스도 불편 변기 고장난줄 알고 난감... 똥 마니 싸는분들은 수압 약하니 주의 샤워기나 해바라기 노후됨 음.. 시설이 아쉽네요,2,4년 전
y_47_707,전주 호텔 늘,jshcokr,가격대비 시설 청결 친절 꽤 괜찮아요,5,1년 전
y_47_708,전주 호텔 늘,chi9839,프론트층에..빵과음료..무료제공서비스도 있습니다.. 청소상태좋구요~^^ 깔끔합니다~^^,5,7년 전
y_47_709,전주 호텔 늘,6020038,조금 작지만 깔끔하고 신축느낌 호텔입니다. 청결하고 분위기도 좋았습니다~ 굳입니다.,5,6년 전
y_47_710,전주 호텔 늘,배고픈토깽,사장님이 친절하시구요 방이 넓은 편은 아니었지만 잠깐 시간 보내다 가기에는 좋아요 위생 상태도 나쁘진 않은 것 같은데 화장실 곳곳에 오래된 흔적이 보이긴 했어요 전체적으로 무난한 것 같아요,4,2년 전
y_47_711,전주 호텔 늘,원*****,편히 쉬었다 가요~! 침구에 먼지가 좀 붙어있긴 했는데 그래도 괜찮았어요 화장실 수압이 좀 약한 거 말고는 딱히 불편한 거 없어서 좋았습니당! 무난하고 좋아요! 아! 그리고 전기장판도 있습니다,5,1년 전
y_47_712,전주 호텔 늘,유리막코팅,노멀하면서 깨긋한곳입니다 주차장 차간 간격도 넓어서 좋앗구요 욕실청결도 좋습니다 넷플릭스 리모컨으로 바로 시청가능하고 티비 사이즈가 커서 맘에들엇어요 조금 아쉬운건 다른방 소음이 좀 들립니다 물사용하는 소리나 목소리같은게 들려지더라구요 잘쉬다갑니다~,5,3년 전
y_47_713,전주 호텔 늘,핑크캉골가방,웨이브가 안됐지만 사장님이신지 젊은 남성분도 되게 친절하셨고 처음에 티비 안돼서 당황했는데 흔쾌히 고치러 올라와 주셔서 감사했어요 방 구조도 예뻤고 업그레이드 해주셔서 너무너무 좋게 이용했습니다 또 갈게요ㅎㅎ,5,4년 전
y_47_714,전주 호텔 늘,불뫼,완전 좋아요 굿굿 안마의자 있보 스타일러 있고 티비 좋고 넷플되고 조용하고 주차공간도 넓고 좋아요 재방문 강추합니다 전주가면 꼭 여기가세요 좋아요ㅋㅋㅋㅋㅋㅋ,5,2년 전
y_47_715,전주 호텔 늘,2205184,서비스음료도 주시고.감사해요 시설은 늘 깔끔하시고 친절도 우수해요 주차도.걱정없이했고 위치도 좋아요 침구도 깔끔하고 좋아요 다만 제가묵었던방이 온도를 올려달라했는데도 추웠네요 온도가점점 내려간다는 점검이 필요할듯 합니다 잘쉬었고 요청한점.개선바랍니다,5,7년 전
y_47_716,전주 호텔 늘,거덜거덜한형화평론가,미니멀디럭스 예약했는데 업그레이드 된 룸 주셨어요!! 언제나 티비도 짱크고 쾌적해서 좋았습니다 ㅎㅎㅎㅎ 방금 막 청소된것같이 바닥엔 물기가 약간 남아있었지만 그만큼 몬가 믿음이 갔구요..ㅋㅋㅋㅋ 늘은 언제나 룸컨디션이 쾌적해서 좋아요 분위기도 고급스럽구요 ott도 다양하게 있어서 다른데서는 못보는 해리포터 정주행했어요ㅠㅠㅠㅠㅠ 감격 하루 잘 쉬다 나왔습니다 ㅎㅎㅎ,5,1년 전
y_47_717,전주 호텔 늘,jshcokr,가격대비 시설 청결 친절 꽤 괜찮아요,5,1년 전
y_47_718,전주 호텔 늘,jshcokr,가격대비 시설 청결 친절 꽤 괜찮아요,5,1년 전
y_47_719,전주 호텔 늘,자카르타과학,알바분이 친절해서 좋았습니다. 객실도 깨끗해서 이용 시 불편함을 안느꼈어요. 담배냄새도 안나서 좋았습니다. 기분 좋게 잘 쉬다 갑니다. 다음에도 또 이용할게요. 감사합니다. ㅎㅎㅎ,5,1년 전
y_47_720,전주 호텔 늘,거*****,좋았어용 방 온도조절도 잘되고 침대도 따뜻하고 저녁식사 시킨걸 배달원분이 맞은편 노이호텔로 잘못배달하셨는데 감사하게도 늘 호텔로 직접 가져다주셔서 밖에까지 안나가도 됐었어요 서비스도 좋은편인것 같아요옹,5,2년 전
y_47_721,전주 호텔 늘,물만두꽃돼지,예약 아주 만족해요~~ 쉬기 너무 좋아요!! 바닥도 깨끗하고 가격도 착하네요!! 따듯한 물 잘 나오고 침구도 깨끗해서 좋습니다~ 평소 잠자리에 예민해서 잠을 잘 못자는데 여기는 잠도 잘 올것 같아요!! 출장이 많은 편이라 타 숙소랑 비교를 많이 하는데 아주 만족스럽습니다 출장 중 이런 숙소 흔치 않으니 기회 된다면 꼭 이용해 보시는 것도 좋을 것 같습니다~ 추천 왕추천 합니다~!! !,5,2년 전
y_47_722,전주 호텔 늘,젤리베어,자주 들릅니당 시설 깔ㅋ근하고 직원분들 친절하셔서 너무 좋아요 ! 아중리 주변에서 제일 깔끔한가 같아요! 1층에 식빵 토스트도 해먹을수잇구 보드게임 빌릴수엣어서 할수잇는게 많아서 젛아용,5,2년 전
y_47_723,전주 호텔 늘,samchoni,확실히 두번째 방문하니 객실 업그레이드는 없네요~ 뭐 알고 간거니까 불만은 없구요 미니멀 객실도 나쁘진 않네요~ 원룸 정도의 크기인데 혼자 사용하기엔 부족함이 없었어요~ 아! 하나 아쉬운건 식사 테이블이 별도로 없어서 TV테이블에 놓고 먹어야 했다는 정도?,5,2년 전
y_47_724,전주 호텔 늘,거덜거덜한형화평론가,감사하게도 업그레이드 해주셔서 노이호텔 이용했어요! 쾌적하고 편안하고 항상 잘 쉬다 갑니당 가성비 너무너무 좋은곳이에요ㅜㅜ 이대로 쭈우우욱 장사 잘되시고 더더더 번창하세요!!!!!ㅎㅎㅎㅎ,5,1년 전
y_47_725,전주 호텔 늘,비인도적인웨딩드레스,1. 이불 침구류는 깨끗하나 벽지 상태가 좀 더럽고 빗 청소를 안 하는듯 머리카락 잔뜩 끼어있음 2. 가격대비 훌륭한 이용시설 3. 배스타올이 없는게 좀 아쉬움 그래도 대실 이용시간 넉넉하고 이 가격에 이정도 컨디션이면 재방문의사 100퍼센트 있음,4,2년 전
y_47_726,전주 호텔 늘,오늘따라기분이조아,"따뜻하고 깔끔하고 친절하시고 좋아요. 티비랑 컴퓨터 연결되서 이것저것 볼수있고 넷플릭스도 잘됩니다. 인테리어, 벽지 등이 지저분하지 않아 좋네요 딱히 단점이 없습니다. 가격도 비싸지 않고 재방문의사 충분합니다. 잘 쉬다 갑니다",5,2년 전
y_47_727,전주 호텔 늘,2205184,주차장 넓고.깔끔합니다 객실도 침구며 모두 깨끗하고 조용하고 사장님도 친절하십니다 서비스로주신 음료도 잘먹었네요 ㅎㅎ 항상.깔끔하게.유지되어 믿고 갈수있네요 청결에 신경 많이쓰시는게.보이네요 항상 들리는 이유가 있겠죠^^,5,7년 전
y_47_728,전주 호텔 늘,9037784,사장님 친절하시고 다 좋은데 벽쪽에 오줌? 자국처럼 흘러내린게 많이 있어서....위생적으로 넘 그랬네요ㅠㅠㅜㅠ 갯실에서 라면도 먹을 수 있어서 좋긴했는데 그 점이 좀 아쉬웠슺니당!!!!,4,4년 전
y_47_729,전주 호텔 늘,흥부마을비밀요원,좋아용! 시간 길어서 좋은데 청소만 신경써주셨음 좋겠습니당,4,1년 전
y_47_730,전주 호텔 늘,100세위협,좋아요~~. 전주올때마다 이용할거 같아요 바로 앞에 편의점 있고 음식점 많고 좋습니다 ㅎㅎ 침구도 깨끗하고 객실도 깨끗하고 사장님도 친절 하셔요^^ 다음에 또 올게요 번창하세요!!,5,2년 전
y_47_731,전주 호텔 늘,용훈,"사장님도 친절하시고 방 컨디션도 엄청 좋았습니다! 컴퓨터 사양도 아주 좋아요! 업그레이드도 해주셔서 감사했습니다, 잘 묵고 갑니다!",5,3년 전
y_47_732,전주 호텔 늘,감동적이고알록달록한비스타,가성비숙소로 최고입니다. 나름 청결하고 좋아요. 장점은 티비로 넷플릭스 디즈니 웨이브 등등 되서 정말 좋았던거같아요. 단점은 화장실이 너무 추웠어요ㅠㅠ 방도 조금 춥긴했지만 전기장판이 따뜻하게 잘되서 좋았습니다.,5,2년 전
y_47_733,전주 호텔 늘,별반지,호텔 늘은 이름 그대로 언제와도 늘 편하게 쉬다가는 곳이네요 ~ 시설도깨끗하고 친절도도 만족하는 곳입니다^^ 주차시설도 넓고 인테리어가 너무이뻐요 변기의 수압이 약해서 프론트에 전화드리니 남사장님께서 올라오셔서 해결해주시고 가셔서 감사했습니다. 다음에 재방문할게요 ~,4,7년 전
y_47_734,전주 호텔 늘,숙이얌,처음갔던 방이 화장실이 막혀있더라구요ㅠㅠㅠ 카운터에 말했더니 친절하게 바로 다른 방으로 바꿔주셨어용 감사합니다!! 방도 깨끗하고 따뜻해서 잘 쉬다 왔답니당ㅎㅎㅎㅎㅎ 다음에 또 이용할께요!,5,4년 전
y_47_735,전주 호텔 늘,매초롬한진돗개,룸업그레이드 받아서 너무 잘이용했어요 방도 깨끗하고 덕분에 스타일러도 잘썼네요 업그레이드 받은방에 욕조도 있었는데 한쪽이 망가졌는지 고무시트지로 붙여놔서 쓰진않았네요😅 또 에어컨 리모컨이 잘 작동이 안되서 좀 애먹었어요ㅎ 단점은 방음이 잘안됩니다 옆방 기침소리도 들려요ㅎㅎㅎ,4,1년 전
y_47_736,전주 호텔 늘,완벽하고친밀한27세,주말인데 대실시간도길고 저렴해서좋아요 에어컨키고 유튜브보면 시간 아주잘갑니다 숙소도 청결하게 관리하셔서 이용하기 좋아요 오늘도 잘 이용하다가 갑니다 다음에도 이용할생각 있어요 잘쉬었어요,5,1년 전
y_47_737,전주 호텔 늘,더북한화가수시,제가 정말 자주 이용하는 곳인데 진짜 올때마다 너무너무 좋습니다.사장님도친절하시고 방 크기도 넓고 쾌적하고 깔끔하고 좋습니다 진짜 어디하나 트집잡을수 없는 곳 입니다 앞으로도 전주에서 숙박잡아야할 일이있다면 저는 무조건 늘로 잡겠습니다..........항상 번창하시고 앞으로도 자주자주 이용하겠습니다!정말잘쉬다갑니다!정말 추천하는 숙박업소입니다!번창하세요~!,5,1년 전
y_47_738,전주 호텔 늘,오늘따라기분이조아,깔끔해요 디즈니되는 숙소가 별로 없는데 항상 잘 이용하고 있습니다. 다들 워낙 친절하시고 주차장이 조금 협소한것만 빼면 좋습니다. 청결이나 객실 상태도 깨끗하고 좋아요. 자주 이용합니다,5,1년 전
y_47_739,전주 호텔 늘,jshcokr,가격대비 시설 청결 괜찮고 친절하세요,5,3년 전
y_47_740,전주 호텔 늘,뚱한세인트버나드,시설이 깔끔하고 최고에요~~~ 아주 고급스러워요 주차 하기도 편리하고 불편한거 없이 잘 쉬었슴니다ㅎㅎㅎ 자주 자주 이용하고 싶어요 가격도 저렴해서 좋고 사장님도 친절하네요 굿이에요 굿~~~,5,2년 전
y_47_741,전주 호텔 늘,세네갈표범,잘지내고 갑니다 조용하니 깨끗하고 따뜻하고요 컴퓨터도 속도 빠르고 좋네요 매번 이용하는데 만족합니다 출장시 강추하고 이만한 가격에 이시설정도면 최고라 생각됩니다 또 이용할께요 ~~~,5,4년 전
y_47_742,전주 호텔 늘,후끈한마무리,오래만에 와도 정말 좋았어요 주차자리도 잘 안내해주시고 너무 친절했어요,5,3년 전
y_47_743,전주 호텔 늘,양은선,급하게 잡은 숙소인데 잘놀다왔습니다 전주 한옥마을 놀러가서 캐리커쳐 그린거 놓고왔는데 이미 폐기처리 된것같아서 마음이 안좋네요 ㅠㅠ 혹시라도 205호 청소하다가 보시면 연락 부탁드립니다!,4,1년 전
y_47_744,전주 호텔 늘,리릴릴리,고급스러움이 생각보다 괜찮았습니다. 편하게 쉴 수 있었고 소음도 별로 없었고 tv도 크고 저는 좋았습니다. 소음도 없었기 때문에 편하게 쉴 수 있게 시스템이 잘 되어 있는 것 같아요. 잘 쉬고 갑니다.,5,2년 전
y_47_745,전주 호텔 늘,jshcokr,가격대비 시설 청결 괜찮고 친절하세요,5,3년 전
y_47_746,전주 호텔 늘,적극적이고밝은해바라기색,방은 작은 편이지만 긴 대실 시간에 편하게 잘 쉬다 왔습니다 방도 따뜻하고 욕실도 괜찮았어요 주차장도 이용하기 괜찮았구요 다음에 또 올 생각입니다 잘쉬다 갑니당~~~~~!!!!!!!,4,2년 전
y_47_747,전주 호텔 늘,서글서글한법관,카운터 직원분 친절하셨고 룸 업그레이드 해주셔서 감사했습니다. 근대 단점이 있다면 화장실 청소상태가 너무 안좋아서 화장실에서 암모니아 냄새가 너무 심하게 나서 힘들었네요 주차 공간은 널널한거 같고 방음은 좀 안되는거 같았어요 옆방 소리가 들리네요 ㅠㅠ,3,2년 전
y_47_748,전주 호텔 늘,다차원적인제이콥,사장님이 친절하셔서 좋았어요. 객실 상태는 엄청 깨끗한 편은 아니지만 가격 생각하면 퀄리티 좋아요. 토스트도 구비되어있고 게임방에는 각종 보드게임도 있어서 좋네요. 방음은 좀 안되긴해요,5,1년 전
y_47_749,전주 호텔 늘,쪼코에몽119,완전 최고네요! 이렇게 춥고 추운 겨울엔 출장 다니면 다른 무엇보다 난방 잘 되는게 최고인데 다른곳은 전기장판이 없거나 어디는 전기장판만 되서 온돌체험? 하곤 하는데 적정한 난방에 정말 잘 쉬다 갑니다!,5,1년 전
y_47_750,전주 호텔 늘,피동적인날맥주,너무 좋아서 전주 올때마다 방문합니다!!! 최고에요 가격 경쟁력이 좋고 시설도 아주 나이스합니다 자주 이용했고 앞으로도 자주 이용할라구요~~~~~그리고 프런트도 친절하셔서 좋아요~!~!!!!,5,2년 전
y_47_751,전주 호텔 늘,감동적이고알록달록한비스타,숙소가 깨끗하고 좋았습니다. 이불은 좀 오래되서인지 하얗진 않앗지만 괜찮앗습니다. ott가 넷플릭스 디즈니 등등 여러가지가 있어서 정말 좋았습니다. 편하게 잘 쉬다갈수 있었습니다. !,5,2년 전
y_47_752,전주 호텔 늘,히사시부리요,깔금하고 좋아요. 사장님도 친절하시구 시설도 좋아요. 생각보다 방이작은것 같지만 그래도 잠깐이용하기 너무 좋아요 다만 수압이 너무 약해서 아쉬웠습니다.. 다음에도 이용할 계획있어요~~,5,2년 전
y_47_753,전주 호텔 늘,94세기억,보드게임 방 이용했는데 보드게임 방에있는 줄알고 ㅠㅠ프론트에 민증 맡기고 빌려가는 거더라구용 다른방에서 먼저사용하면 못쓰고ㅠ 그거는아쉽지만 정말 재밌게잘놀았어요! 티비도 크고 좋았습니다! 다음에도 이용할 의사있습니당!!,5,1년 전
y_47_754,전주 호텔 늘,구붓한프랑키,언제 방문해도 좋은 곳입니다! 깔끔하고 청결하고 가성비도 좋고 편합니다 주위에 숙박 업소들중에 제일 좋은 것 같아요 따뜻하구요 직원분들도 친절하시고 접근성도 좋아요 단점이 딱히 없네요 ㅎㅎ 다들 꼭 방문해보시길 바랍니다 강력 추천 드려요,5,2년 전
