id,name,nickname,review_content,rating,write_date
y_47_374,전주 호텔 늘,선봉411,사장님 친절하시고 화장실엄청넓고 깨끗하네요 TV도 크고 좋네요 다음에 또 오고싶네요 만족합니다,5,1년 전
y_47_375,전주 호텔 늘,이기머니,생각보다 괜찮습니다 따뜻하게 잘쉬다가여,5,8개월 전
y_47_376,전주 호텔 늘,온화하고진솔된청계산,역시 늘 이용하게 되는 곳입니다!,5,9개월 전
y_47_377,전주 호텔 늘,유머러스하고완고한해적단,숙소가 깔끔하고 좋아요,4,8개월 전
y_47_378,전주 호텔 늘,야속한바닷가재,깔끔하고 잘쉬다 갑니다,4,10개월 전
y_47_379,전주 호텔 늘,키다리각시,대체로 만족하지만 욕실샤워기는 줄줄 물이세고 핑크빛곰팡이때는 끼어있고~청결에 신경써 주셨음 하네요,3,6개월 전
y_47_380,전주 호텔 늘,GC1511102640,진짜 좋았습니다 자주 이용할즛,4,9개월 전
y_47_381,전주 호텔 늘,퍼렁이,하루 잘쉬다 왔습니다.,4,9개월 전
y_47_382,전주 호텔 늘,포천계곡장마,대실 이용하다 또 맘이 바껴서 숙박으로 진행하가가 담날 또 대실해서 편히 잘 이용하다 왔어요😂 그만큼 강추👍👍,5,9개월 전
y_47_383,전주 호텔 늘,스물셋훼손자,깨끗합니다 연박하는중이고 청소도 잘되고 냄새도 안나고 화장실도 깨끗합니다 바로앞에 편의점도 있어서 좋습니다 전주 출장올때마다 자주 이용하겠습니다 어플로 예약시 방컨디션에 비해 매우저렴합니다,5,1년 전
y_47_384,전주 호텔 늘,밝고편한게자리,ott가 잘 나오고 쾌적히니 좋습니다!,4,9개월 전
y_47_385,전주 호텔 늘,야속한바닷가재,괜찮은가격 깔끔한 숙소,5,9개월 전
y_47_386,전주 호텔 늘,태봉태경사랑,새로 오픈해서 깔끔히고 좋아요,5,4개월 전
y_47_387,전주 호텔 늘,스물셋훼손자,깨끗하고 좋습니다 화장실도 깨끗하고 방 컨디션도 괜찮네ㅇㅕ 연박중입니다 바로앞에 편의점도 있어서 편리합니다 전주 현대차공장이랑 아침에 출근하면 25분정도 걸립니다 자주이용하겠습니다,5,1년 전
y_47_388,전주 호텔 늘,키다리각시,잘 쉬었다 왔습니다 대체로 만족스러웠네요,3,3개월 전
y_47_389,전주 호텔 늘,7000프로,믿고가는 집 말이 필요없는 집,5,8개월 전
y_47_390,전주 호텔 늘,밝고편한게자리,OTT도 잘 나오고 깔끔하니 좋네요,4,10개월 전
y_47_391,전주 호텔 늘,경이맨임,깨끗하고좋앗습니다요,5,11개월 전
y_47_392,전주 호텔 늘,경이맨임,깨끗하고좋앗습니다요,5,11개월 전
y_47_393,전주 호텔 늘,야속한바닷가재,출장 중 자주 애용합니다 이근처 숙소중 가성비 제일좋습니다,5,9개월 전
y_47_394,전주 호텔 늘,vnfmal97,피시도있고 깔끔해서 좋았어요!,4,9개월 전
y_47_395,전주 호텔 늘,빛나고강렬한지,방음좋고 티비도 커서 좋았어요 잘 쉬다가요,5,9개월 전
y_47_396,전주 호텔 늘,햄식입니다,잘 쉬다가 갑니다~ 깔끔하고 좋아요,3,4개월 전
y_47_397,전주 호텔 늘,의욕적이고지혜로운오슬로공항,깨끗하고 시설 좋습니다,5,8개월 전
y_47_398,전주 호텔 늘,라바라바라바라라,좋은방주셔서 아주 잘쉬었습니다.,5,11개월 전
y_47_399,전주 호텔 늘,스물셋훼손자,깨끗하고 좋습니다 화장실도 깨끗하고 방 컨디션도 괜찮네ㅇㅕ 연박중입니다 바로앞에 편의점도 있어서 편리합니다 전주 현대차공장이랑 아침에 출근하면 25분정도 걸립니다 자주이용하겠습니다,5,1년 전
y_47_400,전주 호텔 늘,태봉태경사랑,편안하게 잘 쉬었습니다.,5,10개월 전
y_47_401,전주 호텔 늘,왕눈이트위터,"카운터에 가격표가 있던데.. 그것보다 비싸게 예약을 했더라구요ㅡㅡ 트윈베드방 왜 더 비쌌던걸까요? 밤 10시경 입실했는데 그 시간에 누가 사용을 한건지 욕실바닥에 물이 많이 뿌려져 있더라구요.. 욕실 청결 상태 별로였고..(특히 세면대) 테이블도 더럽고.. 게이밍 pc는 원하는건 없고 깔리지도 않고.. 셋이 갔는데 생수 달랑 1통, 수건도 2인분, 화장지도 쓰다가 떨어지구.. 누가 밤새 안마의자를 쓰는건지 엄청 쿵쿵거리고ㅡㅡ 아침엔 다른방 티비소리에 깼네요.. 사진, 댓글과는 다른 방 컨디션에 속상했습니다.. 다만 티비와 ott는 좋았습니다..",2,1년 전
y_47_402,전주 호텔 늘,7000프로,기분좋은 하루.ㅎㅎㅎ,2,7개월 전
y_47_403,전주 호텔 늘,완벽한보쌈김치,좋아요! 깨끗하고요!,5,5개월 전
y_47_404,전주 호텔 늘,주차왕김빵빵,사장님이 친절하시고 좋았습니다,5,3개월 전
y_47_405,전주 호텔 늘,달려라주제원,사장님친절하세요 잘쉬다갑니다,5,3개월 전
y_47_406,전주 호텔 늘,냥냥냥솜,완전 깨끗하고 좋았어요!,5,3개월 전
y_47_407,전주 호텔 늘,야속한바닷가재,깔큼하고 늘 잘 애용하고있습니다,5,9개월 전
y_47_408,전주 호텔 늘,Wisodien,저렴하고 괜찮아요..,5,1년 전
y_47_409,전주 호텔 늘,꽃길만걷자1,편안히 잘 쉬다가 갑니다,5,10개월 전
y_47_410,전주 호텔 늘,태봉태경사랑,항상 편하게 쉬엇다 갑니다.,3,7개월 전
y_47_411,전주 호텔 늘,야속한바닷가재,푹쉬다가 갑니다 좋은 숙소입니다,5,9개월 전
y_47_412,전주 호텔 늘,야속한바닷가재,잘쉬다갑니다 깔끔해요,5,9개월 전
y_47_413,전주 호텔 늘,이아리이콩심,항상 잘 묵고갑니다~~,5,10개월 전
y_47_414,전주 호텔 늘,뇌정천마,편히 잘 쉬다갑니다 감사합니다,5,9개월 전
y_47_415,전주 호텔 늘,투영스파파,담배냄새가 너무 심해서 비흡연자에게는 비추 입니다.,1,1년 전
y_47_416,전주 호텔 늘,jgg4785,넘 깔끔하구 좋았어용 전주에 처음 놀러갔는데 깔끔하게 잘 쉬다왔어용,5,9개월 전
y_47_417,전주 호텔 늘,밝고편한게자리,OTT가 안되어 속상했어요. 넷플만 가능하고 나머지는 안되서 이쉽네요.,3,6개월 전
y_47_418,전주 호텔 늘,들르자,"저번에 갈때는 청결하게 보엿는데, 이번에는 침대 이불을 들춰보니 머리카락 다수가 나오고, 침구류도 교환을 안하는지 누런때가 크게 군데군데 보이는게 쉬기 껄그러웟네요",3,3개월 전
y_47_419,전주 호텔 늘,태봉태경사랑,새로 오픈해서 깨끗하고 좋아요,5,5개월 전
y_47_420,전주 호텔 늘,총명하고창의적인코스타리카,두번째방문 좋았어요 ㅅㅅ,4,3개월 전
y_47_421,전주 호텔 늘,오손도손한침대,"사장님은 친절하신데..하… 방에 들어가자 마자 담배냄새가 나고, 청소가 너무 안되어 있었습니다. 침구며 화장실에 머리카락도 있고,,, 제가 집먼지진드기 알레르기가 있는데 침구가 너무 누래서 찝찝해서 다리만 이불덮고 잤다가 다리에 알레르기가 나서 하루종일 긁다 볼일 다봤습니다ㅠㅠ",2,10개월 전
y_47_422,전주 호텔 늘,야속한바닷가재,전주갈때마다 애용하고있습니다,5,9개월 전
y_47_423,전주 호텔 늘,진지하고획기적인청국장,전반적으로 깨끗 햇으나 가성비 괜찮은 숙소 입니다,3,6개월 전
y_47_424,전주 호텔 늘,한강생태학습장소불고기,와 절대가지마세요 개 안좋아요 와 완전 6070모텔,0,2개월 전
y_47_425,전주 호텔 늘,베스트한영민,잘쉬고왔습니다.ㅈ.,5,1년 전
y_47_426,전주 호텔 늘,날으는타조,무난합니다. 근처 들렀다가 갑니다~,3,10개월 전
y_47_427,전주 호텔 늘,특가내놔,1. 자리에 직원이 잘 없어요 2. 주차자리 얼마 없어요 3. 난방 안돼요 4. 방음 안돼요 5. 수건에 라면국물인지 얼룩있어요,1,7개월 전
y_47_428,전주 호텔 늘,아늑한소위,바로.새거로.교체해줌. .,2,8개월 전
y_47_429,전주 호텔 늘,snowflower1015,"프런트에 사람도 없고 전화하라더니 폰은 안에 있어서 받지도 않고 수건이랑 배개 ,이불 커버등 세탁도 제대로 안되어있고 화장실 물도 안내려져 있어서 들어가자마자 다른 사람의 볼일본걸 봐야했습니다. 투숙객이 나간 후 제대로 확인 안하시나봐요",1,9개월 전
y_47_430,전주 호텔 늘,적극적이고희망찬금강유황온천,편하게 잘쉬다갑니다.,3,11개월 전
y_47_431,전주 호텔 늘,뜨끔한신병,"가운 없구요 충전기도 없구요 어메니티가 밀봉된 포장이 아니라서 재활용이 의심되어 조금 불쾌했어요 방도 제가 겪어본 비슷한 가격의 다른 호텔, 모텔들보다 작아요 다음부터는 절대 안 올거 같네요ㅠ",2,3개월 전
y_47_432,전주 호텔 늘,하루하루행복하자,"방이 좁긴했으나 이용하기에 불편함이 없었습니다. OTT서비스도 이용 가능하여 좋았고, 시간도 넉넉하여 좋았습니다. 주변에 편의점도 있고 주차자리도 많이 있었습니다. 잘이용했습니다.",5,1년 전
y_47_433,전주 호텔 늘,하얀하늘푸른바다,장기여행러~서본서본입니다'ٮ' 이번에 여행은 바로 여기로 다녀왔어요 친구를 오랜만에 만나서 어떻게 놀지 고민하다보니 급하게 1박 2일 일정이 되버렸어요 일주일 전이라 숙소도 급하게 잡았어야 했고 일정도 짜야해서 이래저래 바쁜 일주일이었어요 호텔은 일단 땡기는 곳이 없었고 주말에 가다보니 가격도 가격이더라구요 일정이 빡빡하다보니 호텔에 머물 시간도 없어서 간단하게 잘 숙소를 찾았어요 둘다 비싸더라도 깔끔하고 옛날느낌을 싫어해서 찾다보니 모텔이 됐네요 모텔은 진짜 오래 된 곳아니고선 리모델링도 자주 하고 인테리어가 깔끔하잖아요 그래서 고른곳이 바로여기엿다는 523586522,5,25일 전
y_47_434,전주 호텔 늘,하얀하늘푸른바다,장기여행러~서본서본입니다'ٮ' 이번에 여행은 바로 여기로 다녀왔어요 친구를 오랜만에 만나서 어떻게 놀지 고민하다보니 급하게 1박 2일 일정이 되버렸어요 일주일 전이라 숙소도 급하게 잡았어야 했고 일정도 짜야해서 이래저래 바쁜 일주일이었어요 호텔은 일단 땡기는 곳이 없었고 주말에 가다보니 가격도 가격이더라구요 일정이 빡빡하다보니 호텔에 머물 시간도 없어서 간단하게 잘 숙소를 찾았어요 둘다 비싸더라도 깔끔하고 옛날느낌을 싫어해서 찾다보니 모텔이 됐네요 모텔은 진짜 오래 된 곳아니고선 리모델링도 자주 하고 인테리어가 깔끔하잖아요 그래서 고른곳이 바로여기엿다는 45236852,5,25일 전
y_47_435,전주 호텔 늘,하얀하늘푸른바다,장기여행러~서본서본입니다'ٮ' 이번에 여행은 바로 여기로 다녀왔어요 친구를 오랜만에 만나서 어떻게 놀지 고민하다보니 급하게 1박 2일 일정이 되버렸어요 일주일 전이라 숙소도 급하게 잡았어야 했고 일정도 짜야해서 이래저래 바쁜 일주일이었어요 호텔은 일단 땡기는 곳이 없었고 주말에 가다보니 가격도 가격이더라구요 일정이 빡빡하다보니 호텔에 머물 시간도 없어서 간단하게 잘 숙소를 찾았어요 둘다 비싸더라도 깔끔하고 옛날느낌을 싫어해서 찾다보니 모텔이 됐네요 모텔은 진짜 오래 된 곳아니고선 리모델링도 자주 하고 인테리어가 깔끔하잖아요 그래서 고른곳이 바로여기엿다는 sfhyi5663,5,25일 전
y_47_436,전주 호텔 늘,0625feel,시설은 괜찮았으나 구석구석 먼지가 엄청나네요! 욕실 세면대. 물이 안내려가네요.,2,8개월 전
y_47_437,전주 호텔 늘,100세위협,행사일때문에 왔습니다 시설도 깔끔하고 여러모로 좋았습니다 사장님도 친절하시고 침구며 뭐며 다 깨끗합니다 무엇보다 먹을 곳도 꽤 있고 배달도 좋습니다 담에 다시 오게되면 또 들릴게요~~!!!! 맛있는 음식점도 많아요 시설도 깨끗해요 최고입니다 강추 다음에 오게되면 또 들릴게요^^ 행사일때문에 왔습니다 시설도 깔끔하고 여러모로 좋았습니다 사장님도 친절하시고 침구며 뭐며 다 깨끗합니다 무엇보다 먹을 곳도 꽤 있고 배달도 좋습니다 담에 다시 오게되면 또 들릴게요~~!!!! 맛있는 음식점도 많아요 시설도 깨끗해요 최고입니다 강추 다음에 오게되면 또 들릴게요^^,5,1개월 전
y_47_438,전주 호텔 늘,음산한자석,그전에 자주 이용했었는데 오랜만에 방문 하였는데 바닥에 머리카락이며 털... 문에 얼룩이며.. 청결하지 못했어여 냉장고도 열여잇고 안시원하고.. 이번엔 쫌 별루였네요 가격적으로 가성비는 좋았으나 아쉬움이 컸어요,2,10개월 전
y_47_439,전주 호텔 늘,첫동네,숙소내 침실에 부속되어있는 화장실의 출입문 상태가 옥에 티였습니다.인테리어 공사를 빠른 시일내에 진행해 주시기를 희망합니다.,2,8개월 전
y_47_440,전주 호텔 늘,포근한화가,저렴한가격에 하루 잘 쉬였다 갑니다.,1,10개월 전
y_47_441,전주 호텔 늘,57세삶은계란,방음이 거의 안됩니다 객실 청결 상태가 아쉽습니다 친절합니다,2,7개월 전
y_47_442,전주 호텔 늘,곽지님,항상 좋은 공간에서 머물다 갑니다. 인테리어 굳굳 .,5,1년 전
y_47_443,전주 호텔 늘,광적인폭력,청소가좀 깔끔한편이 아닌듯,3,6개월 전
y_47_444,전주 호텔 늘,푸른유령,매트리스가 템퍼가 아니고 일반 스프링매트리스에 넷플릭스도 개인아이디없으면 못봅니다.,1,4개월 전
y_47_445,전주 호텔 늘,남*****,방은 살짝 좁은 감이 없지않아 있었지만 담배냄새 안나고 넷플릭스 돼서 편하게 머물다 갑니다 깨끗하고 좋아요 깨끗하고 좋아요 깨끗하고 좋아요 깨끗하고 좋아요 깨끗하고 좋아요 자주 방문합니다 자주 방문합니다 자주 방문합니다 자주 방문합니다 자주 방문합니다 깨끗하고 좋아요 깨끗하고 좋아요 깨끗하고 좋아요 깨끗하고 좋아요 깨끗하고 좋아요 자주 방문합니다 자주 방문합니다 자주 방문합니다 자주 방문합니다 자주 방문합니다 깨끗하고 좋아요 깨끗하고 좋아요 깨끗하고 좋아요 깨끗하고 좋아요 깨끗하고 좋아요,5,7개월 전
y_47_446,전주 호텔 늘,시간과세월,에어컨은 곰팡이 냄새가 너무 심해서 틀었다 끔. 그리고 욕실은 천장에서 물이 새는지 떨어짐 솔직히~ 많이 실망함 관리가 안되는 숙박시설 같음,1,9개월 전
y_47_447,전주 호텔 늘,SUZUKI77,옆방 음악 및 소음에 잠을 한숨도 못잠,2,4개월 전
y_47_448,전주 호텔 늘,7000프로,가성비 너무 좋아요. 전주가면 가는집,2,8개월 전
y_47_449,전주 호텔 늘,스물셋훼손자,추천합니다 너무좋네요,5,1년 전
y_47_450,전주 호텔 늘,신뢰가고알록달록한버튼,나쁘지 않았어요 디플 잘 보고가요 서비스 친절은 좀 아쉽네요,1,9개월 전
y_47_451,전주 호텔 늘,앙골라케이크,방마다 컨디션이 다른것같네여..^^ 제가 이용했던 곳은 방크기가 너무 작아요 고시원방 크기입니다 리얼 .. 사람 한 명 돌아다니기도 벅차요 ..🥵 무엇보다 침구 청결이그닥 ㅠㅠㅠ 차라리 같은 돈 주고 큰방 예약하거나 디럭스방을 싸게 예약하는게 나을듯해용!! 장점으로는 긴 대실시간과 .. ott가 다양해요!!!,1,1년 전
y_47_452,전주 호텔 늘,봉명덩,두번다시안감 먼지 띵털 머리카락 위생상태엉망,1,6개월 전
y_47_453,전주 호텔 늘,밍둥이22,여행중애 빠른 입실 되는곳이 늘이라서 왔는데 인포 직원분도 친절하시구 티비도 대따크고 안마의자랑 스타일러까지 넘 좋네용^^,5,1년 전
y_47_454,전주 호텔 늘,파랑하늘새,주차장이 넓어서 쉽게 주차 할 수있어서 편하고 좋았습니다 주변에 편의점이 가깝게 있어서 좋았어요 방도 사진과 똑같고 넓어서 좋았습니다 넷플릭스도 잘되고 화장실도 넓어서 좋아요 가성비 좋아요,5,1년 전
y_47_455,전주 호텔 늘,포근한화가,메트리스는 좋은데. 미니멀은 방이 작아서 아쉬웠네요,2,5개월 전
y_47_456,전주 호텔 늘,첫동네,숙소의 침실내 화장실 출입문이 오래되어 미관상 매우 눈살을 찌뿌리게 한 부분은 옥에 티였답니다.,2,8개월 전
y_47_457,전주 호텔 늘,남*****,너무 깨끗하고 인테리어도 좋았어요 잘 쉬다 갑니다 잘 쉬다갑니다 잘 쉬다갑니다 잘 쉬다갑니다 잘 쉬다갑니다 깨끗해요 깨끗해요 깨끗해요 깨끗해요 깨끗해요 잘 쉬다갑니다 잘 쉬다갑니다 잘 쉬다갑니다 잘 쉬다갑니다 깨끗해요 깨끗해요 깨끗해요 깨끗해요 깨끗해요 잘 쉬다갑니다 잘 쉬다갑니다 잘 쉬다갑니다 잘 쉬다갑니다 깨끗해요 깨끗해요 깨끗해요 깨끗해요 깨끗해요 잘 쉬다갑니다 잘 쉬다갑니다 잘 쉬다갑니다 잘 쉬다갑니다 깨끗해요 깨끗해요 깨끗해요 깨끗해요 깨끗해요 잘 쉬다갑니다 잘 쉬다갑니다 잘 쉬다갑니다 잘 쉬다갑니다,4,9개월 전
y_47_458,전주 호텔 늘,너랑나랑유미랑,자주가던곳인데 갈때마다 인포에 사장님 안계셔서 입실시간도 늦어지고 한번씩 바닥도 물기도 안말라서 못들어갈정도일따 있어용,0,10개월 전
y_47_459,전주 호텔 늘,남*****,깨끗하고 사장님도 친절하시고 좋아요 깨끗하고 사장님도 친절하시고 좋아요 깨끗하고 사장님도 친절하시고 좋아요 깨끗하고 사장님도 친절하시고 좋아요 깨끗하고 사장님도 친절하시고 좋아요 깨끗하고 사장님도 친절하시고 좋아요 깨끗하고 사장님도 친절하시고 좋아요 깨끗하고 사장님도 친절하시고 좋아요 깨끗하고 사장님도 친절하시고 좋아요 깨끗하고 사장님도 친절하시고 좋아요 깨끗하고 사장님도 친절하시고 좋아요 깨끗하고 사장님도 친절하시고 좋아요 깨끗하고 사장님도 친절하시고 좋아요,5,10개월 전
y_47_460,전주 호텔 늘,안녕해세유,"ㅎㅎㅎ깨끗한 시설로 기분 좋게 머물다 갑니다. 하나하나 손님들을 위해 신경쓴 게 느껴지더라구요 손님들을 위해 스낵바를 마련해서 간식들도 챙겨 놓아주시고ㅠ, 넘 기분 좋게 머물다 갔네요! 내부 시설도 좋더라구요! 편하기 쉬었다 가네요 다음에 여기로 올 거 같아요 덕분에 좋은 시설에서 잘 쉬었습니다",5,1년 전
y_47_461,전주 호텔 늘,nanie,잘 쉬고갑니다 감사,5,1년 전
y_47_462,전주 호텔 늘,sungyeon21,항상 갈때마다 기분이 좋게 깔끔한 외관과 깔끔한 실내로 매번 올때마다 좋은 느낌으로 오고 있습니다 친절하신 사장님은 덤!👍 방은 깔끔하고 좋으면서 방마다 개성있는 인테리어로 다음에는 어떤 방일까? 궁금해지네요 잘 쉬다 갑니다!,5,1년 전
y_47_463,전주 호텔 늘,완벽하고쾌활한까까,올때마다 좋아요~ 다음에 또 방문할게요~ 올때마다 좋아요~ 다음에 또 방문할게요~ 올때마다 좋아요~ 다음에 또 방문할게요~ 올때마다 좋아요~ 다음에 또 방문할게요~ 올때마다 좋아요~ 다음에 또 방문할게요~,5,1년 전
y_47_464,전주 호텔 늘,영덕대게마을지하,일단 객실 컨디션은 매우 좋았다고 생각했습니다. 깔끔함이 가장 증요한데 깔끔했으며 나머지 부분도 매우 만족입니다. 다만 한 가지 아쉬웠던 점은 에어컨 냉매가 부족해서 에어컨이 시원하지 않았습니다,5,1년 전
y_47_465,전주 호텔 늘,한라산국립공원레이몬드,친절하고 깨끗하고 청결하고 다 좋습니다 숙소 예약할때 욕실을 많이 보는데 깨끗해서 좋았고 침구류도 잘 정리정돈 되어있어서 좋았습니다 편의점도 바로 앞에있어서 편리했습니다 주차공간이 넉넉하지않은건 살짝 불편합니다,5,2년 전
y_47_466,전주 호텔 늘,흑사만다,전주 갈 때마다 이용하는 곳으로 가성비도 좋고 사장님도 친절하십니다.,5,1년 전
y_47_467,전주 호텔 늘,영자에요,넷플릭스도 되고 숙소 하기 좋아요 객실 들어가면 깨끗하고 침대바러 앞에 티비도 있어서 좋아요 주차자리도 넉넉히 있어서 좋아요 고데기도 있어서 좋아요 퍈했던거 같아요 숙소 편해서 너무 좋아요 ㄱ!!,5,1년 전
y_47_468,전주 호텔 늘,동궁,3번째 이용중 입니다. 주변 숙박도 많지만 어플로 가던곳이라 계속 이용하고 있습니다. 항상 주차장이 꽉차 있어서 숙소 밖에 주차를 자주 하네요. 시설이나 깔끔하거나 잘되어 있는데 공기청정기가 작아요. 컴퓨터는 소리가 잘 안들려서 다음에는 해드셋을 빌려야 될듯요. 또 뵙겠습니다.,5,1년 전
y_47_469,전주 호텔 늘,자카르타과학,알바분이 친절해서 좋았습니다. 객실도 깨끗해서 이용 시 불편함을 안느꼈어요. 담배냄새도 안나서 좋았습니다. 기분 좋게 잘 쉬다 갑니다. 다음에도 또 이용할게요. 감사합니다. ㅎㅎㅎ,5,1년 전
y_47_470,전주 호텔 늘,느짓한객원,"친절,깨끗♡ 모든거 다 좋았어요^-^",5,1년 전
y_47_471,전주 호텔 늘,남색서바이벌조교,늘 그렇듯 이번에도 잘 이용하고 갑니다~ 조금 아숴운 점은 방수때문인지 매트에 비닐(?)같은게 씌어져 있어서 푹신함이 덜 하네요 그 부분만 없으면 더 좋을 거 같어요 나머지는 만족~,5,1년 전
y_47_472,전주 호텔 늘,용감한전투선,깨끗하고 편안하게 잘 쉬고 갑니다 감사합니다,5,1년 전
y_47_473,전주 호텔 늘,센형아,주차장 차가 만차라 건물 밖에 잠시 주차하고 프론트 갔더니 객실점검중 올려놓고 5분이상 지나도 오지않아 전화하니까 그제서야 내려와 저기 차를..말하고 있는데 짜증내며 아..잠시만요 프론트로 들어가더니 본인할일하고 왜요? 짐들고 기다리는데 먼저 기다리게해서 죄송하다 말하는게 먼저아니니가요? 예전에는 친절했는데 아쉽네요,1,1년 전
y_47_474,전주 호텔 늘,둥글둥글한비옷,푹쉬었습니다. 편의점도 가깝고 저는 괜찮았습니다. 푹쉬었습니다. 편의점도 가깝고 저는 괜찮았습니다. 푹쉬었습니다. 편의점도 가깝고 저는 괜찮았습니다. 푹쉬었습니다. 편의점도 가깝고 저는 괜찮았습니다.,5,1년 전
y_47_475,전주 호텔 늘,벨기에북어,조아따조아따조아따조아따조아따조아따조아따조아따 조아따조아따조아따조아따조아따조아따조아따조아따 조아따조아따조아따조아따조아따조아따조아따조아따 조아따조아따조아따조아따조아따조아따조아따조아따 조아따조아따조아따조아따조아따조아따조아따조아따 조아따조아따조아따조아따조아따조아따조아따조아따 조아따조아따조아따조아따조아따조아따조아따조아따 조아따조아따조아따조아따조아따조아따조아따조아따 조아따조아따조아따조아따조아따조아따조아따조아따 조아따조아따조아따조아따조아따조아따조아따조아따 조아따조아따조아따조아따조아따조아따조아따조아따 조아따조아따조아따조아따조아따조아따조아따조아따 조아따조아따조아따조아따조아따조아따조아따조아따 조아따조아따조아따조아따조아따조아따조아따조아따 조아따조아따조아따조아따조아따조아따조아따조아따 조아따조아따조아따조아따조아따조아따조아따조아따 조아따조아따조아따조아따조아따조아따조아따조아따 조아따조아따조아따조아따조아따조아따조아따조아따 조아따조아따조아따조아따조아따조아따조아따조아따 조아따조아따조아따조아따조아따조아따조아따조아따 조아따조아따조아따조아따조아따조아따조아따조아따,5,2년 전
y_47_476,전주 호텔 늘,jshcokr,가격대비 시설 청결 괜찮고 친절하세요,5,2년 전
y_47_477,전주 호텔 늘,파행적인도망병,자주가요 좋아요 시설이 자주가요 좋아요 시설이 자주가요 좋아요 시설이 자주가요 좋아요 시설이 자주가요 좋아요 시설이 자주가요 좋아요 시설이 자주가요 좋아요 시설이 자주가요 좋아요 시설이 자주가요 좋아요 시설이 자주가요 좋아요 시설이 수압이넘약함,4,2년 전
y_47_478,전주 호텔 늘,김새우님,방에서 오줌 찌린내 나요,0,8개월 전
