id,name,nickname,review_content,rating,write_date
y_47_1194,전주 호텔 늘,자카르타과학,알바분이 친절해서 좋았습니다. 객실도 깨끗해서 이용 시 불편함을 안느꼈어요. 담배냄새도 안나서 좋았습니다. 기분 좋게 잘 쉬다 갑니다. 다음에도 또 이용할게요. 감사합니다. ㅎㅎㅎ,5,2년 전
y_47_1195,전주 호텔 늘,7288586,정말 넓고 깔끔하고 좋았어요 ㅎㅎ 화장실도 넓고 안마의자도 있고 전기장판도 따시고 자주 이용할게요ㅎㅎㅎ,5,5년 전
y_47_1196,전주 호텔 늘,호로록쨥쨥,냄새가 좀 나요….그리고 컴터 모니터가 안켜지고 TV에 연결하려면 직접 HDMI연결해서 봐야 해요 그 외 나머지는 좋았습니다 사장님 진짜 친절하셨어요,3,3년 전
y_47_1197,전주 호텔 늘,깨방정82,깔끔하고좋아요~~~~ 주변에 상권도좋구 가끔들리는곳이긴한데 가격대비 만족하는곳이네요~~~ 편하게 쉬기에는 딱인듯싶어요 담에두 깨끗하고 편하게 쉬었다갈게요~~~~^^ 굿데이~~,5,2년 전
y_47_1198,전주 호텔 늘,2079239,정말 시설이나 가격 부분에서 정말 좋아요 청결상태도 객실 내부도 정말 좋아요,4,5년 전
y_47_1199,전주 호텔 늘,완벽하고쾌활한까까,넓은 방으로 업그레이드 해주셔서 좋았어요~,5,1년 전
y_47_1200,전주 호텔 늘,gkstoazhf,잘 쉬었다 갑니다^^,5,1년 전
y_47_1201,전주 호텔 늘,깨끗한방원해요,"ㅋ오랫만에 전주 우아동 이라는 지역에 출장을 오게 되었습니다. 어디서 묵을까. 망설이다가 아중역 인근에서 깨끗해보이는 호텔 늘 예약하고 갔습니다. 역시 청결,깔끔 그 자체였고 너무 좋았습니다. 다음에도 꼭 들릴께요",5,3년 전
y_47_1202,전주 호텔 늘,야냐볼릭,종말 위치도 좋고 깔끔해요 다음에도 이용해서 쉬겎습니더 사장님도 많이 친절햐서 푹쉬다 갑니다 종말 위치도 좋고 깔끔해요 다음에도 이용해서 쉬겎습니더 사장님도 많이 친절햐서 푹쉬다 갑니다^^,5,1년 전
y_47_1203,전주 호텔 늘,10325221,사장님도 친절하시고 방도 깔끔했습니다,5,5년 전
y_47_1204,전주 호텔 늘,유*****,시설도 좋구 깔끔하구 잘 쉬었습니다 샤워기 수압이 약해서 조금 아쉬웠네요,5,7년 전
y_47_1205,전주 호텔 늘,검은돌고래,늘 호텔 무한대실 진짜 최고에요 ~!! 객실도 이정도면 나쁘지 않고 직원분도 친절하니 좋은 숙소 같습니다 예전부터 종종 이용하는데 여전히 괜찮은 숙소중 하나로 뽑고 있어요 ~!! 담에 또 이용하고 싶습니다,5,1년 전
y_47_1206,전주 호텔 늘,유*****,주차장도 넓구 실내도 깨끗하고 잘 되어 있어서 편히 쉬었다 왔네요 ^^,5,7년 전
y_47_1207,전주 호텔 늘,한라수목원만화가,좋은방 주셔서 잘 쉬다가 갑니당 ! 대실 시간도 길어서 여유있게 잘 있었어요 ㅎㅎ,5,2년 전
y_47_1208,전주 호텔 늘,3443580,진짜 짱이예요!! 안마기도 진짜 시원하고 비싼거예요 ㅋㅋㅋㅋ방도 좋고 화장실도 너무 깨끗하고 좋아요~~ 센스있게 음료도 탄산수♥ 진짜 전주 와서 호텔때문에 감동먹고가요! 남친도 너무 좋다고하네요! 여태 간곳중에 최고라고~!! 잘쉬다가요 진짜 추천합니다 꼭 가보세요~,5,8년 전
y_47_1209,전주 호텔 늘,여기어때 이용 고객,되게깨끗하고 너무 좋네요 주변도 조용하고 사장님 친절하셔요 가격도 아깝지도않고 최고입니다☺️,5,6년 전
y_47_1210,전주 호텔 늘,5442447,친절했고요 시설 청결 완벽했습니다 하일라이트는 이대근 셋트 이거이거 물건입니다 재방 드러갑니다,5,7년 전
y_47_1211,전주 호텔 늘,난몰라잉,"배그pc 커플존 이용했습니다..배그 안돌아가요ㅠㅠ 모니터랑 그래픽카드 바꾸셔야할거같아요.. 커플피시존이래서 기대하고 갔는데 오버워치도 버벅거리구..티비만보다가 왔네요ㅜㅜ 아쉬워요 나중에 제대로 돌아가는 커플 pc 설치해주시면 연락한번주세요.. 그 외, 직원들 친절하고, 아주 깨끗, 넓고 따뜻하고 편하게 잠들었습니다. 감사합니다",4,5년 전
y_47_1212,전주 호텔 늘,쪼코에몽119,언제나 늘 만족하면서 방문드리네요 우선은 이 추운 겨울에 난방이 완전 잘 된다는 점이 너무너무너무 맘에 듭니다... 진짜 전기장판만 틀어놓으면 이불 안 덮어도 될 정도... 여러 장점 있지만 정말 따뜻하게 잘 자고 갑니다!,5,1년 전
y_47_1213,전주 호텔 늘,자카르타과학,알바분이 친절해서 좋았습니다. 객실도 깨끗해서 이용 시 불편함을 안느꼈어요. 담배냄새도 안나서 좋았습니다. 기분 좋게 잘 쉬다 갑니다. 다음에도 또 이용할게요. 감사합니다. ㅎㅎㅎ,5,1년 전
y_47_1214,전주 호텔 늘,암포서원쌀밥,친절 서비스 청결 위생 시설 모두 만족입니다. 전주엔 이만한 곳 얼마 없는 거 같아요~~,5,7년 전
y_47_1215,전주 호텔 늘,꽃님8641,여행중간에 들린 숙소로 근처에서 식사후 입실하였는데 어플예약시 사진과 다른 느낌 사람마다 틀리니깐요 일단 전체적 컨디션 괜찮습니다. 깔끔하고 그런데 말입니다 화장실 샤워후 물이 막힌건지 천천히 내려가고 침구는 매트릭스 비닐을 안뜷은건지 비닐소리 가 계속 나고요 그런점만 수정해주시면 전반적으로. 가격대비 좋아요,3,2년 전
y_47_1216,전주 호텔 늘,담벽색코트,"일단 복도에서부터 담배찌든내가 납니다 욕조가잇는 디럭스를 예약햇는데 마음대로 게임테이블이잇는 룸을.주셧네요 여자친구랑 가서 포커를.칠것도 아니고 욕조때문에 돈 더 주고 예약한건데 말도없이 방을 바꿔버리네요 침구에는 음식물이 튀어서 빨간 자국이 손톱만하게 잇고 침구 교체 안하시나봐요 담배냄새가 침구까지 다 쪄들어서 머리카릭에서도 딤배냄새가 납니다 담배도 안피는 사람인데요 12시에 전화오더니 ""시간끝낫으니까 나가세요"" 합니다 대박이네요 여기 진짜 출장땜에 한달에 두세번 숙박업소 이용하는데 그중에 서비스마인드 시설 최악입니다 정말..두번다시는 쳐다도 안볼거같아요 여기오시는 분들은 무조건 12시 전에 퇴실하세요 매니저님이 화가 많으세요 전화로 한숨쉬면서 얘기하시니까 참고하세요",0,1년 전
y_47_1217,전주 호텔 늘,안실장님,숙소도 주차장도 상태 좋네요 화장실 샤워 수압이 좀 약한거 빼고 다 좋아요 ㅎ,5,5년 전
y_47_1218,전주 호텔 늘,유*****,깨끗하고 시설도 좋아서 잘 이용했습니다 주차장도 넓고 좋았어요,5,6년 전
y_47_1219,전주 호텔 늘,은콩이이,친절하고 좋아요 깨끗해요,5,1년 전
y_47_1220,전주 호텔 늘,오대산패배인,조아요 잘 사용햇어요ㅎ,4,1년 전
y_47_1221,전주 호텔 늘,하뜡,"전주 여행가서 첫번째로 묵은 숙소인데, 덕분에 전주의 첫 인상이 좋았고 편하게 잘 쉬었습니다.😁",5,1년 전
y_47_1222,전주 호텔 늘,호호60,"깔끔하고 쾌적하게 편안히 하루 잘보냈습니다. 룸업그레이드까지 감사했습니다. 욕실용품, 수건 등 부족함없었고, 고대기있어서 유용했습니다. 급하게 일이 있어 아이 데리고 자정무렵 도착했는데 추가금없이 룸업그레이드까지 감사했습니다. 번창하시길 바라겠습니다.",5,5년 전
y_47_1223,전주 호텔 늘,2205184,친절하신 사장님 잘 쉬고가네요 객실도 청결하고 깔끔합니다 또 올게요 ㅎㅎ,5,7년 전
y_47_1224,전주 호텔 늘,여든다섯파인애플,너무 깔끔하고 프런트 직원 분도 너무 친절하시네요 👍🏿,5,1년 전
y_47_1225,전주 호텔 늘,꼼꼼하고확실한품질,객실에서 담배냄새가 나는거 빼고는 괜찮았습니다.,3,1년 전
y_47_1226,전주 호텔 늘,자카르타과학,알바분이 친절해서 좋았습니다. 객실도 깨끗해서 이용 시 불편함을 안느꼈어요. 담배냄새도 안나서 좋았습니다. 기분 좋게 잘 쉬다 갑니다. 다음에도 또 이용할게요. 감사합니다. ㅎㅎㅎ,5,2년 전
y_47_1227,전주 호텔 늘,오늘따라기분이조아,항상 잘 이용하고 있어요 아늑하고 깔끔하고 딱히 문제있는게 없습니다. 갈때마다 사장님도 친절합니다. 주차장이 조금 협소한건 아쉽지만 충분히 길에 댈만해서 괜찮습니다ㅋ 잘쉬다갑니다 또방문할게요,5,1년 전
y_47_1228,전주 호텔 늘,복*****,전 객실 템퍼매트리스를 사용해서 자고 일어나면 허리가 아프지 않아서 좋습니다 객실마다 스타일러가 있는곳이 있고 안마의자도 있는것이 있고 보드게임 테이블이 있는곳도 있습니다 미니멀은 아무것도 없던걸로 기억하지만 매트리스가 좋고 티비가 커서 좋습니다,5,2년 전
y_47_1229,전주 호텔 늘,자카르타과학,알바분이 친절해서 좋았습니다. 객실도 깨끗해서 이용 시 불편함을 안느꼈어요. 담배냄새도 안나서 좋았습니다. 기분 좋게 잘 쉬다 갑니다. 다음에도 또 이용할게요. 감사합니다. ㅎㅎㅎ,5,2년 전
y_47_1230,전주 호텔 늘,셔틀코스,청결한 시설과 친절한 서비스 가 좋아서 전주에서는 항상 이용합니다~~^^,5,6년 전
y_47_1231,전주 호텔 늘,마흔에다시시작,가성비 너무 좋은 곳입니다 이가격해도 되나 싶네요?? 주중은요 깨끗하고 좁지않은방에서 잘 쉬고 가요 재 방문 합니다 ㅋㅋㅋ 다음주 될 듯 ㅋ 다만 세면대 물이 잘 안빠짐. 샤워기 수압 약함,5,2년 전
y_47_1232,전주 호텔 늘,가야산가시,좋아요~ 저렴한 가격에 이용하는데 객실도 깨끗해요 !! 이용시간도 길어요,5,2년 전
y_47_1233,전주 호텔 늘,Iillllill,일단 사진이랑 느낌이 달라요 사진상 엄청 깔끔하고 오래되어 보이진 않았는데 생각보다 오래된 느낌이고 침대커버가 부스럭부스럭 거리면서 너무 움직이고 비닐느낌이 너무 나길래 안에 봐보니 방수커버 같은?게 있어서 촉감이 너무 별로였습니다...이불도 그렇고 배게도 그렇고 그냥 커버 자체가 별로였어요,3,1년 전
y_47_1234,전주 호텔 늘,통일신라,아주좋아요 ^^♡♡♡♡♡,5,2년 전
y_47_1235,전주 호텔 늘,6603225,"스탠다드 객실 사용했어요! 객실 내부 깔끔하고 좋았어요ㅎㅎ 화장실이 생각보다 너무 깔끔해서 제일 마음에 들었구 드라이기, 고데기까지 없는게 없더라구요ㅎㅎ 대실이용했는데 다음에는 숙박도 사용할게요~^^ 강추합니당!! 자주 이용할게요ㅎㅎ",5,7년 전
y_47_1236,전주 호텔 늘,거덜거덜한형화평론가,깔끔하고 시설이 너무 좋았어요 안마의자 스타일러 등등 거의 호텔 버금갔던듯 ㄷㄷ 퇴실 막바지쯤 갑자기 불이 다 꺼지는 이슈가 있었는데 바로 전화주시고 죄송하다고 퇴실시간 연장해주시는 대처가 참 좋았어요 다음에 또 이용할것같아요!,5,2년 전
y_47_1237,전주 호텔 늘,감*****,"우아동이 전주역이랑 가까워서 자주 여기서 노는데요, 늘호텔은 이번이 두번째 방문입니다. 저번에는 디럭스를 예매했는데 사장님께서 디럭스 트윈 방을 주신 것 같더라구요 ㅎㅎ 그래서 남친이랑 좋은 시간 보내다 왔습니당 디럭스 트윈은 방이 좀 작긴 했지만 내부 상태나 청결엔 문제가 없었어요. 이번엔 미니멀 디럭스로 예약을 했고 601호 배정 받았습니다. 일단 도어락이 배터리가 없어서 열고 닫을 때 마다 띠리리링 소리가 났구요 방은 굉장히 작았습니다. 벽지도 지저분했고 화장실도 너무 오래된 느낌이었어요. 세면대 배수도 안되고 바닥으로 물이 샜습니다. 퇴실할 때 쯤엔 조명이 다 나가버려서 어둠속에서 샤워를 했습니다 ㅠ",2,1년 전
y_47_1238,전주 호텔 늘,지두두,"카운터 직원분들 너무 친절하시고, 자주 이용하는데 처음리뷰 남기게 된점 죄송합니다. 시설깔끔하며 가운은 객실에 비치되어있습니다. Ott문제ㅜ없고 너무 좋아서 정말 많이 이용했던곳이라 강력하게 추천합니다",5,1년 전
y_47_1239,전주 호텔 늘,무등산굴,사장님도 친절하시고 위치도 좋구 객실도 깔끔 깨끗하고 좋으네요,5,7년 전
y_47_1240,전주 호텔 늘,무등산굴,시간도 좋구 위치도 좋구요 친절하시구 방도 깔끔 깨끗 좋네요,5,7년 전
y_47_1241,전주 호텔 늘,유*****,시설도 좋구 조용하니 잘 쉬다 왔네요,5,7년 전
y_47_1242,전주 호텔 늘,알트리버,객실컨디션은 좋았습디다 적당했구요 컴터가 켜지지않아서 물어보니 로딩이 늦게된다고 안되면 연락달라고했는데 그냥안했어요 1층엔 토스트와 커피있었어요 팝콘기계는작동안하는것같았구요 음료나이런건없어서 그림과다르다고 했더니 바뀌었다고 하셨어요 방은 넷플포함 다른오티티도있어서 재밌게 보냈습니다 다음에도 갈께요ㅎ,5,2년 전
y_47_1243,전주 호텔 늘,2205184,청결하고 좋아요 침구가특히 깔끔하네요 추천하고갑니다,5,7년 전
y_47_1244,전주 호텔 늘,태봉태경사랑,편안하게 잘 쉬었다 갑니다.,5,1년 전
y_47_1245,전주 호텔 늘,생기발랄한사립탐정,"깔끔하고 좋았어요. 근데 당일에 예약할 때는 55,000원이었는데 체크인하고 다시 보니 50,000원이더라구요. 체크인할때 방 업그레이드 해줬다고 해서 감사하다고 했는데 그 이유였나봐요.",4,6년 전
y_47_1246,전주 호텔 늘,느짓한객원,"깔끔하고, 친절하고 너무 좋았어여♡",5,1년 전
y_47_1247,전주 호텔 늘,여기어때 이용 고객,저희 커플이 게임을 좋아해서 피시방을 자주가는데 그럴필요 없이 여름엔 이 호텔에서 시원하게 배그피시룸 잡아놓고 게임하면 되겠네요 ㅎㅎ 시설도 너무 좋고 컴퓨터도 좋아서 게임 많이 했어요 진짜 자주 애용할거같아요 ㅎㅎ,5,5년 전
y_47_1248,전주 호텔 늘,GC14994512002,직업상 대실 많이 히는데 가격대비 전주 에서 다녀본 곳 중에서 최고 였음 담주에 또 이용 예정,5,1년 전
y_47_1249,전주 호텔 늘,474572,제가 가봤던 모텔중에 가장 깨끗합니다 토요일을 제외하고 갈일이 생기면 항상 늘을 이용합니다 전주 놀러와서 숙박할 곳을 찾는 사람이 있다면 주저없이 늘을 추천해주고 싶네요^^ 항상 변함없이 지금처럼만 유지 됐으면 좋겠습니다,5,7년 전
y_47_1250,전주 호텔 늘,은중김,항상 이용하는 숙소예요! 청결하고 친절하고 가격도 착하고 안 올 이유가 없습니다!,5,1년 전
y_47_1251,전주 호텔 늘,피동적인날맥주,항상 자주 가는 곳인데 친절하시고 깔끔하고 쉬다가 가기 좋습니다~ ~~~~~방문 할때 마다 대 만족하고 돌아가요~~~~~~~~~~~ 앞으로도 자주자주 방문할려구요~~~~~!~!!!~!!,5,2년 전
y_47_1252,전주 호텔 늘,무등산굴,친절하시고 위치도 좋고 좋네요 객실도 좋구 깨끗하네요,5,6년 전
y_47_1253,전주 호텔 늘,용맹하고강렬한바르샤바,편하고 깔끔하고 청결함,3,1년 전
y_47_1254,전주 호텔 늘,초코렛872,여자친구와 일이 자주 늦게 끝나고 쉬는 날이 불규칙해서 대실 시간이 긴 곳을 많이 찾아다녀봤지만 늘 만한 좋은 가성비 숙소를 찾아볼 수 없었어요. 앞으로도 긴 대실 시간이 필요할 땐 자주 이용할 것 같아요,5,2년 전
y_47_1255,전주 호텔 늘,하늘빛수목원장님,시설도 좋고ㅎㅎ 깔끔해요 ㅎㅎ 가성비도 좋구 여기 저기 돌아다녀ㅎㄴ 본 곳 중에 매우 만족한 숙소 입니다~~~ 다들 꼭 한번씩 가보세용 그리고 직원분들도 넘 착하심ㅎㅎㅎㅎㅎㅎㅎㅎ,4,3년 전
y_47_1256,전주 호텔 늘,우크라이나꽁무니,시설 청결 서비스 모든 면에서 만족합니다. ㅎㅎ,5,6년 전
y_47_1257,전주 호텔 늘,근시안적인예비군,오랜만에 전주 여행가서 즐거운 추억 만들었습니다. 작은방이라 아쉬웠지만 가격대비 너무 좋았어요 주변에 먹거리도 많구 좋더라구요 다음에 전주 갈 일 있으면 큰방으로 해서 가려구요 ! 잘 쉬다가 갑니당,4,2년 전
y_47_1258,전주 호텔 늘,효과적인장난,적당히 작아서 오히려 아늑해서 좋았어요,5,3년 전
y_47_1259,전주 호텔 늘,우글쭈글한공군기,욕조는 머리카락이 많이 있었습니다 말씀 드릴려고 하다 그냥 쉬었습니다,5,1년 전
y_47_1260,전주 호텔 늘,피동적인날맥주,리모델링을 부분적으로 되어서 그런지 이전보다 더 밝아진 느낌이 듭니다. 더 청결해보이고 깔끔해보이네요. 오랜만에 방문했는데 좋았습니다. 청결도는 말할 필요도 없고 이젠 목욕가운도 추가되어서 더 좋네요~,5,2년 전
y_47_1261,전주 호텔 늘,ggqq,저번에 한번가보고 너무 좋아서 다시 예약해서 갔어요 ㅎㅎ 객실 깨끗하고 다 맘에 들어요 다만 ㅜ 객실에 드라이빗이없어서ㅠㅠ 그래도 고데기 다 비치되있어서 ㅎㅎ 잘사용하고 왔어요 자주 이용할거같아요,5,8년 전
y_47_1262,전주 호텔 늘,희경이는천사,시설은 편리하게 잘되어있는 편이고 청결은 깔끔 합니다,5,5년 전
y_47_1263,전주 호텔 늘,PURPLECAFE,"시설도 나쁘지 않고 가격도 괜찮았는데, 방음이 안 되도 너무 안 됩니다. 새벽 내내 볼륨 크게 올려놓고 TV 시청하던 옆 방 손님 덕에 잠을 설쳤습니다. 그거 외에는 괜찮은 숙소입니다.",4,2년 전
y_47_1264,전주 호텔 늘,추운바다가재,방 깔끔하고 좋습니다.,5,2년 전
y_47_1265,전주 호텔 늘,레어템긋,깔끔하긴한데 시설이 너무 별로네요 다른방은 좋을지모르겟는데 일단 온수가 찬물됏다가 엄청 뜨거운물 됏다가 난리네요 씻기 너무 불편합니다 보일러 고치셔야겟어요 그리고 일회용 비품중에 없는것도 몇개잇는거같구요 그리고 무슨 방에 콘센트가 하나도 없는지 모르겟네요 기본방도 아니고 깨끗하고 좋은게 좋아서 돈 더 주고 방 햇는데 실망이네요,3,6년 전
y_47_1266,전주 호텔 늘,miaoo,전반적으로 사진과 비슷하고 컴퓨터 있는 게 좋은데 청소가 덜 되어있었어요 ㅜㅜ 전에 사용했던 사람들 흔적이 남아있어서 아쉬웠어요 컴퓨터는 배그는 좀 버벅 거려서 배그 빼고 웬만한 게임은 할 수 있을 거 같아요,4,2년 전
y_47_1267,전주 호텔 늘,PURPLECAFE,재방문 했습니다. 잘 쉬다 갑니다.,5,2년 전
y_47_1268,전주 호텔 늘,냐냐냐냐놀자,좋아요좋아요좋아요좋아요,5,1년 전
y_47_1269,전주 호텔 늘,셔틀코스,항상 이용하는데 청결하고 편안해서 좋아요~~^^,5,5년 전
y_47_1270,전주 호텔 늘,6020038,시설 좋구 친절하고요~ 컴퓨터도 빠르고 좋네요,5,6년 전
y_47_1271,전주 호텔 늘,싸*****,리뷰 좋아서 이용했습니다. 미니멀이라고 해서 작을줄 알았는데 딱 적당합니다.깔끔하고 금연이라 편안허네요 특히 메트리스 조아서 눕자마자 잠들었어요. 다음애 전주올때도 여기 와야겟어요,5,2년 전
y_47_1272,전주 호텔 늘,무등산굴,위치도 좋구도 객실도 깨끗하고 친절하시네요,5,7년 전
y_47_1273,전주 호텔 늘,궁색한버선,항상 청결하고 친절하셔서 자주 이용합니다 ㅎ,5,6년 전
y_47_1274,전주 호텔 늘,닉네임입니다요,"시설, 청결, 친절도 모두만족합니다. 방음은 그닥.. 모든모텔이 다 그럴듯^^",4,6년 전
y_47_1275,전주 호텔 늘,스물셋훼손자,깨끗하고 좋습니다 화장실도 깨끗하고 방 컨디션도 괜찮네ㅇㅕ 연박중입니다 바로앞에 편의점도 있어서 편리합니다 전주 현대차공장이랑 아침에 출근하면 25분정도 걸립니다 자주이용하겠습니다,5,1년 전
y_47_1276,전주 호텔 늘,계*****,컴퓨터 잘 돌아갑니다~~ 저번에 왔을때 좋아서 또 왔습니당. 물이 뜨거워졌다 좀 차가워졌다 그러긴 하는데 딱히 씻는데는 지장 없습니다. 창문 닫으면 소음 차단 어느정도 되고 시설은 깨끗했어요,5,2년 전
y_47_1277,전주 호텔 늘,야속한식물,주차장이 좀 좁긴 했는데 괜찮았어요 ㅡ 룸컨디션도 좋았어요 ㅡ 다음에도 전주 여행 가면 또 묵고 싶은 곳이에요 ㅡ 따뜻한 물도 완전 잘 나오고 비품도 잘 갖춰져 있어서 좋았습니다 ㅡ 만족!,5,2년 전
y_47_1278,전주 호텔 늘,방향제습,전에 갔었을때 기억이 좋았어서 다시 예약했는데 그땐 좋은 방이었던 것 같습니다. 그래도 가격대비해서는 다른 모텔들보단 훨씬 좋은 것 같아요. 무엇보다 최대장점은 모든 오티티가 된다는 거!,5,2년 전
y_47_1279,전주 호텔 늘,Baggins,대실 이용 했습니다. 굉장히 깔끔하고 청결했습니다. 만족스럽습니다 추천해요.,4,5년 전
y_47_1280,전주 호텔 늘,nanie,잘 묵고 갑니다 감사욘,5,2년 전
y_47_1281,전주 호텔 늘,방향제습,가성비도 좋고 대실시간도 길길래 한번 선택해봤는데 정말 괜찮은 숙소인 것 같습니다. 리모델링을 잘하셨는지 룸 내부가 굉장히 깔끔하고 최신식으로 보였어요. 온도도 딱적당하고 침대도 깔끔요,5,2년 전
y_47_1282,전주 호텔 늘,쪼코에몽119,언제나 방문해도 아늑하고 좋은 숙소입니다 무엇보다 침대가 쾌적하고 넓고 푹신한게 정말정말로 맘에 드네요! 다른 곳들 가보면 침대가 더럽고 불편한 것들이 워낙 많아서... 이 정도면 너무너무 만족합니다!,5,1년 전
y_47_1283,전주 호텔 늘,심약한스키니진,깨끗하고 좋아요 근처에 편의점도있고 변화가라 술집도 많고 근처에 맛집도 많아요 편히 쉬고싶어서 하루종일 방에만 있었지만 ㅋㅋ 방이 다른곳보다 작긴한데 크게 신경안쓰여서 푹자다 나왔네요,5,2년 전
y_47_1284,전주 호텔 늘,피동적인날맥주,정말 좋아요 일반 했다가 방 컨디션이 좋지않아서 변경 부탁드렸는데 업그레이드도 해주시고 정말 좋게 잘 쉬다 갑니다 뭐 하나 부족한 점이 없네요 재방문의사 있어요'!! 감사합니다~~!,5,2년 전
y_47_1285,전주 호텔 늘,젤리베어,자주 들러서 항상 편하게 쉬다가 가용! 먹을거 왕창 사들고 넷플릭스 재밋게 버다가 갖니당 넥플 웨이브 등등 여러개 다 잇어서 골라보기 너무 편하구요 사장님 너무 친절하세요 :) 자주올께용,5,2년 전
y_47_1286,전주 호텔 늘,복*****,이 근방 모텔들 중에 침대 매트리스는 이 집이 가장 좋은거 같아요 룸 인테리어나 컨디션도 가장 좋아요 그래서인지 사람들이 많이 찾는 곳입니다 한번씩 주변에 사람들 잘못걸리면 밤새 내내 시끄러워요,5,2년 전
y_47_1287,전주 호텔 늘,등황색채식주의자,주변 상권이 잘 발달되어 있어서 식사라던가 필요한 물품을 구입하기에 아주 좋습니다. 친절하시고 숙소내부도 잘 정비되어 있는 인상으로 이 지역 평균이라고 보면 되루것 같습니다. 잘 쉬고 왔습니다.,4,2년 전
y_47_1288,전주 호텔 늘,매롱롱롱,여기 진짜 깔끔하고 좋은거 같아요! 무엇보다 침구류가 정말 푹신해서 좋아요. 위치도 텔촌 제일 입구여서 좋았고요 먹자골목이랑 걸어서 2분거리인것도 정말 마음에 드네요. 좋았습니다!,5,2년 전
y_47_1289,전주 호텔 늘,반하준,가성비 대비 진짜 너무 좋은 숙소 찾은것 같아요!! 전주 살면서 여러 곳 많이 다녀봤는데 앞으로는 이 숙소만 이용할 것 같습니다. 좋은 숙소 제공해주셔서 항상 감사드리고 대박나세요~~,5,2년 전
y_47_1290,전주 호텔 늘,GC1457093542,청결하고 친절해서 너무좋아요 적극 추천~,5,7년 전
y_47_1291,전주 호텔 늘,세네갈표범,친절하시게도 업그레이드 해주셔서 넓게 편하게 쉬었습니다 티비도 엄청크고 안마기에 스위트룸이었네요 잘쉬었고 방도 따뜻하고 온수 잘나오고 편안히 조용하게 쉬다 갑니다 또 이용하겠습니다,5,2년 전
y_47_1292,전주 호텔 늘,바그다드강도,방도 아담하고 주차도 나름 편한데 수압이 좀.. 못 씻을 정도는 아니지만 편하게 씻기는 좀 힘들었네요 전체적으로 만족히지만 수압만 좀 고쳐주셨으면 하네요 .,5,2년 전
y_47_1293,전주 호텔 늘,거*****,따뜻하고 깔끔하고 좋아요!! 티비도 크고 요즘 무한대실 오래하는곳 별로 없는데 이가격에 무한대실 할수있어서 너무 좋아요ㅠㅠ 가성비최고에요 여기는 한결같았으면 좋겠어요 늘 못잃어 ㅠㅠ,5,2년 전
y_47_1294,전주 호텔 늘,야외식물원싸움,무한대실 최고..💕 자고 일어나서 넷플릭스도 보고 피로도 풀고 갑니다. 무엇보다 티비가 커서 넷플릭스보는데 너무 좋았어요. 시설도 쾌적하고 다음에 또 재방문하려구요! 번창하세요!!,5,2년 전
