id,name,nickname,review_content,rating,write_date
y_4_001,전주 투썸스테이-중화산점,DEANss,친절하시고 위치도 찾기 쉬운곳에 잇어서 오기 편했고 주차장도 넓고 쾌적해서 편안하게 사용 가능했습니다 또한 깔끔한 인테리어 및 편의장비들이 많아서 좋았고 친절한 서비스와 쾌적환 환경들이 반겨주었고 화장실 상태도 좋앗고 침대도 깨끗하고 방안 냄새도 안낫으며 티비도 컷고 불편한점은 없었어여 다음에도 전주 방문하면 꼭 들려야겠다고 생각했고 이용하면서 계속 만족하는 하루였습니다 다른이들에게도 추천 해주어야겠다고 생각했고 더욱더 번창하셧으면 하는 바람이 들엇습니다 좋은 숙소 좋은 가격입니다,4,26일 전
y_4_002,전주 투썸스테이-중화산점,능글맞은민소매,"출장 갈 때마다 자주 들르는 곳입니다. 욕실도 깨끗하고 샤워 시설도 편안했습니다. 침대도 편안하고 좋았습니다. 일회용품도 잘 준비되어 있어서 사용에 불편함이 없었습니다. 층간 소음 없이 편안하게 쉴 수 있다는 점도 좋았습니다. 다른 모텔에 비해 가격도 합리적이라 이용하기 편리했습니다. 주차 시설도 잘 갖춰져 있어서 불편함이 없었습니다. 모텔 주변에 식당, 편의점, 음료 마실 곳도 많아서 숙박하기 좋은 곳 같습니다. 객실도 깔끔하고 정돈되어 있어서 TV 시청도 편안했습니다. 다음 출장에도 자주 이용할 생각입니다.",5,1개월 전
y_4_003,전주 투썸스테이-중화산점,서켜나,"침대 위에는 고급스러운 침구가 준비되어 있습니다. 부드러운 면 소재의 시트와 포근한 이불은 몸을 감싸는 듯한 편안함을 주며, 숙면을 취할 수 있도록 도와줍니다. 또한, 베개는 다양한 높이와 경도를 선택할 수 있어, 개인의 취향에 맞게 사용할 수 있습니다. 푹신한 침대 덕분에 더욱 특별한 공간이 됩니다. 고급스러운 침구와 편안함을 더하는 디테일 덕분에, 여러분도 최고의 휴식을 경험할 수 있을 거예요. 스타일러는 출장객들에게 큰 인기를 끌고 있습니다. 스타일러는 옷을 깔끔하게 관리할 수 있는 기기로, 냄새 제거와 주름 펴기에 탁월한 성능을 자랑합니다. 제가 직접 사용해 본 결과, 스타일러는 정말 편리하고 유용한 아이템이었어요. 출장 중 입었던 옷들을 스타일러에 넣어두기만 하면 다음날 다시 상쾌하게 입을 수 있었답니다. 특히 중요한 미팅이 있는 날에는 스타일러 덕분에 깔끔한 옷차림을 유지할 수 있어서 자신감이 생겼어요. 고급 드라이기와 고데기가 비치되어 있어, 별도로 준비할 필요 없이 편리하게 사용할 수 있습니다. 드라이기는 강력한 바람과 다양한 온도 조절 기능을 제공하여 빠르고 효율적으로 머리를 말릴 수 있습니다. 고데기는 다양한 스타일링을 가능하게 해주며, 특히 중요한 모임이나 데이트를 앞두고 있는 분들에게 큰 도움이 됩니다. 샤워실은 넓고 현대적인 디자인으로 꾸며져 있습니다. 건식 화장실 구조로 되어 있어 샤워 공간과 화장실이 분리되어 있어 더욱 쾌적하게 사용할 수 있습니다. 샤워실 내부는 고급스러운 타일로 마감되어 있으며, 레인 샤워기와 핸드 샤워기가 함께 설치되어 있어 다양한 샤워 옵션을 즐길 수 있습니다. 바닥은 미끄럽지 않게 설계되어 있어 안전하게 사용할 수 있습니다.",5,2개월 전
y_4_004,전주 투썸스테이-중화산점,dlak0011,"출장 차 머무르게 된 이 모텔은 기대 이상으로 만족스러웠습니다. 프런트 직원분들이 친절하게 맞아주셔서 첫인상이 좋았고, 체크인 절차도 빠르고 간편했습니다. 객실 내부는 청결하게 관리되어 있었고 침구 상태도 양호해 숙면을 취할 수 있었습니다. 특히 욕실이 넓고 온수 수압이 일정해서 샤워하는 데 큰 불편함이 없었어요. 기본 어메니티도 잘 갖춰져 있었고 와이파이 속도도 빨라 업무를 보는 데 무리가 없었습니다. 주변에 편의점과 음식점이 가까워 식사 해결도 쉬웠습니다. 가격 대비 가성비가 좋다고 느꼈으며, 다음에 또 방문하게 된다면 재이용 의사가 충분히 있습니다. 출장뿐 아니라 가벼운 여행 시에도 추천하고 싶은 숙소입니다. 다음에 전주에 머무를 때도 참고하겠습니다. 객실은 전반적으로 조용하고 방음이 잘 되어 외부 소음에 방해받지 않고 쉴 수 있었습니다. 실내 조명도 은은해서 편안한 분위기를 만들어주었고, 테이블과 의자도 배치되어 있어 간단한 식사나 업무를 하기에도 좋았습니다.",4,6일 전
y_4_005,전주 투썸스테이-중화산점,능글맞은민소매,"출장 갈 때마다 자주 들르는 곳입니다. 욕실도 깨끗하고 샤워 시설도 편안했습니다. 침대도 편안하고 좋았습니다. 일회용품도 잘 준비되어 있어서 사용에 불편함이 없었습니다. 층간 소음 없이 편안하게 쉴 수 있다는 점도 좋았습니다. 다른 모텔에 비해 가격도 합리적이라 이용하기 편리했습니다. 주차 시설도 잘 갖춰져 있어서 불편함이 없었습니다. 모텔 주변에 식당, 편의점, 음료 마실 곳도 많아서 숙박하기 좋은 곳 같습니다. 객실도 깔끔하고 정돈되어 있어서 TV 시청도 편안했습니다. 다음 출장에도 자주 이용할 생각입니다.",4,11일 전
y_4_006,전주 투썸스테이-중화산점,입술로,"급하게 잡았는데 바로 예약되서 좋았구요 , 전주올때 편하게 묵을수 있는 숙소라서 좋아요. 주차장도 있고, 근처에 밥집이랑 편의시설,편의점 있어서 좋습니다. 터미널도 가까운편이고, 숙소앞에 편의점도 있어서 좋습니다. 무엇보다 ott다되고, 티비화면이 커서 좋습니다.방에 창문도 있고 열고 닫고 할수있어서 안 답답해서 좋습니다. 수건이랑 생수랑 드라이기랑 비치되어 있어서 편리하구요.단 샤워기가 고장났더라구요,물을 틀으면 물이 양옆으로 다튀어서 그점 불편했어요. 방안에 테이블 의자있어서 앉아서 뭐 먹기도 좋네요. 침대 매트리스가 편해서 잠도 잘 잤습니다.다음에 전주올때도 또 이용할게요.",4,1개월 전
y_4_007,전주 투썸스테이-중화산점,원칙적인스컹크,전주 여행 중 방문한 숙소 전주 투썸 스테이 중화산점을 방문하였습니다 빵도 배우도 울고갈 건편이 없으면 밤늦은 시간에 도착하였는데도 빨리해 주셔서 좋았습니다 방도 선제적으로 깔끔하고 담백 하지 않았습니다 침대도 여태까지 먹었던 숙소중에 가장 커서 좋았어요 여행 중 여행의 피로를 퓩ㄹ기위한 숟소로 좋낫어요 전주여행을 긴다면 또 방문할.의사.잇어요. 너무 만족합니다. 침대도 역대습으로 크고 편안햇어요 번채적으로 깔끔한 숙소로 재방문의사 잇습니다. 앚. 잘 쉬다급니드,5,1개월 전
y_4_008,전주 투썸스테이-중화산점,시꺼먼강상사,지방 출장 와서 잘 쉬다 갑니다.^^ 이 인근 모텔중 가장 깨끗하고 쾌적했습니다. 주차도 편하고 따듯한 물도 잘 나오고 무엇보다 사장님이 친절해서 잘 있다 갑니다. 다음 출장에도 또 이용할 것 같네요.^^ 보일러 작동으로 따뜻하고요. 이중창문이라 도로 쪽 방이라도 조용했던거 같아요. 친구 방문해도 인근에 주차공간이 많아서 주차 하기도 편하고 편의점도 바로 앞에 있고 앞에 병원 식당등 편의 시설이 가까워요. 전주 한옥 마을도 가깝고 방에 스타일러 가 있어 의류 관리하는데 도 편리하고요 다시 방문 할께요.,5,4개월 전
y_4_009,전주 투썸스테이-중화산점,노효철,"출장 갈때마다 자주 들리고 있습니다.. 화장실 깔끔하고.. 샤워 시설도 편합니다.. 침대도 편하고 좋습니다..일회용품들도 잘 준비되어있어서 이용하는데 불편함이 없습니다.. 층간 소음없이 잘 쉴수 있는점도 좋은거 같습니다.. 가격도 주위 모텔에 비해서 무난한정도라 이용하기 편합니다.. 주차 시설도 잘 되어있다보니 불편한 점은 없습니다.. 모텔 주위에 음식점이나 ,편의점, 술 한잔 할수 있는곳들도 많이 있어서 숙박하기 좋은 위치인거 같습니다.. 객실도 깔끔히 잘 정리되었고 티비 시청하기도 편하네요.. 다음 출장에도 자주 이용하도록 하겠습니다..",5,4개월 전
y_4_010,전주 투썸스테이-중화산점,1235,"The manners of the staff were excellent It was good to welcome you quickly and kindly and comfortably. The weather was very cold, but the heating was warm, so my family liked it as warm and comfortable as home. The view was beautiful, and the bedding and other facilities were clean and I liked it. It became a satisfying trip in every way. There's nothing I don't like Thank you.",5,1개월 전
y_4_011,전주 투썸스테이-중화산점,데이브81,전주 중화산동에 가성비 갑인 숙소를 추천합니다! 일단 교통편이 좋습니다! 전주역이나 고속버스 터미널에서 다 가까운 편입니다! 그리고 주변에 맛집도 많이 있습니다! 침대 컨디션도 좋아서 편하게 쉴 수 있습니다! 그리고 스타일러는 큰 장점 같습니다. 전주 오면 여러 맛집을 다니다 보면 냄새가 옷에 배이는 경우가 있는데 다음 날 깔끔하게 해결 할 수 있습니다! 전주 오시면 가성비 갑인 숙소를 추천합니다. 인테리어도 깔끔해서 편하게 쉴 수 있습니다. 전주오시는 분들에게 추천합니다!,5,3개월 전
y_4_012,전주 투썸스테이-중화산점,영롱한약초,"좋았던 점은 슬리퍼가 일회용이 아니라 정전기도 안 나고 쿠션감도 있어서 편하게 신을 수 있었던 거랑 세면대나 샤워기 수압은 괜찮았어요. 아쉬웠던 건 세면대가 욕실이 아니라 방 안에 있어서 당황했고, 그래서 그런지 비누도 제공되지 않아 따로 일회용 비누를 사야 했어요. 수전이 너무 뻑뻑해서 물 틀 때 힘들었고요. 또 세면대가 방 안에 있으니까 세수할 때 물이 바닥에 튀어서 수건 한 장은 바닥에 깔아야 했고, 그래서 2인 이상이면 수건이 모자랄 수도 있겠다는 생각이 들었어요. 화장실 휴지통엔 위생백이 없어서 방 안 휴지통에 들어있던 여분 위생백을 꺼내 씌워뒀는데, 처음부터 씌워져 있었으면 더 좋았을 것 같아요. (체크인 시 청소가 끝난지 얼마 되지 않아 욕실이 젖어있을 수 있다고 하셨는데, 욕실 휴지통도 젖어있어서 그러셨는진 모르겠지만요.) 제가 더위를 잘 타서 처음엔 온도를 낮춰서 공기를 시원하게 해두고 온도를 높여두는 편인데 에어컨 희망 온도를 23도로 해놔도 방 안은 계속 26도 정도로 유지돼서 잘 작동하는 건지 모르겠더라고요. 온도 말고는 조절할 수 있는게 없더라구요.리모컨에 있는 버튼도 눌러봤는데 안되더라구요. 그리고 체크아웃할 때 보니 20도 이하로는 설정이 안 되는 것 같았어요. 가장 불편했던 건 침구 위생 상태였어요. 침대 커버와 베개, 이불 커버 안쪽에 여러 얼룩이 보여서 그냥 이불 위에 누워서 잤어요. 체크인하고 바로 외출했다가 늦게 돌아와서 방 바꾸기도 애매했고, 혼자라 전화로 요청하는 것도 좀 껄끄러웠어요.",3,1개월 전
y_4_013,전주 투썸스테이-중화산점,아빠는맨날출장중,"한달에 일주일 이상 출장러인데, 이번 주말은 와이프랑 함께 여행삼아 겸사겸사 출장... 그래서 검색하던중 투썸 스테이 중화산점 발견!! 거래처도 가깝고, 리뷰도 좋고 해서 예약!! 도착해서보니 아무래도 좀더 좋은방이 좋을것 같아 프런트에 부탁 드렸더니 (아주 조금 더 계산하고) 좋은방으로 업그레이드 받았습니다.. 안마의자, 스타일러, 75인치 TV, 포근한 침대... 호텔 부럽지 않았네요.. 대박 👍 (간만에 꿀잠 잤네요.. ^^) 주차도 해주시고 너무 친절하셨습니다!! 다음 출장때도 방문하려구요.. 투썸 스테이 중화산점 롱런하세요 ~ 🙆‍♂️",5,1년 전
y_4_014,전주 투썸스테이-중화산점,감동적이고유머러스한아바타,"디즈니플러스 큰 티비로 보고싶어서 해당 오티티 되는 대로 찾다보니 나온 숙소인데, 올해 리뉴얼 했다고해서 기대하고 갔었습니다 !! 기대만큼 깔끔한 인테리어에 티비도 크고 디플도 잘 보고 잘 쉬다 나왔네요!! 조금 아쉬운건 뜨거운물이 잘 안나오고, 비누가 없었어요.. ㅠㅠ 그거 빼고는 전부 맘에 들어서 재방문 의사 있습니다!! 매트리스도 엄청 딱딱하지도않고 물컹하지도 않고 편하게 잘 수 있었어요 ㅎㅎㅎ 온수만 조금 손 봐주시면 더더 좋을 것 같습니다~~ 사장님도 친절하셨고 주차도 넉넉해여",5,6개월 전
y_4_015,전주 투썸스테이-중화산점,적절한부대장,침대가 푹신 푹신 좋아요,5,5일 전
y_4_016,전주 투썸스테이-중화산점,바쁜레몬,"화산체육관 근처에 있어서 낮에 배드민턴치고 씻으러 체크인했어요. 걸어서 10분 정도 거리에 있어서 아주 좋았습니다. 17:00에 입실했는데 화장실 청소 금방 하신 것 같더라구요. 청소상태 좋았구 침구도 깔끔했습니다. 티비 완전 큰거 있구요. 좋은건지 끊김현상이나 딜레이현상 없었습니다. 화질이 엄청 좋았어요. 방 넓구 테이블 의자 있고, 재방문 의사 있습니다. 화산체육관 근처에 있어서 낮에 배드민턴치고 씻으러 체크인했어요. 걸어서 10분 정도 거리에 있어서 아주 좋았습니다. 17:00에 입실했는데 화장실 청소 금방 하신 것 같더라구요. 청소상태 좋았구 침구도 깔끔했습니다. 티비 완전 큰거 있구요. 좋은건지 끊김현상이나 딜레이현상 없었습니다. 화질이 엄청 좋았어요. 방 넓구 테이블 의자 있고, 재방문 의사 있습니다.",5,9개월 전
y_4_017,전주 투썸스테이-중화산점,데이브81,전주에 가면 자주 이용하는 호텔입니다! 일단 인테리어가 깨끗합니다! 침대도 좋은 컨디션을 가지고 있습니다! 침대가 넓어서 편하게 쉴수 있습니다! 주변에 맛집도 많이 있어서 좋습니다! 로비에 커피도 맛집입니다! 그리고 전주역과 전주 고속버스 터미널에가 가까운 거리에 있어서 전주 방문시 가성비 좋은 호텔입니다! 한옥마을도 가까운 편에 속해서 택시 타고 쉽게 이용 할 수 있습니다! 혹시 전주에 놀러 오실 계획이 있으시면 적극 가성비 갑인 숙소 추천합니다!^^ 진짜 좋습니다!^^,5,3개월 전
y_4_018,전주 투썸스테이-중화산점,마음만20대,객실이전체적으로 깔금하고침구류정돈이잘돼있습니다 주변에 먹을거리도많고 마실것도많이 있어서 좋았습니다 사장님이 친절하시고 부담없고 좋았습니다 객실이전체적으로 깔금하고침구류정돈이잘돼있습니다 주변에 먹을거리도많고 마실것도많이 있어서 좋았습니다 사장님이 친절하시고 부담없고 좋았습니다 객실이전체적으로 깔금하고침구류정돈이잘돼있습니다 주변에 먹을거리도많고 마실것도많이 있어서 좋았습니다 사장님이 친절하시고 부담없고 좋았습니다ㅎㅎ,4,6개월 전
y_4_019,전주 투썸스테이-중화산점,남다르고푸른금반지,가격이 저령한만큼 냉장고안 음료(딱물1병) 참고하세요,5,19일 전
y_4_020,전주 투썸스테이-중화산점,데이브81,"집이 내무좋아요,ㅣㅣㅣ",5,1개월 전
y_4_021,전주 투썸스테이-중화산점,요하는300km장거리중,"여름휴가차 첫방문했고 2틀 연박했습니다. 위치,가격,큰TV,넷플릭스,스타일러 비치 여부를 두고 예약했는데 모든 조건에 부합하여 예약하게 됐습니다. 조식 무료 서비스는 없지만 연박비 없어서 감동이였어요♡주변에 아침 식사 가능한 곰탕집 맛집 있어서 먹었습니다. 입실후 넷플릭스가 잘안되서 애먹다가 카운터에 문의 드렸는데 남자사장님이 도와주셔서 2틀 문제없이 잘이용했어요. TV커서 올림픽 볼맛도 나고 여행중이라 옷관리 필수인데 스타일러 있어서 관리도 잘했네요. 도보 가능한 전주맛집 삼계탕집도 다녀오고 편의점도 주변에 있고 접근성 꿀이었습니다. 전주에서 여름휴가 2틀 잘쉬고 왔고 다음번에도 재방문 의사 있어요♡",5,10개월 전
y_4_022,전주 투썸스테이-중화산점,소리보미,이제 겨울이 시작되는 12월이 시작된지도 버ᄂᆞ써 3일이되었네요. 그만큼 우리도 더 늙어간다는것이지요. 오늘도 전북삼례에서 일과를 마치고 어김없이 여기어때 어플로 오늘밤 숙소를 정했습니다 여기어때 어플을 단골로 이용하는것은 다른 싸이트보다 할인쿠폰이 많다는 것입니다.가성비높은 모텔을 찾아서 전주중화산동에 소재한 투썸스테이 모텔로 정했습니다. 수건도 냄새나지않고 깨끗하고 내부시설도 깨끗하며 하얀바탕에 티크색 시트지 판넬로 장식하여 온화한 느낌입니다. 주변에 식당도 많아 취사선택하면 됩니다.,5,7개월 전
y_4_023,전주 투썸스테이-중화산점,진지하고남다른빗,"전주에서 머물렀던 호텔은 정말 만족스러웠습니다. 시설이 현대적이고 깨끗하며, 객실에서 느끼는 편안함이 뛰어났습니다. 특히, 욕실의 수압이 좋아 샤워할 때 매우 기분이 좋았습니다. 호텔 직원들은 친절하고 전문적이어서 언제나 도움을 요청하기 편했습니다. 체크인 과정도 신속하게 진행되어 좋았습니다. 교통도 매우 편리해 주변 관광지로 쉽게 이동할 수 있었습니다. 전주 한옥마을과 가까워 관광하기에 안성맞춤이었습니다. 전주에서 편안한 숙박을 원하신다면 이 호텔을 강력히 추천합니다.",4,9개월 전
y_4_024,전주 투썸스테이-중화산점,진솔되고문학적인퇴출,에어컨에서 물이 떨어져서 불편했어요.,4,1개월 전
y_4_025,전주 투썸스테이-중화산점,진지하고남다른빗,"객실이 넓고 깔끔하게 정돈되어 있었고, 침구도 포근하고 쾌적해서 휴식하기에 딱 좋았어요. 위치도 전주 한옥마을과 가깝고, 전주에서 묵었던 호텔은 방이 넓고 깨끗하게 관리되어 있어 정말 편안하게 지낼 수 있었습니다. 침구도 포근하고 쾌적해서 휴식하기에 딱 좋았어요. 인테리어도 깔끔하고 정갈한 느낌이라 머무는 동안 기분이 좋았습니다. 위치 또한 주요 관광지와 가까워 이동이 편리했어요. 큰 전반적으로 만족스러운 숙박 경험이었습니다. 다음에도 전주를 방문한다면 다시 이용하고 싶을 만큼 추천드릴 만한 곳이에요.",5,6개월 전
y_4_026,전주 투썸스테이-중화산점,미휘,전주 여행을 갑자기 오게 되어 급하게 잡았어요. 우선 전주한옥마을쪽을 둘러보고 점심도 먹고 쉬다가 3시 40분 정도에 너무 더워서 체크인 하러 갔어요. 조금 일찍 갔는데도 입실하게 해주셔서 감사했구요. 에어컨도 잘 나오고 룸 컨디션이 좋았어요. 주변에. 맛집도 많아서 저녁에는 백반 먹고 아침에는 콩나물국밥도 먹었네요. 체크아웃하고 나서 덕진공원쪽도 둘러보고 나름대로 더웠지만 즐거웠던 전주여행이었네요. 숙소도 불편함이 없어서 다음에 전주 오면 다시 이용하고 싶네요.,4,11개월 전
y_4_027,전주 투썸스테이-중화산점,시꺼먼강상사,지방 출장 와서 잘 쉬다 갑니다.^^ 이 인근 모텔중 가장 깨끗하고 쾌적했습니다. 주차도 편하고 따듯한 물도 잘 나오고 무엇보다 사장님이 친절해서 잘 있다 갑니다. 다음 출장에도 또 이용할 것 같네요.^^ 보일러 작동으로 따뜻하고요. 이중창문이라 도로 쪽 방이라도 조용했던거 같아요. 친구 방문해도 인근에 주차공간이 많아서 주차 하기도 편하고 편의점도 바로 앞에 있고 앞에 병원 식당등 편의 시설이 가까워요. 전주 한옥 마을도 가깝고 방에 스타일러 가 있어 의류 관리하는데 도 편리하고요 다시 방문 할께요.,5,7개월 전
y_4_028,전주 투썸스테이-중화산점,시꺼먼강상사,지방 출장 와서 잘 쉬다 갑니다.^^ 이 인근 모텔중 가장 깨끗하고 쾌적했습니다. 주차도 편하고 따듯한 물도 잘 나오고 무엇보다 사장님이 친절해서 잘 있다 갑니다. 다음 출장에도 또 이용할 것 같네요.^^ 보일러 작동으로 따뜻하고요. 이중창문이라 도로 쪽 방이라도 조용했던거 같아요. 친구 방문해도 인근에 주차공간이 많아서 주차 하기도 편하고 편의점도 바로 앞에 있고 앞에 병원 식당등 편의 시설이 가까워요. 전주 한옥 마을도 가깝고 방에 스타일러 가 있어 의류 관리하는데 도 편리하고요 다시 방문 할께요.,5,7개월 전
y_4_029,전주 투썸스테이-중화산점,시꺼먼강상사,지방 출장 와서 잘 쉬다 갑니다.^^ 이 인근 모텔중 가장 깨끗하고 쾌적했습니다. 주차도 편하고 따듯한 물도 잘 나오고 무엇보다 사장님이 친절해서 잘 있다 갑니다. 다음 출장에도 또 이용할 것 같네요.^^ 보일러 작동으로 따뜻하고요. 이중창문이라 도로 쪽 방이라도 조용했던거 같아요. 친구 방문해도 인근에 주차공간이 많아서 주차 하기도 편하고 편의점도 바로 앞에 있고 앞에 병원 식당등 편의 시설이 가까워요. 전주 한옥 마을도 가깝고 방에 스타일러 가 있어 의류 관리하는데 도 편리하고요 다시 방문 할께요.,5,7개월 전
y_4_030,전주 투썸스테이-중화산점,소소한하루12,가성비 좋습니다. 리모델링으로 시설도 깨끗하고 편히 쉬다 갑니다.,5,1개월 전
y_4_031,전주 투썸스테이-중화산점,jshcokr,가격대비 시설 청결 친절 괜찮아요,5,2개월 전
y_4_032,전주 투썸스테이-중화산점,라쥬야,티비 엄청 크고 스타일러까지 있어서 출장온 입장에서 매우 만족,5,1개월 전
y_4_033,전주 투썸스테이-중화산점,초초콩,침대 너무 편해요!!! 정말 뒤척임 없이 푹 자요👍🏻,5,2개월 전
y_4_034,전주 투썸스테이-중화산점,10565884,깔끔한 시설과 사장님의 친철함 감사합니다,5,2개월 전
y_4_035,전주 투썸스테이-중화산점,Mr휘,항상 이용하는 곳 입니다. 깔끔하고 응대도 친절하고 좋습니다.,5,1개월 전
y_4_036,전주 투썸스테이-중화산점,온화하고독특한단무지,푹쉬었어요!!!! 숙소가 참 푹쉬었어요!!!! 숙소가 참 좋아요!!!! 편하게 쉬었습니다!!!! 창문 닫으면 조용해요!!! 주위에 유흥주점이 있어서 시끄러울것 같지만 창문닫으면 조용해요!!! 친절해요!!! 친절하십니다!!! 침대가 편해요!!! 잠자리가 편합니다!!! 푹쉬었어요!!!! 숙소가 참 푹쉬었어요!!!! 숙소가 참 좋아요!!!! 편하게 쉬었습니다!!!! 다음에도 이용할게요ㅎㅎ 편하게 쉬다 갑니다 편하게 쉬다 갑니다!!!!,5,6개월 전
y_4_037,전주 투썸스테이-중화산점,유머러스하고완고한해적단,깨끗하고 죻습니다..,5,1개월 전
y_4_038,전주 투썸스테이-중화산점,데이브81,출장으로 전주에 방문하면 좀 더 있어야 할 때가 있습니다! 그럴 때 숙박을 한 이후에 대실을 이용해서 좀 더 쉴수 있습니다! 미리 이야기를 하시면 프론트에서 알아서 대처를 해주시고 예약자 이름이 같은 경우에는 그냥 처리해주시는 경우도 있었습니다! 그리고 9시부터 배달어플을 이용해서 간단한 해장도 가능합니다! 그리고 숙소마다 스타일러가 있어서 전날 혹시 고기집에 방문했을 지라도 괜찮습니다! 숙소는 청결하고 최근에 리모델링을 해서 룸 컨디션도 매우 좋습니다! 숙소로 추천합니다!^^,4,10개월 전
y_4_039,전주 투썸스테이-중화산점,진지하고남다른빗,"전주에서의 숙박 경험은 매우 만족스러웠습니다. 호텔의 시설은 현대적이며 잘 관리되어 있었고, 객실은 깨끗하고 아늑했습니다. 무엇보다 욕실의 수압이 뛰어나 샤워가 매우 쾌적했습니다. 직원들은 친절하고 전문적이었으며, 필요한 도움을 즉각 제공해 주었습니다. 체크인 과정도 원활하게 진행되어 기분 좋게 시작할 수 있었습니다. 교통도 편리해 주변 관광지로의 접근이 용이했습니다. 전주 한옥마을까지 가까워 sightseeing에도 좋았습니다. 종합적으로, 전주에서 편안하게 머물고 싶다면 이 호텔을 적극 추천합니다.",4,8개월 전
