id,name,nickname,review_content,rating,write_date
y_73_218,전주 루이호텔,막강한올빼미1,"너무 깨끗하고 만족스러웠습니다. 다음에도 재방문 의사 있으며,주변 지인들과 회사 동료에게도 추천할께요~ 또한 사장님도 친절하시어,너무 편안하게 하루 푹 쉬었다가 갑니다~번창하세요~응원합니다.",5,1년 전
y_73_219,전주 루이호텔,적극적이고밝은해바라기색,평일 기준 가격도 저렴하고 대체적으로 깔끔하고 화장실도 깨끗한편이라 잘 이용했습니다^^ 카운터 직원분도 친절하시구 생각보다 주변 소음도 잘 안들려서 잘쉬었습니당 ~~~~~~~~~~~,4,2년 전
y_73_220,전주 루이호텔,꽁꼼이,깔끔하고 침대가 참 편안하네요. 넷플리스는 내것을 이용해야합니다. 자주 이용하려구요 추천합니다. 추천합니다.추천합니다 추천합니다 추천합니다 추천합니다 추천합니다 추천합니다,5,3년 전
y_73_221,전주 루이호텔,디트로이트,방도 깨끗하고 화장실 물도 잘 나와서 넘 좋았네요 그리고 무엇보다 사장님께서 친절하셔서 더 좋았습니다. 나중에 전주에 또 가게된다면 재방문 하고 싶네요. 너무편하게 잘쉬다갑니다^^ ㅎㅎ,5,3년 전
y_73_222,전주 루이호텔,RickyJANG,숙소는 깔끔하고 쉬는데 불편함 없어요,4,1년 전
y_73_223,전주 루이호텔,희파토이동생,전주에 일이 있어서 처음 묵었는데 사장님이 주차도 직접 해주시고 그리고 방은 정말 깨끗하고 시설이 좋네요. 다음에 전주 오면 묵을 생각이 있습니다,4,1년 전
y_73_224,전주 루이호텔,회청색광학병기,깨끗하고 너무 좋았어요 침대도 푹신하고 전주한옥마을하고도 가까워서 너무 좋았습니다 다음에 또 놀러갈때 이용할께요,5,1년 전
y_73_225,전주 루이호텔,가죽색인생,저렴한 가격에 잘 쉬다 가요! 깨끗하고 좋은 냄새 났어요,4,3년 전
y_73_226,전주 루이호텔,노효철,1. 깨끗하고 아주 좋아요ㅎㅎㅎ깨끗하고 아주 좋아요ㅎㅎㅎ깨끗하고 아주 좋아요ㅎㅎㅎ깨끗하고 아주 좋아요ㅎㅎㅎ 깨끗하고 아주 좋아요ㅎㅎㅎ깨끗하고 아주 좋아요ㅎㅎㅎ깨끗하고 아주 좋아요ㅎㅎㅎ깨끗하고 아주 좋아요ㅎㅎㅎ 깨끗하고 아주 좋아요ㅎㅎㅎ깨끗하고 아주 좋아요ㅎㅎㅎ 굿~ 2. 스타일러 좋아요.. 3. 또 방문할께요,5,3년 전
y_73_227,전주 루이호텔,해파리123,흠냐리 일단 처음에 배정받은 방은 제가 비흡연자라 그런지 담배냄새가 심했어요 그래서 말씀드렸더니 방 옮겨주셔서 다행히 괜찮았구요 항상 환기 시키는데 사람들이 피면 냄새가 올라온다구 그러시더라구요.. 친절하신편이었고 방도 괜찮았습니다 근데 퀄리티가 엄청 좋거나 그러진 않아서 그냥 딱하루 잠깐 자기에 괜찮았던것같아요 그래도 가끔 샤워가운에서 냄새나는경우도 있는데 침구나 이런부분에 있어서는 청결했어요 만족했습니다 흠냐리 일단 처음에 배정받은 방은 제가 비흡연자라 그런지 담배냄새가 심했어요 그래서 말씀드렸더니 방 옮겨주셔서 다행히 괜찮았구요 항상 환기 시키는데 사람들이 피면 냄새가 올라온다구 그러시더라구요.. 친절하신편이었고 방도 괜찮았습니다 근데 퀄리티가 엄청 좋거나 그러진 않아서 그냥 딱하루 잠깐 자기에 괜찮았던것같아요 그래도 가끔 샤워가운에서 냄새나는경우도 있는데 침구나 이런부분에 있어서는 청결했어요 만족했습니다 흠냐리 일단 처음에 배정받은 방은 제가 비흡연자라 그런지 담배냄새가 심했어요 그래서 말씀드렸더니 방 옮겨주셔서 다행히 괜찮았구요 항상 환기 시키는데 사람들이 피면 냄새가 올라온다구 그러시더라구요.. 친절하신편이었고 방도 괜찮았습니다 근데 퀄리티가 엄청 좋거나 그러진 않아서 그냥 딱하루 잠깐 자기에 괜찮았던것같아요 그래도 가끔 샤워가운에서 냄새나는경우도 있는데 침구나 이런부분에 있어서는 청결했어요 만족했습니다,3,1년 전
y_73_228,전주 루이호텔,완전무결,방도 깨끗하고 침대 매트리스가 정말 좋았어요. 메모리폼인거 같고 잠도 푹 잤어요. 담에 가게 되면 또 이용할겁니다.,5,1년 전
y_73_229,전주 루이호텔,낭낭하게냥펀치,편안하게 잘 쉬었다 갑니다.,5,1년 전
y_73_230,전주 루이호텔,JINJINS,많이 기대안하고 갔는데 생각했던것보다 훨씬 깨끗하고 조용하고 좋았습니다~ 대타올은 없었지만 타올상태도 너무 낡지도 않았고 냄새도 안났고 좋았어요 잘 사용하고 갑니다~,5,3년 전
y_73_231,전주 루이호텔,진솔홀딩스,처음가보는 곳이었는데 자동차키는 맡기고 들어가면되는곳이고 일층에 아이스크림주시는데 더운때 기분좋네요 방에서 푹쉬기좋고 스타일러도있어 옷보관도 좋습니다 주변에 식당도 금방이고 편하게 잘 쉬고왔습니다,5,1년 전
y_73_232,전주 루이호텔,탄탄대로로,"전주시 완산구에 저렴한비용에 숙박이용할수있었네요. 무엇보다도 내.외부 리모델링하셨는지 시설이 정말 호텔급이었습니다. 깔끔하고 너무 청결했고,가까이에 편의점.한옥마을.전주천이 있었고,주변맛집들 너무좋았습니다. 다시예약해서 숙박예정입니다~~~",5,2년 전
y_73_233,전주 루이호텔,RickyJANG,출장왔는데 여기 자주 이용할게요! 따뜻하고 좋았어요,4,1년 전
y_73_234,전주 루이호텔,뿌*****,"사장님께서 친절하셨고, 객실도 청결했습니다. 비품 부족한 것 없었고, 빗이 일회용이라 좋았어요. 또, 침대가 적당히 딱딱하고 푹신해서 편하게 잤습니다. 덕분에 푹 자고 푹 쉬고 갑니다. 다음에 또 방문할게요!",5,2년 전
y_73_235,전주 루이호텔,독고다이3,깔끔하고 조용한객실/침구도 굿,5,1년 전
y_73_236,전주 루이호텔,용마폭포공원혁명군,시설이 좋고 깨끗합니다. 재방문 할게요.,5,1년 전
y_73_237,전주 루이호텔,요기어때님,출장 와서 우연찮게 묶게 됬는데 깔끔하고 괜찮았습니다. 욕실 수압도 좋고 침구류도 냄새안나고 깔끔했어요. 넷플릭스 시청도 가능해서 심심하지 않게 짧은 시간이지만 하루 푹 쉴수 있었습니다.,5,2년 전
y_73_238,전주 루이호텔,감*****,사장님 친절하시고 티비가 엄청 커서 대실 추가해서 영화봤는데 좋았어요ㅎㅎ 깨끗하거나 밝은 분위기는 아니지만 다음에 또 이용할 거 같아요 가격면에서 매력있는 곳 같습니다 건강하새요 사장님,4,1년 전
y_73_239,전주 루이호텔,아랄라라,사장님이 너무 친절해서 좋았습니다!! 방도 깨끗하고 중문읎는게 살짝 아쉽지만 객실이 너무 청결해서 좋았습니다!! 방은 따뜻하지만 침대는 살짝 추운거같아요 ㅠㅠ 그것 빼고는 완전 만족했습니다,5,2년 전
y_73_240,전주 루이호텔,김석환20,이 동네 모텔이 정말 많아요. 다른 곳도 많이 이용해봤지만 주차 발렛도 너무좋고 카운터 음료도 좋고 우선 방 깨끗하고 가격도 저렴하니 가성비 좋습니다. 또 이용할께요 읽어주셔서 감사합니다^^...,5,2년 전
y_73_241,전주 루이호텔,기념공원식비,조용하고 아늑한 참 기분 좋은 모텔,5,2년 전
y_73_242,전주 루이호텔,충무교동안,일단 급하게 가게 됐지만 청결상태는 양호하고 주차장은 비좁아서 차키를 맡기면 다른곳에 주차하고 퇴실때쯤 원상복귀되는거같네요 퀘퀘한 냄새도 없고 가성비로도 괜찮다고 생각되는 숙소에요 굿,5,2년 전
y_73_243,전주 루이호텔,스피나,"소음이 살짝 있는편이지만 프론트 사장님,직원분들 모두 굉장히 친절하시네요 주차도 편한곳에 알아서 해주시고 감사했습니다 방컨디션도 나쁘지 않은편이었어요 수압도 쎈 편이고 재방문의사 있습니다",5,2년 전
y_73_244,전주 루이호텔,기념공원식비,가성비 대비 너무 좋은 모텔,4,3년 전
y_73_245,전주 루이호텔,16119961,깨끗하고 담배냄새도 안나고 좋은냄새 나서 좋았어요 ! 근데 씻으면서 온수가 너무 불편하게 나왔어요 ㅠㅠ 따뜻한 쪽으로 하면 너무 뜨겁고 중간으로 해도 너무 차갑고.. 중간이 없어서 불편했네요 ㅠㅠ..,4,3년 전
y_73_246,전주 루이호텔,남다르고편한암청색,여자친구랑 같이 가봤는데 ㅎㅎㅎㅎㅎ 방도 너무 깔뜸하고 맘에 드러ㅛ저눙거 같아요 ㅎㅎㅎㅎ 다음에 또 방문할게요 편하게 잘쉬다가 가겧습니닿ㅎㅎㅎㅎ 요즘 날씨가 많이 푸운데 감기조시뫄세여,5,3년 전
y_73_247,전주 루이호텔,아흔한살별명,또 방문할개요~ 따숩게 잘잣어요!,5,3년 전
y_73_248,전주 루이호텔,현빈영심,인테리어 자체는 그냥 무난하고 실내가 정말 무진장 따뜻했습니다.,3,1년 전
y_73_249,전주 루이호텔,기념공원식비,매우 좋고 가성비 짱 ㅎㅎㅎㅎ,5,1년 전
y_73_250,전주 루이호텔,아랄라라,건물이 엄청 새거같아요! 사장님도 친절하시고 방 내부도 너무 좋아요 맘에 들어용!! 가격도 괜찮고 편히 잘 쉬었습니다 다만 아쉬운점은 리모컨이 잘 안눌리는거 같아요 ㅠㅠ 그거빼고 다 너무 좋았습니다!,5,2년 전
y_73_251,전주 루이호텔,낭낭하게냥펀치,냄새안나고 깨끗합니다. 인테리어도 깔끔하고 물 수압도 좋고 잘 쉬다갑니다.,5,2년 전
y_73_252,전주 루이호텔,짱짱한산국화,여긴 정말 깔끔하고 안락하고 너무좋아요!! 그리고 스타일러도 너무 깔끔하게 관리 잘되있어서 쓰기에도 너무너무 좋습니다 ㅎㅎ 단골하고싶어요 ㅎㅎ 다음에도 전주오면 무조건 여기 올겁니다 ㅎㅎ,5,4년 전
y_73_253,전주 루이호텔,향기로핀,잘쉬다갑니다 잘쉬다갑니다,5,2년 전
y_73_254,전주 루이호텔,마흔넷봉선화연정,시설도 좋아서 불편함 없고 객실도 깨끗합니다. 사장님 친절하시고 가성비가 너무 좋아요. 주변에 맛집도 많아서 식사하기도 괜찮아요! 여러면에서 만족도가 제일 좋았습니다. 잘 쉬다 갑니다. 다음에도 또 올께요~^^b,5,1년 전
y_73_255,전주 루이호텔,발랄한즙,처음 이용해보는데 가격도 저렴하고 좋습니다!,5,1년 전
y_73_256,전주 루이호텔,말캉말캉한습지식물,사장님이 친절하셨고 객실도 나쁘지 않았어요. 넓은 편은 아닌데 하룻밤 묵기 괜찮았어요. 적당히 괜찮은 모텔이에요. 다음에 또 와서 좋은 추억 쌓고 가겠습니다! 가성비도 좋고 다른 친구들이랑 많이 올게용!,4,2년 전
y_73_257,전주 루이호텔,내가다다,프런트 사장님 친절하시고 객실 컨디션도 좋네요. 사진에 비해 방크기가 조금 아쉬움이 있었지만 하루 푹 잘쉬었네요 ........................... ............,5,3년 전
y_73_258,전주 루이호텔,강렬하고밝은고양,매트리스에 얼룩이 조금 있었지만 나머지는 깔끔했던거같아요. 대체적으로 만족합니다매트리스에 얼룩이 조금 있었지만 나머지는 깔끔했던거같아요. 대체적으로 만족합니다매트리스에 얼룩이 조금 있었지만 나머지는 깔끔했던거같아요. 대체적으로 만족합니다,4,1년 전
y_73_259,전주 루이호텔,통일전망대중계,항상 깔끔하고 좋아요,5,2년 전
y_73_260,전주 루이호텔,빛나는진솔된,리뷰보고 예약잡은건데 괜찮은 곳이예요ㅎ,5,1년 전
y_73_261,전주 루이호텔,록담부장,위치가 큰길가에서 근접해서 찾기가 편하고 좋았습니다~ 난방은 전기장판이 따로 없고 그냥 바닥이 데워지는 시스템이어서 곰방 따뜻해지지는 않는게 조끔 아쉽더라구요! 수압은 따봉으로 쎄고 금방 뜨거운 물이 나와서 좋았어요~ 하루 잘 쉬었다가 갑니다,5,2년 전
y_73_262,전주 루이호텔,온순한엉터리,도로변에 있어서 찾기는 쉬워요. 주차장 두군데 있지만 자리가 그렇게 여유롭지는 않네요. 방은 아담하지만 청소는 잘되어있는거 같네요. 화장실 수압도 좋고 온수도 잘나오네요. 대체로 만족해요.,4,2년 전
y_73_263,전주 루이호텔,통일전망대중계,편안하고 사장님이 친절해요,5,1년 전
y_73_264,전주 루이호텔,여기어때월150,전주 에서 제일가는 가성비 숙소에요 주차장 좋고 한적하고 조용하고 창문열고자면 시골쪽니라 그런가 시원하고 공기좋아요 가성비 쌉상타지! 이용하세요 다 들 ...,5,2년 전
y_73_265,전주 루이호텔,출장만21년째,깨끗하고 좋아요 ㅎㅎ,5,3년 전
y_73_266,전주 루이호텔,내가다다,주차시설 협소 하지만 발렛 잘도와주네요 프런트 직원 분들도 아주 친절 하고 객실도 깨끗하게 잘정돈 되어있고 공기청정기등 잘구비 되어 있어 디만 방이 좀 추운기운이 아주 만족스럽게 푹 잘쉬었습니다.,4,2년 전
y_73_267,전주 루이호텔,별자리운세,좋아요 친절하시고 너무좋아요^^,5,1년 전
y_73_268,전주 루이호텔,혱닝잉,전주에 일찍 도착하여 차를 놓고가고 싶어 사장님께 물어봤더니 흔쾌히 된다고 해주셔서 차 놓고 재밌게 놀았네요. 숙소도 괜찮구 특히 화장실 정말 깨끗하고 좋았어요,4,1년 전
y_73_269,전주 루이호텔,본질적인반추,시설 생각보다 깔끔하고 나쁘지 않아요 넷필릭스도 잘나와요~ 아쉬운점은 물조절이 어렵네요~ 엄청 차갑거나 엄청 뜨겁거나 하네요~ 그점 빼고는 만족스러워요!!!!! 다음에도 이용할게요~,5,3년 전
y_73_270,전주 루이호텔,미천한쇄골,중화산동에 있는 모텔치고는 아주 마음에 들었습니다 평일이라 가격도 저렴했고 사장님이 친절했습니다. 샤워실에 있는 바디로션과 샴푸 린스도 맘에들었고 고대기와 롤빗도 빌려주니 참고하세용,4,2년 전
y_73_271,전주 루이호텔,해바라기랑코스모스,봄햇살 만끽하며 구례 산수유꽃 구경후 집으로 올라가는길에 급히찾은 숙소가 바로 여기. 리뷰도 괜찮았지만 그래도 혹시나 하는맘에 반신반의하며 예약했는데 깔끔하고 깨끗한게 정말 좋았네요. 근처 가까운곳에 맛집도 있어 멀리 안나가고 저녁식사까지 해결. 당일입었던 옷은 스타일러에 맏겨두니 살균소독까지 해주고.. 기회되면 재 방문의사 100%~!! 사장님 덕분에 잘 쉬고 갑니다.,5,2년 전
y_73_272,전주 루이호텔,1234년,방은 나름대로 깨끗한 편입니다. 이불이나 다른 용품들도 깔끔한 편이구요. 주차장이 넓어서 주차하기 편합니다. 화장실도 깨끗한 편입니다. 다만 방이 조금 좁고 조금 소음이 있습니다.,4,2년 전
y_73_273,전주 루이호텔,짠아프간하운드,깔끔해요 티비도커서 볼만햇고 방 완전따뜻해서좋앗어요,5,1년 전
y_73_274,전주 루이호텔,용시임,전반적으로 깨끗하고 좋습니다~,4,1년 전
y_73_275,전주 루이호텔,5천원할인,깨끗하고 사장님도친절하세요 편안히쉬다가요,5,1년 전
y_73_276,전주 루이호텔,낭낭하게냥펀치,잘 쉬었다 갑니다.~,5,1년 전
y_73_277,전주 루이호텔,고먐미이미,종종 갔었는데 여자 사장님?이 너무 불친절해서 다신 안가려구요 넷플릭스도 안되는데 대화하면 기분이 나빠서 그냥 안봤습니다 물은 잘나오는데 차갑거나 뜨겁거나 물조절이 좀 그냥 응대가 불편하니까 다 불편하네요,0,2년 전
y_73_278,전주 루이호텔,여행가곺다리,깔끔하고 좋았어요~~,5,1년 전
y_73_279,전주 루이호텔,13380721,10월에 가보고 오랜만에 방문해서 숙박하였는데 너무 좋았어요!!! 피곤할줄알았는데 잠을 너무 잘잤고 물도 잘나오구 따뜻함이 있어서 좋았습니다!!!!! 식혜도 기본서비스로 있어서 감사했습니당,5,4년 전
y_73_280,전주 루이호텔,대나무숲로빈,깔씀하네요 근처에 조식식당도 있네요,5,1년 전
y_73_281,전주 루이호텔,전통문화체험관승려,편하게 잘 쉬다 갑니다~,5,1년 전
y_73_282,전주 루이호텔,하야말끔한스탠리,"Thank u for staff's kindness. though asks lots of things, they carefully listened and helped us. Everything was nice, clean, quiet, cozy, warm :)",5,2년 전
y_73_283,전주 루이호텔,매너신사임,만족합니다 ~~~^^,5,1년 전
y_73_284,전주 루이호텔,기념공원식비,조용하고 가성비 좋은 모텔,5,1년 전
y_73_285,전주 루이호텔,조또라희,시설이 깔끔하고 사장님도 친절하세용,5,1년 전
y_73_286,전주 루이호텔,여기어때월150,전주에서 제일 가성비 넘치는 곳 중 하나 인거 같아요 정말 자주가고 연박할때도 이용합니다 시설좋고 가격대비 정말 좋습 니다 티비도 크고 땅!!!!,5,2년 전
y_73_287,전주 루이호텔,여기어때월150,전주에서 제일 가성비 넘치는 곳 중 하나 인거 같아요 정말 자주가고 연박할때도 이용합니다 시설좋고 가격대비 정말 좋습 니다 티비도 크고 땅!!!!,5,2년 전
y_73_288,전주 루이호텔,여기어때월150,전주에서 제일 가성비 넘치는 곳 중 하나 인거 같아요 정말 자주가고 연박할때도 이용합니다 시설좋고 가격대비 정말 좋습 니다 티비도 크고 땅!!!!,5,2년 전
y_73_289,전주 루이호텔,파*****,두 번째 방문인데 갈 때마다 좋네요^^ 냉장고가 조금 작아서 이것저것 넣기에는 불편한데 그래도 시원해요. 테이블이 커서 좋아요^^ 드라이기는 과열이 되면 멈추는 거 같아서 이 점 주의하세요,5,2년 전
y_73_290,전주 루이호텔,김석환20,주차하면 사장님이 알아서 이동해주시고 나가기전에 원래위치로 해주셔서 편했습니다. 방은 아담싸이즈이지만 깨끗하고 따뜻히 잠을 잘수 있었습니다. 중화산동 올때마다 여기에서 묵는것 같아요 또 올께요 빠2,5,2년 전
y_73_291,전주 루이호텔,여기어때 이용 고객,나쁘지 않게 이용 했어요! 3만원이면 싸게 이용 한 듯! 전체적으로 만족 하다 갑니다~ 넷플 되면 됐죵~~ ㅋㅋ 티비 크기도 커서 좋았어요!!! 욕실 깨끗하고 넓어서 좋았고 세면대도 밖에 있어서 편리했습니다 감사합니다,3,2년 전
y_73_292,전주 루이호텔,속리산국립공원한치오징어,일때문에 중화산동 저렴한 숙소들 찾아서 많이 다녔는데 이곳이 최고입니다…,5,1년 전
y_73_293,전주 루이호텔,꽁꼼이,친절하시구 깨끗하고 좋았습니다 근데 차키 맡기는거 싫어하는 사람도 있잖아요 키 맡기라하셔서 좀 그랬습니다 그래두 방은 깨끗하고 좋아서 다행입니다 다음에 또 들르겠습니다 이근처 모텔이 좋은곳이 많네요,5,3년 전
y_73_294,전주 루이호텔,용마폭포공원혁명군,깨끗하고 시설이 좋아요.,4,1년 전
y_73_295,전주 루이호텔,빛나는진솔된,사장님도 친절하고 청결했어요!!,4,1년 전
y_73_296,전주 루이호텔,13377475,사진이랑 비슷합니다. 화장실은 리모델링 한것같았지만 기타 인테리어는 신축느낌은아닙니다. 넷플릭스는 잘 이용하였는데 리모콘이 안되어서 티비직접눌러 음량조절했네요~ 조금은 아쉬운 숙소..!,3,4년 전
y_73_297,전주 루이호텔,낭낭하게냥펀치,냄새안나고 깔끔합니다. 저번에도 묵었는데 역시 좋네요. 잘 쉬다갑니다~,5,2년 전
y_73_298,전주 루이호텔,당진라일락,깨끗하고 수압쎄서 좋아요~~ 에어컨도 시원하고요~ 선풍기 있어서 맘에 들고 가성비 좋아서 계속 가게 되네요~~ 아쉬운건 물 온도 조절이 잘 안되고 방이 좁아서 답답한거 못참는분은 참고하세요,4,2년 전
y_73_299,전주 루이호텔,통일전망대중계,깨끗하고 아득하니 좋아요,5,2년 전
y_73_300,전주 루이호텔,낭낭하게냥펀치,잘 쉬었다 갑니다~~,5,1년 전
y_73_301,전주 루이호텔,jullee76,객실 깨끗하고 깔끔했습니다. 화장실앞 센서등이 있어서 가까이가면 자꾸 켜져서 깜짝놀랐습니다ㅜㅜ 침대메트리스가 정말 좋아서 잘때 편했습니다.,5,2년 전
y_73_302,전주 루이호텔,칙칙해진사위,좋아요 또갈게여 다음에,4,1년 전
y_73_303,전주 루이호텔,출장만21년째,깨끗하고 좋아요 ㅎㅎ,5,3년 전
y_73_304,전주 루이호텔,호두색티라노사우루스,급하게 잡았는데 좋았습니다~.~급하게 잡았는데 좋았습니다~.~급하게 잡았는데 좋았습니다~.~급하게 잡았는데 좋았습니다~.~급하게 잡았는데 좋았습니다~.~급하게 잡았는데 좋았습니다~.~,4,3년 전
y_73_305,전주 루이호텔,낭낭하게냥펀치,편하게 잘 쉬었다갑니다~,5,1년 전
y_73_306,전주 루이호텔,피곤한현이,전주 출장을 많이다니는 일하고있는데 중화산동쪽 숙박업소를 알아보다 처음으로 루이라는 업소에서 숙박하게되었는데 가격도 너무 좋았고 방 내 외부 또한 너무 좋아서 너무 만족스러운 출장이 되었습니다~ 깔끔하고 조용하고 방도 따뜻하고 온수도 잘나와서 불만 하나도없이 너무 잘쉬다가 가요!!,5,2년 전
y_73_307,전주 루이호텔,메밀메밀,"방 넓고 너무 좋아요 앞으로 자주자주 이용할 것 같네요 사장님도 너무 친절하셨습니다. 따듯한 공간 이용할 수 있어서 너무 편하게 잘 쉬었고, 주차장도 너무 넓고 좋았어요. 번창하세요~~~",5,4년 전
y_73_308,전주 루이호텔,예*****,넷플릭스만 되는 방 밖에 없어서 아쉽 매트릭스 만족 스타일러 굳굳,4,2년 전
y_73_309,전주 루이호텔,밍몡몽,이번에 처음 가봤는데 이렇게 깨끗한 숙소가 너무 오랜만인 것 같아요!! 제가 예민해서 다른 곳은 바닥을 밟으면 밟히는 먼지에 머리카락이 거슬렸는데 여기는 바닥이 진짜 물걸레질로 다 닦은마냥 반딱반딱 매끈했어요 진짜 너무 깨끗하고 쾌적하게 잘 쉬었습니다.,5,2년 전
y_73_310,전주 루이호텔,fnffn525,생각보다 깨끗하고 좋았어요~~~!!좀 좁긴 했지만 잠만 자려고 예액했던거라 괜탆았습니다!!그리고 다른 숙소와 다르게 선풍기있어서 너무 좋았어요ㅎㅎ에어컨 싫어하는 사람들한테는 강추합니다!!ㅎㅎ그리고 1층에 아이스크림 무료로 제공해주시고 친절하셔서 좋았어요ㅎㅎ,5,1년 전
y_73_311,전주 루이호텔,노효철,깨끗하고 아주 좋아요ㅎㅎㅎ깨끗하고 아주 좋아요ㅎㅎㅎ깨끗하고 아주 좋아요ㅎㅎㅎ깨끗하고 아주 좋아요ㅎㅎㅎ 깨끗하고 아주 좋아요ㅎㅎㅎ깨끗하고 아주 좋아요ㅎㅎㅎ깨끗하고 아주 좋아요ㅎㅎㅎ깨끗하고 아주 좋아요ㅎㅎㅎ 깨끗하고 아주 좋아요ㅎㅎㅎ깨끗하고 아주 좋아요ㅎㅎㅎ 굿~,5,1년 전
y_73_312,전주 루이호텔,YSuit,새롭게 리모델링하셨다고 해서 예약했는데 아담하고 너무 깔끔하고 조용하고 청결하고 대만족입니다~! 주차장도 넓고 직접 주차도 해주시고 짱이에요🤣🙏🏻,5,1년 전
y_73_313,전주 루이호텔,감동적이고유쾌하,쾌적하고 좋았습니다.,5,1년 전
y_73_314,전주 루이호텔,칠썽,평소 여러 모텔을 자주 이용하는 편인데 처음으로 여기 모텔을 가봤어용 사진으로만 봤던거랑은 차원이 다르게 깔끔하고 쾌적해서 쉬었다 가는데에 있어서 부족함 없이 편하게 지내다 갔어용!!,5,2년 전
y_73_315,전주 루이호텔,꺼이꺼이꺼억,"너무 좋았습니다! 일단 수압이 쎄서 좋았구요~ 난방도 너무 잘되서, 나중엔 덥더라구요~ 그리고 어메니티, 이건 저희가 선택할 수가 없는건데! 구성이 알차서 좋았습니다~ 또 들를거에요^^",5,2년 전
y_73_316,전주 루이호텔,맹0008,물 조절이 어려운 것만 빼면 다 좋은 것 같아요 일하시는 분도 친절해요 깨끗하고 좋았어요!!! 깨끗하고 좋았어요!!! 깨끗하고 좋았어요!!! 깨끗하고 좋았어요!!! 깨끗하고 좋았어요!!!,5,2년 전
y_73_317,전주 루이호텔,쌉돼지쿰척쿰척뇸뇸,시설좋고 청결해요 담에또오고싶어요,5,3년 전
y_73_318,전주 루이호텔,노효철,깨끗하고 아주 좋아요ㅎㅎㅎ깨끗하고 아주 좋아요ㅎㅎㅎ깨끗하고 아주 좋아요ㅎㅎㅎ깨끗하고 아주 좋아요ㅎㅎㅎ 깨끗하고 아주 좋아요ㅎㅎㅎ깨끗하고 아주 좋아요ㅎㅎㅎ깨끗하고 아주 좋아요ㅎㅎㅎ깨끗하고 아주 좋아요ㅎㅎㅎ 깨끗하고 아주 좋아요ㅎㅎㅎ깨끗하고 아주 좋아요ㅎㅎㅎ 굿~,5,1년 전
y_73_319,전주 루이호텔,당진라일락,수압이 쎄고 에어컨이 시원해서 좋아요. 저렴한곳 대부분 에어컨이 관리가 안되있어서 안시원하거나 냄새나더라고요. 방이 좁고 침대가 푹드러가서 허리 아픈게 단점. 가성비는 좋아요~~~,2,3년 전
y_73_320,전주 루이호텔,기념공원식비,가성비가 매우 좋은 모텔,4,1년 전
