id,name,nickname,review_content,rating,write_date
y_73_114,전주 루이호텔,기욤티비,국굿 가세영 조아용 굿굿,3,1개월 전
y_73_115,전주 루이호텔,낭낭하게냥펀치,편하게 잘 쉬었다 갑니다~~,5,1년 전
y_73_116,전주 루이호텔,뭘바바아앙,👍👍👍👍👍😗😗😗😗😗,4,7개월 전
y_73_117,전주 루이호텔,10778425,깨끗 하고 친절하시고좋아요,5,9개월 전
y_73_118,전주 루이호텔,바르샤바소식,사장님 완전 친절하세요! 티비도 크고 OTT 다 돼서 편하게 쉬고 왔습니당,5,9개월 전
y_73_119,전주 루이호텔,기념공원식비,가성비 좋은 모텔 ㅋㅋㅋ,5,10개월 전
y_73_120,전주 루이호텔,낭낭하게냥펀치,편하게 잘 쉬었다 갑니다.,5,11개월 전
y_73_121,전주 루이호텔,앗쉬어디가지,깔끔하고 좋아요 사진엔 없지만 욕실 시설이 좋습니다,5,1년 전
y_73_122,전주 루이호텔,강렬하고기대하는동굴,깔끔하고 좋았습니다 주중에 자주애용합니다,4,8개월 전
y_73_123,전주 루이호텔,수고하세여,깨끗해요 다음에 또 올게요,4,9개월 전
y_73_124,전주 루이호텔,10778425,좋아요. 친절하고 깨끗해요,5,10개월 전
y_73_125,전주 루이호텔,10778425,깨끗하고 친절하시고 좋아요,5,6개월 전
y_73_126,전주 루이호텔,미남랑,조용하고 깨끗하고 잘 쉬다 갑니다.,5,1년 전
y_73_127,전주 루이호텔,드센참깨,괜찮았습니다 추천 드려요,3,6개월 전
y_73_128,전주 루이호텔,반직업적인님,숙소 깨끗하고 좋습니다,5,4개월 전
y_73_129,전주 루이호텔,뭘바바아앙,👍👍👍👍👍😗😗😗😗😗,5,8개월 전
y_73_130,전주 루이호텔,각박하고가냘픈명동,좋았습니다~~~~~,4,11개월 전
y_73_131,전주 루이호텔,각박하고가냘픈명동,좋았습니다~~~~~,4,11개월 전
y_73_132,전주 루이호텔,뭘바바아앙,👍👍👍👍👍♥️♥️♥️♥️♥️,4,9개월 전
y_73_133,전주 루이호텔,루나남친,편히 쉬다가 왔어요~ 좋아요,5,6개월 전
y_73_134,전주 루이호텔,뭘바바아앙,👍👍👍👍👍😊😊😊😊😊,5,8개월 전
y_73_135,전주 루이호텔,뭘바바아앙,👍👍👍👍👍😌😌😌😌😌,4,9개월 전
y_73_136,전주 루이호텔,송구리다,깔끔한숙소에서잘쉬었다갑니다^^,5,9개월 전
y_73_137,전주 루이호텔,소소하고친밀한테레시,깔끔하고 괜찮았어요 다음에또이용할게요,5,10개월 전
y_73_138,전주 루이호텔,요구르트한바구니,편하게 쉬다왔어요 !👍🏻,5,4개월 전
y_73_139,전주 루이호텔,이견본체,솔직히 방내부랑 청결은좋앗는데 서비스가너무 안좋음;;예약해서갓는데 늦게 도착햇다고 입실이 안된다는식으로 말씀하시고 입실하니까 갑자기전화오더니 바로 전화 오셔서 차량 이동 하라고 툭툭 내뱉듯이 말하고 끊으셨네요 다 좋은데 불친절 하셔서 좀 그렇네요,3,11개월 전
y_73_140,전주 루이호텔,파란5,깨끗하고 써비스좋아아요,5,5개월 전
y_73_141,전주 루이호텔,대나무숲로빈,맥도날드가 가까워서 좋았네요,5,11개월 전
y_73_142,전주 루이호텔,뭘바바아앙,👍👍👍👍👍♥️👍😃😃😃😃,5,8개월 전
y_73_143,전주 루이호텔,안양제사,깨끗하고 쾌적했습니다,4,9개월 전
y_73_144,전주 루이호텔,적극적이고희망찬금강유황온천,가성비좋고 실내가 깔끔하고 좋아요,5,11개월 전
y_73_145,전주 루이호텔,찬또기,너무좋은곳이예요 가족들이랑 편하게 있다왔어요 무엇보다 저렴해서 좋았습니다,5,11개월 전
y_73_146,전주 루이호텔,민아기여워,깔끔하고 숙소가 예뻐요 ♥,5,4개월 전
y_73_147,전주 루이호텔,watseo51,방이 조금 작고 아담하지만 소음없이 잤어요,3,10개월 전
y_73_148,전주 루이호텔,뭘바바아앙,♥️♥️♥️♥️👍👍👍👍👍♥️♥️,5,9개월 전
y_73_149,전주 루이호텔,카구카구,너무너무 좋아요 ㅎㅎㅎ,5,11개월 전
y_73_150,전주 루이호텔,배고픈밥돌이,방도 넓구 깨끗해서 너무 좋았습니다,5,3개월 전
y_73_151,전주 루이호텔,흥자두,자주 가는데 갈때마다 좋아요,5,9개월 전
y_73_152,전주 루이호텔,기념공원식비,불친절하고 차키를 주어야만 묵을 수 있 별로인 모텔,3,6개월 전
y_73_153,전주 루이호텔,별보는날,옆방에서 양치하는 소리 까지 들릴 정도로 방음 잘 안되고 화장실 욕조에는 처음 스파 켰을때 냄새가 나고 부유물이 떠서 불쾌했음,1,6개월 전
y_73_154,전주 루이호텔,화니화니화나,항상 잘이용하고있어요,3,11개월 전
y_73_155,전주 루이호텔,흥자두,가격 저렴한데도 너무 좋아요,3,9개월 전
y_73_156,전주 루이호텔,버젓한김밥,사실 저흰 침구류가 맘에 들면 잘자는 편이라 침대 배게가 맘에 들었구요~방도 따뜻해서 좋았어요.룸 드라이기가 망가져서 예비 드라이기로 쓴거 외에는 전체적으로 맘에 들었던 숙소같아요~,3,5개월 전
y_73_157,전주 루이호텔,이동일bruce,하루 잘 묵었습니다. 객실안은 청결하고 비품상태 좋았습니다. tv커서 네플릭스보기 좋습니다.,3,4개월 전
y_73_158,전주 루이호텔,홍연두홍,처음 들어갈 때부터 상당히 불친절하시고 침대 밑이 청소가 안 되어 사용한 콘돔이 떨어져있었습니다.,1,7개월 전
y_73_159,전주 루이호텔,깡쐬주한짝,편하게 쉴수있어 좋았네요~,3,9개월 전
y_73_160,전주 루이호텔,JHK76,"리뷰만 보고 마감임박 급하게 잡은 숙소 딸아이랑 단둘 여행 방에 렌즈케이스,털 그대로 이길래 방바꿈 한자리 남아 주차하고 입실 일요일 11시50분 퇴실 주차장에 차는 없고 카운터 직원도 모름 차는 밖에 다른곳에서 찾음 차를 왜 이동했는지 모르겠네요 퇴실 시간 다되서 퇴실했는데;;; 많이 찝찝하고 다신 안올것 같아요 기분좋은 전주여행이 마무리가 씁쓸함",2,8개월 전
y_73_161,전주 루이호텔,김석환20,제일 싸고 컨디션. 좋고 주차까지 해주시고 이만하면 중화산동에서 가장 좋은거 아닙니꺄? 스타일러 넷플렉스 빠짐없이 좋고 깔끔해서 너무나도 좋아요. 주위에 식당과 술집도 즐비하고 아주 좋네요,5,1년 전
y_73_162,전주 루이호텔,도리쑤니,전체적으로 괜찮았지만 지하에 음악홀이 있고 주위전체모텔에 음악홀이라고 같이있어서 그런지 주변이 시끄러워 편하게 잠을 잘수없다는게 아쉬웠습니다.!,2,8개월 전
y_73_163,전주 루이호텔,종합적인석궁,넷플릭스 안됩니다 그리고 화장실이 많이 고장 나있어요 조심히 써야 합니다. 아쉽습니다,1,11개월 전
y_73_164,전주 루이호텔,호모찌,병원 때문에 전주를 방문해야 해서 어디에 묵을까 고민하다가 여기로 잡게 되었어요~~~~~~ 늦게 까지 넷플릭스 보다가 늦게 잤어요 넷플릭스 최고!!!! 방도 괜찮았어요 담에 또갈게요!!,4,1년 전
y_73_165,전주 루이호텔,uy5540uy,조용하고 잘 쉬다 갑니다.,2,4개월 전
y_73_166,전주 루이호텔,노효철,깨끗하고 아주 좋아요ㅎㅎㅎ깨끗하고 아주 좋아요ㅎㅎㅎ깨끗하고 아주 좋아요ㅎㅎㅎ깨끗하고 아주 좋아요ㅎㅎㅎ 깨끗하고 아주 좋아요ㅎㅎㅎ깨끗하고 아주 좋아요ㅎㅎㅎ깨끗하고 아주 좋아요ㅎㅎㅎ깨끗하고 아주 좋아요ㅎㅎㅎ 깨끗하고 아주 좋아요ㅎㅎㅎ깨끗하고 아주 좋아요ㅎㅎㅎ 굿~,4,11개월 전
y_73_167,전주 루이호텔,노효철,깨끗하고 아주 좋아요ㅎㅎㅎ깨끗하고 아주 좋아요ㅎㅎㅎ깨끗하고 아주 좋아요ㅎㅎㅎ깨끗하고 아주 좋아요ㅎㅎㅎ 깨끗하고 아주 좋아요ㅎㅎㅎ깨끗하고 아주 좋아요ㅎㅎㅎ깨끗하고 아주 좋아요ㅎㅎㅎ깨끗하고 아주 좋아요ㅎㅎㅎ 깨끗하고 아주 좋아요ㅎㅎㅎ깨끗하고 아주 좋아요ㅎㅎㅎ 굿~,4,11개월 전
y_73_168,전주 루이호텔,뎡소라,평범합니당 편하게 잘수있는게 최공,3,10개월 전
y_73_169,전주 루이호텔,낭낭하게냥펀치,자주들립니다. 잘 쉬었다갑니다.,5,1년 전
y_73_170,전주 루이호텔,여기어때월150,전주가면 자주 들리던 곳인데 오랫만에 갔지만 역시나 너무좋았습니다 가격대비 최고이며 시설도 너무좋습니다 다음에도 또 이용하겟습니다 !!! 사장님도 매우친절하십니다,5,1년 전
y_73_171,전주 루이호텔,낭낭하게냥펀치,또 들렸다 갑니다~ 항상 마음에 듭니다. 잘 쉬었다갑니다.,5,1년 전
y_73_172,전주 루이호텔,출장만21년째,깨끗하고 아주 좋아요ㅎㅎㅎ깨끗하고 아주 좋아요ㅎㅎㅎ깨끗하고 아주 좋아요ㅎㅎㅎ깨끗하고 아주 좋아요ㅎㅎㅎ 깨끗하고 아주 좋아요ㅎㅎㅎ깨끗하고 아주 좋아요ㅎㅎㅎ깨끗하고 아주 좋아요ㅎㅎㅎ깨끗하고 아주 좋아요ㅎㅎㅎ 깨끗하고 아주 좋아요ㅎㅎㅎ깨끗하고 아주 좋아요ㅎㅎㅎ 굿~,5,2년 전
y_73_173,전주 루이호텔,명동경첩,주변식당이 많고 조용하고 주차하기편하고 톨게이트에서 가깝고 샤워 수압 좋고 사장님 친절합니다 가성비 갑이고 다만 금연인것이 아쉽네요 흡연자로써 금연이라 좀 불편했어요 흡연자이신분은 참조하세요,5,2년 전
y_73_174,전주 루이호텔,여기어때월150,전주에서 괜찬은거같습니다 편하게 쉬다가ㅏ 가1니다 니다우 다음 에도 또 이용 하겟스1니다 가성비 좋고 시설 좋아요 !! 물도 잘나와요,5,2년 전
y_73_175,전주 루이호텔,노효철,깨끗하고 아주 좋아요ㅎㅎㅎ깨끗하고 아주 좋아요ㅎㅎㅎ깨끗하고 아주 좋아요ㅎㅎㅎ깨끗하고 아주 좋아요ㅎㅎㅎ 깨끗하고 아주 좋아요ㅎㅎㅎ깨끗하고 아주 좋아요ㅎㅎㅎ깨끗하고 아주 좋아요ㅎㅎㅎ깨끗하고 아주 좋아요ㅎㅎㅎ 깨끗하고 아주 좋아요ㅎㅎㅎ깨끗하고 아주 좋아요ㅎㅎㅎ 굿~,5,2년 전
y_73_176,전주 루이호텔,단골부부,좋습니다요 좋습니다요 좋습니다요 좋습니다요 좋습니다요 좋습니다요 좋습니다요 좋습니다요 좋습니다요 좋습니다요 좋습니다요 좋습니다요 좋습니다요 좋습니다요 좋습니다요 좋습니다요 좋습니다요 좋습니다요 좋습니다요 좋습니다요 좋습니다요,5,4년 전
y_73_177,전주 루이호텔,zke,루이14세 루이14세 루이14세 루이14세 루이14세 루이14세 루이14세 루이14세 루이14세 루이14세 루이14세 루이14세 루이14세 루이14세 루이14세 루이14세 루이14세,5,3년 전
y_73_178,전주 루이호텔,말똥한용기사,위치도 잘 보이는 곳이고 숙소 상태도 매우 깔끔하고 좋습니다. 특히 매트리스가 정말 맘에 들어요 푹신하고 잠이 잘 옵니다. 소음도 없고 물도 잘 나옵니다. 다음번에도 방문하려고요.,5,2년 전
y_73_179,전주 루이호텔,꺼이꺼이꺼억,"너무 좋았습니다! 일단 수압이 쎄서 좋았구요~ 난방도 너무 잘되서, 나중엔 덥더라구요~ 그리고 어메니티, 이건 저희가 선택할 수가 없는건데! 구성이 알차서 좋았습니다~ 또 들를거에요^^",5,2년 전
y_73_180,전주 루이호텔,이구역의방랑자,여기는 처음 이용해보는 곳인데요 생각보다 깔끔한거 같고 가성비 갑으로 너무 괜찮고 좋은거 같아요. 다음에 또 이용할수 있을꺼 같아요 7시까지만이라 아쉽긴 하지만요 ㅠㅠㅠ,5,2년 전
y_73_181,전주 루이호텔,낭낭하게냥펀치,사장님이 너무 친절하셔서 서비스도 좋고 객실 컨디션도 깨끗하고 넓고 비품도 필요한 것들 다 있습니다. 담배냄새도 거의 안나고 방음도 큰 문제없고 조용합니다. 화장실 수압도 큰 문제없고 주차공간도 있고 넓어 좋고 주변에 상가도 많아 먹을 곳 많고 위치도 좋습니다. 편하게 잘 쉬었다 갑니다.,5,1년 전
y_73_182,전주 루이호텔,달려라경수,"위치는 대로변에서 바로 들어오면 보입니다. 근처에 GS25 편의점 두개나 있고 근처 스타벅스, 맥도날드 있습니다. 주차 가능하고 사장님이 주차도 해주십니다. 친절하시고 우산 부탁드렸는데 흔쾌히 빌려주셔서 근처 잘 다녀왔습니다! 이 숙소의 가장 좋은 점은 TV입니다. 다른 숙소보다 훨씬 큰 화면이라 넷플릭스 보기 좋았습니다. 온도 조절도 쉽게 잘 할 수 있고 묵기 좋았습니다. 걸어서 중화산동 먹자골목 갈 수도 있습니다. 따뜻한 물도 잘 나오고 애머니티도 구비되어 있습니다.",5,1년 전
y_73_183,전주 루이호텔,칠썽,CPU : intel(R) Pentium(R) Dual E2220 / 2.40GHz : intel(R) Pentium(R) Dual E2220 / 2.40GHz : intel(R) Pentium(R) Dual E2220 / 2.40GHz love 버즈 내가 아니라도 주호 풍선 숙소 진짜 너무 좋아요 다음에 꼭 다시와서 놀고싶습니다 사장님도 너무 친절하시고 기억에 남는 여행입니다 My love 버즈 내가 아니라도 주호 풍선 My love 버즈 내가 아니라도 주호 풍선,5,1년 전
y_73_184,전주 루이호텔,둥실한과일,전반적으로 깔끔하고 침구밎 비품등 컨디션 아주좋았습니다. 주차장도 쾌적한편이어서 좋았습니다 출장 자주다니는데 앞으로 자주 이용할것같습니다 친절히응대잘해주시고 편안히 잘쉬다갑니다 다음에 또 올게요,5,1년 전
y_73_185,전주 루이호텔,노르웨이숲81,가격이 매우 싸다. 스타일러가 있으나 좀 지저분하다. 시트 얼룩은 어쩔수 없다. 그래도 따뜻하고 주차관리하시는분 친절하시다. 주변에 음식점 많고 스벅 맥도날드 베리굿이다. 저렴하게 이용할때 괜찮다,4,1년 전
y_73_186,전주 루이호텔,57세배춧국,합리적인 가격에 깔끔한 숙소로 잘 쓰고왔어요. 위생상태도 나쁘지않았고 출장시 숙소로 이용했는데 혼자 쓰기 적당했습니다. 추천드려요~~~~~~~~~~~~~~~~~~~~~~~~~~~~,4,2년 전
y_73_187,전주 루이호텔,쿨써니,가격이 저렴했고 아늑한 공간에서 편하게 잘 쉬다가 나왔습니다 주차장은 좀 협소한 편이지만 다행히 차들이 없어서 괜찮았어요 친절하게 대해주시고 내부도 깔끔해서 나중에도 재방문 할 거 같습니다,5,1년 전
y_73_188,전주 루이호텔,말캉말캉한습지식물,방은 좀 좁은데 깔끔하니 괜찮아요 연식이 조금 있고 그래도 이 주변 모텔들보단 확실히 깔끔한 느낌이였어요 스타일러가 있어서 담배 냄새 안 배서 좋았고 사장님도 친절하셨습니다 앞으로 이용할 일 이 있다면 또 이용할거 같아요,4,2년 전
y_73_189,전주 루이호텔,열렬한이반,리모델링 했다는데 잘 모르겠어요 방에서 담배냄새 넘 심해요 좁아서 물건 둘 곳이 부족했어요 도로변이라 방음 잘 안 돼요 사장님 친절하시고 티비는 커서 좋았어요,4,1년 전
y_73_190,전주 루이호텔,여기어때월150,가성비좋고 시설깔끔하고좋고 위치도뫃고 주차도좋아요!!!사장님친절하시고아주좋아요다음애도 전주가면 이용하겧습니나 전주가면 거희매번이용하능거랕숨니아 주차장도 야외가아니라 너무좋어요!,5,1년 전
y_73_191,전주 루이호텔,이구역의방랑자,”중화산동에 가격대비 인테리어랑 구성이 괜찮은 숙소는 루이가 최곱니다 “ 자주 이용하면서 불편함 없이 쉬다 갑니디.”중화산동에 가격대비 인테리어랑 구성이 괜찮은 숙소는 루이가 최곱니다 “ 자주 이용하면서 불편함 없이 쉬다 갑니디.”중화산동에 가격대비 인테리어랑 구성이 괜찮은 숙소는 루이가 최곱니다 “ 자주 이용하면서 불편함 없이 쉬다 갑니디.”중화산동에 가격대비 인테리어랑 구성이 괜찮은 숙소는 루이가 최곱니다 “ 자주 이용하면서 불편함 없이 쉬다 갑니디..,5,1년 전
y_73_192,전주 루이호텔,낭낭하게냥펀치,사장님이 너무 친절하셔서 서비스도 좋고 객실 컨디션도 깨끗하고 넓고 비품도 필요한 것들 다 있습니다. 담배냄새도 거의 안나고 방음도 큰 문제없고 조용합니다. 화장실 수압도 큰 문제없고 주차공간도 있고 넓어 좋고 주변에 상가도 많아 먹을 곳 많고 위치도 좋습니다. 편하게 잘 쉬었다 갑니다.,5,1년 전
y_73_193,전주 루이호텔,김석환20,발렛파킹 너무나 좋았습니다. 객실안에는 깨끗했고 인테리어도 잘되어 있어서 좋았습니다. 다만 방이 조금 컸으면 하는 바램이지만 힘들겠지요 ㅎ 넷플렉스도 좋았고 항상 청결 유지해주시고 대박나세요,5,3년 전
y_73_194,전주 루이호텔,김석환20,컨디션 주겨요^^ 깨끗하고 발렛파킹사장님도 너무 친절합니다. 공기청정기에 스타일러까지완벽합니다. 정말 더더욱 놀랄일은 가격이 정말 착해요. 가성비도 착한 루이 호텔 강력 추천합니다^^♡,5,2년 전
y_73_195,전주 루이호텔,뿌쩜쭈코,체크인할 때 친절하게 맞아주셔서 감사했습니다😊 객실 청결하고 비품도 부족한 것 없이 잘 구비되어 있습니다. 난방도 잘 돌아가서 따뜻하게 잤습니다. 덕분에 잘 쉬고 갑니다.,5,1년 전
y_73_196,전주 루이호텔,haran7,뷰가 좋고 사장님 친절하고 가격저렴하고 좋습니다~,4,2년 전
y_73_197,전주 루이호텔,멋쩌,전주 관광지 부근에는 본 숙소와 비슷한 가격대로는 시설이 낙후된 한옥이거나 적당한 호텔정도의 시설이면 가격이 두배쯤 되거나여서 적당한 가격의 괜찮은 숙소가 없었어요 그래서 조금 떨어진 이 곳으로 예약했는데 택시비 오처넌정도 나와서 아주 잘한 선택이었어요 방도 깨끗하고 사장님들도 친절히 대해 주셔서 좋았어요 주차장이 너무 좁은가 생각했는데 옆건물로 발렛 해주셔서 편했고 퇴실 시간 10분 정도 오버했는데 배려해주셔서 좋았습니다 전주에서 좋은 추억 많이 만들고 갑니다~~,5,1년 전
y_73_198,전주 루이호텔,chajihun,시설 깔끔하고 룸 컨디션 너무 좋아요.. 사장님 너무 친절하시고 애용하는 곳이에요. 좋은 시설 합리적인 가격에 기분 좋게 머물다가 가요..앞으로도 자주 애용하겠습니다..강추입니다..,5,2년 전
y_73_199,전주 루이호텔,출장만21년째,깨끗하고 좋아요 ㅎㅎ 오,5,3년 전
y_73_200,전주 루이호텔,뿌쩜쭈코,"난방도 잘 돌아가고 편의점 가깝습니다. 객실 청결했고, 비품도 부족한 것 없이 있어 덕분에 잘 쉬고 갑니다.",5,1년 전
y_73_201,전주 루이호텔,여기어때월150,방바닥 화장실바닥 불가마인줄 알았습니다 엄청 따듯하게 푻 쉬엇다가 갑니다 다름에도 이용하겟습니다 침대 짱편하고 젛아요 주차도 좋고 사장님도 친절하세요~~~~~~~~~~,5,2년 전
y_73_202,전주 루이호텔,고달이,시설은 전체적으로 괜찮았지만 티비가 구형 LCD라 화질이 많이 답답했어요. 청결도는 꽤나 좋은 편이어서 기분좋게 이용했다고 리뷰를 남기고 싶었지만.. 주차자리 없어서 차 키 맡긴게 화근이었네요. 발렛이던 다른 업장이던 주차를 맡기면 세팅을 건들지를 않던가 원래대로 세팅을 돌려놓으시던데... 여기는 멋대로 바꾸고 유리창에 기스까지 났네요. 자영업자들 고생하지 마라고 진짜 리뷰 좋게 항상 5점 남기는데. 이거 한건 때문에 서비스쪽 별점만 안좋게 남깁니다. 신경좀 써주세요,3,1년 전
y_73_203,전주 루이호텔,김석환20,깔끔하고. 좋네요 회사 출장으로 두번 갔는데 주차 서비스도 좋고 방 청결 상태좋아요 한가지 아쉬운건 비데가 없네요 ㅠㅠㅠ 담에 또 이용할 용의가 있습니다. 에어드레스도 있고 여하튼 만족합니다,5,3년 전
y_73_204,전주 루이호텔,음난미르,"가격대비 좋습니다 사장님도 친절하고, 주차 공간도 넉넉합니다 시설도 낣고 주변에 음식점도 많습니다 간 술집이 근처에서 좀 시끄러운 단점은 있습니다 물고 잘 나오고 뜨뜬한 물고 잘 나옺니다 침대가 딱딱하니 메모리폼입니다",5,2년 전
y_73_205,전주 루이호텔,zkwwidn,가격이 저렴해서 이용했는데 담배냄새도 나고 화장실 문 위에가 뚫려있어서 소리도 다 들리고 좀 불편하네요ㅠㅠㅠㅠ 방도 작고 티비도 안됐어요.. 리모콘이 고장난건지.. 방음도 안되고 다른 곳보다 작아서 좀 실망했습니다 사진엔 넉넉하게 생겼는데 잠만 자기 좋은곳이에요……….,4,2년 전
y_73_206,전주 루이호텔,계영기원여이동사,조용하게 잘쉬었다 오게되었네요 출장중 속소는 대단히중요한게 청결 좋은침구류 같은데 적합한곳인거 같아요 주변에편의점이나 식당도많아서 추천할만합니다 가성비좋아요 친절하시고 담에또이용할게요,4,2년 전
y_73_207,전주 루이호텔,꺼이꺼이꺼억,"깔끔하고 청결합니다! 출장이 많아서 이곳저곳 많이 다녀봤는데, 침대의 퀄리티나 청결상태, 직원분의 친절함까지 다 갖춘곳은 드물었습니다. 가격대비 이정도 갖추었으면, 추천할만 하다고 생각합니다!^^",5,2년 전
y_73_208,전주 루이호텔,김석환20,주차도 해주시고 첫인상부터가 굿... 방도 깨끗하고 가격도 저렴하고 스타일러도 너무 좋았습니다. 넷플렉스도 너무 좋았습니다. 공기청정기도 너무 좋았습니다. 조금 좁은것이 아쉬웠지만 전체적으로 굿입니다.,5,3년 전
y_73_209,전주 루이호텔,ddochichi,시설도 깔끔하고 친절해서 좋았습니다 물 수압도 쎄서 맘에 들었고 주차도 해주셔서 좋았습니다 주변에 먹거리가 많다기보단 유흥가주변이라 조금 놀랬네요 아이와 편하게 잘 쉬다 갑니다 감사합니다,5,2년 전
y_73_210,전주 루이호텔,100세위협,먹을 거 많고 ~~ 객실 깨끗하고 너무 좋습니다 물도 잘나오고 먹을데도 많아서 좋았어요 침구 상태도 깨끗하고 생긴지 얼마 안된것 같았어요 다음에 또 오면 이용하겠습니다 번창하세요~~!,5,2년 전
y_73_211,전주 루이호텔,불타는부엉이,편의점 가깝고 주변 밥집은 조금 걸어가야 하지만 근처에 맥날도 있어요. 주차공간 적당히 있고 내부시설도 깔끔하고 갖출거 다 갖추고 있어서 편하게 머물다 갑니다 ㅎㅎㅎㅎㅎㅎㅎㅎㅎㅎㅎㅎ,5,2년 전
y_73_212,전주 루이호텔,단골부부,"항상 자주 애용합니다. 너무 좋아요~ 저에겐 딱 맞는 숙소네요 사장님도 친절하시고, 여자친구와 오기에도 안전감이 들어요 앞으로도 자주 애용하겠습니다! ☆☆☆☆☆☆☆☆☆☆☆☆☆☆☆☆☆☆☆☆☆☆☆☆☆",5,4년 전
y_73_213,전주 루이호텔,김연주26,"쾌쾌한냄새 .변기에묻은오줌자국. 보이는곳만 대충한 청소. 가성비 숙소라 장단점이 있다고 생각하고 말았습니다 그러나 이틀연박이였는데, 별도의 코멘트없이 외출시 숙소에 들어와 청소한것도 불편한데, 청소하며 치약과 화장품 뚜껑 등 일회용이 아닌 개인용품을 버려 분노하여 리뷰남깁니다. 저의 컴플레인에도 변상할 생각은 안하시고, 하루지난 쓰레기통을 뒤져 치약을 다시 쓰라고 찾아주신점을 보아 위생 개념이 어느 수준에있는지 알겠습니다. 꼭 개선하셔서 관광도시로 성장하는 전주의 숙박문화에 민폐가 되지 않길 바랍니다",0,1년 전
y_73_214,전주 루이호텔,막강한올빼미1,"너무 깨끗하고 만족스러웠습니다. 다음에도 재방문 의사 있으며,주변 지인들과 회사 동료에게도 추천할께요~ 또한 사장님도 친절하시어,너무 편안하게 하루 푹 쉬었다가 갑니다~번창하세요~응원합니다.",5,1년 전
y_73_215,전주 루이호텔,막강한올빼미1,"너무 깨끗하고 만족스러웠습니다. 다음에도 재방문 의사 있으며,주변 지인들과 회사 동료에게도 추천할께요~ 또한 사장님도 친절하시어,너무 편안하게 하루 푹 쉬었다가 갑니다~번창하세요~응원합니다.",5,1년 전
y_73_216,전주 루이호텔,피곤한현이,전주로 일하러 왔다가 중화산동쪽에서 맛있는 저녁먹으려고 근처에 숙소를 알아봤는데 저렴한가격과 깔끔한이미지 좋은 리뷰까지..바로 예약을 했습니다~ 프론트 직원분이 친절하셨고 사진처럼 방도 정말깔끔했으며 생각했던거 보다 넓어서 너무 만족스러웠어요! 화장실도 쾌적하고 수압도 좋아서 굿굿 잘 쉬다가 갑니다!,5,2년 전
y_73_217,전주 루이호텔,본질적인반추,방 깔끔하고 괜찮았어용! 넷플릭스도 잘나와용 아쉬운점은 물 온도 조절이 조금 어려우어용 너무 뜨겁거나 차가워서 씻을때ㅠ조금 힘들었습니당 그리고 창문에서 문을 닫았는데도 바람소리가 많이 들려용 그거 빼면 만족합니다!,5,3년 전
