id,name,nickname,review_content,rating,write_date
y_74_266,전주 호텔젠,이혜빈1,할인받아 2박 연박으로 해서 10만원에 있다왔는데 시설이나 서비스나 제가 가본 어떤 호텔보다ㅠㅠㅠ 같이 간 친구랑도 여기 살고싶다고ㅋㅋㅋㅋ 근처에 야식 시켜먹을데도 많고 누룩꽃도 가까이에 있어서ㅠㅠㅠ 전주 다시가도 꼭 이 호텔에 묵으려구여 진짜 너무 좋았어요!!!! 완전 쾌적하고 인테리어도 진짜 예뻤어요,5,10년 전
y_74_267,전주 호텔젠,hyeon9,여기어때로 찾아가게되었는데 어딜가나 처음주차장 안좋으면 걱정스러운데 자동문에다가 주차공간도 많고 좋네요 데스크에 계신분이 되게 상냥하게 친절하게 대해주시고 설명도 잘해주셔서 좋네요 방은vip로 갔는데 다른데와 다르게 깨끗하고 기본주는 위생용품도 종류도 여러가지고 되게 좋네요 다른곳과 다르게 냉장고에는 더많은 료수구비 특히 핫식스까지 있어서 놀랬어요 찰떡쿠키도 주시네요ㅎㅎ 티비도 엄청고화질에 인치도 큰편이여서 집에 가져가고싶은충동이ㅜㅜ 정말 별5개가 아깝지않았어요 다른곳은 평가와 다른데 여기는 더 좋네요 다음에 또방문하려구요^^,5,9년 전
y_74_268,전주 호텔젠,842086,"잘 쉬다 갑니다 간단한 리뷰를 하면, 깨끗하고 조용해요 다만 방음이 약하고, 보일러가 너무 뜨거워서 더웠어요ㅠ 그러다보니 약간 숨막힐것같은.. 그렇지만 지내는데 불편함 없고 화장실도 아주 깨끗했어요 절대 지저분하지 않아요 돌아다니다보면 지저분한 느낌주는 모텔들이 있는데 그렇지 않구요 주변에 먹을거리도 돌아다니면 꽤 있어서 가격도 좋고 지내시는데 추천해요~",3,8년 전
y_74_269,전주 호텔젠,유동적인동맹,침대도 방도 따뜻하네요 요즘 날씨도 추운데 춥지않게 잘 잤어요 따뜻한 물도 잘 나오고해서 푹쉬었어요 다음에 근처에 또 오게된다면 여기를 이용할께요 편하게 푹쉬고 꿀잠자고 갑니다 번창하세요,5,3년 전
y_74_270,전주 호텔젠,봉다리봉투,모텔 소개 나온데로 좋네요~ 점렴한 가격에 안마의자를 사용하니 피로가 확 풀리네요 깨끗하고 좋아요~,4,6년 전
y_74_271,전주 호텔젠,15586,전주에서 시설좋은데 찾다가 발견한 젠모텔~ 카운터부터 친절히 반겨주시네용^^ 방에 들어갔는데 모텔특유의 냄새(?)도 안나고 넓고 아늑했어용~ 침대도 깔끔하고 편하네용.이불은 가볍고 따뜻하고 깨끗^^ 푹 쉬다가 기분좋게 커피한잔마시면 나왔네요. 여기 완전 단골될 것 같네용ㅋ,5,11년 전
y_74_272,전주 호텔젠,전국적인계피,여태가본곳중에 최고입니다 성수기라 비록 비싼값에 숙박을하지만 돈이 아깝지않아요... 들어오자마자 호텔인가 싶기도했어요 서비스도 너무좋아요 저희다른지역에서왔는데 모텔때문에 또 여행 전주로오고싶은건 처음이예요! 일반신인데 특실수준ㅠㅠ무한감동 먹고갑니다 그리고 손님들이 너무많아서 미리 예약하고들어오길잘했네용ㅎㅎㅎㅎ 그리고 이모텔의 최고의장점이 긴창문?이네요 다른곳은 그냥 다똑같은데 여긴...배란다처럼 딱트여있어서......여행오길잘했다는 보람까지느꼈습니다~ㅎㅎ 전주 한옥마을도있고 야시장도 자주오는데 올때마다 숙박은 다른곳볼거없고 여기네요ㅎㅎ 사장님짱입니다~ㅎㅎㅎㅎ,5,9년 전
y_74_273,전주 호텔젠,7266205,입구에서 젊은 여사장님? 이 물건 정리하시면서 응대해주셨는데 밝게 인사해주면서 입실물품 주셔서 별거 아닌데 기분좋게 이용했어요 객실도 따뜻했고 편했어요 깨끗했구요 다만 화장실 세면대 수도꼭지 부분과 샤워기 거치대가 파손?? 이 되있어서 고정이 안되는점이 수리가 필요할것으로 보이구요 바닥이랑 전반적으로 깨끗했는데 먼지같은게 덩어리진게 한두개 보여서 체크해보니 침대밑 공간에 먼지가 좀 많네요 바쁘시겠지만 일주일에 한번정도만 침대밑에도 먼지흡수랑 물걸레질 부탁드릴게요 그외에는 공기도 탁하지않고 쾌적하고 아늑했습니다 시간도 많이주시고 다음에도 치킨뜯으러 이용할게요,4,6년 전
y_74_274,전주 호텔젠,둘만의비밀장소,항상애용하는 곳입니다 방들어오면 분위기자체가깔끔해서 좋고 사장님도 친절해서 좋습니다 다만오늘은 화장실에서 담배냄새가 심하게나서 환기를 신경써주시면 좋겠습니다,5,6년 전
y_74_275,전주 호텔젠,88350,여행왓는데 넘좋네요 깔끔하구 엄청 좋앗어요 진짜 의자쇼파 맘에듬 친절 ㅋㅋ,4,10년 전
y_74_276,전주 호텔젠,깨끗한방원해요,"ㅋㅋ아중리는 젊은 기운도 있고, 맛집도 많은데 술집도 많아서 밤에 놀기도 참 좋은 곳이죠 전에 한번 왔을 때도 늦게까지 술마시고 편하게 자고 가고 싶다 생각이 들었었는데 가성비모텔이 있어 이용하고 왔어요 전체적으로 내부가 깔끔했어요 모던하면서 심플한 인테리어입니다. 저희는 일반실을 이용했는데 적당히 편하게 묵고갈만한 크기였어요",5,3년 전
y_74_277,전주 호텔젠,Chiiii,모텔이아니라 호텔분위기네요 너무 깨끗하구 일반실치구 방이넓어서 좋네요^^ 고데기 필요했는데 고데기서비스에 더 만족스러움 직원분?이 너무친절하네요^^ 다음에 또 이용해야겠음 야호,5,11년 전
y_74_278,전주 호텔젠,232891,와 정말 여기어때 처음으로 다운받아서 호텔젠에 오게됏는데요 사실 이름만 호텔이겟지햇는데 정말 호텔이엇네요 서비스도 너무 좋으시고 하나하나 다 알려주시고 사진처럼 방도 깔끔하고 완전 좋네요 과자랑 팝콘 토스트까지 짱이네요 전주오시는분들 이용하세요 적극추천합니다,5,9년 전
y_74_279,전주 호텔젠,572274,명절 보내고 푹 쉬고싶어서 후기보고 왔는데 직원분께서 너무 친절하시고 잘 지내다 왔어요 욕실을 중요하게 보는터라 오자마자 욕실부터 봤는데 수압이랑 온도도 맘에들고 너무너무 깔끔하고 잘 되어있네요 객실도 너무 깔끔하고 잘 되어있구 일회용품 구비도 잘 되어있어서 정말 잘 지내다 갑니다 다음에 또 올게요,5,9년 전
y_74_280,전주 호텔젠,슈니슈니416,주차장도 넓고 객실도 깨끗하고 인테리어도 너무 잘되있구 특히 구조가 맘에 드네요. 화장실도 넓고 욕조까지 있으니 더 좋네요. 편히 잘쉬다가 갑니다!,5,8년 전
y_74_281,전주 호텔젠,7567167,이 주변에 여러 모텔들이 많지만 깨끗함에 있어선 점수를 주고 싶네여 단 벽지에 모기 때려잡은 자국들이 많이 있는데 아쉽네여... 아쉽게도 직원의 친절도는 보통이하 ㅠㅠㅠ,3,6년 전
y_74_282,전주 호텔젠,1772204,스탠다드 저렴하게 이용했는데요 욕조가 생각보다 작긴 하지만 그래도 나름 깔끔하고 방이 넓고 좋네용 또 놀러올께요~~,4,9년 전
y_74_283,전주 호텔젠,9409862,"1. 서비스 - 5시 체크인인데, 5시 20분에 가도 청소가 안되어 20분 더 차에서 대기 (프론트에선 엄청 죄송하다 함) 2. 청소 - 급하게 청소하다 보니, 욕조엔 쓰다만 목욕스폰지 - 샤워기엔 사용한 면도기 있음 - 욕조에 물때가 있어 한번 청소하고 썼는데, 뜨거운 물을 받으니 옆면에 때가 불어서 손으로 밀림 - 욕조물에 몸 잠시 담궜는데 물때가 허물벗은 것처럼 둥둥 떠다님 - 현관은 불 켜지는 천장에 검은 곰팡이 천지임. 마계의 문이 있다면 여기서 악마 나올 기세 3. 시설 - 샤워기 높이 조절 고장. 허리디스크 예정 - TV 소리 안나옴 - 컴퓨터 두대 중 하나는 아예 안켜짐(부팅되다 다운됨) - 다른 컴퓨터도 소리 안남 - 컴퓨터가 TV로 연결이 안돼 영화도 못봄 - 폰으로 라디오 들음 ———————좋은점 1. 친절함 TV와 컴퓨터 안되니 너무 심심해서 프론트에 밤늦게 얘기했는데 결국은 못고치고 가셨지만, 두번 세번 계속 왔다갔다 하며 고치려고 노력하심. 못 고친것도 엄청 죄송해하며 돌아가는 발이 안떨어지셔서 겨우 보낼 정도.. 대신 뭐든 필요한거 있으시면 해주시겠다 했으나.. 우리는 TV가 필요했어요... 진짜.. 심심했어요.... 2. 다른 옵션 우리는 전주 놀러오는 이유가 안마의자와 먹방투어인 만큼, 안마의자는 항상 좋았습니다. 청소도 침대는 깔끔했고 세스코도 설치되있어서 이런부분은 안심입니다. 매년 전주 놀러올때마다 들리는 곳입니다. 사장님은 기억 못하시겠지만 우리는 알아요. 좋은 기억, 좋은 사람들이 있어 오는 곳인데, 변하지 않고 그대로 있어주셨으면 좋겠어서 원래 잘 안쓰는데.. 길게 남깁니다. 글 쓰기 귀찮아서 SNS 전혀 안하는 사람입니다. 다음에도 좋은 추억 남길 수 있게 개선 부탁드려요",2,6년 전
y_74_284,전주 호텔젠,링고망고바나나,주차장입구에서 반겨주는 인형보고 조금 놀래긴했는데!!ㅎㅎㅎ 보드게임에 넷플릭스에 안마의자에 진짜 가성비 최고였어요!! 배그도 잘 돌아가고 러브젠가도 있었고ㅎ 퇴실할 때 사장님이 따뜻한 음료 쥐어주셔서 더더 좋았습니다 블랙보리로 🤭 화장실도 사진 그대로여서 좋았어요 화장실 깔끔한 거 좋아해가지고 방 자체도 사진 그대로 에요! 근데 욕조 청소가..🤢 어차피 욕조 이용안하긴 하는데 조금 신경쓰였고 나머지는 깔끔 그자체였어용!! 한달에 1번 내려오는데 전주오면 무조건 여기서 잘겁니다 리뷰 이렇게 주절주절 쓴 거 처음인데 사장님 조금 일하고 돈많이 버세용 (가성비는 그대로 유지해주세요ㅎㅎ) +스타워즈룸에서 야식 드실 분은 테이블이 없으니.. 감안하시길!,4,5년 전
y_74_285,전주 호텔젠,예순여섯살신문,"가려고 한 식당과 위치가 가까워서 정했던 숙소였는데 잘한 선택이었네요. 위치도 좋고, 비품도 넉넉하게 구비되어 있고 샴푸나 바디워시 제품들도 리필하지 않는다고 해놓으신 것들도 인상깊었습니다.",5,3년 전
y_74_286,전주 호텔젠,여기어때고객님,새모텔이라 그런지 풀욕조도 있고 내부가 너무 깨끗했습니다 여긴 무엇보다 컴터 바탕화면에 있는 최신영화를 무료로 볼수 있는게 좋아요 강추합니다,5,9년 전
y_74_287,전주 호텔젠,러브포엠,객실청결 상태도 나쁘지 않았습니다~ 다만!!!! 진짜..... 샤워기 수압 너무 안좋고요...... 안좋은정도가 아니에요..... 머리감으려면 팔떨어지고요..... 변기물은....수압이 없어요ㅋㅋㅋㅋㅋ 그냥 흐르는물ㅋㅋㅋㅋㅋ 그리고 수건걸이는 왜 또 없는지..... 자려고 불을 소등했는데.... 스위치 불빛이 너무 밝아서 수건으로 덮어도 소용이 없네요... 전구하나는 계속 깜빡이고 거울은 인테리어용인지.... 얼굴 제대로 보기 힘든 위치에 있네요ㅜㅠ 콘센트 갯수도 너무 적어요....,3,5년 전
y_74_288,전주 호텔젠,006611,청결했고 불편했던점은 바로바로 조치 취해주셔서 기분좋게 쉬다가 왔어요^^ 자주 방문할 예정입니다~,4,3년 전
y_74_289,전주 호텔젠,호야호야야,전주 놀러온길에 애들도 있고해서 검색해서 왔는데 시설은 모던하니 괜찮고 직원분들도 친절하네요~~ 애들이 있어서 큰방으로 바꿔서 들어갔는데 머리카락등 찌꺼기가 넘 많네요~ 청소는 좀 신경쓰시면 좋을듯 하네요~ 그리고 방이 넘 추워서 떨며 잤네요~ 여기가 고향인 분들은 에어컨 켠다는데 울산에서 온 우리는 넘 춥네요~ 중앙난방이라 온도 올리면 모든방이 올라가 조금 올려 준다는데 그닥 차이는 없었네요~ 방2개 예약해서 왔는데 나머지 부분은 괜찮았습니다~,4,7년 전
y_74_290,전주 호텔젠,2205184,가격도 저렴하고 그럼에도 객실 컨디션이나 크기 위생 및 스낵바 등 매우 우수합니다 응대 또한 친절하시게 해주셔서 기분이 좋네요 객실도 크고 따뜻합니다 답답하지않인요 주차장도 두군데라 불편함이없구요 강력 추천합니다,5,7년 전
y_74_291,전주 호텔젠,65291,"서울에 살면서도 전주여행을 한달에 서너번.. 가는 사람입니다! 여행이라는 말이 어색하기도 해요ㅎㅎㅎ 여기어때 통해서 매번 숙박업소를 결정하는데, 전주에는 Zen만한 곳이 없는듯합니다*.*!! 일단 모든 여자들이 중요시여기는 시설!! 더러운곳 싫잖아요..ㅠㅡㅠ 하지만 zen은 위생관리에 철저한듯 해요. 개인적으로 화장실 깔끔한 곳을 좋아하는데 바로요기...♥ 옷걸이도 딱딱 걸어져있어 외투정리하기도 편하고, 기본적인 넓이 자체도 넓어요! 좁은곳들은 좀 답답한데 호텔처럼 트여있는 느낌^^ 그리고 서비스! 동물잠옷너므좋아여...♥♥♥♥♥♥♥♥♥♥♥♥♥♥ 진짜 오로지 동물잠옷때문에 하트백개..♥♥♥♥♥♥ 펜션에서 이런 서비스 제공하는 것든 종종 봤는데 모텔에도 있다니 미라클ㄹ....너므좋아여..♥♥ 가격도 저렴하고, 서비스 시설 어느것 하나 빠지지 않는 전주 zen!! 강력추천합미다♥",5,10년 전
y_74_292,전주 호텔젠,여기어때 이용 고객,"벌써 다섯번째 방문, 세번째 후기네요~ 어디로 갈지 고민없이 바로 여기로 옵니닿ㅎㅎ 저번에 방문했을때 적립이 된다구 들어서 이번에는 현금으로 계산했는데 원래 카운터에 있으시던 이모가 아니시더라구요 남자분이 계셔서 적립에대한 말씀이없으시길래 물어보기도 좀 그래서 적립을 못하구 왔습니다 ㅠㅠ 어떻게 하는지 확실히 잘 모르겠어요 ㅠㅠ 그리구 저희는 일반실이 다섯시간 대실이어서 일반실이겠지 하구 방들어갔는데 컴퓨터도 두개있구 특실같더라구요ㅠ 일반실이 다 차서 특실주신거같은데 저희에게 일반실이 없다구 설명을 해주셨으면 좀더 좋았을텐데...ㅠ 하지만 올때마다 만족 대만족하며 돌아가기때문에 후회는 절때 없습니다!!!",5,9년 전
y_74_293,전주 호텔젠,205077,저희는 3시간 시간 맞춰나왔는데 앱에보니 대실 5시간이라네요 우와~~~ 과자랑 식빵 ᆞ음료수 입이 즐겁고요 넓고 깨끗한방에 놀랬어요 일회용품도 넉넉해요 다음에 5시간 있다올래요ㅋ,5,9년 전
y_74_294,전주 호텔젠,18072,전주에는 아중리쪽과 시청쪽이 가장 큰모텔촌인데요 전주를 총틀어서 가장좋은모텔입니다 시설도 욕실도 깨끗하고 가격도 저렴합니다 평일 기준 4만원에 주말은 5만원이면 가능하니 전주에 올때마다 항상 들리곤 합니다 주말엔 사람이 만실이여서 못갈때가 종종있어서 아쉽네요,5,10년 전
y_74_295,전주 호텔젠,사랑바위오렌지주스,전주 혁신도시에서 이정도 가격에 이정도 퀄리티는 없을겁니다 아주 좋습니다!!! 주말에는 다소 비싼감이 있을수맀지만 평일에 출장등로 이용하시면 아주 좋습니다 무인결제 시스템도 있고 주차장도 아주 넓고 좋습니다,5,3년 전
y_74_296,전주 호텔젠,shanin,가격대비 매우 좋은 숙소네요. 안마의자가 젤 좋았네요. PC는 조금 느렸지만 겜할만하네요. 욕조쓰고 싶었는데 청소가 덜 되어있어 사용을 못했고 방에 머리카락이 조금있어 거슬리긴했지만 이 가격에 이만한 숙소는 없을듯하네요. 대체로 만족했고 다음에 재방문해도 좋을듯하고 추천합니다.,5,1년 전
y_74_297,전주 호텔젠,1961094,시설 굉장히 예쁘고 깨끗하지만 화장실자체에서 오줌지린내같은게 좀 나고 목욕을하려고 물을 받아서 들어가려고 하려는 찰나에 욕조안에 붙어있던것이 떨어져서 물안에 금속같은것들도 떠다니고 털같은것들도 있고 하더라구요 그게좀 아쉬웠던것 같습니다,4,8년 전
y_74_298,전주 호텔젠,전주찜,정말 오랜만에 방문하는곳입니다 역시 날이추워지니까 난방이 확실하게되는군용 ㅋㅋㅋ 개인적으로 방구조를 티비랑 컴터를 같은방향에서 볼 수 있었음좋겠어요 ㅠㅠㅠ 워낙 티비를 같이보면서 컴터를하다보니.. 그거 말고는 다좋아요!!,5,3년 전
y_74_299,전주 호텔젠,15878051,"사장님 진짜 너무 쏘스윗,,,,, 전주놀러갈일있으면 꼭 들를께요!! 주변에도 추천하고 싶어요!! 실수로 짐을 놓고왔다 말씀드리니 다음날 바로 택배배송해드리고 너무 친절하세용!!! 앞으로도 번창하세용👍🏻💕",5,3년 전
y_74_300,전주 호텔젠,달라요,잘 쉬다가 갑니다~~~,5,1년 전
y_74_301,전주 호텔젠,88350,어제는 일반실에서 묵었고 깨끗하구 너무너무 친절해서 좋앗어요 이틀째묵을때 특실방이에요 308호 욕조가 크고좋았어요 근데일반실이 더 분위기잇고깔끔 특실서 욕조 들어갈때 진짜조심해야함 멍들엇어요 너무미끄러 위험수위 최상,5,10년 전
y_74_302,전주 호텔젠,161672,최근 이용 숙소 중 인테리어나 청결도는 최고수준입니다. 호텔에 가까운 분위기를 갖고 있네요. 침대가 매우커서 잠도 편안히 잤구요. 아쉬운 점은 충전기가 삼성용 충전기뿐이었는데 그것마저 고장이었구요. 조명이 어두워서 밤에 분위기는 좋지만 여성분들 화장할 때 불편하실겁니다. 다음에 전주가면 또 묵고 싶습니다.,4,8년 전
y_74_303,전주 호텔젠,700238,사모님도 친절하시고 항상 고맙게 이용하고 있습니다. 그런데 매번 아쉬운점은 오래된 수건과 침구였는데 이번에 비까지 와서 그런지 수건 침구 가운에서 냄새가좀 나더라구요 세탁에 신경좀 써주셨으면 합니다. 그것만 빼면 아주 훌륭합니다. 담에 또 이용할께요,4,9년 전
y_74_304,전주 호텔젠,2186970,인테리어도 깔끔하고 일회용이 따로 구비되어있어 좋았어용 다만 조금 아쉬운점이있다면 수압이 조금 약했구용 이거빼곤 최상급 숙박시설이였어용 ㅎㅎ 다음에 또 이용해야겠네요~~^^,5,8년 전
y_74_305,전주 호텔젠,자윰인이다,여행와서 어디서 자야하나 하고 고민했는데 서울하곤 전혀다른 넓고 친절하시고 사진하고 똑같은 젠모텔 엄청 잘쉬다 갑니다 깨끗하고 넓고 욕실도 넓고 ㅈ넘조아용ㅎ 한가지 물끓이는통에 곰방이가 ㅠ그거 빼곤 최고였습니다 고대기도 대여해주시공 잘쉬다갑니다 사장님 또 갈께용^^ ㅅㄱ하세용,4,10년 전
y_74_306,전주 호텔젠,여기어때 이용 고객,오자마자 ㅋ 남친이쓰러져서 ㅋ 침대쪽운못찍었어용 아흑 아쉬붐 !! 너무친절하게 사장님이반겨주셔서 어찌나고마우신지 역시젠입니다!! 내일더 하루묵을생각이예요! 전주오시면 여러뷴 젠으로오세요 최고입니다,5,10년 전
y_74_307,전주 호텔젠,1381274,"가격대비 정말 좋습니다. 시설, 가격도 좋고 음료수 등의 먹거리 제공과 가운 및 기본 어메니티도 지급되어서 몸만 오면 되는것도 좋네요. 다만 구석 구석 머리카락이 보이는데 청소는 조금더 신경 쓰시면 좋을듯 합니다",4,9년 전
y_74_308,전주 호텔젠,1134803,"외관은 깔끔하나 방에 들어선 순간 이상한 아저씨?냄새라고 해야할까요 다른냄새와 담배냄새가 섞인듯한 기분나쁜 묘한 냄새가 나서 창문을 열어서 한참을 환기 시켰는데도 냄새가 안빠지고, 청소를 대충했는지 침대옆 테이블 밑에 이전손님이 버린 휴지 뭉텅이가 널부러져있네요. 세면대에서는 온수쪽으로틀면 물도안나오고..샤워기는 멀쩡해서 그나마 다행이었요...다른건 그렇다 치더라도 휴지는 너무 찝찝하네요..",1,9년 전
y_74_309,전주 호텔젠,노곤노곤졸려,직원분(?) 젊은남자사장님 (?)친절하시구용 ㅎㅎ시설도 깔끔하고 다 좋은데 에어컨 소리가 조금 큰거 빼곤 만족합니닷 ㅎ 침대에서 티비도 바로 보여 좋아요,4,5년 전
y_74_310,전주 호텔젠,초록딱총나무,상태좋구요 프론트 사장킴도 친절해서 좋았습니다. 상태좋구요 프론트 사장킴도 친절해서 좋았습니다. 상태좋구요 프론트 사장킴도 친절해서 좋았습니다. 상태좋구요 프론트 사장킴도 친절해서 좋았습니다.,5,3년 전
y_74_311,전주 호텔젠,율xs,여자친구랑 첫 여행이자 여름휴가로 전주 한옥마을 가면서 방걱정에 알아보다 2틀 미리 예약하고 맘편히 갔네요~ 한옥마을하고도 가까워서 모텔에 차놓고 택시타고 한옥마을까지 편하게 갔어요. 날이 너무 더워서 노는동안 힘들었지만 방도 깔끔하고 에어컨도 빵빵해서 정말 푹 쉬고 올 수 있었던거 같아요ㅎ 다음에 전주 가게되면 또 묵고싶은 곳이네요,5,9년 전
y_74_312,전주 호텔젠,호야호야야,시설 괜찮고 직원분들 친절하고 좋았습니다~ 근데 청소가 많이 미흡하네요~ 머리카락등 신체에 있는 털들과 찌꺼기들이 아주많이 그대로 바닥에 있네요 바닥청소는 신경을 많이 더쓰셔야 될듯하고 숙박하는 날 기온이 많이 내려갔는데 난방이 안되서 자는내내 추웠네요~ 장판이 있긴 하던데 방에 냉기가 많아 일어나니 목이 칼칼하니 감기 기운이 생겼어요~ 조금만 신경 더쓰면 좋을듯 합니다~,4,7년 전
y_74_313,전주 호텔젠,여기어때 이용 고객,객실은 깔끔한데 비누나 치약 들어있는 파우치에서 머리카락과 먼지가 나와서 좀 그랬어요 그거 빼곤 전반적으로 괜찮아요,4,6년 전
y_74_314,전주 호텔젠,전주찜,매 주마다 방문하는곳이에요! 객실자체가 깨끗하고 쾌적한 향이나서 매번 기분좋게 방문합니다 컴퓨터를 써야되는 상황이라서 항상 2pc방을 이용하는데 컴퓨터자체도 사양이 높아서 무리없이 이용합니다 ㅎㅎ,5,3년 전
y_74_315,전주 호텔젠,58918,원래 숙박은 5시부터 입실로 알고있었는데 여행갔을때 소나기가 엄청 내리는바람에 추가금 더내고 숙소에 미리 입실해야겠다 싶어 전화드렸었는데 프런트직원분께서 고맙게도 날씨도 그렇고 하니 추가금안받을테니 오시라는 말에 감격ㅠㅠ 가는길 조금 헤매서 택시기사분도 다행히 어디인지 알고계셔가지구 잘 도착했어요 ㅋㅋ 프론트쪽엔 팝콘과 물 먹을만큼만 가져갈수있도록 자유배치 해둔점 굉장히 좋아요!! 물 많이 마시는데 두세개 집어왔다는^_^ 앞에 캐릭터 잠옷도 있는데 입고 놀았어요 ㅋㅋ 반납만 잘해달라고 일반실 묵었는데 분위기도 좋았구 깔끔했어요 화장실 깔끔하고 괜찮았던거 같아요~~~~ 혹 전주여행가시는분들 여기한번묵어보세요 가격도 저렴하니 좋아용 단 전주시내쪽과는 거리가 조금있지만 버스타고 조금만 가면됩니당~~~~,5,10년 전
y_74_316,전주 호텔젠,전주찜,컴퓨터 사용할려고 자주 갑니다 ㅠㅠ 사양은 좋은편인데 생각보다 컴퓨터는 많이 버벅거리는 편이에요 배그는 완전 저사양으로 돌려야 겨우 되니 놀러오는사람들은 참고하시기 바랄게요 전체적으로는 시설이랑은 다 좋습니다!,5,3년 전
y_74_317,전주 호텔젠,862990,직업상 모텔을 자주 접하는데 여기는 가격대비 맘에 드네요~ 사진으로 확인하시면 될것같아요 ㅎ 정말 우와~했습니다 ㅋ 다음번 전주방문에도 또 오고 싶은 곳이네요~,5,9년 전
y_74_318,전주 호텔젠,버젓한평론가,경칩도 지났는데 여전히 춥네요 테라스 딸린 객실은 따듯한 날씨에 이용하세요 저는 몸에 열이 많은 태음인 인데도 찬 기운에 자다 깨서 새벽에 리뷰를 작성하고 있습니다,3,6년 전
y_74_319,전주 호텔젠,똥니미,티비가 작은편인거 말고는 모든시설이 깨끗하고 친절하시고 너무좋아요,5,3년 전
y_74_320,전주 호텔젠,sage0330,출장차 들린곳입니다. 방값은 부산 서울 빼고는 다 저렴해서 가격도 만족스럽고 시설도 무난합니다. 전주 출장 7일동안 다닌곳 중 가장 좋습니다.,4,9년 전
