id,name,nickname,review_content,rating,write_date
y_74_563,전주 호텔젠,7368446,"잘 쉬다 갑니다! 방도 좋은 방 주신 것 같더라고요ㅠㅠ 방도 깨끗하고 시설도 좋아요. 너무 편하게 있다 갑니다. 보드게임, 만화도 있어서 시간 보내기 좋은 것 같아요! 전주 다시 가게 된다면 또 가고 싶네요. 사장님 감사합니다!",5,6년 전
y_74_564,전주 호텔젠,1635757,역시 전주에서 제일 좋은듯해요 다만 물 수압이 좀 약하고 조명이 어두운것 빼구,3,8년 전
y_74_565,전주 호텔젠,feelhot,오늘도 어김없이 따뜻한 옥수수수염차 감사해요~ 그런데 어제 묵은 방은 침대에 전기장판이 안돼서 조금 추웠어요ㅠ,4,5년 전
y_74_566,전주 호텔젠,혜뿡뿡이,시설이랑 청결상태는 매우 좋습니다 인테리어도 맘에들고 새로 지은건지 링소델링한건지는 모르나 좋습니다 한가지 아쉬운건 온수가 오래 틀고 있어야 나옵니다 온수가 잘안나와 미지근한 물로 샤워했네요 다른건 아주 만족합니다,5,8년 전
y_74_567,전주 호텔젠,1634077,올때마다 깔끔하고 좋은거같아요~ 다만쪼금 불편한게 욕실이 방안이아니라 현관옆에 있어서 방에문열고나가야 하는게 불편한거같네요ㅎ 저번에 있었던 방은 안에 있어서 더편했는데 이건조금아쉽네요ㅎ 그래도 구조독특하고 좋긴한거같네요ㅎㅎ,5,9년 전
y_74_568,전주 호텔젠,175134,"서울서 휴가차 전주여행왔습니다~ 테라스 객실 이용하는데 사진 그대로네요~^^ 꼭대기층, 단독방이라 더 맘에듭니다~ 국내여행이지만 호텔젠 테라스 객실에서의 하루가 휴가 분위기 더 업그레이드 시켜주네요~ 분위기 짱입니다~~",5,9년 전
y_74_569,전주 호텔젠,bluesadad,스파도 좋았고 방두 넓고 좋았는데 바닥과 침대시트에 머리카락이 좀 아쉬웠어요,4,6년 전
y_74_570,전주 호텔젠,산을본다,"제가 지방출장이 매주 있어서 많은 숙소를 다녔는데 그 중 최고의 모텔 중에 한곳 이었던거 같아요. 들어가면서 향이 풍부한 커피한잔과 청결하게 정리된방과 욕실, 그라고 안마 의자. 너무 좋았습니다. 강추 합니다.",5,6년 전
y_74_571,전주 호텔젠,조수민23,편하게 잘쉬다 왔습니다. 아쉬운건 이불에 얼룩이 있던거랑 pc연결 했는데 티비에서 소리가 안낫네요 그거빼곤 완전좋구 편하게 쉬다 왔습니다.,4,5년 전
y_74_572,전주 호텔젠,516519,남자친구와 첫여행. 호텔은아니지만 깨끗한곡 찾다가 온곳. 좋아요! ㅋ침대도 편하고 시설도좋구여~ 방마다 토스터기오 있다고하더라구여~ 아침에 간단히 먹기좋아요!다음에 또 전주에오면 여기로.ㅋ 영화잘보겠습니다!,5,9년 전
y_74_573,전주 호텔젠,여기오땨165897,종종이용 좋아요.. 주변 먹을곳도 많고 괝찮다능.....,4,8년 전
y_74_574,전주 호텔젠,1864028,조아여 담에또이용할거에요 모텔냄새도안나고 밝고 좋았어용,4,8년 전
y_74_575,전주 호텔젠,1064759,갈때마다 친절하신 사장님 덕분에 항상 기분좋게 쉬다가요 ㅎㅎ 방도 넓고 깨끗하고 무엇보다 시간이 넉넉해서 아주 좋아요! 이가격에 이렇게 좋은방은 전주에 젠밖에 없는거 같아요 앞으로도 자주 애용할거같아용~,5,8년 전
y_74_576,전주 호텔젠,feelhot,직원분들도 사장님도 친절하구 깔끔하고 이용할때 불편없이 이용하고 있어서 자주 방문하고 있어용,4,5년 전
y_74_577,전주 호텔젠,ckckja,"시설 갑, 침구 굿, 청결함 최고. 아쉬운 점, 온수가 인색함",4,8년 전
y_74_578,전주 호텔젠,빛투비11,"첫전주여행이었는데,기분좋게이용했어요~ 다만 방이 좀쌀쌀했어요ㅠㅜ",3,7년 전
y_74_579,전주 호텔젠,5225125,바닥에 머리카락이 ㅠㅠㅠ 시살은 좋아요 욕조 더럽구,4,5년 전
y_74_580,전주 호텔젠,여기찌,방이 전체적으로 넓어서 좋아요! 하지만 담배냄새가 너무 강한건 어쩔 수 없나봐요..ㅜㅜ,3,6년 전
y_74_581,전주 호텔젠,송충송충,시설은 기대이상으로 좋았으니 청결부분이 많이 미약했습니다..,3,5년 전
y_74_582,전주 호텔젠,제한속도,방컨디션 최고입니다.. 주차장도넓고 무엇보다 샴푸 바디워시가 개봉불가하도록 실리콘 처리까지 아주 맘에 드네요!! 사진보다 방도좋았고 업글해주신건지모르겠지만!? 최고였네요!! 잘쉬다갑니다~~~,5,2년 전
y_74_583,전주 호텔젠,미키,가성비 좋은 모텔이나 소음이 너무 심함 새벽에 해뜰때싸지 주점에서 노래부르는 인간들 땜에 잠을 거의 못잠 환기시키느라 문을 조금 열어놔서 시끄러운가해거 창문을 완벽하게 닫아도 똑같이 시끄러움,5,2년 전
y_74_584,전주 호텔젠,1688991,전화받는 할머니가 아주 쓰레기고객응대하시네요. 뮤슨사용시간 물어보는데 5~6시간이라고 하네요 무슨 개소린지.. 다시물어보니 5시간 내지 6시간이라고하는데 싸가지가없이 말씀하시더라구여 제가 말을 나쁘게한거도 아니고.. 그리고 네 알겟습니다 하니까 대꾸도없이 끊어버리네요,2,8년 전
y_74_585,전주 호텔젠,라벤더색이빨,여행갔을때 들렸는데 가격대비 정말 좋네야 방이나 화장실도 넘넘 깨끗했고 깔끔해서 좋았어요 시설도 잘되어있어서 1박2일동안 정말 편하게 잘돌나가 왔네요 가격부담이 없어서 제일좋아요 다음에 또갈께요,5,9년 전
y_74_586,전주 호텔젠,6409803,사장님께서 정말 친절하셨습니다. 올라가기 전 무한대실에서 편히 쉬다 시간 맞춰 올라가려고 예약 했는데 정말 좋게 이용하고 가요. 조각케이크를 하나 놓고 왔는데 잘 드셨는지는 모르겠네요 ㅋㅋ,5,6년 전
y_74_587,전주 호텔젠,볼록한공주,보드게임도 있고 배그 pc도 있어서 자주 이용하고 있어요~ '편안하게 놀기 좋은 곳'👍,3,5년 전
y_74_588,전주 호텔젠,896957,정말 너무좋아요~♡ 숙박 대실 넘무 저렴 하구 시간도 많이 주시궁 여기 한번 왔다가 다른데 안가그 젠만 이용합니당^^ 사장님두 너무 친절하시구 시설이 너무 맘에 들어요~ 재밌게 놀다 가용~~♡♡♡,5,9년 전
y_74_589,전주 호텔젠,말랑한사진작가,여기무조건강추드려요. 전주가면서 예약했는데 방도 너무 깨끗하고 담배냄새도안나요. 아침에 퇴실때 덥다고 물도 챙겨주시구 친절에 서비스미쳤어요. 전주 또 여행가면 무조건 여기예약또할게요.,5,2년 전
y_74_590,전주 호텔젠,448005,굿굿 오늘 대실해봤는데 주말에 8시간이나 이용가능하다니 짱 좋은것 같아요 남친이 앞으로 계속 여기를 애용하자고 하는데 주변에 모텔들이 많지만 시설만큼은 여자 혼자묵고가기에도 좋다고 생각되네요,5,9년 전
y_74_591,전주 호텔젠,조물주,여러번 방문을해서 더이상 리뷰쓸 말이 없어요. 그냥 사장님 겁나 친절하시고 방도 깔끔하고 좋아요. 그흔한 담배냄새도 안나요. 그냥 믿고 예약 해보세요. 가성비 하난 끝내줍니다. 이상 리뷰끝,5,2년 전
y_74_592,전주 호텔젠,86497,"전주놀러왓다. 들렷는데. 진짜종네여^^^^카운터에언니도되게친절하시궁. 시설도 예상외로좋앗써영 전주오게되면또올듯!!! 편안히보낼수잇어서하루끝을 기분좋게보낼수잇을꺼같아여~~~^^^""",5,9년 전
y_74_593,전주 호텔젠,미친소12,가격 저렴한 시설 깨끗하고 좋아요,4,5년 전
y_74_594,전주 호텔젠,여기어때고객님,서비스가 너무 좋았고요 시설도 깔끔하고 나름 인테리어가 좋았던거 같아요 조금 안타까웠던건 프리미엄 사용 시 샤워실이 너무 어두웠다는 점입니다 그점 말고는 모든게 맘에 들었어요ㅎㅎ,5,7년 전
y_74_595,전주 호텔젠,234734,가본곳중에 시설도 젤깔끔하고 전체적인 상태가 좋아요 이제 대실시간이 좀 줄어서 아쉽지만 그래도 자주 가고싶은곳이네요! 번창하세요 ㅎㅎ,4,8년 전
y_74_596,전주 호텔젠,1383616,전에 대실이 8시간이었는데 바뀌었는지 5시간이라고 하더라구요 조금 당황스러웠습니다 사장님이바뀐건지... 전에 사장님은 고데기대여해도 카운터에 갖다달라는말도 없으셨는데 카운터로 다시갖다줘야한다고하시고 냉장고에있는물도 전혀 시원하지 않았구요... 시설이랑은 깔끔하고 만족했지만 제가말씀드린점에선 좀 그러더라구요,3,8년 전
y_74_597,전주 호텔젠,여기어때 이용 고객,나무? 데코시트?로 꾸며진 방이 분위기가 참 아늑하고 좋았습니다. 싸구려 벽지보다 훨씬 안정되보이고 좋았어요. 화장실이나 방의 청결도 딱히 흠잡을 곳 없었고 잘 쉬다 갑니다.,5,9년 전
y_74_598,전주 호텔젠,퐁퐁포퐁,남자사장님께서 너무너무 친절하셔서 좋아요 전주갈때마다 항상 갑니다ㅎㅎ 방안에 욕실있는방만 가는데요 항상 백프로 만족입니다!!,4,8년 전
y_74_599,전주 호텔젠,3042042,깔끔하고 너무 좋아요 <~ 근처에 술집도 있고 편의점도 많아서 편리 했어요 다음에 또 이용해야겠어요 ㅎㅎ,4,8년 전
y_74_600,전주 호텔젠,협돌낙타,"사장님도 친절하시고 젠가 부르마블 같은게임, 고데기, 넷플릭스 등등 밖에 안나가도 할것들이 많아서 좋아요 이불 푹신푹신 매트리스는 조금 물렁거려요 전반적으로 다 좋았어요 !",5,5년 전
y_74_601,전주 호텔젠,저명한보상,전체적인 분위기가 호텔처럼 정말 너무 좋네요 여자친구도 맘에 들어합니다 스텐다드 였는데 방이 없어서 디럭스로 주셔내요 또 방문하고싶은 인테리어 구조입니다 잘 쉬고 갈수있겠습니다,5,8년 전
y_74_602,전주 호텔젠,8837117,"일단 두번째 투숙였는데 불편사항 말씀 드리니 바로 룸 체인지해주셨구요 직원분인지,매니저분인지 몰라도 마인드가 굉장히 좋으시고 유쾌하신 분이셨습니다~사장님 그직원분 꼭 오래붙들고 계세요^^",4,6년 전
y_74_603,전주 호텔젠,2994840,호텔식에 시설도 좋으면서 깔끔한 침구와 세련된 인테리어 모두 좋았습니다.,4,8년 전
y_74_604,전주 호텔젠,1635757,전주에서 여기가 가장 좋은듯 하네요 와이파이도 잘되고 내부도 깨끗하고 다만 샤워타올 긴게 없어서 아쉽고 방안 불이 좀 어두운 느낌?? 그래도 비데도 있고 욕조 마사지기능 있어서 좋아요,4,9년 전
y_74_605,전주 호텔젠,251600,여기 이블 깔끔하고 담배냄새 안나고 정말 좋아요 하나 아쉬운건 주변에 먹거리가 별로없다는거 빼곤 아쉬운건 하나도 없네요 깨끗하게 잠자고 싶은사람은 정말 괜찬을것같네요,5,8년 전
y_74_606,전주 호텔젠,마틴82,직원분이 친절하셨어요 또 이용하려구요,4,5년 전
y_74_607,전주 호텔젠,격포채석강,깔끔해서 좋기도 하고 주위가 조용해서 담주가 시험인데 여기서 공부도 하는중입니다 감사합니당,5,5년 전
y_74_608,전주 호텔젠,8677624,좋아요 대실시간도 주차장도,4,5년 전
y_74_609,전주 호텔젠,2958014,여행가서 하루 숙박했는데 괜찮더라고요 근데 좀 화장실 조명이 답답한느낌? 다음에 전주 갈일 있으면 다시갈거같긴해요~,3,8년 전
y_74_610,전주 호텔젠,반민주적인카이도,1.일단 가격이 저렴합니다 2.시설 너무 깨끗하고 좋아요 3.만화책 구비 되어 있어 제가 좋아하는 책 볼수 있었어용 4.욕조가 커서 마음에 듭니다 5.또올게요 ㅎㅎ,5,6년 전
y_74_611,전주 호텔젠,엣지있지,와 가격대비 시간 전국 최고라해도 될듯요 서울에는 이런데 없던데 진짜 여행중 찾아서 기절하는줄 시설도 깔끔하고 좋고 시간길구 써비스좋으시구 최고에요 진짜,5,9년 전
y_74_612,전주 호텔젠,은정이올시다,항상오는곳이지만 방도깨끗하고 넓어서 좋은거 같아요 욕조도 넓어서 매일 찾게되네요 ㅠㅠ,5,5년 전
y_74_613,전주 호텔젠,핑크캉골가방,처음방문 제외하곤 만족하지 못해요 항상..,3,5년 전
y_74_614,전주 호텔젠,225032,처음으로 이용해본 ZEN 기본 시설 및 서비스가 너무 좋네요~ 깔끔한객실 빵빵한 에어컨!! 그리고 무엇보다 토스트기로 식빵을 구어 먹을수있는게 좋습니다. 다음부턴 여기로만 올라구요,4,9년 전
y_74_615,전주 호텔젠,여기어때 이용 고객,갑작스런 전주여행으로 산랑이랑 급하게 잡아서 숙박하고 왔는데 시설및 인테리어는 보통 다른데와 비슷한데 담배냄새가 방안에서 진동을 해서 잠을 자기 힘들었음 밤 늦은시간만 아니였다고 그냥 환불하고 찜빌방으로 가고싶었음 ㅠㅠ,1,8년 전
y_74_616,전주 호텔젠,1172339,"어제 이용했습니다. 시설도 정말 마음에 들었지만, 카운터에 계신 사장님(?)이 정말 친절하셔서 좋았습니다. 무난함 이상의 추천할만한 모텔 같습니다.",5,9년 전
y_74_617,전주 호텔젠,51933,전주로 여행을 왔다 하루 숙박을 했습니다 외관 및 시설은 대체로 깔끔하고 괜찮았으나 수압이 많이 약하고 욕조는 물 받는데 시간이 얼마나 걸리는지.. 반신욕 하려다 지쳐서 포기했습니다 고데기도 대여 가능하고 시설도 깔끔해서 나름 괜찮았습니다. 수압 외에는 다른 건 만족하는 편입니다.,2,10년 전
y_74_618,전주 호텔젠,1458028,방이 나무 깔끔하고 좋아요~ 욕실이 깔끔하게 되어있는게 마음에 드네요 또 올게요,5,9년 전
y_74_619,전주 호텔젠,774845,"출장 왔는데 좋아서 여기서 하루 더 숙박했어요. 사장님도 친절하시고 시설 좋고, 깨끗하고, 컴퓨터 성능도 좋고. . 모두 다 최고예요!!!",5,7년 전
y_74_620,전주 호텔젠,800535,들어와보니청소한지 얼마 안된상태라 바닥이 젖어잇던것 말고는 전반적으로 아주 만족햇습니다<~~~~~~,4,9년 전
y_74_621,전주 호텔젠,1360878,예약하고 왔는데 욕조도 크고 전체적으로 조용하고 편히 쉬신다면 추천드립니다! 너무 좋고 다음에 온다면 한번 더 여기에 쉬다가겠습니다 감사합니다~,5,9년 전
y_74_622,전주 호텔젠,bluesadad,501호 이용했어요 발렛도 해주시고 잘 이용했습니다,4,6년 전
y_74_623,전주 호텔젠,448005,따뜻한 음료도 하나씩 가져갈슈도있어서 좋아요!! 시설 좋은건 말할필요도 없구요,5,9년 전
y_74_624,전주 호텔젠,2451119,침대가 너무 푹신하고 좋은데 친절한지는 모르겠네요,3,7년 전
y_74_625,전주 호텔젠,696734,주차장도 넓고 창문도 크고 침대도 넓고 인테리어도 고급스럽고~ 어디하나 빠지는게 없는 모텔입니다! 완전 손꼽혀요 지금까지 닸던데중에서,5,9년 전
y_74_626,전주 호텔젠,feelhot,이용할때마다 편히 기분좋게 이용하구 있어요~^^,4,5년 전
y_74_627,전주 호텔젠,38532,한옥마을 이후엔 젠이죠 ㅋㅋㅋㅋㅋ 짱짱 여기 사장님도 진짜 친절하시고 대실시간도 모 나름 나쁘지 않고 앞으로 자주 이용할 생각입니다,5,10년 전
y_74_628,전주 호텔젠,레몬에이드쥬스,주차서비스좋고 좋아요,4,6년 전
y_74_629,전주 호텔젠,seusanry1,"덕진공원 근처만 이용하다가 처음 와봤는데 , 아주만족합니다. 굉장히 친절하고 시설도 깨끗합니다. 팝콘, 커피 좋네요.. 잘 묵고 갑니다~^^",5,7년 전
y_74_630,전주 호텔젠,고영삼2,피곤상태에서 찾아간 곳이기에 넘 좋았어요 친절하고 편안하여 다시또 찾고싶은곳 이였습니다. 감사드리고 잘되시길 바랍니다 번창하세요 !,5,8년 전
y_74_631,전주 호텔젠,똘똘이v,솔직히 일반실이랑 테라스실이랑 가격차이 안나는데 연인끼리 분위기 내려면 테라스실이 나을꺼 같네요 평일가면 가격도 저렴하고 좋은거 같아요,5,10년 전
y_74_632,전주 호텔젠,1109771,둘어가자마자 주차 저리가 없었는데 사장님 먼저 나오셔서 주차 해결해주시고 친절하시구 ㅎㅎ 정말 깔끔하고 시간 무지~ 길고 참 좋군오 ^_^,5,9년 전
y_74_633,전주 호텔젠,43016,모텔시설이랑 분위기 최고에용ㅎ 전주여행갔다가 들렀어용ㅎ 방넓고 비품도 잘구비되있어서 편하게 잘이용했어용ㅎ 사장님도 친절하세용^^,5,10년 전
y_74_634,전주 호텔젠,수목원금붕어,조 아 여 ㅎㅋㅎㅋㅋㅎㅋㅎㅋㅋㅎㅋㅎㅋㅎㅋㅎㅋㅎㅋㅎㅋㅎㅋㅎㅋㅎㅎㅋㅎㅋㅋㅋㅎㅋㅎㅋㅎㅋㅋㅎㅋㅎㅋㅎㅋㅎㅋㅎㅋㅋㅋㅎㅋㅋㅎㅎㅋㅎㅋㅎㅋㅎㅋㅎㅋㅎㅋㅎㅋㅎㅋㅎㅋㅎㅋㅎㅋㅎㅋㅎㅋㅎㅋㅎㅋㅎㅋㅋㅎㅋㅎㅋㅎㅋㅎㅋ,5,3년 전
y_74_635,전주 호텔젠,1617494,대실을 이용했는데 편안한 분위기가 좋았습니다. 일단 항상 깔끔해서 자주 이용하게 되네요.,4,8년 전
y_74_636,전주 호텔젠,1232383,평일에 대실이용하고왓는대 ....가격도완전저렴한대 무한대실이라니 ㅠㅠㅜㅜ짱이에요 완전좋아요 시설도좋고 사장님도친절하시고 또올게요!!,5,9년 전
y_74_637,전주 호텔젠,잽싼인삼차,넷플릭스 좋아요👍🏻👍🏻👍🏻안마기를 전 실에 놓으심 어떨가요....🥰,5,5년 전
y_74_638,전주 호텔젠,219141,"국내 여행중 첫날 묵게되었어요 시설이며 서비스며 청결이며, 나무랄데가 없네요~!! 다음에 전주에 가게되면 재방문의사100%입니다 ㅋ",5,9년 전
y_74_639,전주 호텔젠,kks77,"안녕하세요~~^^ 출장길에 두번째이용했는데~~ 넘 편하게 잘 쉬고 갑니다. 가성비 최고, 청결, 서비스 좋습니다.ㅎ 감사합니다.",5,8년 전
y_74_640,전주 호텔젠,887386,깔끔하게 잘 이용했어요 그런데 이본에 눅눅한 냄새기 살찍 난게 아쉬워요 전에는 안닜았는데,4,6년 전
y_74_641,전주 호텔젠,1880391,객실도 깔끔하구 자주 이용하는데 매번 만족합니다 ㅎㅎ 먹거리도 많구 좋습니다 ㅎ ㅎ,4,9년 전
y_74_642,전주 호텔젠,3362028,완전좋아요 안에 욕조도잏구 지은지얼마안된거같아서 깨긋하네요 단점은굳이 뽑다면 복도에서담배냄새나는거? 근데별로신경안쓰셔도될듯ㅎㅎ,5,8년 전
y_74_643,전주 호텔젠,feelhot,이용하는데 불편함이 잘묵고 왔어요~,4,5년 전
y_74_644,전주 호텔젠,370238,피시방 시스템이 제일입니다. 오디션 게임렉만해결되길...................................................,4,9년 전
y_74_645,전주 호텔젠,슈니슈니416,직원분들도 친절하시고 시설도 좋았고 인테리어도 이쁘구요~~ 객실도 깨끗하고 넘나 맘에 들었어요. 편하게 잘 쉬다가 갑니다ㅎㅎ,5,8년 전
y_74_646,전주 호텔젠,8980057,주변 노래방소리가 진동으로 다 느껴짐,3,6년 전
y_74_647,전주 호텔젠,가슴절인사랑,청소상태 깔끔합니다 내부 인테리어도 이쁘네요 방안 공기두 따뜻하구 주전부리도 있어서 좋았습니다 담에 또 방문 하고 싶네요,5,9년 전
y_74_648,전주 호텔젠,아중리골프님,좋아요 최고예요 만족해요,4,6년 전
y_74_649,전주 호텔젠,출장매니아,매번 출장시 마다 방문드립니다 전주에서는 청소상태 좋고 최고 인거 같습니다 빵이나 커피 서비스도 좋구요 번창 하십시요,5,9년 전
y_74_650,전주 호텔젠,499050,시설 굿 청결 굿 출장때문에 모텔 많이 이용해 봤지만 여기만큼 서비스 청결상태 좋은곳 뮷 봤네요 너무너무 좋습니다^^,5,9년 전
y_74_651,전주 호텔젠,1617494,잘 이용하고 갑니다. 잘 쉬었어요. 역시 깔끔하고 서비스가 좋아 너무 좋아요.,4,8년 전
y_74_652,전주 호텔젠,bluesadad,너무 좋았는데 청소상태가 좀...,4,6년 전
y_74_653,전주 호텔젠,701212,너무너무 만족스러운 방이엇습니다. 다른곳이랑 틀리게 방이 깔끔하고 욕실도 깨끗 하고 물도 콸콸 잘 나와서 좋은 밤을 지내고 갑니다^^ 또 전주로 출장을 가게 되면.. 예약을 하고 다시 방문하겠습니다^^ 더욱더 대박나세요~^^,4,9년 전
y_74_654,전주 호텔젠,1109771,늘 좋습니다 항상 깔끔하고 청결해요. 요즘은 슬슬 객실이 춥네요 객실 따숩게 하는게 없어서 아쉽ㅎㅎ 전기장판은 잘 됩니다 ㅋ,5,8년 전
y_74_655,전주 호텔젠,499050,10월에만 여기 모텔 너댓번 투숙한거 같네요~여전히 시설 청결 서비스 마음에 듭니다 끝으로 사장님도 친절하시네요^^,5,9년 전
y_74_656,전주 호텔젠,여기어때 이용 고객,두번째 이용입니다. 역시나 청결하고 조용해서 다음에 또 이용할 생각입니다. 앞으로도 객실 청결 지금처럼 신경 써주세요^^,5,8년 전
y_74_657,전주 호텔젠,101335,매번가도 좋네요 카운터도 친절하시고 시설도 깔끔한게 여기말곤 다른곳 안간지가 벌써몇달째네요 호텔젠 정말 추천합니다~~~,5,9년 전
y_74_658,전주 호텔젠,63232,항상올때마다 느낀지만 정말깨끗하네요 오늘도 쉬고가면서 너무 즐거웠습니다 언제나 반겨주시는 젊은사장님과 낮에퇴실할때 항상 반갑게 인사히니주신는 사모님 너무친절하셔서 언제나 젠을 찾게되네요 시설또한 전주에서 최고인거같아요 깨끗함도 남다르고 특히 이벤트를위한동물잠옷등 너무다양한 서비스에 항상 만족합니다 번창하세요,5,10년 전
y_74_659,전주 호텔젠,1553914,화장실 환기가 잘 안된거 같아요,3,6년 전
y_74_660,전주 호텔젠,1161948,좋았습니다. 비교적 깨끗했습니다. 친절했습니다. 추천할 수 있겠습니다.,4,9년 전
y_74_661,전주 호텔젠,101335,와 정말 어제처음갓는데 시설도 너무깨끗하고 이가격에 간다는게 신기할정도네요 근처 다른곳보다 월등하게 괜찮은거 같아요,5,9년 전
y_74_662,전주 호텔젠,1676881,출장때문에 자주 오지만 올 때마다 객실이 달라 새롭네요 :) 조용하고 깔끔하고 친절하고 무엇보다 편안합니다 ^^,5,8년 전
y_74_663,전주 호텔젠,150240,자주 이용하는데 항상 사장님이 방겨주셔서 너무 좋아요!! 서비스 객실청결등 전주에서 손가락안에 드네요! 번창하세요,5,9년 전
y_74_664,전주 호텔젠,5822490,7만원 방중 최고의방 공훈일인데불구하고 싼가격에 최고의시설 안마의자 월풀욕조 커플피시 테라스 전주여행의 꽃은 방이였다,5,7년 전
y_74_665,전주 호텔젠,8100413,구석구석 신경써서 청소해야겠어요. 침대커버도 즉시 교체해주시고요.,2,6년 전
y_74_666,전주 호텔젠,515708,507호 였고 깔끔하고 좋았어요 다만 아쉬운게 영화 다운받아보려했는데 컴터가 잘안됐구요 화장실이 전등이 나간건지 너무 어둡습니다ㅠ,4,8년 전
y_74_667,전주 호텔젠,1880391,평일대실시간이 길어서 너무좋아요 사장님도 친절하시고 자주애용합니다 짱이에용,3,9년 전
y_74_668,전주 호텔젠,3486233,가격면에서 그정도 시설이면 괜찮았어요 단! 좀 추워요 방이 넓어서 그런지,3,6년 전
y_74_669,전주 호텔젠,Kandoo,가격대비 최고입니다! 컴퓨터가 안되서 방 옮겨주신거 감사합니다~ 직원분도 착하시고 안마의자 너무 좋아요 ㅋㅋ,5,6년 전
y_74_670,전주 호텔젠,499050,여기 3번째 방문입니다..정말 청결하고 주차공간도 넓어서 너무 좋네요~전주 출장올때 zen으로 와야되겠네요,5,9년 전
y_74_671,전주 호텔젠,앙뇽하세요오,다좋은데 전기요가잘안되서 추웠어요ㅠㅠ 몇번갔는데 그때마다 전기요가안되드라구요.. 그거빼면 완전좋아용 사장님도 친절하시고 시설도 굿!,4,9년 전
y_74_672,전주 호텔젠,수도권템플릿,우선 집주인 아저씨가 전화직접해주시고 굉장히 좋았음 마중까지나오셨음 그냥 여러군데ㅜ다녀봤는데 가성비 값이 시설 도 좋았음 호텔 모텔요즘 구분안가지만 확실히 몇성급 호텔은 아니지만 시설만큼은 호텔이었음 나가는시간도 한번도전화안오고 그냥편하게 5시정도까지쉬었음 만화책도있고 컴터도있싸암,5,7년 전
y_74_673,전주 호텔젠,84452,후기보고 처음 방문하는데요 너무 시설도 좋고 깨끗하고 친절하고 대만족입니다 침대도 좋습니다 재방문의사있습니다~~~,5,7년 전
y_74_674,전주 호텔젠,바듀,큰 수건이 없다는거 빼곤 좋았습니다! 월풀도 잘되고 침대도 푹신하고 방도 깨끗해서 좋았습니다!다음에 또 재 방문할 의향있습니다!,4,7년 전
y_74_675,전주 호텔젠,악착한네트워크,청결상태 좋았고 직원분 너무 친절해서 좋았습니다.,4,5년 전
y_74_676,전주 호텔젠,여기숙소어떤가요,담배냄새가 너무 심하네요.... 치킨흘린곳도 있고 나머진 괜찮아요,3,5년 전
y_74_677,전주 호텔젠,현1245,시설 청결 서비스 뭐하나 부족한게없습니다 진~~~~~짜 너무친절하세요 처음왓는대 단골이 될것같아요~~~~!!,5,6년 전
