id,name,nickname,review_content,rating,write_date
y_76_607,전주 화려한외출2,각박하고가냘픈명동,저가 항상 전주가면 애용하는곳중 한곳입니다. 집같은 편안한 공간 역시 !! 여전히 놀러가면 항시 잘해주시는 친절한 사장님 ~ 다음에도 또 들리겠습니다 ㅎㅎ 잘 놀다갑니다 감사합니다 ~,5,2년 전
y_76_608,전주 화려한외출2,각박하고가냘픈명동,저가 항상 전주가면 애용하는곳중 한곳입니다. 집같은 편안한 공간 역시 !! 여전히 놀러가면 항시 잘해주시는 친절한 사장님 ~ 다음에도 또 들리겠습니다 ㅎㅎ 잘 놀다갑니다 감사합니다 ~,5,2년 전
y_76_609,전주 화려한외출2,각박하고가냘픈명동,저가 항상 전주가면 애용하는곳중 한곳입니다. 집같은 편안한 공간 역시 !! 여전히 놀러가면 항시 잘해주시는 친절한 사장님 ~ 다음에도 또 들리겠습니다 ㅎㅎ 잘 놀다갑니다 감사합니다 ~,5,2년 전
y_76_610,전주 화려한외출2,각박하고가냘픈명동,저가 항상 전주가면 애용하는곳중 한곳입니다. 집같은 편안한 공간 역시 !! 여전히 놀러가면 항시 잘해주시는 친절한 사장님 ~ 다음에도 또 들리겠습니다 ㅎㅎ 잘 놀다갑니다 감사합니다 ~,5,2년 전
y_76_611,전주 화려한외출2,각박하고가냘픈명동,저가 항상 전주가면 애용하는곳중 한곳입니다. 집같은 편안한 공간 역시 !! 여전히 놀러가면 항시 잘해주시는 친절한 사장님 ~ 다음에도 또 들리겠습니다 ㅎㅎ 잘 놀다갑니다 감사합니다 ~,5,2년 전
y_76_612,전주 화려한외출2,각박하고가냘픈명동,저가 항상 전주가면 애용하는곳중 한곳입니다. 집같은 편안한 공간 역시 !! 여전히 놀러가면 항시 잘해주시는 친절한 사장님 ~ 다음에도 또 들리겠습니다 ㅎㅎ 잘 놀다갑니다 감사합니다 ~,5,2년 전
y_76_613,전주 화려한외출2,각박하고가냘픈명동,저가 항상 전주가면 애용하는곳중 한곳입니다. 집같은 편안한 공간 역시 !! 여전히 놀러가면 항시 잘해주시는 친절한 사장님 ~ 다음에도 또 들리겠습니다 ㅎㅎ 잘 놀다갑니다 감사합니다 ~,5,2년 전
y_76_614,전주 화려한외출2,푹신푹신한팔보채,최악입니다. 정리가하나도 안되어있고 제대로된 의자도 없고 옛날 할머니집 느낌에 특히 담배냄새가 너무 심합니다. 절대 비추천 이가격이면 그냥 4~5천원 더 주고 깔끔한곳으로 가는걸 추천드려요,0,2년 전
y_76_615,전주 화려한외출2,린여우,방이 넓고 꽤 깨끗해서 잠자기 좋았어요! 전주 놀러가서 묵기 좋은 곳 사장님도 착하세요!,5,3년 전
y_76_616,전주 화려한외출2,짱구는안못말려,숙박비는 저렴에서 만족합니다! 객실 책상이랑 의자가 조금 불편했습니다! 저렴한 가격으로 숙박 원하시는 분들은 여기로 오시면 좋을거 같습니다!! 그리구 아쉬웠던 부분은 조금만 친절하게 대해주셨으면 하는 바램입니당!!!,3,1년 전
y_76_617,전주 화려한외출2,오늘컨셉은뇌출혈,"가격이 저렴하고 주차장 넓은것 빼고는 솔직히 청결상태라던지 시설이 좋은지는 전혀모르겠어요.. 시설개선이 필요한듯합니다. 시설,청결 중요하게 생각하시는분은 비추입니다. 여친이 방보고 다른곳 자기가 계산할테니 나가자했으면 어느정도인줄알겠죠?..",2,3년 전
y_76_618,전주 화려한외출2,장두노미1,가격이 싸서 그냥 급하게 잡느라 예약도 다음날로 해버렸네요 로비에서 사장님인지 직원분인지 모르겠지만 오천원을 더 결제하고 들여 보내주셨는데 취소하고 제가 다시 결제하면 오천원을 더 결제 할 필요가 있을까 싶었는데 피곤하기도 하고 빨리 쉬고 싶어서 그냥 오천원 더 버시라고 결제했네요 시설은 너무 오래된곳이라 기대는 안했지만 객실 컨디션은 다시 안잡고 싶을정도네요,5,3년 전
y_76_619,전주 화려한외출2,삥뽕빵야,전주 오면 거의 매일 여기서 머물다 가요!! 이런 가격에 가성비 좋게 매일 자고가요~~ 그 다음날 대실도 또 빌렸네요ㅎㅎ 넷플도 잘되고 무엇보다 책상이 커서 밥 먹기 너무 좋았어요ㅎㅎ,5,3년 전
y_76_620,전주 화려한외출2,남다르고쾌활한마라도,오랜만에전주가서이용함,5,1년 전
y_76_621,전주 화려한외출2,2143126,시설도 깔끔하구 내부도 넓어서 좋았습니다ㅎㅎ 퇴실시간도 1시라서 넉넉하게 준비할수있어서 좋았구요 가격도 적당해요 ㅎㅎ 급하게 숙소구한거라 걱정했는데 너무 맘에들었어요,5,8년 전
y_76_622,전주 화려한외출2,아흔한살별명,사장님도 친절하고 괜찮아요,5,3년 전
y_76_623,전주 화려한외출2,난내일도,방에서 고기 냄새같은게 너무 심하여 창문 열고 두시간 나갔다 왔네요. 방에서 고기 먹은 기존 손님들 잘못이 제일 크지만 그래도 손님 받기전 냄새가 많이나면 방향제라도 뿌린후 손님 받으셔야될거 같습니다.,1,6년 전
y_76_624,전주 화려한외출2,상상하자,주차장은 운동장 수준. 객실은 실망.,3,1년 전
y_76_625,전주 화려한외출2,아흔째폭격기,친절하시고 넘 조아용,5,3년 전
y_76_626,전주 화려한외출2,Agell,청소는 깔끔하게 잘되잇고 화장실이조금 오래되보이긴 햇는데 관리는 잘되있는덕에 불편한거없이 잘쓸수 있습니다 수압도 보통으로 적당하고 따듯한물도 잘나옵니다.,3,6년 전
y_76_627,전주 화려한외출2,드루와1010,가성비 짱!!! 화장실과 욕실 분리되어 있어서 편한듯..불편한듯.. 잘 쉬었다가 갑니다.,4,5년 전
y_76_628,전주 화려한외출2,etjepense,좋아좋아좋아좋아요좋아,5,3년 전
y_76_629,전주 화려한외출2,GC14988733394,친절하고 청소깨끗해요,5,1년 전
y_76_630,전주 화려한외출2,GC14988733394,친절하고 청소깨끗해요,5,1년 전
y_76_631,전주 화려한외출2,11165084,아주머니가 청결에 매일 신경쓰셔서 매일 침대시트랑 다 바꿔주셨어요 제 클렌징 오일 소분해간것도 버리긴하셨지만... ㅎㅎ 좋은 추억 만들다 갑니다,5,5년 전
y_76_632,전주 화려한외출2,8747602,생가보다 커서 좋았습니다!! 화장실과 샤워실이 따로 있는점도 좋구요!!^^,5,5년 전
y_76_633,전주 화려한외출2,4856480,방도 넓고 세면대가 침대가까이에 있어서 좋았어요~! 방이 넓어서 추울거같았는데 엄청 따듯하더라구요 편히 쉬다 왔습니다 다음에 또 이용할께요,5,7년 전
y_76_634,전주 화려한외출2,멋쟁이피자,방이 넓고 좋았는데 화장실 욕조가 반지하같이 생겨서 너무 웃겼네요 화장실 벽이 안에서 보이고 밖에서도 보이는 유리로 되어있어서 너무 민망했어요 환풍기도 상태도 좋지않았고요 방바닥이 따뜻한거 외에는 좋았던 점이 딱히 없는 것 같네요,4,6년 전
y_76_635,전주 화려한외출2,5654726,객실 직원분 모두 맘에들어요 ^^,5,5년 전
y_76_636,전주 화려한외출2,kkkkhh,깔끔하고 좋아요 항상 친절하세요 ㅎㅎ,5,3년 전
y_76_637,전주 화려한외출2,9367590,사장님이엄청친절하시네요ㅎ 저흰주말부분데 주말올때마다여기로결정했어용ㅎ,5,4년 전
y_76_638,전주 화려한외출2,6807839,시설은 가격대비 만족합니다. 멀티탭이 꺼져있어서 인터넷이 안됐는데 프론트에서 아주머니는 잘 모르신다고 하셔서 그부분이 아쉬웠고 그외에는 만족합니다.,3,6년 전
y_76_639,전주 화려한외출2,타대오,시설은 좀 오래되었으나 청소상태 양호하고 직원이 친절합니다,4,6년 전
y_76_640,전주 화려한외출2,느낌적인느낌으로,나름 괜찮았습니다 !! 다음에 또 머물다가 갈거 같아요!,5,3년 전
y_76_641,전주 화려한외출2,참된이고르,출장 때마다 고정으로 방문하는 곳.,4,4년 전
y_76_642,전주 화려한외출2,7872824,저렴해서 자주갓는데 이불 배게에 담배냄새가 좀 심햇어요ㅜ,4,6년 전
y_76_643,전주 화려한외출2,걸쭉한조어,항상 이용하고 있지만 정말 친절하시고 숙소도 깨끗하고 편안하게 잘 쉬다 가는 것 같습니다 잘한런아니ㅇ 잘한런아니ㅇ 필요하면 줘서 너무 좋아요!!!ㅎㅎ 앞으로도 계속 이용할예정입니다~~,5,2년 전
y_76_644,전주 화려한외출2,14315599,정말 빠짐없이 다 좋습니다! 다만 한가지 아쉬운 점이 있다면 투pc를 지탱하는 책상이 너무 울퉁불퉁해서 마우스 패드 위로도 마우스 사용에 어려움이 있습니다 ㅠ 게임을 하면서도 이것 때문에 여러번 낭패를 겪었구요... 항상 애용하고 있습니다 ㅠ감사합니가,4,4년 전
y_76_645,전주 화려한외출2,호*****,깔끔하고 친절하고 좋아요,5,1년 전
y_76_646,전주 화려한외출2,부기부깅,욕실안에 화장실문이 따로있는 독특?한 구조네요ㅎㅎ 욕조가 아래로 푹 꺼져있는듯한데 이것도 신기했어요ㅋㅋ 에어컨이 오래되서 덜 시원했는데 선풍기가 있어서 틀어봣더니 방이 확 시원해졌네요ㅎㅎ,5,1년 전
y_76_647,전주 화려한외출2,13144537,"시설,서비스 전부다 대만족! 방 엄청 깔끔하고 가성비좋아요 13시퇴실이라 시간넉넉하고 좋아요 다시 갈생각이 바로 들었어요",5,4년 전
y_76_648,전주 화려한외출2,자유분방한블루베리,"시설 인테리어는 복도만 화려해요 방안은 그럭저럭 사장님인지 직원인지 여자분 두분을 뵈었는데, 두분다 불친절해요 충전기 8핀 대여 해 달라니 아이폰이라고 해야지 왜 8핀 달라하냐고 핀잔을 주네요 어이상실… 연세가 있어 몰라서 그럴수도 있겠지만 손님한테 그렇게 응대하는건 아닌듯 충전기 대여시 보증금 5천원을 냈기에 반납시 돌려 받아야 하는데 그때도 엄청 귀찮다는듯 짜증내며 주셨네요 다시 갈일 없겠지만 전국일주 중에 편히 쉬고 싶었는데 기분 드럽게 하루 잤네요",2,3년 전
y_76_649,전주 화려한외출2,태*****,오래되어 시설은 좀 낙후됐으나 가격적인면에서 메리트,5,2년 전
y_76_650,전주 화려한외출2,숲속의방아간,방은적당한편이고창문이있어환기도잘할수있어좋았습니다. 건물이좀오래된면이있어서시설은조금낡은편입니다. 방은적당한편이고창문이있어환기도잘할수있어좋았습니다. 건물이좀오래된면이있어서시설은조금낡은편입니다.,5,3년 전
y_76_651,전주 화려한외출2,싱싱한감자전,친절하고 좋아요 자주이용해요,5,1년 전
y_76_652,전주 화려한외출2,8717002,싼 가격에 시설도 너무 좋고 특히 퇴실 시간이 늦어서 좋았습니당ㅎ,4,6년 전
y_76_653,전주 화려한외출2,Gartz,넓은 주차장이 반겨 주는 곳으로 쾌적한 분위기 따뜻한 방 친절한 주인장이 반겨 주는 곳입에요 잘 쉬었어요,5,6년 전
y_76_654,전주 화려한외출2,싱싱한감자전,자주이용해요 친절하고좋아요,5,1년 전
y_76_655,전주 화려한외출2,김멍멍,주차장있음 욕조있음 에어컨 선풍기 있음 충전기 없음 수압 없음 맛집 가까움,5,1년 전
y_76_656,전주 화려한외출2,바듀,"방이 좀 어둡고 청소가 좀 덜된건지 누가 사용한 면봉이 책상에 있고, 머리카락이 베개에 묻어있는 거 빼고는 괜찮았어요.",3,5년 전
y_76_657,전주 화려한외출2,도톰한어른,가격대비에 깔끔하고 시설도 좋고 방도크고 좋았습니다^^ 사장님도 친절하셔서 다음에 또 재방문하겠습니다~!,5,6년 전
y_76_658,전주 화려한외출2,타대오,오늘도 잘 쉬고 올라가요 방이 추웠어요 날씨가 추운날에는 보일러를 틀어주는 여유를~~,4,4년 전
y_76_659,전주 화려한외출2,레드포맨,역시 피씨 사양대로 렉도없이 좋네요 ^^ 린스는 일회용이라 그건 좀 불편했네요~ 다음에 또 이용할게요,5,5년 전
y_76_660,전주 화려한외출2,팀와,안녕하세요. 자주 이용하는 사람입니다~ 화장실이랑 시설도 깨끗하고 방 크기도 좁지 않아서 좋은 거 같아요 항상 기분 좋게 이용하고 있습니다~ 조만간 또 이용할게요!! 감사합니다.,5,4년 전
y_76_661,전주 화려한외출2,양세바리발,대실 시간이 다른 곳에 비해 길다는 장점이 있고 가격대비 시설도 만족스러웠습니다.,3,5년 전
y_76_662,전주 화려한외출2,햇살이가,잘 쉬고 갑니다 좋은 하루되세요,4,1년 전
y_76_663,전주 화려한외출2,똥강아지네1,가격대비 굳! 서울로치면5만원 더받아야할,5,5년 전
y_76_664,전주 화려한외출2,궁핍한반딧불이,넓고 좋아요! 최고입니다. 욕실 청소만 좀더 신경써 주셔요,4,6년 전
y_76_665,전주 화려한외출2,수림서원민소매,"친절해요사장님~!! 기분좋게 있다가요 사진보단 조금 노후된겅 사실이지만 그래도 굿굿 또올게요""!",5,5년 전
y_76_666,전주 화려한외출2,중심적인샴페인,매우 저렴하고 깔끔해서 좋았는데 화장실은 청소를 안하신건지 변기에 누가 파스때서 버린게 있어서 당혹스러웠네요 그거빼곤 다 좋았습니다,3,1년 전
y_76_667,전주 화려한외출2,hade4168,바닥에 뭐가 밟히고 머리카락이 많았지만 그냥 하루 잘묵고 갑니다,5,3년 전
y_76_668,전주 화려한외출2,7069497,오래된 건물인지 먼지가 많아요 청소상태도 좀 실망스럽구요,4,6년 전
y_76_669,전주 화려한외출2,야외식물원승무원,사장님 친절하시고 깨끗하고 좋아요!! 사장님 친절하시고 깨끗하고 좋아요!! 사장님 친절하시고 깨끗하고 좋아요!! 사장님 친절하시고 깨끗하고 좋아요!! 사장님 친절하시고 깨끗하고 좋아요!!,5,2년 전
y_76_670,전주 화려한외출2,Londoner,"넓어서 좋아요! 가성비는 진짜 좋습니다. 한옥마을, 야시장이 열리는 남부시장 그리고 막걸리 거리에서 멀지 않아요 전반적으로 깨끗하나 욕실 타일에 곰팡이가 살짝 있어서 아쉽네요.",4,5년 전
y_76_671,전주 화려한외출2,하얀색폭스하운드,"출장오면 자주,,,오는곳,,,시설이 년식이 쫌 있긴하지만,,,이가격이면 혜자죠,,,,주위에 식당도 많고 가볍게 한잔하고,,,자기에도 좋아요,,,,물가도 오르는데,,,가격이 좋네요 출장자주오는데 자주올께요",4,2년 전
y_76_672,전주 화려한외출2,밝고유머러스한시대,조하요오오ㅗ오오오오옹,4,1년 전
y_76_673,전주 화려한외출2,2931314,전화로 문의한 내용도 친절하게 설명해주시구 ^^ 청결하고 좋았어요 다시 이용할마음이 생깁니다~,5,8년 전
y_76_674,전주 화려한외출2,공쥬여신님이다,깔끔하고 좋았습니다~~~~~~~~~~ 나중에 또 오고 싶네요~~~~~ 방이 진짜 아담해요 숙박 보다는 대실이 알맞는 거 같아요!!!!!!!!!!!! 잘 쉬다 갑니다!!!!!!!!!!!,5,3년 전
y_76_675,전주 화려한외출2,각박하고가냘픈명동,몇년째 항상자주오는데 사장님??은 변함없이 여전히 친절하십니다! 자주오셔서 그런지 이제항상 좋은방으로만 주십니다ㅎㅎㅎ 내부시설도 몇년째 청결유지를 하고있어서 넘좋습니다 앞으로도 자주올게요 사장님??✋,5,3년 전
y_76_676,전주 화려한외출2,채윤채윤,전주 공연 보러 가서 늦은 시간에 체크인 했는데 그 시간에도 사장님 너무 친절하게 안내해주셔서 감사했어요 ! 물어보는 것도 대답 너무 잘 해주셨고 객실 상태도 너무 좋았고 가성비 최고였어요 !!,5,3년 전
y_76_677,전주 화려한외출2,태*****,업무상 예약했는데 만족스럽습니다!,5,2년 전
y_76_678,전주 화려한외출2,곰광,언제가도 친절한 사장님과 저렴한 가격과 좋은 시설로 항상이용합니다. 다음에도 갈게요~!!,5,2년 전
y_76_679,전주 화려한외출2,곰광,"매 주말마다 가지만 친절한 사장님과 좋은 시설, 넓은 주차장까지 부족한게 하나도없습니다~",5,2년 전
y_76_680,전주 화려한외출2,시큼한척후병,객실은 크고 좋아요 구조도 독특하고 깔끔해요 화장실에 욕조도 있어 좋았어요 그런데 화장실에 곰팡이가 많아요,4,1년 전
y_76_681,전주 화려한외출2,2343521,일회용컵 대신 유리컵만 쓰신다고 하셔서 일단 들어갔는데 컵상태가 최악이네요 찝찝해서 결국 종이컵 사왔네요 씻긴하는건지... 다른건 괜찮았어요.,2,5년 전
y_76_682,전주 화려한외출2,johnny12,컴퓨터 잘되는 방을 주셔서... 편안하게 업무도 잘보고 갑니다. 너무 감사합니다.,5,5년 전
y_76_683,전주 화려한외출2,1156504,온돌방을 예약했는데 전기장판방을 주셨어요ㅋㅋ 방 공기가 후끈한걸 바라서 온돌방을 선택한건데 공기는 차가워서 목이따갑고 장판자리만 따뜻하고 방 전체 난방을 높여달라고 말씀드렸는데 바닥은 1도 따뜻해지지 않았습니다 수압은 약한데 따뜻한은 잘 나왔고 화장실 등은 이틀째엔 들어오지않았어요ㅋㅋ 방 청결은.. 장판을 치우고 청소를 하진 않으시나봐요 창문밑쪽에 머리카락이니 뭐니 잔뜩 있었습니다 안좋은 일로 급하게 전주에 내려와서 방이라도 따뜻하게해서 있으려했는데 온돌방은 무슨 ㅋㅋㅋㅋㅋㅋ 전기장판방으로 명명해주세요;,1,5년 전
y_76_684,전주 화려한외출2,속리산국립공원미사일,항상 깨끗하고 만족합니다.,5,2년 전
y_76_685,전주 화려한외출2,매롱롱롱,오래된 냄새가 났는데 항상 싼맛에 가요 청결은 나쁘지 않아요 근데 항상 조명이 어두워서 음산한 느낌이 나는 곳이네요 그냥 저냥 잘 쉬었다 갑니다 다음에 또 갈지는 잘 모르겠어요 싸서 가요,3,3년 전
y_76_686,전주 화려한외출2,johnny12,오늘도 컴퓨터 잘되는 방을 내주셔서... 편안하게 잘 있다 갑니다. 감사합니다.,5,5년 전
y_76_687,전주 화려한외출2,싱싱한감자전,좋아요 자주이용해요 친절합니다,5,1년 전
y_76_688,전주 화려한외출2,6787799,위치도 좋고 가격대비 좋은듯,3,5년 전
y_76_689,전주 화려한외출2,수퍼럭키,가성비 괜찮아요 모텔촌이라 주변 편의점과 식당들이 많아서 편리해요 배달해먹을곳이 많단 뜻이죠 객실 넓고 엘리베이터있어요 살짝 담배냄새랑 수압이 아쉽지만 비품은 넉넉하게 잘 들어있어요,5,2년 전
y_76_690,전주 화려한외출2,d*****,너무추움. 언제적 침구류인지. . 냄세심함,2,2년 전
y_76_691,전주 화려한외출2,GC14988733394,깨끗하고 주인이 친절합니다,5,1년 전
y_76_692,전주 화려한외출2,GC14988733394,깨끗하고 주인이 친절합니다,5,1년 전
y_76_693,전주 화려한외출2,열넷째염장,"가격대비 좋은 것 같습니다. 객실안에 미니 바도 특이하고, 특별히 불편한 점 없습니다~",5,6년 전
y_76_694,전주 화려한외출2,열정적인집파리,사모님 친절하시고 가격도 저렴하고 객실도 깨끗하네요. 잘 쉬었다 가겠습니다~^^,5,6년 전
y_76_695,전주 화려한외출2,레드사랑,티비가 스마트티비여서 폰이나 태블릿으로 연결 가능 ㅂ 갤럭시면 스마트뷰 아이폰이면 에어플레이? 이건 되나 모름 다 맘에 들었어요 주차장도 크고 전주오면 여길 자주 올거같음,4,4년 전
y_76_696,전주 화려한외출2,주먹펀치,"진짜 옛날 시설? 같았어용 처음에 들어갔을때 퀴퀴한 냄새랄까,, ㅋㅋ 커플피시방이 었는데 컴터가 롤 돌아가긴하는데 중간에 마우스 맛가고 스피커 맛가고 난리더라구요 ㅎ 남친이 봐줘서 게임 하긴했답니당 하루 머물기 아주 나쁘진않았어요",3,5년 전
y_76_697,전주 화려한외출2,GC1509531140,저렴해서 예약했더니 방도 춥고 청소도 엉망이고 티비도 않나오고 모두 않좋내요. 다시는 이용 않합니다.,1,3년 전
y_76_698,전주 화려한외출2,좋은인연사랑,깨끗하고친절하고조용하고좋아요깨끗하고친절하고조용하고좋아요깨끗하고친절하고조용하고좋아요깨끗하고친절하고조용하고좋아요깨끗하고친절하고조용하고좋아요깨끗하고친절하고조용하고좋아요깨끗하고친절하고조용하고좋아요깨끗하고친절하고조용하고좋아요,5,2년 전
y_76_699,전주 화려한외출2,이스탄불시베리아호랑이,가성비가좋아요가성비가좋아요가성비가좋아오 가성비가좋아요가성비가좋아요가성비가좋아오 가성비가좋아요가성비가좋아요가성비가좋아오 가성비가좋아요가성비가좋아요가성비가좋아오 가성비가좋아요가성비가좋아요가성비가좋아오,5,1년 전
y_76_700,전주 화려한외출2,좋은인연사랑,깨끗하고친절하고조용하고좋아요깨끗하고친절하고조용하고좋아요깨끗하고친절하고조용하고좋아요깨끗하고친절하고조용하고좋아요깨끗하고친절하고조용하고좋아요깨끗하고친절하고조용하고좋아요깨끗하고친절하고조용하고좋아요깨끗하고친절하고조용하고좋아요,5,2년 전
y_76_701,전주 화려한외출2,지방적인차렵저고리,가격이 싸서 좋아요 ㅋ,5,5년 전
y_76_702,전주 화려한외출2,제이쓰리글로벌,사장님이 매우 친절합니다 가족이 머물러서 와이프와 초등학교 2학년과 머물렀는데 추가요금은 따로 받지 않았습니다 인근에 막걸리 골목 시장이 있어 택시타고 움직이기 좋은 위치에 있습니다,4,6년 전
y_76_703,전주 화려한외출2,식사는잡쉈어,시설 좋고 깨끗하고 저렴하고. 중화산동 최고 모텔입다. 시설 좋고 깨끗하고 저렴하고. 중화산동 최고 모텔입다. 시설 좋고 깨끗하고 저렴하고. 중화산동 최고 모텔입다. 시설 좋고 깨끗하고 저렴하고. 중화산동 최고 모텔입다.,5,3년 전
y_76_704,전주 화려한외출2,태*****,"가성비 좋이요.,.",5,2년 전
y_76_705,전주 화려한외출2,태*****,또올께요 감사합니다,5,2년 전
y_76_706,전주 화려한외출2,솔이사랑,요즘 주말만 되면 전주 모텔 잡기가 너무 어렵고 평일보다 배 이상으로 비싸서 많이 아쉽네요. 택시잡기도 어렵고 대리운전 잡기도 어려워서 울며 겨자먹기로 비싼값 생각않고 하루 묵었는데 지금껏 알던 화려한외출이 아니었네요. 호텔같았습니다,5,2년 전
y_76_707,전주 화려한외출2,아흔째앨리스,우선 가격이 너무 저렴하고 이 가격에 이 시간이면 혜자라고 생각합니다!! 시설도 나쁘지않고 넷플 생겨서 너무 너무 좋아요! 다음에 또 갈 의향 있습니다 앞으로 자주 이용하겠습니다~~,3,4년 전
y_76_708,전주 화려한외출2,소소하고지혜로운국수오리,비품들도 잘 비치되어있어서 좋아요,5,1년 전
y_76_709,전주 화려한외출2,2430508,가격도 저렴하고 따듯하게 잘작어요 근데 이불이 좀 불편하더라고요 뻣뻣하다고 해야하나,3,4년 전
y_76_710,전주 화려한외출2,삼천동왕,좋아요 좋아요 좋아요,5,3년 전
y_76_711,전주 화려한외출2,자체적인바보,마음 머무는 곳 편안함,5,1년 전
y_76_712,전주 화려한외출2,2954272,위치도 나름 괜찮고 친절하셔서 좋았음 ㅎㅎ 욕조도 있고 해서 피로풀기도 좋았제용,3,6년 전
y_76_713,전주 화려한외출2,자주가는출장객,2층객실썼는데.. 엘지텔레콤안터집니다 이런것좀신경써서 건물에 통신사기지국 설치좀해주세요 통사사에요청하면 무료입니다,3,5년 전
y_76_714,전주 화려한외출2,열살브레인,가격베리굿 청결. 주인이 모든걸 신경쓰지않는다는게 더 굿,5,6년 전
y_76_715,전주 화려한외출2,sony999,안좋은 리뷰들이 몇몇있어 걱정하기도 햇는데 굳이 할 필요 없을만큼 아주 잘 쉬다 갑니다 역시 눈으로 직접보고 직접 쉬어야 알수있는듯 카운터도 친절하고 아주 자아알 쉬다가는것같은 느낌,5,3년 전
y_76_716,전주 화려한외출2,강쭈디,가성비가 정말 좋았고 컴퓨터도 게임이 잘 돌아가더군요~(키보드가 가끔 잘 안먹음..티비도 크고 여러가지 잘 나오더군요(흐흐흐흐..)여러모로 만족했습니다 ㅎ,4,5년 전
y_76_717,전주 화려한외출2,8261181,수건에 라면 국물 밎 핏자국 있었음.바닥에서 먼지 쓸리고.. 내부시설은 녹슬었어요. 지인에게 추천하면 솔전당함. 인생 최악의 외출이 될 거임,0,3년 전
y_76_718,전주 화려한외출2,워터드래곤75,"시설, 청결, 서비스 모두 좋아요",5,5년 전
