id,name,nickname,review_content,rating,write_date
y_76_285,전주 화려한외출2,백색실토,잘쉬다갑니다~ 방도 편하고 침대도 푹신해서 좋았습니다 시설도 좋아서 너무 편해요~~~~~ 화장실도 냄새도 안나서 너무 좋았습니다~~~ 디ㅡ시 또 오겠습니다~~~ 감사합니다~~~,5,3년 전
y_76_286,전주 화려한외출2,진주색나비,있을거 다있고 깔끔해요 근데 식탁이라고 해야하나 침대 옆 테이블에 놓여있는 의자가 너무 높아서 앉아서 뭘 먹기가 좀 힘들어요 화장실 욕조가 반지하처럼 있어서 신기했어요 깔끔하고 좋아용,5,4년 전
y_76_287,전주 화려한외출2,11780330,혼자 쉬러 갔는데 가격이 저렴한게 메리트네요 ! 화장실에서 담배냄새가 너무 짙어서 ㅜㅜ 숨막혔어요~ 그리고 객실안 콘센트 마다 먼지가 너무 많아서 한번쯤 청소를 하셔야할 것 같아요 ㅠ 주인 아주머니는 친절하셨어요!,2,5년 전
y_76_288,전주 화려한외출2,audwns3180,잘쉬다갑니다~~~~~가성비 최고입니다ㅎㅎㅎㅎ 깔끔하고 넷플도 되고 컴퓨터는 없지만 이만한 가격에 긴대실시간 만족하고 잘 쉬다가요ㅎㅎㅎㅎㅎ 충전기는 카운터에서 보증금 받고 빌려줍니다,5,3년 전
y_76_289,전주 화려한외출2,만두랑놀쟈,"12시쯤 도착했어요 즉흥적으로 서울에서 태교여행겸 먹방하러 온거거든요 가격도 저렴하구 좋아보여서 왔는데 주차장도 넓고, 내부도 깨끗하고 좋았어요 다만 임산부라 그런지 냄새에 좀 민감한데 담배찌든내가 좀 베어있는것 같더라구요 ㅠ 야식사러갈겸 나갈때 문열어두고 환기 좀 시키고 들어오니까 적응이 된건지 괜찮아졌어요 ㅎㅎ 컴퓨터도 있고 티비도 커서 야식먹으면서 너무 재미지게 티비를 봤네요!",5,5년 전
y_76_290,전주 화려한외출2,밤태자팍,이모텔 너무 좋아요~차량주차도 편하고 사장님이 너무 친절하여 다시 또유고싶은 모텔입니다. 침대도 편하고 욕실 수업도 정말 좋습니다. 다음에 또 오겠습니다.감사합니다. 아100자 힘드네....,5,3년 전
y_76_291,전주 화려한외출2,골맨,마지막. 출지ㅡㅇ의 끋을 이곳에서보내고 갑니다. 나름편히쉬었다갑니다. 번창하시고. 가성비좋고. 그리불편없이 쉬었다가기 갑니다. 추천할만하네요. 주차좋고 주변먹거리좋고.......,4,2년 전
y_76_292,전주 화려한외출2,세상끝,시설은 약간노후되였지만 나름깔끔하고 좋았습니다.친절하게 방도안내해주시고 청결하였습니다.저는 만족합니다.번창하세요.,5,5년 전
y_76_293,전주 화려한외출2,토끼꼬리9개,일반실 예약했는데 특실?로 변경해주신다고해서 너무너무 감사했습니다 방도 넓고 대리석바닥 너무좋았는데요 너무추웠어요.. 카운터계신 분께서 연신 죄송하다 보일러돌렸다 새벽되시면 좀 나아질꺼다했는데요 저희 입실시간 새벽두시였구요..ㅜ 아침에눈떳을때도 매우매우추웠어요.. 사장님 개선좀해주세요!!,3,2년 전
y_76_294,전주 화려한외출2,일곱장비,주말에도 8시간이나 대실되는곳은 여기뿐이라서 또 왔습니다! 넷플릭스 정주행 실컷하다갑니다 가성비갑! 저렴해서 웬만하면 불만이 없지만 바닥 청소는 신경써주면 좋을 것 같아요 먼지나 가루같은게 떨어진게 눈에 보이더라구요ㅎ,3,3년 전
y_76_295,전주 화려한외출2,골맨,연박중인데. 친절한카운터분이. 오늘따라 좀 그러네요. 어려운부탁도아닌데. 좀퉁x스럽게 당황되네요. 그래도. 큰불편함없이 잘쉬고. 갑니다. 방컨디션 그정도면. 길가라그런지 좀시끄럽긴해요. 알아서 판단하세요.,5,1년 전
y_76_296,전주 화려한외출2,신지호7,사장님이 굉장히 친절하게 방 안내 해주셨고 넷플릭스 되는 곳으로 대실 해주셨어요 대신 티비랑 컴터 연결은 안됬습니다 방 굉장히 넓었고 컨디션도 좋았어요 조명 갯수가 많아 조절할 수 있는게 굉장히 좋았습니다 욕조가 생각보다 넓어서 좋았는데 욕조 마개가 없어서 쓸 순 없었고요 방 청결했고 비누도 따로 주셨어요 대실 시간 길어서 편히 쉬다 갑니다,5,4년 전
y_76_297,전주 화려한외출2,사법적인광어,가격대비 대만족. 주차공간도 넉넉하고 위치도 좋음 전주갈일 생기면 무조건 여기서 숙박해야겠음.,5,2년 전
y_76_298,전주 화려한외출2,낙산공원애완동물,방이 넓어요 객실이 넷플릭스가 돼서 재밌게 봤습니다! 전반적으로는 다 만족했지만 한가지 문제점이 있었는데 그 문제점이 너무 컸어요 ㅠㅠ 침대가 움직일 때마다 크게 삐거덕 거려서 잠을 못잤습니다.. 205호예요,3,1년 전
y_76_299,전주 화려한외출2,여기어때 이용 고객,친절하시고 주차공간도 넓엇습니다. 깔끔하고 청결합니다. 방도깨끗하구요 겨울이라 방이따듯하고 전기장판도 아주따듯하게이용햇어여 ^^ 다음에도 또오면 여기서이용할러구욥........,5,3년 전
y_76_300,전주 화려한외출2,스물여덟살중대원,방도 깨끗하고 냄새도 안나고 깔끔하니 좋았어요 티비도 잘 나오고 따듯한 물도 잘나와서 편하게 쉬다갑니다 샤워기 수압이 좀 약해서 아쉽긴해도 전체적으로 깔끔하고 좋아서 좋았습니다 다음에 또 올 생각있습니다,5,3년 전
y_76_301,전주 화려한외출2,5901491,우선 주차장이 넓은 점은 좋았습니다. 하지만!!! 청결상태는 최악이였습니다. 피묻어서 피가굳은 가운부터해서 수건도없고 바닥도 지져분하고 살면서 이런 숙박업소는 처음봅니다. 리뷰 잘안쓰는데 리뷰랑 다른 현실에 화가나서 남겨요. 사진 첨부합니다,0,6년 전
y_76_302,전주 화려한외출2,파의파,저는 전주 사람도 아니구 다른 지역에서 온 사람으로서 솔직하게 리뷰하겠습니다. 장점 : 1. 방이 넓직해서 좋았습니다 2. 그리고 대소변 보는곳과 씻는곳이 분리되서 좋았습니다. 3. 베개가 인당 2개씩 총 4개 있어서 더욱 더 편안히 잤습니다. 4. 수건이 상당히 많이 비치되어있어 여유롭게 사용 가능합니다. 6장 있었습니다. 5. 욕조도 넓직하고 둘은 모르겠고 혼자서는 충분히 여유롭게 사용 가능합니다. 여기까지가 제가 머무른 방에 장점이였구 단점은 딱히 없었던 거 같습니다. 이상 충청도 사람의 솔직히 리뷰였습니다.,4,4년 전
y_76_303,전주 화려한외출2,철저한라볶이,굳 ㅎㅎㅎㅎㅎㅎㅎㅎㅎㅎㅎㅎㅎㅎㅎㅎㅎㅎㅎㅎㅎㅎㅎㅎ 편하게 놀고 싶을 때 자주 이용하는데 아주 좋아요 편히 쉬기도 좋고 침대도 따뜻하고 좋습ㄴ다 가격도 착하고 시간도 길어서 좋아요!!,5,4년 전
y_76_304,전주 화려한외출2,100세위협,일때문에 왔는데 시설도 깔끔하고 여러모로 좋았습니다 사장님도 친절하시고 침구며 뭐며 다 깨끗합니다 무엇보다 먹을 곳도 꽤 있고 배달도 좋습니다 담에 다시 오게되면 또 들릴게요~~!!!!,5,1년 전
y_76_305,전주 화려한외출2,epsky4836,"깔끔하고 좋습니다. 전주 출장 때마다 자주 이용하는숙소예요. 사장님 정말 친절하시고, 주차장이 넓어서 아주 좋습니다. 객실도 깔끔하게 잘 정돈 돼어 있어 하루 쉬기 좋습니다. 앞으로도 전주 출장 때마다 자주 이용하려고 합니다.",5,1년 전
y_76_306,전주 화려한외출2,각박하고가냘픈명동,저가 항상 전주가면 애용하는곳중 한곳입니다. 집같은 편안한 공간 역시 !! 여전히 놀러가면 항시 잘해주시는 친절한 사장님 ~ 다음에도 또 들리겠습니다 ㅎㅎ 잘 놀다갑니다 감사합니다 ~,5,3년 전
y_76_307,전주 화려한외출2,가람호,"넓고 큰방이 인상적이었네요. 욕실도 청결하고,객실도 청결하였습니다. 무엇보다 외풍이 없어 따뜻하게 하루 잘 쉬었다 갑니다. 다음에 전주에 올 기회가 있으면 또 이용하겠습니다. 잘 쉬었다 갑니다.",5,2년 전
y_76_308,전주 화려한외출2,골맨,오래간만에 전주출장 또와서 이곳을 예약해서 이용해봅니다. 카운터분 여전하시네요. 큰불편없이 잘쉬고갑니다. 몆일은 이곳에서 있지않을까 생각이드네요. 조금노후되었지만 나름관리가 잘되어있네요. 추천합니다,5,1년 전
y_76_309,전주 화려한외출2,5949965,"살면서 리뷰 달아본적도 없는데 사장님이 리뷰를 쓰게 만드시네요.여자친구랑 2년정도 만나면서 주에 한번씩은 이 모텔 이용하는 단골입니다. 요즘세상에 리뷰,평점이 얼마나 중요하신지 모르시는것 같아요 오후9시 입실해서 바로 전기장판을 틀어놨었고 11시가 되었는데도 온기하나 없는겁니다 바로 로비로 전화해서 자초지종 설명을 하니 귀찮다는 말투로 방으로 오신다더군요. 방에 오시고 몇번 전기장판을 만져보다가 하시는 말씀이 나도 모르겠다라는 식으로 애기하시더라구요 전문가가 아니라면서 딴 장판을 가져다 주시던지 방을 바꿔주시던지 대처를 먼저 해주셔야지 모르쇠 일관적으로 나오시는 사장님한테 남는 전기장판이라도 가져다 달라고 제 입으로 요청드렸습니다. 결국 30분뒤쯤 장판가져다 주시고 잠은 잘 잤으나 안경쓴 여사장님 불친절한 태도 때문에 앞으로 다른 모텔 알아봐야겠네요",0,4년 전
y_76_310,전주 화려한외출2,아무거나하지뭥,저렴한 가격에 잘 이용하다 갑니다 시간도 넉넉해서 저렴한 가격에 잘 이용하다 갑니다 시간도 넉넉해서 저렴한 가격에 잘 이용하다 갑니다 시간도 넉넉해서 저렴한 가격에 잘 이용하다 갑니다 시간도 넉넉해서 좋네요,5,3년 전
y_76_311,전주 화려한외출2,8450157,전주에서 자야 할 일이 생길 때 마다 찾는 곳 입니다! 화려한외출 2 모텔은 가격이 싼 게 좋은 거 같아요! 늘 여기어때로만 예약을 해서 직접 가서 결제하는 금액은 모르겠지만 제가 예약할 때 가격대로 생각하면 이 가격에 이 정도 방이면 아주 좋다고 생각합니다! 앞으로도 자주 방문 할 거 같아요^^,5,3년 전
y_76_312,전주 화려한외출2,암자색빅터,최악입니다 여기 예약하실 분들 잘 보세요 중화산동 모텔 중 가장 투숙객을 우습게 보는 곳이네요 저는 가운입고 남자친구는 반라였습니다 넷플릭스 보고있는데 갑자기 청소하는 사람이 마스터키로 문을따고 들어오더라구요? 그러면서 '뭐야 사람있었네?' 이러면서 이런사과 하나도 없이 그냥 나갔습니다 그 이후 본인들끼리 깔깔거리면서 웃는 소리가 계속 들려서 남자친구가 나가면 상황이 더 심각해질까봐 제가 몇번이나? 나갔는데 막상 나가면 또 잠잠해지고 어디로 사라져있더라고요 청소카트는 그대로 복도에 있고요 너무 화가나서 카운터에 전화를 계속 했는데 전화는 전혀 받지 않았습니다 또다시 들어올까봐 제대로 쉬지도 못했습니다 그날 5층에는 저희만 사용하고있었고 다른곳은 빈방이어서 아마 비웃은 것도 우리를 보고 비웃은거라 확실합니다 미친게 아니고서야 문을따고 분명 앞에 신발이 있음에도 불구하고 그대로 들어오는거는 머리가 없는 것 아닌가요? 퇴실할때 되서 얼굴좀 보려고 카운터 갔더니 사람이 바뀌어있었습니다 모텔 사장님이 이 글을 보실지는 모르겠지만 직원 교육 단단히 시키세요 5월 5일 어린이날 이용했고 5-60대 머리 짧은 아줌마 였습니다 카운터도 같이 보는 것 같더라구요 여기 이용하실 분 들은 조심하세요 언제 문따고 들어올지 모릅니다,0,4년 전
y_76_313,전주 화려한외출2,김멍멍,주차장있음 욕조있음 전기장판있음 충전기없음 맛집 가까움,5,2년 전
y_76_314,전주 화려한외출2,강봉희,진짜 좋아용 칫솔도 부드럽소 잠자리가 젠짜 따뜻해서 좋소 더울정도 키키키 컴퓨터도 배그가 돌아감👍🏻👍🏻 짱짱!!! 한가지!! 침대옆 인터폰아래에 사용한 휴지가 엄청많아서 내가 따로 버렸다는 점!! 다른거는 완전 짱!!,4,7년 전
y_76_315,전주 화려한외출2,17119019,적극 추천합니다 너무숙소가마음에들어서 리뷰를 남기게됩니다 갑자기 숙소이용해야해서 집근처로 알아보다 안성맞춤에 좋은숙소에서 하루 이용하게되었습니다 안내해주시는분도 친절하십니다 숙소상태도 깨끗하고너무마음에들었습니다 다음에 또 이용할기회가 생긴다면 또이용할껍니다~! 하루잘쉬고 편하게있다가 갑니다 중화산동에서 가장마음에드는 숙소였습니다 좋은숙소로 적극추천합니다!! 아주마음에들었습니다,5,3년 전
y_76_316,전주 화려한외출2,온에어,"시설 청결, 넓고 편안함. 세월의 흔적은 있으나, 매우 준수함. 컴퓨터 사양도 좋아요. 전주시 중심부에 위치해서 접근성도 좋고, 백제대로변이라 교통도 매우 좋습니다. 카운터도 친절하시고, 간혹 어르신들이 계셔도 다들 친절하십니다.",5,6년 전
y_76_317,전주 화려한외출2,골맨,긴출장길어 연박하고있읍니다. 가성비 그런대로 괺찬아요. 헌데. 조금부족한거야있죠. 노후되었어도 나름관리가 잘되어있고요 물수압이 좀약하나 그런데로. 조금더 친절했으면하는. 바람. 추천합니다,4,2년 전
y_76_318,전주 화려한외출2,남부러운봄,물2병이 있었는데 하나는 자면서 먹었고 불꺼진채여서 그런지 확인안해봤구요 아침에먹다남은 물병 가져왔는데 저렇게 이상한게들어있네요 이거먹어서 그런지몰라도 목아프고 기침2시간씩하고 기침하면 가슴쪽엄청아프네요,0,6년 전
y_76_319,전주 화려한외출2,팀와,안녕하세요~~~ 여러번 이용하는데 항상 깨끗하고 화장실도 좋고 생각보다 넓은거 같아요 가격대비 진짜 괜찮은 것 같고 옛날에 왔을 때보다 더 좋아진거 같아요 할상 잘 이용하고있습니다,5,4년 전
y_76_320,전주 화려한외출2,라쥬야,출장와서 이용하기 좋습니다 위치도 좋고 가격도,4,1년 전
y_76_321,전주 화려한외출2,epsky4836,전주에 출장 올 때마다 매달 방문하는 모텔입니다. 주차장 정말 넓어서 이용하기 좋습니다. 주변 숙소 중에서 가성비 최고입니다. 앞으로도 전주 출장 때마다 계속 이용하려고 합니다~~,5,1년 전
y_76_322,전주 화려한외출2,청솔20,차량주차 편하고 객실상태 비교적양호 합니다. 컴퓨터 데스크탑이 없어 조금은 아쉬웠습니다. 객실 청결상태 양호하고 직원분도 친절합니다. 가성비 훌륭하고 편안하게 휴식 취하기 좋았습니다.,4,3년 전
y_76_323,전주 화려한외출2,11202270,"1. 일단 사장님 너무 친절하시네요 주차장도 깨끗하고 일요일이라 여유가 많아서 좋았어요. 2.복도,앨리배이터 깨끗하고요 걕실 정리,정돈도 잘되어 있네요 3. 한가지 아쉬운 부분은 화장실 청소와 침대보는 다른사람이 쓰던거 같아서 찜찜하네요 특히 침대보는 더욱더 신경좀 써주셔야 할거 같습니다. 다른부분은 만족합니다.",4,2년 전
y_76_324,전주 화려한외출2,행복햎삐,우선 첫번째 사장님이 착함! 두번째 편한위치! 그리고 짐이있어 힘들어서 1시간정도 일찍 사장님께 들어가도되는지 여쭤보니 바로 수락해주시는 사장님 ! 감사했습니다! 너무 편했고 푹 쉬다 갑니다!,5,3년 전
y_76_325,전주 화려한외출2,5989158,사진에속지마세요... 사장님 에어컨좀 새로가세요 에어컨이 자고일어나도 더워요 터보로틀고잤는데 더워요 방두개 잡았는데 두방다그래요 들어가자마자 선풍기도있고좋네 에서 아선풍기없으면큰일날뻔했다로 생각이바뀌더군요 그리고 청결은 들어가자마자 욕실에 물기땜에자빠질뻔했고 욕실 반지하?형태 침대머리카락 여러가닥 있고 그리고 11시인가 늦은시간에체크인하는데 객실키고뭐고배정도안해노셔서 기다리게하고 카운터냉기에속았네요 사장님은 아주냉장고속에계시더만 객실은 왜이리덥습니까 제가가본곳중 2번째로최악입니다,0,6년 전
y_76_326,전주 화려한외출2,강돼종,객실은 가격에 비해 괜찮은 편입니다. 욕실이 분리되있어서 불편한점 있지만 나름 괜찮습니다. 청소상태는 양호합니다. 배달 시켜먹기 좋게 중간에 상이 있어서 매우 좋았습니다. 잘 쉬다 갑니다.,5,2년 전
y_76_327,전주 화려한외출2,지단5,저렴한 가격대비 시설이 깔끔하고 좋았습니다.,3,1년 전
y_76_328,전주 화려한외출2,수퍼럭키,항상 만족스러운 모텔이에요 친절하신 사장님과 깔끔한 객실 컨디션이 좋아서 자주 방문하게 돼요 편의점도 1분거리로 가깝고 수압도 쎄고 온수도 잘 나와서 샤워할 맛이 나요 정말 최고에요,5,1년 전
y_76_329,전주 화려한외출2,비비콕콕2,편히잘쉬었다왓네요 가격대비시설이좋아요 숙소가 청결하고 깨끗하고..넘좋아요 회장실수압도좋아요.. 넷플렉스시청도 가능하구요... 재방문률200%.... 수고하세요.... 감사합니다...,5,2년 전
y_76_330,전주 화려한외출2,10656416,너무 추워 감기 걸렸음 전기장판 밖은 추움,4,3년 전
y_76_331,전주 화려한외출2,인천레이,여러곳둘러보고 예약한곳입니다 우선 외관부터 깔끔합니다 주차도알아서 해주시는서비스도좋구요~^^ 내부는 꿉꿉한냄새도 하나도안나고 집처럼편했어요 지금까지가본곳중에 제일깔끔한곳같아요~ 잘이용했습니다 또이용할게요!^^,5,3년 전
y_76_332,전주 화려한외출2,모*****,잠만 잘거라 대충 잡은곳인데 가운에서 찐내나고 샴푸도 안좋고 린스는 일회용 하나에 무엇보다 바퀴벌레 잇엇음;;잠만 잘거라 대충 잡은곳인데 가운에서 찐내나고 샴푸도 안좋고 린스는 일회용 하나에 무엇보다 바퀴벌레 잇엇음;;,2,1년 전
y_76_333,전주 화려한외출2,GC14821578049,넷플릭스되는방으로줬다하지만 들어가자마자 화장실세면대는 물이새고....그냥잠만잘정도 막걸리집가려고 했는데주변에모텔없어 그냥여기로잡음 사진보고 괜찮아서 왔는데 솔직히 사진빨에 속았음ㅜㅜ,3,2년 전
y_76_334,전주 화려한외출2,청솔20,객실상태 전반적으로 양호하고 친절해요. 휴식 잘 취하고 갑니다.,4,4년 전
y_76_335,전주 화려한외출2,tshan0778,1. 처음마음 끝까지 초심을 잃으면 전부 잃는다고 했는데 객실청소가 엉망이네요 전엔안그랬는데 다른사람이 쓰던 칫솔 치약이 그대로 있고 머리카락도 장난아니게 많고 이번엔 너~~무 실망스럽네요 2. 날씨가 추운날씨임에도 난방을 안해줘서 전기장판 으오만 ..추워서 혼났어요 보일러 틀어달라고 전화했는데 알았다고 하고선 전혀 반응이 없었네요,4,2년 전
y_76_336,전주 화려한외출2,비비콕콕2,편히잘쉬었다왓네요 가격대비시설이좋아요 숙소가 청결하고 깨끗하고..넘좋아요 회장실수압도좋아요.. 넷플렉스시청도 가능하구요... 재방문률200%.... 수고하세요.... 감사합니다...,5,2년 전
y_76_337,전주 화려한외출2,11202270,"1.주차장 넓고 ,주위환경도 조용하고 복도 객실(화장실,기타)청소상태는 내우 양호함 2.일단 시끄럽지 않아서 너무좋았음 단 휴대폰 충전기가 예전엔 있었던가 같은데 비치가 별도 안되어 있어 입실시 확인이 필요함 3.모든것이 맘에 드는데 단 한가지 침대보는 재사용 하지 않았음 좋겠음 침대보에 얼룩이 있어 순간 기분이 찜찜했음 이부분은 관리가 필요로 보임",4,2년 전
y_76_338,전주 화려한외출2,동네미친개,전주여행하면서 세번째방문합니다 신시가지에서멀지도않고 특히나 주차공간이넉넉해서 갈때마다 주차걱정하지않고가서좋습니다.방도 가격대비넓어서 갈때마다 만족하고 있다가옵니다.다음번올때도방문예정입니다,5,3년 전
y_76_339,전주 화려한외출2,닭발조앙,항상 이용하고 있지만 정말 친절하시고 숙소도 깨끗하고 편안하게 잘 쉬다 가는 것 같습니다 여기는 고데기도 필요하면 줘서 너무 좋아요!!!ㅎㅎ 앞으로도 계속 이용할 예정입니다 감사합니당~,5,3년 전
y_76_340,전주 화려한외출2,골맨,기나긴 출장을 이곳에서 연박중 입니다. 가성비 최고지요 주차공간좋고 그리불편한건 없어서 좋아요. 시설은 좀되었지만 관리가 잘되어있어. 그리불편하지는 안아요. 추천합니다,5,2년 전
y_76_341,전주 화려한외출2,4739805,막걸리거리랑 레일바이크..한옥마을 주요관광지의 근접성이 좋아 선택한 곳입니다.. 주차장이 넓고 방도 넓고 화장실이 분리형이라 좋지만...청소와 수압은 신경써주셔야 겠더라구요ㅠㅠ 화장실이며 욕실 침실 쓰지도 않았는데 머리카락이 여기저기 많아 괜히 좀 그렇더라구요ㅠㅠ 침대의 시트외 까는것도 없어서 이불깔고 잤답니다ㅠㅠ 물도 졸졸 나와 겨우 씻을정도라 여름엔 안좋더라구요ㅠㅠ,3,7년 전
y_76_342,전주 화려한외출2,출장인생,"출장때문에 숙박을 잡았는데.. 처음에 5층방으로 배정받았으나, 컴퓨터가없는 관계로 다시 카운터에 말해서 7층으로 배정받았음. 객실상태는 샤워실이랑 화장실이 따로있어 좋았고.. 청소상태도 꽤나 잘되어있음.. 하지만 리모컨 고장인지 전등을 수동으로 온오프해야했음 가격도 착하고.. 이만하면 최상급모텔은 아니지만 가성비로는 훌륭한듯~",4,6년 전
y_76_343,전주 화려한외출2,침대위매쉬,화려한외출2 가성비로가긴좋은데 시설이노후된건어쩔수없는거같아요 주변편의시설좋았구요 아주머니친절해저좋았습니다. 내부인테리어기닥하고가면곤란합니다. 청결도는나쁘진않았고요 방음이안되는단점이있어요,3,3년 전
y_76_344,전주 화려한외출2,다탁다탁,"저렴함. 주차장 넓음. 어두움. 담배찐내. 소개사진처럼 쾌적한 느낌 아님. 침구에 머리카락, 이물질. 5분내로 다른숙소 잡고 퇴실함.",1,5년 전
y_76_345,전주 화려한외출2,초코렛872,이번에 여자친구랑 편하고 시원하게 쉴 수 있는 곳을 찾다가 우연히 알게 됐어요 객실은 전체적으로 깔끔하고 화장실도 쾌적해서 이용하면서 불편함이 없었습니다 가성비도 정말 좋아서 또 이용할 것 같아요 ㅎㅎ,5,1년 전
y_76_346,전주 화려한외출2,고먐미이미,"가격대비 처음엔 깔끔해보였는데,, 자는데 자꾸 가려웠어요... 왜그러지.. 모기인가 찾아봐도 모기 아닌거같고.. 같이 잔 사람도 같이 막 가려워서 긁어서 잠을 같이 설쳤어요ㅠ 겉보기엔 깔끔해보였어요.. (사진은 사용 후라서 지저분해보임) 넷플릭스 된다고했는데 안되더라고요 늦게 입실하고 그래서 사람부르기도 그래서 그냥 넘어갔는데 컴터도 없어서 따로 넷플릭스 연결되는것도 없고 그냥 안되는방 같아요",2,1년 전
y_76_347,전주 화려한외출2,신의기운,가성비 좋고 길게 있고 싶을때 이용하기 좋은 숙소네요~~ 시설이 조금 오래되긴했지만 어딘가가 부서지거나 한것은 아니고 오래되서 때탄 느낌이 전체적으로 드는 느낌이네요 그거 빼고는 좋습니다,3,3년 전
y_76_348,전주 화려한외출2,한적한반달곰,"위치가 딱 찾기 좋은 곳이었고, 실내는 깔끔했어요. 바닥이 대리석?이라서 방 전체는 차가운 느낌이 있지만 침대에 전기매트 틀어놓고 자니까 크게 문제는 없습니다! 다른 시설보다 화장실이 노후화가 느껴지지만 수압이 정상이라 괜찮습니다",4,6년 전
y_76_349,전주 화려한외출2,6473061,침구류 상태도 그냥 그랬고 샤워기는 괜찮았네요. 새벽에 아저씨가 소리지르고 싸우는거 빼고는 괜찮았습니다. 주변이 조금 시끄러운거 빼고는?? 구래도 잘 이용하다가 갑니다. 감사합니다,5,3년 전
y_76_350,전주 화려한외출2,멍언루,객실상태 사진에서 보이는 그대로예요 !! 침구류 너무 폭신하고 딱이예요 ~~~~ 다음에도 놀러오면 재방문의사 1000%입니다 ~~~ 너무 편하게 하룻밤 묵고 갑니다 감사합니다 사장님 !!!,4,3년 전
