id,name,nickname,review_content,rating,write_date
y_76_948,전주 화려한외출2,jh120184,싼맛에 이용하지만 담배냄새가 너무 심해서 비흡연자들 에게는 조금 안좋네요 객실 금연좀 했으면 더 좋았을거같습니다,2,5년 전
y_76_949,전주 화려한외출2,야외식물원승무원,사장님 친절하시고 좋아요! 사장님 친절하시고 좋아요! 사장님 친절하시고 좋아요! 사장님 친절하시고 좋아요! 사장님 친절하시고 좋아요! 사장님 친절하시고 좋아요! 사장님 친절하시고 좋아요!,5,2년 전
y_76_950,전주 화려한외출2,호산서원홍조,컴퓨터도 좋고 친절하고 다 좋았습니다,5,4년 전
y_76_951,전주 화려한외출2,푸석푸석한파견자,늦은밤 전주에 도착해서 숙소 싼곳 알아보다 여기가 제일 싸서 했는데 음.. 싼거 말고는 별로에요 위생상태도 영... 이불에 모래 같은게 있고 바닥에 이물질 있고 수건도... 딱히,2,3년 전
y_76_952,전주 화려한외출2,도통동어금니,저녁늦게 급하게 묵은숙소였는데 가성비 좋았습니다. 특히 직원분이 매우 친절하셨어요. 높은 층까지 잡아주셔서 매우 만족했습니다. 다음에 오면 다시 방문하도록 하겠습니다. 사업 번창하세요~,5,2년 전
y_76_953,전주 화려한외출2,기명이,저렴한가격에 잘 이용하고 갑니다 !,5,5년 전
y_76_954,전주 화려한외출2,찡찡한상디,가격대비 나쁘지않았어요! 자주이용할듯,5,5년 전
y_76_955,전주 화려한외출2,전주아나콘다,물 두 개 주셔서 감삼다... 허허 자주오니까 기억해주시고 좋네요,5,5년 전
y_76_956,전주 화려한외출2,백제왕국,시설이 깔끔하고 편안합니다.,5,4년 전
y_76_957,전주 화려한외출2,비비콕콕2,서비스도좋고 시설도굳입니다,5,4년 전
y_76_958,전주 화려한외출2,이방자,시설이랑 주변환경이 깨끗해서좋인요,5,7년 전
y_76_959,전주 화려한외출2,공감하고평범한월미공원,하... 할머니집 왔는데 안쓰던 사랑채 급하게 청소하신 상태입니다 청소 구석구석 머리카락 과자가루 떨어져있고 거미줄도 엄청 크게 있었습니다 방음하나도 안되요 근데 주인아주머니가 착하시고 방없어서 그냥 잤는데 허참...,2,1년 전
y_76_960,전주 화려한외출2,10745739,친절한 사장님과 깔끔한 내부시설,5,5년 전
y_76_961,전주 화려한외출2,zke,가격대비 좋아요 가격대비 좋아요 가격대비 좋아요 가격대비 좋아요 가격대비 좋아요 가격대비 좋아요 가격대비 좋아요 가격대비 좋아요 가격대비 좋아요 가격대비 좋아요 가격대비 좋아요 가격대비 좋아요,5,2년 전
y_76_962,전주 화려한외출2,7872824,저렴한 가격에 시설 괜찮습니다,5,6년 전
y_76_963,전주 화려한외출2,너만아는여우,너무깨끗하고 타 모텔에 비해서 저렴한반면에 너무 물도 잘나오고 좋아요 깨끗합니다 카운터 분도. 친절이 고객응대 해주시고 너무행복한꿈에 잠드네요 .오늘 하루도 . 바이바이,5,5년 전
y_76_964,전주 화려한외출2,각박하고가냘픈명동,친절하고 시설도만족해요 ㅎㅎ,5,5년 전
y_76_965,전주 화려한외출2,면깡,깔끔하고 숙소가 편해서 너무 좋아요,5,1년 전
y_76_966,전주 화려한외출2,애매모호한사주,아주 맘주차공간도넓고에들어요,5,6년 전
y_76_967,전주 화려한외출2,자작나무숲광어,깨끗하고 좋았습니다. 가격도 저렴했구요,4,4년 전
y_76_968,전주 화려한외출2,9256142,사용하기 편안하고 좋았습니다,5,6년 전
y_76_969,전주 화려한외출2,3217185,역시 믿고 가는 숙박업체네여^^ 하룻밤 잘 자고 갑니다.,5,5년 전
y_76_970,전주 화려한외출2,9240504,담배냄새가 좀난가빼곤 다 괜찮았어요 ㅎ,3,5년 전
y_76_971,전주 화려한외출2,18476555,친절하고 가격 대비 좋아요,5,2년 전
y_76_972,전주 화려한외출2,크리스탈쑤,청결하고 인테리어가 예뻐욤,5,5년 전
y_76_973,전주 화려한외출2,8211684,위생상태나 그런건 별로인데 그냥괜찮아요,3,5년 전
y_76_974,전주 화려한외출2,좋은방나,가격이 저렴해서 좋았습니다,5,2년 전
y_76_975,전주 화려한외출2,12152035,시설과 청결 만족 합니다,5,4년 전
y_76_976,전주 화려한외출2,전주한옥마을선거운동원,가격저렴 시설좋아용 굿굿,5,5년 전
y_76_977,전주 화려한외출2,쿙쟈뱐,편하게 오랫동안 쉴 수 있어서 좋아요ㅎㅎ 주말에 이렇게 푹 쉴 수 있다는게 행복하네요 넷플릭스도 잘 나옵니다! 덕분에 푹 쉬고 가네요~~~~ 다음에도 또 와서 쉬다가 가야겠어요ㅎㅎ,3,3년 전
y_76_978,전주 화려한외출2,여기VVIP,전주에서 숙박2틀 예정으로 왔는데 숙소가 좋아서 모두 2틀 숙박햇네요. 모든 투숙객들에게 언제나 늘 편안하게 지금처럼 제공해 주세요... 또 방문할께요^.^,5,6년 전
y_76_979,전주 화려한외출2,엽집누나,일단 전주는 3번째 방문입니다~ㅎㅎㅎ 룸 컨디션은 굿~~이고요~방도 크고 침구류도 깨끗하고~잘쉬다 갑니다~^^ 번창하세요~,5,2년 전
y_76_980,전주 화려한외출2,싱싱한감자전,친절하고 좋아요~^^,5,1년 전
y_76_981,전주 화려한외출2,싱싱한감자전,친절하고 좋아요~^^,5,1년 전
y_76_982,전주 화려한외출2,이스탄불달팽이,시설이 좀 노후되긴 했는데 가격이 저렴해서 괜찮은 것 같아요,4,3년 전
y_76_983,전주 화려한외출2,전주한옥마을선거운동원,가격저렴 시설쵝오ㅎㅎ,5,5년 전
y_76_984,전주 화려한외출2,전주아나콘다,여기 좋습니다. 뭔가 깔끔하고 일반실은 근데 뭔가 바닥이 이상함 더렂거나 그런 건 아닌데 뭔가 신발신고 들어가야 할 거 같은 바닥이랄까... 무튼 그렇습니다,5,5년 전
y_76_985,전주 화려한외출2,미륵,저렴한 가격 가성비 쵝오네요,5,1년 전
y_76_986,전주 화려한외출2,66세올리비아,이번 출장 이틀동안 방12개 잡았습니다,5,4년 전
y_76_987,전주 화려한외출2,착실한단군,오래된건물은 알겠는데.... 이불정리만 되어 있고 바닥청소는 하나도 안되었네요 ㅜㅜ 찝찝해서 자다가 나왔네요,4,3년 전
y_76_988,전주 화려한외출2,2430508,따뜻하니 잘잣어여 근데 옆에 방문이 닫히면 같이 소리가 나서 좀 무서웟어오 ㅠ,4,5년 전
y_76_989,전주 화려한외출2,11804102,고럭저럭 이용했던 것 같아요 다만 린스랑 치약이랑 일회용이여서 많이 청결해 보였구요 들어갔을 때 티비가 켜져있어서 좀 당혹스러웠네요 그리고 나름 만족했어요,2,5년 전
y_76_990,전주 화려한외출2,악착같은오줌,시설좋고 가격대비 훌룡합니다,3,4년 전
y_76_991,전주 화려한외출2,도에몽님,번. 창. 하. ㅅ ㅔ. 요. ㅅ ㅏ. 장. 님. 〰️〰️〰️,5,1년 전
y_76_992,전주 화려한외출2,호*****,친절하고. 좋아요..,5,1년 전
y_76_993,전주 화려한외출2,모험심있고알록달록한부채,저렴하고 깨끗한 숙소 잘왔습니다,5,1년 전
y_76_994,전주 화려한외출2,주깨비,선착순 특가 방이라 그런지몰라도ㅎㅎ 가격은 무지싸지만ㅎㅎ 그뿐이네요.. 수압도 그럭저럭..욕조도 그럭저럭 창문은 방충망이 찢어져서 열지도 못하고 싼맛에 이용할만은 하네요..ㅎㅎ 그뿐입니당,2,4년 전
y_76_995,전주 화려한외출2,곽기철1104,좀 오래된 감이 없지않았어요 문이 열쇠네요,5,6년 전
y_76_996,전주 화려한외출2,3559688,대전에서 전주 여행 왔는데 덕분에 아주 편하게 잘 쉬고 갑니다~서비스도 좋코 물도 2병이나 더 주시고 아주 친절하시네요 감사합니다~번창 하십시요,5,8년 전
y_76_997,전주 화려한외출2,3028109,신랑이랑 엄마모시고 전주 놀러갔는데 가격대비 맘에들었어요 전주에 다시 놀러가면 다시묵고싶어지네요,4,8년 전
y_76_998,전주 화려한외출2,대찬루저,전주왓다가 우연히 들럿는데 그냥저냥 하루 잘묵엇습니다 근처에 편의점도 잇고 즐거운 시간 보내다 갑니다 화장실 욕조가 꺼져잇는데 신기햇어요 수압세구 잘묵엇다갑니다 전주방문잘하고갑니다,2,1년 전
y_76_999,전주 화려한외출2,6069510,예약도 되어있지않고 배정받은방은 방금전까지 쓰던방이라 다시 바꿔달라하고 아침9시부터 문을 누가열려고 하고 청소때문인듯 불쾌했네요. 다시가고싶지 않네요,1,7년 전
y_76_1000,전주 화려한외출2,흐린시민,재방문 의사 0입니다ㅠㅠ,2,2년 전
y_76_1001,전주 화려한외출2,기념공원식비,가격대비 가성비 좋은모델,4,3년 전
y_76_1002,전주 화려한외출2,자작나무숲대결,위치도 괜찮았고 주변에 편의점도 많아서 도보로 뭐 사러 가기에 좋았어요 처음 받은 방이 비가와서 습한날씨여서 그런지 냄새가 좀 났는데 다른방으로 바로 변경해주셔서 그래도 잘 쉬다 갑니다,3,3년 전
y_76_1003,전주 화려한외출2,sonuro,깨끗하고 좋습니다~,5,5년 전
y_76_1004,전주 화려한외출2,초코렛872,이번에 여자친구랑 추운 날씨에 편하고 따뜻하게 쉴 수 있는 곳을 찾다가 우연히 알게 됐어요 객실은 전체적으로 깔끔하고 화장실도 쾌적해서 이용하면서 불편함이 없었습니다 가성비도 정말 좋아서 또 이용할 것 같아요 ㅎㅎ,5,2년 전
y_76_1005,전주 화려한외출2,7872824,"저렴한데, 환기가 잘 안되서 그런지 갈때마다 눈이 너무 매워요ㅠ",4,6년 전
y_76_1006,전주 화려한외출2,여기어때 이용 고객,가격싸고좋았어요 ㅎㅎ근데 여기어때 탭찍는게없어요 제휴한지얼마안되서그런가 ㅋ제가못찾은건지ㅋ,4,8년 전
y_76_1007,전주 화려한외출2,8446970,자주찾아가는 좋은 숙소입니다!,5,5년 전
y_76_1008,전주 화려한외출2,9874979,직원분은 너무 친절했는데 시설은 그닥 별로예요. 샤워기 물도 새고 화장실 변기가 잘 내려가지도 않아요.,2,5년 전
y_76_1009,전주 화려한외출2,기념공원식비,가성비 대비 매우 좋은 모텔,5,4년 전
y_76_1010,전주 화려한외출2,10831779,무한대실이라서 좋았고 다른곳보다 훨씬 저렴하게 이용할 수 있어서 더 좋았어요 넷플도 있어서 편하게 쉬다 왔습니다 다음에 또 갈게용,5,4년 전
y_76_1011,전주 화려한외출2,꺼칠한소매치기,가격대비 이정도면 잘만 합니다. 돈아끼시려는 분들 추천요~,4,5년 전
y_76_1012,전주 화려한외출2,탄탄대로로,"전주여행 갔다가 하루,이틀,삼연박을 하고 왔습니다. 부담없는 평일가격이라 부담없이 전주.완주.진안.임실 편하게 잘다녀왔습니다~",4,3년 전
y_76_1013,전주 화려한외출2,8926209,자주 애용하는곳 가성비 개강취!! 넓고 편안하게 잠들기 좋아요!!,4,5년 전
y_76_1014,전주 화려한외출2,6594276,항상가격이 저렴해서좋아요. 쪼금만 난방을 더해줬으면 좋겠어요,4,5년 전
y_76_1015,전주 화려한외출2,온에어,오래된건물치고는 청결하고 좋습니다. 가성비 좋구요. 괜찮습니다.,4,6년 전
y_76_1016,전주 화려한외출2,9550064,차소리 좀 크게들려 별로였는데 아침에보니 창문열고 잦더군여 가성비 좋은곳 였어요,4,5년 전
y_76_1017,전주 화려한외출2,아흔한살별명,사장님이 친절하요~~,5,3년 전
y_76_1018,전주 화려한외출2,연두색수꿩,가성비 좋은 것 같아요!,5,2년 전
y_76_1019,전주 화려한외출2,8926209,가성비를 논하고 싶다면!! 여기를 추천합니다 남성들만 아는 고충이 있다면 ㅋㅋ 저랑 공감한다면 망설이지 마세욥,3,5년 전
y_76_1020,전주 화려한외출2,원초적인비스타,오자마자 키보드가 부서져있어 놀랐어요ㅎㅎ 하지만 바로바꿔주셔서 감사해요ㅎㅎ,4,6년 전
y_76_1021,전주 화려한외출2,알렉산더810,저렴하게 잘 쉬다갑니다,5,5년 전
y_76_1022,전주 화려한외출2,3217185,역시 깨끗하고 좋아요.,5,5년 전
y_76_1023,전주 화려한외출2,예뜰2,깔끔하고 번화가랑 가까이 있어 여행하거 쉬기에 좋습니다 퇴실 시간듀 넉넉하고,4,4년 전
y_76_1024,전주 화려한외출2,7052525,깔끔하고 그럭저럭 잘쉬다갔습니다! 화장대쪽은 조금신경써주시면 좋을거같아요ㅠㅠ,4,6년 전
y_76_1025,전주 화려한외출2,아기곰돌돌,전기코드가 한쪽이덜렁거리고 화장실 환풍기작동안돼네요~~수리부탁해용~,4,1년 전
y_76_1026,전주 화려한외출2,잠만잡니다요,잘쉬었다갑니다ㅎㅎㅎ,5,5년 전
y_76_1027,전주 화려한외출2,7156151,괜찮아요 좋아요 굿,5,5년 전
y_76_1028,전주 화려한외출2,각박하고가냘픈명동,주마다 이용하는곳인데 처음으로 2pc방으로 예약했더니 너무맘에들어요 ! 요새 시국이시국인지라 pc방가기도위험해서 여기서 맘잡고 재밌게 놀다갔네요 ㅎㅎㅎ 감사합니다 ~ 항상 친절하신 사장님,5,4년 전
y_76_1029,전주 화려한외출2,10745298,좋아욯ㅎㅎㅎㅎㅎㅎㅎ,5,5년 전
y_76_1030,전주 화려한외출2,한요미아빠,겨울에 가실분들 참고하세요. 왠만하면 나쁜리뷰 안남기는데 저는 까탈스럽지도 않고 딱 두가지만 봅니다. 화장실 변기 깨끗한지와 방이 따뜻한지... 한겨울인데 맨발로 방바닥을 밟을수가 없이 차가워서 씻기가 힘들고 옷 다 입고 잤습니다... 변기는 제대로 닦지않아 공중화장실 수준이더라구요.... 정말 최악이었습니다....,2,2년 전
y_76_1031,전주 화려한외출2,6610624,사장님이 친절하시고 우선 방이 깔끔해요 들어갔을 때 깔끔하다 느껴지는 느낌?? 따뜻한물도 잘 나오고 책상도 있어서 요즘 같은 시기에 늦은 시간에 음식먹기 좋은 곳 같아여~ 추천합니다,5,4년 전
y_76_1032,전주 화려한외출2,GC14769274054,타지였는데 사장님이 너무 친절하셔서 좋았어요ㅠㅠ 감사해요^^,4,6년 전
y_76_1033,전주 화려한외출2,haran7,특실인데 까운 안빨아서 더러웠음 501호는 키를 꽂아야만 냉장고가 돌아감 역시 싼게 비지떡,3,2년 전
y_76_1034,전주 화려한외출2,청솔20,가성비 훌륭합니다. 다만 직원 친절도만 좀 개선된다먼 좋겠군요.,3,4년 전
y_76_1035,전주 화려한외출2,물컹한서버,"처음 객실 들어오자마자 사진과 너무 다르고 화장실 타일이 깨져있고 위험해 보여 객실 변경 요청 친절하게 응대는 해주시나 다른 방도 동일한 컨디션 관리인이 건물 관리를 안하는지 전화도 받지 않아서 직원과 소통이 안됨 총 3번이나 객실을 변경했지만 방안에 거미 여러마리, 청결하지않은 침구는 그대로 전체적으로 더럽고 허름한 느낌 침대 딱딱함 .. 매트리스가 맞는지 의문이 들 정도 다른 숙소에 비해 가격이 비교적 싸다지만 이건 좀 아닌거같네요 문도 잘 안열림..;; 충전기도 방 안에 없어서 빌려가야함 아무리 저렴해도 커플은 오지마세요…",0,2년 전
y_76_1036,전주 화려한외출2,기념공원식비,서비스의 품질이 안 좋은,3,1년 전
y_76_1037,전주 화려한외출2,원초적인비스타,좋아요 다만 컴퓨터 성능이 더 좋아지면 좋겠어요,4,5년 전
y_76_1038,전주 화려한외출2,혀니혀니허니,괜찮아요ㅎㅎㅎㅎㅎㅎ,3,3년 전
y_76_1039,전주 화려한외출2,9125008,에어컨가스충전좀. 안시원함 대로앞이라 창이3개. 시끄러운데에어컨안되서문열고잇엇음. 청소깨끗.주간청소이모친절하심.,2,5년 전
y_76_1040,전주 화려한외출2,6514378,가격 대비 너무 만족 스럽네요 방도 넓고~,4,5년 전
y_76_1041,전주 화려한외출2,6695394,여기 완전 괜찮아요 ! 주중이지만 절대 이가격 안나오는 완전 캡입니다 ㅋㅋ 이거 옛날에 쓰건 말인가 !!!,5,7년 전
y_76_1042,전주 화려한외출2,용이나르샤,기성비 대비 괜찮은 숙소었어요 주변에 식당도 많아 좋았어요,3,1년 전
y_76_1043,전주 화려한외출2,9996155,"사진과 너무 다릅니다. 침대 밑 타인이 사용한 화장지와 커피캔이 뒹굴고 있고 입실하고 1시간이 지나도 추워서 룸 난방 온도 올려달라고해도 따뜻해지지 않네요. 그리고 입실한지 2시간쯤 지난, 저녁 9시쯤되니 1만원 할인 들어가네요. 여튼 비추합니다",1,5년 전
y_76_1044,전주 화려한외출2,좋은방나,가격대비 좋습니다~,5,2년 전
y_76_1045,전주 화려한외출2,유동골,깨끗해서 좋아요. 다음에도 다시 예약할게요..,4,4년 전
y_76_1046,전주 화려한외출2,타대오,오늘도 푹은하게 잘 쉬고갑니다 시설은 오래되었으나 출장오신분들 강추요,4,5년 전
y_76_1047,전주 화려한외출2,대량적인이웃,윗층으로 올라가면서 수압이약한건알겠는데 너무약했어용...,4,8년 전
y_76_1048,전주 화려한외출2,tappa0936,접근성이 좋네요~도로 바로앞이라서,4,6년 전
y_76_1049,전주 화려한외출2,케파하이,이가격에 이정도면 매우 만족해요,4,5년 전
y_76_1050,전주 화려한외출2,4180138,시설도 좀 그렇고 수압도 약하고 청소도 좀 그렇고 ... .................,2,8년 전
y_76_1051,전주 화려한외출2,블랙매니큐어,외관으로 보기에는 나쁘지 않았고 객실 내부도 가격대비 괜찮았어요~ 근데 청소를 제대로 못하신건지 그전에 사용하신 분이 숨겨놓은 쓰레기를 너무 잘 발견한건지 해바라기 껍질에 마른 딸기 꼭지까지.. 발에 3회정도 밟히니까 기분이 나쁘더라구요. 처음 발견했을때 옮길까 했는데 조금더 저렴하게 구매한거라 그냥 이용했지만 다시 가고싶진않아요..,2,4년 전
y_76_1052,전주 화려한외출2,공보빵화분율무,저렴한 가격에 비해 방 넓고 깔끔했습니다. 몹시 만족스럽네요!,4,5년 전
y_76_1053,전주 화려한외출2,타대오,친절하게 대해주셔서 편히 쉬고 올라갑니다,4,4년 전
y_76_1054,전주 화려한외출2,10694552,좀 오래된방이라그런지 침대는 삐걱거리고 욕실은 좀 지져분햇어요 세면대도 막혀있었고 샤워기 걸이도 없어 아쉽네요 그냥 저렴한 방이예요,3,5년 전
y_76_1055,전주 화려한외출2,악착같은오줌,방도 크고 구조가 맘에 들었습니다. 잘쉬다 갑니다.,4,4년 전
y_76_1056,전주 화려한외출2,짱9는출장중,잘쉬다 왔습니다 또 출장오면 들릴께요~,5,3년 전
y_76_1057,전주 화려한외출2,노식이,친절하고 마음 편하게 맞이해 주셔서 .. 좋은 곳이네요..잘 쉬었다가 갑니다..감사합니다,5,4년 전
y_76_1058,전주 화려한외출2,zke,싸다구~싸다구~싸다구~싸다구~싸다구~싸다구~ 싸다구~싸다구~싸다구~싸다구~싸다구~싸다구~ 싸다구~싸다구~싸다구~싸다구~싸다구~싸다구~ 싸다구~싸다구~싸다구~싸다구~싸다구~싸다구~~,4,3년 전
y_76_1059,전주 화려한외출2,블랙넘버,가격대비 짱입니다 ^^,4,5년 전
y_76_1060,전주 화려한외출2,조알탱,청결하고 좋았어요~ 다만 조금 추웠어요,4,6년 전
y_76_1061,전주 화려한외출2,하얀색폭스하운드,다음에 또 올께요 감사,4,5년 전
y_76_1062,전주 화려한외출2,야외식물원승무원,ㅇ 사장님친절하시거깨끗하고 좋아요 사장님친절하시거깨끗하고 좋아요 사장님친절하시거깨끗하고 좋아요 사장님친절하시거깨끗하고 좋아요 사장님친절하시거깨끗하고 좋아요 사장님친절하시거깨끗하고 좋아요,5,3년 전
y_76_1063,전주 화려한외출2,845178,카운터 직원들이 너무 친절해요 잘 쉬고 갑니다,4,6년 전
y_76_1064,전주 화려한외출2,빛깔비밀요원,급해서 저렴한김에 예약했는데 아기랑 갈곳은 아닌거같아요..무슨 80년대 여인숙 인줄 알았네요 이런 최악의숙소는 처음봅니다,1,1년 전
y_76_1065,전주 화려한외출2,3964829,시설청결상태도 별로고 방에 첨들어갈때 코를찌르는 케케함 그냥 돈 헌납하고 옴기고싶을정도였네요,0,5년 전
y_76_1066,전주 화려한외출2,9574017,가격대비 괜찮습니다.,4,5년 전
y_76_1067,전주 화려한외출2,유빈가빈아빠,저렴한가격에 넓은방 화징실 옥조 특히함,4,5년 전
y_76_1068,전주 화려한외출2,845178,항상 가성비 좋은 숙박시설이라 생각합니다,4,4년 전
y_76_1069,전주 화려한외출2,태양같은남자,정말 ㅂ좋습니다. 출장으로 급하게 잡았는데 정말 잘 쉬다 갑니다. 다음에 오면 또 오고 싶네요 편안하게 쉬었습니더. 바로 앞에 편의점도 있어서 편하더라구요. 아무튼 정말 잘 쉬다 갑니다.,5,1년 전
y_76_1070,전주 화려한외출2,16759998,가격도 저렴하고 무엇보다 사장님 너무 착하세요 ㅠㅠㅠㅠㅠㅠㅠㅠㅠㅠㅠㅠㅠㅠㅠㅠㅠㅠㅠㅠㅠㅠㅠ 시설도 괜찮고 완전 짱짱 입니다요 다들 여기로 어세요 !!!!!!!! 전 또 묵을 생각 있습니다 ㅎㅎ,5,3년 전
y_76_1071,전주 화려한외출2,9574017,가격대비 괜찮아요.,4,5년 전
y_76_1072,전주 화려한외출2,타대오,오늘도 편안하게 잘쉬고 갑니다,4,4년 전
y_76_1073,전주 화려한외출2,8926209,4번째 방문 평일 저녘이면 항상 오는곳 ㅋ 따뜻한 물 잘나와요 근처에 술 마실곳이랑 편의점 가까움 무엇보다 주차하기 편함,3,5년 전
y_76_1074,전주 화려한외출2,찐득한디자이너,출장 때문에 숙박하게 되었는데 가성비 좋고 직원분이 친절해서 좋았습니다 ㅎㅎ,5,5년 전
y_76_1075,전주 화려한외출2,4174764,저렴한가격에 하루 이용했는데 괜찬음,3,5년 전
y_76_1076,전주 화려한외출2,여기어때고객님,바닥청소필요~~~~~,5,1년 전
y_76_1077,전주 화려한외출2,인사과장,잘 이용했습니다...,4,5년 전
y_76_1078,전주 화려한외출2,뭄바이휴업,아주아주아주아주아주아주아주아주아주아주아두아주아주아주아주아주아주아주아주아주아주아주아두아주 아주아주아주아주아주아주아주아주아주아주아두아주아주아주아주아주아주아주아주아주아주아주아두아주아주아주아주아주아주아주아주아주아주아주아두아주아주아주아주아주아주아주아주아주아주아주아두아주,5,1년 전
y_76_1079,전주 화려한외출2,3371545,너무조아요~가성비최고 깨끗하고 넓고 디자인이쁘고 퇴실시간넉넉하구~최고에요!!,5,6년 전
y_76_1080,전주 화려한외출2,winterff,잘쉬었습니다 감사합니다,4,4년 전
y_76_1081,전주 화려한외출2,9149347,그럭 저럭 잘 이용하고 갑니다 ~~,4,6년 전
y_76_1082,전주 화려한외출2,말캉말캉한습지식물,자주 오는데 중화산동 저렴한 모텔치고 쾌적한 편이에요. 사장님도 친절하셔서 가끔씩 방 업그레이드도 해주시고 가성비 좋습니다. 좀 노후된 모텔이긴 하지만 싼 맛에 가끔씩 올만 합니다. 애인과 오기보단 친구와 외박하거나 밖에서 자야할때 애용합니다.,5,2년 전
y_76_1083,전주 화려한외출2,rudtjr3029,저렴하게 잘 이용 했습니다,4,5년 전
y_76_1084,전주 화려한외출2,2015874,아늑하면서도 넓고 좋습니다 사장님이 너무 친절하셨어요 만족합니다 다음에 또 방문할 수 있는 기회있으면 해도 좋을만큼 좋았습니다,3,8년 전
y_76_1085,전주 화려한외출2,월미공원라이카,출장으로 인해 예약을 했어요,4,6년 전
y_76_1086,전주 화려한외출2,악마밍구1,테이블과 스탠드가 정말 많아요,2,1년 전
y_76_1087,전주 화려한외출2,johnny12,1피시방에 묵으니.. 훨씬 더 좋네요. 멋진 서비스 감사합니다.,5,5년 전
y_76_1088,전주 화려한외출2,7267287,청결하고 값도싸고 좋았어요 ㅎㅎ,4,6년 전
y_76_1089,전주 화려한외출2,열다섯째작가,청결하고 넓어요 좋아요,4,6년 전
y_76_1090,전주 화려한외출2,여기어때고객님,방도크고..흔희 볼수없는 욕조까지...ㅎㅎ 재밌게 쉬다가요~^^,5,5년 전
y_76_1091,전주 화려한외출2,둘리쓰으,"숙박이랑 대실 같이 예약했는데 물이 부족할것같아서 달라고했는데 하나에 천원 주라네요... 저번에는 주셨는데 이제는 사장님께서 물도 아끼신다고..돈 받으라고 하셨다네요.. ㅠㅠ 혹시 가운 세탁따로 안하시나요? 저번에 빗 잃어버렸었는데 일주일후에 가운 주머니에서 발견됐네요.. 가운에 피도 묻어있고 좀 더러워서 못입었습니다.. 욕실청소도 잘 안되어있고요 종이컵 누가 쓰다만거 그대로 잇더라고요 그래서 청소이모님께 달라고 그랬더니 눈치보면서 사장님이 더주지말라고 하셧대요,, 매일 별점 5개만 주다가 처음으로 할말했네요 이제부터는 종이컵도 따로 챙겨가고 물도 따로 챙겨가야겠어요!!",0,3년 전
y_76_1092,전주 화려한외출2,9574017,가격대비 훌륭합니다.,4,6년 전
