id,name,nickname,review_content,rating,write_date
y_83_001,전주 데이나이스,크림밍밍,재방문한 숙소 전주 신시가지 데이나이스 호텔 건물이 주차장이 있고 외부 주차장이 따로 있어서 주차하는데 걱정이 없어요 호텔 바로 앞에 공영주차장이 있기도 합니다 저번에 방문했을때 깔끔하고 만족했어서 재방문 했어요 데이나이스는 방 구조가 특이한 거 같아서 갈때마다 새로운 느낌이 드는 호텔입니다 침대도 푹신하고 수압도 괜찮았구요 내부도 깔끔해서 만족했어요 입실시간이 6시인데 더 일찍 도착하는 바람에 기다려야하나 고민하다가 일단 체크인 해보자 하구 방문했는데 센스있게 빠르게 입실을 도와주셔서 감사했습니다 신시가지 숙소로 추천해요,5,1개월 전
y_83_002,전주 데이나이스,크림밍밍,전주 신시가지에 있는 데이나이스 호텔에서 평일 1박 묵었어요 신시가지에서 놀 때마다 보던 호텔이었는데 방문은 처음이라 어떨까 궁금했던 곳었어요 후기를 보니 출장 나오신 분들이 많이 묵는 전형적인 비즈니스 호텔인 것 같더라구요 그래서 그런지 숙소가 전반적으로 청결하고 조용해서 편안하게 쉴 수 있었어요. 침대도 푹신하고 방도 넓고 쾌적해서 만족스러웠습니다. 주차장도 따로 있지만 야외에 공영주차장도 마련이 되어있어서 걱정은 없을 것 같아요 신시가지에 있어서 대중교통 이용이나 근처 맛집 가기에도 편해서 신시가지 숙소로 추천드립니다,5,2개월 전
y_83_003,전주 데이나이스,소말리아직장,신시가지 내 위치해 있어서 배달 음식 시켜먹거나 포장해오거나 식당가서 먹고 다시 숙소 들어가기가 정말 좋아요 주차장도 기본 건물 주차장 외에 추가로 21대 주차 가능한 주차장도 별도로 있다고 안내되어 있어서 주차도 걱정 없어요 수압도 좋고 방 컨디션도 좋고 침구류도 깨끗해서 만족스러웠습니다 드라이기 바람도 세서 좋았고 아쉬운점은 고데기는 없습니다 티비 크기도 적당하고 휴지도 부족함 없고 방음도 잘 되는편 같아서 만족하명서 편하게 잘 쉰 것 같아요 대실 시간도 늦게 예약해서인지 23시까지 가능해서 매우 만족스러웠습니다,5,27일 전
y_83_004,전주 데이나이스,양세바리발,"여기어때 어플을 통해 편하게 숙박할 곳을 찾다가 전주 데이나이스호텔을 발견하여 예약 후 시간에 맞춰 입실하였습니다. 입실 과정에서 친절하게 안내를 해주셔서 기분좋게 입실을 할 수 있었고, 입실하니 방 안 온도도 적절하게 설정되어 있었고, 침대도 푹신하여 하루동안 편안한 시간을 보낸 후 퇴실할 수 있었습니다. 갑작스럽게 예약한 후 방문한 숙소였는데, 쾌적하고 편안한 환경속에서 아주 만족스러운 시간을 보내고 나온 것 같다는 생각이 들어서 추후에도 재방문 의사가 있습니다.",4,2일 전
y_83_005,전주 데이나이스,50502000맨,전주에 갈때마다 전주신시가지 쪽 숙소를 자주이용하는제 데이나이스는 갈때마다 이용하고 있습니다 다른것보다도 침구류가 중요한데 이곳 침구류는 꿀잠을 자기에 넘 좋구요 다른시설도 좋습니다 주차장도 넓어서 이용하기에는 매우 편합니다 주변 먹거리 편의점 잘 되있고 아침에 일어나서도 제가좋아하는 전주 현대옥 본점이차로 10분거리가 안되서 좋습니다 매번가지만 사장님 친절해서 좋구요 주변지인들 애기해줘도 가성비 대비 다 좋다는 평을 듣는것같네요 다음에 또 갈께요 수고하세요,4,8개월 전
y_83_006,전주 데이나이스,세네갈표범,사진을 못찍었네요ㅠㅠ 하지만 엄청 좋은 숙소입니다 이미지 사진과 똑같습니다 갑작스럽게 가게 된거라라 급하게 숙소 잡아 걱정이 많았는데 너무나도 만족스러운 숙소였습니다 우선 넓습니다 전주 신시가지 위치해있는데 주변에 조금만 나가면 먹을거리가 놀거리가 아주 많아 위치적으로도 너무 좋습니다 청결관리 매우 잘된것으로 보이고 냄새도 없으며 방음 또한 좋습니다 매우깨끗해서 제일 좋은것 같습니다 이만한 룸컨디션 가진 숙소 없는것 같아 매우 만족스럽고 또 이용하겠습니다 또 이용하겠습니다~~~~,5,24일 전
y_83_007,전주 데이나이스,공주듀,"걍 그저 그래요 가격 대비 일단 사장님도 친절하셨고 가격 저렴해서 별 기대 하지도 않은거 치고는 청결 했어요 너무 기대 안함 , , 바닥에 부스러기가 있는지 잘 얼룩도 안닦여 있었지만 어차피 잠만 자고 아침일찍 갈거라 크게 신경 안썼습니다 놀라운건 화장실에 문이 없어요 커튼으로 내려야 함 샤워실이 그렇고 화장실은 반투명 문 있어요 ! 근데 아쉬웠던건 침대에 얼룩이 있는데 ㅠ ㅠ 안지워졌더라구요 그래서 수건 깔고 잠 그냥 주변에 놀러와서 잠깐 잠만 잘곳이 필요 했던거라 그냥 크게 불편함 없이 이용 했어요 주변 신시에서 논다면 여기 괜찮은거 같아요",5,6개월 전
y_83_008,전주 데이나이스,먀라,"전체적으로 깔끔하고 관리가 잘 되어 있었습니다. 객실과 욕실 모두 청결하게 유지되어 있어 쾌적하게 머물 수 있었습니다. 침구도 깨끗했고, 기본적인 편의 시설도 잘 갖춰져 있어 이용하는 데 불편함이 없었습니다. 다만, 일반 객실에는 가운이 제공되지 않아 조금 아쉬웠습니다. 잘때 가운이 있으면 더 편리할 것 같은데, 잘때 옷을 입고 자야하는 부분이 불편했습니다. 이 부분이 개선되면 더욱 만족스러운 숙박이 될 것 같습니다. 그 외에는 전반적으로 만족스러웠고, 다음에도 이용할 의향이 있습니다.",4,4개월 전
y_83_009,전주 데이나이스,호오오이,전주여행을 급하게 계획해서 아무런 계획없이 예약한 숙박업소입니다 ㅎㅎ ! 전주한옥마을과는 많이 먼 숙소는 아닌데 택시타고 한 십오분정도? 가면 있어요!! 로비에는 아이스크림 마음대로 먹을 수 있게 구비되어있어 아이스크림 잘 챙겨먹었어요! 근데! 화장실 문이 없어서 많이 당황했어요ㅠㅠ 블라인드로 되어있어 적잖이 당황했습니다.. 그래도 적응하여 잘 지내다 왔습니다!!ㅎㅎ 만약에 화장실에 블라인드만 되어있어도 괜찮다 싶으신 분은 예약하셔도 무방할 것 같아요!,4,26일 전
y_83_010,전주 데이나이스,코로쿄쿄,욕실들어가는 문이 없는거랑 방에 창문이 안열리는게 좀 아쉬웠어요ㅠ,4,6일 전
y_83_011,전주 데이나이스,양세바리발,"여기어때 어플을 통해 숙박할 곳을 찾다가 전주 데이나이스 호텔을 발견하여 예약 후 시간에 맞춰 입실하였습니다. 입실 과정에서 친절하게 안내를 해주셔서 기분좋게 입실을 할 수 있었고, 입실하니 방 안 온도도 적절하게 설정되어 있었고, 침대도 푹신하여 예약한 시간동안 편안한 시간을 보낸 후 퇴실할 수 있었습니다. 갑작스럽게 예약한 후 방문한 숙소였는데, 쾌적하고 편안한 환경속에서 아주 만족스러운 시간을 보내고 나온 것 같다는 생각이 들어서 추후에도 재방문 의사가 있습니다.",4,4개월 전
y_83_012,전주 데이나이스,알쏭달쏭굴,"데이나이스는 깔끔하고 편안한 숙소로 였어요!!!. 특히, 객실은 청결하게 관리되어 쾌적한 휴식을 취할 수 있어서 좋았습니다. 침대, 배게가 편안해서 진짜 잠이 솔솔 왔어요. 드라이기, 고데기같이 필요한 물건이 잘 갖춰져 있어 불편함 없이 머물 수 있고요. 직원들도 친절했습니다. 샤워실에 샴푸, 드라이기, 바디워시 다 있어서 따로 챙겨올 필요도 없습니다. 근데 방 분위기는 살짝 어두운 편이라 밝은거 좋아하시는 분들은 좀 답답할 수도 있어요~~~ 어쨌든 담배냄새도 없고 굿입니다^^",5,6개월 전
y_83_013,전주 데이나이스,서켜나,"주차 공간이 다소 협소한 편이지만, 숙소에서 약 10m 정도 떨어진 곳에 외부 주차장이 따로 마련되어 있어 주차에는 큰 어려움이 없습니다. 다만, 이 외부 주차장은 숙박 고객뿐만 아니라 일반인도 함께 이용할 수 있어 혼잡할 때는 다소 불편함이 있었습니다. 로비에는 아이스크림 냉장고가 있어 자유롭게 아이스크림을 즐길 수 있었고, 냉장고 안에는 생수와 음료도 비치되어 있어 유용하게 이용할 수 있었습니다. 객실의 침대와 침구 상태도 나쁘지 않아 편안한 숙면을 취할 수 있었던 점은 만족스러웠습니다. 다만, 에어컨을 가동하니 이상한 냄새가 나서 껐고, 대신 창문을 열고 잠을 청해야 했습니다. 또 방 안의 조명을 리모컨으로 조작하려 했지만, 작동이 되지 않아 불편했습니다. 샤워기의 경우 거치대에 고정이 되지 않아 샤워하는 동안 다소 불편함이 있었습니다. 전반적으로 몇 가지 아쉬운 점은 있었지만, 숙면과 기본적인 편의는 갖춰져 있는 숙소였습니다.",2,2개월 전
y_83_014,전주 데이나이스,여기어때회원님,비치되어있는 충전기 선이 고장나서 요청드렸는데 바로 가져다주시고 되게 친절하게 안내해주셨어요! 에어컨도 잘 됐고 근처에 마트가 있어서 혼자 가서도 든든히 먹을 과자랑 과일을 저렴하게 샀습니당ㅎㅎ 테이블도 있는데 되게 편했고 뭐 시켜먹기도 좋은 것 같더라구요! 신시가지 번화가 주변에 위치해있어서 모임 후 가기에도 굳입니당 욕조도 있는 방으로 배정해주셨는데 넓었지만 사용하지 않았고 전체적으로 깔끔했어요 평일에 가서 사람이 없었는지는 몰라도 방음도 잘 되는 것 같았습니다!,5,10개월 전
y_83_015,전주 데이나이스,모험심있고완고한빨래,자주 가는 숙소에요 맘에 들어요,5,8일 전
y_83_016,전주 데이나이스,유쾌하고지혜로운실현,진짜 푹 쉬고 갈 수 있어서 좋았습니다! 배달 시켜서 맛있게 먹으면서 편안하게 쉬고가요~ 마침 눈 내리는날 여기 와서 눈사람도 만들고 엽떡에 뿌링클 시켜서 맛있게 먹었습니닿ㅎㅎㅎㅎ 사장님도 친절하셔서 물도 왕창 가져갈수 있고 연박하면 수건도 챙겨주십니다! 방에 물이 잘 안빠지는거 빼고는 수압도 강하고 방이 깨끗해서 신시가지에 있는 숙소중에서는 3순위 안에 들거 같은느낌? 애인이랑 같이 놀러와서 이틀밤 쉬고 갔는데 침대가 너무 편안해서 개꿀잠 자고 떠납니다~~~~~,5,4개월 전
y_83_017,전주 데이나이스,모험심있고완고한빨래,자주 애용하는 숙소입니다 깨끗하고 좋아요,5,17일 전
y_83_018,전주 데이나이스,모험심있고완고한빨래,자주 애용하는 숙소입니다 깨끗하고 좋아요,5,17일 전
y_83_019,전주 데이나이스,모험심있고완고한빨래,자주 애용하는 숙소입니다 깨끗하고 좋아요,5,17일 전
y_83_020,전주 데이나이스,모험심있고완고한빨래,자주 애용하는 숙소입니다 깨끗하고 좋아요,5,17일 전
y_83_021,전주 데이나이스,숙박하는공주,"너무 좋은 숙소! 주말에 가서 비쌌지만, 평일에 가면 더 좋을것같아요. 일단 신시가지 안에있어서 편의가 좋았습니다. 방도 너무 쾌적하고 냄새도 향긋했고, 1층에 아이스크림이 무료...인게 너무 대박..ㅎ 1일 1 아이스크림 했어요! 역시 인기있는 호텔은 다르다..다음에 오면 또 묵을것 같습니다 *^^* 너무 좋은 숙소! 주말에 가서 비쌌지만, 평일에 가면 더 좋을것같아요. 일단 신시가지 안에있어서 편의가 좋았습니다. 방도 너무 쾌적하고 냄새도 향긋했고, 1층에 아이스크림이 무료...인게 너무 대박..ㅎ 1일 1 아이스크림 했어요! 역시 인기있는 호텔은 다르다",5,1년 전
y_83_022,전주 데이나이스,숙박하는공주,"너무 좋은 숙소! 주말에 가서 비쌌지만, 평일에 가면 더 좋을것같아요. 일단 신시가지 안에있어서 편의가 좋았습니다. 방도 너무 쾌적하고 냄새도 향긋했고, 1층에 아이스크림이 무료...인게 너무 대박..ㅎ 1일 1 아이스크림 했어요! 역시 인기있는 호텔은 다르다너무 좋은 숙소! 주말에 가서 비쌌지만, 평일에 가면 더 좋을것같아요. 일단 신시가지 안에있어서 편의가 좋았습니다. 방도 너무 쾌적하고 냄새도 향긋했고, 1층에 아이스크림이 무료...인게 너무 대박..ㅎ 1일 1 아이스크림 했어요! 역시 인기있는 호텔은 다르다",5,1년 전
y_83_023,전주 데이나이스,V토토로V,출장으로 자주이용하는데 항상 청결하고 편안함 내부 정말 넓고 깨끗 주차장 편하고 베리굿,5,1개월 전
y_83_024,전주 데이나이스,Almondus,깔끔하고 쾌적해서 항상 이용합니다,5,14일 전
y_83_025,전주 데이나이스,한농대학생,좋습니다. 화장실도 넓고,5,1개월 전
y_83_026,전주 데이나이스,지혜지혜지혜52,"신시가지 바로 앞이라 접근성이 좋아요 근처에 맛집이나 놀곳도 많고 번화가 이동하기에도 편했어요! 밤에 시끄럽지 않을까 걱정했는데 생각보다 괜찮더라구요?! 직원분도 친절하시고 로비에 커피, 아이스크림도 있어서 좋았어요🥰 방도 크고 청소상태도 괜찮고 스타일러에 욕조까지 있어 대만족!! 다만 화장실&욕실에 문이 없고 블라인드?를 칠 수 있게 되어있어서 살짝 민망할수도 있어요..그리고 여기서 찬공기가 나오더라구요ㅠㅠ 방 공기가 전체적으로 차서 그게 살짝 아쉬웠어요! 그래도 재방문 의사 100%입니다<",5,5개월 전
y_83_027,전주 데이나이스,남다르고꼼꼼한지하,외관을 처음 봤을 때는 좀 오래되어 보이기도해서 걱정했어요. 일단 주차하기 어려운 신시가지에 주차장 잘 갖춰져 있어 편리했고 친절하셨습니다. 방안에 들어가보니 역시 좀 오래된 느낌이 있긴했지만 꽤 깔끔했어요. 침구도 잘 관리되어 있고 방 청결싱태가 좋아서 마음 놓고 묵을 수 있었습니다. 숙박시에는 다른 것보다 청결상태나 담배냄새 나지 않는 조용한 곳을 선호하는데 이런 점들이 잘 갖춰져있어서 만족하고 잘 수 있었던 곳이에요 워낙 위치가 좋아서 먹고 마시고 하기에난 딱이에요,3,11개월 전
y_83_028,전주 데이나이스,낙동강소만두,방깔끔하고 넷플도 잘되고 좋와요 컴퓨터 있는게 검색하기도 어렵게 그려요,5,1개월 전
y_83_029,전주 데이나이스,자립적이고탁월한염소자리,편안한 1박이었습니다 !,5,1개월 전
y_83_030,전주 데이나이스,진짜이용하고쓴다,조용하고 깔끔하니 좋았습니다~!,4,9개월 전
y_83_031,전주 데이나이스,화려한영공,트윈넓고 깨끗하였습니다 친절하세요,4,2개월 전
y_83_032,전주 데이나이스,멍멍아음매해봐,잠시 쉬어가기 좋은 곳입니다 추천,4,1개월 전
y_83_033,전주 데이나이스,중심적인주름,깔끔하고 좋습니다 다음에 또 놀러갈게요,4,3개월 전
y_83_034,전주 데이나이스,elevenlp,시설 좋고 가격도 저렴해서 지주 올꺼 같음 전주오면 예약 해야 겟네요^^,4,1개월 전
y_83_035,전주 데이나이스,숙소좋으면우는개구리,직원분이 너무 친절하셔서 좋아요,5,1년 전
y_83_036,전주 데이나이스,화려한영공,깨끗하고 넓어서좋아요 화장실문대신 자바라말고는 불편함없어요 아침은 커피만,5,2개월 전
y_83_037,전주 데이나이스,이건이궈,"전주에 출장 올 일이 있어서 방문했습니다. 위치는 전북도청 주변, 유흥거리와 음식점이 많은 전주 신시가지 주변에 있습니다. 신시가지 주변에는 이 모텔말고도 여러 모텔이 있지만, 이번에 기회가되서 여기로 오게 됐습니다. 주차공간은 2주차장 까지 있어서 여유롭게 주차를 할 수 있었습니다. 일반 객실을 예약했는데 방이 비교적 넓어서 좋았네요. 단지 아쉬운 점은 티비가 조금 오래되서 화면도 작고 넷플 지원도 안되네요. 이부분만 개선되면 메리트 있다고 생각합니다. 잘 쉬다 가요",5,7개월 전
y_83_038,전주 데이나이스,감동적이고맑은통로,신시가지에서 가까워서 좋습니다,5,1년 전
y_83_039,전주 데이나이스,김둥ol,객실 깔끔하고 청결해서 잘 쉬었습니다. 한가지 아쉬운건 늦게 입실해서 그런지 어메니티를 안챙겨주셨네요. 그리고 화장실 유리가 완전 투명이라 상당히 민망하네요..,4,11개월 전
y_83_040,전주 데이나이스,꼼꼼하고깔끔한꿈,많이 불편했던점 화장실이 오픈되어있다 침대에서 샤워실이 보인다 장점 깨끗함 시설이 좋음 난방이 좋음,4,5개월 전
y_83_041,전주 데이나이스,V토토로V,주변 다른곳보다는 조금더 나이스합니다. 가성비 만족입니다.,5,2개월 전
y_83_042,전주 데이나이스,레다히멍,시설 괜찮았습니다. 잘쉬고갑니다,4,3개월 전
y_83_043,전주 데이나이스,V토토로V,넓고 편안하게 푹쉬었어요 깨끗하네요,5,2개월 전
y_83_044,전주 데이나이스,딴거딴더딴거딴거,출장왔다가 이용하고 갑니다,4,5개월 전
y_83_045,전주 데이나이스,파란색구축함,약간 아쉽긴해도 혼자자기좋아요,3,8개월 전
y_83_046,전주 데이나이스,V토토로V,조용하고 따뜻하게 쉬었어요 업무 출장으로 이용했는데 깨끗하고 편안했습니다.,5,5개월 전
y_83_047,전주 데이나이스,자립적이고탁월한염소자리,정리 정돈 상태도 괜찮고 실내가 매우 깔끔 합니다. 생필품도 잘 비치 되어 있고,5,11개월 전
y_83_048,전주 데이나이스,라쥬야,물이 잘 안나오는거 외엔 좋아요,4,11개월 전
y_83_049,전주 데이나이스,여행알러지,끼끗하고 좋아요 다만 샤워기 높이가...,5,4개월 전
y_83_050,전주 데이나이스,진솔되고문학적인퇴출,그냥 무난했습니다. 잘 쉬었다 가요,3,1개월 전
y_83_051,전주 데이나이스,감동적이고우호적인멕시코,깔끔해서 이용하기 좋았어요.,5,3개월 전
y_83_052,전주 데이나이스,안녕하성준,잠깐 쉬다갔는데 깨끗하고 좋아용,4,6개월 전
y_83_053,전주 데이나이스,나는어떰,신시가지 근처에서 하루 묵는데 접근성도 좋고 시설도 깔끔하니 괜찮았습니다^^ 다음에도 이쪽에 올일 있으면 여기서 쉴것 같아요 ㅋㅋ,5,10개월 전
y_83_054,전주 데이나이스,충청남도레몬,방 깨끗하고 좋아요~~,5,6개월 전
y_83_055,전주 데이나이스,용인자연휴양림기사,쾌적하고 굿이었어요 담에또 이용의사있음,5,1년 전
y_83_056,전주 데이나이스,라쥬야,신시가지 한가운데 있어서 편함 시설도 괜찮음,5,10개월 전
y_83_057,전주 데이나이스,말뚱한소행성체,잘 쉬고 갑니다....,4,2개월 전
y_83_058,전주 데이나이스,말뚱한소행성체,잘 쉬고 갑니다....,4,2개월 전
y_83_059,전주 데이나이스,아이클리너,일정때문에 급하게 잡아서 오래는 못았었지만 좋았어요,5,5개월 전
y_83_060,전주 데이나이스,응답하라2020,넓고 깨끗하고 괜찬습니다.,5,4개월 전
y_83_061,전주 데이나이스,감동적이고우호적인멕시코,깨끗해서 이용하기 좋았어요.,5,3개월 전
y_83_062,전주 데이나이스,Almondus,편하게 잘쉬다가 갑니다,5,3개월 전
y_83_063,전주 데이나이스,nofear74,저희 부부가 전주에 각각 출장이 잡혀서 여기어때 어플을 통해 검색하여 선택하게 된 숙소인데요 최근 다녀본 숙소중에 가성비가 상당히 좋았습니다 깔끔한건 말할것도 없고 침구 청결상태는 100점이고 매트리스가 상당히 좋은걸 넣으셨는지 잠잘때 매우 편했습니다 화장실 또한 냄새 하나 없이 매우 깔끔했고 로비에서부터 충분한 추가음료가 비치되어 좋았으며 아이스크림도 원하는 사람은 편하게 갖다 먹을수있게 비치해주셨어요 샤워기에 살짝 문제가 있었는데 사장님께서 직접 올라오셔서 해결해주신것 감사합니다,5,5개월 전
y_83_064,전주 데이나이스,응답하라2020,넓고 수압좋고 괜찬습니다,5,5개월 전
y_83_065,전주 데이나이스,영서기님,"출장갈때마다 가고있어요 외부 주차장이 따로 있어서 좋아요 물,음료,아이스크림 구비되어 있어요",5,8개월 전
y_83_066,전주 데이나이스,얼씨구절씨구z,이번에도 잘쉬다 갑니다~,4,7개월 전
y_83_067,전주 데이나이스,응답하라2020,넓고 편안합니다...,5,5개월 전
y_83_068,전주 데이나이스,가무잡잡하고가냘픈수출,□ 아이스크림이 무료제공!! 시설물이 참 좋습니다! 방도 너무 깔끔합니다. □ 욕실문이 없네요~ □ 블라인드 추가하면 좋겠어요.,5,8개월 전
y_83_069,전주 데이나이스,tjdqhrlove,깔끔하네요 잠시지만 잘이용했어요,3,8개월 전
y_83_070,전주 데이나이스,동국님,출장왔는데 좋습니다 ㅎㅎ,4,9개월 전
y_83_071,전주 데이나이스,10778425,깨긋하고 친절하시고 좋아요,4,7개월 전
y_83_072,전주 데이나이스,바푸나,객실 상태가 좋았고 은근 꽤 넓은 편이었습니다.,4,3개월 전
y_83_073,전주 데이나이스,퀘st,편하게 잘쉬다 갑니다~,4,12개월 전
y_83_074,전주 데이나이스,빛나고남다른이스라엘,개인적으로 너무 만족하며 사용했습니다!!!,5,7개월 전
y_83_075,전주 데이나이스,simzzam,잘 쉬다가 갑니다 번창하세요,5,8개월 전
y_83_076,전주 데이나이스,영서기님,깨끗하고 좋아요 화장실 샤워실이 보이는거 말고는..,5,10개월 전
y_83_077,전주 데이나이스,10778425,깨끗하고 친절하시고좋아요 주변맛집많아서 좋아요,5,8개월 전
y_83_078,전주 데이나이스,얼씨구절씨구z,잘쉬다 갑니다 감사합니다,4,7개월 전
y_83_079,전주 데이나이스,영서기님,깨끗하고 좋은 방 이에요,5,10개월 전
y_83_080,전주 데이나이스,영서기님,깨끗하고 좋은 방 이에요,5,10개월 전
y_83_081,전주 데이나이스,10778425,깨끗하고 친절하시고 좋아요,5,7개월 전
y_83_082,전주 데이나이스,RickyJANG,출장으로 왔는데 편하게 쉬다갑니다,5,7개월 전
y_83_083,전주 데이나이스,RickyJANG,출장으로 방문했는데 잘쉬다갑니다,5,7개월 전
y_83_084,전주 데이나이스,날라서헤어핀,적당한가격 하루밤자는건 괜찮은정도,4,9개월 전
y_83_085,전주 데이나이스,ym4099011,너무 깨끗하고 좋았어요 다음에 다시 올거에요~,3,4개월 전
y_83_086,전주 데이나이스,빛나는진솔된,사장님친절ㅎㅎㅎㅎㅅ,5,9개월 전
y_83_087,전주 데이나이스,영서기님,전주로 출장갈때마다 이용하고 있어요,5,8개월 전
y_83_088,전주 데이나이스,영서기님,전주로 출장갈때마다 이용하고 있아요,5,8개월 전
y_83_089,전주 데이나이스,오이도비늘,깨끗하고 주차장넓ㅇㄷㅁ,5,8개월 전
y_83_090,전주 데이나이스,정직하고희망찬바바리코트,침대에 쌀알만한 벌레있었음 나머지는 전뷰 만족,3,9개월 전
y_83_091,전주 데이나이스,나루고,너무나 친절하게 응대해주셔서 감사합니다.,5,8개월 전
y_83_092,전주 데이나이스,치명적인오렌지주스,방 컨디션 좋고 1층에 아이스크림도 있어서 좋아요,5,9개월 전
y_83_093,전주 데이나이스,리민성,전주 놀러왔다가 잘 쉬다가요,5,8개월 전
y_83_094,전주 데이나이스,Jasonnnnn,"출장으로 인해 급하게 숙박결정... 급하게 숙박잡고 들어왔는데 방 컨디션도 꽤나 괜찮았고, 화장실 컨디션이나, 샤워기 수압 등 괜찮았습니다! 하지만, 화장실 비품이나(샴푸,린스,바디샤워, 그리고 화장 실 외부 세면대에 비치되어있는 치약!) 이렁게 차라리 일 회 용이었으면 조금 더 나쁘지 않을거 같아요! 주변에 상권은 그럭저럭이었고 편의점이나 식당도 꽤나 많이 있 었습니다 안좋은점은 딱히 많이 없었고, 방음도 그냥 그럭저럭 잘 되 는거 같은 느낌이에요.. 피곤해서 잘 못느꼈을지도..? 다음에도 이용할 생각 있음!! 근데 외풍이 있어서 조금 추움",4,8개월 전
y_83_095,전주 데이나이스,타잔11,샤워 꼭지가 볼트빠져서 떨어집니다. 배게에 누군가의 긴머리카락이 있더군요.찝찝함이.,2,4개월 전
y_83_096,전주 데이나이스,열정적이고바람직한샌드위치,TV 음성이 아에 안나옴,0,1년 전
y_83_097,전주 데이나이스,예순넷골든리트리버,샤워실 문이 따로 없어서 당황했지만 깨끗하고 좋았습니다,2,10개월 전
y_83_098,전주 데이나이스,지현닝이,사진과똑가타요가서잘만합니다,2,10개월 전
