id,name,nickname,review_content,rating,write_date
y_83_099,전주 데이나이스,니클로,전주 올 때마다 자주 이용하는 숙박업소입니다. 평균적으로 저렴한 가격에 이용할 수 있습니다. 업소 주변에 식당이나 주점들도 많이 있어서 식사나 다른 것들도 편하게 해결할 수 있습니다. 침구류는 청결하게 잘 정돈 되어 있습니다. 쾌적한 실내를 유지하고 있습니다. 어매니티 용품들도 잘 구비 돼 있어서 편리하게 사용할 수 있습니다. 욕실도 넓고 특히 샤워부스가 넓어서 편하게 이용할 수 있습니다. 주차장도 건물 자체에는 많은 차량이 주차하기 어려우나 외부에 넉넉하게 마련 돼 있어 걱정 없이 이용할 수 있습니다.,5,1년 전
y_83_100,전주 데이나이스,황소자리노름꾼,"객실이 생각보다 굉장히 크고 넓었어요 주변에 먹거리도 많고 막걸리골목까지 택시타고 10분정도 6-7천원 나왔던것 같아요 직원붐들 친절하시고 청결함 최고,, 방음도 잘되는 편인거 같아요",5,1년 전
y_83_101,전주 데이나이스,누리보듬3,"친구들을 만나러 전주에 오게 되었네요~ 친구들, 지인, 후배들과 전주에서 즐거운 저녁 식사를 하고 술도 한잔하고 숙소에 들어왔습니다 식사 장소와 가까운 곳이며 평점이 높은 곳으로 예약했는데 역시나 평점이 왜 높은지 알겠더군요~^^ 하루이긴 하지만 숙소가 지저분하면 기분이 망치기 마련인데 아주 청결하고 직원들도 친절하시고 모든 면에서 좋았네요~ 가성비도 좋아서 다음번에도 전주를 방문하면 당연히 또 예약할거고 지인도 방문한다면 적극 적극 추천하려고 합니다~^^",5,1년 전
y_83_102,전주 데이나이스,haran7,전제적으로 좋습니다. 화장실과 샤워장이 별도로 있고 욕조가 커서 좋습니다. 테이블도 하나 있어서 연인끼리 커플끼리 한잔 딱이네요 다만 아쉬운건 욕실 청소.. 그것만 빼면 완벽합니다.,4,1년 전
y_83_103,전주 데이나이스,이구역의방랑자,오랜만에 숙박하려고 찾던 중 이 숙소를 찾게되서 예약을 했는데요 외관과는 다르게 내부는 훨씬 깔끔하고 좋았어요 여기 근처에 맛집 술집 카페 등등 가까이 있어서 좋았어요 방안에 공기는 사알짝 차가운 감은 없지않아 있지만 침대안은 따뜻해서 좋았어요 숙박 가격도 사악하지않고 적당해서 아주 좋았고 다음에도 머물만한 곳인거 같아요 신시가지 근처에서 숙소를 찾고 계신다면 여기를 추천해드리고 싶네요!!,5,1년 전
y_83_104,전주 데이나이스,유교걸베비,"넓은 편에 속하는 숙소 침대 푹신푹신 주차장 넓음 가운이나 고데기, 넷플릭스 없음 화장실에만 거울 있음",4,1년 전
y_83_105,전주 데이나이스,RickyJANG,편하게 잘자고 갑니다.,4,1년 전
y_83_106,전주 데이나이스,RickyJANG,츨장이용했는데 잘쉬다갑니다,5,1년 전
y_83_107,전주 데이나이스,실없는천왕성,사장님이 친절하시고 시설도 깔끔해서 잘쉬다왔어요 신시가지 근처라 접근성도 좋고 배달도 빨라서 대실이용하는데 무리없이 보냈네요 티비로 영화랑 넷플도 잘보고왔네요ㅎㅎ 주변에 낙후된 모텔들 많은데 앞으로 자주이용할거같아요 번창하세요,5,1년 전
y_83_108,전주 데이나이스,불확실한석사,전주 신시가지 올때면 늘 묵는 숙소입니다 주차장이 외부에도 있어서 매우넓고 실내가 깨끗하고 직원분들도 친절하세요 다른지역에 비해서 전주쪽 객실사이즈가 큰편이지만 입실시간이 다소 늦은점은 다른지역에 비해 단점이긴 합니다만 신시가지는 대부분 숙소가 6시입실이네요 주변 숙소중에서는 저는 개인적으로 데이나이스 추천드리며 나머지는 그럭저럭 입니다 그리고 1층에 여분에 물과 아이스크림 커피가 비치되어있어 자유롭게 가져다드실수가 있습니다 전주에 오신다면 추천드립니다,5,1년 전
y_83_109,전주 데이나이스,귀여운말,숙소 넓고 깔끔해서 좋아요! 음료랑 아이스크림 제공에 반했어요,5,1년 전
y_83_110,전주 데이나이스,시큰시큰한스피드,시설대만족 가성비최인거같네요 시설너무깔끔하고 사장님애우친하시구요 아주착한모델같네오,5,1년 전
y_83_111,전주 데이나이스,jason8532,조용하며 깨끗합니다. 주변 신시가지와 인접해있어 편의시설등이 많습니다,4,1년 전
y_83_112,전주 데이나이스,한참놀나이,충전기가 망가져있고 다른콘센트 사용도 안대서 좀 아쉬워요ㅠ,4,1년 전
y_83_113,전주 데이나이스,허부영,위치좋은곳에 있고 깔끔했어요,5,1년 전
y_83_114,전주 데이나이스,GC15002070066,금액에 맞는 방이였슴니다,4,1년 전
y_83_115,전주 데이나이스,가*****,"직원분들이 너무 친절하세요. 전반적으로 가성비 있고 좋았지만, 밖에 소음이 너무 잘 들립니다.",4,1년 전
y_83_116,전주 데이나이스,RickyJANG,출장으로 이용하기 좋아요,4,1년 전
y_83_117,전주 데이나이스,꼼꼼하고꼼꼼한샴,너무 만족스러운 플렉스^^ 항상 좋아요^^,5,1년 전
y_83_118,전주 데이나이스,셋난폭기사,근처 먹을데많아 좋아용,5,1년 전
y_83_119,전주 데이나이스,대대적인거지,잘 쉬다 가요 또 왔습니드 ㅎㅎ,5,1년 전
y_83_120,전주 데이나이스,대대적인거지,잘 쉬다 갑니다 또 올게요 ㅎㅎ,5,1년 전
y_83_121,전주 데이나이스,RickyJANG,출장간 잘쉬다갑니다 ㅎㅎ,4,1년 전
y_83_122,전주 데이나이스,woohoohoot,신도시에 위치 가성비 좋음,5,1년 전
y_83_123,전주 데이나이스,감동적이고엄청난봉투,정말 편안하고 행복하게 이용하고 가요,5,1년 전
y_83_124,전주 데이나이스,미니8888,가성비 좋게 잘쉬다갑니다 침대도 푹신하니 편했어요,4,1년 전
y_83_125,전주 데이나이스,갸름한인삼차,깨끗하고 좋았어요 잘쉬다 갑니당,4,1년 전
y_83_126,전주 데이나이스,다라미다라밍,욕실 있는 사진 보고 예약을 했지만 없어서 아쉬웠지만..그래도 깨끗하고 좋았어요!,4,1년 전
y_83_127,전주 데이나이스,GC1506699127,청결하고 넓고 특히 개인적으로 화장실이 맘에드네여~~,4,1년 전
y_83_128,전주 데이나이스,딴또마왕,깔끔하고 시설좋고 아이스크림 맛집,5,1년 전
y_83_129,전주 데이나이스,gwangchuns,넓고 쾌적한 숙소 괜찮았어요,4,1년 전
y_83_130,전주 데이나이스,바르샤바소식,잘 쉬고 나왔습니다. 친절해요.,5,1년 전
y_83_131,전주 데이나이스,비러스윗정박,출장내려와서 너무 편하게 쉬다가 갑니다!,5,1년 전
y_83_132,전주 데이나이스,김치만두냠냠,침구류는 깔끔했지만 바닥에 기분나쁜 털들이 좀 있었어요 ㅠ 그리고 가운도 기본적으로 없었구요,3,1년 전
y_83_133,전주 데이나이스,안동파,청결하고 주위먹거리만아요 강추합니다,4,1년 전
y_83_134,전주 데이나이스,안동파,깨끗하고 주위먹거리만아요,4,1년 전
y_83_135,전주 데이나이스,GC14856325553,".....,,,,,",3,1년 전
y_83_136,전주 데이나이스,폭력적인한나,숙소가 깔끔하니 너무 좋습니다👍🏻👍🏻👍🏻👍🏻👍🏻굳굳,5,1년 전
y_83_137,전주 데이나이스,광화문보안관,화장실이 트여 있어서 커플들 환장할듯.. 화이팅 입니다,4,1년 전
y_83_138,전주 데이나이스,용맹하고자신감있는오렌지족,스타일러 있는 사진 보고 특실예약했는데 아무것도없네요 콘센트도 화장실쪽은 안되고 침대옆만 되고 커피포트 기계도 고장이네요,2,1년 전
y_83_139,전주 데이나이스,말콤잉,신시가지 깔끔한 호텔! 항상 잘 이용합니다,5,21시간 전
y_83_140,전주 데이나이스,평민적인마른오징어,"전주에 놀러와서 너무 좋았습니다.전주 신시가지에 위치한 데이나이스 모텔은 전반적으로 깔끔하고 아늑한 분위기가 인상적이며, 가성비 좋은 숙소를 찾는 분들에게 꾸준히 사랑받고 있습니다. 최근 2024년 6월 기준으로 “요근래 다녀본 숙소 중 최고로 아늑하고 맘에 드는 숙소”라는 찬사를 받을 만큼 객실 분위기와 위생, 서비스 측면에서 높은 만족도를 기록하고 있습니다 ￼. 특히 침대가 매우 편안하고 이불도 푹신해 숙면을 유도하며, 안내 데스크에서 제공하는 비락식혜와 사인머스캣 음료도 소소하지만 기분 좋은 포인트로 꼽힙니다 ￼. 주차 공간은 객실 옆 작은 주차장뿐 아니라 인근 넉넉한 외부 주차장이 있어 편리하며, 최근 후기들에 따르면 대체로 방음이 잘 되고 소음도 적은 편이라 조용한 숙박을 원하는 이들에게 적합합니다 (). 다만 “물 수압이 다소 약하다”는 아쉬움을 이야기하는 후기와, 2025년 초 “청결이 조금 아쉽다”는 의견도 종종 보이므로, 이 점만 개선된다면 더욱 완벽한 숙소가 될 것으로 보입니다",3,1일 전
