id,name,nickname,review_content,rating,write_date
y_86_252,호텔원 전주 이노시티,산업적인박달나무,"숙소에서 머물면서 매우 만족스러운 경험을 했습니다. 프런트 데스크 직원들은 친절하고 전문적이었으며, 체크인 과정이 매우 원활했습니다. 객실은 깨끗하고 넓으며, 편안한 침대와 고급스러운 욕실 용품이 인상적이었습니다. 또한, 호텔의 위치가 관광지와 가까워 매우 편리했습니다. 호텔 내 시설도 잘 관리되어 있었고, 전반적인 서비스 수준이 매우 높았습니다. 전체적으로 서비스와 시설 모두 최고 수준이었고, 다음에도 꼭 다시 방문하고 싶습니다. 호텔원 이노시티를 강력히 추천합니다.",5,1년 전
y_86_253,호텔원 전주 이노시티,인절미빙수,"장점 1. 혁신도시에 위치해있어 편의시설이 매우 가까움. 2. 주차장이 약간 좁긴 하지만, 늦은 저녁에 가도 주차할 공간이 있었음(평일 한정일수도!) 3. 깨끗하고 깔끔해서 기분이 좋음!! 4. 향이 좋아요 5. 침대 푹신해서 잠이 잘 옵니다!! 단점 1. 방음이 아예 안됨 옆방에 티비보는 소리도 들리고, 코고는 소리도 들림. 윗층에 쿵쿵거리는 소리도 들림. 별 신경 안쓰는 분들이라면 오셔도 될듯! 2. 캐리어 옮겨서 로비를 가는데 계단이..ㅜㅜ 3. 밥 먹을 수 있는 테이블이 따로 없어서 약간 불편함 출장때문에 갔는데 가성비 갑이었어요~!!!",5,1년 전
y_86_254,호텔원 전주 이노시티,프로출짱러,"좋았던 점 1. 깔끔한 조식 구성 2. 주변 밥먹을 곳이 많고, 편의점도 가까움 3. 침대가 아주 폭신하고 편안함 아쉬웠던 것 - 방음이 안됨: 옆 방의 통화소리까지 적나라하게 들림 - 복도가 너무 어두워서 잘 안보임 - 1층 로비에서 체크인 하고, 체크아웃은 4층임 그래서 어려움. 안내문에 써있다고는 하지만 잘안보임ㅠㅠ 결론 * 재방문 의사 없음ㅠ",5,2년 전
y_86_255,호텔원 전주 이노시티,도이가족,"일단 번화가에 있어서 편리성이 좋습니다. 직원분도 매우 친절하세요. 저녁 늦게 체크인 했는데도 친절하게 안내해주셨습니다. 방 크기도 적합했고, 특히 화장실이 넓고 분리되어서 좋았습니다. 침대와 TV 위치가 애매하기는 했는데, 큰 불편함은 없었습니다. 호텔방에 건물 4층부터 있는거 같은데, 건물 1~3층은 다른 상가들이 입점해 있었지만 숙박하는데 불편함은 전혀 없었습니다. 다만, 조식시간이 8~9시로 너무 짧은것이 아쉬웠습니다. 다시 방문한다면 해당 숙소 이용하겠습니다.",5,1년 전
y_86_256,호텔원 전주 이노시티,도이가족,"일단 번화가에 있어서 편리성이 좋습니다. 직원분도 매우 친절하세요. 저녁 늦게 체크인 했는데도 친절하게 안내해주셨습니다. 방 크기도 적합했고, 특히 화장실이 넓고 분리되어서 좋았습니다. 침대와 TV 위치가 애매하기는 했는데, 큰 불편함은 없었습니다. 호텔방에 건물 4층부터 있는거 같은데, 건물 1~3층은 다른 상가들이 입점해 있었지만 숙박하는데 불편함은 전혀 없었습니다. 다만, 조식시간이 8~9시로 너무 짧은것이 아쉬웠습니다. 다시 방문한다면 해당 숙소 이용하겠습니다.",5,1년 전
y_86_257,호텔원 전주 이노시티,너굴아아,생각보다 깨끗하고 좋았던 전주 출장 숙소였어요!공기 청정기도 있고 침구도 깨끗하고 그낌도 좋아서 만족했구요!화장실도 깨끗 만족했습니다.이제 전주 출장이 종종 많아질거 같은데 전주 출장은 무조건 여기로 와야겠어요.단점을 굳이 하나 뽑으라면 옆방이 티비 소리를 너무 크게 틀어 놓은건지 방음이 조금 부족한건지 소리가 좀 들렸지만 불편할 정도 아니였고 잘 시간 되니 조용했어요.그리고 근처에 이것저것 저녁 먹을곳도 있어서 편히다녀 왔습니다.,5,2년 전
y_86_258,호텔원 전주 이노시티,용소폭포핫도그,이번에 전주 여행을 가게되어서 예약을 했는데 숙소를 잘 고른거 같아요. 가격대비 객실이 넓은 편이고 욕실도 큰편입니다. 룸컨디션도 괜찮았고 인테리어도 깔끔해서 좋았아요. 그리고 칫솔치약이 제공되지 않으니 미리 준비해가시는게 좋습니다. 혁신동 근처에 깔끔하고 괜찮은 가게가 많아서 식사하고 한잔하기 좋습니다. 전주 시내하고는 좀 떨어져 있어서 한옥마을 가실꺼면 차로 20분정도 들어가셔야합니다.,5,3년 전
y_86_259,호텔원 전주 이노시티,즐겁고평범한여명,두번째 방문했어요! 선착순 이벤트?로 업그레이드되어서 슈페리얼에 머물게되었는데 아주 마음에 들었습니다. 청소가 마무리가 안된건지 세면대에 수건이 놓여져있었고 가운도 없어서 이야기했더니 바로 올라오시더라구요. 금방 해결해서 좋았습니다. 아침 조식도 좋았고 친절하셔서 좋았어요. 또 침대 뭐쓰시는지 모르겠는데 진짜 잠 잘잤습니다. 다른 호텔들은 침대 불편해서 잠을 잘 못자는데 여기는 꿀잠자요. 다음에 또 방문하겠습니다!!,5,3년 전
y_86_260,호텔원 전주 이노시티,나는야스키노맨,오랜만에 전주 놀러가면서 이용하게 됐어요 저는 매우 만족했는데요 아래의 이유를 들 수있을것같네요😊 1. 건물과 시설이 오래된느낌이 없었고 신식느낌이여서 보기도 이쁘고 청결도 좋아 보였어요 2. 가성비 있는 가격에 호텔에 머물 수 있었어요 3. 안내원분이 친절해서 좋았어요 4. 조식도 깔끔하게 잘나와서 만족했어요 5. 주차도 지하에 댈곳이 있고 토요일에 방문하였음에도 자리가 모자르지 않았어요(게다가주차비 무료!) 저는 다음에 전주놀러가도 여기머물것같네요 ㅎㅎ 잘 쉬다 갑니다~~^^ 이노시티 짱! 추천해요~~,5,1년 전
y_86_261,호텔원 전주 이노시티,뭐야너구리,진짜 가성비 짱 최고의 호텔 전주랑 거리가 있지만 전주여행에 묵기도 좋고 완주 전북 혁신도시 출장에도 묵기 좋은 곳 ! 가성비가 너무좋아서 이가격에 이퀄리티를? 할 수 있고 조식 먹는 공간도 예쁘고ㅠ이가격에 조식 포함이라니ㅠㅠ하면서 아침에 토스트랑 쥬스 또는 커피 마실 수 있어욤 근처에 먹을것도 많아서 밤에 앞에서 맥주한잔하기도 딱인 공간이었습니다 ㅎㅎㅎ 호텔 자주다니는데 정말 추천이욤,5,3년 전
y_86_262,호텔원 전주 이노시티,KONIMA2003,여기는 두번째 숙박을 하였는데 역시 수압에 문제가 있고 이번엘 티브이가 중간에 끊겨 너무 불편하고 조식의 다양한 한식으로 바꾸어서 좀더 낳은 조식분위기를 만들어주세요 다음에는 주변의 숙소를 이용하여 비교분석을 제대로 하려합니다 비데는 너무 좋았으나 수압이 약하고 커튼이 없어 물이 많이 튀어 욕실이 너무 미끄러웠으며 음료도 물만 달랑있어 조금 아쉬워 이것도 추가음료를 구비해주시면 좋겠네요 이불도 청결하지못해 아쉽네요,3,2년 전
y_86_263,호텔원 전주 이노시티,천재적인비행,1. 급하게 전주 여행왔다가 한옥마을 근처엔 숙소가 없어 깔끔해보여서 예약했어요 2. 청결상태는 완전 만족해요 3. 주차장은 조금 많이 협소해요 (출차시 조심) 늦게 체크인했을 때 이중주차가 필수지만 데스크에 키를 맡기면 발렛까지 해주시고 방까지 키를 가져다 주십니다 4. 원래 룸이 스탠다드였는데 무료로 업그레이드 해주셨어요 5. 방음도 잘 되는 것 같아요. 다른 방 소음이 안들렸어요 6. 아래층 상가에 있는 생맥주 쿠폰도 주셨어요 전체적으로 만족! 이쪽으로 온다면 재방문의사 100%,5,1년 전
y_86_264,호텔원 전주 이노시티,동막골유원지집적회로,"최고의 시설입니다 업무 때문에 전주에 머물러야 했는데, 좀 떨어져있어도 조용할 것 같아서 예약했는데 매우 만족해요! 일단 응대가 처음부터 끝까지 친절하셔서 기분이 매우 좋았습니다. 문을 열고 들어가면 깔끔한 향이 반기고, 인센스콘도 피우니 편안해서 향 좋아하시는 분들 오시면 좋을 것 같았어요. 혼자 온 거라 비즈니스텔 정도의 깔끔한 느낌을 원했는데 딱이고, 혼자 쓰기 커서 좋습니다. 인테리어도 매우 깔끔해요. 또 나오면서 분실물이 있는데 매우 친절히 응대해주셨습니다. 다음에도 또 올게요!",5,1년 전
y_86_265,호텔원 전주 이노시티,muessom,비지니스 호텔로 괜찮은것 같아요 체크인도 편하고 다채로 청결하고 방음도 잘 되는거 같아요 엘베가 카드키를 찍어야 올라갈수 있는데 키가 하나 제공되는 점이 좀 불편하네요ㅠ 2명이 이용하는데 잠깐 나갈일이 있어 키를 뽑고 안에서 1명이 자고 있었는데 청소하시는 분께서 문을 열고 들어와 깼다고 하네요ㅠㅠ 조식은 아침에 간단히 먹기 괜찮은 편입니다~ !!먹는곳도 깔끔하고 조용하고 예쁜것 같아요 어메니티를 따로 제공한다 써있던데 어메니티 제공 날짜가 지나서인지 이벤트가 끝난건지 어메니티는 따로 주는것이 없었고 기본적인 어메니티는 안에 있으나 칫솔치약 면도제품은 제공되지 않으니 챙겨가세요 방 컨디션은 괜찮았고 침대는 푹신하니 좋아요~!! 다음에 전주를 가게되면 또 이용할것 같네요 넷플릭스같은 시스템이 제공되지 않은건 아쉬었습니다ㅠ 조식은 아메리카노나 주스 선택인데 주스가 없어서 아이스티제공됬어요!!!!,3,3년 전
y_86_266,호텔원 전주 이노시티,매초롬한진돗개,————— 전주에 다시 올일이 생기기도 했고 운좋게 쿠폰이 생겨 오랜만에 다시 가볼까하고 예약하게 됬습니다 1년 전에 왔을 때도 좋은 객실 컨디션이었는데 여전히 객실상태도 좋고ㅎㅎㅎㅎㅎ 객실내에서 나는 향기도 그대로네요👍🏻👍🏻 전주혁신도시쪽 오실일 있으면 여기만한 숙소는 없는 것 같아요 타지에도 호텔원이 많이 있던데 한번 이용해 보고 싶을정도로 좋은 인상입니다 건물뷰여도 객실이 좋으니 전혀 문제될게 없네요ㅎㅎㅎㅎㅎ 다음에 이쪽 근방 오면 또 오고 싶네요 ————-,4,1년 전
y_86_267,호텔원 전주 이노시티,i*****,장점 - 사진이랑 비슷한 상태에요! 대게 사진하고 다른경우가 있는데 똑같은 컨디션 상태라 괜찮아요! 딱 연인이나 혼자 출장이나 여행와서 하룻밤 묵어가기 좋아요! 조명도 은은하니 좋아요! 그리고 인포 직원분 너무 친절해서 좋아요~^^ 주차는 좀 일찍 오면 괜찮고 늦게오면 주차 자리가 부족합니다! 단점 - 대신에 작은방이라 그런가 창이 있는데 열려고 보니까 비상계단쪽이라 블라인드 계속 쳐야 하는게 답답해요. 그리고 수건 구멍 뚫려 있어요.... ... 그리고 저번에도 말했지만 카드키가 하나 더 있으면 좋겠어요ㅠㅠ 하나라 밖에 외출 갔다가 오면 에어컨 꺼져서 냄새가 나요.......... 저번 룸은 괜찮았는데 이번에는 에어컨에서 살짝 냄새가 났어요! 단점 보완하면 좋을 거 같아요!,5,1년 전
y_86_268,호텔원 전주 이노시티,김*****,"여행와서 쉬려고 숙소 잡았는데 청결하고 업그레이드도 해주셔서 너무 좋았어요! 주변 맛집도 많고 수압도 강하고 깔끔했어요>< 특히 직원분이 엄청 친절하셨습니다!!다만.....방음이 조금 안되는 것 같아요 그리고 가운이 없는게 아쉬웠습니다..또 현관 쪽에 새벽에 갑자기 불이 켜져서 놀랐습니다,, 이것들 빼고는 다 좋았어요",5,3년 전
y_86_269,호텔원 전주 이노시티,카카777,전주 출장 때마다 가는 내 최애 호텔입니다. 정말 친절 끝판왕이예요!!! 청결하고 조용합니다!! 조식도 간단&깔끔~♡,5,3년 전
y_86_270,호텔원 전주 이노시티,KONIMA2003,오랜만에 좋은호텔에서 잘 보내고 왔습니다 먼저 가자마자 룸업그레이드 해주시면서 친절하게 맞아주셔서 고마웠습니다 방도 너무 깔끔하고 무엇보다 에이스침대 죄고였습니다 공기청정기도 마음에들고 샴푸 보디소프도 1회용 용기에 있어서 좋았습니다 전국과 해외를 1년에 150번이상 사용하는데 전주에서 가성비 최고의 호텔입니다 앞으로도 전주는 여기로 하려고합니다 여러분들도 한번 이용해보시면 좋으실거라고 여겨집니다,5,2년 전
y_86_271,호텔원 전주 이노시티,꼼꼼하고유쾌한라따뚜이,"엘베부터 객실 들어갈때까지 좋은향이 납니다. 깨끗하게 잘 관리되는 느낌이나, 수건이나 베개, 이불에는 약간의 얼룩들이 있어요. 주차장도 들어갈땐 괜찮은데 나올때 너무 비좁아서 큰 차들은 차빼기 힘들겠네요. 그래도 전체적으로는 일반 모텔들과는 다르게 호텔 같은 느낌을 받을 수 있네요. 만족스러웠습니다. 룸도 업그레이드 해주셔서 감사했고요, 전주 또 오면 재방문 의사있어요.",4,1년 전
y_86_272,호텔원 전주 이노시티,아흔일곱라이카,"위치가 좋습니다. 전주 교외이지만 출장으로 좋은 위치인거같네요. 방 컨디션은 깔끔하고 청결합니다. 복도소음외에 방간 소음은 없는거같습니다. 프론트가 크지 않지만 직원은 친절한 편입니다. 주말에는 이벤트라고 해서 웰컴 욕실시트를 주는것 같습니다. 주변에 먹을거리가 많고, 가까워서 음식걱정은 딱히 없을 것 같습니다. 이외에 필요한 사항은 프론트에 연락하면 즉각 대응해줍니다.",5,2년 전
y_86_273,호텔원 전주 이노시티,춘천숲레모네이드,남편과 함께 오랫만에 여행을 계획하면서 한번도 가본적이 없는 전주여행을 하게 되었습니다. 숙소가 가장 중요해서 검색을 하다가 전주한옥마을에서는 다소 떨어져있는 숙소를 예약했는데 생각보다 거리도 멀지않고 좋았어요. 체크인 하는날 방도 업그레이드 해주시고 룸 컨디션이 4성급 못지 않더라구요. 남편이랑 이가격에 진짜 예약한게 맞냐고 의아해했어요. 주변에 음식점도 많고 한옥마을 거리도 가까워서 예약하길 잘했다는 생각이 들었어요. 다음번 전주여행도 이곳으로 예약하고 싶어요.,5,1년 전
y_86_274,호텔원 전주 이노시티,지구가태양을네번,완주 놀러갔다가 후기 좋아서 예약했어요! 주차장 자리도 넉넉했고 직원분도 친절하셨어요. 룸상태도 깨끗하고 이용하진 않았지만 스타일러도 있어서 사용하실 분들은 이용하시면 좋을 거 같아요! 공기청정기도 배치되어 있고 에어컨도 빵빵하고 거기에 2시 입실 1시 퇴실... 아침잠이 많은 편인데 여유롭게 쉬다가 준비하고 나올 수 있었어요! 혁신도시 내 위치해 있어서 근처에 식당이 많아서 먹고 싶은 메뉴 충분히 즐기고 간단하게 술고 마실 수 있어요. 완주에 1박2일 머무는 동안 좋은 추억 만들어 주셔서 감사합니다!ㅎㅎ,5,1년 전
y_86_275,호텔원 전주 이노시티,모험심있고깔끔한너구리,"전주혁신도시 쪽으로 오면 항상 찾는 곳입니다 ! 주변이 번화가라 조금만 걷거나 차를 타고 가면 먹을 것도 많고 술집도 많아서 위치적으로 훌륭했던 것 같습니다 !!! 숙소 컨디션은 사진과 비슷한 것 같고, 넷플릭스, 쿠팡플레이, 유튜브 다 잘 돼서 잘 이용했습니다 ! 숙소도 깨끗하고 청결해서 묵는 동안 잘 지냈습니다!!! 화장실도 깨끗했고 수압도 잘 나와서 좋았습니다!!! 근처로 여행 오게 되면 또 찾을 거 같은 숙소 입니다 ~~침대도 푹신푹신해서 잠자기도 너무 좋았습니다!!",5,1년 전
y_86_276,호텔원 전주 이노시티,모야암거나해,"전주여행을 계획하고 숙소 고민을 정말 많이 하고 호텔원으로 2박 연박 예약했는데 너무 만족합니다. - 직원분 매우 친절하심 - 호텔이라 금연에 객실 매우 청결함 - 지하주차장 넓게 잘 되어있음 - 에어컨, 공기청정기 청소 잘되어있어 매우 깔끔 - 침구류 매우 좋아서 꿀잠 가능 (11시간이나 잤어요) - 조식도 기대했던거 보다 훌륭 - 레이트체크아웃 - 주변에 먹을곳 많음 - 객실 업그레이드 해주셨고 연박이라 청소 기대 안했는데 저희 외출했을때 청소랑 침구류 교체도 해주심 사실 주요 관광지들이랑은 거리가 조금 있어서 고민했지만 방문해보니 여자친구와 잘 선택했다고 좋아했습니다. 여행도 자주다니고 호캉스도 2주에 한번 정도 다니는데 가격대비 최고의 숙소였습니다.",5,2년 전
y_86_277,호텔원 전주 이노시티,너굴아아,공기 청정기 있어서 너무 좋았어요.이날 간남 미세먼지 나쁨이었거든요.전주 출장 자주 갈거 같은데 이제는 전주 출장 가면 무조건 여기로 가려고 합니다. 어메니티도 잘 준비되어져 있는 편이고 무엇보다 호텔임에도 가격이 나쁘지 않아 기분 좋게 이용했던거 같습니다.티비도 크고 좋았고 화장실도 좁지 않아 이용하기 좋았습니다.완전 최신식 호텔은 아니였지만 가격대비 깨끗한 호텔이었어서 적극 추천드려요.!,5,2년 전
y_86_278,호텔원 전주 이노시티,귀여운게젤조하,당일 급하게 예약했는데 생각보다 고급스러운 느낌이었고 청결했어요. 향이 되게 편하고 좋았어요. 조식도 간단/든든/맛있고 직원분이 너무 친절하세요~^^ 다음에 전주혁신도시오면 또 예약하고 싶어요😊,5,1년 전
y_86_279,호텔원 전주 이노시티,oasis8324,숙소너무좋아요 체크인할때 향기도좋고 무엇보다 1층에 식당이 많아서 저녁도 맛있게먹고 좋았습니다. 전주한옥마을이랑 차로 25분거리라 접근성도좋구요 거의호텔3성급인줄알았어요 방업그레이드도해주셨고 조식도 스프랑 넘맛있었어요 사람도별로많지않아서 조용했고 카페테리아도괜찮았습니다 조식드셔보셔도괜찮을것같아요 담에전북놀러올때이용하고싶어요 전북혁신도시도 사람도많고괜찮네요 푹쉬다가잘놀다갑니다담에도또이용할게요 가게번창하세요^^,4,1년 전
y_86_280,호텔원 전주 이노시티,쫑씬,만성동 올때마다 전주이노시티 호텔원 이용하는데 화장실 침대 책상 등 너무 깔끔하고 좋아요 그리고 직원분들도 너무 친절하셔서 부담없이 문의하고 편하게 이용가능합니다! 다음에 또 이용하겠습니다 감사합니다☺️,5,1년 전
y_86_281,호텔원 전주 이노시티,동두천포병학교,"5성급 부럽지 않은 호텔이었습니다. 창문도 크고 전망도 나쁘지 않았어요. 인테리어도 고급스러워서 마음에 들어요. 침구류 관리도 잘 되어있고 실내 온도도 딱 좋습니다. 화장실도 나눠져 있어서 건식으로 쓰기 좋았어요. 체크인, 체크아웃 시간도 저한테 딱이었네요. 출장 와서 예약한건데 다음에도 꼭 여기 하려구요. 물도 따뜻하게 바로 나오고 여러모로 만족합니다. 제대로 된 호텔 느낌이에요. 호텔 여기저기서 나는 향도 마음에 들어요. 스타일러도 바깥에 따로 비치되어 있어 좋았습니다. 잘 머물다 갑니다.",5,1년 전
y_86_282,호텔원 전주 이노시티,77세아마추어,"여기어때 이벤트를 통해서 이런곳에서도 쉬어보네요. 인테리어와 욕실은 고급졌으며 커다란 창문을 통해 보이는 시티뷰 또한 마음에 들었습니다. 정말 고급진 호텔이였고 편안하게 쉬었습니다. 우울하고 스트레스에 시달리던 일상에서 벗어나 재충전의 시간을 가지게 해 주셔서 감사합니다. 여기서 머물게 된 것이 하나의 큰 선물을 받은 듯한 느낌이였습니다. 호텔원에, 그리고 제 자신의 앞길에는 좋은일들만 가득하기를 기원합니다.",5,3년 전
y_86_283,호텔원 전주 이노시티,0922,남편과전주여행때 이용했는데 한옥마을에서 차로 멀지 않고 좋았습니다 한옥마을에 있는 숙소를 갈까했는데 구경하고 차로 돌아와도 충분히 올 수있는 거리입니다 침구류가 아주깨끗했고 욕실에 인센스도 있어서 아주 향기롭고 해외여행온것같은 향이 느껴졌어요 그리고 밤늦게 주차때문에 전화드렸는데 바로 해결해주셨어요 직원분들이 굉장히 친절하십니다 다음에 전주올일있으면 또 이용할것같아요,5,2년 전
y_86_284,호텔원 전주 이노시티,영구결번,혁신도시 중심부에 위치해있어서 근처에 먹을게 아주 많아요~~ 자차를 이용했는데 지하주차장이 있고 만차시 건너편 건물 지하주차장을 이용할 수 있어서 좋습니다. 화장실도 아주 넓고 깨끗해요. 복도도 넓고 좋은 향기가 나요. 다음에 전주에 또 방문하면 여기로 올 것 같네요ㅎㅎ 프론트 직원분도 정말 친절하십니다!! 단점은 테이블같은게 없어서 좀 불편하다는점정도네요.,4,1년 전
y_86_285,호텔원 전주 이노시티,하요꿀,옆방소리만 아니면 더할나위없이완벽할텐데 밤에 너무나 시달린 나머지 나머지 좋은것들이 눈에 안들어오더라구요 룸 업해주셔서 감사하고 정성 가득 아침식사도감사합니다 방도깨끗하고 욕실도 감탄 그자체 그치만 소음은 진짜 어떻게 해얄듯,5,3년 전
y_86_286,호텔원 전주 이노시티,굉굉한언니,우선 전반적으로 깔끔하고 만족스러웠어요. 어매니티 주신것도 향이 좋더라구요 룸은 에어컨도 잘 작동되고 침구는 살짝 무슨 부스러기 같은게 쪼금 있긴했지만 그냥 털어내고 잤습니다 다만 아쉬운 점은 화장실을 쓰는데 변기와 같이 있는 휴지통이 안비워져 있더라구요.... 청소하시면서 비우는걸 깜빡하신 듯 합니다. 이미 들어온 상태라 그냥 썼지만 좀 그랬습니다 ㅠ 휴지통 외에는 책상도있고 스탠드까지 쓸 수 있어서 면접 전날 온건데 지내고 가기 괜찮았습니다.,4,4년 전
y_86_287,호텔원 전주 이노시티,백이ee,"세면용품 없어서 불편합니다. 요즘 숙박업소들이 환경어쩌구하면서 추가금받는데, 걍 숙박비용 더받고 비용에 녹이는게 낫다고 보네요. 한두푼 내고온것도아닌데 들을때마다 짜증만 나고, 5만원짜리 모텔에는 있는데 굳이..? 숙소는 깔끔함. 근데 방음이 좀 안됨. 새벽까지 비즈니스 통화하는 사람 목소리가 다 들림. 응대 해주시는 분은 친절하고 잘 해주셔서 좋았음. 조식 신청 안하고 조식 사 먹으려고갔었는데, 조식먹는곳에 아무도없고 그래서 그냥 나와서 먹음. 조금아쉽",4,1년 전
y_86_288,호텔원 전주 이노시티,i*****,"지난번에는 창문이 쟉아서 답답함 감이 있었는데, 이번에는 한쪽면이 전체 유리창 방문을 주셔서 너무나 좋았어요! 환기 시키려고 열었는데 어제 오늘 날씨가 심해서 유리창이 팍 열려져서 닫으려는데 잘못하면 앞으로 떨어질 거 같더라구요 유의하셔야 할 점 입니다. 그리고 룸 컨디션은 예약시 사진으로 본 그대로라 따로 걱정 안하셔도 돼요! 수건 여유분 요청 드렸더니 바로 가져다 주셔서 너무 좋아요 올때마다 만족 합니다~^^ 또 재방문 의사 있어요 친구, 연인, 가족, 혼자 방문해도 좋아요. 근처에 맛집 많습니다^^",5,1년 전
y_86_289,호텔원 전주 이노시티,눈누난나나내나,갑작스레 여행을 가게 되어 예약했는데 너무너무 만족합니다. 시설도 깔끔하고 늦게가서 주차자리가 없었는데도 직접 발렛파킹도 해주셨습니다 4층에 있는 홍차서비스도 이용할 수 있어서 매우 좋았어요 침대매트도 고급진거라 매우 편했고 TV도 커서 굉장히 만족하며 사용하였습니다 화장실도 깔끔해서 좋았고 들어가자마자 아로마 향이 나서 기분이 좋았어요 조식또한 정말 맛있었습니다 또 들려서 쉬다가고 싶은 숙소입니다!,5,2년 전
y_86_290,호텔원 전주 이노시티,코코넛카밀,"숙소 진짜 깔끔하고 좋았어요 !! 청결도도 만족스럽고 위치도 나쁘지 않았습니다. 다만 단점은 10시이후엔 무인으로 운영이되었고 밤시간대에는 프론트로 연결이 어려워 소통이 많이 어려웠습니다. 주차공간이 협소하였지만 그래도 주변 공터에 주차할 수 있어 좋았구요 주변에 여러 맛집, 카페가 있는 번화가에 위치해 있어서 접근성은 참 좋은 것 같네요 전주 방문하게되면 한번 더 머무를 것 같습니다.",5,2년 전
