id,name,nickname,review_content,rating,write_date
y_86_090,호텔원 전주 이노시티,송길동이,전주에서 숙박할 일 생기면 항상 이곳에서 묵어요. 일단 룸 자체가 청결하고 수건이나 다른 소모품들이 깨끗해서 좋아요. 그리고 요즘 호텔 근처에 먹거리도 많이 생겨서 저녁에 나와서 주변 돌아다니기도 좋습니다.,5,3개월 전
y_86_091,호텔원 전주 이노시티,딴거딴더딴거딴거,행사 때문에 왔다가 잘 쉬고 갑니다.,4,3개월 전
y_86_092,호텔원 전주 이노시티,백김치김치구이,결론 약간 별로 총점 🌕🌕🌗 첫인상은 너무 좋았다 이전에 잡았던 숙소도 너무 호텔같고 좋았는데 이곳이 더 좋은느낌이었다 방 침대푹신해 분위기좋아 화장실 말끔해 번화가라 갈곳많고 밥집 술집많아! 직윈 친절해 주차장 좁지만 괜찮아 인센스콘 너무 매력있어! 전체적으로 너무 만족스럽게 입실했다 문제는 여기서 부터. 유리컵 이가 약간 나가있었고 세수하고 수건을 한장 썼는데 구멍이 3개나 나고 약간 너덜너덜했다 그때까지도 아 여기 전체적으로 너무 좋은데 여기서 좀 깍아먹네... 하고 말았다 근데 방에 좀 있으니까 밖에소리너무 잘들리고 특히 옆방 소리가 진짜 다들린다 방음이 하나도 안되고 틀어놓은 음악소리도 들린다.. 진짜 진짜 말도 안되게 잘들린다 특히 화장실 쪽이 옆방이 샤워기 틀어놓으면 소음이느껴질정도.. 그리고 아침에 씻으러 들어갔는데 샴푸 써있는 통에 린스 틀어있고 린스통에도 린스.... 샴푸는 없고 린스만 두개....진짜 너무 짜증났는데 또 조식이 맛있어서 살짝 괜찮아졌다,2,8개월 전
y_86_093,호텔원 전주 이노시티,초록빨때,"전주 호텔원 이노시티에서의 숙박은 정말 만족스러웠습니다. 호텔은 현대적이고 깔끔하며, 방도 넓고 쾌적했습니다. 침구는 편안했고, 청결 상태도 훌륭했습니다. 특히 객실 내에 있는 다양한 편의시설이 잘 갖춰져 있어 편리하게 사용할 수 있었습니다. 프런트 직원들의 친절한 서비스도 인상적이었으며, 체크인과 체크아웃이 빠르고 간편했습니다. 호텔 위치도 전주 주요 관광지와 가까워 이동이 편리했습니다. 전체적으로 가성비가 매우 좋은 숙소로, 다시 방문하고 싶은 곳입니다.",5,8개월 전
y_86_094,호텔원 전주 이노시티,초록빨때,"전주 호텔원 이노시티에서의 숙박은 정말 만족스러웠습니다. 호텔은 현대적이고 깔끔하며, 방도 넓고 쾌적했습니다. 침구는 편안했고, 청결 상태도 훌륭했습니다. 특히 객실 내에 있는 다양한 편의시설이 잘 갖춰져 있어 편리하게 사용할 수 있었습니다. 프런트 직원들의 친절한 서비스도 인상적이었으며, 체크인과 체크아웃이 빠르고 간편했습니다. 호텔 위치도 전주 주요 관광지와 가까워 이동이 편리했습니다. 전체적으로 가성비가 매우 좋은 숙소로, 다시 방문하고 싶은 곳입니다.",5,8개월 전
y_86_095,호텔원 전주 이노시티,초록빨때,"전주 호텔원 이노시티에서의 숙박은 정말 만족스러웠습니다. 호텔은 현대적이고 깔끔하며, 방도 넓고 쾌적했습니다. 침구는 편안했고, 청결 상태도 훌륭했습니다. 특히 객실 내에 있는 다양한 편의시설이 잘 갖춰져 있어 편리하게 사용할 수 있었습니다. 프런트 직원들의 친절한 서비스도 인상적이었으며, 체크인과 체크아웃이 빠르고 간편했습니다. 호텔 위치도 전주 주요 관광지와 가까워 이동이 편리했습니다. 전체적으로 가성비가 매우 좋은 숙소로, 다시 방문하고 싶은 곳입니다.",5,8개월 전
y_86_096,호텔원 전주 이노시티,효과적인비행기,전주 혁신도시 최고의 갬성 숙소 호텔 이노원입니다 객실에서 주는 어메니티도 다른 곳들이랑 뭔가 결이 달라요 목욕할때 피우는 향도 아주 기분이 좋습니다 위치도 아주 좋아요 추천 전주 혁신도시 최고의 갬성 숙소 호텔 이노원입니다 객실에서 주는 어메니티도 다른 곳들이랑 뭔가 전주 혁신도시 최고의 갬성 숙소 호텔 이노원입니다 객실에서 주는 어메니티도 다른 곳들이랑 뭔가 결이 달라요 목욕할때 피우는 향도 아주 기분이 좋습니다 위치도 아주 좋아요 추천 드립니다 ^^ 목욕할때 피우는 향도 아주 기분이 좋습니다 위치도 아주 좋아요 추천 드립니다 ^^ ^^,5,8개월 전
y_86_097,호텔원 전주 이노시티,초록빨때,"전주 호텔원 이노시티에서 2박 3일 동안 숙박하면서 만족스러운 경험을 했습니다. 객실은 넓고 깔끔했으며, 청소 상태도 매우 좋았습니다. 특히 침대가 편안해서 여행 중 피로를 풀기에 안성맞춤이었어요. 조식도 다양하게 준비되어 있어 든든하게 하루를 시작할 수 있었습니다. 주변 상권이 잘 발달되어 있어 식사나 쇼핑도 편리하게 해결할 수 있었고, 직원들이 매우 친절하고 필요한 요청에 신속하게 대응해 주어 더욱 기분 좋은 숙박이었습니다. 전주를 다시 방문하게 된다면 재숙박할 의향이 있습니다.",5,9개월 전
y_86_098,호텔원 전주 이노시티,초록빨때,"전주 호텔원 이노시티에서 2박 3일 동안 숙박하면서 만족스러운 경험을 했습니다. 객실은 넓고 깔끔했으며, 청소 상태도 매우 좋았습니다. 특히 침대가 편안해서 여행 중 피로를 풀기에 안성맞춤이었어요. 조식도 다양하게 준비되어 있어 든든하게 하루를 시작할 수 있었습니다. 주변 상권이 잘 발달되어 있어 식사나 쇼핑도 편리하게 해결할 수 있었고, 직원들이 매우 친절하고 필요한 요청에 신속하게 대응해 주어 더욱 기분 좋은 숙박이었습니다. 전주를 다시 방문하게 된다면 재숙박할 의향이 있습니다.",5,9개월 전
y_86_099,호텔원 전주 이노시티,초록빨때,"전주 호텔원 이노시티에서 2박 3일 동안 숙박하면서 만족스러운 경험을 했습니다. 객실은 넓고 깔끔했으며, 청소 상태도 매우 좋았습니다. 특히 침대가 편안해서 여행 중 피로를 풀기에 안성맞춤이었어요. 조식도 다양하게 준비되어 있어 든든하게 하루를 시작할 수 있었습니다. 주변 상권이 잘 발달되어 있어 식사나 쇼핑도 편리하게 해결할 수 있었고, 직원들이 매우 친절하고 필요한 요청에 신속하게 대응해 주어 더욱 기분 좋은 숙박이었습니다. 전주를 다시 방문하게 된다면 재숙박할 의향이 있습니다.",5,9개월 전
y_86_100,호텔원 전주 이노시티,초록빨때,"전주 호텔원 이노시티에서 2박 3일 동안 숙박하면서 만족스러운 경험을 했습니다. 객실은 넓고 깔끔했으며, 청소 상태도 매우 좋았습니다. 특히 침대가 편안해서 여행 중 피로를 풀기에 안성맞춤이었어요. 조식도 다양하게 준비되어 있어 든든하게 하루를 시작할 수 있었습니다. 주변 상권이 잘 발달되어 있어 식사나 쇼핑도 편리하게 해결할 수 있었고, 직원들이 매우 친절하고 필요한 요청에 신속하게 대응해 주어 더욱 기분 좋은 숙박이었습니다. 전주를 다시 방문하게 된다면 재숙박할 의향이 있습니다.",5,9개월 전
y_86_101,호텔원 전주 이노시티,해왕성두더지,전주에서 제일 괜찮은 숙소라고 생각해요. 편하게 쉬고 가요. 다만 tv 켜기 불편해요. 잘 안 켜져요.,5,5개월 전
y_86_102,호텔원 전주 이노시티,곤색시점,가격대비 깨끗해서 좋아요! 주차장이 좁고 전기차 충전할 수 없는 곳이 없어서 아쉽지만 그래도 만족합니다!,4,5개월 전
y_86_103,호텔원 전주 이노시티,진또배긔,전주에 이런 고급스러운 숙소가 있는지 처음 알았습니다!! 출장 겸 휴식하려고 숙소 잡았는데 고급스러운 욕실과 푹신한 침대 그리고 상권이 바로 앞에 자리잡고 있어서 맛있는 저녁과 제대로 된 휴식을 취할 수 있었던 것 같습니다. 나중에 또 방문하게 된다면 재방문 의사 10000%입니다!!!! IC에서도 가까워서 다음날 다른 곳으로 나가기에도 좋고 들어오기도 좋았던 것 같습니다!! 다음에도 방문해서 또 좋은 시간 보내야겠습니다~~ 그리고 주차도 널널하니 좋더라고요!!,5,7개월 전
y_86_104,호텔원 전주 이노시티,효창공원올빼미,숙소는 너무 좋았는데 난방이 잘안되는지 너무 추웠습니다. 아무리 컨트롤러로 조절해도 작동이 안되더군요. 아침에 자고일어났더니 20도 밑이었습니다. 또한 새벽에 전체 불이 한번에 켜지고 또 다시끄면 또 켜지고를 반복해서 잠을 설쳤습니다. 또 옆방이 새벽에 싸우는지 시끄러워서 로비에 전화를 걸었는데 안받더군요. 그래서 결국 춥고 시끄러운상태에서 잠을 설쳤습니다. 위치나 청결은 정말 좋은데 조금 아쉬운 숙박이었습니다.,5,5개월 전
y_86_105,호텔원 전주 이노시티,이누지환,프론트 직원분도 친절하시고 방이 일단 너무 깨끗하고 청결해서 좋았습니다 또 이용할게요~,5,4개월 전
y_86_106,호텔원 전주 이노시티,뚜오럽창사,너무 잘 쉬다 옵니다~~~ 전주 여행가면 다시 방문하고싶은 곳이에요~,4,10개월 전
y_86_107,호텔원 전주 이노시티,진중하고신나는못,너무 재미있어요 다음에 또올게요,5,3개월 전
y_86_108,호텔원 전주 이노시티,선동적인호들갑,객실 상태 좋고 근처에 편의시설들 다있어서 차놓고 다녀도 좋아요~ 문건 놓고 간게 있어서 연락드렸는데 찾아봐 주셔서 감사합니다,5,6개월 전
y_86_109,호텔원 전주 이노시티,홍펭귄,방음이 어마어마하게 안돼요.... 합판 하나 사이에 두고 있는 느낌 특히 욕실에선 옆방사람 통화내용도 다 들립니다 ㅜㅜ... 재방문은 어려울듯,4,5개월 전
y_86_110,호텔원 전주 이노시티,중동서원분유,2차 방문입니다 가격대비 최고입니다 일찍 입실하면 룸 업그레이드도 해주십니다. 전주에서는 가성비 최고입니다. 또 방문할 계획있습니다. 요청하면 가운과 수건도 더 받을 수 있고 무엇보다 호텔 내에서 굉장히 좋은 냄새가 납니다. 혁신도시 내에 있다보니 많은 음식점을 편하게 이용할 수 있어 장점이고 단점으로는 딱 2개가 있긴 있는데 수건 가운에서 털이 좀 날립니다 그리고 ott 이용 시에는 개인 계정을 사용해야하는 번거로움이 있습니다만 룸 컨디션이 좋으니 다 상쇄됩니다 조만간 또 방문하겠습니다 감사합니다.,5,8개월 전
y_86_111,호텔원 전주 이노시티,힘찬보충병,"매번 전주 출장 올때마다 머무는 곳입니다. 혁신에서 가장 풀부킹이 되는 호텔이지 않을까 싶네요. 주변에 상가랑 먹거리 많고 맛집도 많습니다. 숙소는 구조적으로 1층 프론트 4,5,6 층 객실로 이뤄져있고 퇴실시에는 4층에 키만 놔두고 퇴실하면 되네요. 다만 주차장이 객실수에 비해 현저하게 부족하니 주차 못하실 경우에 대비해 일찍오면 좋습니다. 없을 경우에는 길거리에 주차하면 됩니다. 화장실도 넓고, 깔끔합니다. 방향제를 설치해놨는지 방에 입실시 향기나는 점이 나쁘지 않네요.",5,7개월 전
y_86_112,호텔원 전주 이노시티,남다르고다감한버튼,푹 쉬엇다가갑니다ㅏㅏㅏ,5,2개월 전
y_86_113,호텔원 전주 이노시티,여기어때0대표이사,이용했습니다.....,5,6개월 전
y_86_114,호텔원 전주 이노시티,안락동큰형님,한 건물이 아니라 주상복합 같은 형태라 조금 생소했는데 시설이나 청결은 매우 좋네요 괜히 인증숙소가 아닌가 봅니다 롬에 제공된 인센스 향도 너무 좋고 조식도 맛있었어요 잘 쉬다 갑니다!!,5,11개월 전
y_86_115,호텔원 전주 이노시티,앙뇽하세요오,따뜻하고 푸근하니 좋았어요!어메니티 매진은 좀..,4,6개월 전
y_86_116,호텔원 전주 이노시티,비둘기색열차,깨끗하고 직원분들도 친절하세요!,4,1개월 전
y_86_117,호텔원 전주 이노시티,써니416,늦게.체크인 했는데 친절하게 키 안내 해주시고 특가라 뷰는 창문 열면 벽 뷰지만 깔끔하고 깨끗합니다. 개인적으로 침구도 마음에 들구요.,5,7개월 전
y_86_118,호텔원 전주 이노시티,기념공원포병대,깨끗하고 심플하고 사용하기 좋은 객실이었어요. 외부.내부 시설도 깔끔하고. 친절하게 매번 대해주셔서 좋더라구요. 항상 차를 가지고 이동하는데 주차장도 있고. 기분 좋게 쉬다가 갑니다.,5,1년 전
y_86_119,호텔원 전주 이노시티,드레이스크,시설두좋구 너무깨끗합니다,5,1개월 전
y_86_120,호텔원 전주 이노시티,푸푸라마,전주가는편인데 처음 알게된 숙소예요 금액이 착해서 많을걸 기대하지말고 가자 이랬는데 와~완전 호텔급 룸상태였어요~ 공기청정기도 있어서 냄세는 전혀안나고 청결상태도 너무 좋았어요,5,9개월 전
y_86_121,호텔원 전주 이노시티,바바리안만세,깔끔하고 아주 좋았습니다,5,1년 전
y_86_122,호텔원 전주 이노시티,산업적인박달나무,시설이 너무 깨끗해서 좋았어요 !!!!!특히 직원분들이 모두 친절하셔서 편하게 이용할수있었습니다 조식도 늦게갔는데 직원분이 챙겨주셔서 맛있게 먹었습니다 ~~~~~ 일단 주변에 먹을거리도 많아서 나와서 저녁먹기에도 좋고 또 숙소가 깔끔해서 안에서도 쉬기 너무 좋았습니다!!!!! 다음에도 혁신에 숙소를 잡게된다면 다시 여기로 오고싶습니다 직원분들이 다 친절하셔서 기분좋게 숙박을 이용할수 있었습니다~~~~~ 아쉬운건 없었습니다 방도 넓은거로 배정해주셔서 너무 감사했습니다,5,1년 전
y_86_123,호텔원 전주 이노시티,한화리조트알로에,깨끗하고 좋아요. 프론트에 전화를 너무 안받으셔서 살짝 짜증났지만요.,5,1년 전
y_86_124,호텔원 전주 이노시티,고라니고릴라,저는 화장실을 중요하게 생각하는데 변기와 샤워부스랑 세면대랑 다 분리되어있어서 좋았습니다. 아쉬운점은 간이 테이블이 없어서 간단한 짐 올려두지 못해 아쉬웠네요ㅠ 그래도 아늑하고 깔끔해서 만족합니다 !,4,4개월 전
y_86_125,호텔원 전주 이노시티,별명이뭐고,인테리어 적으로는 괜찮습니다 체크인은 1층에서만 가능합니다. 방을 가벽으로 했는지 옆방의 통화소리가 들립니다.,4,4개월 전
y_86_126,호텔원 전주 이노시티,해왕성두더지,"전주 외곽에 있어 관광지라 멀긴 하지만 도리어 그렇기 때문에 합리적인 가격으로 좋은 시설에 묵을 수 있었다고 생각합니다. 위와 같이 숙소에서 제공하는 사진이랑 시설 동일하고 청소상태도 최상입니다. 조식도 따뜻한 빵과 스프, 샐러드 다 맛있었어요.",5,7개월 전
y_86_127,호텔원 전주 이노시티,의*****,전에 갔을 때 깨끗해서 만족하고 갔었는데 이번에는 침대 시트에 오염이 있었어요,4,6개월 전
y_86_128,호텔원 전주 이노시티,듬직한휴업,근처 다른 곳은 이름이 호텔이고 모텔 느낌인데 여기는 호텔 분위기,5,6개월 전
y_86_129,호텔원 전주 이노시티,먹거리마을꿩,조식도 맛있고 방도 깔끔하고 좋아요,4,6개월 전
y_86_130,호텔원 전주 이노시티,공쥬2223,안 좋은 리뷰도 몇 개 있았지만 좋은 리뷰가 더 많고 좋아보여서 선택함 매우 만족!,5,7개월 전
y_86_131,호텔원 전주 이노시티,바다의왕자123,퍈안햇으나 조식 서비스 메뉴가 더 다양하면 좋겠네요,4,11개월 전
y_86_132,호텔원 전주 이노시티,덴신,가성비 좋아요!!!!,5,5개월 전
y_86_133,호텔원 전주 이노시티,주도적이고활발한팬케이크,편하게 쉴수있어서 좋았습니다,4,6개월 전
y_86_134,호텔원 전주 이노시티,자두자두2020,깔끔하고 괜찮았어요!,4,1년 전
y_86_135,호텔원 전주 이노시티,정직한석식,기분 좋게 머물렀습니다,5,6개월 전
y_86_136,호텔원 전주 이노시티,mockrren,침구류도 깔끔하고 욕조도 있어서 아주 좋았어요,5,8개월 전
y_86_137,호텔원 전주 이노시티,진중하고신나는못,너무 잘 지내고 왔습ㄴ다,4,4개월 전
y_86_138,호텔원 전주 이노시티,엘렌예거,출장 올때마다 이용합니다 조식까지 제공되니 좋습니다,5,4개월 전
y_86_139,호텔원 전주 이노시티,국악으로국위선양,다음에 전주 방문시 다시 이용계획입니다,4,5개월 전
y_86_140,호텔원 전주 이노시티,나*****,처음으로 이용했었는데 깔끔그자체입니다. 냄새도 너무 좋았고 와이드해서 만족 200%,5,5개월 전
y_86_141,호텔원 전주 이노시티,카카777,제가 전주 출장올 때마다 오는 호텔입니다. 청결도가 우선 정말 맘에 들구요~ 방의 색감과 조식이 제 취향에 정말 잘 맞습니다. 꾸준히 계속 방문할 호텔입니다!!!,5,7개월 전
y_86_142,호텔원 전주 이노시티,쫑씬,편하고 너무 좋아요! 오늘도 역시 친절하십니다 감사합니다☺️☺️,5,1년 전
y_86_143,호텔원 전주 이노시티,거슬거슬한대리,전주올거면 여기 와야겠어요. 서비스도 좋았고 온돌이 데워져서 공기가 따뜻해서 더 좋았습니다!,5,7개월 전
y_86_144,호텔원 전주 이노시티,귀여운탱아,좋았어요 완전 다사용할게요,5,4개월 전
y_86_145,호텔원 전주 이노시티,진중하고신나는못,매번 즐겁게 이용합니다,5,4개월 전
y_86_146,호텔원 전주 이노시티,강렬하고탁월한케이블카,잘 묵거갑니다 시설 좋아요,5,5개월 전
y_86_147,호텔원 전주 이노시티,헤시리헤보,적극 추천하는 숙소입니다,5,6개월 전
y_86_148,호텔원 전주 이노시티,테드81,조식이 아쉽지만 전반적으로 만족합니다,5,5개월 전
y_86_149,호텔원 전주 이노시티,ParkIK,깨끗하고 친절하고 너무좋아요,5,6개월 전
y_86_150,호텔원 전주 이노시티,드레이스크,너무깨끗하고 좋았습니다,4,1년 전
y_86_151,호텔원 전주 이노시티,와이앤제이컴퍼니,전주 출장때 들린곳인데. . 쾌적하고 넘 좋네요.. 담에도 여기 예약하려구염,4,10개월 전
y_86_152,호텔원 전주 이노시티,쫑씬,완주올때마다 이용하는 호텔원! 암막커튼치니 너무아늑하고 숙소가 깔끔해요! 푹 쉬엇다가 갑니다 ㅎㅎ 감사합니다!!!,5,10개월 전
y_86_153,호텔원 전주 이노시티,안녕쿵쿵쿵,늦게도착했는데도 안내해주셔서 편하게 다녀왔습니당,4,4개월 전
y_86_154,호텔원 전주 이노시티,성공한사업가,♡♡♡♡♡위치 좋고 청결합니다.,5,8개월 전
y_86_155,호텔원 전주 이노시티,박셈,건물내부가 깔끔하고 편했습니다 잘쉬고 갑니다,4,3개월 전
y_86_156,호텔원 전주 이노시티,오밀조밀한현실,조용하고 깨끗해요! 주변에 맛집이 많아요~~^^,5,8개월 전
y_86_157,호텔원 전주 이노시티,GC14717947642,항상 전주혁신올때마다 방문합니다 최고에요!,5,4개월 전
y_86_158,호텔원 전주 이노시티,진중하고신나는못,너무너무 재밌고 알차게 잘 이용했습니다 감사합니다,5,5개월 전
y_86_159,호텔원 전주 이노시티,백제문화단지혹성,잘 이용하고 있습니다. 방 상태가 매우 좋아 자주 이용하고 있어요. 적극 추천합니다.,5,4개월 전
y_86_160,호텔원 전주 이노시티,방대한심술,아주 좋았습니다 같이 온 일행도 만족했네요,5,1년 전
y_86_161,호텔원 전주 이노시티,조태식,잘 쉬다 갑니다 갈때마다 너무 편하게 있다가 옵니다,5,3개월 전
y_86_162,호텔원 전주 이노시티,주캉이,숙소 컨디션도 매우 훌륭하구 주차하기도 편했던 숙소입니다. 그리고 조식비쥬얼도 매우 휼륭합니다,5,6개월 전
y_86_163,호텔원 전주 이노시티,헤시리헤보,재재재재방문 할 정도로 너무 좋아요,5,6개월 전
y_86_164,호텔원 전주 이노시티,박셈,두 세번째 오고 있는데 편하게 쉬고 갑니다 깔끔해서 좋았어요,5,3개월 전
y_86_165,호텔원 전주 이노시티,진중하고신나는못,진짜 이쁘고 맘에 드는 숙소입니다 또 오고 싶어요,5,5개월 전
y_86_166,호텔원 전주 이노시티,강렬하고활발한캄보디아,생각보다 편하고좋았습니다,3,7개월 전
y_86_167,호텔원 전주 이노시티,남다르고감동적인반죽,청결하고 친절하며 조식도 만족했습니다. 다만 벽간소음이 좀 있네요. 전반적으로 잘 쉬었습니다.,4,11개월 전
y_86_168,호텔원 전주 이노시티,힘찬보충병,전주 출장시 항상 투숙하는 곳입니다.,4,5개월 전
y_86_169,호텔원 전주 이노시티,덴신,자주 이용하는데 이번엔 침대에 머리카락이ㅜㅜ 평소엔 깨끗하고 좋아요!,4,4개월 전
y_86_170,호텔원 전주 이노시티,권덕순,친절하고 넘 좋았어요~~~♡♡,5,10개월 전
y_86_171,호텔원 전주 이노시티,서툰등산모,올때마다 만족하는 곳입니다 깨끗해요,5,3개월 전
y_86_172,호텔원 전주 이노시티,조신하게살래요,출장 가면 매번 가는 곳 입니다. 언제나 만족합니다!,5,8개월 전
y_86_173,호텔원 전주 이노시티,찰*****,깔끔해요 슬리퍼가 바닥타일애서 조금 미끄러운거말고는 깔끔하고 괜찮았습니다,5,4개월 전
y_86_174,호텔원 전주 이노시티,도다리킴,관광지에서 거리가 좀 있지만 깨끗해서 좋았어요. 주차는 밤늦게 가니 다 차서 그냥 주변 길가에 댔습니다.,5,6개월 전
y_86_175,호텔원 전주 이노시티,nanggung,깔끔하고 좋았습니다.,5,4개월 전
y_86_176,호텔원 전주 이노시티,조효상2,편히 쉬다 갑니다 다음에 전주오면 다시 방문하겠읍니다,5,9개월 전
y_86_177,호텔원 전주 이노시티,기념공원포병대,깨끗하고 심플하고 사용하기 좋은 객실이었어요. 외부.내부 시설도 깔끔하고. 친절하게 매번 대해주셔서 좋더라구요. 항상 차를 가지고 이동하는데 주차장도 있고. 기분 좋게 쉬다가 갑니다.,5,9개월 전
y_86_178,호텔원 전주 이노시티,평민이,잘쉬다갑니다 잘쉬다갑니다,5,5개월 전
y_86_179,호텔원 전주 이노시티,SSAT,👍☺️🤙👍❤️☺️🤙👍❤️☺️🤙,5,5개월 전
y_86_180,호텔원 전주 이노시티,ToBeYours,여긴 언제나 객실이 만실이에요. 고객들이 잘 찾는 이유가 있겠죠?,5,9개월 전
y_86_181,호텔원 전주 이노시티,엑슬림,"비즈니스 호텔입니다, 퇴실시간 넉넉하고, 물 시원하고, 잘 쉬고 갑니다~",4,7개월 전
y_86_182,호텔원 전주 이노시티,괜찮은앤드류,혁신동에서 제일 깔끔하고 넓은 숙소네요,5,8개월 전
y_86_183,호텔원 전주 이노시티,초록빨때,"전주 호텔원 이노시티에서의 숙박은 정말 만족스러웠습니다. 호텔은 현대적이고 깔끔하며, 방도 넓고 쾌적했습니다. 침구는 편안했고, 청결 상태도 훌륭했습니다. 특히 객실 내에 있는 다양한 편의시설이 잘 갖춰져 있어 편리하게 사용할 수 있었습니다. 프런트 직원들의 친절한 서비스도 인상적이었으며, 체크인과 체크아웃이 빠르고 간편했습니다. 호텔 위치도 전주 주요 관광지와 가까워 이동이 편리했습니다. 전체적으로 가성비가 매우 좋은 숙소로, 다시 방문하고 싶은 곳입니다.",5,8개월 전
y_86_184,호텔원 전주 이노시티,벨리스,아주편히쉬었어요 아주좋아요,4,10개월 전
y_86_185,호텔원 전주 이노시티,온화하고문학적인통로,가성비.가심비. 모두모두 좋으니 전주올때마다 올듯요,5,8개월 전
y_86_186,호텔원 전주 이노시티,암묵적인땀,깔끔하고 쾌적해서 좋았어요,5,8개월 전
y_86_187,호텔원 전주 이노시티,적극적이고자신감있는비유,괜찮은거 같아요 체크아웃이 1시여서 더 좋았어요,4,5개월 전
y_86_188,호텔원 전주 이노시티,하하호호777,직원분도 친절하고 방 업그레이드 해주셔서 편하게 있다갑니다 여자 혼자 출장땜에 가는거라 불안했는데 조용한 끝방으로 주셨고 객실도 깔끔하고 좋았어요~ 4층 라운지도 아늑한 분위기 좋던데요 ㅎㅎ,5,1년 전
