id,name,nickname,review_content,rating,write_date
y_8_001,전주 브라운도트 - 덕진점,감사행복사랑축복,저는 출장을 자주 다니다 보니 숙소를 예약할때 주차장이 있는지 부터 확인하는데 주차장 있어서 편하게 주차했고 주변에 편의점도 있었고 먹을곳도 많아서 그런 부분도 좋았습니다. 카운터 보시는분 상당히 친절하셨고 숙소 청결이 중요하다고 생각하는데 담배냄새도 없었고 내부도 깔끔하고 욕실도 넓어서 씻기 편했습니다.티비도 ott서비스로 넷플 볼 수 있어서 좋았고 침대도 저는 편했습니다. 바닥 청소가 살짝 부족했는데 이 부분 빼고는 금액대비 해서 좋았던 숙소라고 생각합니다 주변에 오시면 하루 숙박으로 괜찮다고 생각합니다,5,1개월 전
y_8_002,전주 브라운도트 - 덕진점,d*****,"토요일인데도 대실 가능해서 좋았어요 ! 올때마다 주차가능해서 너무 좋고 청결도 좋습니다 :) 프론트에 있는 강쥐 졸귀탱 .. 🥹 늦게 가서 1시간 30분만 이용했지만 잘 쉬다 나왔습니다. 세면도구, 샤워용품 등 빠지는거 없이 모두 다 있었고 가운도 있는데 걸려있는 가운이에요~~ 침대도 푹신하니 잠시 쉬었다 가기 좋고 티비 크기는 보다시피 적당한 크기입니다!!!! 욕실도 찍었어야했는데 못찍었지만 사진과 같습니다~ 따뜻한물 잘 나오고 수압도 좋아요 화장실 문은 유리라 비칠 순 있어요",5,1개월 전
y_8_003,전주 브라운도트 - 덕진점,77세아마추어,"깔끔하고 아늑한 숙소였습니다. 체크인부터 체크아웃까지 모든 과정이 원활했고, 호스트도 친절하게 안내해주셔서 편안하게 머물 수 있었습니다. 침구류가 청결하고 침대도 푹신해서 숙면을 취할 수 있었어요. 주변에 맛집과 카페도 가까워 위치도 만족스러웠습니다. 다음에 또 방문하고 싶어요. --- 숙소에 도착했을 때 첫인상부터 매우 좋았습니다. 외관도 깔끔하고 실내는 사진으로 봤던 것보다 훨씬 넓고 정돈되어 있어 만족스러웠습니다. 특히 청결 상태가 인상 깊었는데, 바닥이며 침구, 화장실까지 먼지 하나 없이 잘 정리되어 있어 기분 좋게 머물 수 있었습니다. 침대는 푹신하고 편안해서 하루 종일 걸어 다닌 피로를 충분히 풀 수 있었고, 에어컨과 난방도 잘 작동해 쾌적한 온도를 유지할 수 있었습니다. 숙소 내에 마련된 어메니티도 다양하고 퀄리티가 좋아서 따로 챙겨온 물품 없이도 편리하게 이용할 수 있었습니다.",5,1개월 전
y_8_004,전주 브라운도트 - 덕진점,스물다섯등산화,자주 방문하는 호텔이에요. 합리적인 가격에 금연 객실이라 비흡연자도 안심하고 숙박할 수 있고 방도 청결해요. 넷플릭스도 원활하게 잘 되고 침대가 방수매트 때문에 사부작거 리긴 하지만 전 크게 불편하진 않았어요. 시스템 에어컨이라 냉방 난방 다 잘되구요 전기매트도 있어 따뜻 하게 있었습니다. 다음에도 또 숙박하고 싶은 마음 100프로입니다. 카운터에서 사장님도 늘 친절하세요. 대리석 바닥이라 보기에 더 깔끔해보여요. 수건도 여유롭게 넣어주셔서 좋습니다 또 올게요!,5,1일 전
y_8_005,전주 브라운도트 - 덕진점,용맹하고밝은교복,숙소는 깔끔하고 시설도 좋으나 담배냄새와 곰팡이냄새인지 꿉꿉한냄새때문에 좀 힘들었네오… 환기시키고 공청기틀고 에어컨 틀어도ㅠ 아예사라지진않더라구요 주말대비 가격은 저렴하게 자서 그냥 이해하고 잤긴한데ㅠㅠ 환기라던지 디퓨저나 페브리즈 이런거라도 필요할거같아요 이불도 쿰쿰한냄새때문에 잘때 좀 힘들었어요 그리고 수건이없어서 씻다가 받으러가야했어요 일회용품은 무상제공되서 좋았고 충전기는 카운터에서 받라와야합니다 냄새에 예밍하신분들은 참고하시면 좋을거같아요,4,5일 전
y_8_006,전주 브라운도트 - 덕진점,재기영,가장 중요하게 여기는게 청결인데 정말 깔끔하고 여행하는 게 흠 없이 재밌게 놀았던 것 같아요! 일단 화장실이 깨끗 하고 샴푸 냄새에 예민한데 향도 괜찮았어요 프론트에서 직원분께서도 너무너무 친절하게 맞이해 주셔서 좋았습니 다! 위치도 너무 좋고 무엇보다 신축같은 느낌이 많이 들 어서 기분이 너무 좋았습니다. 침구류나 탁자나 어메니티 등 객실 컨디션도 너무 좋아서 여행 내내 잘 놀고갑니다. 다음에 또 놀러오면 꼭 올거같아요 항상 좋은 인상 느끼게 해주셔서 감사합니다 사장님 아,5,6개월 전
y_8_007,전주 브라운도트 - 덕진점,대박이야3515,"숙박후기예용~ 출장을 자주가는데 여기는 주변 대비 만족스러웠습니다. 방도 깔끔하고 다양한 티비 채널까지있어서 더욱 더 좋았어요. 이근처에서는 여기가 모텔중에서는 제일 가성비 좋은것 같아요. 종업원도 친절해서 좋았습니다. 주차시설도 여러대 댈수있도록 기본 주차장시설도 있고.. 에어콘, 화장실 시설, 물도 잘나오고.. 앞으로도 이곳에가면 이 숙소를 잡을예정이예요. 주변에 먹을만한 음식가게도 종류별로 다양하게 있는것도 좋네요.. 누가와도 어지간해서 실망하지 않을것같네요.. 짱입니다요~~ㅋㅋ",4,8개월 전
y_8_008,전주 브라운도트 - 덕진점,77세아마추어,"태평양 화장실, 인테리어, 편의 용품, 침대와 침구류, 편의를 위한 고급 가전제품.. 도대체 빠지는게 뭔가요? 가격도 적당하고 위치도 좋아요 계속 이용할 것 같아요. 객실도 아주 위생적으로 잘 청소되어 있고 분위기도 좋네요. 비데와 스타일러와 에어컨은 머무는 동안 너무 잘 썼습니다. 일행도 숙소에 대만족 했습니다. 소모품류도 고급집니다. 적당한 높이의 책상과 편안한 의자 덕분에 문서 작업도 잘 하고 갑니다. 잘 쉬고 깔끔하게 이용하고 갑니다. 번창하시고 행복하세요!",5,10개월 전
y_8_009,전주 브라운도트 - 덕진점,77세아마추어,편의 용품이 잘 제공되어 있어서 좋습니다!.!.!.!. 객실 조명이 분위기가 참 좋습니다~.~.~..~. 침구류도 편안하고 깨끗합니다~.~.~..~. 위치도 좋습니다 자주 들르는 곳이에요~.~.~.~ 가격도 합리적이여서 자주 가는게 큰 부담이 되지는 않습니다!.!.!..!. 주차하기 편합니다만 차량 방문이 많아서 자리가 없을 수도 있어요~.~.~..~. 책상이 큰 점이 아주 마음에 듭니다!.!.!.. 작업하기 참 좋은 것 같습니다!.!.,5,8개월 전
y_8_010,전주 브라운도트 - 덕진점,백*****,총점 🌕🌕🌕 방이 깔끔해서 좋았습니다 ;) 컴퓨터도 맘에 들었고 소파같이 컴퓨터 앞에 저런 인테리어 좋아해서 좋았습니다 1층 프론트 앞에 냉장고가 있는데 거기에 음료나 헛개수가 있어서 다음날 술 마시고 퇴실하면서 마시기 딱 좋아요 굿굿 근데 사진에 있던 커피머신같은게 전부 없어졌더라구요 아쉬웠습니다 방은 대채로 깔끔했는데 뭔가좀 안 닦인곳이 있어서 당황했어요 화장실 문 유리문 이니 꼭 참고 하세요 같이 가신분은 여기 너무 좋다고 계속 여기서 자고싶다고 광광 울다 가셨고 저는 평범했다고 생각합니다,5,8개월 전
y_8_011,전주 브라운도트 - 덕진점,otsep,"전북대 주변 숙소에 묵어야 할 때가 있는데, 그럴 때마다 브라운도트를 이용하곤 합니다. 깔끔한 인테리어, 훌륭한 가성비, 어메니티 제공, 이용 가능한 OTT 구비 등 기본적으로 갖춰져야 하는 것들을 잘 갖추고 있는 숙소라고 생각해요. 다소 방음이 안 된다는 느낌도 있는데 거슬릴 정도는 아닙니다. 그리고 룸 컨디션이 항상 좋지만은 않습니다. 그러나 성수기라는 점을 감안한다면, 문제 제기 시 프론트에서 신속하고 원만하게 해결해 주신다는 점을 고려한다면 충분히 만족합니다.",4,10개월 전
y_8_012,전주 브라운도트 - 덕진점,말콤잉,전북대 근처 깔끔한 숙소!,5,7일 전
y_8_013,전주 브라운도트 - 덕진점,77세아마추어,훌륭합니다. 근처 편의시설 잘 되어있습니다~~~~~ 인테리어 깔끔하고 좋습니다 아늑합니다~~~~~ 화장실도 넓고 깔끔합니다~~••~~~ 숙소의 퀄리티에 비해 가격도 합리적이여서 아주 만족했습니다~~~~\ 객실 내 편의 물품들도 잘 비치되어 있습니다~~~~\ 조명도 세심하게 잘 설치되어 있어 상황에 따라 빛을 잘 조절할 수 있는 점이 마음에 들었습니다~~~~~ 에어컨도 조용하고 좋은 모델로 장착되어 있어 쾌적하게 잘 지낼 수 있었습니다~~~ 감사합니다 또 오겠습니다,5,9개월 전
y_8_014,전주 브라운도트 - 덕진점,이름은아무렇게나,사진은 이용하고 나가는길어 다소 이질감이 느껴질수도 있지만 전체적으로 주변 숙소들에 비해 깔끔하고 세련된 느낌이듭니다. 일단 화장실도 넓고 이용하기 편한 분위기를 주고 화장실 거울에도 조명이 있어서 좋네요 편하게 머물수있는 환경이 조성되어있다는게 가장 큰장점같아요. 또 숙소들보면 먹을거 먹는것도 힘든데 여기는 상도 올려놓고 먹기 좋은 상으로 되어있어서 불편함이 없습니다 북대에서 깔끔하고 잘쉬고가고싶은분들이 오면 좋을 숙소라는 생각이 드네요 또 재방각입니다.,5,7개월 전
y_8_015,전주 브라운도트 - 덕진점,thisisiseungmi,여기 두 번 방문했는데 두 번 다 룸 업그레이드를 받았어요 시설 너무 좋고 깔끔해요,5,11개월 전
y_8_016,전주 브라운도트 - 덕진점,킴단임,깔끔하고 양호하고ㅎㅎ,3,3일 전
y_8_017,전주 브라운도트 - 덕진점,유민이빨,깨끗하니 잘 휘다가요 감사합니다,4,26일 전
y_8_018,전주 브라운도트 - 덕진점,흔쾌한연애,"오랜만에 재방문하게 되었습니다. 기존방에서 미흡한 부분이 있어서 말씀드렸더니, 바로 방을 바꿔주시면서 업그레이드까지 해주셨습니다. 덕분에 좋은방과 시설을 이용할 수 있어서 감사합니다. 필요한 물품을 말씀해주시면, 바로 대응 해주십니다. 항상 웃으며 응대해주셔서, 친절함에 감동했습니다. 기회가 된다면, 재방문하고 싶습니다.",5,1년 전
y_8_019,전주 브라운도트 - 덕진점,콕뀌리,출장왔는데 편하고 좋습니다^^,4,17일 전
y_8_020,전주 브라운도트 - 덕진점,앙골라케이크,위생이 좀 아쉬웠어요~~~~ 침대에 오염물 묻어있고 벽에 곰팡이 펴있고~~~~ 전체적으로 방이 좀 꿉꿉하네욥 ~~~~~ 옛날에 이용했을땐 깔끔했던 것 같은데~~~~ 이번엠 좀 실망이네용~~~~~ 그래도 넷플릭스 안된다고 하니까 방 바로 바꿔주셔서 좋았어요 ~~~~~ 그래도 가성비로눈 짱입니다 ~~~~~ 화장실운 깨끗해뇨 ~~~~~ 아쉽지먼 다음에도 이용해보겠습니다 ~~~ 북대랑 가까워서 시켜먹을 곳은 많아요 ~~~~ 최고의 장점 ~~~~|||~,5,11개월 전
y_8_021,전주 브라운도트 - 덕진점,이강소,여기 근처 중에는 가성비가 제일 좋아요 깔끔하고 편안해용,5,20일 전
y_8_022,전주 브라운도트 - 덕진점,아찔아찔한거미,너무 좋은 숙소 였어요. 이욤시간이 더 길었으면 좋겠습니다,4,1개월 전
y_8_023,전주 브라운도트 - 덕진점,독특하고꼼꼼한가락지빵,좋아용 좋아용 좋아용 좋아용 좋아용,4,1개월 전
y_8_024,전주 브라운도트 - 덕진점,크크섬77,먼저 주차장이 넓어 주차하기 너무 좋았습니다. 방도 너무 넓어 놀랬는데 화장실도 욕조와 함께 넓고 쾌적했습니다. 한가지 흠은 욕조 물이 뭐에 막혔는지 좀 천천히 내려가더군요...그외엔 화장실은 흠이란 찾아볼 수 없었네요..방도 침대가 넓은 거 두개...와이프랑 둘이 각각 하나씩 뒹굴거리며 사용했네요..그리고 스타일러스 ....집에서도 사용하지만 여기에도 있을지 몰랐는데 옷을 아주 뽀송뽀송하게 만들어줘서 담날 입고 나가기 너무 좋았습니다. 전체적으로 만족이고 담에도 또 방문할께여,5,10개월 전
y_8_025,전주 브라운도트 - 덕진점,붕붕777,좋아요 굿입니다 다음에도 이용할게요,3,23일 전
y_8_026,전주 브라운도트 - 덕진점,10832487,북대 주변 숙소 중에 깔끔하고 청결합니다,5,1개월 전
y_8_027,전주 브라운도트 - 덕진점,기차화통,방 깔끔하고 좋아요 ㅎㅎ 주차장 시설이 잘되어 있습니다 방 깔끔하고 좋아요 ㅎㅎ 주차장 시설이 잘되어 있습니다 방 깔끔하고 좋아요 ㅎㅎ 주차장 시설이 잘되어 있습니다 방 깔끔하고 좋아요 ㅎㅎ 주차장 시설이 잘되어 있습니다 방 깔끔하고 좋아요 ㅎㅎ 주차장 시설이 잘되어 있습니다 방 깔끔하고 좋아요 ㅎㅎ 주차장 시설이 잘되어 있습니다,4,9개월 전
y_8_028,전주 브라운도트 - 덕진점,이현교,사진과 같이 깨끗하고 좋아요,5,1개월 전
y_8_029,전주 브라운도트 - 덕진점,94세스칼렛,장점 1. 주차공간 : 6시 정도 늦은 시간에 갔지만 주차할 수 있었음 2. 인테리어 : 심플하고 깔끔한 최고의 인테리어 3. 시설 : 음식을 먹을수 있는 테이블과 작은 소파가 준비되어 있음 단점 1. 방음 : 복도와의 방음이 부족함 2. 외부통로 : 호텔 입구 도로가 협소함 3. 화장실 문 : 스탠다드 기준 반투명 문인데 잘 안보면 못보고 가다 부딛힐 수 있음,5,1년 전
y_8_030,전주 브라운도트 - 덕진점,미안할때사과,시설 좋고 깔끔해서 좋아요,5,1개월 전
y_8_031,전주 브라운도트 - 덕진점,길직리,숙소가 깔끔하고 편안했어요,5,1개월 전
y_8_032,전주 브라운도트 - 덕진점,rucd11,바깥 유리창 닫으려고 하니 힘없이 손잡이가 빠져버리네요. ㅠㅠㅠ 방 업그레이드 해주셔서 차마 방 바꿔달라고 말씀을 못 드렸네요 안쪽 유리창도 제대로 안 닫혀서 바깥 소리가 들려 밤에 자다가 몇번을 깼네요 ㅠㅠㅠㅠ 리뷰 보시면 바깥 유리창 손잡이 고쳐주세요 출장업무 마치고 지금 리뷰 쓰느라 좀 늦어졌네요,4,4개월 전
y_8_033,전주 브라운도트 - 덕진점,자립적이고알록달록한졸업,충전기가 없었어요..당연히 있을줄 알았는데..카운터에서 말씀도 안해주시네요.. ㅏ,4,6개월 전
y_8_034,전주 브라운도트 - 덕진점,회갈색성전사,친절하시구 숙소 상태도 깔끔해서 좋아요,4,10개월 전
y_8_035,전주 브라운도트 - 덕진점,전여행,전체적으로 깨끗합니다,4,9개월 전
y_8_036,전주 브라운도트 - 덕진점,연말연초연중,깔끔하고 친절하시고 좋습니다,5,3개월 전
y_8_037,전주 브라운도트 - 덕진점,연말연초연중,깔끔하고 항상 친절하세요!,5,3개월 전
y_8_038,전주 브라운도트 - 덕진점,77세아마추어,별 5개보다 더 드리고 싶습니다!!!!! 객실이 매우 넓고 편안한 분위기를 가지고 있어 머무는 동안 기분이 좋았습니다~~~~~ 화장실도 어지간한 고급호텔 못지 않은 공간감과 구조를 가지고 있습니다!!!!! 제공되는 물품들도 세심함이 느껴집니다~~~~~ 스타일러가 있어 옷에 냄새와 주름을 없애고 깔끔하게 입고 나갈 수 있어요 너무 좋습니다~~!!!!! 그럼에도 합리적인 가격으로 자주 이용해도 크게 부담되지 않아서 자꾸 오게 됩니다~~~~~ 최고의 숙소!,5,8개월 전
y_8_039,전주 브라운도트 - 덕진점,chrisoh21,위치가 애매하고 근저에 식사할데가 별로 없지만 청결하고 잘 관리된 곳입니다.,3,2개월 전
y_8_040,전주 브라운도트 - 덕진점,프리미엄게살버거,시설은 깔끔하고 냄새도 안나네요 근데 먼지가 좀 많아요 목이아파요,3,4개월 전
y_8_041,전주 브라운도트 - 덕진점,고두스,전주 오면 늘 즐겨 찾는 숙소입니다. 장점은 시설이 깔끔하고 주차장이 넓은게 장점입니다. 인근에 덕진공원이 위치하고있어서 산책하기에도 좋고요 기회가 된다면 다시 한번또 숙박하도록하겠습니다.,5,1년 전
y_8_042,전주 브라운도트 - 덕진점,쨔양이,좋아용 맨날 이용해요!!,5,7개월 전
y_8_043,전주 브라운도트 - 덕진점,말근이슬,전주에 오랜만에 출장와서 여기저기 검색하다가 브라운도트 전주덕진공원점에 묶게 되었는데 요번 출장중 제일 좋은 시설이었습니다. 일단 트윈인데 침대가 모두 더블 사이즈고 방도 무지하게 넓습니다. 스타일러도 준비되어있어 편했구요. 욕실도 넓은데다 욕조도 완전 빅사이즈여서 하루의 피곤이 풀릴수 있도록 반신욕하기에도 좋습니다. 주차장도 상당히 넓어서 만실인데도 주차하기 널널해서 편했구요. 다만 한가지 불편한점은 주차장 들어가는 입구가 불펀한정도. 아믄튼 요번 출장중에 제일 훌륭한 숙박시설이었습니다.,5,3개월 전
y_8_044,전주 브라운도트 - 덕진점,suwhsh,깔끔하고 너무 좋아요! 북대에서 도보로 쫌 멀다는게 단점 깔끔하고 너무 좋아요! 북대에서 도보로 쫌 멀다는게 단점 깔끔하고 너무 좋아요! 북대에서 도보로 쫌 멀다는게 단점 깔끔하고 너무 좋아요! 북대에서 도보로 쫌 멀다는게 단점 깔끔하고 너무 좋아요! 북대에서 도보로 쫌 멀다는게 단점 깔끔하고 너무 좋아요! 북대에서 도보로 쫌 멀다는게 단점 깔끔하고 너무 좋아요! 북대에서 도보로 쫌 멀다는게 단점 깔끔하고 너무 좋아요! 북대에서 도보로 쫌 멀다는게 단점 깔끔하고 너무 좋아요! 북대에서 도보로 쫌 멀다는게 단점,5,9개월 전
y_8_045,전주 브라운도트 - 덕진점,GC14993324687,good good!!,5,9개월 전
y_8_046,전주 브라운도트 - 덕진점,갯벌체험장허풍쟁이,201호 토나옴 천장 벽지 다 떠있음 곰팡이 냄새 토나옴 가운 옷걸이에 걸려있음 세탁된건지 의심스러움 보통 가운 세탁 후 비닐에 싸놓는데 ㅋ 세면대 물 틀었는데 배수구에서 곰팡이 냄새 올라옴 토나옴 침대 눕지도 않고 앉았는데 쿰쿰한 냄새 계속 남 슬리퍼 없음 이런곳을 돈 받고 내주면 안되는데,0,1개월 전
y_8_047,전주 브라운도트 - 덕진점,황금원숭,숙소 공간도 넓고 가격대도 좋고 쉬기 좋았어요 욕조도 넓고 화장실이 깔끔해요!! 청결 굳,5,4개월 전
y_8_048,전주 브라운도트 - 덕진점,프리미엄게살버거,시설은 깔끔하고 냄새도 안나네요 근데 먼지가 좀 많아요 목이아파요,4,4개월 전
y_8_049,전주 브라운도트 - 덕진점,수리산진돗개,무난하고 자주 이용합니다. 위생상태도 나쁘지않고,5,9개월 전
y_8_050,전주 브라운도트 - 덕진점,간드러진가냘픈작업복,"물2, 비데o. 깨끗합니다",4,4개월 전
y_8_051,전주 브라운도트 - 덕진점,눅눅한구역보스,편하게 잘 묵고 갑니다~ 다만 욕실 문이 쌩 투명문이라 당황했네요 불투명도 아니고 진짜 쌩 투명문..,5,7개월 전
y_8_052,전주 브라운도트 - 덕진점,지몽s,편히 장 쉬었어요...,4,11개월 전
y_8_053,전주 브라운도트 - 덕진점,잭1234,너무 너무 좋습니다 적극 추천합니다,5,3개월 전
y_8_054,전주 브라운도트 - 덕진점,잭1234,너무 너무 좋습니다 적극 추천합니다,5,3개월 전
y_8_055,전주 브라운도트 - 덕진점,잭1234,너무 너무 좋습니다 적극 추천합니다,5,8개월 전
y_8_056,전주 브라운도트 - 덕진점,정직하고완고한면발,정말 좋은곳 인거 같아요,5,10개월 전
y_8_057,전주 브라운도트 - 덕진점,정직하고완고한면발,정말 좋은곳인거 같아요,5,10개월 전
y_8_058,전주 브라운도트 - 덕진점,우스꽝스러운군사경찰,깨끗하고 좋았습니다 잘 이용했습니다,5,11개월 전
y_8_059,전주 브라운도트 - 덕진점,강원랜드마샬,깨끗해서 항상 이용하고있습니다. 평일에는 종종 방을 업그레이드해주시는것 같아요!,5,11개월 전
y_8_060,전주 브라운도트 - 덕진점,혜이니꼬,ㅠㅠ 수건이 더러워요... 그리고 카운터에 없어서수건받기가 힘드네요..,2,27일 전
y_8_061,전주 브라운도트 - 덕진점,여행가요79,다른 숙소보다 청결하고 관리 잘되어있는 편입니다.,5,6개월 전
y_8_062,전주 브라운도트 - 덕진점,식물학습장군사경찰,따뜻하고 좋아요 특히 사장님이 너무 친절해요,4,1년 전
y_8_063,전주 브라운도트 - 덕진점,전완근,시설 좋은 곳 사용하려면 무조건 여기로 오는 것 같아요! 무한 대실도 다음에 이용 예정입니다~,5,3개월 전
y_8_064,전주 브라운도트 - 덕진점,신정호관광지편충,아주만족합니다 시설 인테리어 아주 좋아요,5,8개월 전
y_8_065,전주 브라운도트 - 덕진점,암회색권총,진짜로 좋아요 아주 자주 이용하고 ㅆ어오 !,4,5개월 전
y_8_066,전주 브라운도트 - 덕진점,callhead4,숙소가 깔끔하고 사장님도 친절하고 좋았어요 잘쉬다갑니다,5,5개월 전
y_8_067,전주 브라운도트 - 덕진점,악동한이,좋아요^^ 일요일마다 숙소 예약하네요,5,6개월 전
y_8_068,전주 브라운도트 - 덕진점,침착하고우호적인시멘트,따뜻해요~~~~~!,4,5개월 전
y_8_069,전주 브라운도트 - 덕진점,굴눌둘,깔끔하고 좋아요 ㅎㅎㅎ,5,4개월 전
y_8_070,전주 브라운도트 - 덕진점,인위적인장군,깔끔하고 방음도 잘 되는 거 같고 좋아요,5,10개월 전
y_8_071,전주 브라운도트 - 덕진점,deliman,깨끗하구 넓어서 ㅋ해적하네요,4,5개월 전
y_8_072,전주 브라운도트 - 덕진점,함필웅,덕진공원주변 가성비 굿!,4,10개월 전
y_8_073,전주 브라운도트 - 덕진점,어지간한애완동물,깔끔하고 너무 너무 좋습니다,5,11개월 전
y_8_074,전주 브라운도트 - 덕진점,여행가요79,자주 이용하는 사람입니다. 방 컨디션 좋고 방 업그레이드도 자주 해주셔서 좋습니다.,5,10개월 전
y_8_075,전주 브라운도트 - 덕진점,새*****,그냥저냥 이용하기 좋아용!!,4,8개월 전
y_8_076,전주 브라운도트 - 덕진점,삥아리,깔끔합니다..많이 만족,5,1년 전
y_8_077,전주 브라운도트 - 덕진점,거제사격,친절하시고 깨끗합니다,5,3개월 전
y_8_078,전주 브라운도트 - 덕진점,topyoung823,깔끔하고 좋아요! 또 이용하고싶어요,5,4개월 전
y_8_079,전주 브라운도트 - 덕진점,도톨엄마,맘에들엇어여 잘 이용했습니다,5,8개월 전
y_8_080,전주 브라운도트 - 덕진점,행복한포비,깔끔합니다. 편하게 잘 쉬다왔습니다.,5,7개월 전
y_8_081,전주 브라운도트 - 덕진점,여행가요79,관리 잘되어있는 숙소입니다,5,10개월 전
y_8_082,전주 브라운도트 - 덕진점,루이얌,구웃두웃구웃!!!!!,4,9개월 전
y_8_083,전주 브라운도트 - 덕진점,부돌남,덕진공원근처라 좋았습니다,5,8개월 전
y_8_084,전주 브라운도트 - 덕진점,루이얌,구웃구웃구웃 !!!!0,4,9개월 전
y_8_085,전주 브라운도트 - 덕진점,곤우넨네,항상 잘 쉬다갑니다요 ㅎ,5,4개월 전
y_8_086,전주 브라운도트 - 덕진점,즐겁고푸른캐나다,깔끔하고 좋아요 매번방문하는데 굳,5,6개월 전
y_8_087,전주 브라운도트 - 덕진점,굼바,빵점 중에 빵점 입니다. 절대 아이들과 같이 가지마세요~!! 털도 그대로 있고..돈아까웠습니다.,0,2개월 전
y_8_088,전주 브라운도트 - 덕진점,김민21,믿고가는 브라운도트입니다,4,5개월 전
y_8_089,전주 브라운도트 - 덕진점,여행가요79,깨끗하고 좋습니다..,5,9개월 전
y_8_090,전주 브라운도트 - 덕진점,여행가요79,좋습니다.....!!,5,9개월 전
y_8_091,전주 브라운도트 - 덕진점,땡그란사령장,주변에 맛집도 많아서 이동성 좋아요 !!!!! 자주 가는 곳인데 방음이 잘 안 되는 거 빼고는 너무 좋습니다 !!!!! 주변에 맛집도 많아서 이동성 좋아요 !!!!! 자주 가는 곳인데 방음이 잘 안 되는 거 빼고는 너무 좋습니다 !!!!! 주변에 맛집도 많아서 이동성 좋아요 !!!!! 자주 가는 곳인데 방음이 잘 안 되는 거 빼고는 너무 좋습니다 !!!!! 주변에 맛집도 많아서 이동성 좋아요 !!!!! 자주 가는 곳인데 방음이 잘 안 되는 거 빼고는 너무 좋습니다 !!!!! 다음에 또 이용할 의사 100입니다~,5,21일 전
y_8_092,전주 브라운도트 - 덕진점,간드러진가냘픈작업복,깨끗하고 좋습니다..,5,5개월 전
