id,name,nickname,review_content,rating,write_date
y_97_371,전주 후,사기적인파견자,오늘 객실들어갓는데 담배냄새가 안나고 좋은냄개가 나서 좋앗는데 날이 너무 더워서 에어컨 킬려고 햇는데 저녁먹다가 리모컨 눌럿는데도 안되고 콘센트부분이 떨어진건지 안되도라고요...자면서도 땀흘리고 잣어요... 608호인데 천장한번 수리하셔야할거같어요..그거빼곤 다만족해요,4,2년 전
y_97_372,전주 후,1399739,"일단 방이 너무 깨끗해서 마음에 들었고, 늦은 시간에 들어갔는데 사장님이 친절하게 응대해주셔서 감사했어요. 여행갔던거였는데 터미널하고 가까워서 이동하기에도 편했고, 전 샴푸냄새에 예민한 편인데 평소 쓰던 향과 비슷해서인지 잠도 더 잘 왔던 것 같아요! 날이 추웠는데 방도 따뜻하고 매트도 잘 작동되서 가격대비 너무 만족스럽고 또 전주를 가게 된다면 이용할 것 같아요 ! 대박나세요 !!",5,8년 전
y_97_373,전주 후,여기어때 이용 고객,고속버스터미널 근처 1분거리라 접근성도 좋고 먹고 즐길거리도 주변에 다잇어서 너무 부담없이 놀다 들어올 수 잇어서 좋았습니다 잠자리도 편하고 퇴실시간이 넉넉해서 푹 쉴 수 잇는 점이 너무 좋았어요,5,2년 전
y_97_374,전주 후,돌돌한김초밥,"숙소는 시외버스터미널 바로 뒤에 위치해 있습니다. 커플 PC룸에서 묵었는데, 컴퓨터 상태는 괜찮았어요! 다만 ㅠ 룸 내부에 놓여있는 탁자 청소가 제대로 되어 있지 않았네요. 이 점은 아쉽습니다. 또 내부에서 담배 냄새가 조금 나는 편이에요. 참고 바랍니다. 주차장도 있기는 하나 간격이 다소 좁은 편입니다. 앞차가 가로막는 형태로 주차가 될 수도 있습니다~! 침구류 및 어메니티는 일반적입니다~!",3,1년 전
y_97_375,전주 후,여기어때월150,정말 좋구 컴터도 잘되구 시설도 좋아요~~ 티비도좋고 근데 다른방에서 시끄러운게 다들리네요.... 다른방이 너무시끄러운건지 시간도 새벽대인데 단속좀 햐주세요.........,5,3년 전
y_97_376,전주 후,별아루,ㅠㅠㅠㅠㅜㅠㅠㅠ 으어... 단골인데 오늘 심하게 충격이네요 욕조에 물받아 목욕하고 컴터하는재미로 여기오는데요 욕조에 물받고 샤워후 들어갑니다. 근데 나중에 다시 들어가려고 보니 물에 검은게 둥실둥실ㅡㅡ... 근데사실 일전에 왔을때도 한번 이랬어요.. 그래서 그땐 제가 자다깨서도 막 목욕하는편이라 이불이나 바닥에 먼지같은게 몸에 묻어서 그리 떠있나 싶었거든요. 근데 오늘은 입실하고 오자마자 씻고나서 물받고 들어갔거든요. 전 욕조청소까지하고 들어가는편이라..욕조에서 묻어나오는게 아니란걸 믿어 의심치 않습니다. 그러고나서 또 샤워하러갔다가 추위타서 물이 아직 따땃미지근하길래 들어가려는데 ... 허? 까만게 아주그냥ㅠㅠ벌레인지알았어요 남친이 그냥물빼고다시받으래서 물을 쫙 뺐는데. 물이 바닥으로 더 빠질수록 눈에 안보이던 검은게 수두룩... 내가여태이물에 어케했나싶어 까물어치기도하고 다시 물을받다보니 허..ㅠ또생김 그래서 혹시나싶어 샤워기헤드에 물나오는곳을 열어보니 ㅋㅋ 검은게 동실동실 끼여있고.. 그냥 뺀채로 물받으니 또 나옴ㅠㅠ 수도청소를하시든 샤워기 줄이랑 다 갈으시던.. 조치가필요하네요. 사진에 저런게 어마합니다ㅠ,3,8년 전
y_97_377,전주 후,926660,남자친구와 pc룸 이용하였습니다 ~ 저렴하고 편안하고 좋았습니다 아주머니도 친절하시고 ㅎㅎ 건물 자체는 다른 모텔보다는 낡았는데 내부는 리모델링해서 전혀 사용에 문제 없어요 그리고 터미널 바로 뒤에 위치해있어서 타지에서 오시는 분들도 사용하기 좋을듯 합니다 ㅎㅎ 컴퓨터도 모텔 컴터중에는 손에 꼽을 정도로 좋았습니다 다음에 또 이용할게요 다음에는 롤 배울거에요 ㅋㅋㅋ,5,9년 전
y_97_378,전주 후,슴다섯감자,늦은시간 방문하였지만 사장님의 친절함덕분에 잘 이용할수있었네요 방안에서 담배냄새가 심하기는 했지만 늦은 퇴실시간이 만족하고 갑니다 담배냄새 빼고는 전체적으로 괜찮았습니다. 감사합니다,5,4년 전
y_97_379,전주 후,2596177,늘 이용하는 가성비 좋은 숙소 입실 시간이 겁나 빨라요,5,4년 전
y_97_380,전주 후,김포삼남매아부지,가격대비 만족합니다 주변 시설중에는 가격대비 정말좋고 방상태 깨끗하고 에어컨성능.컴뷰터 성능 모두 만족합니다 주변에 식당도 백반집도 많아서 이용하기 좋았어요 ㅢㆍ음 출장때도 다시 찾아갈만한 좋은고입니다,3,1년 전
y_97_381,전주 후,831515,처음가봤는데 사장님도 친절하고 서비스도 좋고 건물도 대체적으로 깨끗하고 좋았는데 아쉬운점이 있었다면 비누가 너무 오래된것처럼 갈라져있고 색이 바래져있더라고요ㅠㅠ 그리고 주차하는곳이 불편한게 아쉬윘네요 그래도 대실가격이 저렴하고 이용시간이 길어서 편히 쉬다갔어요!,4,9년 전
y_97_382,전주 후,솔깃한블루진,저아영저아영저아영저아영 저아영저아영저아영저아영 저아영저아영저아영저아영 저아영저아영저아영저아영 저아영저아영저아영저아영 저아영저아영저아영저아영 저아영저아영저아영저아영 저아영저아영저아영저아영 저아영저아영저아영저아영 저아영저아영저아영저아영 저아영저아영저아영저아영 저아영저아영저아영저아영,5,3년 전
y_97_383,전주 후,익스피리언스맨,주차편하고 침대에 전기장판도 있고 냉장고에 석류 망고음료수도있고 괜찮았습니다,5,8년 전
y_97_384,전주 후,8919214,"커플 피시방 예약 했었는데 피시방에서 쓰는 의자에 피시방처럼 컴퓨터 키면 게임 모아보기처럼 떠요 (배그,오버워치,롤 등) 그런데 오버워치 같은 유료 게임은 라이센스가 없어서 못하더라구요 아쉽 ㅠ 방 카드 꽂고 조금 기다리다 보면 바닥도 따뜻해지고 침대에 전기장판도 있고 좋아요 +고데기도 있음 화장실도 깨끗했고 수건도 충분하고 만족👍",5,6년 전
y_97_385,전주 후,중점적인댓글,남자친구랑 장거리연애에 모텔을 자주 이용하는데 둘다 게임을 자주하는편이라 커플pc있는곳으로 다니는데 웬만한pc방보다 좋은 컴퓨터가 있는곳은 여기뿐이에요ㅜㅜ 진짜 전주에선 여기밖에 안가요 퇴실시간도 넉넉하고 최고에요 담배냄새가 많이 나긴 하지만 컴퓨터며 모니터며 너무 좋아요,4,4년 전
y_97_386,전주 후,여기어때 이용 고객,편히쉬다갑니다 또 방문하께요편히쉬다갑니다 또 방문하께요 편히쉬다갑니다 또 방문하께요편히쉬다갑니다 또 방문하께요 편히쉬다갑니다 또 방문하께요편히쉬다갑니다 또 방문하께요 편히쉬다갑니다 또 방문하께요,5,3년 전
y_97_387,전주 후,5274589,일반실 사용후기 (오후 8시 입실) 인테리어는 사진과 동일해서 깜짝 놀랐습니다. 터미널 주변이라 인테리어 리모델링 한거 같아 깔끔하며 바닥은 마루모양의 장판입니다 방크기도 일반실치고 괜찮습니다. 조금 아쉬운게 있다면 바닥이 끈적 꺼리는게(전 손님이 음료를 흘린듯...)일부분 있었고 욕실이 조금 아쉬운 부분이 있습니다. 실내를 키운만큼 욕실이 작고 물 수압에 비해 하수구 배수 기능이 떨어지는 점이있었습니다. 그런면을 감안하더라고 깔끔해보이는 인테리어가 단점을 보안해주는 곳입니다. (건물내 주차 공간은 안쪽에 주차하게 되면 앞에 차가 나가기전 까지 못나가는 구조입니다. 사장님이 차를 빼줄거같네요. 일찍 도착해서 안쪽에 주차했습니다.),3,7년 전
y_97_388,전주 후,오늘만자고가요,인테리어도 깔끔하고 내부도 청결하여 너무 좋았습니다 사장님도 친숙하시고 너무 친절하셨어요 하지만 아쉬운점이 컴퓨터 사양이 좋은줄알았는데 게임하다가 몇번씩 팅기더라구여 그부분이 좀아쉬웠지만 나머지는 너무 좋았습니다,4,3년 전
y_97_389,전주 후,구리터분한대추나무,사장님도 친절하시고 가격도 아주 만족합니다 온수도 잘나오고 인테리어 시설 깔끔하니 노후된거 없이 아주 좋습니다 다음 또 재방문할께요 아쉬운점은 없네요 아주 잘쉬다갑니다^^ 추천드립니다!!,5,2년 전
y_97_390,전주 후,마닐라산딸기,컴퓨터도 좋았고 특히 디자인이 모텔이 아니고 약간 이쁜 자취방 느낌도 나서 좋았습니다 시설도 말할것도 없이 좋았고 제일 좋았던건 퇴실이 2시라 맘편히 푹 잘수 이ㅛ엇던게 제일 좋았네요,5,3년 전
y_97_391,전주 후,4206260,"엄청 자주이용했음 최근에 오전12시 넘어서 입실해서 그런지 항상 정리가 안되어있음 ☆오늘은 바로 전타임 사용자가 욕실 화장지가 부족하여 곽티슈를 휴지걸이 위에 올려놓고 쓰던 흔적(물론 휴지는 새로 채워놓지않았음), 전 사용자가 쓰던 샤워타월이 그대로 수건걸이에 걸려있고 생수도 없었음☆ 후 모텔 엄청 자주 이용해서 리뷰 많이 적었는데 아마 최근 리뷰 3개가 별로라고 적었던 거 같음 늦은시간에 입실하면 청소상태가 조금 미흡한 듯한데 개선이 필요해보임 아 주인아저씨 아줌마는 친절하심 (단, 입실할때까지 카운터에서 대기시간은 좀 걸림) ●이른시간에 입실하고 저렴한 가격에 퇴실이 늦고 인테리어 괜찮은 모텔을 찾는 사람에게 추천● 위에 언급한 단점들을 커버할만큼 장점이 좋아서 또 이용할 거 같음 다음에는 꼭 정리가 잘 되어있는 방이기를 소망함",0,6년 전
y_97_392,전주 후,국밥3그릇,최고입니다 갓성비 자체 숙소 그리고 pc도 게임 앵간한 거 다 돌아갑니다 리뷰에서 왜 전주 오면 이용하라고 하셨는지 알겠습니다 댕좋습니다! 갓성비 최고의 숙소 터미널과도 걸어서 3분거리 꼭오세요 ! 갓성비 최고의 숙소 터미널과도 걸어서 3분거리 꼭오세요 ! 갓성비 최고의 숙소 터미널과도 걸어서 3분거리 꼭오세요 ! 갓성비 최고의 숙소 터미널과도 걸어서 3분거리 꼭오세요 ! 갓성비 최고의 숙소 터미널과도 걸어서 3분거리 꼭오세요 !,5,1년 전
y_97_393,전주 후,쓸모없는외투,사장님 친절하시고 방도 엄청 깔끔하고 좋아요~~~~~~~~~~~~~~~~~~~~~~~~~~~~~~~~~~~~~~~~~~~~~~~~~~~~~~~~~~~~~~~~~~~~~~~~~~~~~~~~~~~~~~,5,4년 전
y_97_394,전주 후,여기어때 이용 고객,맘에들어요 퇴실시간도 넉넉하고 장소도 좋아서 어딜가든 편히 갈수잇는거같아요 창도 암막처리되서 해도 안들어오고 충분히 잘수잇어서 더욱 좋았습니다 번창하세요 굳굳굳굳굳굳굳굳굳굳굳굳굳굳,5,2년 전
y_97_395,전주 후,솔이또링,사장님 친절하시고 비품도 종류 여러가지라 불편함 없이 잘 사용하고 있습니다 수건에서도 냄새안나고 컴퓨터 사양도 좋고 체크아웃 시간 늦어서 자주 이용하는 중 입니당 ! 가성비로는 좋아요 근데 담배냄새 나는건 좀 아쉽습니다,5,2년 전
y_97_396,전주 후,불타는불끈,주차장도 넓고 지붕있는주차장이라서 좋음 컴퓨터 생각보다 좋음. 아주머니 츤데레임 ㅋ,5,8년 전
y_97_397,전주 후,여기어때 이용 고객,맘에들어요 퇴실시간도 넉넉하고 장소도 좋아서 어딜가든 편히 갈수잇는거같아요 창도 암막처리되서 해도 안들어오고 충분히 잘수잇어서 더욱 좋았습니다 번창하세요 굳굳굳굳굳굳굳굳굳굳굳굳굳굳굳,5,2년 전
y_97_398,전주 후,2000938,사장님도 친절하시고 시설 깨끗하고 좋아요! 좋은곳 싸게 잘 쉬다가 갑니다^^,5,8년 전
y_97_399,전주 후,여리g,하루 잘묶었다감니다. 벼개나 침구류 깨끘하니좋았어요.,4,1년 전
y_97_400,전주 후,2093969,한달안에 네번이상 왔었어요! 항상 묵는 방에만 묵었는데 항상 깔끔하고 친절하셨어요~ 오늘 다른 방에 묵게 되었는데 에어컨소리가 너무 커서 놀랐네요ㅠㅠ.. 바꿔달라면 바꿔주시겠지만~ 오늘 그냥 자보려구요 가격대비 최고입니다. 입퇴실시간 넉넉하구 욕실 수압도 훌륭하구요,4,8년 전
y_97_401,전주 후,찡찡한상디,약간 건물이 오래된거치고는 주변에 고속버스터미널도바로 앞이고 편의점도 바로앞에 있어서 좋아요 수압도쎄고 컴퓨터가 피시방처럼 되어있어서 게임도하고 방음도 옆방에사람이없었는지는몰라도 좋았어요,5,2년 전
y_97_402,전주 후,3608658,주인아주머니 친절하시고 터미널 근처라 교통도 편리했습니다. 수압 객실 온도 방음도 좋은 편이였습니다.,5,8년 전
y_97_403,전주 후,종합적인사방오리나무,가격대비soso 가격대비soso 가격대비soso 가격대비soso 가격대비soso 가격대비soso 가격대비soso 가격대비soso 가격대비soso 가격대비soso 가격대비soso 가격대비soso,5,3년 전
y_97_404,전주 후,종합적인사방오리나무,가성비 좋습니다. 깔끔하고 무난해요 가성비 좋습니다. 깔끔하고 무난해요 가성비 좋습니다. 깔끔하고 무난해요 가성비 좋습니다. 깔끔하고 무난해요 가성비 좋습니다. 깔끔하고 무난해요 가성비 좋습니다. 깔끔하고 무난해요 가성비 좋습니다. 깔끔하고 무난해요 가성비 좋습니다. 깔끔하고 무난해요,5,1년 전
y_97_405,전주 후,야속한강정,베팅상태 안좋습니다 여자랑 같이 가지도 않았는데 시트에 긴머리카락 있었고요 화장실도 대충 청소한 흔적있었습니다.대실이후에 대충 청소해서 팔았다는 느낌이 확 들었습니다. 가운도 2개가 기본인데 1개만 있었고 그냥 싼 맛에 이용가능한거 같습니다.,5,1년 전
y_97_406,전주 후,뚱뚱둥,별 안주고싶은데 반개는 줘야되나요??.... 사진이랑 너무다르네요 여기 리뷰쓴사람들은 왜 다 좋다고 남겼는지 모르겠어요...리뷰믿고간건데 일단 너무 드러워요...거미줄도있고..수건쓰려는대 머리카락 한개도아니고 수건에 덕지덕지 붙어있어요 주말이라 육만원이나 결제하고 간건데;;.....싸면은 그나마 그러려니하겠는데 리모델링했다고해서 깨끗할줄알았어요 ...또 보일러도 잠깐만 튼듯 .. 밤에 춥네요.... 화장실시설이나 퇴실시간은 괜찮아요 ...청결에 신경써주세요,0,6년 전
y_97_407,전주 후,1233135,이틀 머물렀는데 바닥 진짜 뜨겁고 전기장판도 안틀고 잤어요. 게다가 수압이 정말좋아서 편하게 쉬다가 가요 욕조도 큰편이랍니다. 사장님도 친절하시고 다만 이틀째에 청소상태가 살짝 아쉽긴했지만 편하고 좋았답니다!,4,9년 전
y_97_408,전주 후,437814,"고객응대,비상시대응,가격대비 주변 숙박시설에 비해 굉장히 좋습니다. 그래서 매번 전주여행 가면 여기만갑니다. 커플pc룸 추천드립니다. 오늘도 갔는데 역시 ㅎㅎ 터미널 바로 옆이라 가까워서두 좋구요.추천!",4,9년 전
y_97_409,전주 후,여기어때고객님,객실 컨디션우수 전주버스터미널 근처의 숙소입니다 조용하고 쾌적합니다 pc사양이 좋아서 pc방에서 게임하는것같습니다 침구류도 깨끗하게 잘 관리되고 편안하게 쉬고 갈 수 있는곳입니다.,5,2년 전
y_97_410,전주 후,어어주뮈어저,넷플릭스 유튜브가 되서 재밌게 지냈습니다. 주변에 편의점도 있어서 뭐 사먹으러 나가기 좋구요. 다만 화장실 배수구에 머리카락 뭉친게 많아서 청소가 잘 됬나 싶더라구요. 나머지는 다 좋았습니다,5,4년 전
y_97_411,전주 후,여기어때 이용 고객,전주쪽에 처음가본곳인데요 전주시내쪽이랑도 가깝고 주변에 먹자골목이 있고 터미널이랑도 엄청 가까워서 좋다고 생각을 합니다 컴퓨터도 엄청 빠르고 친절한 점도 좋다고 생각을 합니다 다음에 또 이용하려고요,5,1년 전
y_97_412,전주 후,여행이좋아요용,피시사양 좋고 침구깨끗 비데 맘에듬,5,1년 전
y_97_413,전주 후,1023038,"두번째 방문~ 이번엔 커플피시룸 이용했는데 주변 모텔과 견주어볼때 이정도 컴사양 있을 모텔이 있을까 싶을정도로 좋네요! 508호 묶었는데 저번 이용했던 방보다 너무 따뜻하고 뜨신물도 잘 나와서 좋았습니다. 다음에도 일반실보단 커플피시룸 이용하려구요! 고대기가 비치되어있어서 좋다했더니 작동을 안하더라구요 그점이 좀 아쉬웠습니다~ 그리고 컴퓨터 사양이 좋아서 그런지 이전 이용 고객들이 막다뤄서 그런가 깔려있는 게임도 안되는게 몇개 있었어요~ 퇴실후, 객실마다 고장여부 체크해보심이 좋을것 같아요~ 남자친구 얼굴 바로 알아봐주시고, 친절히 대해주셔감사했어요~ 이모님~ 다음에도 이용할게요~",5,9년 전
y_97_414,전주 후,쁑띈떄낑,방문해보니 다른분들이 왜 추천하는지 알겠더군요ㅎㅎ 너무 좋아요 침대열선도 좋고 화장실과 방 내부 깨끗했고요 컴퓨터도 있어서 게임도 할수 있고 창문 닫으니까 세상과 단절된듯 어두워져서 전 더 좋았어요 전주에 다시 오게되면 여기로 다시 잡을거 같아요,5,6년 전
y_97_415,전주 후,철마공원브뤼셀그리펀,청결 상태 매우 좋앗고 잘 이용했습니다,4,1년 전
y_97_416,전주 후,7125931,일단 숙박연구소 키트를 줌 심지어 이 안에 샴푸린스스킨로션 키트가 들어있음 여기 안에 없는게 없고 화장실 깨끗 비데도 있음 1주일에 한번 이용하는데 만족오짐 전기장판 개오짐 컴퓨터 좋음 피시방배경처럼 런처 깔려있을 정도 가운 있음 냄새 안남 충전기 다 있음,5,6년 전
y_97_417,전주 후,여기어때 이용 고객,맘에들어요 퇴실시간도 넉넉하고 장소도 좋아서 어딜가든 편히 갈수잇는거같아요 창도 암막처리되서 해도 안들어오고 충분히 잘수잇어서 더욱 좋았습니다 번창하세요 굳굳굳굳굳굳굳굳굳굳굳굳굳굳굳,5,2년 전
y_97_418,전주 후,종합적인사방오리나무,굿~~~~ .,5,3년 전
y_97_419,전주 후,착한가이야,잘쉬고 왔습니다 ~~!잘쉬고 왔습니다 ~~! 잘쉬고 왔습니다 ~~!잘쉬고 왔습니다 ~~! 잘쉬고 왔습니다 ~~!잘쉬고 왔습니다 ~~! 잘쉬고 왔습니다 ~~!잘쉬고 왔습니다 ~~!,5,3년 전
y_97_420,전주 후,종합적인사방오리나무,좋습니다. .,5,3년 전
y_97_421,전주 후,종합적인사방오리나무,좋습니다. .,5,3년 전
y_97_422,전주 후,하루만잘래,적당한 가격에 딱 그만큼의 시설 및 인테리어~~ 방안에 담배냄새는 배어있지 않아서 좋았던 기억이 난다. 전국을 돌아다니는 직업이다보니 365일중 300일은 모텔에서 지내는데 여기는 가격대비 좋지도 나쁘지도않고 딱 쏘쏘하다,5,2년 전
y_97_423,전주 후,라이네즈,객실 청소 상태가 매우 깨끗하고 시설도 정말 좋습니다. 직원분들도 친절하시고 방음도 잘 되어 있습니다. 주변에 식당가와 편의점이 가까이 있어 편하게 이용할 수 있었습니다. 번창하세요~,4,3년 전
y_97_424,전주 후,안*****,이번에는 들어가자마자 담배냄새가 너무 많이 나서 좀 아쉬웠어요...그리고 너무너무 추워요....아무래도 겨울이라서 난방은 좀 잘 해주셨으면 좋겠어요 공기자체가 너무 추워요....들어가자마자 추웠어요 그 부분은 이해하지만 그 이후로도 추웠어요 옷을 입고 있어야할 정도라서요 저녁 7시 이후론 좀 따뜻하다가 12시 지나면 또 끄시는지ㅠㅠㅠㅠㅠ새벽에도 바닥이 차더라고요,4,2년 전
y_97_425,전주 후,종합적인사방오리나무,"굿~~~~~~~~~ ,",5,3년 전
y_97_426,전주 후,889323,주말마다 숙박이용해요~ 후 몰랐을땐 귀찮게 고데기 맨날 챙겨다녔는데 여기는 고데기까지있어서 너무 좋아요^^ 객실도 항상 청결하고 프론트 사장님두 친절하시구요~ 가격이랑 퇴실시간 뭐 하나 빼놓을게없네요~^^ 늘 잘 쉬다가용~,5,9년 전
y_97_427,전주 후,오목조목한망아지,방이 깨끗합니다 화장실도 깨끗합니다 아쉬운점은 욕조 물이 잘 안빠져요ㅠㅠ 그거 빼고는 괜탆았어요! 시트도 깨끗하고 전체적으로 깨끗해서 만족스러웠어요 퇴실시간도 너무 넉넉해서 늦잠 잘수있어요,5,3년 전
y_97_428,전주 후,뭉글뭉굴이,항상 자주 가는곳입니다 매번 가지만 너무 좋아요 고속버스터미널 근처에선 가격대비로는 정말 괜찮은곳인거같아요 청소도 잘 되어있고 사장님이 우선 너무 친절하셔서 기분좋게 하루 잘 머물다 가는거같아요ㅎㅎㅎ,5,4년 전
y_97_429,전주 후,여기어때월150,전주 에서 제일 자주가는 곳입니다 매번 친절하시고 청결상태 좋고 깔끔하고 위치좋고 주차자리도 좋고 가성비중에 제일 가성비 인거같습니다 자주 이용해주세요~~~,5,2년 전
y_97_430,전주 후,인생은두방,"일단 여기는 컴터가 엄청 빠르고 가격이 저렴합니다!빠른, 입실 늦은 퇴실이라 이용시간 좋고요 일단 위치도 좋아요 그리고 마지막으로 모든 객실에 넷플릭스 있어서 시간 보내기 최고입니다",5,3년 전
y_97_431,전주 후,노긋한역술가,고속버스 터미널 바로 옆이라서 좋아요 시설도 주변 중에서는 나름 괜찮고 퇴실 시간 압박도 별로 없고 편하게 쉬다 올 수 있어요 여기도 샴푸 린스 바디워시 디스펜서로 되어있어서 위생도 나름 괜찮네요,5,2년 전
y_97_432,전주 후,사기적인파견자,자주 방문하다보니 사장님하고 먼가 좀 친해진느낌 ㅎㅎ 자주이용하고 하다보니까 반겨주시는게 좋앗어요 저렴하고 가성비잇는데가 쩡이긴허니까 계속 여기로 올슈밖에없는 이유같아요 ㅎㅎ다음애도 이용하겟습니다,5,1년 전
y_97_433,전주 후,1889010,"서울에서 전주 처음 놀러 오는데, 서울 인근 모텔가격과 비슷한 가격대에 최고의 시설을 가진 곳을 와서 너무 만족해요! 커플pc방밖에 없길래 기대안하고 왔는데 컴퓨터들이 피시방 사양과 거의 비슷하네요.. 요즘 유행하는 게임도 하구...상상도 못했어요 커피포트도 이용한 모텔, 호텔 중에 제일 깨끗하고 편했어요^^ 터미널과 가까운 곳으로 기대없이 예약한건데, 너무너무 만족한 1박이 될 것 같아요. ^^ 적극추천합니다~ 리뷰 처음 써용ㅎㅎ넘넘 굿!",5,8년 전
y_97_434,전주 후,여기어때 이용 고객,맘에들어요 퇴실시간도 넉넉하고 장소도 좋아서 어딜가든 편히 갈수잇는거같아요 창도 암막처리되서 해도 안들어오고 충분히 잘수잇어서 더욱 좋았습니다 번창하세요 굳굳굳굳굳굳굳굳굳굳굳굳굳굳,5,2년 전
y_97_435,전주 후,종합적인사방오리나무,편합니다. .,5,3년 전
y_97_436,전주 후,타*****,고속버스터미널 근처에 하루 묵을 곳 찾다가 퇴실 시간이 2시라 눚잠자서 여유부리며 나올 수 있어서 예약했는데 입실해보니 기대이상으로 깨끗하고 컴퓨터도 너무 좋아서 대만족했습니다 맛있는 밥도 시켜 먹고 푹 쉬다갑니다 !,5,2년 전
y_97_437,전주 후,125226,욕조가 누래욬ㅋㅋㅋㅋㅋㅋㅋㅋㅋ 목욕은 안했습니다. 위치나 서비스는 만족~,4,8년 전
y_97_438,전주 후,정신적인부정,ㅎㅎㅎㅎ좋았아요 컴퓨터도 있고 넷플도 되구요 근데 방에서 담배냄새가 조금 났습니다 ㅠㅠㅠㅠㅠㅠ 그래도 객실 전체적으로는 괜찮았습니다 ㅎㅎㅎㅎㅎㅎ ㅎㅎㅎㅎㅎㅎ 다음에 어쩌다가 한번 올 거 같아용,5,2년 전
y_97_439,전주 후,타*****,저번에 하루 묵고 만족했었어서 또 방문했습니다~ 이번에도 잘 쉬다 가요 이번에는 청소를 허시는건지 손님 소음인지는 모르겠지만 저녁과 아침에 심하게 쿵쿵대서 제가 잠귀가 밝아 아쉬웠습니다. 다음에 또 올게요,5,2년 전
y_97_440,전주 후,8365685,시설 청결 서비스 다 좋앗구요 커플pc룸 이용햇는데 컴퓨터도 엄청좋네요 방이작은줄알앗는데 딱적당한거같앗어요 화장실이랑 방도 깔끔햇고 사장님도 착하셧어요 다음에도 이용할생각이에요ㅎ,5,6년 전
y_97_441,전주 후,고속진,새벽에 머리가 너무 아픈 바람에 약달라고 했는데 너무 친절하셔서 좋았습니다... 인테라어는 전반적으로 괜찮았습니다 가격도 합리적이구요 즐거운시간 보내고 갑니다~,4,8년 전
