id,name,nickname,review_content,rating,write_date
y_97_1950,전주 후,선이선이권선이,가덨던숙소중 제일 최악이였어요 넥플릭스도 안돼고 부분티비고장에 청결부분에선 물을 흘려 닦던중 꽃가루면 이해라도 하겠는데 오랫동안 닦지 않은것처럼 물티슈에 시커멓게 닦여지고 코드선있는부분엔 먼지가득에 정말 최악이였습니다.,0,2년 전
y_97_1951,전주 후,889323,고데기가 있어 좋아요 주말마다 늘 이용하는 곳이에요. 잘쉬다갑니다ㅎㅎ,5,8년 전
y_97_1952,전주 후,889323,주말마다오는 후 미리 예약후 이용했어요 올때마다 편하게 잘있다 갑니당ㅋㅋ,5,8년 전
y_97_1953,전주 후,괘씸한코딱지,가격 대비 이만한 곳이 없지요!! 특히 빠른 컴터가 마음에 들었습니다.,5,9년 전
y_97_1954,전주 후,young89,ㅋㅋㄱㅋㅋㅋㅋㅋ항상 이용하는곳인데 매번 만족합니다 버스터미널과도 가까워요,5,8년 전
y_97_1955,전주 후,50081,터미널 근처라서 좋고 혼자 하루 있기에도 좋았습니다 잘 쉬다가요~^^,5,8년 전
y_97_1956,전주 후,하늘물빛바다,깨끗하고 넓고 퇴실시 여유롭게 해주셔서 감사합니다 ^_^ 번창하세요~,5,8년 전
y_97_1957,전주 후,2951918,화장실이 조금 추운거 빼고 괜차나요 ㅎ❤️!!!!!!!!!!!!!!!,5,8년 전
y_97_1958,전주 후,심심한루피,좋앗어요 깔끔하고 가격 대비 만족햇어요!!!!!! 푹 잘 쉬다가 갑니다,5,8년 전
y_97_1959,전주 후,미끄둥,가격대비 괜찮습니다 다만 커플피씨 이용시 컴터 한곳씩 문제가 조금있네요ㅠ,3,6년 전
y_97_1960,전주 후,307728,전주에 올때마다 슥ㆍ박합니다 괜찮은곳입니다 추천합니다~~~~~~~,5,8년 전
y_97_1961,전주 후,울산패잔병,자주이용하고있는데 시설도 매우깨끗하고 난방도잘되서 편하게쉬었다갑니다,5,8년 전
y_97_1962,전주 후,8053042,사장님께서 친절하게 대해주셨어요,4,6년 전
y_97_1963,전주 후,6172487,깨끗하고 좋았어요. 고데기도 있었고! 샤워기가 마음에 드네요 :) ~,5,7년 전
y_97_1964,전주 후,서재원21,출장업무차 내려왔다가 이용하고 갑니다. 너무 깨끗하고 좋아요!,5,7년 전
y_97_1965,전주 후,여긴어따,비와서오늘도일찍와버렸네요 ㅎㅎㅎ감사해요눈치도안주시공 흨ㅋㅋㅋ따뜻,5,8년 전
y_97_1966,전주 후,307728,객실컨디션 좋고요 깨큿합니다 만족합니다~~~~~~~~~~~~~,5,8년 전
y_97_1967,전주 후,307728,시설좋습니다 깨끗하구요 전주오면 항상 들러요~~~~~~~~~~~,5,8년 전
y_97_1968,전주 후,307728,서비스좋네요 항상 전주올일있으면 여기만옵니다~~~사업 번창하세요,5,8년 전
y_97_1969,전주 후,여기어때 이용 고객,굳굳굳굳굳굳굳굳굳굳굳굳굳굳굳굳굳굳굳굳굳굳굳굳굳굳굳굳굳굳굳굳굳굳굳굳굳굳굳굳굳굳굳굳굳굳굳굳굳굳굳굳굳굳굳굳굳굳굳굳굳굳굳굳굳굳굳굳굳굳굳굳굳굳굳굳굳굳굳굳굳굳굳굳굳굳굳굳굳굳굳굳굳굳굳굳굳굳굳굳굳굳굳굳굳굳굳굳굳굳굳굳굳굳굳굳굳굳굳굳,5,2년 전
y_97_1970,전주 후,여기어때 이용 고객,굳굳굳굳굳굳굳굳굳굳굳굳굳굳굳굳굳굳굳굳굳굳굳굳굳굳굳굳굳굳굳굳굳굳굳굳굳굳굳굳굳굳굳굳굳굳굳굳굳굳굳굳굳굳굳굳굳굳굳굳굳굳굳굳굳굳굳굳굳굳굳굳굳굳굳굳굳굳굳굳굳굳굳굳굳굳굳굳굳굳굳굳굳굳굳굳굳굳굳굳굳굳굳굳굳굳굳굳굳굳굳굳굳굳굳굳굳굳굳굳,5,2년 전
y_97_1971,전주 후,여기어때 이용 고객,굳굳굳굳굳굳굳굳굳굳굳굳굳굳굳굳굳굳굳굳굳굳굳굳굳굳굳굳굳굳굳굳굳굳굳굳굳굳굳굳굳굳굳굳굳굳굳굳굳굳굳굳굳굳굳굳굳굳굳굳굳굳굳굳굳굳굳굳굳굳굳굳굳굳굳굳굳굳굳굳굳굳굳굳굳굳굳굳굳굳굳굳굳굳굳굳굳굳굳굳굳굳굳굳굳굳굳굳굳굳굳굳굳굳굳굳굳굳굳굳,5,2년 전
y_97_1972,전주 후,여기어때 이용 고객,굳굳굳굳굳굳굳굳굳굳굳굳굳굳굳굳굳굳굳굳굳굳굳굳굳굳굳굳굳굳굳굳굳굳굳굳굳굳굳굳굳굳굳굳굳굳굳굳굳굳굳굳굳굳굳굳굳굳굳굳굳굳굳굳굳굳굳굳굳굳굳굳굳굳굳굳굳굳굳굳굳굳굳굳굳굳굳굳굳굳굳굳굳굳굳굳굳굳굳굳굳굳굳굳굳굳굳굳굳굳굳굳굳굳굳굳굳굳굳굳,5,2년 전
y_97_1973,전주 후,여기어때 이용 고객,굿굿굿굿굿굿굿굿굿굿굿굿굿굿굿굿굿굿굿굿굿굿굿굿굿굿굿굿굿굿굿굿굿굿굿굿굿굿굿굿굿굿굿굿굿굿굿굿굿굿굿굿굿굿굿굿굿굿굿굿굿굿굿굿굿굿굿굿굿굿굿굿굿굿굿굿굿굿굿굿굿굿굿굿굿굿굿굿굿굿굿굿굿굿굿굿굿굿굿굿굿굿굿굿굿굿굿굿굿굿굿굿굿굿굿굿굿굿굿굿,5,3년 전
y_97_1974,전주 후,버으섯,가격대비 진짜 좋은거 같아요....................,5,8년 전
y_97_1975,전주 후,9402828,좋아요!깨끗하고 친절하고,4,6년 전
y_97_1976,전주 후,9488971,시설 좋고 청결하고 사장님도 친절하심 굿굿,3,5년 전
y_97_1977,전주 후,울부,항상가지만 청결하고아늑합니다~ 고데기도있어서따로안챙겨가도되서좋구여~,5,6년 전
y_97_1978,전주 후,천왕성사령부,완전만족!!!! 시간 길어서 좀 허름할줄 알았는데 전혀 아니었음 강츤,5,6년 전
y_97_1979,전주 후,여긴어따,오늘도 쉬로왓써요♥♥♥ 담배냄시가나지만 그래도깨끗~~~ㅎㅎㅎㅎ,5,8년 전
y_97_1980,전주 후,6699989,모든게 다 좋았어요ㅎㅎㅎㅎㅎㅎ근데 화장실에 벌레가 나왔어요ㅎㅠㅠㅜ,3,5년 전
y_97_1981,전주 후,하애,엄 청 깨 끗 하 고 피 씨 있 는 방 좋 습 니 다 터 미 날 근 쳐 에 있 어 서 위 치 도 맘 에 들구요 엄 청 깨 끗 하 고 피 씨 있 는 방 좋 습 니 다 터 미 날 근 쳐 에 있 어 서 위 치 도 맘 에 들구요,5,2년 전
y_97_1982,전주 후,5761600,위치도 좋고 깔끔하네요!^^,4,6년 전
y_97_1983,전주 후,여행조아조아잉,절대 비추해요.. 모텔도 아니고 여관수준이에요.. 심지어 엄청 큰 °°벌레가 2개나 나왔어요.. 요즘 세상에 벌레라니...ㅠㅠ 일이 생겨서 급하게 예약한 제 탓이죠..,0,1년 전
y_97_1984,전주 후,여긴어따,잘쉬었어요 좀 새벽에추웠지만~~ 그래도만족만족입니돻ㅎㅎㅎㅎㅎ,5,8년 전
y_97_1985,전주 후,여기어때고객님,두번째 이용 고객으로 어무 좋았습니다. 다음에도 이용할께요!,5,8년 전
y_97_1986,전주 후,288590,진짜좋아용♥또왔습니다 잘쉬고 갈께요 감사합니다 사장님♥ㅎㅎㅎㅎ,5,8년 전
y_97_1987,전주 후,전격적인캐스퍼,가성비 완전 만족! 외관시설은 좀 그렇지만 내부는 좋습니다!!,5,5년 전
y_97_1988,전주 후,이불속이젤조아,화장실 청소가 잘 안된거 빼고 단골 집인 만큼 마음에 들었어요,3,6년 전
y_97_1989,전주 후,민오토락,가격저렴하고 좋아요,4,5년 전
y_97_1990,전주 후,524738,방값도 시세에 비하면 쌌고 시설도 그렇게 나쁘진 않았어요. 화장실문이 안닫힌건 함정...,4,9년 전
y_97_1991,전주 후,돔황차차,방음이 부족한거 빼고는 모두 굿굿굿 엄청좋았어요~ 깔끔 따뜻,5,7년 전
y_97_1992,전주 후,여행다녀자,깔끔하고 컴퓨터도 좋아요ㅎㅎㅎㅎ 다음에 또오고싶어요~~~ㅎㅎㅎㅎ,5,8년 전
y_97_1993,전주 후,8517736,최고입니다.저렴한 가격!가까운 터미널!저에겐 너무 좋은 조건~,5,6년 전
y_97_1994,전주 후,125226,좋아요 몇번째 이용ㅇ인짘ㅋㅋㅋㅋ,4,8년 전
y_97_1995,전주 후,여긴어따,항상즐겁게따뜻하게잘쓰고갑니다 친절에감사해욯ㅎㅎㅎㅎ 함상여기로,5,8년 전
y_97_1996,전주 후,1437379,모기가너무많네요.............ㅇ.ㅇ.........,5,8년 전
y_97_1997,전주 후,2596177,한달에 한두번은 꼭 찾는 숙소 주인 할머니 친절해쇼,5,4년 전
y_97_1998,전주 후,8487308,먹거리가 많은 지역 근처라 숙박하는 것에 큰 도움이 되었어요,5,6년 전
y_97_1999,전주 후,1008774,깔끔하고 좋네요 아주머니도친절하시고 다움에또오고싶습니다~~~,5,8년 전
y_97_2000,전주 후,2303646,매번잘쓰고있어요!!! 에어컨빵빵하고 깔끔하게좋아요......,5,8년 전
y_97_2001,전주 후,베트남스키퍼키,너무좋네요 가격이저렴해서기대안햇는데 또방문하고싶네요 ㅎ,5,6년 전
y_97_2002,전주 후,여기어때 이용 고객,좋아요~청결하고요~,4,6년 전
y_97_2003,전주 후,노주섭1,시설이 조용하고 깔끔하고 좋네요 ㅎㅎ 다음에 또올게요.ㅎㅎ,5,8년 전
y_97_2004,전주 후,밝고평범한프라하공항,사장님 넘 친절하시구 서비스 좋아용 빠른입실 늦은퇴실 최고,5,6년 전
y_97_2005,전주 후,1317508,가운에서 냄새나는거 빼고좋아여 시설도 괜차나여 ㅋㅋㅋㅋㅋ다음에도 올만해요~~~~~~~~,4,8년 전
y_97_2006,전주 후,14042986,객실도 따뜻하고 컴퓨터도 빠르고 특히 침대에 전기장판이 있어서 편하개 잤습니다. 다만 티비 리모컨이 잘 안먹히는점은 살짝 아쉬웠지만 좋은 시설이였습니다,5,4년 전
y_97_2007,전주 후,에스티루이,생각보다 가깝고 가격도 저렴하고 맘에 쏙 들어 만족합니다.,5,6년 전
y_97_2008,전주 후,2643754,깔끔하고 정갈하게 정돈되어있어 좋네요... 잘 쉬다 갑니다~,5,7년 전
y_97_2009,전주 후,끼뭉,화장실 변기며 여기저기 물 튀기고 뒷정리를 안한 흔적들이..청소가 제대로 안되어 있더라구요 그리고 다른 곳은 가운을 세탁 후 비닐 포장해주는 곳이 많았는데 여기는 그냥 옷걸이에 걸려있어요..대충 깨끗해보이면 다시 걸어두는건 아닌지 찝찝했습니다,3,6년 전
y_97_2010,전주 후,여기어때 이용 고객,참좋았다참좋았다참좋았다참좋았다참좋았다참좋았다참좋았다참좋았다참좋았다참좋았다참좋았다참좋았다참좋았다참좋았다 참좋았다참좋았다참좋았다참좋았다참좋았다참좋았다참좋았다참좋았다참좋았다참좋았다참좋았다참좋았다참좋았다참좋았다,5,3년 전
y_97_2011,전주 후,최강레전드,조아여 ㅎ ㅎㅎㅎㅎㅎㅎㅎㅎㅎㅎㅎㅎㅎㅎㅎㅎ 나름 뭐 시설 괜찬ㅍ구여 ㅎㅎㅎㅎ 그래도 조아여 . .ㅎㅎㅎㅎㅎㅎㅎㅎ 다들 뭐 재밋게 하세용 ㅎㅎㅎ ㅎㅎ........,5,1년 전
y_97_2012,전주 후,뭉글뭉굴이,좋아요 터미널근처에선 여기서 가성비가 제일 좋은거같아요,5,4년 전
y_97_2013,전주 후,서울의정부원주,정말 괜찮은 숙소에요,5,1년 전
y_97_2014,전주 후,어뜨기,"일단 여자친구가 원하는 고대기가 있어서 방문햇는데.. 생각보다 고대기가 약하다고 하네요. 그리고 퇴실시길이 2시라서, 아주 만족 스럽게 쉬고 왓네요. 쉬취때문에 힘들어하는편인데 늦게까지 잘쉬고 왓네요",5,2년 전
y_97_2015,전주 후,3409970,대실시간도 6시간으로 넉넉하고 저렴해서 너무 좋아요!!,5,7년 전
y_97_2016,전주 후,9456862,사장님께서 친절하시고 무난하게 잘 묵었어요,4,6년 전
y_97_2017,전주 후,여기어때 이용 고객,청결하기는 했지만 일부러 커플PC 방으로 예약햇던건데 하나는 갠찮앗는데 하나는 자꾸 튕겨서 탈주됫어요... 그래서 방 옮겻는데 또 하나는 말썽이라 결국 게임못했네요 컴퓨터 개선이 좀 시급해 보여요.,2,9년 전
y_97_2018,전주 후,3140936,내나이41살 여친나이 47살 너무늦게 만나서 결혼을 전제로 연애중 여기어때을알게돼여 깨끗 하고 저렴한 숙소에서 편하게 지내게해준 여기어때 강추 힙니다 앞으로도 좋은 이벤 많이 부탁해요 기대해도돼죵 ? ㅋㅋ,5,8년 전
y_97_2019,전주 후,여기어때 이용 고객,좋아요 편히쉬다갑니다좋아요 편히쉬다갑니다좋아요 편히쉬다갑니다좋아요 편히쉬다갑니다좋아요 편히쉬다갑니다좋아요 편히쉬다갑니다좋아요 편히쉬다갑니다 좋아요 편히쉬다갑니다좋아요 편히쉬다갑니다좋아요 편히쉬다갑니다,5,2년 전
y_97_2020,전주 후,현이75,멀리서 급하게왔는데 잘 자고가요 침대가 조금 딱딱쓰해요,5,2년 전
y_97_2021,전주 후,여긴어따,푹쉬고 잘자고 가요~ㅎㅎ 여기서자면꿀잠이네욯ㅎㅎㅎㅎ,5,7년 전
y_97_2022,전주 후,3908676,화장실문이없어요ㅠㅠ 그래도객실은깨끗하네용,4,8년 전
y_97_2023,전주 후,201760,매번갈따마다 여기만이용합니다 깨끗하고 게임도되구 좋네요,5,7년 전
y_97_2024,전주 후,병진재영,편히쉬다갈수있어서좋고 퇴실시간도다른곳보다길어서좋아요,5,5년 전
y_97_2025,전주 후,5978281,좋아요좋아요 가격대비 정말 괜찮죠 ㅎㅎ,4,6년 전
y_97_2026,전주 후,6295542,친절하시구 리모델링도 잘되있어서 깨긋하고 좋아요ㅎㅎ,5,6년 전
y_97_2027,전주 후,4206260,인테리어 좋아서 남자친구랑 또 가자고 했어요 좋아요,5,7년 전
y_97_2028,전주 후,여기어때 이용 고객,굳굳굳굳굳굳굳굳굳굳굳굳굳굳굳굳굳굳굳굳굳굳굳굳굳굳굳굳굳굳굳굳굳굳굳굳굳굳굳굳굳굳굳굳굳굳굳굳굳굳굳굳굳굳굳굳굳굳굳굳굳굳굳굳굳굳굳굳굳굳굳굳굳굳굳굳굳굳굳굳굳굳굳굳굳굳굳굳굳굳굳굳굳굳굳굳굳굳굳굳굳굳굳굳굳굳굳굳,5,2년 전
y_97_2029,전주 후,여기어때 이용 고객,굳굳굳굳굳굳굳굳굳굳굳굳굳굳굳굳굳굳굳굳굳굳굳굳굳굳굳굳굳굳굳굳굳굳굳굳굳굳굳굳굳굳굳굳굳굳굳굳굳굳굳굳굳굳굳굳굳굳굳굳굳굳굳굳굳굳굳굳굳굳굳굳굳굳굳굳굳굳굳굳굳굳굳굳굳굳굳굳굳굳굳굳굳굳굳굳굳굳굳굳굳굳굳굳굳굳굳굳,5,2년 전
y_97_2030,전주 후,여기어때 이용 고객,굳굳굳굳굳굳굳굳굳굳굳굳굳굳굳굳굳굳굳굳굳굳굳굳굳굳굳굳굳굳굳굳굳굳굳굳굳굳굳굳굳굳굳굳굳굳굳굳굳굳굳굳굳굳 굳굳굳굳굳굳굳굳굳굳굳굳굳굳굳굳굳굳굳굳굳굳굳굳굳굳굳굳굳굳굳굳굳굳굳굳굳굳굳굳굳굳굳굳굳굳굳굳굳굳굳굳굳굳,5,2년 전
y_97_2031,전주 후,여기어때 이용 고객,좋아요 항상 굳굳입니다좋아요 항상 굳굳입니다좋아요 항상 굳굳입니다좋아요 항상 굳굳입니다좋아요 항상 굳굳입니다좋아요 항상 굳굳입니다좋아요 항상 굳굳입니다좋아요 항상 굳굳입니다좋아요 항상 굳굳입니다,5,3년 전
y_97_2032,전주 후,널찍널찍한오렌지,대실시간도 길고 좋아요~ 리모델링하셨는지 깔끔하네요,5,6년 전
y_97_2033,전주 후,최강레전드,조아여 ㅎㅎ 그래도 자주 잇고 먼가 편해여 . 괜찮아오 에어컨 잘나온 ㅊ ㅊ.ㅎ ㅎㅎㅎㅎ 조아여 ㅎㅎㅎㅎㅎㅎ,5,1년 전
y_97_2034,전주 후,구불구불한자작나무,리모델링해서 가격에 비해 엄청좋아요^^* 강추 합니다,5,5년 전
y_97_2035,전주 후,2050862,깨끗하고 사장님도 친절하셔서 즐겁게 묵다 갔습니다!,5,8년 전
y_97_2036,전주 후,이그뇽,깨끗하고 자주이용하는 모텔이지만 나무랄게없어요 ㅋㅋ,5,6년 전
y_97_2037,전주 후,울부,매번리뷰도남기지만 매번청결하고좋아요~아늑해서좋습니다,5,6년 전
y_97_2038,전주 후,종합적인사방오리나무,좋습니다!!!좋습니다!!!좋습니다!!!좋습니다!!!좋습니다!!!좋습니다!!!좋습니다!!!좋습니다!좋습니다!!!좋습니다!!!좋습니다!!!좋습니다!!!좋습니다!!!좋습니다!!!좋습니다!!!좋습니다!,5,3년 전
y_97_2039,전주 후,945947,굿~~~~! 늘 좋아용ㅎㅎㅎ 이모님도 재밌고 따뜻하고 교통편도 좋고 가격대비 만족,4,9년 전
y_97_2040,전주 후,정신분석이론,방을 사용하는 데는 괜찮았습니다. 다만 담배냄새가 너무많이 올라와서 있는 내내 어지러웠습니다. 흡연방이면 흡연방이라고 적혀있으면 좋겠어요~,3,2년 전
y_97_2041,전주 후,여긴어따,올만에왔는데 더좋아졌어요~ 역시친절하시구요♥♥♥,5,6년 전
y_97_2042,전주 후,여긴어따,공기는차갑지만 이불속은따뜻하고 수맙이강해서좋아요,5,7년 전
y_97_2043,전주 후,여기어때 이용 고객,시설도 좋았고 거의 여기만 이용하는거 같아요^^,5,7년 전
y_97_2044,전주 후,여기어때 이용 고객,너무좋습니다 굳굳너무좋습니다 굳굳너무좋습니다 굳굳너무좋습니다 굳굳너무좋습니다 굳굳너무좋습니다 굳굳너무좋습니다 굳굳너무좋습니다 굳굳너무좋습니다 너무좋습니다 굳굳너무좋습니다 굳굳너무좋습니다 굳굳,5,3년 전
y_97_2045,전주 후,야외식물원제의,근처오면 늘 쓰는 숙소에요 따뜻하게 잘 잤습니다~,5,6년 전
y_97_2046,전주 후,힐링MD,터미널두 가깝구 시설두 리모델링 되어서 괜찮아요,5,6년 전
y_97_2047,전주 후,밍누냐냐,가성비도 좋고 퇴실시간도 다른곳보다 늦고 만족.,5,6년 전
y_97_2048,전주 후,1312738,너무너무너무 깨끗하고 좋아서 매번 이용하고있어요,5,8년 전
y_97_2049,전주 후,엄격한뿌리,굿굿 너무좋네요!!!굿굿 너무좋네요!!!굿굿 너무좋네요!!!굿굿 너무좋네요!!!굿굿 너무좋네요!!!굿굿 너무좋네요!!!굿굿 너무좋네요!!!굿굿 너무좋네요!!!굿굿 너무좋네요!!!굿굿 너무좋네요!!!,5,2년 전
y_97_2050,전주 후,여기어때 이용 고객,좋아요~~~~~~~~~수건에 뭐가 묻어있긴했어요,5,6년 전
y_97_2051,전주 후,4129531,ㅇ왐전 짱짱맨 청결찡징,4,8년 전
y_97_2052,전주 후,6198155,터미널 바로 옆인데다가 청결해서 너무 좋았어요.,5,6년 전
y_97_2053,전주 후,여기어때 이용 고객,굳굳굳굳굳굳굳굳굳굳굳굳굳굳굳굳굳굳굳굳굳굳굳굳굳굳굳굳굳굳굳굳굳굳굳굳굳굳굳굳굳굳굳굳굳굳굳굳굳굳굳굳굳굳굳굳굳굳굳굳굳굳굳굳굳굳굳굳굳굳굳굳굳굳굳굳굳굳굳굳굳굳굳굳굳굳굳굳굳굳굳굳굳굳굳굳굳굳굳굳굳굳굳굳굳,5,2년 전
y_97_2054,전주 후,여기어때 이용 고객,좋습니다 자주애용하는곳이에요좋습니다 자주애용하는곳이에요좋습니다 자주애용하는곳이에요좋습니다 자주애용하는곳이에요좋습니다 자주애용하는곳이에요좋습니다 자주애용하는곳이에요좋습니다 자주애용하는곳이에요,5,2년 전
y_97_2055,전주 후,여기어때 이용 고객,편하게 보내다갑니다 또올께요편하게 보내다갑니다 또올께요편하게 보내다갑니다 또올께요편하게 보내다갑니다 또올께요편하게 보내다갑니다 또올께요편하게 보내다갑니다 또올께요편하게 보내다갑니다 또올께요,5,3년 전
y_97_2056,전주 후,1625967,시설 자체가 깔끔하고 둘이쓰기아주 좋습니다^-^,5,8년 전
y_97_2057,전주 후,8932779,후 너무너무 좋아요 늘 가는 단골이에용 추천추천,5,6년 전
y_97_2058,전주 후,진주색나비,입퇴실시간이 늦어서 너무너무너무 좋아요,5,5년 전
y_97_2059,전주 후,벅찬앤드류,너무 편하고 사장님도 친절하세요 항상 이용합니디,5,2년 전
y_97_2060,전주 후,2741955,생각보다 시설도 너무좋고 방도 너무 좋아요!!!,5,6년 전
y_97_2061,전주 후,1064435,예약되게 해주세요ㅜ 예약될때가 좋앗는데ㅠ 그리고 청소하실 때 조금만 구석구석신경 써주시면 정말 좋을듯합니다,3,9년 전
y_97_2062,전주 후,18364,항상 친절하신 서비스 깔끔한방에 만족하고갑니다,5,8년 전
y_97_2063,전주 후,여기어때 이용 고객,너무좋습니다 편히쉬다가요너무좋습니다 편히쉬다가요너무좋습니다 편히쉬다가요너무좋습니다 편히쉬다가요너무좋습니다 편히쉬다가요너무좋습니다 편히쉬다가요너무좋습니다 편히쉬다가요너무좋습니다 편히쉬다가요,5,2년 전
y_97_2064,전주 후,여기어때 이용 고객,굳굳굳굳굳굳굳굳굳굳굳굳굳굳굳굳굳굳굳굳굳굳굳굳굳굳굳굳굳굳굳굳굳굳굳굳굳굳굳굳굳굳굳굳굳굳굳굳굳굳굳굳굳굳굳굳굳굳굳굳굳굳굳굳굳굳굳굳굳굳굳굳굳굳굳굳굳굳굳굳굳굳굳굳굳굳굳굳굳굳굳굳굳굳굳굳굳굳굳굳굳굳굳굳,5,2년 전
y_97_2065,전주 후,여기어때 이용 고객,좋습니다 편히쉬다가요좋습니다 편히쉬다가요좋습니다 편히쉬다가요좋습니다 편히쉬다가요좋습니다 편히쉬다가요좋습니다 편히쉬다가요좋습니다 편히쉬다가요좋습니다 편히쉬다가요좋습니다 좋습니다 편히쉬다가요,5,2년 전
y_97_2066,전주 후,여기어때 이용 고객,굳굳굳굳굳굳굳굳굳굳굳굳굳굳굳굳굳굳굳굳굳굳굳굳굳굳굳굳굳굳굳굳굳굳굳굳굳굳굳굳굳굳굳굳굳굳굳굳굳굳굳굳굳굳굳굳굳굳굳굳굳굳굳굳굳굳굳굳굳굳굳굳굳굳굳굳굳굳굳굳굳굳굳굳굳굳굳굳굳굳굳굳굳굳굳굳굳굳굳굳굳굳굳굳,5,3년 전
y_97_2067,전주 후,2546747,깨끗한 인테리어에ㅡㅡ조용하게 쉴수 있네요~^^,5,7년 전
y_97_2068,전주 후,박구사,객실 들어가자마자 담배 냄새가 심하게 났습니다 사진처럼 침대 시트에 담배 자국이 있었고 화장실은 바닥과 슬리퍼까지 물에 흥건해서 이용할 수가 없었습니다 그래서 그냥 나왔고요 다른 호텔을 새로 돈 주고 예약했습니다,0,1년 전
y_97_2069,전주 후,밍탱밍탱,addxhrskhrstssturklwurwutwurwkurwkhrskutskhfslhfsljfslfjsljfsljfslhgskhfslhfslhfslhfsljfsljfsljfsljfsljgs,5,1년 전
y_97_2070,전주 후,lliiililii,가격이 싸요. 이게 제일 큰 장점 입니다. 비데가 있어요. 아쉬운점은 담배냄새가 너무 너무 많이 납니다. 이게 어느 정도냐면 쩐내가 안 빠지고 이불도 담배 냄새가 나고 끈점 거리는것처럼 느껴질 정도 입니다. 정말 담배 냄새 쾌쾌한것만 아니면 예의상으로라도 좋은 별점 드리고 싶었는데 담배 냄새가 너무 심해요. 전국일주 시작날인데 이것 때문에 그 뒤에 객실은 뮤조건 신축 위주로 잡았습니다. 이것만 해결된다면 정말 좋은 숙소가 되지 않을까 생각 합니다.,2,2년 전
y_97_2071,전주 후,밝고평범한프라하공항,사장님도 친절하시구 빠른입실 특히 너무 좋아용,5,6년 전
y_97_2072,전주 후,예순둘순대,좋았어요~~ ㅎㅎㅎ,4,4년 전
y_97_2073,전주 후,2999647,좋습니다 근데 방에서 담배냄시가 쫌 낫네요ㅋㅋ,5,7년 전
y_97_2074,전주 후,마이바니,방도 바꿔주시고 사장님 친절하세요,4,7년 전
y_97_2075,전주 후,3513485,잘 쉬고 가겠습니다 청결하고 깔끔하고 좋아요~,5,6년 전
y_97_2076,전주 후,9600599,인테리어도 깔끔히잘되잇고 겜도 잘돌아가서좋아요,5,5년 전
y_97_2077,전주 후,강9724,깨끗하고 사장님이 친절하세요ㅎㅎ대실 강추합니다,5,6년 전
y_97_2078,전주 후,종합적인사방오리나무,게임하기 좋은 곳. 청소도 깔끔합니다. .,5,2년 전
y_97_2079,전주 후,1687618,잘쉬다가요 아늑하고사장님좋으셔요 자주이용하는데다음에 또올게요ㅎㅎㅎ 번창하세요,4,9년 전
y_97_2080,전주 후,3858508,좋아요 시설이 짱좋아요 좋아요 짱짱짱 좋아요,5,8년 전
y_97_2081,전주 후,10375522,푹쉬다 갑니다. 퇴실시간이 여유잇어서 좋네여,5,5년 전
y_97_2082,전주 후,우크라이나파이터,입실빠르고 퇴실 늦고 좋아요~~ 5번은 넘게 간것 같은데 항상 주인아주머니도 친절하시고 ~ 방에 무선충전기 있어서 정말 좋았어요~ 넷플릭스도 되고 다음에 또 갈게요 감사합니다 ~~,5,1년 전
y_97_2083,전주 후,1625967,시설이 참 깨끗하고 좋습니다 잠자리도 굿굿굿,5,8년 전
y_97_2084,전주 후,잭1234,너무 너무 좋았어요 적극 추천합니다,5,5년 전
y_97_2085,전주 후,포뽀뽀,넘좋아요 고데기도있어요 다음에또예약할래요~!,5,5년 전
y_97_2086,전주 후,어둠컴컴한병사,방도 갠찮고 청결하고 좋습니다.!!!!!!!,5,6년 전
y_97_2087,전주 후,여기어때 이용 고객,터미널이가깝고 방도 크고 시설도 나쁘지않았습니다^^벌써 두번째 애용!,4,8년 전
y_97_2088,전주 후,3409970,크리스마스에 기분 좋게 잘 쉬다 갑니당!!,5,7년 전
y_97_2089,전주 후,어름샤워,괜찮아요 괜찮아요 괜찮아요,5,2년 전
y_97_2090,전주 후,야박이님,출장 오면 항상 이용 하는곳 좋아요,5,5년 전
y_97_2091,전주 후,서늘한이빨,항상여기만와요! 깔끔하고 사장님도친절합니다,5,5년 전
y_97_2092,전주 후,3914963,여행일정동안 이용했는데 매우 좋았습니다^^,5,8년 전
y_97_2093,전주 후,원초적인비스타,좋아요 이불이 조금 깨끗했으면 좋겠어요,5,6년 전
y_97_2094,전주 후,여기어때 이용 고객,좋아요 편히쉬다갑니다 좋아요 편히쉬다갑니다좋아요 편히쉬다갑니다좋아요 편히쉬다갑니다좋아요 편히쉬다갑니다좋아요 편히쉬다갑니다좋아요 편히쉬다갑니다 좋아요 편히쉬다갑니다좋아요 편히쉬다갑니다,5,2년 전
y_97_2095,전주 후,아마도요,꺠끗하고 주차하기가 편해요,4,4년 전
