id,name,review_content,rating,write_date
yeogi_accom_008_7757,전주 브라운도트 - 덕진점,전주 한달에 한번남짓 오는 장거리 커플인디앞으로 계속 이용하고 싶은 숙소였어요코로나 때문에 밖에 나가서 뭘 하지 못하는데깨끗하고 쾌적해서 숙소 안에서 맛있게 먹고 편하게 잘 쉬다가 갑니다 또 올게요,5,3년 전
yeogi_accom_008_7758,전주 브라운도트 - 덕진점,타지 친구가 놀러오거나 전주 친구들끼리 방잡고 놀때 항상 애용하는 숙소입니다 코로나가 터지고 애용하기 시작했는데 그 뒤로도 자주 올만큼 근처에 먹거리도 많고 바로 옆에 덕진공원도 있어 산책하기 좋습니다,5,1년 전
yeogi_accom_008_7759,전주 브라운도트 - 덕진점,너무 너무 좋습니다 적극 추천합니다,4,1년 전
yeogi_accom_008_7760,전주 브라운도트 - 덕진점,올만에갔네요 북대에서는 여기가 탑이에요 제일깔끔하고 냄새도안나고 제일좋음 앞에편의점도있어서편하고 입구앞에 음료수랑물도준비되어있어서편하게가져가서드시면되요 북대에서 여기보다 좋은데는없네요,5,1년 전
yeogi_accom_008_7761,전주 브라운도트 - 덕진점,하루하루 예약을 하고 연박으로 프론트에 확인을 하고 입실을 했습니다다음날 퇴근 후 입실하는데 프론트에 확인했던 그분이 왜 나갈때 연박인걸 말 안했냐고 합니다본인에게 첫날 입실때 확인했다라고 하니그러니까 왜 아침에 나갈때 말을 했어야지 안했냐 합니다확인도 체크도 대처도 기분 나쁘게 하니 화가 나겠죠,4,3년 전
yeogi_accom_008_7762,전주 브라운도트 - 덕진점,항상 편하게 푹쉬고옵니딘,5,1년 전
yeogi_accom_008_7763,전주 브라운도트 - 덕진점,숙박은 처음해보았는데 너무 만족해요체크아웃 시간도 1시라 넉넉하고 무엇보다 깔끔해요특히 화장실 엄청 깔끔해요다음에도 전주에서 숙박하면 이 호텔로 오고싶네요아쉬운점은 쇼파에 얼룩 그점만 아쉬워요난방도 잘되고 넷플웨이브 티빙 다되서 너무 좋구요,5,2년 전
yeogi_accom_008_7764,전주 브라운도트 - 덕진점,깨끗하고 시설 좋아요굿굿,4,1년 전
yeogi_accom_008_7765,전주 브라운도트 - 덕진점,깨끗하고 시설 좋아요굿굿,4,1년 전
yeogi_accom_008_7766,전주 브라운도트 - 덕진점,깨끗하고 아주 좋습니다,5,1년 전
yeogi_accom_008_7767,전주 브라운도트 - 덕진점,전주 여행온 친구 보내고 또 다시 대실해서 들어갔습니다  ㅎㅎ 무엇보다 주변 숙소에 비해 깔끔하구 서비스도 좋았습니다 도 잘 되어있어 무더운날 나는 솔로 정주행하다 왔네요,5,1년 전
yeogi_accom_008_7768,전주 브라운도트 - 덕진점,대실이나 숙박으로 무난하게 이용하시 좋아서 자주 애용하는 숙박시설 입니다 근데 오늘은 청결상태가 영  좋지 않았어요 바닥에 머리카락과 발톱  같은게 돌아다니고 이불은 누가 밟고 올라간 것 처럼 검은 발바닥 자국이 있었고  여러모로 아쉬웠어요 그래도 매번 그런건 아니였어서 나중에도 이용할꺼 같긴 해요 청결상태만 신경써주신다면 더 좋을꺼 같아요,3,2년 전
yeogi_accom_008_7769,전주 브라운도트 - 덕진점,깨끗하고 너무 좋아요,5,2년 전
yeogi_accom_008_7770,전주 브라운도트 - 덕진점,숙소 컨디션이 좋습니다,5,1년 전
yeogi_accom_008_7771,전주 브라운도트 - 덕진점,시설 및 청결 상태 다 만족했습니다다만서비스가 정말 별로네요객실 이용중 카운터에서 전화오더니 저희 이용전 전 사람이 물건을 두고 가셨던거 같은데 확인 부탁드린다고여기 까지는 문제가 없었습니다찾아보니 없어서 없다고 했는데 전 손님이 직접 확인하로 들어오셔도 되냐고 물어보시더라고아니 이건 아니지 않나요그래도 중요한 물건이신거 같아서 알겠다고 했습니다근대 손님이 올라오실때 숙소 관리자도 같이 올라오셔야 되는거 아닌가요기분이 나빠서 환불 요청하려다가 서로 얼굴 불키기 싫어서 이용 안하고 그냥 나왔네요입장 바꿔서 꼭 생각 해보시길 바랍니다,2,1년 전
yeogi_accom_008_7772,전주 브라운도트 - 덕진점,청소컨디션 친절함 시설 다 좋습니다 ㅎㅎ,5,3년 전
yeogi_accom_008_7773,전주 브라운도트 - 덕진점,화장실이 너무 마음에 들었습니다,5,1년 전
yeogi_accom_008_7774,전주 브라운도트 - 덕진점,깨끗하고 좋아요깨끗하고 좋아요,5,1년 전
yeogi_accom_008_7775,전주 브라운도트 - 덕진점,깨끗하고 좋아요깨끗하고 좋아요,5,1년 전
yeogi_accom_008_7776,전주 브라운도트 - 덕진점,깨끗하고 좋아요깨끗하고 좋아요,5,1년 전
yeogi_accom_008_7777,전주 브라운도트 - 덕진점,깨끗하고 좋아요깨끗하고 좋아요,5,1년 전
yeogi_accom_008_7778,전주 브라운도트 - 덕진점,화장실도 깔끔하고 방내부도 넓고 쾌적해서 좋야요,3,1년 전
yeogi_accom_008_7779,전주 브라운도트 - 덕진점,진짜 깔끔하고 좋은 것 같아요쾌적하고 관리가 잘 되어 있는 것 가타용,5,3년 전
yeogi_accom_008_7780,전주 브라운도트 - 덕진점,전북대 근처에 있는 곳 중에 제일 괜찮은것 같아요 방도 넓고 침대도 커서 편하게 쉬다가 갑니당  직원분들도 정말 친절하셨는데 감사하게도 젓가락을 빌려주셨어요 덕분에 밥을 손으로 먹지 않아도 되었던   감사합니다 ㅎㅎ,5,2년 전
yeogi_accom_008_7781,전주 브라운도트 - 덕진점,넓직하고 군더더기없는 객실이 너무 마음에 들었어요 화장실도 넓고 전반적으로 청결도 꽤나 우수한 편이었어요 바닥이나 욕실바닥에 머리카락이 좀 있긴했는데 이정도는 괜찮았어요 앞으로도 종종 가게될것같아요 ㅎㅎ 너무 좋았어용,5,2년 전
yeogi_accom_008_7782,전주 브라운도트 - 덕진점,두번째 이용인데 여기 너무좋습니다 위치며 시설이며 호텔같은 분위기 저렴하게 이용할수있어서 좋았고 이번에 쿠폰발행 하셔서 여기만 계속 이용할 예정입니다 직원분들도 친절하셔서 잘쉬다왔네요,5,3년 전
yeogi_accom_008_7783,전주 브라운도트 - 덕진점,너무 좋아서 자주 이용하는 곳입니다,5,3년 전
yeogi_accom_008_7784,전주 브라운도트 - 덕진점,여기 근처에서 브라운도트가 가장 깔끔하고 좋은 것 같아요 나름 신축이라 그런지 낡은 곳 하나 없어요 바로 앞에 버스 정류장도 있고 마트나 편의점도 있어서 너무 편리해요 진짜 위치는 너무 좋아요 이 숙소 추천드립니다,5,2년 전
yeogi_accom_008_7785,전주 브라운도트 - 덕진점,출장으로 찾게된 브라운도트 덕진점입니다업무차 전국으로 다니다 보면 브라운도트는 보증된 숙박업소라서덕진점도 예약후 방문하였습니다방사이즈는 적당하고 욕조도 있더라고요충분히 좋았지만 제가 방문한 브라운도트 업소중에관리가 좀 미흡한편에 속하는거 같습니다조금 아쉬웠구요그래도 주차장도 넓고 잘 쉬었습니다,3,2년 전
yeogi_accom_008_7786,전주 브라운도트 - 덕진점,전주는 처음 출장인데 깔끔하고 실내도 넓고 좋습니다 침대도 편하고 잘 자고 갑니다,5,3년 전
yeogi_accom_008_7787,전주 브라운도트 - 덕진점,너무 깔끔하고 사진보다 넓어서 너무 만족했습니다,5,1년 전
yeogi_accom_008_7788,전주 브라운도트 - 덕진점,주차장도넓고 깔끔하고 시설도좋습니다 방은 생각한거보다 넓고 화장실도 샤워하는곳도 별도로있어서좋았어요 놀러와서 하루밤 지내는곳으로 여기보다 더 할곳이 없다생각합니다 잘 보내고 갑니다,4,2년 전
yeogi_accom_008_7789,전주 브라운도트 - 덕진점,1 출장으로 하루 묵었는데 방이 진짜 따뜻했습니다 땀이 날 정도였고 아늑했습니다2 침대가 매우 편해서 잠도 잘 잤고 온수도 잘 나오고 욕조도 넓은것이 편헸습니다3 근처에 먹을 곳이 많음,5,3년 전
yeogi_accom_008_7790,전주 브라운도트 - 덕진점,시설 좋고 인테리어 좋고 사장님 친절하고 잘 묵고갑니다시설 좋고 인테리어 좋고 사장님 친절하고 잘 묵고갑니다시설 좋고 인테리어 좋고 사장님 친절하고 잘 묵고갑니다시설 좋고 인테리어 좋고 사장님 친절하고 잘 묵고갑니다,5,2년 전
yeogi_accom_008_7791,전주 브라운도트 - 덕진점,처음 전주 놀러가서 숙박했던 곳입니다다른 지역 브라운도트점도 많이 이용했지만 똑같이 너무 좋았어요 방도 넓었고 4명이서 이용하기 딱 좋았네요주변에 호수도 있고 음식점도 많아서 좋아요,5,1년 전
yeogi_accom_008_7792,전주 브라운도트 - 덕진점,재방문의사 있습니다,4,1년 전
yeogi_accom_008_7793,전주 브라운도트 - 덕진점,평소에 샴푸 바디워시같은 물건들에 예민해서 숙소측에서 제공하는 제품들은 평소에 잘사용하지 않는데 이곳 브라운도트에서 제공하는 제품들은 관리가 잘되있어서 그런지 저한테 잘맞아서 편안하게 잘이용하고 가는거 같아요 ,5,2년 전
yeogi_accom_008_7794,전주 브라운도트 - 덕진점,수압도 좋고 방도 되게 깨끗하고 무엇보다 친절하게 안내해주셔서 좋았어요 전주 놀러와서 편하게 묵을 곳 필요했는데 브라운도트를 발견해서 여자친구랑 편하게 묵고 왔네요 다음에 전주 놀러가게 되면 또 이용할게요,5,2년 전
yeogi_accom_008_7795,전주 브라운도트 - 덕진점,넘 깨끗해서 좋아요 근데 티비가 침대 쪽이 아니라 볼 때 조금 불편하더라구용 ㅠㅠ 그리고 방음도 좀 아쉬워요 ㅠ그거 말고는 시설도 좋고 깨끗해서 만족합니다앞으로도 자주 이용할 생각이에요 ,5,2년 전
yeogi_accom_008_7796,전주 브라운도트 - 덕진점,방 깔끔하니 좋아요 냄새도 향기롭고요,5,3년 전
yeogi_accom_008_7797,전주 브라운도트 - 덕진점,괜찮았어요 새로생긴 곳이라그런지깔끔하고 이만한곳 있을까 싶었고 욕조도 있어서 깔끔하게 몸담그고 피로풀기 딱이었습니다 여기 추천드리고 출장오면 자주올거같아요 적극 추천드리고 주변 시설도 좋아요,5,3년 전
yeogi_accom_008_7798,전주 브라운도트 - 덕진점,덕진공원 바로 근처에요 근처에 7일레븐 지에스 편의점 있어요 근처 전북대학교 술집 있어요 주차 입구가 들어가기 항상 힘들지만 들어가면 넓어요 객실 깔끔하고 컴퓨터 게임 설치가 안되어있는데 오버워치 돌아가요 컴퓨터랑 침대가 분리되어있고 방이 깔끔햐서 좋았습니다,3,2년 전
yeogi_accom_008_7799,전주 브라운도트 - 덕진점,늘 브라운도트는 기본이상은 하는듯 합니다 스타일러도 있고 넷플도 유용하게 이용 근데 찍힌곳들이 몇군데 있고 창문에 찬바람이 살짝 돌아 들어오는게 약간의 단점침대매트리스는 살짝 하드하네요 방음은 좋아요,5,2년 전
yeogi_accom_008_7800,전주 브라운도트 - 덕진점,너무너무 좋아요 ㅎ  시설도 좋곻 너무좋아요 좋아욯 ㅎ,5,3년 전
yeogi_accom_008_7801,전주 브라운도트 - 덕진점,방음이 다소 아쉬웠어요ㅠㅠ,5,2년 전
yeogi_accom_008_7802,전주 브라운도트 - 덕진점,일단 브라운도트 호텔 객실 자체가 조용한 곳에 있어서 좋았구요 사장님께서 친절하시고 객실 컨디션이 좋았어요 따뜻한 느낌의 조명도 자는데 더 포근하게 잘 수 있었던것 같아요 난방 에어컨도 잘되고 추천합니당,5,2년 전
yeogi_accom_008_7803,전주 브라운도트 - 덕진점,북대 근처 깨끗한곳 찾아보다가 예약했습니다 방도 되게 좋았고 나중에 전주에서 숙박할일 있으면 예약해도 괜찮을것같다고 생각했어요 가격도 착하고 좋았습니다 아 참 덕진광장 근처라 위치도 괜찮은것같아여,5,2년 전
yeogi_accom_008_7804,전주 브라운도트 - 덕진점,너무 좋아요 잘 이용하다가요,5,3년 전
yeogi_accom_008_7805,전주 브라운도트 - 덕진점,처음 이용해봤는데 너무 쾌적하고 깨끗했어요 스타일러 있는것도 너무 편리하고 드라이기 이런것도 문제 없이 작동해요 무료 업그레이드도 감사합니다 물 잘나오고 따뜻하고 편히 쉬다가요ㅎㅎㅎㅎ,5,2년 전
yeogi_accom_008_7806,전주 브라운도트 - 덕진점,잘 쉬었다 갑니다 주차공간은 넓은 편입니다 공간 넓직하고 10대 정도의 공간이 있어요 이중주차 걱정은 없어서 편했습니다 내부 룸 컨디션도 좋은 편입니다 화장실도 넓직해서 씻기 좋습니다,5,2년 전
yeogi_accom_008_7807,전주 브라운도트 - 덕진점,다른곳보다 저렴하고일단 넓어요,3,1년 전
yeogi_accom_008_7808,전주 브라운도트 - 덕진점,깔끔하고 괜찮았습니다 간단하게 묵기도 좋았고 직원분들도 친절해서 기분 좋게 있다가 갈 수 있었네요 인테리어도 좋고 침구류도 푹신해서 피곤할 때 잘 쉬다가 나왔습니다 이상한 냄새도 안 나고 좋아요,5,3년 전
yeogi_accom_008_7809,전주 브라운도트 - 덕진점,사장님이 너무 친절하셔서 갈때마다 기분좋게ㅠ이용합니다 시간보다 조금 일찍갔지만 다른방 내어주시고 기다리는동안 커피랑 음료도 이용할수있어서 편했어요 숙소도 쾌적하니 좋앗고 방음도 잘되눈거같어요,5,2년 전
yeogi_accom_008_7810,전주 브라운도트 - 덕진점,빠르게 이용할수있어좋았음,3,1년 전
yeogi_accom_008_7811,전주 브라운도트 - 덕진점,깨끗하고 편의품도 잘 구비되있고 도보 이용시 버스정류장도 가깝습니다주변에 편의시설이 가깝게 있어 여행할때도 불편함없이 잘 이용할수있을것같아요  무엇보다 매우 친절하셔서 또 이용할것같아요,5,2년 전
yeogi_accom_008_7812,전주 브라운도트 - 덕진점,깔끔하고 좋아요 근데 세면대물이 잘 안내려가요 ㅠㅠ,5,1년 전
yeogi_accom_008_7813,전주 브라운도트 - 덕진점,지난 이용때 너무 좋은 기억이 있어서 또 이용하게 되었어요여기 추천드려요 저는 이 곳만 계속 이용할 거 같습니다사장님도 매우 친절하시고 방도 깨끗합니다 스타일러가 맘에들어요ㅎㅎ,5,2년 전
yeogi_accom_008_7814,전주 브라운도트 - 덕진점,출장 올때마다 쉬고가는 호텔입니다 방이 비교적 넓어서 좋고 다만 침대가 쫌 딱딱한 편입니다 침구류는 괜찮아요 주차공간 또한 넓은편이라 가끔 늦게 도착하더라도 편안하게 주차할수 있어요,4,3년 전
yeogi_accom_008_7815,전주 브라운도트 - 덕진점,깔끔하고 좋았습니다,5,3년 전
yeogi_accom_008_7816,전주 브라운도트 - 덕진점,깨끗하고 깔끔하니 좋습니다,5,1년 전
yeogi_accom_008_7817,전주 브라운도트 - 덕진점,처음 브라운도트 와봤는데 인테리어 너무 예쁘고 가격도 착하네요주변 먹거리도 많아서 즐기다 숙소 오면 너무너무 좋네요하지만 커튼이 암막이였다면 더더 좋았을텐데요 ㅜㅜㅜ잘자고 왔습니다 ㅎㅎ다음에 또 예약할게요,5,1년 전
yeogi_accom_008_7818,전주 브라운도트 - 덕진점,자주 가는 곳입니다청결하고 친절하고 좋아요앞으로도 항상 가고 싶은 곳이고음료도 자유롭게 가져갈 수 있도록 배치되어있고방도 깨끗하고 좋아요항상 청결도 만족도 높은 곳 추천합니다,5,2년 전
yeogi_accom_008_7819,전주 브라운도트 - 덕진점,추석연휴기간 연휴가 길어 전주에 왔다가 호텔에서 잘 쉬다가 갑니다에어드레스 잇어 편햇구요무엇보다 욕조가 커서 여행후 피로풀수 잇는 힐링됫어요룸 컨디션  전체적으로 좋앗구요다음에 전주오면 다시  잦을거 같아요다만 직원이 조금더 친절하면 금상첨화일듯요,3,1년 전
yeogi_accom_008_7820,전주 브라운도트 - 덕진점,이번에도 룸 업그레이드 해주셨어요 ㅎㅎ 덕분에 더 넓은 객실에서 쉴 수 있었어요  여긴 화장실도 참 넓고 친절해요 스탬프이벤트도 너무 파격적인 이벤트인듯요 ㅎㅎ 자주 올게요,5,2년 전
yeogi_accom_008_7821,전주 브라운도트 - 덕진점,브라운도트는 갈 때마다 깔끔하고 넓고 조용한 게 정말 최대 장점인 것 같아요 어 뭐지 불편하다 더럽다 이런 생각 든 적은 한번도 없었어도 대실도 마찬가지구요  잘 이용했습니다 ㅎㅎ,5,2년 전
yeogi_accom_008_7822,전주 브라운도트 - 덕진점,크리스마스인데도 대실 예약해서 잘 쉬다갑니다방 컨디션 항상 깔끔하고 보일러도 따뜻해서 좋아요항상 브라운도트 먼저 검색하고 방 알아봅니다 편의저도 걸어서 갈 거리라 가깝고 돟아요,5,3년 전
yeogi_accom_008_7823,전주 브라운도트 - 덕진점,전주 여행가서 하루 숙박했습니다 일단 카운터 직원분이 너무 친절하셨고 너무 만족했습니다 객실 내부도 너무 청결했고 스타일러가 있어서 사용해보니 너무 좋았습니다 화장실도 너무 깨끗해서 만족했습니다,5,4년 전
yeogi_accom_008_7824,전주 브라운도트 - 덕진점,시설도 쾌적하고 깔끔합니다화장실도 깔끔하고 침대도 푹신푹신해서 정말 마음에 듭니다 방도 넓은 편이고 화장실도 넓어서 정말 마음에 들었어요 다음에 또 방문하고 싶은 곳입니다,5,2년 전
yeogi_accom_008_7825,전주 브라운도트 - 덕진점,브라운도트는 방문할때마다 항상 깨끗한 느낌이라서 기분 좋게 방문합니다 청소상태가 좋은것 같아요이번 방문에도 편안하게 푹 잘 쉬다가 갑니다  다음에 또 방문 하겠습니다 ㅎㅎㅎ,5,3년 전
yeogi_accom_008_7826,전주 브라운도트 - 덕진점,깔끔하고 좋아요깔끔하고 좋아요,5,1년 전
yeogi_accom_008_7827,전주 브라운도트 - 덕진점,괜춘 근데 수건이 좀 적음,5,1년 전
yeogi_accom_008_7828,전주 브라운도트 - 덕진점,청소가 안되어있는 부분이 조금 있습니다 대실이랑 숙박을 같이 하다보니 빨리 청소해야해서 어쩔 수 없을 것도 같은데 신경쓰이시면 가지마십쇼 로비에 있는 직원인지 주인인지 젊은 남성분 있는데 근무태도가 썩 좋진 않네요 전화응대도 별로고 별 생각없이 일 하는 느낌입니다 매우 수동적입니다 리뷰 응답도 다 복붙하는거같은데 말한 부분들이 고쳐지진 않겠죠 수고하세요,3,1년 전
yeogi_accom_008_7829,전주 브라운도트 - 덕진점,생각날때마다 가서 쉬는 곳으로 깔끔하고 좋아요,5,2년 전
yeogi_accom_008_7830,전주 브라운도트 - 덕진점,덕진버스정류장 덕진공원에서 가까워서 접근성이 좋습니다건물도 좋아보이고 방도 큽니다 특히 화장실이 어마어마합니다 ㅎㅎ 화장실이 제일 맘에 들었어요편히 쉬다갑니다 감사합니다,5,2년 전
yeogi_accom_008_7831,전주 브라운도트 - 덕진점,넘 깨끗해서 좋아요 근데 티비가 침대 쪽이 아니라 볼 때 조금 불편하더라구용 ㅠㅠ 그거 말고는 시설도 좋고 깨끗해서 만족합니다앞으로도 자주 이용할 생각이에요 ,5,2년 전
yeogi_accom_008_7832,전주 브라운도트 - 덕진점,룸 컨디션도 너무 좋았구 직원분들도 너무 착하셨어요화장실이 투명한 건 조금 아쉬웠지만 다른 것들이 너무 좋아서 작은 단점은 잊어버렸습니다다음에 이용할 일 있으면 이용할게요,5,3년 전
yeogi_accom_008_7833,전주 브라운도트 - 덕진점,청결함 깔끔함 친절함 주차 뭐 하나 빠지는 것 없이 완벽합니다전주 여행에서 숙소가 가장 고민이었는데 다음 여행부턴 고민할 필요없겠어요전주 가면 무조건 브라운도트만 갈 거예요,5,2년 전
yeogi_accom_008_7834,전주 브라운도트 - 덕진점,깔끔하고 넓어서 잘 쉬었어요,5,1년 전
yeogi_accom_008_7835,전주 브라운도트 - 덕진점,깔끔하고 넓고 좋아요,4,1년 전
yeogi_accom_008_7836,전주 브라운도트 - 덕진점,항상 이용하는 곳 이에요깔끔하고 먼지 알러지 있는데 여기는 알러지 반응도 앖어요 주말에도 이용하기 편하고 주변에 먹을게 많아서 자주 이용해요,5,2년 전
yeogi_accom_008_7837,전주 브라운도트 - 덕진점,프론트 분도 친절하시고 음료수 종류가 많아서 좋았어요 객실도 넓고 씻을 때 수압이 너무 세지도 약하지도 않고 적당해서 씻기 편했어요 위치도 괜찮아서 자주 가게 되네요 브라운도트 호텔 짱,5,2년 전
yeogi_accom_008_7838,전주 브라운도트 - 덕진점,시설 너무 깔끔하고 다음에 기회 있으면 또 이용할 것 같아요 친절하시고 좋습니다 다만 겨울인데 방이 그렇게 따뜻하진 않았던 것 같아요 의자가 달라서 애매했지만 불편하진 않았습니다 ㅎ,5,2년 전
yeogi_accom_008_7839,전주 브라운도트 - 덕진점,늦은 시간에 방문했음에도 친절히 응해주시고 맞아주셔서감사했습니다 늘 느끼지만 참 시설 깔끔하고 좋습니다덕진공원쪽에서 가장 좋은 숙소같아요늘 잘 이용합니다 감사합니다,5,2년 전
yeogi_accom_008_7840,전주 브라운도트 - 덕진점,너무좋아요 ㅎㅎ 시설도 청결 깨끗하고 대체적으로 모든부분이 좋아요 전주에 출장으로 오게되었는데 다음에도 온다면 또 올거같네요 만족 또 만족합니다 항상 변함없이 지금 처럼 유지 해주세요 강추,5,3년 전
yeogi_accom_008_7841,전주 브라운도트 - 덕진점,깔끔하고 좋아요화장실침구류 맘에 들고 뷰도 좋습니다출장가면 꼭 여기 이용하는데 늦게가면 자리없으니 예약하고 가세요                          도 좋습니다,5,1년 전
yeogi_accom_008_7842,전주 브라운도트 - 덕진점,전주 최고의 숙소입니다 너무 깔끔하고 고급지네요 깐깐한 여자친구도 인정한 최고의 숙소입니다 다시 이용하고싶지만 당일 예약은 너무 힘드네요 그만큼 사람들이 인정하고 많이 찾는 숙소인거같아요,5,2년 전
yeogi_accom_008_7843,전주 브라운도트 - 덕진점,첫인상부터 친절하세요서비스바에는 네스프레소 캡슐커피가 있어요디카페인으로 한 잔 뽑아 가져왔어요객실 깔끔하고 도 크고 밝고 냄새도 안나구요다만 청정기가 있었으면 하는 바램입니다,5,2년 전
yeogi_accom_008_7844,전주 브라운도트 - 덕진점,아주만족스럽네요 재방문의사있음요,5,1년 전
yeogi_accom_008_7845,전주 브라운도트 - 덕진점,들어오자마자 너무 좋았어요냄새도 안나고 깔끔 그 자체그리고 로비에 커피가 좋았어요 네스프레소타서 먹었는데 깔끔 ㅎㅎ침대도 너무좋습니다다음에도 꼭 이용하겠습니다,5,4년 전
yeogi_accom_008_7846,전주 브라운도트 - 덕진점,브라운도트는 어느 지역에 가든지 만족스럽습니다 이번 출장 일정도 괜찮은 곳에서 잘 있다가 왔네요깨끗한 숙소 시설도 좋았습니다 침대도 편했고 욕실 수압도 굿이었고 쾌적한 곳이었어요,5,1년 전
yeogi_accom_008_7847,전주 브라운도트 - 덕진점,여윽시 브라운도트좋았어요네비가 가르킨 입구가 골목길이라 당황했지만전빈적으로 좋았어요,5,2년 전
yeogi_accom_008_7848,전주 브라운도트 - 덕진점,급한 볼일이 생겨 늦은 시간에 전주에 들러야해 잠만 자려 저렴하게 숙박 예약했습니다후기 남기려고보니 업그레이드 해주신거였네요 운 좋게 주차자리는 하나 있었으나 거의 만차였습니다스타일러 있어서 유용했고 룸 구조가 야식먹기에 참 좋았습니다 소파는 좀 지저분했지만그러나 누구 털인지 모를 각종 털들이 방부터 욕실까지 청소상태 너무 불량했고 욕실 문이 안닫히고 욕실 내부 변기있는 칸 열림 닫힘 모두 불가능해서 곤란했습니다 손님에게 줘도 되는 방인가 싶을 정도로7층에 묵었는데 새벽 12시쯤 윗층 가구 이동소리와 발소리 등 층간소음이 태어나서 처음 겪을 정도 상상초월할만큼 너무 심각해서 안자니 못할 만큼 피로가 더 쌓였네요양 옆 소음은 크지 않아 다행이긴했는데 결과적으로는 다시는 이용하지 않을 것 같습니다 샤워기 수압는 좋았어요숙소 예약할 때 안좋은 후기도 꼭 검색하세요 좋은 후기만 보고 갔는데 제 실수였습니다,1,1년 전
yeogi_accom_008_7849,전주 브라운도트 - 덕진점,출장으로 들렸습니다,5,1년 전
yeogi_accom_008_7850,전주 브라운도트 - 덕진점,너무 친절하시고 서비스 좋았어요 다시 방문한다면 꼭 다시 찾고 싶은 곳이에요 침대 푹신하던데 좋은 매트리스를 쓰는 것 같더라고요 ㅎㅎ 그리고 청소도 잘 되어있는게 마음에 들었어요,5,4년 전
