id,name,review_content,rating,write_date
yeogi_accom_008_7417,전주 브라운도트 - 덕진점,전주  여행와서 2박 있었는데 프론트 사장님께서 주위 맛집 포차도  알려주시고  친절하시고 착하셨습니다 생각했던거보다  방이 훨씬  깨끗해서  편하게 쉬었다 갑니다 넷플도  웨이브도  스타일러도  잘 사용했고 웨이브랑 넷플 같이있으니  좋았어요 청결  중요시하는데 호텔치고도  깨끗했구요  다음에 오게되면 또   이용할께요       ,5,3년 전
yeogi_accom_008_7418,전주 브라운도트 - 덕진점,브라운 도트 전북대 부근에서 맨날 가는 곳이지만 너무 깔끔하고 좋아요 근데 오늘 숙소는 이상하게도 욕조 물이 자꾸 빠져요 너무 아쉬웠어요 ㅠ 따뜻한 물에 몸을 담구려했는데 밑빠진 독이더라구요 502호 욕조 수리 부탁드려요 근처 조용해서 좋고 음식점도 맛있어요 위치 최공,5,2년 전
yeogi_accom_008_7419,전주 브라운도트 - 덕진점,주차하려고 들어가는 길목이 좀 좁았어요그리고 고데기랑 충전기는 따로 달라고 하셔야되구요방은 지인짜 따뜻했어요 사실 좀 더웠습니다방안에서는 방온도 조절은 따로 안 되는 것 같았구요더워서 창문을 열면 바로 도로라 시끄러워서 창문을 열 수가 없었어요 그래서 그냥 에어컨 키고 잤습니다화장실이 지인짜 넓었어요 좋았습니당,4,3년 전
yeogi_accom_008_7420,전주 브라운도트 - 덕진점,공원 앞에 자리 잡고 있고 근처에 편의점이 있어 이용하는데 편했습니다 룸 상태도 깨끗해서 좋았습니다 1층 로비에 얼음도 있어서 좋았습니다 근데 아직 에어컨 청소는 못한건지 냄새가 너무 나서 문열려고했는데 방충망이 없어 불편했습니다,5,2년 전
yeogi_accom_008_7421,전주 브라운도트 - 덕진점,시설 좋고 고급지고 깔끔하고 시설면에서는 나무랄데가 없어요 네스프레소 머신도 완죤 굿굿 딱 하나 옥의 티라면 방음이 안되도 넘 안된다는거 ㅠㅠ 복도의 비닐봉지 펄럭이는 소리까지 다 들리네요 ㅠ,5,4년 전
yeogi_accom_008_7422,전주 브라운도트 - 덕진점,여기는 처음이용해봤는데요 모텔인줄알았는데 호텔식으로 엄청 내외관 모두 깔끔하고 청결도도 좋더라고요 스타일러도있어서 고기먹고 쉬다온건데 뽀송하게 나올수있어서 기분좋게 이용했습니다 또이용할게요,5,3년 전
yeogi_accom_008_7423,전주 브라운도트 - 덕진점,직원들 너무 친절합니다 ㅜㅜㅜ인테리어도 너무 이쁘고 체곱니다 최고 전주에선 최고인거같아용 다 좋은데 에어컨 상태는 조금 아쉽네용필터부분인가 먼지가 너무 많아요이부분만 개선되면 완벽할거 같습니다,4,3년 전
yeogi_accom_008_7424,전주 브라운도트 - 덕진점,객실컨디션도 너무 좋았고 위치도 좋았습니다 덕진공원 바로 옆이라 산책하기도 좋았어요 시설 진짜 깔끔하고 화장실도 넓어요 방이 따뜻해서 좋았지만 많이 건조했어요 그건 날씨 때문인 것 같아요 전주에서 이용해본 숙소중에 제일 좋았습니다,5,3년 전
yeogi_accom_008_7425,전주 브라운도트 - 덕진점,요즘 여기만 이용합니다 사장님이 정말 친절하셔서 들어갈때부터 기분좋고 손님이 원하는 타입 객실있으면 가능한 선에서 변경도 해주시고요 방 청결도는 말할것도없이 좋아서 매번 기분좋게 이용하네요ㅎㅎ,5,3년 전
yeogi_accom_008_7426,전주 브라운도트 - 덕진점,전북대는항상여기서만자요 제일깨끗하고 사장님너무친절하시고음료수랑 마음대로가져가실수있어요 그리고비품잘되어있고화장실도깨끗하고 수압도넘좋아요 덕진동가면 여기가제일좋고제일깨끗합니다 이용해보세요,5,1년 전
yeogi_accom_008_7427,전주 브라운도트 - 덕진점,주차하러 가기 힘든 점은 있지만 호텔 내부가 정말 깔끔하며 호텔 만석이었음에도 옆방 소리는 전혀 들리지 않았습니다 욕조가 아주 커서 피로 회복하는데 좋은 숙소이며 넷플릭스 접속이 바로되어 원하는 프로 시청하기에 제격임,5,3년 전
yeogi_accom_008_7428,전주 브라운도트 - 덕진점,숙소 개조음ㅇㅇㅇㄷ웡랴도 자주 감 대실하랴다가 걍 숙박함 ㅇㅇ북대랑 거꺼워서 좋고 술 먹고 들어오시기 딱임앞으로도 종종 애용 애용 하겜슴ㅕ숙소 개조음ㅇㅇㅇㄷ웡랴도 자주 감 대실하랴다가 걍 숙박함 ㅇㅇ북대랑 거꺼워서 좋고 술 먹고 들어오시기 딱임앞으로도 종종 애용 애용 하겜슴 전주 던북댜 놀러오면 무조건 여기 추천위치 갑터미널도 가까움개 굿입니다 구웃아 근데생긴지 좀 되서ㅜ낤은  낡은 느낌은확실히 있긴 함 참고 바람 근데 대충자긴 굿 굿 ,4,1년 전
yeogi_accom_008_7429,전주 브라운도트 - 덕진점,전북대랑 가까워서 저녁에 근처 밥 먹으러 가기가 좋고인근 숙소들과 비교했을 때 확실히 깔끔하고 좋습니다인테리어도 예쁘고 시설도 새것처럼 좋았어요다만 가장 아쉬웠던 건일부 리뷰에서 얘기가 있던 것처럼알 수 없는 냄새가 납니다플라타너스 나무 냄새 아시나요 약간 지린 그 냄새가 나요누우면 침대 머리맡에서 계속 나서 신경쓰이긴 했어요그것 제외하면 만족합니다,5,4년 전
yeogi_accom_008_7430,전주 브라운도트 - 덕진점,다른곳 숙소는 몇번이요해본결과 브라운도트는 실망한적이 없어서  여기로 가봤는데 역쉬 객실상태는 깔끔하니 좋았어요  하지마 입구들어가는곳골못이 좁아서  불편은하더라구요 공사도하고그날따라 아그리고 하나단점이있다면 다른곳은 전부비데인데 여기는 일반객실은 비데가아니더라구,5,1년 전
yeogi_accom_008_7431,전주 브라운도트 - 덕진점,북대에서잘때는여기서자고있습니다 깔끔하고 덕진동에서는 제가봤을때 제일깔끔한거같아요 비품도잘뎌있고 화장실도 넓고 편의점도가까이있어서 너무편하고좋습니다 그래서매번여기서편하게쉬다갑니다 ㅈ뇌고,5,1년 전
yeogi_accom_008_7432,전주 브라운도트 - 덕진점,출장 올때마다 방문해요객실컨디션 좋아서 먼저 픽하는데요구비시설도 좋아요넷플릭스랑 웨이브도 시청되구요주차도 편리했고 안내도 친절하구요프론트앞에는 캡슐커피도 마실수 있어요출장객을 위한 양말 서비스도 있다네요,5,2년 전
yeogi_accom_008_7433,전주 브라운도트 - 덕진점,바로 옆에 전북대 있어서 맛있는 거 먹르면서 맥주 한잔하고 딱 걸어서 돌아오기 좋은 위치에 있고 방도 깔끔합니다 아쉬운건 일층 직원분이 조금만 웃으며 서비스해줫으면 좋겠습니다,5,2년 전
yeogi_accom_008_7434,전주 브라운도트 - 덕진점,주차장도 확보가 잘 돼 있어서 사실 주차할 때부터편리함을 느끼고 프론트에 계신분은 너무 친절하셔서입장부터 기분이 좋아집니다방 내부 분위기도 일반 집같은 안락함을 주기에너무 좋은 숙소입니다,5,3년 전
yeogi_accom_008_7435,전주 브라운도트 - 덕진점,체인답게 깔끔하고 청결하게 관리되네요전주로 출장 올때마다 이용해야겠어요늦으면 만실이라 미리예약해야 이용가능한거같네요방도 넓고 에어컨도 깨끗해서 편하게 쉬고 나왔네요출장올때 미리 예약하고 와야겠어요,5,1년 전
yeogi_accom_008_7436,전주 브라운도트 - 덕진점,시설도 깔끔하고 청소도 잘 되어있어서 좋았습니다 화장실도 청결하고 침대에 머리카락도 못봤습니다 주변 근처에서는 가장 깨끗한 숙소 인것 같아요 기회가 되면 다음에 또 방문하고 싶어요,5,2년 전
yeogi_accom_008_7437,전주 브라운도트 - 덕진점,주차장이 넓어서 늦은 입실에도 주차 걱정 없어서 좋아요 방도 갈 때마다 항상 깔끔하고 분위기 좋습니다그리고 방 온도가 높아서 들어가자마자 기분이 좋네요 수압쎄고 깔끔하고 좋습니다,5,1년 전
yeogi_accom_008_7438,전주 브라운도트 - 덕진점,건물 전체 객실 내부가 깨끗해서 좋습니다넷플릭스 웨이브 유튜브도 돼서 심심하지 않게 보낼 수 있었습니다덕분에 편안하게 쉴 수 있었습니다 감사합니다 다음에 또 방문하겠습니다,5,3년 전
yeogi_accom_008_7439,전주 브라운도트 - 덕진점,프랜차이즈라 그런지 역시 깔끔하게 잘 관리되어있어요 ㅎㅎ 직원분도 친절하시고 시설도 정말 깔끔하게 잘정리되어있어요 근데 여기가 차로 들어오실때는 공간이 협소하다보니 큰 차 운전하시는 분들은 참고하시는게 좋으실거같에요,5,3년 전
yeogi_accom_008_7440,전주 브라운도트 - 덕진점,근방에서 여기저기 많이 고민하다가 선택한 숙소인데 다행히 후회없습니다시설은 말할것도 없이 좋구요침대도 푹신하니 푹쉬고 자다왔습니다또한 주차공간도 넓고직원분들도 굉장히 친절해서 좋았습니다추천,5,3년 전
yeogi_accom_008_7441,전주 브라운도트 - 덕진점,덕진공원 근처라서 위치가 좋은것 같아요 시설도 노후화되지 않고 객실 상태도 비교적 청결하니 좋았네요 남아있는 방이 제한적이라 옵션이 없는 방을 선택했더니 피씨나 스타일러 등이 없던게 좀 아쉬웠어요,5,2년 전
yeogi_accom_008_7442,전주 브라운도트 - 덕진점,1 객실컨디션깔끔한 분위기에 리모델링해서 좋았지만 비염이 심한 편인데 침구류에 먼지가 조금 있는지 코를 계속 훌쩍거렸어요2 공원 식당 편의점 등 주변 부대시설이 잘 되어있어여,5,4년 전
yeogi_accom_008_7443,전주 브라운도트 - 덕진점,원래 예약된 체크인시간보다 일찍 도착할것 같아 연락드렸는데 와도 된다고 하셔서 감사했습니다입실하자마자 완전 인테리어 취향저격이었어요엄청 추운날이 아니었는데 난방 겁내 빵빵 ㅎㅎ 사실 잘때는 너무 더웠어요ㅠㅠ소품 하나하나가 되게 센스 있고 특히 화장실이너무 예뻐서 나중에 인테리어 할 일 있으면 참고하고싶어요  볼일보는데랑 씻는곳 완전 분리되어있는 것도 좋았고 요즘 숙소들이 화장실이 침대에서 훤히 보여서 불편한 곳 많은데 여기는 그렇지 않아서 좋았습니다 방도 조용하고 주차 공간도 널널합니다,3,4년 전
yeogi_accom_008_7444,전주 브라운도트 - 덕진점,공간이 넓어서 좋았어요 넷플릭스도 잘 나오고 불편한 점도 없었습니다특히 마음에 들었던 부분이 넓은 책상입니다출장시 업무 보기에 좋았어요노트북 놓고도 공간이 상당히 남았어요,4,2년 전
yeogi_accom_008_7445,전주 브라운도트 - 덕진점,이근방에서 시설도 제일좋고 깔끔합니다 특히 화장실은 타의 추종을 불허하게 깔끔 그자체 숙박할땐 더좋구요 에어컨도 시스템이라 발쪽으로 공기 시원하게 해주고요 뭐하나 빠지는것이없습니다,5,4년 전
yeogi_accom_008_7446,전주 브라운도트 - 덕진점,흑 전주에서 제일 좋은 모텔이 브라운도트인데 오늘은 뭐때문인지 담배냄새가 잔뜩 나서 정말 ㅠㅠ 힘들었어요 전객실 금연으로 아는데 왜 담배냄새가 났을까요 그외엔 다 좋습니다,4,3년 전
yeogi_accom_008_7447,전주 브라운도트 - 덕진점,더블 트윈 침실로 이용했고침대가 너무편하고 넓고 쾌척했어요샤워기 손잡이 부분에 날카로운 부분있어서 그건 좀 별로,4,1년 전
yeogi_accom_008_7448,전주 브라운도트 - 덕진점,좋아요 만족합니다 항상 주차 때문에 숙박잡을때 고민이 되는데 넉넉합니다 시설도 청결하고 대체적으로 모든부분이 좋아요 전주에 출장으로 오게되었는데 다음에도 온다면 또 올거같네요 만족 또 만족합니다 항상 변함없이 지금 처럼 유지 해주세요,5,3년 전
yeogi_accom_008_7449,전주 브라운도트 - 덕진점,직원분 친절하고 좋음방 넓고 좋은데 방음이 잘 안됨침대는 방수포 때문에 뿌드득뿌드득 소리가 남보일러 때문인지 살짝 건조함 방 좋고 직원 친절해서 재방문 의사 있음  ㅁ,5,1년 전
yeogi_accom_008_7450,전주 브라운도트 - 덕진점,전주여행 숙소로 잡았는데 아주 만족합니다근처에 덕진공원이 있어서 아침에 뛰고 오기도 좋아요스타일러가 있어서 옷도 깔끔하게 정리했습니다한옥마을은 버스로 2-30분 거리라 그냥 버스를 탔고돌아올때는 택시타니 5000원 정도 나왔습니다기분 좋게 잘 이용했어요,4,2년 전
yeogi_accom_008_7451,전주 브라운도트 - 덕진점,전주 출장 올때마다 들려서 숙박합니다프리미엄 객실 넓고 비품들도 많아서 좋아요욕실도 크고 1층엔 커피머신도 있어서 아침에커피한잔 마시기 좋아요근데도로소음때문에 문을 닫아도 씨끄러워요,4,3년 전
yeogi_accom_008_7452,전주 브라운도트 - 덕진점,갈 때마다 깨끗해서 자주 이용하는데 이번에는 침대 시트에 약간 모래 같은 느낌의 먼지들 때문에 까끌까끌하더라구요  좀 아쉬웠습니다 ㅠㅠ그래도 항상 깔끔해서 만족합니다 ,5,2년 전
yeogi_accom_008_7453,전주 브라운도트 - 덕진점,랜덤객실 2인이었는데 트윈룸 주셔서 엄청 널널히 쓸 수 있어서 아주 좋았습니다  스타일러도 있어서 옷도 뽀송하게 할 수 있어서 기분도 좋았고 주차장 자리도 많아서 아주 좋았습니다 무엇보다 3시에 입실했는데도 친절히 맞아주셔서 아주 좋았습니다 ,5,2년 전
yeogi_accom_008_7454,전주 브라운도트 - 덕진점,주차공간 많고 카운터에 계신 사장님 너무 친절해요방금 화장실 청소한것 같아 화장실에 물기가 많아 미끄러웠지만 그것 빼곤 룸 컨디션도 너무 좋고 깨끗해요 전주로 여행 오신다면 정말 강추,5,4년 전
yeogi_accom_008_7455,전주 브라운도트 - 덕진점,이틀째연속으로오네요 사장님 너무친절하시고올때마다느끼는거지만 북대에서 제일깔끔하고 포인트적립이있어서 나중에쓸수있는점이너무좋아요 그리고 주위맛집들이있어서 주차해놓고 술먹으러가기너무좋습니다,5,1년 전
yeogi_accom_008_7456,전주 브라운도트 - 덕진점,주위 교통편이 많거나 좋지는 않지만 배달도 잘 오고편의점이 가까이 있어 편합니다데스크에서도 서비스가 굉장히 친절하고 시설도 깨끗하고 가성비도 좋은 것 같아요다음에 또 들리겠습니다,5,3년 전
yeogi_accom_008_7457,전주 브라운도트 - 덕진점,시설은 화장실과 방 모두 깨끗하고 조용하고 좋았어요 직원 친절 역시 나쁘지 않고 괜찮았습니다 다만 방이 좀 추운것같네요 그래도 나쁘지않게 이용한것 같습니다 추후 기회가 된다면 다시 재방문할것 같습니다,5,2년 전
yeogi_accom_008_7458,전주 브라운도트 - 덕진점,객실도 청결하고 냄새도 나지 않아 좋았습니다 수건도 넉넉하게 챙겨 주시고 시원하게 하룻밤 보냈습니다 다만 객실 내 등이 고장났는지 깜빡 거리는데 보수하셔야 할 것 같습니다 전주에 온다면 다음에 또 이용할 것 같습니다 ,5,3년 전
yeogi_accom_008_7459,전주 브라운도트 - 덕진점,들어가는 입구가 골목이라해서 많이 구석진 곳이라 생각했는데 도로랑 가까워서 이용하는데 불편함이 전혀 없었어요객실이 너무 깨끗하고 좋았어요룸이라 방도 크고 성능 또한 좋았어요화장실은 넓은데다가 컨디션도 최상이였구요숙소 들어가는 입구에 커피머신기가 있어 모닝커피 마시기에도 좋았어요다음 전주여행을 하게 되믄 다시 이용하고 싶어요,5,3년 전
yeogi_accom_008_7460,전주 브라운도트 - 덕진점,잘 쉬고 잘 놀다 갑니다 날씨가 이제 더운탓인지 아니면 난방을 잘 틀어주셨는지 저희는 조금 더웠습니다 하지만 덕분에 감기 걸리지 않고 잘 잔 것 같습니다 안내분들도 친절하시고 위치도 좋아 잘 보냈습니다,5,3년 전
yeogi_accom_008_7461,전주 브라운도트 - 덕진점,객실 넓고 스타일러 있어서 편했어요 욕실도 욕조 있고 넓어서 이용하기 좋았어요 체크인시간이 늦어서 아쉬웠는데 그만큼 체크아웃이 여유있어서 편하게 쉬었습니다,4,1년 전
yeogi_accom_008_7462,전주 브라운도트 - 덕진점,- 시설깨끗합니다- 출장직원을 위해 무료로 업그레이드해주셔서 감사했어요- 직원분은 살짝 까칠하지만 일처리 깔끔하십니다- 내부 엄청 넓고 쾌적해요- 넷플릭스 등 무료로 가능해요,5,2년 전
yeogi_accom_008_7463,전주 브라운도트 - 덕진점,시설이 너무 깨끗하고 잘 이용하고 갑니다욕조도 있어 오랜만에 물 받아서 목욕도 했어요ㅋㅋ다시 전주 놀러가면 또 이용하고싶어요생각지도 못했는데 가격대비 너무 좋아요 많이 이용하세요,5,3년 전
yeogi_accom_008_7464,전주 브라운도트 - 덕진점,브라운도트 덕진점에는 남자친ㄱ 가 좋아하는 맥도날드가 있습니다 새벽 한시쯤에 나가서 선데이도 먹고왔어요 그리고 제가 좋아하는 킹스타피자베이컨포테이토도 배달 시켜 먹을 수 있습니다 아주 좋은데이트 감사합니다 브라운도트 덕진점에는 남자친ㄱ 가 좋아하는 맥도날드가 있습니다 새벽 한시쯤에 나가서 선데이도 먹고왔어요 그리고 제가 좋아하는 킹스타피자베이컨포테이토도 배달 시켜 먹을 수 있습니다 아주 좋은데이트 감사합니다브라운도트 덕진점에는 남자친ㄱ 가 좋아하는 맥도날드가 있습니다 새벽 한시쯤에 나가서 선데이도 먹고왔어요 그리고 제가 좋아하는 킹스타피자베이컨포테이토도 배달 시켜 먹을 수 있습니다 아주 좋은데이트 감사합니다,5,1년 전
yeogi_accom_008_7465,전주 브라운도트 - 덕진점,전주갈 때마다 이용합니다 너무 편안하게 잘 이용했습니다 바로 앞에 공원이 있어 산책하거나 운동하기에 너무 좋아요 그리고 직원분도 친절하시고 잠도 잘와서 피로가 싹 풀리네요 감사합니다,5,1년 전
yeogi_accom_008_7466,전주 브라운도트 - 덕진점,북대에일이있어서 연박으로이틀을 푹쉬었네요 머하나부족한거없이 편하게쉬었던거같아요 사장님은언제나친절하시고 수압이랑 너무 좋고 편해서 이틀동안 너무 편하게쉬었다가 볼일잘보았네요 담에또올께요,5,1년 전
yeogi_accom_008_7467,전주 브라운도트 - 덕진점,전주 놀러갔다가 급하게 잡은 룸복도는 방음이 안됨초저녁부터 옆방 소리 아주 민망함애들과 같이 갔는데 여긴 그냥 젊은 애들거시기하러 오는곳같음룸 컨디션은 좋음 난방온수 아주 잘 됨카운터는 로 보임,4,1년 전
yeogi_accom_008_7468,전주 브라운도트 - 덕진점,브라운도트는 평소 자주 이용하는 체인인데 역시 이곳도 최소한의 만족을 채워주는 곳이었습니다 디자인이나 청결도 준수했고 욕조 있는 방으로 업그레이드 해주셔서 덕분에 잘 쉬었습니다,4,1년 전
yeogi_accom_008_7469,전주 브라운도트 - 덕진점,다 괜찮았는데 방음이 좀잘 안되네요청결 상태는 에어컨 빼고 괜찮았어요룸도 크고 깔끔하니 좋아요,4,3년 전
yeogi_accom_008_7470,전주 브라운도트 - 덕진점,언제나가도친절한브라운도튼이네쇼 방도 업그레이드해주셔서 편하게쉬었다가요 비품이랑잘되있고방이랑따뜻하게푹잤던거같인요 편의점도가까이있고 번화가앞에있어서 나가기도편하고좋았ㅈ습니다담에ㅣ또방문할께요,5,1년 전
yeogi_accom_008_7471,전주 브라운도트 - 덕진점,여기 너무 친절하고 좋았어요가족끼리 디럭스트윈에 1박 머물렀는데 4인 가족 이었거든요 추가 비용도 없이 칫솔도 4개 챙겨 주셨어요 룸안에 담배 냄새도 없고 인테리어도 깔끔하니 좋았습니다가격도 좋고 담에도 전주에 놀러갈땐 묻지도 따지지도 않고여기로 다시 와야 겠습니다,5,3년 전
yeogi_accom_008_7472,전주 브라운도트 - 덕진점,전주 올때마다 34번정도 방문항것같아요 매번 올때마다 객실 컨디션 너무 좋았구요 카운터에 계신분도 친절하셨어요 주변에 덕진공원이 있어서 산책하기도 좋고 다음에 또 방문의사 있어요,5,3년 전
yeogi_accom_008_7473,전주 브라운도트 - 덕진점,시설이깨끗하고 좋아요 침구상태에 예민한편인데 냄새도안나고 청결하네요 잘 묵다갑니다,5,1년 전
yeogi_accom_008_7474,전주 브라운도트 - 덕진점,1 시설 및 인테리어는 어떠셨나요시설 괜찮았고 인테리어도 괜찮았습니다2 객실 청결상태는 어떠셨나요객실 청결상태 괜찮았습니다3 서비스 및 직원의 친절도는 어떠셨나요전부 다 괜찮았습니다그럼 수고하세여 ㅋㅋ,5,3년 전
yeogi_accom_008_7475,전주 브라운도트 - 덕진점,아주아주 맘에들어요 좋아요 다음에 또오랴고요 프롬트 계신분이 바꼈는지 되게 친절하셔서 기분이 좋았어요 깨끗하고 냄새도안나고 맘에들어요 넓고 주변에 식당도 많고 편의점도 주변이고덕진공원도좋아여,5,3년 전
yeogi_accom_008_7476,전주 브라운도트 - 덕진점,좋았어여 방이 윗공기가 너무 추워서 잘때 불편하고 복도인지 방인지 방음이 하나도 안되요 새벽내내 시끄러웠어요 그래도 구조도 좋고 방도 크고 일단 화장실이 엄청 커서 ㅋㅋㅋㅋㅋㅋㅋ편하게 쉬다왔어오 ,5,2년 전
yeogi_accom_008_7477,전주 브라운도트 - 덕진점,객실도 깨끗하고 화장실도 깔끔하고 외부 내부 전부 깔끔한거같아요 가격대비 제일 좋은곳 같네요 방도 하나 업그레이드 시켜주신거 같은데 넓어서 편하게 잘 쓰다 가는거 같아요 또 이용할게요,5,1년 전
yeogi_accom_008_7478,전주 브라운도트 - 덕진점,항상 잘 이용해 왔지만 에어컨 필터에 먼지가 많이 껴있는거 같아서 필터청소만 되어있으면 더욱 좋을 것 같습니다,4,3년 전
yeogi_accom_008_7479,전주 브라운도트 - 덕진점,전북대와 덕진공원 사이에 있구요 비교적 관리가 잘 되고 내부 인테리어랑 침대 가구도 잘 매치되는 편입니다 머무르는 동안 편하게 쉬었다 갔구요 감사했습니다 방 교체 요청했는데 흔쾌히 해주셨구요,5,2년 전
yeogi_accom_008_7480,전주 브라운도트 - 덕진점,진짜 감동이였어요  전주 놀러가서 기대안하고 예약했는데 일단 방을 업드레이드 해주신거 같았어요 그리고 방에 들어갔는데 와 침대 두개에다가 방도 따시고 스타일러가 있어서 옷 보관하기에도 좋았네요 다만 기본적으로 방안에 충전기가 없는게 아쉬웠고 그리고낮에 나올때보니까 직원분이 잘생겼어요,5,2년 전
yeogi_accom_008_7481,전주 브라운도트 - 덕진점,매번 오지만 정말 좋아요 이 가격에 이 퀄리티 진짜 마음에 듭니다 있는 방은 진짜 방 뺨치게 너무 좋구요 스타일러 있는 프리미엄 기본 스탠다드 다 좋습니다 침대도 안불편하고 잠도 잘 오고요 피곤할때 대실하는데 진짜 너무 만족스럽습니다 사진이랑 똑같아요,5,3년 전
yeogi_accom_008_7482,전주 브라운도트 - 덕진점,숙소 디자인도 되게 깔끔하고 공기 청정기도 있고 좋았어요 특히나 화장실이 엄청 넓고 이뻐서 좋더라구요침대도 넓고 편하고 넷플릭스도 되구 2 최고였어요ㅋㅋㅋㅋ 다만 방음이 좋지는 않더라구요 그리고 잘때 블라인드 사이로 햇빛이 들어와서 조금 신경쓰였어요 이거만 개선해주시면 너무 좋을거같아요 두번째 온건데 이번에도 잘 쉬다 갑니다 앞으로 전주 숙소로는 여기만 올거같네요ㅎㅎ,4,1년 전
yeogi_accom_008_7483,전주 브라운도트 - 덕진점,방을 트윈룸으로 업그레이드해서 주셨는데 둘 다 싱글보다 큰 베드여서 놀랐고 엄청 좋았어요스타일러 소리가 크길래 뭐지 싶었는데 빈 옷걸이때문에 소음이 심했더라구요 청결하고 너무 좋았어용,5,1년 전
yeogi_accom_008_7484,전주 브라운도트 - 덕진점,1 인테리어주변 숙소에 비하면 정말 인테리어 심플하게잘하신것같아요 다음에 이 근처로 오게되면 또 방문할 예정입니다2 서비스직원분도 친절하고 입실시간보다 빨리 도착해서주변에 주차할곳이 없는데 배려해주셔서 감사했습니다3 위생최근 리모델링 하신건지 전반적으로 룸 상태는정말 깔끔했습니다 잘 이용하고 갑니다 다음에도또 방문할게요 ,5,4년 전
