id,name,review_content,rating,write_date
yeogi_accom_009_9269,전주 노이 호텔,정말 잘 쉬고 갑니다 조식도 좋았어요정말 잘 쉬고 갑니다 조식도 좋았어요정말 잘 쉬고 갑니다 조식도 좋았어요정말 잘 쉬고 갑니다 조식도 좋았어요정말 잘 쉬고 갑니다 조식도 좋았어요,5,1년 전
yeogi_accom_009_9270,전주 노이 호텔,노이 좋습니다 노이 좋습미다노이 좋습니다 노이 좋습미다노이 좋습니다 노이 좋습미다노이 좋습니다 노이 좋습미다노이 좋습니다 노이 좋습미다노이 노이 좋습니다 노이 좋습미다좋습니다 노이 좋습미다,5,1년 전
yeogi_accom_009_9271,전주 노이 호텔,알바분이 친절해서 좋았습니다객실도 깨끗해서 이용 시 불편함을 안느꼈어요담배냄새도 안나서 좋았습니다기분 좋게 잘 쉬다 갑니다다음에도 또 이용할게요 감사합니다 ㅎㅎㅎ,5,1년 전
yeogi_accom_009_9272,전주 노이 호텔,전체적으로 깔끔해서 좋았습니다 위치도 역이랑 가까워서 좋고 바로 앞에 편의점도 있어서 편합니당 다만 샤워랑 화장실이 엄청 가려져 있는 게 아니라서 초큼 불편했어요ㅠ 그렇지만 그거 외에 다른 건 다 좋았어요,4,1년 전
yeogi_accom_009_9273,전주 노이 호텔,처음 전주에 놀러왔을때 숙소도 저렴하고 해서 막상괜찮을가 했는데 좋아서 다른숙소 돈을 더주더라도 더좋은곳을 가면 어떨까해서 첨와본숙소인데  3박숙소 잡았어요 첫날 놀고들어와서 씻으려고 욕조물을 틀었더니 오염물질이 떠다녀 숙소 위생이 안좋아서 숙소 변경 요청드렸는데 두번째 방역시 방물바다에 방바닥에 머리카락 장난 아니였고 그래서 다시 요청드렸는데 제일 좋은 방이라고하여서 3번째 방 역시 관리가 안되었고 욕조 사이에 누가 나두고간 팬티가 있는게 어니겠어요이정도면 위생이 너무 안좋고 환불도 안된다고 하고 어쩔수 없이 자다 나왔는데 제대로 씻지도 못하고 불편하게 있다가 나왔네요,0,10개월 전
yeogi_accom_009_9274,전주 노이 호텔,찬물 따뜻한 물 잘 나오고 에어컨 빵빵하게 잘 나와요 어메니티에서 머리카락 나오고 곳곳에서도 머리카락이저렴한 가격에 오랜 시간 머물 수 있어서 좋지만 본인이 깔끔한 편이면 청결은 좀,5,2년 전
yeogi_accom_009_9275,전주 노이 호텔,항상 이용하는 최고의 숙소입니다ㅠㅜ우선 1층에 얼음컵이랑 커피머신 있는게 최고이구요그리고 숙소에서 모든 다되는게 진짜 은근히 메리트가큰거같더라구요다른숙소에서는 기것해야 넷플릭스거든요근데 여기는 티빙 웨이브 와챠 디즈니 넷플진짜평일 7시간대실하면 영화보고 자고 진짜 여름에근처 모텔중에 이곳만 이용합니다ㅠㅜ단점은 충전기를 객실에서 받아서 사용해야하고같은 일반 객실마다 테마가 조금씩 달라서침대 머리벽쪽위에 동물석상같은거빼면 전부좋습니다ㅎㅎ그객실은 그냥 무섭더라구요ㅎㅎ그리고 욕실 샤워기 수압은 엄청약해요샤워기자체가 별로라서 그건 다른걸로 바꿔주셨음 합니당앞으로도 여기만 갈거같아요,5,2년 전
yeogi_accom_009_9276,전주 노이 호텔,가성비 좋다는분들 진짜 대단하시네요 최악입니다 처음갔던방엔 욕실에서 거머리같은 벌레들에 두번째방도 역시 청결이라곤 볼수없는 쓰레기장보통은 올라와서 확인해보시지않나요 전화받자마자 바로 방바꿔준다고 내려오라하시더니 전화 끊어버리시고1박으로 놀러온거라 시간낭비하기싫어서 그냥 입던옷 그대로입고 잤습니다  다음에 또 전주여행오면 여기는 물론 여기 근처 모텔호텔은 절대 이용안할거같네요 리뷰 추천순으로 보지마시고 최신순으로 보세요다들,0,10개월 전
yeogi_accom_009_9277,전주 노이 호텔,주인인지 직원인지는 잘모르겠지만 전주 출장갈때마다 자주 찾는곳인데 게이밍피시 방을 예약하고 좀 괜찮은방 달라니까 우리는 사양 다똑같아요 그순간에 다른 예약손님  머리카락땜에 너무 더럽다고 방 바꿔달라고 내려옴,2,1년 전
yeogi_accom_009_9278,전주 노이 호텔,5시간 대실인데 엄청 싸구 다음에 또 이용할께요5시간 대실인데 엄청 싸구 다음에 또 이용할께요5시간 대실인데 엄청 싸구 다음에 또 이용할께요5시간 대실인데 엄청 싸구 다음에 또 이용할께요,5,2년 전
yeogi_accom_009_9279,전주 노이 호텔,전주역이랑도 가깝고 스위치 게임을 마음껏 할 수 있어서 좋아요 1층에 음료수도 가져갈 수 있고 커피 음료가 아닌 과일 음료라서 만족스러워요 단점은 딱히 없구 장점이 많아서 이 근처 올 때마다 노이 호텔만 가네용,5,2년 전
yeogi_accom_009_9280,전주 노이 호텔,청결하고 깨끗햇습니당프론트는 너무 친절하구충전기두 빌려주시고 ㅎㅎ항상 노이는 너무 친절하싱 것 같아요인테리어도 너무 좋구가성비도 정말정날 좋아요 전주 놀러오면 노이로 꼭 꼭방문하세용청결하고 깨끗햇습니당프론트는 너무 친절하구충전기두 빌려주시고 ㅎㅎ항상 노이는 너무 친절하싱 것 같아요인테리어도 너무 좋구가성비도 정말정날 좋아요 전주 놀러오면 노이로 꼭 꼭방문하세용,5,2년 전
yeogi_accom_009_9281,전주 노이 호텔,깔끔한 외관과 모던한 인테리어와 친절한 사장님이 계신 로비부터 마음이 편안하더라구요 방안은 또한 역시 깔끔 그 잡채 깔끔한모습을보고 다음에도 또 와야겠지라는 생각을 가지고 좋은 시간 보내다 왔습니다 진짜 강추,5,2년 전
yeogi_accom_009_9282,전주 노이 호텔,노이는 언제나 초ㅣ고입니당 항상 노이만 이용하는데  노이가 제일 좋은 것 같아요깖금하도 라면 기계도 있고 먹거리도 있고 친절하고숙소도 정말 깨끗해요  타지에수 묵으실 분 노이 완전 추천드려요  전주역에소도 가깝고 겉으로도 좋아보이고 안에 시설도 깨끗하고 정말 좋아요넷플릭스  웨이브 등 다 되니깐 하루 놀기도 정말 좋은것 같아요 ㅎㅎ샤워할 수 있는 시설도 좃고 바다워시샴푸 린스수건 전부 너무 좋아용  노이는 언제나 초ㅣ고입니당 항상 노이만 이용하는데  노이가 제일 좋은 것 같아요깖금하도 라면 기계도 있고 먹거리도 있고 친절하고숙소도 정말 깨끗해요  타지에수 묵으실 분 노이 완전 추천드려요  전주역에소도 가깝고 겉으로도 좋아보이고 안에 시설도 깨끗하고 정말 좋아요넷플릭스  웨이브 등 다 되니깐 하루 놀기도 정말 좋은것 같아요 ㅎㅎ샤워할 수 있는 시설도 좃고 바다워시샴푸 린스수건 전부 너무 좋아용  노이는 언제나 초ㅣ고입니당 항상 노이만 이용하는데  노이가 제일 좋은 것 같아요깖금하도 라면 기계도 있고 먹거리도 있고 친절하고숙소도 정말 깨끗해요  타지에수 묵으실 분 노이 완전 추천드려요  전주역에소도 가깝고 겉으로도 좋아보이고 안에 시설도 깨끗하고 정말 좋아요넷플릭스  웨이브 등 다 되니깐 하루 놀기도 정말 좋은것 같아요 ㅎㅎ샤워할 수 있는 시설도 좃고 바다워시샴푸 린스수건 전부 너무 좋아용  노이는 언제나 초ㅣ고입니당 항상 노이만 이용하는데  노이가 제일 좋은 것 같아요깖금하도 라면 기계도 있고 먹거리도 있고 친절하고숙소도 정말 깨끗해요  타지에수 묵으실 분 노이 완전 추천드려요  전주역에소도 가깝고 겉으로도 좋아보이고 안에 시설도 깨끗하고 정말 좋아요넷플릭스  웨이브 등 다 되니깐 하루 놀기도 정말 좋은것 같아요 ㅎㅎ샤워할 수 있는 시설도 좃고 바다워시샴푸 린스수건 전부 너무 좋아용  번창하세요 노이 최고입니당새해복많이먾리 받으세요  ㅎㅎ내년에도 노이 이용할개요,5,2년 전
yeogi_accom_009_9283,전주 노이 호텔,너무 좋아요 사장님 친절하시고 좋아요너무 좋아요 사장님 친절하시고 좋아요너무 좋아요 사장님 친절하시고 좋아요너무 좋아요 사장님 친절하시고 좋아요너무 좋아요 사장님 친절하시고 좋아요너무 좋아요 사장님 친절하시고 좋아요너무 좋아요 사장님 친절하시고 좋아요너무 좋아요 사장님 친절하시고 좋아요너무 좋아요 사장님 친절하시고 좋아요너무 좋아요 사장님 친절하시고 좋아요너무 좋아요 사장님 친절하시고 좋아요너무 좋아요 사장님 친절하시고 좋아요너무 좋아요 사장님 친절하시고 좋아요너무 좋아요 사장님 친절하시고 좋아요너무 좋아요 사장님 친절하시고 좋아요너무 좋아요 사장님 친절하시고 좋아요너무 좋아요 사장님 친절하시고 좋아요너무 좋아요 사장님 친절하시고 좋아요너무 좋아요 사장님 친절하시고 좋아요,5,3년 전
yeogi_accom_009_9284,전주 노이 호텔,화장실에 휴지 없고 종이컵 없는 게 좀 불편했어요 그리고 침대 이불에 뭐 묻어있던데 신경 좀 써주세요 ,4,2년 전
yeogi_accom_009_9285,전주 노이 호텔,잘 자고 갑니답 좋아요 깔끔하구요,5,2년 전
yeogi_accom_009_9286,전주 노이 호텔,침구가 너무 편해서 꿀잠잤어요침구가 너무 편해서 꿀잠잤어요침구가 너무 편해서 꿀잠잤어요침구가 너무 편해서 꿀잠잤어요침구가 너무 편해서 꿀잠잤어요침구가 너무 편해서 꿀잠잤어요사장님도 친절하셔요,5,2년 전
yeogi_accom_009_9287,전주 노이 호텔,깨끗하고 좋습니다 주차장도 넓어요 ㅎㅎ깨끗하고 좋습니다 주차장도 넓어요 ㅎㅎ깨끗하고 좋습니다 주차장도 넓어요 ㅎㅎ깨끗하고 좋습니다 주차장도 넓어요 ㅎㅎ깨끗하고 좋습니다 주차장도 넓어요 ㅎㅎ깨끗하고 좋습니다 주차장도 넓어요 ㅎㅎ깨끗하고 좋습니다 주차장도 넓어요 ㅎㅎ깨끗하고 좋습니다 주차장도 넓어요 ㅎㅎ깨끗하고 좋습니다 주차장도 넓어요 ㅎㅎ깨끗하고 좋습니다 주차장도 넓어요 ㅎㅎ깨끗하고 좋습니다 주차장도 넓어요 ㅎㅎ깨끗하고 좋습니다 주차장도 넓어요 ㅎㅎ깨끗하고 좋습니다 주차장도 넓어요 ㅎㅎ깨끗하고 좋습니다 주차장도 넓어요 ㅎㅎ깨끗하고 좋습니다 주차장도 넓어요 ㅎㅎ깨끗하고 좋습니다 주차장도 넓어요 ㅎㅎ깨끗하고 좋습니다 주차장도 넓어요 ㅎㅎ깨끗하고 좋습니다 주차장도 넓어요 ㅎㅎ깨끗하고 좋습니다 주차장도 넓어요 ㅎㅎ깨끗하고 좋습니다 주차장도 넓어요 ㅎㅎ깨끗하고 좋습니다 주차장도 넓어요 ㅎㅎ깨끗하고 좋습니다 주차장도 넓어요 ㅎㅎ깨끗하고 좋습니다 주차장도 넓어요 ㅎㅎ깨끗하고 좋습니다 주차장도 넓어요 ㅎㅎ깨끗하고 좋습니다 주차장도 넓어요 ㅎㅎ깨끗하고 좋습니다 주차장도 넓어요 ㅎㅎ깨끗하고 좋습니다 주차장도 넓어요 ㅎㅎ깨끗하고 좋습니다 주차장도 넓어요 ㅎㅎ깨끗하고 좋습니다 주차장도 넓어요 ㅎㅎ깨끗하고 좋습니다 주차장도 넓어요 ㅎㅎ깨끗하고 좋습니다 주차장도 넓어요 ㅎㅎ깨끗하고 좋습니다 주차장도 넓어요 ㅎㅎ,5,2년 전
yeogi_accom_009_9288,전주 노이 호텔,눈도많이 내리고                                                              체크인후 근처 술집에서 한잔 이동하기 너무 좋은 위치 추천,5,2년 전
yeogi_accom_009_9289,전주 노이 호텔,전주 숙소중에 가성비는 가장 좋은듯                             출장시 매번 이용할정도로  시설면에서도                  다른곳에 뒤떨어지지 않음,5,2년 전
yeogi_accom_009_9290,전주 노이 호텔,전주 숙소중에 가성비는 가장 좋은듯                             출장시 매번 이용할정도로  시설면에서도                  다른곳에 뒤떨어지지 않음,5,2년 전
yeogi_accom_009_9291,전주 노이 호텔,잘 쉬다 갑니다 잘 쉬다 갑니다 잘 쉬다 갑니다 잘 쉬다 갑니다 잘 쉬다 갑니다 잘 쉬다 갑니다 잘 쉬다 갑니다 잘 쉬다 갑니다 잘 쉬다 갑니다 잘 쉬다 갑니다 잘 쉬다 갑니다 잘 쉬다 갑니다,5,2년 전
yeogi_accom_009_9292,전주 노이 호텔,전주 출장가면 이곳이 원픽입니다전주 출장가면 이곳이 원픽입니다전주 출장가면 이곳이 원픽입니다전주 출장가면 이곳이 원픽입니다전주 출장가면 이곳이 원픽입니다전주 출장가면 이곳이 원픽입니다,5,2년 전
yeogi_accom_009_9293,전주 노이 호텔,안녕하세용 요즘 자주 방문했던 노이 호텔에 대한 리뷰를 남기겠습니다 먼저 청결부분에서 가장 좋은 좋았던 것 같습니다 항상 방에 들어갈 때 담배냄새도 안났고 여러모로 깔끔했습니다 다음에도 이용하겠습니다,5,2년 전
yeogi_accom_009_9294,전주 노이 호텔,항상 가는 곳입니다 위치상도 좋고 청결 그리고 서비스까지 만족할 수 있는 곳이여서 자주 애용합니다 이번에 갔을때는 담배냄새때문에 방을 바꿔주셨는데 룸업그레이드도 해주셔서 너무 좋았어요 짱짱입니다,5,2년 전
yeogi_accom_009_9295,전주 노이 호텔,이번에 이있는 방으로 예약했는데 가볍게 즐기기 좋았습니다 그외 역시 깔끔하고 다 좋았지만아쉽게 샤워실 호스가 벗겨져 있었고 변기에 뭐가 묻진 원인모를 악취까지그동안 좋은 방만 걸렸던 건지 조금 아쉽네요,5,2년 전
yeogi_accom_009_9296,전주 노이 호텔,매트리스는 좋아요 근데 컴퓨터 유에스비는 안되고 매트가 조금 더러워서 신경쓰였어요 주차는 생각보다 편하고 전화 문의 했을 때 직원분이 불친절하다는 점 그것만 빼면 괜찮은 곳인 것 같아요,2,2년 전
yeogi_accom_009_9297,전주 노이 호텔,전주부근으로 출장을 갔습니다숙소동행자가 있어서 트윈으로 예약했습니다방은 깨끗하고 깔끔해요싱글침대와 더블침대가 있었구요모텔인데도 괜찮았어요화장실도 욕조가 있고요 비데도 있네요넓고 깨끗하네요ㅎ 관리 잘하심일하시는 남자분 친절하시고요엘레베이터도 빠르게 잘되네요어메니티도 제공되는데 기본적인 칫솔치약 세안제 등 필요한건 다있네요감사했습니다그리고 주변에는 밥집 술집 많아요회사사람들과 가서 사진은 못찍었지만되게 많아서 잘골라가시면 될듯해요또가겠습니다 감사합니다,5,1년 전
yeogi_accom_009_9298,전주 노이 호텔,원래 자주 방문하다가 오랜만에 방문하게 되었는데 여전히 청결이 좋았고 느끼기에 깔끔했으며 친절하신 사장님 덕분에 기분좋게 이용할 수 있었습니다 다음주에도 꼭 이용하겠습니다 감사합니다,5,2년 전
yeogi_accom_009_9299,전주 노이 호텔,전주 놀러와서 비가 와서 잠시 쉴 곳을 찾다가 방문하게 되었는데 우선은 주차장이 꽤나 넓어서 편하게 주차했습니다 주인준께서도 친절하시고 만차이면 발렛주차도 해주신다니까 편하게 방문 할 수 있을거 같아요 실내도 깨끗하고 좋았습니다 침대도 푹신하고 넷플릭스나 에어컨도 잘 되서 잘 쉬고 잘 놀았어요 저번에 방문 했을 때랑 달리 욕실이 리모델링 됬는지 더 편하더라구요 다만 샤워기 위치가 조금 낮아서 그거 빼고는 다 괜찮았습니다 욕실 문이 미닫이 였는데 고장낫는지 좀 떠있는거만 보수하면 댈거 같아요,4,1년 전
yeogi_accom_009_9300,전주 노이 호텔,잘 쉬었습니다 감사합니다1 위치가 좋아요전주역에서 내려오면 금방인 가까운 위치 위아래로 식당가도 있고 편의점도 붙어있어서 식사 시 편리합니다2 조식 제공1층 카페테리아에는 씨리얼 한강라면 식빵 커피 등등 여러가지가 조식으로 아침 6시부터 9시까지 제공됩니다 3 불편한 없는 객실 시설넓은편인 객실 화장실은 변기 세면대 샤워실이 모두 분리된 형태 티비로는 유튜브 시청이 가능하고 로 되는데 넷플릭스 디즈니 티빙 등 이용할 수 있는게 많습니다 4 괜찮은 성능의 컴퓨터롤 등 국민겜이 원활히 돌아가는 성능입니다,4,1년 전
yeogi_accom_009_9301,전주 노이 호텔,연차 끝나구 위로 올라가기 전에 대실 예약했는데 역시나 노이 너무 좋았어요 일단 전기매트 있는게 가장 좋구여ㅋㅋㅋ 그리구 여긴 모든 가 다 있어서 넘 좋아요ㅎ 오늘은 내남편과 결혼해줘 보면서 초밥 시켜먹었어요 컴퓨터가 게이밍 컴퓨터라서 푸꾸옥 일정도 세울겸 사용했는데 시간 순삭으로 지나가서 모든 계획 다 세웠어요ㅋㅋㅋ청결은 그녕 평타정도 치지만 그래도 이 가격에 5시간 대실 할 수 있는데가 흔치 않아요 숙박도 저렴한 편이고 맞은편에 편의점도 있으니 많이 이용해보세요,5,1년 전
yeogi_accom_009_9302,전주 노이 호텔,시설 및 인테리어 여기어때 예약시 사진을 꼼꼼히 살펴보고 예약했다 밝은 화이트톤의객실과 약간 그레이 컬러 객실이 눈에 들어왔고 예약한대로 객실은 화이트 톤의 밝은 것이 인상적인 객실을 배정받았다 넷플릭스가 된다고 적혀있는거 알고 들어가서 넷플릭스 보면서 쉴수있어서 좋았고  창밖 풍경이 높은빌딩이 아니어서 좋았다 사실 처음에 배정받은곳은 담배냄새가 역해거 바로 벙 교체를 요창했고 즉각 방을 바꿔주어 감사했다 화장실 세면대가 매우 넖어 편했고 욕조안에 기본적인 샤워 용품이 비치되어 편했다 방음이 잘되어 주위 소음없어서 휴식취하기에 제격이었다 객실 청결상태는 잘 정돈된 상태였고 청결하게 준비돼있었다 다만 벽에 뭔가를 떼어낸듯한 상태가 좀 의아했지만 액자나 벽걸이 티비위치를 바꾼건지 뭔지 떼어낸 자국이 보였음 청소상태도 굿이었다 서비스 및 직원의 친절함이 기분좋게 해주었고 앞서 말했듯 방교체역시 선뜻 해주어 고마웠다 첫방문시 인사도 밝게해주니 반겨주는거같아 기분이 좋았다 아울러 카운터 앞쪽에 준비돼 있는 커피 음료 외에도 토스트용 빵 수제청 같은특별 음료가 비치돼있어 맛도 보게하니 다채로웠다 완전 친절 기억에 남을 만한 서비스 감사합니다기본적으로 객실 컨디션이 깨끗하고 조용해서 편히 시감보내다가 가기에 좋았다 피씨와 안마의자가 널찍하게 준비되어있고 미니 탁자가 있어서  단란하게 앉아서 음료머시기에도 좋을거같았다 티비 화면은 적정한 수준이었고 침대 시트는 아주 깨끗하게 정돈 돼있고 불쾌한 냄새도없었다 욕실 타월은 여러장 있어서 좋았는데 새거처럼 보드라운것들이 더 많이있어서 나름 타월도 만족했다가장 이용하기 좋았던것은 요즘 핫한 넷플릭스 영화를 맘껏 즐겨볼수있었던 점으로 예약할때부터 알고 갔는데 역시나 편하게 이용할수 있던게 기억에 남는다 일단 전주역에서 매우 가까운 위치라서 다음이용도 고려할만하다 차로 약 3 분거리라서 이용이 편하고 주변에 숙소가 많던데 여기어때 통해서 좋은 숙소를 잘 골라간것같아서 기분이 좋았다 다음번이용할땐 즉석라면을 먹어봐야겟다 좋은 시간 보냈네요 감사합니다,5,1년 전
yeogi_accom_009_9303,전주 노이 호텔,전주역에서 내려오면 금방인 위치라 좋습니다 주변 거리에 식당가가 있어 밥먹기도 좋고 편의점이나 마트도 있어서 편리합니다 1층 카페테리아에는 아침 6시 9시 사이에 조식을 먹을 수 있도록 되어있는데 씨리얼 식빵 한강라면 주스 식빵 등등 여러가지 준비되어 있습니다 객실은 공간이 꽤 넓어서 좋고 화장실은 샤워실 변기 세면대 분리형 칸막이로 되어있는데 깔끔해서 좋은거 같습니다 기본방부터 인터넷 가능한 컴퓨터가 있고  사용가능한 티비가 있고 여기 콘센트는 다양한 코드 꼽을 수 있게 되어서 외국인 관광객이 편하겠다 생각듭니다,4,1년 전
yeogi_accom_009_9304,전주 노이 호텔,충분한 어메니티 만족했습니다 그리고 안락한 템퍼 매트리스까지 정말 편안했습니다객실 청소 상태 또한 만족했는데요 머리카락 하나 보이지 않을 정도로 청결했습니다넷플릭스 디즈니 플러스 티빙 등 다양한 를 문제없이 즐길 수 있었으며 로 봐서 그런가더 선명하고 좋았습니다 그리고 프라이빗 욕실 또한 괜찮았는데요 특히 반신욕을 할 수 있는 욕조가 있어 주중의 피로 여유 있게 주말에 푼 거 같아 편안했습니다 다만 세면대가 막혔는지 빠르게 배수가 되지 않아 불편했습니다이점 참고하시면 좋을 것 같습니다정말 가성비 있게 잘 이용한 것 같아 만족했습니다다음에도 기회가 된다면 또 이용하도록 하겠습니다,4,1년 전
yeogi_accom_009_9305,전주 노이 호텔,오랜만에 노이 방문했는데 303호는 처음 배정받았습니다 욕조가 특이하게 생겼는데 시간상 이용은 못했구 나중에 기회가 되면 이용해보려고요스타일러가 있는 숙소는 많이 있는데 여기는 대박인게 시트도 같이 배치되어 있더라고요 센스 대박이죠ㅎㅎ샤워부스랑 화장실이랑 분리되어 있어서 좋았습니다 다만 화장실에서 담배냄새가 나더라구요 환풍구를 타고 다른 방에서 피는 담배냄새가 올라오는 것 같더라구요ㅠㅠ 이건 조치가 필요할 것 같습니다 항상 이용하는 노이 좋습니다,5,1년 전
yeogi_accom_009_9306,전주 노이 호텔,장점아중2지구 술집 번화가 사거리에 위치해서접근성이 좋습니다사방팔방 현관문있어 모든방향 편의점다 이용할수 있습니다주차장 넓고 주변에도 공영주차장이 있습니다변기칸 샤워기칸 분리되어있어 편리하고수압도 아주 좋습니다실내 조명도 5가지로 되어있어 은은한 조명부터환한 조명까지 메이크업 하기도 아주 좋습니다욕실 거울에도 조명이 부착되어있어남자분들 면도하기도 좋습니다침대 헤드위 조명도 아주 이쁩니다단점객실이 좀 좁습니다객실 창문이 안쪽으로 열게되어 조금불편합니다테이블이 너무 작아 음식 먹기는 불편했습니다,4,1년 전
yeogi_accom_009_9307,전주 노이 호텔,오늘도 역시 노이ㅎㅎ 요새 늘 호텔 이용하다가 오랜만에 노이 왔네요 늘이랑 노이랑 같은 사장님이라 그러신지 둘다 넘 좋아요 근데 개인적으루 노이가 더 취향인 느낌ㅎㅎ 노이는 시설도 청결하구 구조도 약간 엔틱 해서 그런지 더 좋아요ㅋㅋㅋㅋ 사진에서 보시는 것처럼 약간 노루랑 이런거 걸려있구ㅎㅎ 글구 방도 짱 커요 근데 화장실 슬리퍼에서 냄새가 좀 나요ㅠㅠ 이거 교체하셔야 할 것 같아요,5,1년 전
yeogi_accom_009_9308,전주 노이 호텔,객실 사진은 화이트톤 인테리어였는데제가 이용한 객실은 308호 이고 우드톤 빈티지 인테리어였어요들어갔을때 방 너무 깔끔하고 따뜻해서 기분 업넷플왓챠유튜브쿠팡플레이 전 객실 다 무료입니다 세면대 샤워부스 화장실 다 따로 되어있어요천정형 샤워기는 푸른색으로 녹이랑 곰팡이가 좀 있었어요고데기도 있어서 넘넘 좋았어요그리고 아침도 토스트라면도 먹을수 있다고 써있었습니다 앞에 편의점 있는데 도보 10초컷  한옥마을 자차로 10분전주역 8분 접근성 최고침대베게 너무 푹신하고전기장판도 있어서 따뜻하게 너무 잘잤어요수압도 세고 어메니티는 따로 가져온게 있어서 안써봤는데 샴푸린스바디워시 다 구비 되어 있습니다가성비 갑 호텔입니다 너무 추천해요,4,2년 전
yeogi_accom_009_9309,전주 노이 호텔,충분한 어메니티 만족했습니다 그리고 편안한 휴식을 주는 템퍼 매트리스 좋았습니다 또한 욕조가 있어 반신욕을 할 수 있어서 괜찮았습니다 한주의 피로가 풀리는것 같아요 쌀쌀한 날씨에도 아늑하게 객실 내 난방과 전기장판이 있어 따뜻하게 쉬었고요객실 청소 상태 또한 만족했는데요 머리카락 하나 보이지 않을 정도로 청결했습니다넷플릭스 티빙 웨이브 디즈니 왓챠 까지 돌아가면서 재미있게 잘 시청도 하였고요큰 화면으로 봐서 그런지 더욱 즐거웠습니다감사합니다,4,1년 전
