id,name,review_content,rating,write_date
yeogi_accom_009_9587,전주 노이 호텔,오랜만에 방문했아요 노이 여전히 최고애요 시설도 좋고냄새도 안나고편의시설도 가깝구 충전기대여도 해주시고청결해요 여기 최고에요 ㄹㅎㅎ전주에서 묵으실거면무조건 노이호텔 추천입니다 오랜만에 방문했아요 노이 여전히 최고애요 시설도 좋고냄새도 안나고편의시설도 가깝구 충전기대여도 해주시고청결해요 여기 최고에요 ㄹㅎㅎ전주에서 묵으실거면무조건 노이호텔 추천입니다 오랜만에 방문했아요 노이 여전히 최고애요 시설도 좋고냄새도 안나고편의시설도 가깝구 충전기대여도 해주시고청결해요 여기 최고에요 ㄹㅎㅎ전주에서 묵으실거면무조건 노이호텔 추천입니다 오랜만에 방문했아요 노이 여전히 최고애요 시설도 좋고냄새도 안나고편의시설도 가깝구 충전기대여도 해주시고청결해요 여기 최고에요 ㄹㅎㅎ전주에서 묵으실거면무조건 노이호텔 추천입니다 ,5,2년 전
yeogi_accom_009_9588,전주 노이 호텔,전주역과 전주한옥마을 중간에 위치해있으며 호텔앞에 편의점이 있고 먹거리 상권이 형성되어 있어 이용하기 너무 편리합니다사장님도 친절하시고 객실이 청결해서 기분까지 좋아집니다넷플렉스숙박시 1시퇴실가성비 최고강추합니다,5,2년 전
yeogi_accom_009_9589,전주 노이 호텔,전주역과 전주한옥마을 중간에 위치해있으며 호텔앞에 편의점이 있고 먹거리 상권이 형성되어 있어 이용하기 너무 편리합니다사장님도 친절하시고 객실이 청결해서 기분까지 좋아집니다넷플렉스숙박시 1시퇴실가성비 최고강추합니다,5,2년 전
yeogi_accom_009_9590,전주 노이 호텔,도착해서 처음 들어선 주차장은 넓고 쾌적해서 차를 주차하기 편했습니다 그리고 들어선 출입구에 준비된 커피와 얼음 토스트는  청결한 상태로 먹을 수 있었습니다객실 화장실 등 청결상태도 좋았습니다가격도 저렴하고 좋습니다,5,2년 전
yeogi_accom_009_9591,전주 노이 호텔,침대 푹신하고 조용해서 좋았어요 추천  침대 푹신하고 조용해서 좋았어요 추천  침대 푹신하고 조용해서 좋았어요 추천  침대 푹신하고 조용해서 좋았어요 추천  침대 푹신하고 조용해서 좋았어요 추천 ,5,3년 전
yeogi_accom_009_9592,전주 노이 호텔,오늘은 좀 불만족스럽네요 욕조 이용하려고 욕조 있는 방 예약했는데 없는 방으로 주시고 바꾼 방 욕조가 거품이 남아있어 기분이 좀 그랬네요 바닥재가 날카롭게 벗겨져 있어 위험했고요 오늘은 좀 그랬네요,4,1년 전
yeogi_accom_009_9593,전주 노이 호텔,출장을 자주다니다 보니 옵션을 검색하고 사진 이미지로만 판단해서 들어가다보니 본것과 달리 가면 실망을 많이 했는데여기는 깨끗하고 본것과 똑같아서 좋네요출장와서 편하게 잘쉬다 가네요,5,3년 전
yeogi_accom_009_9594,전주 노이 호텔,방 상태나  인테리어 등은 좋습니다 욕조도 두명 들어가기에 충분했어요 다만 는 두개 다 부팅이 되지 않아서 점검한번 하셔야할듯 합니다 시간이 늦어 연락 드리지 않았지만 도 이용을 하려했는데 못했네요ㅠ 게이밍의자라고 보기에도 어려워서 해당부분은 수정을 하시는게 더 좋지않을까 싶습니다,5,2년 전
yeogi_accom_009_9595,전주 노이 호텔,주말가격도 괜찮고 주차장도 넓어서 좋아요방도 큰편이고 욕실 화장실 분리라서 좋아요세면대랑 거울 있는곳 조명이 너무 어두워서 불편하긴했어요 ㅠㅠㅠㅠ 잘 쉬다갑니다,4,1년 전
yeogi_accom_009_9596,전주 노이 호텔,시설 인테리어부터 객실의 청결함까지 다 깨끗하고 좋아서 푹 쉴 수 있었습니다에어컨도 바람이 잘 나왔고 욕실도 깨끗해서 사용하는데 거부감이 없었습니다쉬는동안 잠깐 컴퓨터도 사용했는데 성능이 좋아서 잘 사용했습니다,5,2년 전
yeogi_accom_009_9597,전주 노이 호텔,조아요 ㅎㅎㅎㅎㅎㅎㅎㅎㅎㅎㅎㅎㅎㅎㅎㅎㅎㅎㅎㅎㅎㅎㅎㅎㅎㅎㅎㅎㅎㅎㅎㅎㅎㅎㅎㅎㅎㅎㅎㅎㅎㅎㅎㅎㅎㅎㅎㅎㅎㅎㅎㅎㅎㅎㅎㅎㅎㅎㅎㅎㅎㅎㅎㅎㅎㅎㅎㅎㅎㅎㅎㅎㅎㅎㅎㅎㅎㅎㅎㅎㅎㅎㅎㅎㅎㅎㅎㅎㅎㅎㅎㅎㅎㅎㅎㅎㅎㅎㅎㅎ,5,3년 전
yeogi_accom_009_9598,전주 노이 호텔,좋습니다좋습니다좋습니다좋습니다좋습니다좋습니다좋습니다좋습니다좋습니다좋습니다좋습니다좋습니다좋습니다좋습니다좋습니다좋습니다좋습니다좋습니다좋습니다좋습니다좋습니다좋습니다좋습니다좋습니다좋습니다,5,3년 전
yeogi_accom_009_9599,전주 노이 호텔,너무 깔끔하고 너무 깨끗하고 너무 청결해서 좋았어요 인테리어가 고급지고 좋았던 거 같아요 버스 정류장꽈도 가까퉈서 정말 좋아요 나중에 꼭 또 이용할게요 장서 잘 되세요,5,2년 전
yeogi_accom_009_9600,전주 노이 호텔,조금 춥긴 한데 전기장판 있어서 따뜻했어요 전체적으로 깨끗하고 직원분이 엄청 친절해요 ㅎㅎ,5,1년 전
yeogi_accom_009_9601,전주 노이 호텔,저번에 괜찮아서 재방문 했는데 확실히 동가격대 다른 숙박업체보다 좋네요 시설도 좋고 이번에 배정받은 방은 조금 좁지만 더 분위기 있고 좋았어요 다만 조금 아쉬운 점은 구석에 먼지같은게 쌓여있어서 좀 그랬는데 충분히 만족합니다,5,2년 전
yeogi_accom_009_9602,전주 노이 호텔,좋아요 ㅎㅎ 매번 이용하지만 여기가최고인것같아요 친절하시고 청결하고 소음도 없어요  충전기도 원하는걸로 다잇고 간단한 음식도 준비되어있고편의점도 바로 앞에 있어서 접근성도 정말 좋아요 전주오면 꼭 추천합니다,5,2년 전
yeogi_accom_009_9603,전주 노이 호텔,리뷰좋아요 ㅎㅎ매번 이용하지만 여기가 최고인것같아요  친절하시고 청결하고 소음도 없어요 충전기도 원하는걸로 다잇고 간단한 음식도준비되어있고 편의점도 바로 앞에 있어서접근성도 정말 좋아요전주오면 꼭 추천합니다,5,2년 전
yeogi_accom_009_9604,전주 노이 호텔,잘 이용하다 갑니다침대도 편하고 티비도 크고도 여러가지 있어서 좋아요잘 이용하다 갑니다침대도 편하고 티비도 크고도 여러가지 있어서 좋아요잘 이용하다 갑니다침대도 편하고 티비도 크고도 여러가지 있어서 좋아요잘 이용하다 갑니다침대도 편하고 티비도 크고도 여러가지 있어서 좋아요잘 이용하다 갑니다침대도 편하고 티비도 크고도 여러가지 있어서 좋아요잘 이용하다 갑니다침대도 편하고 티비도 크고도 여러가지 있어서 좋아요,5,1년 전
yeogi_accom_009_9605,전주 노이 호텔,잘 이용하다 갑니다침대도 편하고 티비도 크고도 여러가지 있어서 좋아요잘 이용하다 갑니다침대도 편하고 티비도 크고도 여러가지 있어서 좋아요잘 이용하다 갑니다침대도 편하고 티비도 크고도 여러가지 있어서 좋아요잘 이용하다 갑니다침대도 편하고 티비도 크고도 여러가지 있어서 좋아요잘 이용하다 갑니다침대도 편하고 티비도 크고도 여러가지 있어서 좋아요잘 이용하다 갑니다침대도 편하고 티비도 크고도 여러가지 있어서 좋아요,5,1년 전
yeogi_accom_009_9606,전주 노이 호텔,아침에 커피 라면 토스트 등으로 조식이 제공되고 생수도 추가로 비치해 놓고 있어 업무상 이용하기에는 좋은 거 같다다만 투숙객에 비해서 주차장이 넓다고는 할 수 없을 듯 하다,5,1년 전
yeogi_accom_009_9607,전주 노이 호텔,좋아요 ㅎㅎ매번 이용하지만 여기가 최고인것같아요  친절하시고 청결하고 소음도 없어요 충전기도 원하는걸로 다잇고 간단한 음식도 준비되어있고편의점도 바로 앞에 있어서 접근성도 정말 좋아요전주오면 꼭 추천합니다,5,2년 전
yeogi_accom_009_9608,전주 노이 호텔,너무 좋았어요 5시간이용에 만족함니다감사합니다 사장님,4,1년 전
yeogi_accom_009_9609,전주 노이 호텔,항상잘이용해요 좋습니다,4,1년 전
yeogi_accom_009_9610,전주 노이 호텔,조하용 내부 너무 예쁘게 생겨서 갈때마다 좋네용,5,3년 전
yeogi_accom_009_9611,전주 노이 호텔,항상친절해서 너무좋아요 시설도 ㅇ깔끔합니다,4,1년 전
yeogi_accom_009_9612,전주 노이 호텔,깔끔하고 좋네요 스타일러  슈드레서  까지 있어서 좋네요,4,1년 전
yeogi_accom_009_9613,전주 노이 호텔,이번 전주출장이라 근처에 방을 잡아야 해서 이곳에 예약을 하고 방에 들어가보니 방은 깔끔하고 좋았습니다 화장실도 깨끗하고 좋습니다 사장님도 친절하시네요 주차장도 넓어 주차하기 좋습니다,5,3년 전
yeogi_accom_009_9614,전주 노이 호텔,직원분 친절하셨습니다룸컨디션 좋았습니다,5,2년 전
yeogi_accom_009_9615,전주 노이 호텔,이번 출장이라  근처에 방을 잡아야 해서 이곳에 예약을 하고 방에 들어가보니 방은 깔끔하고 좋았습니다 화장실도 깨끗하고 좋습니다 사장님도 친절하시네요 주차장도 넓어 주차하기 좋습니다,5,2년 전
yeogi_accom_009_9616,전주 노이 호텔,이번 출장이라  근처에 방을 잡아야 해서 이곳에 예약을 하고 방에 들어가보니 방은 깔끔하고 좋았습니다 화장실도 깨끗하고 좋습니다 사장님도 친절하시네요 주차장도 넓어 주차하기 좋습니다,5,2년 전
yeogi_accom_009_9617,전주 노이 호텔,이번 출장이라  근처에 방을 잡아야 해서 이곳에 예약을 하고 방에 들어가보니 방은 깔끔하고 좋았습니다 화장실도 깨끗하고 좋습니다 사장님도 친절하시네요 주차장도 넓어 주차하기 좋습니다,5,2년 전
yeogi_accom_009_9618,전주 노이 호텔,전주에 놀러갈일이 있어서 2번째 숙박하는데 항상 갈때마다 좋네요 방도 깨끗하고 에어컨도 빵빵 근처에 단골로가는 밥집도 있는데 그곳이랑도 가까워서 너무좋아요  전주 올때마다 이용할게요,5,1년 전
yeogi_accom_009_9619,전주 노이 호텔,전주에서 가격도 저렴하고 시설도 좋아서 만족해요직원분들도 친잘하셔요주차장 만차되면 발렛도 해주십니다즐거운 전주여행 보내고 왔어요아 침구류 매우 푹신합니다  근처에 식당가도 많아요,5,2년 전
yeogi_accom_009_9620,전주 노이 호텔,숙소 깔끔하고 사장님이 친절하세요 자주 이용하고있습니다 ㅎㅎ                                                            ,5,1년 전
yeogi_accom_009_9621,전주 노이 호텔,디즈니가 되어서 좋았습니다다만 음식을 먹을 공간이 없어서 먹을때 불편했어요,4,2년 전
yeogi_accom_009_9622,전주 노이 호텔,숙소 근처에 편의점이 있어서 편리했고 주차공간이 작아서 약간 아쉬웠습니다 숙소 청소상태는 괜찮았어요 ㅎㅎㅎㅎ잘쉬다 나왔습니다 다음에도 다시 이용해도 괜찮을거 같아요,5,2년 전
yeogi_accom_009_9623,전주 노이 호텔,역시 전체적으로 숙소상태 깔끔해서 기분좋게 이용했습니다 다만 수건에서 담배냄새가 나서 이 부분만 조금 더 신경써주셨으면 좋겠습니다 주차장도 넓고 주차하기 편해서 다음에도 이용하겠습니다 ,5,2년 전
yeogi_accom_009_9624,전주 노이 호텔,안마의자 있어서 산행후 마사지는 좋았는데화장실 변기 수압이 너무 약해서 불안불안 했습니다 그 점 빼고는 괜찮았어요,4,1년 전
yeogi_accom_009_9625,전주 노이 호텔,객실이 넓고 푹 쉬기 좋아요 가성비 좋고 이 가격에 이정도 객실이면 나쁘지 않은거같아요 화장실도 깨끗하고 티비도 좋아요 침대도 푹신하고 또 오기 좋은거 같아요 다음번에 또 방문 할게요,5,2년 전
yeogi_accom_009_9626,전주 노이 호텔,잘쉬다갑니다 깔끔하고 친절해요 ㅎ,5,1년 전
yeogi_accom_009_9627,전주 노이 호텔,너무 깔끔하고 친절하셔서 기분이 좋았어요 인테리어가 정말 좋네요 들어가보니 객실이 엄청 넓었어요 티비도 정말 컸어요 컴퓨터도 잘 됐어요 다음에 또 전주 오게되면 방문할게요,5,2년 전
yeogi_accom_009_9628,전주 노이 호텔,깨끗하고 굉장히 좋았습니다,4,1년 전
yeogi_accom_009_9629,전주 노이 호텔,완전 깨끗했고 담배냄새도 진짜 1도 안나서 진짜 만족했어요 커피 같은 부가서비스도 좋았구요 닌텐도스위치 대여해서 종일 손목빠지게 했네요 ㅋㅋ 욕실위생도 깨끗했고 비와서 급해서 대실했는데 기분좋게 놀았네요 다음에도 방문할께요,5,1년 전
yeogi_accom_009_9630,전주 노이 호텔,매번 자주 이용하지만 항상 만족하는 곳입니다 그 이유에는 여러 가지가 있는데 그 중 가장 큰 이유는 청결함입니다 항상 청결하게 관리해주셔서 편하게 쉬다갈 수 있습니다 다음에도 또 올게요,5,1년 전
yeogi_accom_009_9631,전주 노이 호텔,저렴한 가격에 좋았어요 직원분 친절하시구요 허나 룸 작고 청소는  그냥 하룻밤 자기에는 적당했어요,5,2년 전
yeogi_accom_009_9632,전주 노이 호텔,주차장도 넓고 친절하세요대실 시간도 길고 깔끔해서 종종 이용합니다욕실도 잘 정돈되어있고 수압도 좋아요넷플 유튜브도 시청 가능해서 편하게 잘쉬다 올수 있어요 다음에 또 이용할게요,5,1년 전
yeogi_accom_009_9633,전주 노이 호텔,전주역과 전주한옥마을 중간에 위치해있으며 호텔앞에 편의점이 있고 먹거리 상권이 형성되어 있어 이용하기 편리합니다 음료 토스트 삶은달걀까지 로비에 비치되어 있음넷플렉스이벤트 숙박시 3시입실 1시퇴실가성비 좋음,5,3년 전
yeogi_accom_009_9634,전주 노이 호텔,방음도 잘되는편이고 주차공간이 넓어서 좋아요바로앞에는 편의점이있고 침대가 너무 푹신하고 편해서잠들면 못일어날정도에요 넷플릭스 보면서 쉬기에는 정말 가성비가 좋고 깔끔해요,5,2년 전
yeogi_accom_009_9635,전주 노이 호텔,청소 조금 더 신경써주세요욕조 청소상태가 불량했어요컴퓨터 뒤에 누가 껌을 뱉어놓았고 청소하지않아 그대로붙어있었음청소 아주머니들이 청소룰 제대로 보지 않고 하는듯함스타일러 사용 잘 하였음담배냄새는 안나서 좋았음,2,2년 전
yeogi_accom_009_9636,전주 노이 호텔,매번 올때마다 친절하시고시설도 깔끔하고 방도 업그레이드 해주실 때 많아서 너무 좋아요도 종류가 많아서 너무 좋아요청소도 매번 잘되어 있어서 너무 좋아요,5,1년 전
yeogi_accom_009_9637,전주 노이 호텔,너무 좋아서 또 왔어요 10월에 비해 가격이 조금 올라서 아쉽지만이번에도 매우 만족하고 갑니다저번 방은 좀 넓고 환한 방이었는데 이번 방은 아늑하고 어두운 방이더라구요 그래도 인테리어가 심플하니 이쁜거 같아요그리고 제일 중요한 푹신한 침대여서 너무 좋았습니다,5,3년 전
yeogi_accom_009_9638,전주 노이 호텔,깨끗하고ㅎㅎㅎ위치도 좋아요ㅎㅎㅎ애견동반도 가능한 룸이 별도로 있더라구요침대도 푹신합니당아 가운이좀많이작고 수건에서 냄새가 조금 났어요그런점만 빼면 만족스럽게 쉬었다 갑니당,5,1년 전
yeogi_accom_009_9639,전주 노이 호텔,너무 좋아요 닌텐도 이용했는데 잘 사용하고 갑니다샴푸랑 바디워시도 좋았고 티비도 잘 나오더라고요 평일에 좋은 가격으로 잘 이용한거같아요 주변에 바로 편의점도 있어서 위치도 참 좋아요,5,1년 전
yeogi_accom_009_9640,전주 노이 호텔,텔레비젼이 아주 커서 영화 감상 하기에 좋네요 잘 쓰고 갑니다,4,1년 전
yeogi_accom_009_9641,전주 노이 호텔,1전주 지방 출장시 숙박 하는곳입니다객실 상태는 아주 양호 하고 청결 또한 좋습니다주차장도  넓진 않지만 불편하지는 않습니다필요에 따라 발렛 해주세요주변에 먹거리 많구요 직원분들도 아주 친절합니다,4,2년 전
yeogi_accom_009_9642,전주 노이 호텔,조아요오 잘 이용했습니다,4,1년 전
yeogi_accom_009_9643,전주 노이 호텔,자주가는데 좋아요 생각보다 넓구 깔끔해요 전기장판도 있어서 좋았어요자주가는데 좋아요 생각보다 넓구 깔끔해요 전기장판도 있어서 좋았어요자주가는데 좋아요 생각보다 넓구 깔끔해요 전기장판도 있어서 좋았어요,5,3년 전
yeogi_accom_009_9644,전주 노이 호텔,주차나 객실상태는 좋았습니다 다만 욕실에서 샤워할때 바깥에서 실루엣을 볼수 있다는 점이 약간 신경 쓰였어요,4,2년 전
yeogi_accom_009_9645,전주 노이 호텔,방 깨끗했구요 여러가지 세면도구랑 드라이기까지 구비되있어서 푹 쉬다 갑니다시설은 말도 필요없이 깔끔했어용 재예약 의사 있을정도로 괜찮았구 이벤트 특가 랜덤객실로 예약했었는데 괜찮은방 배정해주셔서 좋았습니다,4,3년 전
yeogi_accom_009_9646,전주 노이 호텔,일찍갔는데  사장님이 받아주시고 친절하시네여  초콜릿도 서비스로 드리고 방도 깨끗하고 좋네요 근처에 관광할곳도 많아서 예약하면 좋을꺼같아요 다시 군산가면 또 가도 좋을꺼같아요 화장실도 깨끗해요 감사합니다,5,2년 전
yeogi_accom_009_9647,전주 노이 호텔,일단 넷플릭스 사용 가능이라서 갔는데 아이디 자체가 등록이 없네요그리고 가운 자체가 없어서 1층으로 내려가서 따로 말씀 드렸습니다 입욕제 욕조 등등 여러가지 있는데 욕조가 생각보다 너무 작아요 2인이상 들어가기엔 너무 좁다고 생각합니다 변기는 물이 안내려가서 답답했습니다 저희가 잠을 잤는데 늦게 일어나서 30분 정도 늦게 내려왔습니다 물론 저희가 잘못했지만 사전에 추가 비용은 생각도 못했습니다 30분에 1만원이 말이 되는지 미리 전화라도 한통 주시면 좋았는데 서비스 역대급 최악이네요,1,2년 전
yeogi_accom_009_9648,전주 노이 호텔,편하게 잘 갑니다 시설도 괜찮고 젛아요편하게 잘 갑니다 시설도 괜찮고 젛아요편하게 잘 갑니다 시설도 괜찮고 젛아요편하게 잘 갑니다 시설도 괜찮고 젛아요편하게 잘 갑니다 시설도 괜찮고 젛아요,5,2년 전
yeogi_accom_009_9649,전주 노이 호텔,1 사진과 같고 현 시즌에 방이 정말 따뜻합니다2바깥 내부와 소리 방음이 정말 좋습니다3가 정말 좋습니다 게임을 즐겨하는데 렉이 없습니다4 서비스 등등 다양한 장르를 즐길수 있습니다5직원 분이 정말 친절 합니다6한옥 마을 도 가깝고 금액대비 정말 가성비가 훌륭합니다7주변에 맛집이 많습니다강력 추천 합니다별다섯개푹 잘쉬다 갑니다,5,2년 전
yeogi_accom_009_9650,전주 노이 호텔,가격저렴하고 잘 묵고 갑니다다만 화장실 변기 욕조 객실 등위생 상태가 불량해요,4,1년 전
yeogi_accom_009_9651,전주 노이 호텔,이번 출장이라  근처에 방을 잡아야 해서 이곳에 예약을 하고 방에 들어가보니 방은 깔끔하고 좋았습니다 화장실도 깨끗하고 좋습니다 사장님도 친절하시네요 주차장도 넓어 주차하기 좋습니다,5,2년 전
yeogi_accom_009_9652,전주 노이 호텔,알바분이 친절해서 좋았습니다객실도 깨끗해서 이용 시 불편함을 안느꼈어요담배냄새도 안나서 좋았습니다기분 좋게 잘 쉬다 갑니다다음에도 또 이용할게요 감사합니다 ㅎㅎㅎ,5,1년 전
yeogi_accom_009_9653,전주 노이 호텔,너무 마음에 너무 마음에 너무 마음에 들었어요 너무 마음에 들었어요너무 마음에 너무 마음에 너무 마음에 들었어요 너무 마음에 들었어요너무 마음에 너무 마음에 너무 마음에 들었어요 너무 마음에 들었어요너무 마음에 너무 마음에 너무 마음에 들었어요 너무 마음에 들었어요너무 마음에 너무 마음에 너무 마음에 들었어요 너무 마음에 들었어요,5,1년 전
yeogi_accom_009_9654,전주 노이 호텔,갈 때마다 친절하시고 객실컨디션도 항상 좋은 편인 거 같아요 다만 아쉬운 점이 모든 오티티플랫폼 가능인데 가끔씩 로그인이 안되어 있어서 아쉽네요 그것 말고는 이번이용도 만족입니다,5,2년 전
yeogi_accom_009_9655,전주 노이 호텔,다른 곳이랑은 다르게 를 마음대로 볼수있어 좋았습니다 방 상태도 괜찮고 전기장판이 나와 따뜻했습니다,4,1년 전
yeogi_accom_009_9656,전주 노이 호텔,깨끗하고 시설이 좋습니다 재방문할게요,5,2년 전
yeogi_accom_009_9657,전주 노이 호텔,이번 출장이라  근처에 방을 잡아야 해서 이곳에 예약을 하고 방에 들어가보니 방은 깔끔하고 좋았습니다 화장실도 깨끗하고 좋습니다 사장님도 친절하시네요 주차장도 넓어 주차하기 좋습니다,5,2년 전
yeogi_accom_009_9658,전주 노이 호텔,세상에 매트리스 진짜 너무 마음에 들어서 꿀잠잤어요 시설도 준수하고 좋습니다 특히 저렴한 가격에 재미요소까지 더할수 있다는게 즐거웠어요 아 물론 악귀 보느라 빌린건 하지도 못했다는 후문이ㅎㅎ,5,1년 전
yeogi_accom_009_9659,전주 노이 호텔,좋습니다 항상이용해요,4,1년 전
yeogi_accom_009_9660,전주 노이 호텔,닌텐도 스위치 처음 해봤는데 남자친구랑 같이 할 수 있어서 좋았어요  편의점도 바로 앞에 있고 위치상 만족했습니당,4,1년 전
yeogi_accom_009_9661,전주 노이 호텔,전주에서 놀다가 아이와 체험할수있는 숙소여서 좋았습니다 시설도 친절도 굿입니다,4,1년 전
yeogi_accom_009_9662,전주 노이 호텔,전주 여행  중 후회없는 숙소 선택방도 깨끗하고 사장님도 친절 하셔서기분좋은 전주 여행 이였습니다 모든게 나이스 했던 전주 에서의 추억ㅎ,5,3년 전
yeogi_accom_009_9663,전주 노이 호텔,사장님도 너무친절하고 방도 한단계업 시켜주셔서 좋앗어요,5,1년 전
yeogi_accom_009_9664,전주 노이 호텔,객실도 엄청 깨끗하고 객실안에 냄새도 좋고 완전 만족했어요 ,5,1년 전
yeogi_accom_009_9665,전주 노이 호텔,전주여행 숙소로 찾다가 체험할 수 있는 방이 있어서 예약을 하게되었습니다 외관도 깔끔하고 조식코너도 토스트라면커피 등 다양하게 이용할 수 있어서 좋았습니다 다만 게임을 하기에 침대가 있다보니 원활하게 되지않아 기대보다 조금 아쉬웠지만 재밌게 이용했습니다 그리고 다른 리뷰에서 봤는데 진짜 화장실과 욕조가 보이는 구조유리벽에 자잘한 도트무늬 시트라 조금 당황했어요ㅎㅎ그래도 욕조도 있고 여행하는동안 잘 쉬다 갑니다,4,2년 전
yeogi_accom_009_9666,전주 노이 호텔,자주 이용하는 숙소입니다 청결하고 괜찮아요 ,5,3년 전
yeogi_accom_009_9667,전주 노이 호텔,닌텐도 게임을 할수있는 룸이 있어서 예약했는데 잘 놀았어요,4,1년 전
yeogi_accom_009_9668,전주 노이 호텔,체크인하러 남자 혼자 와서 그런지 정말 청결도 엉망이고 담뱀냄새는 찌들었고 방도 춥고 일부러 이런 방을 주신건지 여친이랑 같이 체크인 했으면 바로 바꿔 달라고 요청 했을텐데 객실관리에 신경쓰시길,1,2년 전
yeogi_accom_009_9669,전주 노이 호텔,외관이 깨끗하고 주위의 다른 모텔 대비 조금은 나아보입니다 사장님도 친절하시고 침대 매트리스도 괜찮습니다1층 프론트에 커피 생수도 충분하고 가격대비 만족합니다추천합니다,5,1년 전
yeogi_accom_009_9670,전주 노이 호텔,오랜만에 노이 호텔 갔는데 좋은 방으로 업그레이드 해주셔서 너무 감사했어요ㅜㅜ 방도 넓고 욕조도 커서 놀랐어요 티비도 커서 스위치랑 영화 보는데 편했구요 ㅎㅎ 덕분에 편히 쉬면서 놀았어요,5,2년 전
yeogi_accom_009_9671,전주 노이 호텔,출장으로 갔습니다 매분기마다 츨장을 다니는데요 스타일러스 있고 캄퓨터 좋은곳으로 픽을 하는편입니다 불편함 없이 좋앗습니다 그런데 청소면에서 안되잇엇습니다 털들이 많이 보이더라고요 청소빼고는 무난햇습니다 다음번에도이용할맘이 있습니다,5,1년 전
yeogi_accom_009_9672,전주 노이 호텔,항상 잘 사용하고있어요ㅎ방도 깨끗하고 청결해요ㅎㅎ,5,1년 전
