id,name,review_content,rating,write_date
yeogi_accom_009_8546,전주 노이 호텔,너무 맘에들었어용항상 대실은 노이만 옵니다 ㅎㅎ숙박도 해봤는데 진짜 가성비 최고입니당 노이대실시간두 길구 티비 화면도 커가지궁 넘 즐거웠어요올림픽보면서 푹 쉬구 침구류도 넘 푹신하구에어컨도 터보기능 잘되가지구 엄청 시원했습니당 화장실이랑 샤워부스가 분리되어있어서 넘 좋았구세면대도 따로 분리되어있어서 넘 편했어요유니크한 인테리어도 센스있구 전체적인 룸 컨디션이 최상이였네염 ㅎㅎ그리구 청소상태두 아주 훌륭했습니당 또 방문 할게용,5,10개월 전
yeogi_accom_009_8547,전주 노이 호텔,회사에서 전주로 이틀 출장와서 묵었던 숙소인데 전체적으로 깔끔하고 가격도 착해서 가성비가 좋았습니다 방에 컴퓨터와 가능한  큰 티비도 좋았고 조명도 너무어둡지도 밝지도 않아서 부담이 안됬습니다 숙박업체를 자주가는 업이라 본이아니게 많이가봐서 비교해보니 방냄새나 에어콘필터청소 그리고 화장실 청결함 같은게 매우 잘되있던 편이였습니다 굿굿    가끔 방에 비품이 없거나 컴퓨터 스피커가 안들리고 핸드폰 춤전기가 망가진곳도  있긴하지만 모든방이 그러진않고 충분히 납득할수있는 정도라 저는 이곳을 다른분께 추천합니닷 ,5,6개월 전
yeogi_accom_009_8548,전주 노이 호텔,시원하게 좋은 방에서 편하게 쉬다갑니다,5,6일 전
yeogi_accom_009_8549,전주 노이 호텔,다른지역으로 가야해서 늦은저녁에 잡은 숙소인데 건물이 성처럼 이뻐요 주차장의 넓어서 주차하는데 어려움없이 잘 했어요 방은 살짝 아담한 편인데 조명이 살짝 어두운 편이더라고요 욕실 앞쪽으로 세면대랑 거울이 있고 욕실과 화장실이 분리가 되어 있어서 좋았어요다만 드라이기랑 거울이 떨어져 있어서 머리손질할때 힘들더라고요 그리고 청소가 좀덜 되어 있어서 거울 테두리에 먼지가 엄청 많이 쌓여있었어요저희방만 그랬는지는 모르겠지만 바닦에도 장식물에도 먼저가 많았어요청소는 신경을 쫌 쓰셔야겠어요,4,4개월 전
yeogi_accom_009_8550,전주 노이 호텔,시설도 완전 좋고 엄청 친절하시고 객실이 청결상태가 좋았습니다,5,1년 전
yeogi_accom_009_8551,전주 노이 호텔,이번에도 출장으로 이용했습니다 언제나처럼 방이 깔끔하고 컨디션도 좋으니 만족하네요 방 크기도 혼자 쓰기 좋았습니다 그리고 담배냄새가 안나는게 진짜 만족했습니다   침구류도 따뜻하고 푹신푹신해서 잠도 잘 잤습니다 추위를 떨면서 일을 하다보니 잠도 금방 왔던 것 같네요ㅋㅋㅋ 스타일러도 있어서 작업복에 그나마 냄새도 날릴 수 있었습니다  욕실도 넓어서 좋았구요ㅎㅎ 욕조도 있어 러닝하고 와서 반신욕도 편하게 했습니다 덕분에 잘 쉬었다 갑니다,5,4개월 전
yeogi_accom_009_8552,전주 노이 호텔,우선 가장 인상 깊었던 점은 대실 가능한 시간이 6시간으로 다른 곳에 비해 되게 길었습니다 그래서 1차적으로 기분이 좋았구요 방에 들어 갔는데 시설도 괜찮아서 2차적으로 기분이 좋았습니다 또 청결하기도 하구요 욕실에 샴푸랑 바디워시도 냄새가 좋았습니다 방 크기랑 인테리어는 전체적으로 심플합니다 아 개인적으로 좀 아쉬운 점은 창문에서 빛이 조금 세어나옵니다 주차에 관해서 말하자면 주차장 크기는 평범하다고 보시면 됩니다 다음에 또 재방문 의사 있습니다 좋네요,4,9개월 전
yeogi_accom_009_8553,전주 노이 호텔,방이 청결해요시설이 깔끔해요뜨거운 물이 잘나와요전기장판이 따뜻해요침대가 푹신 푹신해요티비가 커요컴퓨터가 빨라요컴퓨터가 잘되요방이 아늑해요종류가 많아요배달이 가까워요조식이 빵 라면 등 몇게 있어요,5,5개월 전
yeogi_accom_009_8554,전주 노이 호텔,방이 청결해요시설이 깔끔해요뜨거운 물이 잘나와요전기장판이 따뜻해요침대가 푹신 푹신해요티비가 커요컴퓨터가 빨라요컴퓨터가 잘되요방이 아늑해요종류가 많아요배달이 가까워요조식이 빵 라면 등 몇게 있어요,5,5개월 전
yeogi_accom_009_8555,전주 노이 호텔,일단 모텔이 깔끔하니 만족햇고카운터 계시는분들 다들 친절하셔서 너무좋앗어요다만 객실 수 비해 주차장이 좀 작긴해여ㅠㅠ주차할곳없을땐조금고민할거같아요주변에 음식점도잇어서 그리고 바로앞에 편의점이 코앞에잇어서 먹고싶은거나 필요한게잇으면 가서 바로살수잇어서 위치또한너무좋앗어요욕실 진짜 호텔식처럼 깔끔해요티비는 가 다 되서 여러가지 보고 시청하고 그랫어요 객실 내 안마의자도 잇는거보고 숙박비용이 아깝진않아 너무 좋앗습니다감사합니다,5,5개월 전
yeogi_accom_009_8556,전주 노이 호텔,308호 다녀왔네요 추웠는데 잘 쉬다가요 다음에도 노이호텔로 다녀오려고요 아중리에서 제일 깨끗하고 청결한듯하네요 그리고 방도 은근 커서 심적으로 여유가 생깁니다 물도 올라가기 전에 2개까지 챙길 수 있게 해주셔서 물 넉넉하게 마실 수 있어서 감사합니다 ㅎㅎㅎ 항상 잘 이용하고 있습니다 전기장판도 따뜻하게 잘 가동되어서 잠도 잘 때 추운건 하나도 없었네요 거리도 가까워서 너무 편합니다 308호에 침대 위에 있는 등불이 배터리가 나간 것 같으니 이점만 참고해서 수리 한번 해주세요 불편한점은 전혀 없었 전화도 한번만 해주셔서 편했습니다,5,7개월 전
yeogi_accom_009_8557,전주 노이 호텔,이번에 이용한 모텔은 전반적으로 매우 만족스러웠습니다 체크인 과정도 간편하고 직원분들이 친절하게 응대해 주셔서 기분 좋게 시작할 수 있었습니다 객실은 예상보다 더 깔끔하고 침구류도 청결하게 관리되어 있어 편안하게 쉴 수 있었습니다 특히 욕실이 넓고 물이 잘 나오는 점이 좋았습니다 모텔 위치도 도심과 가까워 접근성이 뛰어나며 주변에 다양한 음식점도 있어 편리했습니다 가격 대비 시설이 훌륭한 곳이라 다시 방문할 의향이 있습니다 전반적으로 좋은 경험을 했고 추천할 만한 모텔입니다 관광지까지의 접근성이 뛰어나 여행을 더욱 즐겁게 만들어 주었습니다 가격 대비 시설이 훌륭한 곳이라 다시 방문할 의향이 있습니다 전반적으로 좋은 경험을 했고 추천할 만한 모텔입니다 추천 합니다 강력,5,5개월 전
yeogi_accom_009_8558,전주 노이 호텔,편하게 작업도 하고 쉬려고 대실했는데 우선 가격이 엄청 저렴한데 이용시간은 길어서 너무 좋았어요 가성비 미침 사장님도 친절하게 응대해주셔서 입실 전부터 기분이 좋았어요객실 컨디션 너무 깔끔하고 생각보다 넓어서 만족스러웠어요 특히 욕조 샤워공간이랑 변기랑 분리되어 있으니까 더 쾌적하더라구요방에서 일도 좀 하고 맛있는 것도 먹고 쉬고 여유롭게 시간 잘 보내다 갑니다 다음에 이 근처에서 숙박이나 대실할 일 있으면 무조건 다시 올 것 같은 곳이에요 완전추천,5,8개월 전
yeogi_accom_009_8559,전주 노이 호텔,강아지랑 이용 할려고 주변 애견 동반 숙소를 찾았는데 괜찮은 곳이 있어 이용 했습니다외관은 생각보다 좋았는데 내부가 ㅜㅜ 담배냄새가 너무 심했구요 뭐 사바사가 있고 개인 차가 있지만 사장님께서 조금 응대가 저희는 불편했습니다 그리고 객실 주변에 쓰레기나 복도에 쓰레기가 자꾸 발에 밟혀 잘못 가다 넘어질뻔한 기억도 나네요 다음 이용은 하고 싶지는 않지만 그래도 한번 이용 한걸로 만족 합니다,3,2개월 전
yeogi_accom_009_8560,전주 노이 호텔,변기에 손 안대도 자동이라 편했어요침대는 전기장판있어서 조절가능해요일찍 체크인해 들어올수있고 다좋았는데 방바닥에 보일러불이 저녁6시이후 들어온다고 해서 기다렸다가 샤워하려고 했는데 식사후에도 안들어왔지만 ㅜ싸우기 귀찮아 그냥 샤워씻고 후딱 침대로 들어갔어요더 추워지만 보일러 바닥에 불 들어와야할듯해요방바닥만 따듯하면 완벽했을듯하고위치가  전주역에서 멀긴 멀더라고요 시간이 많은 분은 괜찮을듯해요담에 가면 방바닥 따뜻하게 해주세요 ㅜㅡ흑,4,6개월 전
yeogi_accom_009_8561,전주 노이 호텔,시설도 좋고 주변 먹거리도 많고 추천해요,4,1개월 전
yeogi_accom_009_8562,전주 노이 호텔,여기 서비스 짱짱입니다다음에 놀러갈때 또 이용하고싶은 집 입니다 ㅎㅎ 고생하셔요,5,19일 전
yeogi_accom_009_8563,전주 노이 호텔,드디어 복귀 전날까지 묵었네요ㅋㅋㅋㅋㅋㅎㅎㅎㅎㅎㅅ 전주 출장으로 많이 묵긴 했지만 깔끔하고 방 컨디션도 좋아서 가격대비 가성비도 좋은 것 같습니다 침구류도 따뜻하고 푹신푹신해서 잠도 잘 잤습니다 또한 스타일러 덕분인지 작업복도 다음날에 그나마 상쾌하게 입을 수 있었습니다 욕조도 있어 러닝하고 와서 따뜻하게 반신욕도 했습니다 잠을 더 자느라 이용하지는 않았지만 1층에 69시까지 조식도 구비되어 있어 괜찬을 것 같습니다 덕분에 푹 쉬다 복귀합니다,5,4개월 전
yeogi_accom_009_8564,전주 노이 호텔,전주 출장으로 계속 노이를 이용 중입니다 늘 이용했던 것처럼 방도 깔끔하고 넓어서 좋네요   마침 작업할 수 있게 테이블도 놓여져 있어서 편하게 일을 마칠 수 있었습니다 전에 방처럼 화장실과 샤워부스로 구분되어 있지 않지만 좁지도 않고 해서 나름 좋았던 것 같습니다 스타일러도 편하게 사용할 수 있었습니다 운동하고 와서 운동복도 상쾌하게 돌렸습니다 욕조도 있어 반신욕도 편하게 했네요ㅎㅎㅎ 바로 앞에 편의점도 있어 저녁도 간단히 해결할 수 있었습니다 잘 쉬었다 가네요,5,4개월 전
yeogi_accom_009_8565,전주 노이 호텔,노이호텔에서의 숙박은 전반적으로 매우 만족스러웠습니다 우선 체크인이 신속하게 이루어져 장시간 이동 후에도 기다림 없이 바로 객실에 들어갈 수 있어 좋았습니다 방은 넓고 쾌적하며 청결 상태도 양호했습니다 특히 전기장판이 훌륭하여 추운 날씨에도 따뜻하고 편안하게 숙면을 취할 수 있었습니다 직원들의 서비스도 친절하고 세심했으며 퇴실 10분 전에 전화로 미리 안내해 주는 점도 인상적이었습니다 세심한 배려가 돋보이는 호텔로 편안한 휴식을 원하는 분들께 추천합니다,5,4개월 전
yeogi_accom_009_8566,전주 노이 호텔,청결상태 좋았구요 아늑하니 편안하게 숙박하고 왔습니다ㅎ,4,2개월 전
yeogi_accom_009_8567,전주 노이 호텔,가격 대비 매우 좋은 가성비를 자랑합니다 객실은 깔끔하고 현대적인 분위기로 잘 꾸며져 있으며 침대와 욕실 모두 편안하고 청결했습니다 기본적인 시설들이 잘 갖추어져 있어 불편함 없이 지낼 수 있었습니다 또한 호텔 위치가 중심지와 가까워 관광지나 주요 교통편으로의 이동이 매우 편리합니다 직원들도 친절하고 도움을 주기 위해 항상 준비되어 있어 서비스 면에서도 만족스러웠습니다 가격에 비해 서비스와 시설이 훌륭하여 가성비를 중요시하는 여행객에게 특히 추천할 만한 호텔입니다,5,6개월 전
yeogi_accom_009_8568,전주 노이 호텔,숙소저렴하고 빠른입실시간이 장점인곳입니다도 다양하게이용 할수있어서 너무좋습니다각방에 물2개 음료2개구비되어있습니다 로비에 객실당 음료2개 더 가져갈수있도록되어있으니저처럼물먹는하마이신분들은 따로챙겨가셔도될듯합니다한가지아쉬운건 청소상태입니다 욕실 청소는 하시는건지물만뿌리는건아닌지 군데군데 곰팡이가 너무 많습니다 곰팡이제거좀하셔야할듯합니다 침대커버에도 오물이그대로묻어있습니다위생상태 빼면 정말 완벽할거같습니다ㅈㅂ딛ㅂㅈㄱㄷ,5,4개월 전
yeogi_accom_009_8569,전주 노이 호텔,청결하고 조용하고 너무 잘 쉬었다가 갑니다 헌데 욕실 샤워기줄이 파손 되어서 빠른 보수가 필요할듯 싶네요 샤워하는데 애 먹었네요 다음에도 다시 오겠습니다 사장님도 너무 친절하고 좋아요,4,7개월 전
yeogi_accom_009_8570,전주 노이 호텔,노이호텔 바로 앞에 편의점이있어요1분거리 도 아니고 진짜 걸어서 5초면 가요 ㅎㅎㅎ그래서 중간에 과자나 먹을거리나 필요한거 사러가기에 정말 좋구요 티비도 진짜 보기 짱좋은 티비입니당 그리구 요즘 날씨에 제일 좋은건 전기장판 전기장판 없는 호텔들두 의외로 많더라구요 ㅠㅠ그래서 들어가자마자 장판있는지부터 확인했어요 ㅎㅎ 그리고 프론트에 계신 언니분도 너무 친절 하시궁 시설도 깔끔해서 다음부터 여기만 방문할것같아요 난방만 조금 신경 써주세용,5,5개월 전
yeogi_accom_009_8571,전주 노이 호텔,잘놀다가요 또올께요,4,17일 전
yeogi_accom_009_8572,전주 노이 호텔,노이는 언제가도 친절하고 편해요 위치도 먹자골목에 위치해있어서 근처에서 저녁먹기도 편하더라구요 아 그리고 도 여러가지 이용할 수 있는것도 아주 큰 장점이에요  노이는 언제가도 친절하고 편해요 위치도 먹자골목에 위치해있어서 근처에서 저녁먹기도 편하더라구요 아 그리고 도 여러가지 이용할 수 있는것도 아주 큰 장점이에요  노이는 언제가도 친절하고 편해요 위치도 먹자골목에 위치해있어서 근처에서 저녁먹기도 편하더라구요 아 그리고 도 여러가지 이용할 수 있는것도 아주 큰 장점이에요,5,4개월 전
yeogi_accom_009_8573,전주 노이 호텔,항상 방문하는 곳인데 매번 방문시 마다 만족 또 만족합니다 시트와 배게 이불들이 깨끗하고 담배 냄새도 전혀 나지 않고  편안한 향기가 숙소내에서 나니깐 마음까지 너무 편안학 쉴 수 있었습니다숙소 컨디션이 매우 청결하고 기분이 좋습니다방문시마다 너무 너무 만족도가 높은 숙소입니다또한 숙소 주위에 식사를 맛있게 할수 있는 맛집들과 편의점들이 많이 있어서 너무나 편리했습니다밤에 술 한잔 생각날때도 숙소에서 몇걸음만 나가도 기분전환 할수 있어서 좋았습니다 전체적인 만족및 적극 추천 드립니다,5,4개월 전
yeogi_accom_009_8574,전주 노이 호텔,노이 올때마다조아용근처 편의점 밥집 가까워서넘좋아요ㅋㅋ,5,12일 전
yeogi_accom_009_8575,전주 노이 호텔,항상 방문하는 곳인데 매번 방문시 마다 만족 또 만족합니다 시트와 배게 이불들이 깨끗하고 담배 냄새도 전혀 나지 않고  편안한 향기가 숙소내에서 나니깐 마음까지 너무 편안학 쉴 수 있었습니다숙소 컨디션이 매우 청결하고 기분이 좋습니다방문시마다 너무 너무 만족도가 높은 숙소입니다또한 숙소 주위에 식사를 맛있게 할수 있는 맛집들과 편의점들이 많이 있어서 너무나 편리했습니다밤에 술 한잔 생각날때도 숙소에서 몇걸음만 나가도 기분전환 할수 있어서 좋았습니다그리고 1층 프론트에 얼음정수기도 있고 커피 맛집으로  추천해도 될정도로 맛있는 커피머신이 있어 이 숙소를 방문할때마다 커피를 맛있게 마시고 오는 사람중에 1인입니다,5,8개월 전
yeogi_accom_009_8576,전주 노이 호텔,항상 방문하는 곳인데 매번 방문시 마다 만족 또 만족합니다 시트와 배게 이불들이 깨끗하고 담배 냄새도 전혀 나지 않고  편안한 향기가 숙소내에서 나니깐 마음까지 너무 편안학 쉴 수 있었습니다숙소 컨디션이 매우 청결하고 기분이 좋습니다방문시마다 너무 너무 만족도가 높은 숙소입니다또한 숙소 주위에 식사를 맛있게 할수 있는 맛집들과 편의점들이 많이 있어서 너무나 편리했습니다밤에 술 한잔 생각날때도 숙소에서 몇걸음만 나가도 기분전환 할수 있어서 좋았습니다그리고 1층 프론트에 얼음정수기도 있고 커피 맛집으로  추천해도 될정도로 맛있는 커피머신이 있어 이 숙소를 방문할때마다 커피를 맛있게 마시고 오는 사람중에 1인입니다,5,8개월 전
yeogi_accom_009_8577,전주 노이 호텔,항상 방문하는 곳인데 매번 방문시 마다 만족 또 만족합니다 시트와 배게 이불들이 깨끗하고 담배 냄새도 전혀 나지 않고  편안한 향기가 숙소내에서 나니깐 마음까지 너무 편안학 쉴 수 있었습니다숙소 컨디션이 매우 청결하고 기분이 좋습니다방문시마다 너무 너무 만족도가 높은 숙소입니다또한 숙소 주위에 식사를 맛있게 할수 있는 맛집들과 편의점들이 많이 있어서 너무나 편리했습니다밤에 술 한잔 생각날때도 숙소에서 몇걸음만 나가도 기분전환 할수 있어서 좋았습니다그리고 1층 프론트에 얼음정수기도 있고 커피 맛집으로  추천해도 될정도로 맛있는 커피머신이 있어 이 숙소를 방문할때마다 커피를 맛있게 마시고 오는 사람중에 1인입니다,5,8개월 전
yeogi_accom_009_8578,전주 노이 호텔,거울에 누르면 불빛나오게 한 거 좋아요,5,1일 전
yeogi_accom_009_8579,전주 노이 호텔,항상 방문하는 곳인데 매번 방문시 마다 만족 또 만족합니다 시트와 배게 이불들이 깨끗하고 담배 냄새도 전혀 나지 않고  편안한 향기가 숙소내에서 나니깐 마음까지 너무 편안학 쉴 수 있었습니다숙소 컨디션이 매우 청결하고 기분이 좋습니다방문시마다 너무 너무 만족도가 높은 숙소입니다또한 숙소 주위에 식사를 맛있게 할수 있는 맛집들과 편의점들이 많이 있어서 너무나 편리했습니다밤에 술 한잔 생각날때도 숙소에서 몇걸음만 나가도 기분전환 할수 있어서 좋았습니다 추천 드리고 싶습니다,5,5개월 전
yeogi_accom_009_8580,전주 노이 호텔,깨끗하고 주차장 좋고 친절하십니다,5,11일 전
yeogi_accom_009_8581,전주 노이 호텔,침대도편하고   좋았어요 앞으로도 자주이용하려구요,5,10일 전
yeogi_accom_009_8582,전주 노이 호텔,전주 노이호텔은 깔끔하고 세련된 디자인이 인상적인 숙소로 한옥마을과 가까워 관광에 매우 편리합니다 객실은 넓고 현대적인 감각으로 꾸며져 있어 편안한 분위기를 제공하며 침대와 침구류의 청결 상태가 매우 좋아 숙면을 취할 수 있는 환경이 잘 갖춰져 있습니다 특히 먼지가 나는 커튼 대신 나무 문으로 창문을 막아둔 점이 매우 만족스러워 많은 이용객들이 이를 높이 평가하고 있습니다 직원들의 친절한 서비스 또한 전반적인 만족도를 높이는 요소로 작용합니다 전주에서 깨끗하고 편안한 숙박을 원한다면 노이호텔은 훌륭한 선택이 될 것입니다,4,10개월 전
yeogi_accom_009_8583,전주 노이 호텔,항상 방문하는 곳인데 매번 방문시 마다 만족 또 만족합니다 시트와 배게 이불들이 깨끗하고 담배 냄새도 전혀 나지 않고  편안한 향기가 숙소내에서 나니깐 마음까지 너무 편안학 쉴 수 있었습니다숙소 컨디션이 매우 청결하고 기분이 좋습니다방문시마다 너무 너무 만족도가 높은 숙소입니다밤에 술 한잔 생각날때도 숙소에서 몇걸음만 나가도 기분전환 할수 있어서 좋았습니다그리고 1층 프론트에 얼음정수기와 커피머신이 있어 이 숙소를 방문할때마다 커피를 맛있게 마시고 오는 사람중에 1인입니다,5,7개월 전
yeogi_accom_009_8584,전주 노이 호텔,처음 노이호텔을  숙소로  갔는데 리뷰가좋아서요 아이가 둘이라 2있는 방으로 정했습니다 첨  컴이상이있어서사장님이 다른 방으로 교체해주심  더좋은방으로요ㅋ근데  스타일러가있드라고여ㅎㅎ숙소에있는거 첨봤으요 ㅋ 아이가둘이라 침구셋트도 하나 에서 더 주시고 넘 친절하셨어요젤좋은건 조식이 있다는거  라면 토스트콘푸라이크아메리카노까지글구얼음까지  아이들이 든든하게먹고 저흰 속풀이잘했답니다 가격대비 넘좋은듯요전주이미지가  확 더좋아짐담 놀러갈때 또 노이로 갈거에요,5,11개월 전
yeogi_accom_009_8585,전주 노이 호텔,편안한 시간 잘 보내고 왔네요,4,27일 전
yeogi_accom_009_8586,전주 노이 호텔,전주 출장 중에 이용했습니다 방 컨디션 좋고 냄새도 안나서 만족했습니다 아늑하고 해서 잠도 잘 잤던 것 같네요 티비도 큰 편이어서 좋았고 누워서 편하게 볼 수 있었습니다ㅎㅎ 냉장고에는 물 2개와 음료 2개 비치되어 있습니다 가격대비 방이 좋습니다 그래서 전주 올 때마다 이 곳만 이용하는 것 같네요 스타일러 있는 방 주셔서 스타일러도 사용할 수 있었습니다 주차장도 좁지 않은 편이라 큰 차 임에도 불구하고 주차도 편했네요 덕분에 잘 쉬었습니딘 다음에 또 방문할게요,5,3개월 전
yeogi_accom_009_8587,전주 노이 호텔,강아지와 같이 전주에 놀러와서 강아지랑 함께 묵을 곳을 찾다가 노이호텔을 발견했습니다 사실 선택지가 많지 않음 숙소에서 체크인할 때 강아지를 위한 배변패드 방석 간식 밥물그릇을 제공해주셨고요 따로 사료만 챙겨가면 돼서 너무 편했습니다주차공간도 넉넉하고 들어갔을 때 침구류나 청결상태도 너무 좋았습니다 다만 컴퓨터를 이용할 때 의자가 너무 불편해서 장기간 앉아있지 못했습니다바로 앞에 편의점도 있고 주변에 산책하기 좋은 공원이 있고 술집도 있어서 위치도 좋은 거 같습니다 강아지와 함께 재방문 할 거 같습니다 추천,5,9개월 전
yeogi_accom_009_8588,전주 노이 호텔,강아지와 같이 전주에 놀러와서 강아지랑 함께 묵을 곳을 찾다가 노이호텔을 발견했습니다 사실 선택지가 많지 않음 숙소에서 체크인할 때 강아지를 위한 배변패드 방석 간식 밥물그릇을 제공해주셨고요 따로 사료만 챙겨가면 돼서 너무 편했습니다주차공간도 넉넉하고 들어갔을 때 침구류나 청결상태도 너무 좋았습니다 다만 컴퓨터를 이용할 때 의자가 너무 불편해서 장기간 앉아있지 못했습니다바로 앞에 편의점도 있고 주변에 산책하기 좋은 공원이 있고 술집도 있어서 위치도 좋은 거 같습니다 강아지와 함께 재방문 할 거 같습니다 추천,5,9개월 전
yeogi_accom_009_8589,전주 노이 호텔,강아지와 같이 전주에 놀러와서 강아지랑 함께 묵을 곳을 찾다가 노이호텔을 발견했습니다 사실 선택지가 많지 않음 숙소에서 체크인할 때 강아지를 위한 배변패드 방석 간식 밥물그릇을 제공해주셨고요 따로 사료만 챙겨가면 돼서 너무 편했습니다주차공간도 넉넉하고 들어갔을 때 침구류나 청결상태도 너무 좋았습니다 다만 컴퓨터를 이용할 때 의자가 너무 불편해서 장기간 앉아있지 못했습니다바로 앞에 편의점도 있고 주변에 산책하기 좋은 공원이 있고 술집도 있어서 위치도 좋은 거 같습니다 강아지와 함께 재방문 할 거 같습니다 추천,5,9개월 전
yeogi_accom_009_8590,전주 노이 호텔,가격도 저렴하게 이용했는데 시설도 조식 서비스도 모두 만족하여 적극 추천합니다,5,1개월 전
yeogi_accom_009_8591,전주 노이 호텔,좋아요 항상 애용 하고 있어요 주차장도 잘 되어 있고 전기장판도 따뜻하고  도 웬만한 건 다 잘 됩니다 다만 방이 조금 추워서 목이 칼칼하고 아팠어요 날씨가 추워져서 그런 거 같아요 그리고 금연 객실읹 줄 알았는데 아닌가봐요 담배 냄새 좀 나더라구오 이건 비흡연자들은 조금 불편 할 거에요 저는 입퇴실 시간을 딱 맞춰서 이용 하는데 다른 곳은 막 재촉 전화 하는데 여기는 그런 거 없이 편하게 이용 할 수 있게 해주니까 항상 마음 편하게 올 수 있었어요 집이랑도 가깝고 쉬러 자주 옵니다,3,7개월 전
yeogi_accom_009_8592,전주 노이 호텔,조용히 편하게 쉬다가 갑니다 감사합니다,5,26일 전
yeogi_accom_009_8593,전주 노이 호텔,항상 저렴한 가격에 잘 이용하고 있습니다,4,13일 전
