id,name,review_content,rating,write_date
yeogi_accom_017_18772,전주 호텔모아,사장님이 엄청 친절해서 좋습니다,5,3개월 전
yeogi_accom_017_18773,전주 호텔모아,적당히 청결하고 시설 괜찮아요친절한지는 모르겠어요,2,4개월 전
yeogi_accom_017_18774,전주 호텔모아,너무 좋습니다 다른곳 고민도 말고 모아,5,3개월 전
yeogi_accom_017_18775,전주 호텔모아,객실은 깨끗하고 사장님이 친절하게 해주셔서출장 잘 다녀왔어요 다음에 또 갈께요,3,5개월 전
yeogi_accom_018_18776,전주 브라운도트 아중지구점,전주의 조용한 밤을 닮은 호텔  브라운도트 아중지구점낯선 도시의 밤이 낯설지 않게 느껴질 때그건 아마 숙소가 마음에 쏙 들었을 때다전주 브라운도트 아중지구점에서의 하룻밤은 그런 느낌이었다차로 진입하면 눈에 띄는 모던한 외관많이 꾸미지 않아도 단정하고 정돈된 분위기입구에서부터 묵직한 차분함이 느껴졌다로비는 고요한 음악과 함께 따뜻한 조명이 반겨주고체크인을 도와주던 직원의 말투는 마치 오래된 전주의 카페 사장님처럼 부드러웠다커피 한 잔을 손에 들고 객실로 향했다객실은 편안하게 그리고 조용하게방에 들어서자마자아 오늘 잠 잘 자겠다라는 말이 절로 나왔다이불은 폭신했고 조명은 부드러웠으며무엇보다 외부 소음 하나 없이 조용했다바닥 가구 침구까지 깔끔하게 정돈된 룸 컨디션은누군가가 정성껏 준비해둔 작은 쉼터 같았다욕조가 있는 방을 선택한 덕분에저녁엔 따뜻한 물에 몸을 담그고넷플릭스 한 편을 틀어 두었다여행이라는 말이 꼭 바쁘게 움직여야 한다면나는 이제 그 정의를 바꾸고 싶다가정의 달 전주 그리고 작은 쉼가정의 달에 가족여행을 계획한다면이런 조용한 호텔에서의 하루는 어쩌면 가장 큰 선물이 될지도 모른다너무 유명하지도 너무 평범하지도 않은딱 지금 이 순간에 필요한 균형감 있는 공간나는 여기어때 앱에서 이곳을 발견했고예약을 마치고 나서야괜찮은 선택이었기를하고 혼잣말을 했다결과는 트립홀릭 리뷰에 남길 만큼 만족스러웠다여행정보 스티커북교통수단전주역 로 도착 후 택시 약 10분시외버스터미널 대중교통도 이용 가능자차 주차공간 넉넉하고 접근성 좋아요숙소 꿀팁욕조 있는 방 선택 하루가 다르게 회복됨고층 객실 요청 밤 풍경 은근히 예쁨조식은 없지만 근처 베이커리 천국 브런치 투어 추천한줄 정리전주 여행에서 하루쯤은 말없이 위로해주는 숙소가 필요하다면 이곳이 딱이다,4,1개월 전
yeogi_accom_018_18777,전주 브라운도트 아중지구점,1 위치  전북 전주시 아중지구 덕진공원 인근2 주차장  10대 이상3 로비  매우 친절4 객실 청결 상태  매우 청결5   넷플릭스 유튜브 티빙6 냉장고  물 음료 커피7 방 크기  매우 넓음8 뷰  씨티뷰9 먹을거리  10분 내 많음10 아쉬운 점  없음11 재방문 의사  무조건 방문12 조식  간편조식13 총평출장 고객입니다좋은 가격에 좋은 숙소 감사합니다 위생적으로 우수하여 매우 만족합니다 항상 지금처럼 유지할 수 있도록 관리 부탁 드립니다 감사합니다,5,1개월 전
yeogi_accom_018_18778,전주 브라운도트 아중지구점,출장을 여러군데 다니는데 여기숙소는 이용하기에 정말 괜 찮 은 숙소였습니다객실도 생각보다 깨끗하고 넓어서 분위기 냄새도 좋고 화장 실 수압도 괜찮고 수건도 도톰하고 물도 잘 빠져서 좋습니다조명도 은은한게 티비도 크고 리모콘도 깨끗했습니다근처에 식당도 많고 볼거리도 있고 직원들도 친절은기본이고 가격도 괜찮고 여러모로 만족해서 기분좋게 머무르다 갑니다  모두이용해 보세요 정말정말 좋습니다담에도 또 이용하겠습니다,5,2개월 전
yeogi_accom_018_18779,전주 브라운도트 아중지구점,20년째 출장중 입니다출장 하면서 안성맞춤 입니다다음에도 방문 할것 같습니다 1 주차시설주차장 충분 합니다  차량 주차 걱정 없습니다맞은편 무료 공영주차장도 있습니다2 친절 서비스친철 합니다3 청결 및 기타시설수압 잘 나오고 뜨거운물 잘 나옵니다냄새 없고 깨끗합니다 점호해도 됩니다넷플릭스 되고 공기 청정기 됩니다대형 있습니다 밤에 잘때 모기가 없습니다침대 깨끗하고 이불 깨끗 합니다배개 4개 있습니다일반 숙박시설 가서 침대에 누우면 간지러운데 여기는 그렇지 않습니다위생이 청결된 느낌 입니다4 주위 먹거리많이 있습니다아구 뚝배기 식당이 있는데 속풀이 최고 입니다5 운동 및 산책아중호수가 있는데 산책로 하기 좋습니다주위에 볼거리 있습니다6 노트북 사용 가능합니다콘센트 잘되어 있습니다커피포트 있습니다생수 2개 있습니다7 방음소음아주 조용 합니다창문 열면 차소리 조금 납니다8 조식식빵라면 등 있습니다,5,7일 전
yeogi_accom_018_18780,전주 브라운도트 아중지구점,최근에 이 모텔에서 1박을 했는데 전반적으로 만족스러웠습니다 객실은 깔끔하고 청결 상태가 매우 좋았으며 침대도 푹신해서 편안하게 잘 수 있었습니다 에어컨과  등 기본적인 시설도 잘 작동했고 욕실에는 수건과 어메니티가 충분히 구비되어 있어 따로 준비할 필요가 없었습니다 프런트 직원도 친절하게 응대해 주셔서 체크인과 체크아웃이 수월했어요 특히 조용한 분위기 덕분에 휴식하기에 정말 좋았습니다 주변에 편의점과 음식점도 가까워서 위치적으로도 편리했습니다 다음에 근처에 올 일이 있다면 재방문하고 싶은 곳입니다 가격 대비 만족도가 매우 높아요,5,17일 전
yeogi_accom_018_18781,전주 브라운도트 아중지구점,비즈니스 출장으로 혼자 호텔을 이용했습니다 친절한 사장님과 직원들이 맞이해주었고 방 컨디션 또한 최상이었습니다 이제 성수기 시즌이라 출장으로 이용하기는 어렵겠지만 가족들과 함께 시즌에 이용하기 아주 숙소인것 같습니다 바베큐장과 수영장을 갖추고 있어서 이용시 편리하며 바로 앞에 해변 및 일모루감강을 직관할 수 있습니다 인근 상가와도 거리가 가까우며 맛집들이 근처에 많습니다 가까운거리내에 은행 마트 음식점 등 모든 편의시설이 다 갖추어져 개인업무 보기에도 용이하며 아주 좋은 곳에 위치해 있습니다,5,16일 전
yeogi_accom_018_18782,전주 브라운도트 아중지구점,화장실문이 유리문인 곳 너무 싫어하는데 이곳은 중문이 있어서 괜찮았어요 그리고 복도가 깔끔해서 비즈니스호텔 같았어요 프론트에 식빵이랑 쿠키 그리고 음료 편하게 먹을 수 있게 구비되어있는 곳도 좋고 공영주차장이 있어서 좋더라구요 자체적 주차장이 제일 좋지만 아니어도 무료 주차장이 가까워서만족 스러웠어요다음에 다시 이용할것 같아요,4,11일 전
yeogi_accom_018_18783,전주 브라운도트 아중지구점,전주 브라운도트 아중지구점  조용한 휴식의 정석전주는 언제 가도 좋은 도시지만 특히 가정의 달인 5월엔 어쩐지 더 특별하게 느껴진다그 중에서도 이번에 다녀온 브라운도트 호텔 전주 아중지구점 이곳은 소음 제로  감성 플러스의 정석이었다로비부터 심상치 않다첫인상은 역시 로비군더더기 없이 깔끔한 디자인에 친절한 직원 응대로 피로가 절반 사라진 기분프런트 옆에 살짝 배치된 커피머신에서 뽑은 따뜻한 라떼를 들고 엘리베이터에 오르는 순간 아 이번 여행  숙소 잘 잡았다 싶었다객실  감성과 실용의 교차점룸컨디션은 여행전문가들인 트립홀릭들도 반할  좋아할 만한 스타일 침대는 말 그대로 포근 포근 탄탄한 매트리스에 폭신한 베개는 꿀잠 예약 조명과 컬러톤이 차분해서 쉬기 최적화 욕조 완비 반신욕 가능 여행의 피로를 말끔히 씻어준다 에 넷플릭스 연결됨 혼자 보는 드라마 한 회 세상 힐링심지어 룸 안에 무선 충전기 공기청정기 넉넉한 콘센트 배치까지여기어때 앱에서 예약한 거 인생 선택 인정한줄 정리전주에서 소리 없이 감탄하게 되는 조용한 쉼터 브라운도트 아중지구점장점 요약 고급스러운 인테리어  방음 잘되는 객실 넉넉한 어메니티와 가성비 좋은 룸 혼자든 가족이든 만족도 100 예약은 여기어때에서 깔끔하게 여행정보란 맛집 추천1 현대옥 콩나물국밥  숙취엔 이만한 해장이 없음2 전주중앙회관 비빔밥  한옥마을 근처 정통 전주 비빔밥3 서신동 백년가게 갈비탕 뜨끈하고 깊은 국물 맛 4 열정 아구-   도보 1분 거리 추천 맛집교통수단 전주역  택시 타면 호텔까지 약 10분 시외버스터미널  근처 버스노선 다양 자차 이용 시  아중지구 위치 좋아서 주차 편함숙소 꿀팁 고층 요청 필수 야경이 한 폭의 그림 공원 뷰 추천 체크인 시 욕조 여부 확인  반신욕 꼭 해봐야 해요 근처 맛집 많으니 꼭 동네 투어도 해볼 것전주에서 잠깐 쉬고 싶다면시끌벅적한 여행지보다 조용한 감성호텔 하나가 훨씬 좋을지도브라운도트 아중지구점 다음에도 또 묵을 의향 200입니다,4,1개월 전
yeogi_accom_018_18784,전주 브라운도트 아중지구점,이곳은정말 직원분때문에 간다고해도 과언이아닐정도로 인포에계신 친절하신 정장비슷하게입으시는 야간에주로계시는 좀 슬림해보이시는 남자분 때문에 자주찾는곳이예요솔직히예약하기정말힘들거든요인기가아주많은곳이예요 왜냐면 저같이 직원분때문일수도ㅋㅋㅋㅋ  시설이일단 참좋고위치가 아중리 번화가중심에있어요솔가밑라인 조개꽃천지 맞은편이라서 어디든쉽게다닐수있는 아주좋은 위치에 뷰자체가 답답하지않아서 창문으로보이는하늘이 참 모텔촌같은 느낌이없어 너무만족스러워요 총 12박이상 이곳에서 숙박을 했었구요 따지고보면 30일이상 이곳을애용했겠네요 객실청결도는 솔직히 예전만하진못해요객실먼지가날리고 공청기주변에쓰레기도안치워지거나화장실부분에머리카락도그대로있기도하고그럼에도불구하고 인테리어적인부분이나 가격적인부분 위치적인요소들이 다른곳들대비뒤지지않기에 항상찾고애용하고 직원분이 너무친절하셔서 찾게됩니다 이렇게길게리뷰를쓰는일자체가없어요근데꼭 이브라운도트는 그직원분한테 잘해주셔야할것같습니다 저같이느끼시는분이 정말많으실것같아요 항상웃는낯으로 고객응대한다는것이 쉬운일도아니고 고객한분한분지나가는객을 기억해준다는것도 쉬운일이아닐텐데 참 기억에남습니다 호텔급도있지만 굳이이곳을애용하는이유기도하고 시설적인부분 위치적인부분 가격적인부분 모두뒤지지않으니 더자주찾아야겠네요 이번주도얼른예약해야겠어요저희는업무상주말에무조건내려오는데 이곳은꼭 저희주말집같으네요  객실컨디션만 더개선되면 100점만점에 500점줄것같아요달걀감사히잘먹었습니다너무고마웠어요,5,1년 전
yeogi_accom_018_18785,전주 브라운도트 아중지구점,숙소 청결상태 아주 훌륭했고 조식도 라면이랑 토스트 쿠키 등 좋았어요 사장님께서도 친절하셨구요 위치도 좋았습니다 잘 쉬다 갑니다,5,2개월 전
yeogi_accom_018_18786,전주 브라운도트 아중지구점,지방에 일이 많아 출장을 자주다니는 일을해서 지역별로 숙박업소를 자주이용하는 일인입니다지방 출장시  자주 이용하는 숙소입니다직원분들이 항상 웃잘챙겨주시네요웃는얼굴로 친절하게 맞아주시고필요한것  있으면            청결상태도 화장실 깨끗하네요 침구도 깔끔하게 정리되어있고   깨끗하네요방음도 잘되어서 옆방소음도   들리지 않았습니다추가로 필요한 물품도 요청하면 편하게   잘챙겨주네요     배게도 높지않아서 숙면을 취했네요편하게 잘쉬다가 갑니다다음  출장시도 또올께요항상 번창하세요,5,1개월 전
yeogi_accom_018_18787,전주 브라운도트 아중지구점,자주 방문합니다 출장중에 방문 하는곳 입니다예전에는 라면이 준비되어서 먹었는데 이젠 자판기로 이용해서 먹으면 됩니다 여긴 커피 맛집입니다객실 상태는 예전에 마음에 들어서 왔는데 이번에도 깨끗한 침구류 욕실 물 수압좋고 깨끗하고 특히 방안에 담배 냄새가 나지않아서 좋은듯 합니다추운날씨라서 패딩을 입고 다니는데 스타일러덕에 다음날에 깔끔한 옷으로 출근할수 있어서 좋아요티브이에서 영화한편보고 간식과 커피 마시고 나면 하루 푹쉬고 다음 츌장길 편하개 시작합니다,5,4개월 전
yeogi_accom_018_18788,전주 브라운도트 아중지구점,전주 출장시 처음으로 숙박을 했는데 깔끔하고 담배냄새 없고 스타일러에 모든게 다 마음에 들었습니다카운터에 직원분들이 친절하고 로비에는 라면과 커피 무료음료와 토스트까지 간단식사로 좋을것 같습니다만 이용은 하지 못했습니다 제가 출장을 많이 다녀 숙소 수준을 잘 알고 있는데  주볌 숙소중에 제일 좋았던것 같습니다 후기에 보면 침대가 불폄하다고 해서 걱정을 했는데 저는 편했습니다 다음에도 전주 출장시 묵을 예정입니다,5,1년 전
yeogi_accom_018_18789,전주 브라운도트 아중지구점,객실이 깨끗하고 화장실도깨끗했고1층로비가 청결히 간식도 음료도 조식으로 샌드위치랑 라면도 준비되어있었고 좋았어요공원이 바로옆에있어 더좋았고요카운터계신분들도 친절했고요1박이 아쉬웠어요,5,1개월 전
yeogi_accom_018_18790,전주 브라운도트 아중지구점,오픔 이벤트로 저렴하게 예약가능해서 브라운도트를 저렴하게 이용할 수 있어서 너무 좋았습니다 한옥마을 차로 10분 정도 가면 돼서 나름 먼 듯 가까워요고데기 대여도 가능합니다 다만 말씀드려야 빌려주세요그리고 드라이기는 바람 꽤 쎄더라구요오티티 자동로그인 진짜 신기해요주차장도 꽤 넓고 좋아용의자 2개랑 식탁 있어서 배달음식 먹어도 아주 좋습니다에어드레서도 사용은 못해봤지만 비치되어있더라구요근데 약간 이불이 먼지가 잘 날립니다비염 심하시면 참고하셔야될 거 같습니다,5,3개월 전
yeogi_accom_018_18791,전주 브라운도트 아중지구점,전주 브라운도트에서 1박을 하면서 전반적으로 만족스러운 숙박을 했습니다 객실은 깔끔하고 정리가 잘 되어 있었으며 침구류도 청결해서 편하게 쉴 수 있었습니다 욕실 상태도 양호했고 수압이 세서 샤워하는 데 불편함이 없었습니다 특히 프런트 직원분이 친절하게 응대해 주셔서 체크인과 체크아웃 과정이 원활했습니다 위치도 전주한옥마을과 가까워 관광하기에 편리했고 주변에 편의점과 음식점이 있어 이용하기 편했습니다 다만 방음이 다소 아쉬워서 복도 소음이 들리긴 했지만 전체적으로 가성비 좋은 숙소였습니다,5,4개월 전
yeogi_accom_018_18792,전주 브라운도트 아중지구점,연박 이용했는데 주변 먹거리도 많고 조용하고 방도 깨끗해서 편안하게 쉴 수 있었어요 직원들도 친절하고 위치도 좋아서 이동하기 편했습니다 다음에 또 이용하고 싶어요,4,2개월 전
yeogi_accom_018_18793,전주 브라운도트 아중지구점,전주 시내에서 살짝 외곽으로 온 느낌인데 전주를 잘 알지 못하는데 역에서 외곽 쪽 느낌으로 이동했어요 저는 조용해서 전반적으로 더 괜찮았어요일단 외관은 사진으로 본 것처럼 꽤 큰 편인데건물 크기에 비해 주차장이 크진 않아서 늦게 도착하시면 근처 가까운 공영으로 이동해야 할 수도 있어요그리 멀지 않은듯해요1층에 프런트랑 간단한 요기꺼리를 얻을 수 있는 카페테리아가 있고위층은 객실이에요수압좋고방도 넓은편스타일러 있고테이블도 적당히 있어서 사용하기 좋습니다저는 재방문 의사가 있어요,5,1개월 전
yeogi_accom_018_18794,전주 브라운도트 아중지구점,이번달엔 전주에 두번 출장오게 되었어요첫번째 출장때 이용해보았는데 너무 맘에 들어 두번째도 브라운도트를 찾게 되었습니다일단 숙소 깔끔하고 조용해요 객실내 도 큼직하고 넷플릭스도 가능하고 방은 난방 잘 되어 따뜻하고 폭신한 침대에 깔끔하고 사각사각 소리나는 침구류도 좋고요주변 맛집들도 많고 출장지와 거리가 가까워 더 좋습니다 다음번 출장오게 되면 또 이곳을 방문할거에요1층 로비에 간단하게 먹을수 있는 조식도 좋아요직원분도 친절합니다,5,3개월 전
yeogi_accom_018_18795,전주 브라운도트 아중지구점,룸도 깨긋하고 하루 편히 쉬었다갑니다 룸사진은 못찍었지만 11시까지 조식이라 체크아웃하며 조식을 할 수있어 좋았네요  담에 전주 놀러옴 또 올께요,4,23일 전
yeogi_accom_018_18796,전주 브라운도트 아중지구점,전주 아중리 브라운도트 호텔은 신축이라 그런지 시설이 정말 깔끔하고 쾌적했어요 객실도 넓은 편이고 스타일러가 비치되어 있어서 옷 관리가 아주 편리했답니다 조식도 무료로 제공되는데 메뉴도 괜찮고 맛도 좋았어요 직원분들도 친절하게 응대해 주셔서 기분 좋게 지낼 수 있었고요 호텔 근처에 맛집도 많고 위치도 좋아서 여행하기에 딱 좋았어요 다음에 전주에 또 오게 된다면 꼭 다시 이용하고 싶을 정도로 만족스러웠습니다 가성비도 좋고 추천합니다 아중호수도 좋아요,4,2개월 전
yeogi_accom_018_18797,전주 브라운도트 아중지구점,급하게 출장오게되어서찾게되었던 곳 라면기계에 문제가 있었는데즉시 잘 처리 해주시고 친철했습니다너무 아득하고  편하게 잘 쉬다가잘 가게됩니다 기본적으로 주차가 편해서 불편함이전혀없었고 방안이 따뜻해서 평안하게 잘 쉴 수 있습니다 불편함없이 안내도 친절하게 잘 해주셔서신경쓰지않고 정말 잘 쉬다가 갑니다가장 중요한 화장실도 깨끗해서 사용할 때기분좋게 잘 쓸 수 있었고수압도 쎄서 씻는데도 어려움이 없이씻을 수 있었어요 티브이도 커서이것저것 볼 때 몰입감있게 잘 보다가 갑니다담주 출장때도 다시 들러야겠네요,4,3개월 전
yeogi_accom_018_18798,전주 브라운도트 아중지구점,출장으로 24년 9월 23일 월요일에 시티뷰로 숙박했습니다1  방문 시 접근성 도로주변에 있어서 찾는데 어렵지 않습니다2 외관 및 내부객실 상태 외관 깨끗하고 1층 로비도 깔끔하고 스낵바도 잘 정리 되어 있습니다 내부객실도 넓고 침대도 푹신합니다  - 다만 에어드레서가 문을 열고 닫기 어렵네요     침대와 붙어 있으며 문이 오른쪽에서 왼쪽으로 열리게 배치하여 사용하는데 살짝 불편 했습니다3 부대시설 스낵바가 있어서 간단한 음료와 원두커피 이용 가능  - 자판기에 음료와 어매니티 봉지라면이 있습니다     음료는 무료 어매니티봉지라면 유료 - 봉지라면 600원 매우 저렴 하네요 간단조식이 있다고 써 있지만 운영 없었습니다4 직원 서비스 문의사항에 친절하게 답변 해주셨습니다,4,9개월 전
yeogi_accom_018_18799,전주 브라운도트 아중지구점,최근 가본 숙소중에서 청결 서비스 최고입니다 1층에있는 빵 라면 음료 서비스는 너무 좋았구요룸 컨디션도 담배냄새 전혀없는 너무 깨끗한 곳이었습니다 주변에 맛집도 많이있고 호프집 노래방도 있어서 하루 즐기기 너무 좋았어요 사장님도 친절하시고 모든게 완벽했습니다 주차 시설도 넓어서 주차 하는데 어려움 없었구요전주 한옥마을까지 차로 10여분 간거 같아요가깝고 좋은 숙소 다음에도 재방문 의사 있습니다 밖은 추운 날씨였지만매우 따뜻하고스타일러 작동도 잘 되어 만족합니다,5,3개월 전
yeogi_accom_018_18800,전주 브라운도트 아중지구점,정말 전주에서 여러번 숙박을 하는데 여기만큼 깔끔하고 청결한곳은 처음이에요 프론트에계신 분들도 정말 친절하신거 같아요 다만 인터넷이 케이티라서 ㅎㅎ 혹시약정 끝나셨으면 전화한번주세요 1661-3699 유플러스 입니다,5,19일 전
yeogi_accom_018_18801,전주 브라운도트 아중지구점,1 위치  전주 우아동 2 주차장  매우 넓음전기차 충전 가능3 로비  매우 친절4 객실 청결 상태  매우 깨끗5   넷플릭스 유튜브 디즈니6 냉장고  물 음료 커피7 방 크기  보통8 뷰  씨티뷰9 먹을거리  10분 내에 너무너무 많음10 아쉬운 점  없음11 재방문 의사  무조건 방문12 조식  라면 베이글 커피머신13 총평- 출장 고객입니다 전주 및 인근지역 출장시에도 무리해서라도 오는 숙소 입니다 오픈 때부터 이용하고 있습니다 변함없는 모습에 너무 감사합니다,5,11개월 전
yeogi_accom_018_18802,전주 브라운도트 아중지구점,1 위치  전주 우아동 2 주차장  매우 넓음전기차 충전 가능3 로비  매우 친절4 객실 청결 상태  매우 깨끗5   넷플릭스 유튜브 디즈니6 냉장고  물 음료 커피7 방 크기  보통8 뷰  씨티뷰9 먹을거리  10분 내에 너무너무 많음10 아쉬운 점  없음11 재방문 의사  무조건 방문12 조식  라면 베이글 커피머신13 총평- 출장 고객입니다 전주 및 인근지역 출장시에도 무리해서라도 오는 숙소 입니다 오픈 때부터 이용하고 있습니다 변함없는 모습에 너무 감사합니다,5,11개월 전
yeogi_accom_018_18803,전주 브라운도트 아중지구점,두번째 이용입니다 체인점답게 너무 청결하고 좋네요,4,1개월 전
yeogi_accom_018_18804,전주 브라운도트 아중지구점,내부 너무 깔끔하고 체크아웃시간도 넉넉해서 쫓기면서 준비할필요없었고 프론트에 간단하게 먹을수있는 먹거리들도 있어서 좋았고 관리해주시는 매니저님도 친절하셔서 좋았습니다 다음에 또 방문할예정입니다,5,2개월 전
yeogi_accom_018_18805,전주 브라운도트 아중지구점,깨끗하고 주차도 편리하고 좋아요,5,17일 전
yeogi_accom_018_18806,전주 브라운도트 아중지구점,깨끗하고 주차도 편리하고 좋아요,5,17일 전
yeogi_accom_018_18807,전주 브라운도트 아중지구점,깔끔하고 불편한 점 없이 잘 이용했어요,5,1개월 전
yeogi_accom_018_18808,전주 브라운도트 아중지구점,사장님께서 너무 친절하셔서 좋았습니다,4,1개월 전
yeogi_accom_018_18809,전주 브라운도트 아중지구점,전주시 덕진구 우아2동 브라운도트 호텔 이 숙소의 장점1 가성비와 접근성이 좋다2 사장님께서 친절하시다3 주변  인프라가 좋고 아중리 먹자골목이다4 침대가 편안해서 숙면하기에 좋다5 1층 프런트옆 무료 자판기 음료및 한강라면 1000원이면 먹을수 있다 이 숙소의 단점1 단점은 거의 없으나  가운과 고데기가 없어 프런트에 말씀드려야 받을 수 있다2컴퓨터가 없다 총평전체적으로 뛰어난 숙소이고   또 재방문할것이다,5,3개월 전
yeogi_accom_018_18810,전주 브라운도트 아중지구점,넓고 청결해요 맘에 들어요,5,4일 전
yeogi_accom_018_18811,전주 브라운도트 아중지구점,주차장넓고 방깔끔해서 좋아용,5,13일 전
yeogi_accom_018_18812,전주 브라운도트 아중지구점,광주에서 저녁 늦게 갔던거라 방 급하게 알아보다가 깔끔하고 괜찮은거 같아서 사장님께 전화해서 저녁 늦게 갈거 같은데 괜찮을까요 했는데 사장님께서 괜찮다고 마지막에 전화 끊기 전에 조심해서 천천히 오라고 하시더라구요 ㅎㅎ 챙겨주시는 마음이 너무 따뜻하고 친절 하셨어요 로비부터 들어가자 마자 너무 깔끔했고 방 안에 들어가는 순간 놀랬어요 진짜 가운도 너무 부드럽고 좋고 드라이기가 진짜 최고에요 수건에 주황색 국물 뭍어있던거 보고 처음에는 엄청 살짝 당황하다가 방 가성비가 너무 좋고 다 친절하셔서 그냥 쓰게 되더라구요 ㅎㅎ 다음에 또 찾아갈게요,5,1년 전
