id,name,review_content,rating,write_date
yeogi_accom_018_19055,전주 브라운도트 아중지구점,장점수압이 세다주차장 넓다단점조식바가 타 브라운도트 대비 미흡컴퓨터 상태가 별로 좋지 않다객실에서 바깥으로 통하는 창문이 작아서 좀 답답,3,1년 전
yeogi_accom_018_19056,전주 브라운도트 아중지구점,1 항상 갑니다2 주차가 편합니다3 시설이 깨끗하고 좋습니다4 직원분들이 친절합니다5 의류관리기가 있어 편합니다6 넷플릭스 디즈니 등 이용하기 편리합니다7 추천합니다,4,1년 전
yeogi_accom_018_19057,전주 브라운도트 아중지구점,전반적으로 깨끗하고 방이 넓어요 넷플릭스  나와서 잘보고 나왔습니다 중문이 있어서 소음이 적었고 화장실도 넓고 스타일러가 있어서 좋았습니다 방이 많이 건조해서 그 부분이 좀 힘들었어요 겨울엔 좀 힘들것 같아요 일단 대체적으로 좋았습니다 스낵바는 로비에 트여있어서 사용할때 좀 눈치보이는 부분이 있어요,5,2년 전
yeogi_accom_018_19058,전주 브라운도트 아중지구점,오늘도 여김없이 출장일을 끝내고 숙소를 찾아 여기어때 어플을 켜고 내주변을 찾아봅니다 사진부터 마음에 드는 인테리어를 찾았지만 이지역에선 야기가 가장 맘에 들어서 예약을 하고 방문 하였습니다 역시나 사진처럼 깨끗하고 푸근하고 좋습니다 전지역을 모두 출장을 다니기에 전국 곳곳의 숙소를 다니고 숙소를 비교하지만 여기도 어김없이 잘 선택 한거 같아 마음이 뿌듯합니다 ㅎㅎ 다음에도 재방 계획입니다,5,2년 전
yeogi_accom_018_19059,전주 브라운도트 아중지구점,여기 저기 많이 신경써서 리모델링한게 보이네요좋아요잘 쉬었습니다,4,2년 전
yeogi_accom_018_19060,전주 브라운도트 아중지구점,다음에 또 들르겠습니다,4,1년 전
yeogi_accom_018_19061,전주 브라운도트 아중지구점,룸이 깨끗하고 좋았습니다 금연시설이라 냄새나는것두 없구요 주차장도 넓구요 직원분들도 너무 친절하셔서 다음번에 전주 또 놀러가게 되면 여기 오고싶어요 넷플릭스랑 디즈니도 볼 수 있어서 편히 잘 쉬다 갑니다,5,2년 전
yeogi_accom_018_19062,전주 브라운도트 아중지구점,1 직원들이 친절하고 대응이 전문적이었습니다2 주차공간이 넉넉해서 주차하기가 편했습니다3 숙소의 청소 상태가 양호했습니다4 침대가 푹신하여 잠을 푹 잘 수 잇었습니다,5,2년 전
yeogi_accom_018_19063,전주 브라운도트 아중지구점,다음에 또 들르겠습니다,4,1년 전
yeogi_accom_018_19064,전주 브라운도트 아중지구점,잘 쉬었습니다,4,2년 전
yeogi_accom_018_19065,전주 브라운도트 아중지구점,전주 출장시 마다 고정으로 묵는 숙소입니다여타의 모텔과 다르게 호텔 느낌이 물힌나는 곳입니다 리모델링으로 깨끗하고 쾌적한 곳이라 찝찝함 없이 사용하고있습니다 아침 조식도 간단히 마련되어있어 이용할 수 있습니다 적극  추천합니다,5,2년 전
yeogi_accom_018_19066,전주 브라운도트 아중지구점,방크기도 적당하고 깨긋합니다,4,2년 전
yeogi_accom_018_19067,전주 브라운도트 아중지구점,심플하고  깨끗함 완벽하게 리모델링  되엇네요,5,1년 전
yeogi_accom_018_19068,전주 브라운도트 아중지구점,신축건물이라 아주 깨끗합니다프론트  여사장님 아주 친절하게 하나하나 자세히 설명해주세요침구 푹신하니 아주 깨끗하고수건도 깨끗합니다청소상태 아주 청결하고요1층에 간단한 조식 준비 되어 있어 좋아요옆에 자판기 음료 무한 공짜입니다아주 아주 만족하고재방문 백퍼입니다,5,1년 전
yeogi_accom_018_19069,전주 브라운도트 아중지구점,너무 잘썼습니다객실컨디션 최고네요,5,1년 전
yeogi_accom_018_19070,전주 브라운도트 아중지구점,ㅣ조용하고 깨끗해서 좋습니다 시설도 좋네요 넷플릭스 잘 나오고 피씨 성능도 아주 좋았습니다 혼자 갔는데 혼자 놀기 아까웠네요  그쪽으로 출장 갈일 있으면  다시 가도록 하겠습니다,5,2년 전
yeogi_accom_018_19071,전주 브라운도트 아중지구점,전주에서 잠깐 쉬다 갔는데 숙소도 깨끗하고 잘 이용하다 온것 같습니다 위치도 괜찮았고 깨끗한 숙소 찾으시면 전주 브라운도트 이중지구점을 추천합니다 안내도 친절하게 잘 해 주셨어요,5,1년 전
yeogi_accom_018_19072,전주 브라운도트 아중지구점,남자친구와 처음 온 전주 숙박시설이 이렇게 좋아도되는건가요 사댱님2박3일 예약햇는데 예약하기 잘했다는 생각 들어요사장님 사모님 두분다 친절도 100전주오면 무조건 여기만 올거에요여성분들 고대기 놓고오셨거나 하시묜 카운터에 말씀하세용 유닉스 고대기 빌려주심니당 센스도 너무좋고자판기음료수 무료 최고입니다저한 10개는 마신듯죄송해요사장밈ㅋㅋㅋㅋ이렇게 싼가격에 스타일러까지 주변 맛집도 많고한옥마을 택시타고 10분컷뜨 사장님께 맛집 여쭤보면 친절히 설명도 해주신답니다사장님 덕분에 시원하고 편하게 쉬다가용 감사합니다,5,1년 전
yeogi_accom_018_19073,전주 브라운도트 아중지구점,아주 좋았고 또 다시이용할 거 같아요,3,1년 전
yeogi_accom_018_19074,전주 브라운도트 아중지구점,시설  아주 만족하였습니다청결  깔끔하고 관리가 잘 되는 것 같아요잠자리가 굉장히 편했고 방음도 잘 되는 것 같아서 아주 좋았습니다출장을 자주 다니기 때문에 자주 방문할 것 같아요,5,1년 전
yeogi_accom_018_19075,전주 브라운도트 아중지구점,좋습니디 좋아오 좋아오,5,1년 전
yeogi_accom_018_19076,전주 브라운도트 아중지구점,이번객실컨디션은 진짜음그랬어요ㅠㅅㅠ아무래도 유동객수도많아지고 고객수가많아지고규모가커지다보니호실마다 청소해주시는분들이매우힘드실거라는생각은들지만 그럼에도 조금만더 위생적인부분에 신경써주시면더좋을것같아요화장실청소는진짜완전거의안되어있었고 베드는그나마깨끗했으나 들어가자마자 바닥에 먼지에양말에먼지가깜짝놀랬어요ㅠㅠ저도여기가고처음있는일이였거니와결국 객실 이동을말씀드렸고 업그레이드해주셔서남은1박편히쉬고왔지만 마음이좋지많은않았습니다그래도항상 기분좋게반겨주셔서감사해요,5,1년 전
yeogi_accom_018_19077,전주 브라운도트 아중지구점,가 키뽑고 나갔다 오면 자꾸 초기화가 되어있어 게임을 매번 설치하는거랑 의자가 불편했어요 ㅜㅜ 그래도 개인정보 노출위험이 없는거겠죠 그외 매우깨끗했고 위치도 좋았습니당,5,1년 전
yeogi_accom_018_19078,전주 브라운도트 아중지구점,화장실과 침구시설 깔끔하고 스낵바도 다양하게 구비되어 있어서 좋았습니다,4,1년 전
yeogi_accom_018_19079,전주 브라운도트 아중지구점,아주 깨끗하고 좋아요,5,1년 전
yeogi_accom_018_19080,전주 브라운도트 아중지구점,장난아니네요 전주 완산구 내 모텔에서 가장 좋지 않을까싶은데 가격이 주변에 비해 비싼건맞지만 그만큼 가격못하는 숙소도많은데 여긴 참 좋네요 넓고 깨끗하고 화장실이 최신인테리어입니다 ㅎㅎ 집도 이런타일에 세면대면 좋겠다,5,2년 전
yeogi_accom_018_19081,전주 브라운도트 아중지구점,남편이랑 여행차 온 전주라 숙소 고민 진짜 많이 됐어요ㅠㅠ 후기가 좋기도 하고 숙소 컨디션이 좋아보여 선택했는데 진짜 너무너무 좋아요 스탠다드인데 방 들어가자마자 남편이랑 둘이서 와 ㅆ 좋네 이러고ㅎㅎ 조식까지 있다네요 음료도 무료라네요 어제 마신 술도 잘 해장하고 갑니당 ㅎㅎㅎ 너무 좋아요 여기 전주 숙소는 무조건 여기 주변거리 상관없이 무조건 여기,5,1년 전
yeogi_accom_018_19082,전주 브라운도트 아중지구점,너무 너무 좋습니다 적극 추천합니다,4,1년 전
yeogi_accom_018_19083,전주 브라운도트 아중지구점,전주 여행 때 연박으로 묵고 왔어요룸 컨디션 짱 좋아요주차장도 문제 없이 이용 했네요객실 엄청 깨끗하고인포메이션에 계신 분들도 친절하셔요다음에 또 여행 가면 아중지구점 이용 할 것 같아요,5,2년 전
yeogi_accom_018_19084,전주 브라운도트 아중지구점,전주출장 가면 여기서 다시갈 것임 깨끗하고 객실사이즈며 청결이 비즈니스 급 아침에는  편의점 라면과토스트 계란 제공,5,1년 전
yeogi_accom_018_19085,전주 브라운도트 아중지구점,전주가면브라운도트 아중지구점저번주 분실물도 챙겨놔 주시고 너무 감사합니다시설도 청소상태도 너무 좋아요현장이 마무리 되서 앞으로 갈일은 적겠지만또 전주 또 가게 되면 아중지구로 갈께요,5,1년 전
yeogi_accom_018_19086,전주 브라운도트 아중지구점,너무 너무 좋습니다 적극 추천합니다,5,1년 전
yeogi_accom_018_19087,전주 브라운도트 아중지구점,시설 서비스 간편조식 최고에요쿠폰덕에 가성비 좋게 묵었어요침구 방음도 좋아요,5,2년 전
yeogi_accom_018_19088,전주 브라운도트 아중지구점,-셀프바 이용방법 숙지가 안되어서 라면을 룸으로 가지고 갔음-갖고 내려오라고 인터폰받고 바로 내려감-외출하면서 고민함 숙소가면 보통 라면도 먹고 쉬고 이것저것 먹으려고 가는건데 외부음식 안되나보다하고 뭐지 고민함-한옥마을가서 결국 빈손으로 돌아옴 외부음식 안되나싶어서-엘베 공지안내문 보니 배달되는것같아서 국물도없고 최대한 피해없을 치킨을 시켜먹음-담날아침 전북대 볼 일보고 숙소돌아와 로비서 토스트먹음-굳이 또 룸으로 갖고 가지말라고함갖고갈생각도 없었는데진짜 불편하게 함-퇴실할때 다른방보니 짬뽕에 맥주에 라면에 파티하던데 로비라면은 왜 안되는지 그 기준이 먼지 의문-잘때도 진짜 조심히 잠  머묻혀서 머라할까싶어서 둘이 조심하자고 12만원주고 불편한 숙소 첨이라고 - 그냥 불편햇음조취취한다는데 무즌조취요불편한거 이야기하는데 내려오라고해서 내려오고피해준게없는데ㅋㅋ대응이황당,2,2년 전
yeogi_accom_018_19089,전주 브라운도트 아중지구점,새로 생겨서 그런지 너무 깔끔하고 샤워기 및 욕실 수압도 너무 좋았습니다 객실도 생각이상으로 넓어서 쾌적하게 이용하고 갑니다 특히 체크인 체크아웃을 도와주신 사원분들이 너무 친철하셨습니다 감사했습니다,5,1년 전
yeogi_accom_018_19090,전주 브라운도트 아중지구점,생긴지 얼마안됐다고 하셨는데 진짜 최근가본 숙박시설중 최고였습니다 아침에 빵도 구워먹을수 있어서 짱조음 적극추천합니다,5,2년 전
yeogi_accom_018_19091,전주 브라운도트 아중지구점,너무 너무 좋습니다 적극 추천합니다,5,1년 전
yeogi_accom_018_19092,전주 브라운도트 아중지구점,너무 너무 좋습니다 적극 추천합니다,5,1년 전
yeogi_accom_018_19093,전주 브라운도트 아중지구점,3월 오픈해서 룸컨디션 아주 깨끗합니다스타일러가 있어서 정장 주름이나 냄새잡기 좋네요,5,2년 전
yeogi_accom_018_19094,전주 브라운도트 아중지구점,객실 깨끗하고 좋습니다추천합니다,5,1년 전
yeogi_accom_018_19095,전주 브라운도트 아중지구점,브라운도트 전주 아중점 좋습니다믿고가는 브라운도트 중에서도 좋습니다업무보시는 분들도 좋습니다 감사합니다셀프바도 있는데 없어도 충분히 훌륭한 객실입니다감사합니다 쾌적하고 편하게 이용했습니다감사합니다 쾌적합니다 객실도 깨끗합니다 화장실도 깨끗합니다편하게 수고가게 해주셔서 감사합니다다음에 전주오면 또 오겠습니다 감사합니다편하게 숙면 했습니다 좋습니다 감사드립니다 편하게 잘 있다가 갑니다 또 오겠습니다,5,1년 전
yeogi_accom_018_19096,전주 브라운도트 아중지구점,다음에 또 들르겠습니다,4,2년 전
yeogi_accom_018_19097,전주 브라운도트 아중지구점,객실컨디션 너무 좋았어요 추천합니다,5,1년 전
yeogi_accom_018_19098,전주 브라운도트 아중지구점,전주 근처 출장으로 방문 하였습니다 신축이라 모든 시설이 다 깨끗해서 좋았습니다 다만 제가 방문시 디즈니 가 제대로 작동되지 않아서 별하나 뺐습니다 하지만 그 과정에서 직원분이 굉장히 친절히 응대해 주셔서 좋았습니다,5,1년 전
yeogi_accom_018_19099,전주 브라운도트 아중지구점,친절하시고 너무 센스있게 침대위치까지 설명해주시고 선택하게 해주시고 또 근처 맛집도 안내해주시고 감동 받았습니다 ,5,1년 전
yeogi_accom_018_19100,전주 브라운도트 아중지구점,친절하시고 너무 센스있게 침대위치까지 설명해주시고 선택하게 해주시고 또 근처 맛집도 안내해주시고 감동 받았습니다 ,5,1년 전
yeogi_accom_018_19101,전주 브라운도트 아중지구점,깨끗하고 좋아요 방 크기도 좋아요,4,2년 전
yeogi_accom_018_19102,전주 브라운도트 아중지구점,너무 너무 좋습니다 적극 추천합니다,4,1년 전
yeogi_accom_018_19103,전주 브라운도트 아중지구점,안녕하세요우선은 다른것보다 부부사장님 두분이 너무너무 친절하시네요 출출함에 편의점가서 간식거리 사들고오는데 어떻게 알고 찐계란에 라면조리까지 해주시고 ㅠㅠ 감동 했어요 한달에 한번씩 지방출장다니는데 정말 좋은 숙소에 좋은 사장님들 만나서 편하게 쉬고 갑니다 번창하시고 다음에 또 올게요,5,1년 전
yeogi_accom_018_19104,전주 브라운도트 아중지구점,너무 너무 좋습니다 적극 추천합니다,5,1년 전
yeogi_accom_018_19105,전주 브라운도트 아중지구점,인근에서 가장 가성비 훌륭한 숙박 시설 입니다청결도 만족도 높구요시설 만족도 높구요친절 만족도 높습니다무엇보다 객실 시설이 매우 좋네요편안한 밤 보내고 갑니다다음 출장시 재방문 예정입니다,5,1년 전
yeogi_accom_018_19106,전주 브라운도트 아중지구점,너무나좋습니다                                                                                             ,5,1년 전
yeogi_accom_018_19107,전주 브라운도트 아중지구점,항상애용하고여전히한곳만들고팝니다ㅋㅋㅋ이번에는빼빼로까지 이곳은 언제까지이렇게 사소한것하나하나 고객을설레게하는지ㅋㅋ거참ㅋㅋ 이러니갈수밖에요주말마다예약할때마다 이거참 민망스럽네요ㅋㅋ,5,1년 전
yeogi_accom_018_19108,전주 브라운도트 아중지구점,브라운도트를 부산에서 한번 가봤는데 깔끔하고 잘 되어 있어서 전주 여행에도 브라운도트로 선택해봤어요 역시나 깔끔하고 잘 되어있고 새 방터럼 깨끗합니다 체크인히는데 친절하게 해주셔서 좋았어요 잘 쉬어서 너무 좋아요ㅎㅎ,5,1년 전
yeogi_accom_018_19109,전주 브라운도트 아중지구점,아이랑 아내가 너무 만족해서 제가 기분이 더 좋네요 푹 잘쉬고 갑니다 다음에 이곳으로 여행오면 또 쉬러 오겠습니다,5,1년 전
yeogi_accom_018_19110,전주 브라운도트 아중지구점,시설하고일단프론트에계신남자분너무친절했어요주말마다거의 일겸가는편인데  역시이번주도예약했어요편안함을추구하는편이고 저희는 도매일이라 저녁일이라많이피곤해서 주로숙소해서쉬는편인데  숙소청소상태는조금부족했고 드라이기가좀많이약하고 매직기가없어서 너무아쉬웠어요 다른곳은왠만하면다구비가되어있는편이거든요  그럼에도시설이만족스런편이고 청결만좀더좋아지면만족스러울듯싶어요이번주 스파예약했는데 꼭청결하길바래봅니다,5,1년 전
yeogi_accom_018_19111,전주 브라운도트 아중지구점,다음에 또 들르겠습니다,4,1년 전
yeogi_accom_018_19112,전주 브라운도트 아중지구점,조금 늦게 도착했는데도 주차 등 안내도 잘해주셨고 이용은 안했지만 스낵바도 잘 갖춰진 것 같았어요 많은 분들이 잘 이용하고 계셨습니다 룸 컨디션도 신축이라 그런지 넘 좋았고 정말 청결했습니다 전주한옥마을이랑 거리도 멀지 않아서 여행하기 편했고 주차 공간도 넉넉합니다 다음에 전주에 방문하면 또 묵고 싶은 숙소였어요 직원분들도 정말 친절하셨습니다 침구도 편하고 에어드레서도 잘 이용했어요,5,2년 전
yeogi_accom_018_19113,전주 브라운도트 아중지구점,인근지역임실 출장으로 해당숙소를 예약했습니다 속소 컨디션은 양호하였으며 주변소음도 없었습니다 그리고 주변 식당들이 위치하여 저녁 먹기도 수월했습니다 아침조식도 제공되는데 간단한 식사 가능했습니다 푹 쉬다 갑니다,5,2년 전
yeogi_accom_018_19114,전주 브라운도트 아중지구점,전체적으로 깔끔하고 편의시설이 좋았어요,5,1년 전
yeogi_accom_018_19115,전주 브라운도트 아중지구점,주변지역 출장으로 해당 숙소를 예약했습니다 숙소 주변으로 식당이 많이 위치하여 편리했습니다 숙소 내부는 깔끔했고 담배 냄새가 발생하지 않아 쾌적하게 숙면할 수 있었습니다 잘 쉬었다 갑니다,5,1년 전
yeogi_accom_018_19116,전주 브라운도트 아중지구점,전반적으로 깔끔해서 좋았습니다 공기청정기와 에어드레서가 있어서 좋았습니다 로비에 라면끓여먹는 기계와 무료 음료수 자판기가 있어서 즐겁게 이용했습니다 위치 접근성 등 전체적으로 만족합니다,5,1년 전
yeogi_accom_018_19117,전주 브라운도트 아중지구점,숙소 위치도 좋고 객실도 넓고 깨끗해서 편안하게 묵었습니다 사장님이 친절하셔서 기분좋게 체크인 체크아웃 할 수 있었습니다 아침에 로비에서 스낵바도 이용할 수 있어서 좋았습니다 다음에 전주 방문하게 되면 또 이용해야겠어요 ,5,1년 전
yeogi_accom_018_19118,전주 브라운도트 아중지구점,전주 출장은 브라운도트 아중지구,5,1년 전
yeogi_accom_018_19119,전주 브라운도트 아중지구점,시설 깔끔하고 좋았습니다,4,1년 전
yeogi_accom_018_19120,전주 브라운도트 아중지구점,객실도 깔끔하고 좋았습니다,4,1년 전
yeogi_accom_018_19121,전주 브라운도트 아중지구점,좋아요 추천합니다,5,2년 전
yeogi_accom_018_19122,전주 브라운도트 아중지구점,최고에요 너무너무 좋아영                                                                                   ,4,1년 전
yeogi_accom_018_19123,전주 브라운도트 아중지구점,너무좋아요  전주가면 매일가는거 같네요,5,1년 전
yeogi_accom_018_19124,전주 브라운도트 아중지구점,전주 출장은브라운도트 아중지구,5,1년 전
yeogi_accom_018_19125,전주 브라운도트 아중지구점,다음에 또 방문의사 있음,5,1년 전
yeogi_accom_018_19126,전주 브라운도트 아중지구점,너무 좋았습니다 벌써 두번째 이용중,5,1년 전
yeogi_accom_018_19127,전주 브라운도트 아중지구점,오픈한지 얼마 되지 않아서 너무 좋았어요 방도 업그레이드해주셔서 선물같은 여행이었습니다 항상 담배냄새가 제일 걱정인데 그런걱정 전혀없고 깨끗하게 관리되어서 너무 좋았어요 친절하게 안내해주셔서 두 배로 좋았습니다 잘 이용했습니당,5,2년 전
yeogi_accom_018_19128,전주 브라운도트 아중지구점,전주 브라운도트아중지구점몇번째 방문인지 모를 정도로자주가는데 이제 집만큼 편하네요깨끗하고 친절하시고어매니티가 바뀌었던데칫솔은 별로였어요ㅋㅋ근데 그 머냐 디퓨져가 바뀐건지 향이 엄청 좋아요,5,1년 전
yeogi_accom_018_19129,전주 브라운도트 아중지구점,사장님이 친절하시고 많이 챙겨주시네요,5,2년 전
yeogi_accom_018_19130,전주 브라운도트 아중지구점,너무 깨끗하고 조용하고 좋아요라면커피음료등도 무료로 이용하고 좋아요강추,5,1년 전
yeogi_accom_018_19131,전주 브라운도트 아중지구점,새로 지은 지 얼마 안돼서 방도 깔끔하고 티비도 커서 좋았어요,5,2년 전
yeogi_accom_018_19132,전주 브라운도트 아중지구점,깔끔하고 좋습니다주차장 쾌적재방문 의사 100,5,1년 전
yeogi_accom_018_19133,전주 브라운도트 아중지구점,푹쉬다갑니다 ㅎㅎ좋아요,5,1년 전
yeogi_accom_018_19134,전주 브라운도트 아중지구점,월요일부터 목요일까지 연박하면서 너무 편안하게 쉬다가갑니다사장님이 친절하시고 아침에 나갈때 과일까지 챙겨주시고 너무너무좋았네요,5,2년 전
yeogi_accom_018_19135,전주 브라운도트 아중지구점,전날에 너무피곤해서브라운도트 덕진점에서 숙박했는데후회를 얼마나 했는지 몰라요ㅜ다시는 배신안하겠슴돠전주 출장은 무조건아중지구점,5,1년 전
yeogi_accom_018_19136,전주 브라운도트 아중지구점,세번째 숙소 방문중 ㅎㅎㅎ,5,1년 전
yeogi_accom_018_19137,전주 브라운도트 아중지구점,할인이벤트로 숙소를 알아보는도중 아중리에 브라운도트가 생겨 처음으로 브라운도트에 가보았는데요 입구부터 럭셔리한게 아주 입구들어가자마자 깔끔해서 놀랐습니다 일층에 조식도 깔끔하게 있고 커피랑 음료뽑아먹을수있는 자판기다 따로있더라구요 일층에서 음료 뽑아가세요 방에는 물만읶습니다방으로 들어가니 냄새도 깔끔하고 침구도 깨끗하니 주말에 아주편하게 쉴수있었네요 ㅎㅎ나중에 다시 이용하도록하겠습니다,5,2년 전
yeogi_accom_018_19138,전주 브라운도트 아중지구점,매우 만족합니다친절했고 편했고 룸컨디션 최상이었습니다,5,1년 전
yeogi_accom_018_19139,전주 브라운도트 아중지구점,시설 좋아요 담에 놀러오면 또 이용햘꺼예요,3,1년 전
yeogi_accom_018_19140,전주 브라운도트 아중지구점,새로 오픈해서 시설은 아주 깨끗합니다,5,2년 전
yeogi_accom_018_19141,전주 브라운도트 아중지구점,시설깨끗하고 직원분들 친절하구요 주차도 편리하게 잘했습니다방도넓어서 좋았구요 주변에도 먹을곳도 많아서 좋았습니다객실비품도 여유있게있고 여자친구가 다음에도 오자고하는대 재방문하겠습니다,5,1년 전
yeogi_accom_018_19142,전주 브라운도트 아중지구점,시설 진짜 아중리쪽에서 가본곳중 최고인듯합니다,5,1년 전
yeogi_accom_018_19143,전주 브라운도트 아중지구점,너무 깨끗하고 좋습니다,5,1년 전
yeogi_accom_018_19144,전주 브라운도트 아중지구점,정말 마음에 들어요 마사지 기계 있는 방으로 예약했는데 티비도 크고 마사지 기계에 누워서 마사지 받으면서 넷플도 보고마사지 기계가 꺼더라고요 엄청 이쁘고 가격 찾아보고 한번더 놀라고 ㅎㅎ매우 만족하고 갑니다,5,1년 전
yeogi_accom_018_19145,전주 브라운도트 아중지구점,브라운도트호텔은 국내 최고의 숙박시설입니다위생적이며 청결하고 샤워실도 최상급입니다생수와 커피도 충분히 드실 수 있으며해장을 위해 라면도 끓여 드실 수 있습니다방문하시면 매우 만족하실 거라 확신합니다,5,2년 전
yeogi_accom_018_19146,전주 브라운도트 아중지구점,깨끗해요 어메니티도 깔끔하네요 재방문 의사 있어요,5,2년 전
yeogi_accom_018_19147,전주 브라운도트 아중지구점,넘모넘모 좋아요 최고                                                                                      입니다,5,2년 전
yeogi_accom_018_19148,전주 브라운도트 아중지구점,너무너무 깔끔하고 좋았어요정리 정돈 된 상태가 매우 깔끔하고사장님 즐겁게 일하시는 모습 보기 좋습니다많이 번창하시고 돈 많이 버시고행복한 나날을 보내시기를 바랍니다 수고 하세요,5,2년 전
yeogi_accom_018_19149,전주 브라운도트 아중지구점,전주 출장은 브라운도트 아중점,5,1년 전
yeogi_accom_018_19150,전주 브라운도트 아중지구점,깨끗해고 넘 좋네요아침에 간단한 식사도 할수있어서 좋았어요,5,1년 전
yeogi_accom_018_19151,전주 브라운도트 아중지구점,1 통창 너무 좋았어요2 신식이라 방도 이쁘고 깔끔함3 스타일러 굿굿4 가운도 좋은 가운이에요5 드라이기까지 좋음6 티비 좋은데 디즈니채널 소리가 좀 작더라구요ㅜㅜ아쉽,5,2년 전
