id,name,review_content,rating,write_date
yeogi_accom_018_18934,전주 브라운도트 아중지구점,매번 방문하는데  만족합니다,4,1년 전
yeogi_accom_018_18935,전주 브라운도트 아중지구점,편하게 잘 쉬다왔어요,5,5개월 전
yeogi_accom_018_18936,전주 브라운도트 아중지구점,전반적으로 청결한 상태를 유지하고 있어요,4,11개월 전
yeogi_accom_018_18937,전주 브라운도트 아중지구점,청결합니다 괜찮아요,4,3개월 전
yeogi_accom_018_18938,전주 브라운도트 아중지구점,어른 2  아이 2  쓰기엔 적당했습니다,2,2개월 전
yeogi_accom_018_18939,전주 브라운도트 아중지구점,깨꿋하게 잘 쉬었습니다,4,2개월 전
yeogi_accom_018_18940,전주 브라운도트 아중지구점,굿굿굿 좋아요 초이스 굿,4,11개월 전
yeogi_accom_018_18941,전주 브라운도트 아중지구점,좋아요좋아요좋아좋아짱좋아완전좋아 여기최고임 좋아요 여기좋인 완전좋아 여기최고임 좋아요 여기좋인 완전좋아 여기최고임 좋아요 여기좋인 완전좋아 여기최고임 좋아요 여기좋인 완전좋아 여기최고임 좋아요 여기좋인 완전좋아 좋아요좋아요좋아좋아짱좋아완전좋아 여기최고임 좋아요 여기좋인 완전좋아 여기최고임 좋아요 여기좋인 완전좋아 여기최고임 좋아요 여기좋인 완전좋아 여기최고임 좋아요 여기좋인 완전좋아 여기최고임 좋아요 여기좋인 완전좋아 여기최고임 좋아요 여기좋인 완전좋아 여기최고임 좋아요 여기좋인 완전좋아 여기최고임 좋아요 여기좋인 완전좋아여기최고임 좋아요 여기좋인 완전좋아 여기최고임 좋아요 여기좋인 완전좋아 여기최고임 좋아요 여기좋인 완전좋아,5,10개월 전
yeogi_accom_018_18942,전주 브라운도트 아중지구점,좋아요좋아요좋아좋아짱좋아완전좋아 여기최고임 좋아요 여기좋인 완전좋아 여기최고임 좋아요 여기좋인 완전좋아 여기최고임 좋아요 여기좋인 완전좋아 여기최고임 좋아요 여기좋인 완전좋아 여기최고임 좋아요 여기좋인 완전좋아 좋아요좋아요좋아좋아짱좋아완전좋아 여기최고임 좋아요 여기좋인 완전좋아 여기최고임 좋아요 여기좋인 완전좋아 여기최고임 좋아요 여기좋인 완전좋아 여기최고임 좋아요 여기좋인 완전좋아 여기최고임 좋아요 여기좋인 완전좋아 여기최고임 좋아요 여기좋인 완전좋아 여기최고임 좋아요 여기좋인 완전좋아 여기최고임 좋아요 여기좋인 완전좋아여기최고임 좋아요 여기좋인 완전좋아 여기최고임 좋아요 여기좋인 완전좋아 여기최고임 좋아요 여기좋인 완전좋아,5,10개월 전
yeogi_accom_018_18943,전주 브라운도트 아중지구점,1 위치  전주 우아동 2 주차장  매우 넓음전기차 충전 가능3 로비  매우 친절4 객실 청결 상태  매우 깨끗5   넷플릭스 유튜브 디즈니6 냉장고  물 음료 커피7 방 크기  보통8 뷰  씨티뷰9 먹을거리  10분 내에 너무너무 많음10 아쉬운 점  없음11 재방문 의사  무조건 방문12 조식  라면 베이글 커피머신13 총평- 출장 고객입니다 전주 및 인근지역 출장시에도 무리해서라도 오는 숙소 입니다 오픈 때부터 이용하고 있습니다 변함없는 모습에 너무 감사합니다,5,11개월 전
yeogi_accom_018_18944,전주 브라운도트 아중지구점,근처에 식당 가깝고  앞에 공원있어서 좋습니다,4,3개월 전
yeogi_accom_018_18945,전주 브라운도트 아중지구점,저는 전국의 숙소들을 아주 자주 많이 다니거든요전국으로 출장을 아주 자주 많이 다니거든요전주에 와서는 여기를 처음 이용했는데 굉장히 만족 스러웠습니다다시 이용할 의사가 있습니다,5,1년 전
yeogi_accom_018_18946,전주 브라운도트 아중지구점,깔끔하고 좋네요,5,3개월 전
yeogi_accom_018_18947,전주 브라운도트 아중지구점,1층에 조식먹을 수 있게 커피 빵 라면 준비도어있고 객실은 깔끔 그자체추석 연휴 첫날 잘 쉬다 갑니다,5,9개월 전
yeogi_accom_018_18948,전주 브라운도트 아중지구점,진짜 깨끗하고 좋은 여행이였어요,5,3개월 전
yeogi_accom_018_18949,전주 브라운도트 아중지구점,좋았어요ㅎㅎㅎㅎㅎㅅ,5,3개월 전
yeogi_accom_018_18950,전주 브라운도트 아중지구점,항상 잘이용하고 있습니다주차장도 넓고 방도 깨끗합니다,5,6개월 전
yeogi_accom_018_18951,전주 브라운도트 아중지구점,다음에 또 들르겠습니다,4,5개월 전
yeogi_accom_018_18952,전주 브라운도트 아중지구점,깨끗하고 주변으로 갈 곳이 많아 좋았습니다 ,5,9개월 전
yeogi_accom_018_18953,전주 브라운도트 아중지구점,근처 갈 일 있음 가는 숙소 입니다 추천 드립니다,5,1년 전
yeogi_accom_018_18954,전주 브라운도트 아중지구점,다음에 또 들르겠습니다,4,3개월 전
yeogi_accom_018_18955,전주 브라운도트 아중지구점,잘쉬다가 갑니다조용하고 시설부분이 깔끔했습니다침대도 좋고티비도 좋고화장실이 깔끔했습니다전체적으로 깔끔하고 청결했습니다주변 먹을때도 있고근접성이 좋아 다음에 또이용할께요 감사합니다,5,1년 전
yeogi_accom_018_18956,전주 브라운도트 아중지구점, 최고입니당따뜻하고청결하고저는여기로만갑니당,5,6개월 전
yeogi_accom_018_18957,전주 브라운도트 아중지구점,깨끗하고 좋아요 잘 쉬었습니다,4,7개월 전
yeogi_accom_018_18958,전주 브라운도트 아중지구점,전주 올때마다 오는집,5,11개월 전
yeogi_accom_018_18959,전주 브라운도트 아중지구점,좋았습니다 또 이용할께요,5,6개월 전
yeogi_accom_018_18960,전주 브라운도트 아중지구점,깨끗한 침실 침대 정말로 최고입니다,5,8개월 전
yeogi_accom_018_18961,전주 브라운도트 아중지구점,숙소는 역시 브라운도트 다음에도 이용할게요,5,5개월 전
yeogi_accom_018_18962,전주 브라운도트 아중지구점,깔끔하고 청결하고 편해요,5,1년 전
yeogi_accom_018_18963,전주 브라운도트 아중지구점,역시 믿고가는 브라운입니다지방출장으로 어느 지점이든 브라운만가는데 만족도는 늘 최고네요,4,9개월 전
yeogi_accom_018_18964,전주 브라운도트 아중지구점,생각했던대로 컨디션  괜찮아요편히 쉬고 갑니다 ㅎㅎ,4,9개월 전
yeogi_accom_018_18965,전주 브라운도트 아중지구점,옛날같지는 않내요청소가 별로입니다,3,4개월 전
yeogi_accom_018_18966,전주 브라운도트 아중지구점,너무 고급스럽고 편하게묵엇네요,5,8개월 전
yeogi_accom_018_18967,전주 브라운도트 아중지구점,ㄴ방이 넓고 깔끔해서 좋았어요,5,11개월 전
yeogi_accom_018_18968,전주 브라운도트 아중지구점,굿굿굿 좋아요 굿 초이스,4,11개월 전
yeogi_accom_018_18969,전주 브라운도트 아중지구점,깨끗하고 조용하고 숙박 하기  정말 좋습니다,5,6개월 전
yeogi_accom_018_18970,전주 브라운도트 아중지구점,깨끗하고 편안했습니다,5,8개월 전
yeogi_accom_018_18971,전주 브라운도트 아중지구점,넘 친절하고 깔끔합니다,5,6개월 전
yeogi_accom_018_18972,전주 브라운도트 아중지구점,저는 간간히 시간 되면 전주로 놀러 오는데요 이전에 브라운도트 금암점에서 정말 만족했기 때문에 이번엔 체인점인 아중점으로 오게 됐습니다저는 31에 예약하고 방문했는데 우선 방이 생각보다 많이 협소했어요 그래도 인테리어가 깔끔해서 괜찮았어요우선 도착하고 방에 가운이 없어서 내려가서 카운터에 요청을 했는데요 찾아보고 드린다고 하셔서 기다렸습니다 근데 계속 기다려도 안 오시더라고요 시간이 늦었고 피곤해서 얼른 씻고 싶은 마음에 다시 카운터로 내려갔습니다 근데 그냥 앉아계시더라고요 그래서 당황스러워서 가운 찾아주신다고 하지 않았냐 여쭤보니 가운이 없대요 그럼 말씀이라도 해주시지 ㅠㅠㅠ 내려가지 않았다면 내내 기다릴 뻔했네요가운 없다길래 그냥 돌아와서 씻으려니 온수가 안 나오더라고요 다시 내려가서 온수가 안 나온다고 말하니까 보일러 켜드린다고 조금만 기다리라고 하셨는데  5분동안 냉수가 나와서 이번엔 전화로 따뜻한 물이 계속 안 나온다고 하니까 본인도 잘 모르겠대요 그래서 방 바꿔달라고 요청했습니다 위 사진이 바꾼 방안에 있던 휴지통 사진입니다휴지통이 안 비워져있더라고요시간은 자정이 넘었고 내려가기도 짜증이나고 이렇게 도착해서 한시간을 허비하니 더 말씀드려서 뭐하나 라는 생각에 따로 말씀 안 드렸습니다방문 전 리뷰도 보고 왔는데 리뷰와 너무 다른 서비스와 시설에 너무 실망했습니다아 그리고 소음에 민감하신 분들은 피하셔야 할 것 같아요 방음이  정말 하나도 안 됩니다맞은 편 드라이기 소리 웃음소리 다 들리고 무엇보다 불편한 점은 새벽엔 바람에 현관문이 흔들리고 바람 소리가 너무 심했습니다정말 최악이었습니다공휴일이라 그런지 서비스나 협소한 시설에 비해 비싼 돈 주고 낭비를 했다는 생각에 정말 불만족스러웠습니다,1,4개월 전
yeogi_accom_018_18973,전주 브라운도트 아중지구점,깨끗하고 좋네용 잘 쉬다갑니다,5,10개월 전
yeogi_accom_018_18974,전주 브라운도트 아중지구점,친절하고 깨끗해서 좋아요,5,9개월 전
yeogi_accom_018_18975,전주 브라운도트 아중지구점,전에 갔을때는 간식을 편하게 먹을 수 있는게 좋아 재방문 했는데 조식시간에만 가능하더라구요 조금 아쉬웠네요,4,1년 전
yeogi_accom_018_18976,전주 브라운도트 아중지구점,매번 방문 시 느끼는거지만 사장님도 갱장히 친절하시고 방문 했을때 주는 그 우아함도 았구요 모텔답지않게 정말 분위기는 호텔호텔 스럽고 침대도 딱 누웠을때 너무 편안하고 허리가 안 아프고 잠도 정말 잘 잤구요 그리고 일단 냄새가 향기롭고 머물렀를때 정말 편했습니다 전주에 이런 호텔 및 모텔 많이 생겼으면 좋겠고 기본적으로 제공되는것들도 너무 잘 되있고 쾌적하고 너무너무 좋았습니다 다음에도 방문하고 싶고 나중에는 다른 방도 가보고 싶네요화장실도 너무 깨끗하고 좋았어요,5,7개월 전
yeogi_accom_018_18977,전주 브라운도트 아중지구점,자주 애용 하는 숙소 입니다,5,9개월 전
yeogi_accom_018_18978,전주 브라운도트 아중지구점,회사 출장 업무로 인해 숙박을 하게 되었습니다숙소를 선택할때 가장 큰 비중을 차지하는 부분이 주차장 시설인데 숙소 주차장이 넓고 쾌적하여가지고 차량을 주차하기가 매우 편하고 좋았습니다숙소 건물 외관도 깔끔하게 마음에 들었고 숙박 리셉션 체크인을 하는데 사장님께서 친절하게 응대해주시면서 방 키를 내어주셨습니다방 내부도 시설이 마음에 들고 비품이 잘 구비되어 있었고 침대 및 침구류도 깨끗하고 좋았습니다다음번에도 이 지역을 온다면 재방문 할 의향이 있습니다,5,10개월 전
yeogi_accom_018_18979,전주 브라운도트 아중지구점,즐거운 여행이었어요행복한 숙박 잘 하고갑니다 행복한 시간 잘 보내고 갑니다 스장님 번창하세요 숙소가 매우 쾌적하고 깔끔합니다 다음에도 재방문의사가 있습니다 다음에는친구들도데리고와서잘거에요사장님이매우친절하셔서기분이좋았습니다감사합니다24년 갑진년 청룡의기운으로하고자하시는 모든일들 다이루시고행복하고 희망찬 한해되시길 기원합니다2024년 갑진년 청룡의 해 항상 건강하시고 하시고자 하시는 일 전부 잘 되시길 기원 하겠습니다새해 복 많이 받으세요,5,9개월 전
yeogi_accom_018_18980,전주 브라운도트 아중지구점,출장 와서 하루 잘 묵었습니다 깨끗하고 좋아요 출장 와서 하루 잘 묵었습니다 깨끗하고 좋아요 출장 와서 하루 잘 묵었습니다 깨끗하고 좋아요 출장 와서 하루 잘 묵었습니다 깨끗하고 좋아요출장 와서 하루 잘 묵었습니다 깨끗하고 좋아요 출장 와서 하루 잘 묵었습니다 깨끗하고 좋아요 출장 와서 하루 잘 묵었습니다 깨끗하고 좋아요 출장 와서 하루 잘 묵었습니다 깨끗하고 좋아요,5,1년 전
yeogi_accom_018_18981,전주 브라운도트 아중지구점,처음 방문했는데 오픈한지 얼마안되서 그런지 깨끗하고 좋네요,5,1년 전
yeogi_accom_018_18982,전주 브라운도트 아중지구점,완벽한 파크뷰에 통창이라 너무 쾌적하게 이용했습니다특히 이불이 너무 뽀송하고 좋습니다에어드레서 작동 잘되고 드라이기가 다이슨과 비슷한 제품이네요조식으로 토스트 라면 가능합니다라면 끓이고 있는데 사장님리 갓김치 주셔서 감사했습니다다음에 또 이용하겠습니다,5,1년 전
yeogi_accom_018_18983,전주 브라운도트 아중지구점,시설깔끔하고마음에들엇어요완전만족스러웠어요,5,1년 전
yeogi_accom_018_18984,전주 브라운도트 아중지구점,1 위치  전북 전주시 우아동 아중지구2 주차장  매우 넓음3 로비  매우 친절4 객실 청결 상태  매우 깨끗5   넷플릭스 유튜브 디즈니6 냉장고  물 음료 커피7 방 크기  보통8 뷰  씨티뷰9 먹을거리  10분 내에 너무너무 많음10 아쉬운 점  없음11 재방문 의사  무조건 방문12 조식  삼립 빵 한강라면유료13 총평- 출장 고객입니다 카운터 직원분 너무 예쁘고 친절하셔서 감사했습니다 오랫만에 방문했는데 한강라면이 유료로 바뀌었네요 아쉽습니다,5,9개월 전
yeogi_accom_018_18985,전주 브라운도트 아중지구점,주변 모텔중에 제일깨끗하고 젛았습니다,3,8개월 전
yeogi_accom_018_18986,전주 브라운도트 아중지구점,친절하고 깨끗해서 좋았습니다,5,1년 전
yeogi_accom_018_18987,전주 브라운도트 아중지구점,레이트체크아웃을 신청할정도로 완벽한 숙소였습니다 전주가면 매일 이 곳에서 자려고 합니다 편안하게 잘 머무르고 갑니다 조용한 동네라 좋았어요 대박나세요  나중에 또 가겠습니다,5,1년 전
yeogi_accom_018_18988,전주 브라운도트 아중지구점,전주출장갈때마다 들려요,5,1년 전
yeogi_accom_018_18989,전주 브라운도트 아중지구점, 전주 브라운도트 아중지구1 위치  전북 전주시 우아동2 주차장  매우 넓고 쾌적함30대 이상3 로비  매우 친절4 객실 청결 상태  5등급 호텔 수준5   넷플릭스 유튜브6 냉장고  물 음료 커피 등 자판기 보유7 인테리어  심플8 뷰  씨티뷰 파크뷰9 먹을거리  주위에 많음10 총평- 너무 깨끗하고 너무 친절하셔서 기분이 좋아지는 숙소 였습니다  특히 카운터 보시는 분들이 너무너무 친절해서 감동적입니다 다음 출장 때 또 뵙겠습니다,5,1년 전
yeogi_accom_018_18990,전주 브라운도트 아중지구점, 전주 브라운도트 아중지구1 위치  전북 전주시 우아동2 주차장  매우 넓고 쾌적함30대 이상3 로비  매우 친절4 객실 청결 상태  5등급 호텔 수준5   넷플릭스 유튜브6 냉장고  물 음료 커피 등 자판기 보유7 인테리어  심플8 뷰  씨티뷰 파크뷰9 먹을거리  주위에 많음10 총평- 너무 깨끗하고 너무 친절하셔서 기분이 좋아지는 숙소 였습니다  특히 카운터 보시는 분들이 너무너무 친절해서 감동적입니다 다음 출장 때 또 뵙겠습니다,5,1년 전
yeogi_accom_018_18991,전주 브라운도트 아중지구점,처음으로 간 전주여행 한옥마을 근처로 알아보다가 선택한 호텔입니댜 금요일 4시 조금 넘어서 도착했더니 주차장에 차가 없더라구요ㅎㅎ그래서 여유롭게 주차하고 숙소 키 받기 전에 입구 구경했는데 라면기계도 있고 자판기도 있는데 음료가 무료예요숙소 들어갔더니 깨끗하고 공기청정기 틀려있고 스타일러 있고 일회용품스킨 로션부터 너무 충분하게 제공해주신 부분이 너무 좋았고 뷰는 공원뷰라서 좋았어요 그런데 조금 아쉬웠던 부분은 베개에서 쉰내가 좀 나고 화장실 수압도 약하고 변기물도 너무 약하더라구요이 부분만 조금 참고해주시고 개선해주시면 더 좋은 숙소가 될 것 같아요 서비스가 너무 좋은숙소예요 잘 쉬었다가 갑니댜,4,1년 전
yeogi_accom_018_18992,전주 브라운도트 아중지구점,전국 출장다니는 영업사원 입니다벌써 여기 5번 이상 이용한 것 같습니다처음과 같은 청결이 제가 계속 이용하는 이유 입니다너무 깨끗하고 만족합니다주차장 넓고 쾌적해서 주차하기 편리해요카운터 보시는 직원분 너무 친절하고 상냥하셔서 감사 했습니다삼성 에어드레서 잘되고 넷플릭스 유튜브 잘 이용했습니다드라이기 너무 좋으며 애터미니 충분히 쓸만한 좋은 제품입니다조식으로 한강라면 토스트 이용 가능합니다자판기도 있어 편리해요다음 출장시 또 이용 하겠습니다,5,1년 전
yeogi_accom_018_18993,전주 브라운도트 아중지구점,브라운도트 전주 아중지구점 좋아요지역 숙소 이용은 브라운도트만 이용하는데전주 아중지구점 너무 좋습니다 잘 이용했습니다 편하게 숙면했습니다라면 서비스도 제공하는데 없어도 괜찮은데 충분히 훌륭한 객실인데 이용객을 위해 서비스를 제공해주시는 것 같습니다없어도 충분히 훌륭하고 시설도 깨끗하고 훌륭합니다 다음에 또 오겠습니다전주는 항상 여기만 이용하는데 오늘도 편하게 쉬다가 갔습니다 감사합니다 좋은 곳 입니다다음에 또 오겠습니다 감사합니다,5,1년 전
yeogi_accom_018_18994,전주 브라운도트 아중지구점,1 오픈한지 얼마안된듯 시설이 깨끗하고 객실컨디션도 좋습니다2 침구류가좋아서 숙면했어요3 도 몰입감도촣아서 넷플릭스보기좋아요 에어드레서도 있습니다4 단점은 가 없네요 스탠다드라 그런가,5,2년 전
yeogi_accom_018_18995,전주 브라운도트 아중지구점,매번 전주올때마다 유일하게 이곳에서만 숙소를 예약하게 되는데요 처음 사용해보고 숙소내부 깔끔하고 화장실도 비데기능도 있고 침구도 청결해서 이곳만 찾게 되는것같네요 그런데  전기차전용 주차공간은 따로 마련해두셨는데 전기차 충전 시설이 설치가 안되어 있는게 좀 아쉽고 불편했습니다 지난해 방문때 직원분이 곧 설치 완료할거라고 말씀하시던데 방문때마다 설치가 더딘것같고 또 전기차 아닌 다른 일반차량이 전용 주차공간에다 주차를 하는것도 좀 불편했습니다 하루빨리 개선이 되었으면 좋겠고 충전시설 설치완료가 되었으면 합니다,4,1년 전
yeogi_accom_018_18996,전주 브라운도트 아중지구점,좋아요 굿입니다 다음에도 이용할게요,5,2년 전
yeogi_accom_018_18997,전주 브라운도트 아중지구점,전주 여행 와서 머문 숙소역시 브라운 도트는 어느 지역이든 모두 청결 상태가 100점 이예요주차장도 넓고 바로 앞에 공용 주차장도 있었어요숙소 주변 5분 거리에 음식점 들도 많아서 저녁 먹기 편했어요사장님  직원분 모두 친절 하셨고 숙소 내부도사진 처럼 정말 깔끔 했어요도 크고 탁자 의자 수납 공간도 많아서여행짐 풀고 사용하기 편했어요침대도 푹신하고 이불도 베개도 모두 깨끗했어요욕실도 머리카락 하나 없이 정말 청소가 잘 되어 있었어요담배 냄새도 안나고 전주 여행오면 또 방문 예정이예요,5,1년 전
yeogi_accom_018_18998,전주 브라운도트 아중지구점,출장길 방문해서 다시 또 재 방문합니다  수납공간이많아서 정리하니 편해요 짐을 들고 다닌편이이라 바닥에 짐을 놓디않고 수납칸에 정리해서 좋아요 침구류 깨끗하고 둘이 자기에 넉넉한 침대 덕에 편하게 쉬었네요 들어오는 입구에 음료수 있으니 더운날씨 꼬옥 챙기세요 넥플이 되니까 영화보면서 배달음식 시켜서 좋아요 화장실 넓고 깨끗하고 온수 잘나오고 물 수압 좋아요  아침 출근길에 입구에서 라면 끓여서 먹었네요 냉장고에 계란과 단무지 챙겨서 라면 먹고 토스트도 있어서 커피 한잔과 함께 아침을 먹어서 든든하게 먹고 쉬다갑니다,5,1년 전
yeogi_accom_018_18999,전주 브라운도트 아중지구점,객실 침구류들 푹신해서 좋구요 주변 조용하고 화장실 깨끗하고 비데가 있어서 사용하기 편하고  요즘같이 미세먼지 많은 날 창문 닫아놓고 있어도 공기청정기가 계속 돌고 있어서 숙박하고 있는 동안 실내가 전혀 답답하지가 않았고 외출했을때 갑자기 비가 오거나 해서 옷이 젖은 일이 있었더라도 스타일러가 있어서 젖은 옷 넣어두고 몇분 돌리면 다음날에 뽀송하게 입을 수 있어서 좋았습니다  마지막으로 넷플릭스나 디즈니같은  시청 하기도 참 편리하게 되있어서 좋았습니다,4,1년 전
yeogi_accom_018_19000,전주 브라운도트 아중지구점,전라북도 전주 출장시 항상 이용하는 호텔로 앞에 공원에 번화가도 있고 해서 좋아요 조식은 토스트와 삶은 계란 라면등을 먹을수가 있구요 주변 어느 숙소보다 깨끗하고 조용합니다 특히 혼자 출장왔을때 업무를 볼수 있게 공간이 마련되어 있구요 콘센트도 여유가 있습니다 침구류 화장실 스타일러가 있어 옷을 뽀송뽀송 말릴 수가 있습니다 주변에 저녁먹을 식당도 많이 있고 혼자 가서 먹을 식당도 많이 있어요 다음 출장시에도 재방문 의사 있으며 주차는 공간이 부족해도 자로 앞에 공영주차장이 있어 좋습니다,5,1년 전
yeogi_accom_018_19001,전주 브라운도트 아중지구점,객실에 공기청정기 스타일러가 있어서 좋았고 화장실에 비데도 있고 내부도 깔끔해서 좋았습니다 타숙박업소는 넷플릭스나 디즈니같이  시청하려면 일일이 가입하고 이것저것 누르느라 시청하기 불편했는데 리모콘 누르면 바로바로 볼 수 있게 되어 있어서 편리한 부분이  있어서 좋았구요 무엇보다 스낵바에서 라면을  뽀글이처럼 간단히 끓여 먹을 수 있도록 구비를 해놔서 좋았구요 필요할때 커피나 음료도 바로 먹을 수 있게 시설 사용도 불편하지 않았고 편리해서 좋았습니다,4,1년 전
yeogi_accom_018_19002,전주 브라운도트 아중지구점,전주 아중지구에 있는 숙소로 전주지역 출장시 매번 오는 숙소입니다 침구류도 깨끗하고 스타일러도 구비되어 있어서 너무 좋습니다  방에 공기청정기도 있고 출장시 업무를 볼수 있게 노트북자리도 있어 너무 편해요 주변에 맛집도 많이 있고 번화가 인데도 불구하고 시끄럽고 그러지 않았습니다 다음 전주 출장시에도 당연히 여기 브라운도트 호텔에 묵을 예정입니다 여기는 다른 모텔들에  비해 인기가 많아 미리 예약을 해야 하니 참고 하시기 바랍니다 그리고 1층에 간단한 스넥바가 있어 간단 조식은 가능합니다,5,1년 전
yeogi_accom_018_19003,전주 브라운도트 아중지구점,전주 우아동 모텔촌 오랜만에가봤습니다못보던 브라운도트가 있네요그래서 바로 예약했습니다우아동에서 가장 깔끔했던 마리호텔 바로옆에 오픈했네요방이 없어  트윈으로 예약했고침대를 붙여놓은 방이었는데4명이 자도 괜찮을 정도로넓고  브라운도트 특유의 두툼한 메트리스좋았습니다가 굉장히 크다보니넷플디즈니 보는데 몰입감 좋았고요디즈니 가능한 곳 많지 않은데희소성 있습니다공기청정기 비데 스타일러 1층 라운지에 커피와 끊인라면 먹을수있는건 너무 좋았습니다리모델링을 한건지 아니까리한것이브라운도트 스타일 인테리어가아닌듯한 방바닥 그리고 머리카락이 변기에 날라다니던데적당한 먼지나 머리카락은 이해하지만대놓고 변기에 있는건 청소에 신경 좀쓰셔야겠습니다내부 주차장이 협소하여  외부 공영주차장에주차할 가능성이  높은건 비오는날단점입니다이 근방에서는 가격이 12만원 정도씩높다고 생각하지만 충분히 선택할만합니다직원분 친절하셨습니다,5,1년 전
